title,link,published,summary,source
Stocks to buy or sell: Dharmesh Shah of ICICI Sec suggests buying BEL shares on 9 February 2026,https://www.livemint.com/market/stock-market-news/stocks-to-buy-or-sell-dharmesh-shah-of-icici-sec-suggests-buying-bel-shares-on-9-february-2026-11770482288139.html,2026-02-08 06:01:18 IST,"Stocks to buy or sell: Domestic equity benchmarks ended mostly stable, with the Sensex up 266.47 points and Nifty 50 up 50.90 points. This week, Nifty 50 gained 3.5%. Experts cite a U.S.-India trade agreement as a key factor driving market sentiment.",https://www.livemint.com/rss/markets
Hims &amp; Hers halts sale of Wegovy copycat pill following FDA crackdown on weight-loss drugs,https://www.livemint.com/companies/news/hims-hers-halts-sale-of-copycat-novo-nordisk-wegovy-pill-cheaper-generic-fda-crackdown-weight-loss-drugs-us-health-11770514900203.html,2026-02-08 07:36:33 IST,"Hims &amp;amp; Hers Health Inc. announced it will stop selling a copycat version of Novo Nordisk's Wegovy weight-loss pill two days after its launch, following FDA scrutiny. Here's all we know about the probe and US health department's moves.&amp;nbsp;",https://www.livemint.com/rss/companies
STT hike further stacks the odds against retail traders,https://www.livemint.com/money/personal-finance/stt-hike-retail-traders-futures-options-impact-budget-2026-11770375399591.html,2026-02-08 07:00:47 IST,"Long-term investment options, such as mutual funds, can be a better option as they are far less sensitive to transaction costs and short-term market volatility.",https://www.livemint.com/rss/money
"India’s textile sector at an inflection point as global tariff barriers ease; Arvind Fashion, Raymond Lifestyle top buys",https://economictimes.indiatimes.com/markets/stocks/news/indias-textile-sector-at-an-inflection-point-as-global-tariff-barriers-ease-arvind-fashion-raymond-lifestyle-top-buys/articleshow/128058839.cms,2026-02-08 10:11:56 IST,"The immediate reduction in US tariffs on Indian textile goods from 50% to 18% has brought long-awaited relief to an industry that had been grappling with margin compression, regulatory costs, and weakening demand—particularly in home textiles, where the market had declined by around 4% and smaller players were nearing shutdown.",https://economictimes.indiatimes.com/markets/stocks/rssfeeds/2146843.cms
From 1929 to today: what history tells us about America’s speculative culture and India’s prudence,https://economictimes.indiatimes.com/markets/stocks/news/from-1929-to-today-what-history-tells-us-about-americas-speculative-culture-and-indias-prudence/articleshow/128058696.cms,2026-02-08 10:06:31 IST,"The American financial system is structurally designed to accommodate, and often actively encourage, speculative behaviour. Indian markets, by contrast, are deliberately constructed to restrain it.",https://economictimes.indiatimes.com/markets/stocks/rssfeeds/2146843.cms
Silver ETFs crash 38% in 7 days. Time to buy for those who missed the rally?,https://economictimes.indiatimes.com/markets/stocks/news/silver-etfs-crash-38-in-7-days-time-to-buy-for-those-who-missed-the-rally/articleshow/128058296.cms,2026-02-08 09:48:31 IST,"Silver exchange-traded funds (ETFs) have plunged about 38% from their record high reached just seven trading sessions earlier on January 29, as higher margin requirements and profit-booking led to a sharp unwinding of leveraged bets.",https://economictimes.indiatimes.com/markets/stocks/rssfeeds/2146843.cms
Stocks to buy under  ₹100: Sumeet Bagadia recommends three stocks to buy on Monday - 9 February 2025,https://www.livemint.com/market/stock-market-news/stocks-to-buy-under-100-sumeet-bagadia-recommends-three-stocks-to-buy-on-monday-9-february-2025-11770524077818.html,2026-02-08 10:14:22 IST,"Sumeet Bagadia has recommended three stocks to buy on Monday, February 9. The three stock picks by Bagadia are - Irb Infrastructure Developers, Bank of Maharashtra, and Zee Entertainment Enterprises.",https://www.livemint.com/rss/markets
Buy or sell: Ganesh Dongre of Anand Rathi recommends three stocks to buy on Monday - 9 February 2026,https://www.livemint.com/market/stock-market-news/buy-or-sell-ganesh-dongre-of-anand-rathi-recommends-three-stocks-to-buy-on-monday-9-february-2026-11770521890083.html,2026-02-08 09:33:31 IST,"Ganesh Dongre of Anand Rathi recommends three stocks to buy on Monday - Trent, Oberoi Realty, and Canara Bank.",https://www.livemint.com/rss/markets
"Inflation data, India-US trade deal to Q3 results 2026: Top five triggers that may dictate Indian stock market this week",https://www.livemint.com/market/stock-market-news/inflation-data-to-q3-results-2026-top-five-triggers-that-may-dictate-indian-stock-market-this-week-11770517324199.html,2026-02-08 08:05:20 IST,"Indian stock market: On Friday, The Indian stock market closed higher, led by buying interest in select heavyweight stocks such as ITC, Kotak Mahindra Bank, and ICICI Bank.",https://www.livemint.com/rss/markets
Jeffrey Epstein advised Starlink rival OneWeb's founder Greg Wyler on securing funds — What we know,https://www.livemint.com/companies/epstein-was-adviser-behind-funding-of-starlink-rival-oneweb-11770520863436.html,2026-02-08 08:51:02 IST,"Emails released by the US Department of Justice show Jeffrey Epstein's role as an adviser in the creation of OneWeb, a satellite network competitor to Starlink. Founder Greg Wyler confirmed Epstein offered guidance but no investments were made.",https://www.livemint.com/rss/companies
Layoff news: Jack Dorsey's Block plans 10% job cuts during performance reviews amid ‘business overhaul’,https://www.livemint.com/companies/news/layoff-news-jack-dorsey-block-plans-10-pc-job-cuts-workforce-employee-performance-reviews-business-overhaul-tech-company-11770517108275.html,2026-02-08 08:37:27 IST,"Jack Dorsey's Block plans to lay off 10% of its workforce during performance reviews, with aim to “overhaul” its business, according to a Bloomberg report. Hundreds of Block workers have been informed that their jobs could be cut.&amp;nbsp;",https://www.livemint.com/rss/companies
"US trade deal framework to boost investor confidence, strength capital flows, deepen markets: BSE chief",https://economictimes.indiatimes.com/markets/stocks/news/us-trade-deal-framework-to-boost-investor-confidence-strength-capital-flows-deepen-markets-bse-chief/articleshow/128061728.cms,2026-02-08 12:07:51 IST,"The successful conclusion of an interim trade framework agreement between India and the US will boost investor confidence, strengthen the foundation for capital flows, and deepen market participation as India integrates further with the world economy--directly advancing the vision of Viksit Bharat, said Sundararaman Ramamurthy, MD and CEO, Bombay Stock Exchange (BSE).",https://economictimes.indiatimes.com/markets/stocks/rssfeeds/2146843.cms
"FPIs turn net buyers in Feb; invest Rs 8,100 cr in a week on US trade deal",https://economictimes.indiatimes.com/markets/stocks/news/fpis-turn-net-buyers-in-feb-invest-rs-8100-cr-in-a-week-on-us-trade-deal/articleshow/128061603.cms,2026-02-08 12:04:42 IST,"After three consecutive months of heavy selling, foreign portfolio investors (FPIs) turned net buyers in the first week of February, infusing more than Rs 8,100 crore in Indian equities, aided by improving risk sentiment, along with a trade deal with the US.",https://economictimes.indiatimes.com/markets/stocks/rssfeeds/2146843.cms
Mcap of 8 of top 10 valued firms surges by whopping Rs 4.55 lakh cr; Reliance biggest winner,https://economictimes.indiatimes.com/markets/stocks/news/mcap-of-8-of-top-10-valued-firms-surges-by-whopping-rs-4-55-lakh-cr-reliance-biggest-winner/articleshow/128061454.cms,2026-02-08 11:58:23 IST,"The combined market valuation of eight of the top 10 valued firms jumped by a whopping Rs 4.55 lakh crore last week, with Reliance Industries emerging as the biggest winner, in line with a remarkable rally in equities.",https://economictimes.indiatimes.com/markets/stocks/rssfeeds/2146843.cms
Dividend yield stocks as tactical &amp; trading plays in a volatile market: 4 stocks with dividend yields of up to 6.1%,https://economictimes.indiatimes.com/markets/stocks/news/dividend-yield-stocks-as-tactical-trading-plays-in-a-volatile-market-4-stocks-with-dividend-yields-of-up-to-6-1/articleshow/128061202.cms,2026-02-08 11:50:26 IST,"The Nifty and Sensex are likely to remain volatile as we enter a phase of tight liquidity ahead of the financial year ending. And given that a New World Order is in the making, this volatility may well continue. So, how to deal with volatility? One way is to use a mix of conventional and unconventional methods to ensure that if the market stays under pressure and stocks are not creating wealth, they should be at least generating income. In short, the dividend play.",https://economictimes.indiatimes.com/markets/stocks/rssfeeds/2146843.cms
10 largecap stocks with massive upside potential of up to 45%. Do you own any?,https://economictimes.indiatimes.com/markets/stocks/news/11-largecap-stocks-with-massive-upside-potential-of-up-to-45-do-you-own-any/slideshow/128060383.cms,2026-02-08 11:01:29 IST,,https://economictimes.indiatimes.com/markets/stocks/rssfeeds/2146843.cms
Bajaj Finance vs Jio Financial Services: Which stock to buy after Q3 results 2026? Explained,https://www.livemint.com/market/stock-market-news/bajaj-finance-vs-jio-financial-services-which-stock-to-buy-after-q3-results-2026-explained-11770529113994.html,2026-02-08 11:56:21 IST,"According to market experts, Seema Srivastava, Senior Research Analyst at SMC Global Securities, Bajaj Finance and JFSL present contrasting investment propositions, reflecting different stages of the financial services lifecycle and catering to distinct investor profiles.",https://www.livemint.com/rss/markets
Fractal Analytics’ 70x IPO: Why India’s top AI bet is debuting at a 26% discount,https://www.livemint.com/market/ipo/fractal-analytics-ipo-india-ai-company-valuation-risks-analysis-11770526704052.html,2026-02-08 11:43:45 IST,"India’s first pure-play AI IPO comes at a 26% discount. But behind the 70x multiple lie sticky global clients, volatile margins, and a founder-led model where one misstep could change the story. Is scarcity enough?",https://www.livemint.com/rss/markets
The personal finance system is rigged for you to fail,https://www.livemint.com/money/personal-finance/personal-finance-system-rigged-profits-investor-mistakes-how-avoid-11770460971568.html,2026-02-08 10:47:05 IST,A new book confirms what sensible investors have long suspected about finance.,https://www.livemint.com/rss/money
"Inflation data, Q3 earnings likely to drive stock markets this week",https://www.business-standard.com/markets/news/inflation-data-q3-earnings-likely-to-drive-stock-markets-this-week-126020800188_1.html,2026-02-08 12:04:38 IST,"Inflation data, trading activity of foreign investors and global trends would dictate sentiment in the stock market this week, according to analysts.
Besides, geopolitical developments and Q3 earnings will also guide market movement during the week.
""This week features several important domestic and global triggers. In India, investors will closely track retail inflation data due on February 12 and foreign exchange reserves data on February 13, for insights into price trends and external sector stability.
""The earnings calendar stays active, with key results expected from Titan Company and Mahindra & Mahindra, which may drive stock-specific action. Globally, participants will monitor a heavy US data calendar and performance of the Nasdaq Composite following its recent decline,"" Ajit Mishra, SVP, Research, Religare Broking Ltd, said.
Geopolitical developments and their impact on commodity markets will also be closely watched, Mishra added.
From the Q3 earnings space, Ashok Leyland,",https://www.business-standard.com/rss/markets-106.rss
"FPIs turn net buyers in Feb, invest ₹8,100 cr in a week on US trade deal",https://www.business-standard.com/markets/news/fpis-turn-net-buyers-in-feb-invest-8-100-cr-in-a-week-on-us-trade-deal-126020800177_1.html,2026-02-08 11:35:46 IST,"After three consecutive months of heavy selling, foreign portfolio investors (FPIs) turned net buyers in the first week of February, infusing more than Rs 8,100  crore in Indian equities, aided by improving risk sentiment, along with a trade deal with the US.
The inflows follow sustained withdrawals in recent months, with FPIs pulling out Rs 35,962 crore in January, Rs 22,611 crore in December, and Rs 3,765 crore in November, data with the depositories showed.
Overall, in 2025, FPIs pulled out a net Rs 1.66 lakh crore (USD 18.9 billion) from Indian equities, marking one of the worst periods for foreign flows. The selling was driven by volatile currency movements, global trade tensions, concerns over potential US tariffs and stretched equity valuations.
According to the data, FPIs invested Rs 8,129 crore in this month (till February 6).
Himanshu Srivastava, principal manager- research at Morningstar Investment Research India, said the recent buying reflects improving risk appetite a",https://www.business-standard.com/rss/markets-106.rss
"Mcap of 8 top valued firms surges by ₹4.55 trn, Reliance biggest winner",https://www.business-standard.com/markets/news/mcap-of-8-top-valued-firms-surges-by-4-55-trn-reliance-biggest-winner-126020800165_1.html,2026-02-08 11:15:21 IST,"The combined market valuation of eight of the top 10 valued firms jumped by a whopping Rs 4.55 lakh crore last week, with Reliance Industries emerging as the biggest winner, in line with a remarkable rally in equities.
Last week, the BSE benchmark surged by 2,857.46 points or 3.53 per cent.
From the top-10 pack, Reliance Industries, HDFC Bank, Bharti Airtel, ICICI Bank, State Bank of India, Bajaj Finance, Life Insurance Corporation of India (LIC), and Hindustan Unilever were the gainers, while Tata Consultancy Services (TCS) and Infosys saw their valuations erode.
The combined market valuation of the eight firms was Rs 4,55,336.36 crore.
Reliance Industries added Rs 1,41,887.97 crore, taking its market valuation to Rs 19,63,358.79 crore.
LIC's valuation zoomed Rs 64,926.1 crore to Rs 5,70,198.54 crore. The market valuation of Bharti Airtel surged Rs 52,516.39 crore to Rs 11,62,288.64 crore and that of ICICI Bank jumped Rs 52,476.97 crore to Rs 10,06,258.82 crore.
The market ...",https://www.business-standard.com/rss/markets-106.rss
China's Luckin Coffee opens first high-end store as it takes on Starbucks,https://www.cnbc.com/2026/02/08/chinas-luckin-coffee-opens-its-first-high-end-store.html,2026-02-08 11:56:08 IST,The Chinese coffee upstart is expanding from budget drinks into the premium market with a new flagship store.,https://www.cnbc.com/id/10000664/device/rss/rss.html
Piramal Pharma moves SC against Gujarat pollution body's plant closure order,https://www.livemint.com/companies/news/piramal-pharma-supreme-court-gujarat-pollution-board-plant-closure-order-11770532295319.html,2026-02-08 12:49:15 IST,"Piramal Pharma's plea is slated to be heard on 9 February before a bench led by Chief Justice of India Surya Kant, along with Justices Joymalya Bagchi and N.V. Anjaria.",https://www.livemint.com/rss/companies
11 penny stocks surged up to 300% in 3 months. Do you own any?,https://economictimes.indiatimes.com/markets/stocks/news/11-penny-stocks-surged-up-to-300-in-3-months-do-you-own-any/slideshow/128063419.cms,2026-02-08 12:42:01 IST,,https://economictimes.indiatimes.com/markets/stocks/rssfeeds/2146843.cms
"Q3 results 2026: BSE, Titan, M&amp;M, HUL, ONGC among 1600 companies to declare earnings next week; check full list here",https://www.livemint.com/market/stock-market-news/q3-results-2026-bse-titan-m-m-hul-ongc-among-1600-companies-to-declare-earnings-next-week-check-full-list-here-11770532331140.html,2026-02-08 13:18:31 IST,"BSE, Titan, Mahindra &amp;amp; Mahindra, Hindustan Unilever, ONGC, Coal India, Ashok Leyland, Lenskart Solutions, Torrent Pharma among marquee companies to declare Q3 results next week.",https://www.livemint.com/rss/markets
From flyers to faithfuls: Why IndiGo and Air India are racing to lock in loyal customers,https://www.livemint.com/companies/news/from-flyers-to-faithfuls-why-indigo-and-air-india-are-racing-to-lock-in-loyal-customers-11770523400209.html,2026-02-08 13:56:19 IST,"Loyalty in travel grows as a customer retention lever, prompting airlines like IndiGo and Air India to double down on their rewards programmes. IndiGo's BluChip and Air India's integration of its Maharaja programme with Air India Express is increasingly seen vital for growth.",https://www.livemint.com/rss/companies
"Cement majors post double-digit volume growth in Q3, expect price recovery ahead",https://economictimes.indiatimes.com/markets/stocks/news/cement-majors-post-double-digit-volume-growth-in-q3-expect-price-recovery-ahead/articleshow/128064555.cms,2026-02-08 13:55:31 IST,"Leading cement makers reported strong double-digit year-on-year growth in sales volumes during the December 2025 quarter, even as their realisations came under pressure.",https://economictimes.indiatimes.com/markets/stocks/rssfeeds/2146843.cms
Can Meta stock join $4 trillion club by 2032? Here's what US-based financial advisory firm says,https://www.livemint.com/market/stock-market-news/can-meta-stock-join-4-trillion-club-by-2032-heres-what-us-based-financial-advisory-firm-says-11770540239584.html,2026-02-08 14:55:10 IST,"Meta Platforms' stock can potentially join the $4 trillion club in the next six years, predicts a US-based financial advisory firm in its recent article. Here's all investors need to know about the big tech giant's stock price trend over the years on Wall Street.&amp;nbsp;",https://www.livemint.com/rss/markets
"Upcoming IPOs: Aye Finance IPO, Fractal Analysis IPO among three new issues to open next week; check full list here",https://www.livemint.com/market/ipo/upcoming-ipos-aye-finance-ipo-fractal-analysis-ipo-among-three-new-issues-to-open-next-week-check-full-list-here-11770538301839.html,2026-02-08 14:45:58 IST,"Aye Finance IPO, Fractal Analytics IPO are among the mainboard public issues to open next week. Meanwhile, in the SME segment, Marushika Technology IPO will also open for bidding.",https://www.livemint.com/rss/markets
Ahead of Market: 10 things that will decide stock market action on Monday,https://economictimes.indiatimes.com/markets/stocks/news/ahead-of-market-10-things-that-will-decide-stock-market-action-on-monday/articleshow/128067643.cms,2026-02-08 15:56:54 IST,"Indian benchmark indices closed higher on the back of buying interest in consumer and private banking stocks, though gains were limited by selling pressure across auto, IT and pharma names.",https://economictimes.indiatimes.com/markets/stocks/rssfeeds/2146843.cms
Market Trading Guide: Buy HUL and JSW Steel on Monday for up to 8% short term gains. Here’s why,https://economictimes.indiatimes.com/markets/stocks/news/market-trading-guide-buy-hul-and-jsw-steel-on-monday-for-up-to-8-short-term-gains-heres-why/slideshow/128067491.cms,2026-02-08 15:48:52 IST,,https://economictimes.indiatimes.com/markets/stocks/rssfeeds/2146843.cms
"Investors chase cheaper, smaller companies as risk aversion hits tech sector",https://www.livemint.com/market/investors-chase-cheaper-smaller-companies-as-risk-aversion-hits-tech-sector-11770548499174.html,2026-02-08 16:31:38 IST,"USA-MARKETS/INVESTORS-RISK (ANALYSIS, GRAPHIC, PIX):ANALYSIS-Investors chase cheaper, smaller companies as risk aversion hits tech sector",https://www.livemint.com/rss/markets
"Gold, silver rates today: Gold, silver price in India below up to 40% from record high. Is it right time to buy?",https://www.livemint.com/market/commodities/gold-silver-rates-today-gold-silver-price-in-india-retraces-up-to-3-from-record-high-is-it-right-time-to-buy-11770544462444.html,2026-02-08 16:18:59 IST,"MCX gold price is nearly 23% down from the record high price of  ₹1,93,096 touched on January 29. On the other hand, MCX silver price is 40% below the all-time high of  ₹4,20,048 per kg.",https://www.livemint.com/rss/markets
"Dividend Stocks: Bharat Dynamics, Hero MotoCorp, RVNL, among others to trade ex-dividend next week; Full list here",https://www.livemint.com/market/stock-market-news/dividend-stocks-bharat-dynamics-hero-motocorp-rvnl-among-others-to-trade-ex-dividend-next-week-full-list-here-11770543499748.html,2026-02-08 16:12:28 IST,"Dividend Stocks: Bharat Dynamics, Hero MotoCorp, RVNL, Container Corp., Power Grid Corp., Emami, NHPC, and Cummins India are among other firms which will trade ex-dividend in the upcoming week, starting Monday, 9 February 2026. Check full details and list here.&amp;nbsp;",https://www.livemint.com/rss/markets
"SIF rollout narrows to equity and hybrid plays, complex strategies stay off the table",https://www.livemint.com/market/specialized-investment-funds-dominance-equity-hybrid-debt-market-trends-investor-demand-11770535350841.html,2026-02-08 17:29:31 IST,"While hybrid Specialized Investment Funds are winning over high net-worth investors looking for debt-plus returns, complex sector-betting funds are being left on the drawing board due to structural risks and high costs.",https://www.livemint.com/rss/markets
The Lion’s roar: Inside the Tamil show turning startups into household names,https://www.livemint.com/companies/start-ups/startup-singam-tamil-nadu-entrepreneurs-palm-era-11770285036149.html,2026-02-08 17:00:56 IST,"From palm groves to prime time, Startup Singam is rewriting the rules of capital and visibility. Witness how founders in Tamil Nadu are leveraging this show as a marketplace to speed up their businesses.",https://www.livemint.com/rss/companies
