title,link,published,summary,source
Earning  ₹30 lakh? The wrong tax regime could cost you over  ₹1 lakh,https://www.livemint.com/money/personal-finance/earning-30-lakh-the-wrong-tax-regime-could-cost-you-over-1-lakh-11783508387694.html,2026-07-08 16:43:21 IST,A  ₹30 lakh salary puts taxpayers in a bracket where tax planning matters more than ever. Here's how much tax you pay under the old and new regimes and which one works better.&amp;nbsp;,https://www.livemint.com/rss/money
"Strait of Hormuz traffic won't return to normal until 2027 after latest setback, Kalshi traders predict",https://www.cnbc.com/2026/07/08/kalshi-traders-think-hormuz-traffic-wont-return-to-normal-this-year.html,2026-07-08 18:33:30 IST,Speculators now see just a 44% chance that traffic flows return to normal by Dec. 1.,https://www.cnbc.com/id/10000664/device/rss/rss.html
Fed meeting minutes to show 'family fight' over rates. The squabble could drag on for a while,https://www.cnbc.com/2026/07/08/with-minutes-due-feds-family-fight-over-interest-rates-could-drag-on.html,2026-07-08 18:56:14 IST,"There have been few instances over the past 35 years or so when the Fed has only made one rate move, be it up or down.",https://www.cnbc.com/id/10000664/device/rss/rss.html
"Two Trades for Today: A metals major for a gain of 8%, and a mid-cap auto ancillary stock for a 7% upmove",https://economictimes.indiatimes.com/markets/stocks/news/two-trades-for-today-a-metals-major-for-a-gain-of-8-and-a-mid-cap-auto-ancillary-stock-for-a-7-upmove/articleshow/132266593.cms,2026-07-08 20:26:19 IST,Our technical analysts identify select stocks every trading day that may gain momentum even in volatile markets. Here are the technical calls for today.,https://economictimes.indiatimes.com/markets/stocks/rssfeeds/2146843.cms
Market Trading Guide: Ather Energy among 2 stock recommendations for Thursday,https://economictimes.indiatimes.com/markets/stocks/news/market-trading-guide-ather-energy-among-2-stock-recommendations-for-thursday/articleshow/132266594.cms,2026-07-08 20:23:59 IST,"Indian markets declined sharply as rising crude prices, higher bond yields and renewed West Asia tensions hurt sentiment. Technical analysts recommended Alkyl Amines Chemicals and Ather Energy, citing bullish trends, strong momentum and favourable technical indicators.",https://economictimes.indiatimes.com/markets/stocks/rssfeeds/2146843.cms
"Gold, silver prices today: Comex gold slips $107, silver drops $3 as Middle East tensions escalate; Fed minutes in focus",https://www.livemint.com/market/commodities/gold-silver-prices-today-comex-gold-slips-107-silver-drops-3-as-middle-east-tensions-escalate-fed-minutes-in-focus-11783521110993.html,2026-07-08 20:56:27 IST,"Precious metals saw further losses on 8 July, influenced by renewed Middle East tensions and a strengthening US dollar. Gold dropped to $4,050 and silver fell below $60, as escalating conflicts following US strikes on Iran raised concerns over inflation and interest rates.",https://www.livemint.com/rss/markets
"Wall Street slumps after Trump says Iran deal is ‘over’, Broadcom climbs 3%, United Airlines dips 3.2%",https://www.livemint.com/market/stock-market-news/wall-street-slumps-after-trump-says-iran-deal-is-over-11783518891496.html,2026-07-08 19:31:57 IST,"At 10:10 a.m. ET, the Dow Jones Industrial Average fell 0.97%, the S&amp;amp;P 500 lost 0.46%, the Nasdaq Composite lost 0.31%",https://www.livemint.com/rss/markets
Markets tumble after Donald Trump ends ceasefire,https://www.livemint.com/market/stock-market-news/india-stock-market-falls-trump-ends-us-iran-ceasefire-crude-oil-fii-11783514525588.html,2026-07-08 19:26:39 IST,"The Nifty 50 fell 2.1% to 23,882, while the Sensex fell 2.1% to 76,503—their lowest levels since 30 March.",https://www.livemint.com/rss/markets
Sebi reintroduces open-market share buybacks: How your gains will be taxed and what to consider before participating,https://www.livemint.com/money/personal-finance/sebi-reintroduces-open-market-share-buybacks-how-your-gains-will-be-taxed-and-what-to-consider-before-participating-11783521247009.html,2026-07-08 21:20:59 IST,"Sebi has notified rules for open-market share buybacks effective August 1, 2026, allowing companies to repurchase shares through stock exchanges. Here's how your capital gains will be taxed and what to consider before selling your shares via the open market.",https://www.livemint.com/rss/money
How many mutual funds should you own? Experts explain the right portfolio mix,https://www.livemint.com/money/personal-finance/how-many-mutual-funds-should-you-own-experts-explain-the-right-portfolio-mix-11783521482339.html,2026-07-08 21:18:28 IST,"Managing too many mutual funds complicates portfolio tracking without enhancing diversification. Experts suggest three to six funds can suffice, emphasising a mix of large, mid, and small-cap funds along with debt for balance.&amp;nbsp;",https://www.livemint.com/rss/money
"As the Magnificent 7 lose swagger, which stock should you buy now? Experts reveal the right strategy",https://www.livemint.com/money/personal-finance/as-the-magnificent-7-lose-swagger-which-stock-should-you-buy-now-experts-reveal-the-right-strategy-11783517233038.html,2026-07-08 20:00:15 IST,"The Magnificent Seven tech giants are losing investor interest as their performance lags behind the Nasdaq 100 and S&amp;amp;P 500. Emerging chipmakers like Micron Technology are gaining traction, while stocks like Alphabet show potential amidst differing fortunes among the group.",https://www.livemint.com/rss/money
Quant Mid Cap Fund beats benchmark in short term after years of lag: Expert explains what investors should do,https://www.livemint.com/money/personal-finance/quant-mid-cap-fund-beats-benchmark-in-short-term-after-years-of-lag-expert-explains-what-investors-should-do-11783513559489.html,2026-07-08 19:49:01 IST,"Quant Mid Cap Fund has outperformed its benchmark index over the last 3 and 6 months, but continues to lag over the 1-, 3-, and 5-year periods. The expert attributed the rebound to portfolio repositioning and advised investors to focus on long-term consistency.&amp;nbsp;",https://www.livemint.com/rss/money
ITR filing 2026: Preventive health checkups can help you save tax — here's how,https://www.livemint.com/money/personal-finance/itr-filing-2026-preventive-health-checkups-can-help-you-save-tax-heres-how-11783516458727.html,2026-07-08 19:25:31 IST,"The ITR filing deadline is approaching, prompting taxpayers to prepare documents and explore deductions. Section 80D allows deductions for preventive health checkups, capped at  ₹5,000, applicable only in the old tax regime.",https://www.livemint.com/rss/money
Ahead of Market: 10 things that will decide stock market action on Thursday,https://economictimes.indiatimes.com/markets/stocks/news/ahead-of-market-10-things-that-will-decide-stock-market-action-on-thursday/articleshow/132267520.cms,2026-07-08 21:27:57 IST,"Indian equities posted their steepest single-day decline since March as rising crude prices, renewed Middle East tensions and weak global cues triggered broad-based selling. Analysts said geopolitical developments, earnings guidance and central bank decisions will shape the market’s near-term direction.",https://economictimes.indiatimes.com/markets/stocks/rssfeeds/2146843.cms
Levi Strauss shares slip ahead of Q2 earnings report as investors await impact of FIFA World Cup campaign,https://www.livemint.com/market/stock-market-news/levi-strauss-shares-slip-ahead-of-q2-earnings-report-as-investors-await-impact-of-fifa-world-cup-campaign-11783531415964.html,2026-07-08 23:06:55 IST,"Analysts expect Levi Strauss to report earnings of 24 cents per share on revenue of $1.52 billion, representing year-over-year growth of 9% and 8.6%, respectively",https://www.livemint.com/rss/markets
Laser Power &amp; Infra raises  ₹222 crore from anchor investors ahead of IPO,https://www.livemint.com/market/stock-market-news/laser-power-infra-raises-rs-222-crore-from-anchor-investors-ahead-of-ipo-11783529504396.html,2026-07-08 22:32:32 IST,"Laser Power &amp;amp; Infra Limited has raised  ₹222 crore from anchor investors at  ₹214 per share, with a planned IPO of  ₹742 crore opening on July 9, 2026. It reserves allocations for QIBs, NIIs, and retail investors, with listings expected on BSE and NSE by July 16.",https://www.livemint.com/rss/markets
SBI Funds Management files RHP for IPO; issue opens on July 14,https://www.livemint.com/market/stock-market-news/sbi-funds-management-files-rhp-for-ipo-issue-opens-on-july-14-11783526824951.html,2026-07-08 21:45:04 IST,"State Bank of India announced that SBI Funds Management has filed the red herring prospectus for its IPO. The offering is an sale of up to 203.71 million shares, with SBI divesting 128.33 million. The IPO opens for subscription on July 14, 2026.",https://www.livemint.com/rss/markets
UPI and personal loans are replacing credit cards in Indians' wallets: CIBIL,https://www.livemint.com/money/personal-finance/upi-and-personal-loans-are-replacing-credit-cards-in-indians-wallets-cibil-11783529539796.html,2026-07-08 22:53:03 IST,"Credit card penetration in India remains low, with only 5.2 crore holders, representing 25% of the credit-active population. While usage is rising, first-time borrowers account for just 8% of new credit card issuances",https://www.livemint.com/rss/money
PPF account turns dormant if you invest less than  ₹500 a year: What you lose and how to revive it,https://www.livemint.com/money/personal-finance/ppf-account-turns-dormant-if-you-invest-less-than-500-a-year-what-you-lose-and-how-to-revive-it-11783528876965.html,2026-07-08 22:51:12 IST,"PPF accounts become inactive if the annual  ₹500 minimum deposit is missed, restricting benefits. Activation requires a request and payment of a penalty. Full details here.",https://www.livemint.com/rss/money
