title,link,published,summary,source
"Bitcoin prices today: Crypto token drops over 5% to $84,400, market capitalisation hits $1.68 trillion",https://www.livemint.com/market/cryptocurrency/bitcoin-prices-today-crypto-token-drops-over-5-to-84-400-market-capitalisation-hits-1-68-trillion-11769702801298.html,2026-01-29 21:54:48 IST,"Bitcoin, the largest cryptocurrency, hit a new low of $84,410 on January 29, marking a 5.43% drop amid a market sell-off. Its market capitalisation is $1.68 trillion, with a trading volume of $50.59 billion in the past 24 hours.",https://www.livemint.com/rss/markets
Microsoft stock drops 12% after Q2 results as cloud revenues fail to exceed investor expectations,https://www.livemint.com/market/stock-market-news/microsoft-stock-drops-12-after-q2-results-as-cloud-revenues-fail-to-exceed-investor-expectations-11769700588851.html,2026-01-29 21:13:31 IST,Microsoft stock drops 12% after Q2 results as cloud revenues fail to exceed investor expectations,https://www.livemint.com/rss/markets
How Tesla’s $2 billion xAI investment may smooth Elon Musk's path to trillion-dollar pay package — explained,https://www.livemint.com/companies/news/how-tesla-s-2-billion-xai-investment-may-smooth-elon-musks-path-to-trillion-dollar-pay-package-explained-11769685557548.html,2026-01-29 21:10:22 IST,Tesla's $2 billion investment in Elon Musk's xAI aims to bolster its shift towards AI. Musk's $1 trillion pay package is tied to performance milestones of the EV maker.&amp;nbsp;,https://www.livemint.com/rss/companies
Bulk deal: Goldman Sachs trims Manappuram Finance stake; CLSA offloads Sunteck Realty shares,https://economictimes.indiatimes.com/markets/stocks/news/bulk-deal-goldman-sachs-trims-manappuram-finance-stake-clsa-offloads-sunteck-realty-shares/articleshow/127781178.cms,2026-01-29 22:12:37 IST,"Goldman Sachs offloaded over 65.27 lakh shares in Manappuram Finance for approximately Rs 190 crore, with Morgan Stanley as the buyer. In a separate transaction, CLSA sold 71.61 lakh shares of Sunteck Realty for Rs 269 crore, with Goldman Sachs and Morgan Stanley acquiring them.",https://economictimes.indiatimes.com/markets/stocks/rssfeeds/2146843.cms
"Five baby Vedantas will step into stock exchanges in May, three to bear most debt load",https://www.livemint.com/companies/five-baby-vedantas-will-step-into-stock-exchanges-in-may-three-to-bear-most-debt-load-demerger-11769696763598.html,2026-01-29 22:41:13 IST,"Vedanta is yet to finalize which resultant company will bear how much debt; however, each resultant company will get a share of Vedanta’s  ₹60,624-crore net debt based on the value of their assets and their cash generation abilities, the management said.",https://www.livemint.com/rss/companies
Coforge sweetens India’s largest IT deal after shareholder pushback,https://www.livemint.com/companies/news/coforge-sweetens-india-s-largest-it-deal-after-shareholder-pushback-11769683255363.html,2026-01-29 21:56:03 IST,"Despite support from global giants like Norges Bank, domestic institutions blocked the move, forcing Coforge to remove Advent’s influence over audit and remuneration committees to ensure the Encora acquisition proceeds.",https://www.livemint.com/rss/companies
"Gold price crashes 6%, silver 8% as sudden selloff grips precious metals: What's behind the fall? Explained",https://www.livemint.com/market/commodities/gold-price-crashes-6-silver-rate-today-8-as-sudden-selloff-grips-precious-metals-whats-behind-the-fall-explained-11769711963519.html,2026-01-30 00:12:08 IST,Both gold and silver retreated sharply from their all-time high levels as the US dollar strengthened and amid a decline in the US stock market.,https://www.livemint.com/rss/markets
Gold falls as investors take profits after record high,https://www.livemint.com/market/gold-falls-as-investors-take-profits-after-record-high-11769711777015.html,2026-01-30 00:06:16 IST,GLOBAL-PRECIOUS:Gold falls as investors take profits after record high,https://www.livemint.com/rss/markets
Apple Buys Israeli AI Startup That Interprets Facial Movements,https://www.livemint.com/companies/apple-buys-israeli-ai-startup-that-interprets-facial-movements-11769712521905.html,2026-01-30 00:18:41 IST,"Apple Inc. has acquired Israel-based artificial intelligence startup Q.ai, which develops technology for reading facial movements and understanding silent communication.",https://www.livemint.com/rss/companies
Dollar under pressure as investors remain jittery over U.S. policy,https://www.livemint.com/market/dollar-under-pressure-as-investors-remain-jittery-over-u-s-policy-11769715810764.html,2026-01-30 01:13:30 IST,GLOBAL-FOREX/ (UPDATE 5):FOREX-Dollar under pressure as investors remain jittery over U.S. policy,https://www.livemint.com/rss/markets
First Brands Founder Charged With Fraud That Wiped Out Billions,https://www.livemint.com/companies/first-brands-founder-charged-with-fraud-that-wiped-out-billions-11769715615682.html,2026-01-30 01:10:15 IST,"First Brands Group founder Patrick James and his brother Edward, a former executive at the company, were indicted in New York following the collapse of the bankrupt auto-parts maker last year.",https://www.livemint.com/rss/companies
Blue Owl Investors Pull 15% of Assets From Tech-Focused Fund,https://www.livemint.com/companies/blue-owl-investors-pull-15-of-assets-from-tech-focused-fund-11769715553605.html,2026-01-30 01:09:13 IST,"Investors pulled around 15.4% of net assets from one of Blue Owl Capital Inc.’s tech-focused funds, following the vehicle’s decision to dramatically increase the amount investors could withdraw earlier this month.",https://www.livemint.com/rss/companies
"SpaceX, xAI in talks over merger ahead of potential IPO: Report",https://www.livemint.com/companies/news/spacex-xai-in-talks-over-merger-ahead-of-potential-ipo-report-11769718842479.html,2026-01-30 02:25:42 IST,"The proposed merger could boost Musk’s push into space-based AI and strengthen SpaceX’s defence credentials, analysts say. SpaceX is valued near $800 billion, while xAI was last valued at $230 billion, with an IPO potentially pushing SpaceX past $1 trillion.",https://www.livemint.com/rss/companies
