title,link,published,summary,source
"Adani Enterprises, other Adani Group stocks jump up to 3%. Here’s why",https://economictimes.indiatimes.com/markets/stocks/news/adani-group-stocks-in-focus-as-us-authorities-weigh-dropping-fraud-charges-against-gautam-adani/articleshow/131106898.cms,2026-05-15 08:29:00 IST,Adani Group stocks saw a significant jump on Friday. Reports suggest US authorities may resolve fraud allegations against Gautam Adani.  A settlement with the SEC for $18 million is also proposed.  This development could lead to the dropping of criminal charges.  The Adani Group is reportedly considering substantial US investments.  This offers a major relief for the conglomerate.,https://economictimes.indiatimes.com/markets/stocks/rssfeeds/2146843.cms
"Multibagger PSU stock HUDCO share price falls over 8% despite strong Q4 results, dividend announcement",https://www.livemint.com/market/stock-market-news/multibagger-psu-stock-hudco-share-price-falls-over-8-despite-strong-q4-results-dividend-announcement-11778825823290.html,2026-05-15 11:55:31 IST,"HUDCO shares fell over 8% despite strong Q4FY26 results, reporting a net profit of  ₹1,981 crore, more than double from last year. The Board approved a dividend of  ₹1.5 per share, with consolidated revenue growing 25.3% to  ₹3,563 crore.",https://www.livemint.com/rss/markets
Simca Advertising share price hits in 5% upper circuit after a weak debut,https://www.livemint.com/market/stock-market-news/simca-advertising-share-price-hits-in-5-upper-circuit-after-a-weak-debut-11778823140358.html,2026-05-15 11:50:21 IST,"Simca Advertising debuted poorly on NSE SME, opening at  ₹156, 14.75% below the issue price. The stock reached an intraday low of  ₹148.20 but was locked at a 5% upper circuit of  ₹163.40 after the initial drop.",https://www.livemint.com/rss/markets
"SAIL Q4 Results 2026 LIVE: Maharatna PSU could post double-digit rise in profit, revenue; all eyes on dividend",https://www.livemint.com/market/stock-market-news/sail-q4-results-2026-live-sail-share-price-sail-q4-dividend-earnings-profit-15-may-2026-11778824399309.html,2026-05-15 11:36:49 IST,SAIL Q4 Results 2026 LIVE: SAIL share price traded marginally in the red ahead of the March quarter results. The PSU company will likely report the earnings later in the day.,https://www.livemint.com/rss/markets
"Tata Steel Q4 Results 2026 LIVE: Expect strong earnings with net profit to double; Europe business, dividend in focus",https://www.livemint.com/market/stock-market-news/tata-steel-q4-results-2026-live-tata-steel-q4-earnings-tata-steel-share-price-tata-steel-dividend-europe-15-may-2026-11778823910031.html,2026-05-15 11:19:12 IST,"Tata Steel Q4 Results 2026 LIVE: The Tata Group firm is expected to report strong earnings growth for the fourth quarter of FY26, led by rise in steel prices and sales volumes, while Europe business EBITDA loss is estimated to narrow.",https://www.livemint.com/rss/markets
What happens if Indian rupee hits 100 against US dollar? Here’s how a weaker currency could reshape Indian stock markets,https://www.livemint.com/market/stock-market-news/what-happens-if-indian-rupee-hits-100-against-us-dollar-here-s-how-a-weaker-currency-could-reshape-indian-stock-markets-11778823266325.html,2026-05-15 11:17:12 IST,"Amid escalating geopolitical tensions and rising crude oil prices, the Indian rupee has dropped significantly. Analysts predict that if the rupee weakens further, it could drive inflation and impact sectors reliant on imports while benefiting export-focused industries.",https://www.livemint.com/rss/markets
Small-cap stock Fujiyama Power hits 5% upper circuit after Q4 results 2026; details here,https://www.livemint.com/market/stock-market-news/smallcap-stock-fujiyama-power-share-price-hits-5-upper-circuit-after-q4-results-2026-details-here-11778822277380.html,2026-05-15 11:13:01 IST,"Fujiyama's Q4FY26 PAT jumped 107.5% YoY to  ₹106.3 crore, while PAT margin rose by 110 basis points to 11.8% from 10.7% YoY. Fujiyama Power shares have risen 26% year to date, compared with an 11% decline in the benchmark Sensex.",https://www.livemint.com/rss/markets
Why JLR remains elephant in the room for Tata Motors despite domestic momentum,https://www.livemint.com/market/mark-to-market/tata-motors-india-pv-business-jlr-impact-fy26-11778816758068.html,2026-05-15 10:32:08 IST,"Tata Motors’ India passenger vehicle business delivered robust FY26 growth led by SUVs and EVs, but mounting pressures at Jaguar Land Rover continue to overshadow the recovery story.",https://www.livemint.com/rss/markets
Emerging Currencies Dip as US Retail Data Boosts Dollar,https://www.livemint.com/market/emerging-currencies-dip-as-us-retail-data-boosts-dollar-11778821285179.html,2026-05-15 10:31:24 IST,Most emerging-market currencies fell Thursday on the back of a stronger dollar after US retail sales signaled consumer resilience in the world’s largest economy despite sharply higher gasoline prices.,https://www.livemint.com/rss/markets
"Rajesh Palviya of Axis Sec suggests Ajanta Pharma, Tata Communications, NMDC shares to buy today - 15 May",https://www.livemint.com/market/stock-market-news/rajesh-palviya-of-axis-sec-suggests-ajanta-pharma-tata-communications-nmdc-shares-to-buy-today-15-may-11778819072454.html,2026-05-15 10:28:28 IST,"The stock market saw gains on May 15, with Sensex rising 451.46 points and Nifty 50 up 143.25 points, led by IT stocks. Oil companies faced declines after fuel price increases, while the market remains volatile within a range of 24,500 to 23,200.",https://www.livemint.com/rss/markets
RFBL Flexi Pack IPO allotment date today: Here are steps to check status online; GMP signals 8% listing gains,https://www.livemint.com/market/ipo/rfbl-flexi-pack-ipo-allotment-date-today-here-are-steps-to-check-status-online-gmp-signals-8-listing-gains-11778819822985.html,2026-05-15 10:11:00 IST,"RFBL Flexi Pack IPO price band was set as  ₹47 to  ₹50 per share, and investors could apply for the offer in lots of 3000 shares. Shares of RFBL Flexi Pack will list on NSE SME next week on 19 May.",https://www.livemint.com/rss/markets
Kaynes Technology share price nosedives 24% in two days to hit 52-week low after multiple downgrades. Check details,https://www.livemint.com/market/stock-market-news/kaynes-technology-share-price-nosedives-24-in-two-days-to-hit-52-week-low-after-multiple-downgrades-check-details-11778819367091.html,2026-05-15 10:08:40 IST,"Kaynes Technology faced downgrades from multiple brokerages after disappointing Q4 earnings, despite a 33% revenue increase in FY26. The stock saw a sharp decline, hitting a 52-week low, raising concerns over margins and working capital.",https://www.livemint.com/rss/markets
Adani Ports to Adani Power: Adani Group stocks advance after reports of US to settle fraud lawsuit against Gautam Adani,https://www.livemint.com/market/stock-market-news/adani-ports-to-adani-power-adani-group-stocks-advance-after-reports-of-us-to-settle-fraud-lawsuit-against-gautam-adani-11778817387514.html,2026-05-15 09:41:52 IST,"On May 15, shares of Adani companies saw gains amid news that US authorities might dismiss fraud charges against Gautam Adani. Adani plans to invest $10 billion in the US, generating around 15,000 jobs, while settling a civil fraud lawsuit.",https://www.livemint.com/rss/markets
"Tata Motors PV share price jumps over 8% after Q4 results. Should you buy, sell or hold the auto stock?",https://www.livemint.com/market/stock-market-news/tata-motors-pv-share-price-jumps-over-8-after-q4-results-should-you-buy-sell-or-hold-the-auto-stock-11778817595051.html,2026-05-15 09:31:18 IST,"Tata Motors Passenger Vehicles reported a consolidated net profit of  ₹5,783 crore for the fourth quarter of FY26, a decline of 31.7% from  ₹8,470 crore in the year-ago period.",https://www.livemint.com/rss/markets
"HPCL, BPCL to IOCL: OMC stocks decline up to 2.6% even after petrol, diesel prices raised by  ₹3/litre; here's why",https://www.livemint.com/market/stock-market-news/hpcl-bpcl-to-iocl-omc-stocks-decline-up-to-2-6-even-after-petrol-diesel-prices-raised-by-3-litre-heres-why-11778814820367.html,2026-05-15 09:24:36 IST,"Shares of state-run oil marketing companies fell despite a petrol and diesel price hike, as investor sentiment remained weak due to lower-than-expected increases and rising global crude prices. Petrol in Delhi is now  ₹97.77 per litre, while diesel is  ₹90.67 per litre.",https://www.livemint.com/rss/markets
Rupee opens 11 paise lower at 95.87 against the US dollar,https://www.livemint.com/market/stock-market-news/rupee-opens-11-paise-lower-at-95-87-against-the-us-dollar-11778816011996.html,2026-05-15 09:05:22 IST,"The Indian rupee opened weaker at 95.87 against the US dollar, continuing a downward trend due to rising US Treasury yields and high crude oil prices. The rupee has fallen to record lows for three consecutive sessions, influenced by foreign equity withdrawals and high demand for dollars.",https://www.livemint.com/rss/markets
"Gold price today: Rate drops on MCX amid a stronger US dollar, higher oil prices; experts highlight key levels to watch",https://www.livemint.com/market/commodities/gold-price-today-rate-drops-on-mcx-amid-a-stronger-us-dollar-higher-oil-prices-experts-highlight-key-levels-to-watch-11778815656677.html,2026-05-15 09:05:02 IST,"Gold price today: Gold rates dropped on the MCX on Friday morning amid a stronger US dollar, driven by elevated crude oil prices. International gold prices declined to an over one-week low, looking set for a weekly decline.",https://www.livemint.com/rss/markets
"Silver rate today: MCX silver price falls 4% to  ₹2.79 lk/kg on firm dollar, crude price rise; Trump-Xi meeting awaited",https://www.livemint.com/market/commodities/silver-rate-today-mcx-silver-price-falls-4-to-rs-2-79-lk-kg-on-firm-dollar-crude-price-rise-trump-xi-meeting-awaited-11778812554032.html,2026-05-15 09:04:47 IST,"Silver rate today: Selling intensified across bullion counters, with MCX silver prices plunging  ₹11,644, or 4%, to  ₹2,79,458 per kg. Gold prices also fell, as MCX gold fell  ₹1,623, or 1%, to  ₹1,60,355 per 10 grams.",https://www.livemint.com/rss/markets
Copper Extends Retreat on Faster Inflation and Stronger Dollar,https://www.livemint.com/market/copper-extends-retreat-on-faster-inflation-and-stronger-dollar-11778815723817.html,2026-05-15 08:58:43 IST,Copper extended its retreat from a record-high close as accelerating US inflation reduced the chance of rate cuts and a stronger dollar make the metal more expensive for many buyers.,https://www.livemint.com/rss/markets
Stocks to buy for short term: From PFC to Tata Steel - Ajit Mishra of Religare Broking suggests 3 stock picks,https://www.livemint.com/market/stock-market-news/stocks-to-buy-for-short-term-pfc-tata-steel-divis-labs-ajit-mishra-of-religare-broking-suggests-3-stock-picks-11778812924214.html,2026-05-15 08:40:05 IST,"Stocks to buy for the short term: Ajit Mishra of Religare Broking is positive on three stocks, including PFC and Tata Steel, for the next 1-2 weeks.&amp;nbsp;",https://www.livemint.com/rss/markets
"Stocks to Watch: Tata Motors PV, Adani Enterprises, JSW Steel, Bharti Airtel, among other stock in focus today - 15 May",https://www.livemint.com/market/stock-market-news/stocks-to-watch-tata-motors-pv-adani-enterprises-jsw-steel-bharti-airtel-among-other-stock-in-focus-today-15-may-11778812563542.html,2026-05-15 08:34:23 IST,"Indian benchmark indices rose for the second consecutive session on May 14, with the Sensex gaining nearly 790 points. Bharti Airtel was the top gainer, while wholesale price inflation hit a 42-month high of 8.3%. Key companies are set to release quarterly results soon.",https://www.livemint.com/rss/markets
Shares to buy or sell: Chandan Taparia of Motilal Oswal recommends three stocks to buy today - 15 May 2026,https://www.livemint.com/market/stock-market-news/shares-to-buy-or-sell-chandan-taparia-of-motilal-oswal-recommends-three-stocks-to-buy-today-15-may-2026-11778811116206.html,2026-05-15 08:17:14 IST,"Shares to buy or sell: Chandan Taparia has recommended three stocks to buy today, 15 May 2026 - National Aluminium Company, Apollo Hospitals Enterprise and NTPC shares.",https://www.livemint.com/rss/markets
"Billionaire Adani to settle with SEC, nears end of US legal woes",https://www.livemint.com/companies/gautam-adani-sagar-adani-sec-settlement-us-fraud-charges-adani-green-energy-bribery-allegations-11778816850171.html,2026-05-15 09:21:37 IST,"Adani and his nephew Sagar agreed to pay a total of $18 million to settle Securities and Exchange Commission allegations they made false and misleading representations about Adani Green Energy Ltd, according to a proposed agreement filed in federal court Thursday.",https://www.livemint.com/rss/companies
Why mid-sized IT firms are more confident about AI than Infosys and HCLTech,https://www.livemint.com/companies/midcap-it-ai-disruption-indian-it-sector-coforge-persistent-systems-infosys-hcltech-mphasis-tech-mahindra-11778775458821.html,2026-05-15 09:07:16 IST,"Smaller IT services firms say nimbleness and domain depth shield them from AI disruption, even as India’s largest outsourcers warn of deflationary impact and rising competitive intensity.",https://www.livemint.com/rss/companies
"How fuel price hike could impact inflation and your daily expenses? Expert says, ‘Food, transport costs to rise’",https://www.livemint.com/money/personal-finance/how-fuel-prices-hike-could-impact-inflation-and-and-your-daily-expenses-expert-says-food-transport-costs-to-rise-11778821134485.html,2026-05-15 11:50:51 IST,"Petrol and diesel prices in India increased by  ₹3 per litre, with CNG rising by  ₹2 per kg. This hike aims to offset losses from rising crude oil prices, but concerns about its impact on retail inflation persist, especially in sectors like agriculture and transportation.",https://www.livemint.com/rss/money
Income Tax return filing for AY 2026-27 begins: Check who can file ITR-1 and ITR-4,https://www.livemint.com/money/personal-finance/income-tax-return-filing-for-ay-2026-27-begins-check-who-can-file-itr-1-and-itr4-11778822114268.html,2026-05-15 11:33:53 IST,ITR filing for AY 2026-27 begins as the Income Tax Department enables Excel utilities and online filing for ITR-1 and ITR-4 on the e-Filing portal for eligible taxpayers in the country.,https://www.livemint.com/rss/money
"Gold and silver price today, 15 May: Check retail rates of 24K, 22K gold and 999 silver in Delhi, Mumbai, other cities",https://www.livemint.com/money/personal-finance/gold-and-silver-price-today-15-may-check-retail-rates-of-24k-22k-gold-and-999-silver-in-delhi-mumbai-other-cities-11778814756988.html,2026-05-15 10:29:27 IST,"Gold price today: Gold rates dropped on the MCX on Friday morning amid a stronger US dollar, driven by elevated crude oil prices. International gold prices declined to an over one-week low, looking set for a weekly decline.",https://www.livemint.com/rss/money
"Petrol, diesel, CNG, LPG get costlier: How much more Indians are paying amid West Asia conflict – City-wise rates here",https://www.livemint.com/money/personal-finance/petrol-diesel-cng-lpg-get-costlier-how-much-more-indians-are-paying-amid-west-asia-conflict-city-wise-rates-here-11778816699553.html,2026-05-15 10:06:42 IST,"In May, Indian consumers experienced a significant rise in fuel prices, with petrol and diesel increasing by  ₹3 per litre, the first hike in four years. CNG prices also rose by  ₹2 per kg, reflecting the impact of escalating global crude prices due to the West Asia conflict.",https://www.livemint.com/rss/money
"Petrol, Diesel Price Hike News LIVE: Fuel prices hiked by  ₹3/litre after elections as crude costs bite",https://www.livemint.com/money/petrol-diesel-price-hike-delhi-bangalore-mumbai-kolkata-live-updates-social-media-political-reaction-latest-news-15-may-11778814839481.html,2026-05-15 09:21:56 IST,"Petrol, Diesel Price hike news LIVE: Petrol and diesel prices across India were raised by  ₹3 per litre on May 15, pushing fuel costs higher in Delhi, Mumbai, Kolkata, Chennai and other cities. The hike comes amid surging global crude oil prices and rising geopolitical tensions in West Asia.",https://www.livemint.com/rss/money
"Focus on the horizon: Bajaj Finserv's Nimesh Chandan sees Nifty at 27,000 despite volatility",https://www.livemint.com/money/personal-finance/bajaj-finserv-nimesh-chandan-sees-nifty-at-27000-despite-volatility-11778691579602.html,2026-05-15 09:00:51 IST,"As markets swing on global headlines, Bajaj Finserv AMC CIO Nimesh Chandan says investors should focus on long-term trends, not noise — and sees the Nifty heading to 27,000.",https://www.livemint.com/rss/money
Explained | What caused the hike in petrol and diesel prices and why rates differ across Indian cities,https://www.livemint.com/money/explained-why-petrol-diesel-prices-were-hiked-after-4-years-of-stability-how-much-will-you-pay-now-11778813007777.html,2026-05-15 08:45:18 IST,"Petrol and diesel prices increased by  ₹3 per litre after four years without revisions. Petrol now costs  ₹97.77 in Delhi, while diesel is  ₹90.67. Prices vary by city, with significant increases attributed to rising global energy costs amid geopolitical tensions.",https://www.livemint.com/rss/money
Trump wraps up two-day China trip; invites Xi for a September visit,https://www.cnbc.com/2026/05/15/trump-wraps-up-two-day-china-trip-invites-xi-for-a-september-visit.html,2026-05-15 10:50:19 IST,,https://www.cnbc.com/id/10000664/device/rss/rss.html
