title,link,published,summary,source
MTAR Technologies and three other stocks hit 5-year swing high breakout,https://economictimes.indiatimes.com/markets/stocks/news/mtar-technologies-and-three-other-stocks-hit-5-year-swing-high-breakout/slideshow/130744978.cms,2026-05-04 08:51:33 IST,"Four NSE-listed companies with market capitalisation above Rs 10,000 crore touched their 5-year swing highs on April 30, signalling bullish momentum. Stocks including MTAR Technologies and Hitachi Energy India are approaching key resistance levels, with technical indicators suggesting potential upside, though not all moves qualify as confirmed breakouts yet.",https://economictimes.indiatimes.com/markets/stocks/rssfeeds/2146843.cms
"CDSL shares dip over 3% after Q4 net profit tanks 20% to Rs 80 crore, margins under pressure",https://economictimes.indiatimes.com/markets/stocks/news/cdsl-shares-in-focus-after-q4-net-profit-tanks-20-to-rs-80-crore-margins-under-pressure/articleshow/130744338.cms,2026-05-04 08:31:56 IST,"CDSL share price dropped over 3% after it reported mixed Q4 FY26 results with profit declining despite steady revenue growth and improved operating performance. Margins narrowed while total income saw modest gains. The company crossed a milestone in demat accounts, reflecting rising investor participation, and maintained a stable outlook amid volatility, with continued focus on technology and infrastructure investment.",https://economictimes.indiatimes.com/markets/stocks/rssfeeds/2146843.cms
Cemindia Projects among 5 stocks that closed above VWAP,https://economictimes.indiatimes.com/markets/stocks/news/cemindia-projects-among-5-stocks-that-closed-above-vwap/slideshow/130744263.cms,2026-05-04 08:24:23 IST,"Five stocks from the Nifty500 universe closed over 2% above their VWAP on April 30, indicating strong intraday buying and improving sentiment. A close above VWAP signals price strength during the session and is considered a short-term bullish indicator, suggesting sustained accumulation and potential for continued upward momentum.",https://economictimes.indiatimes.com/markets/stocks/rssfeeds/2146843.cms
IIFL Finance among 4 stocks showing bullish RSI upswing,https://economictimes.indiatimes.com/markets/stocks/news/iifl-finance-among-4-stocks-showing-bullish-rsi-upswing/slideshow/130744126.cms,2026-05-04 08:19:37 IST,"Four stocks from the Nifty500 universe were flagged in the RSI Trending Up scan on April 30 after gaining over 2%. The indicator turned positive as RSI crossed above 50 from lower levels, signalling improving momentum, strengthening sentiment, and potential short-term buying opportunities in select stocks.",https://economictimes.indiatimes.com/markets/stocks/rssfeeds/2146843.cms
"BHEL Q4 results 2026: Profit jumps nearly threefold to  ₹1,290 crore; declares a final dividend of  ₹1.40 for FY26",https://www.livemint.com/market/stock-market-news/bhel-q4-results-2026-profit-jumps-near-three-fold-to-1290-crore-declares-a-final-dividend-of-1-40-for-fy26-11777873985034.html,2026-05-04 11:27:38 IST,BHEL Q4 results 2026: Profit jumps near three-fold to  ₹1290 crore; declares a final dividend of  ₹1.40 for FY26,https://www.livemint.com/rss/markets
Small-cap pharma stock under  ₹50 jumps 4% following Dalal Street rally,https://www.livemint.com/market/stock-market-news/smallcap-pharma-stock-under-rs-50-jumps-4-following-dalal-street-rally-11777869261715.html,2026-05-04 10:52:28 IST,"Sudarshan Pharma Industries saw a 4% stock price increase after reporting a 44.8% rise in Q4 net profit to  ₹10.73 crore and a 36.72% revenue growth to  ₹220.92 crore. For the year, net profit rose 55.64% and sales climbed 39.21%.",https://www.livemint.com/rss/markets
"DMart shares tumble 4% after Q4 results, wipe off  ₹9,300 crore from Radhakishan Damani &amp; other promoters' wealth",https://www.livemint.com/market/stock-market-news/dmart-shares-radhakishan-damani-other-promoters-lose-over-rs-9-300-crore-as-avenue-supermarts-stock-falls-4-afte-11777870626782.html,2026-05-04 10:29:24 IST,"Radhakishan Damani and other promoters of the company who cumulatively hold a 74.51% stake in the company, lost  ₹9332 crore in notional wealth within minutes amid the decline in the counter.",https://www.livemint.com/rss/markets
"Nifty may oscillate between 23,500 and 24,500 this week, likely to remain range-bound in near term",https://www.livemint.com/market/stock-market-news/nifty-may-oscillate-between-23-500-and-24-500-this-week-likely-to-remain-range-bound-in-near-term-11777867145424.html,2026-05-04 10:21:35 IST,"With geopolitical risks still unresolved and inflation concerns lingering, markets are expected to remain range-bound in the near term, with the Nifty likely to oscillate between 23,500 and 24,500 levels, with a mixed bias.",https://www.livemint.com/rss/markets
This drone maker stock rallies 17% to 52-week high on strong Q4 results. Do you own?,https://www.livemint.com/market/stock-market-news/ideaforge-share-price-rallies-17-on-strong-q4-results-do-you-own-11777867018332.html,2026-05-04 10:02:19 IST,"ideaForge share price hit a 52-week high on Monday, 4 May, after the company reported strong Q4 results. The company returned to black in Q4 FY26 while its revenue surged sevenfold.",https://www.livemint.com/rss/markets
"Sensex jumps 1,000 points; investors earn  ₹6L cr: Election result trends, other factors behind market rally explained",https://www.livemint.com/market/stock-market-news/sensex-up-900-points-investors-earn-4-lakh-crore-election-results-other-factors-behind-stock-market-rally-explained-11777867912582.html,2026-05-04 09:52:22 IST,"The 30-pack Sensex surged by 1,000 points, or 1.3%, to an intraday high of 77,911, while the NSE barometer Nifty 50 rose by 1.2% to the day's high of 24,290. Investors earned about  ₹6 lakh crore in a single session.",https://www.livemint.com/rss/markets
Ola Electric share price jumps over 3% as April registrations climb 20% MoM,https://www.livemint.com/market/stock-market-news/ola-electric-share-price-jumps-over-3-as-april-registrations-climb-20-mom-11777867513878.html,2026-05-04 09:45:39 IST,"Ola Electric Mobility shares increased over 3% on May 4 after reporting a 20% rise in April registrations, from 10,133 to 12,166 units. This growth occurred despite a 22% decline in the overall electric two-wheeler market, highlighting strong consumer confidence and demand for Ola's EV lineup.",https://www.livemint.com/rss/markets
Crude oil price steadies amid US-Iran war uncertainty. Where's it headed in near term?,https://www.livemint.com/market/commodities/crude-oil-price-steadies-amid-us-iran-war-uncertainty-wheres-it-headed-in-near-term-11777865648853.html,2026-05-04 09:36:28 IST,US-Iran war: MCX crude oil prices rose marginally amid no peace agreement and continued disruptions to traffic through the Strait of Hormuz. Analysts said the near-term bias is cautious and contingent on headline-driven developments in the Middle East war.,https://www.livemint.com/rss/markets
"Gold, silver prices today: Check retail rates of 24K, 22K gold, 999 silver on 4 May in Delhi, Mumbai, Kolkata, others",https://www.livemint.com/market/commodities/gold-silver-prices-today-check-retail-rates-of-24k-22k-gold-999-silver-on-4-may-in-delhi-mumbai-kolkata-others-11777833727570.html,2026-05-04 09:30:38 IST,"On 4 May, gold prices in India remained stable, and silver prices also showed limited movement as traders await clarity on the US-Iran peace deal. Check retail rates of 24K, 22K gold, and 999 silver in your city.",https://www.livemint.com/rss/markets
What do the election results of 2026 mean for the Indian stock market? Explained,https://www.livemint.com/market/stock-market-news/what-do-the-election-results-of-2026-mean-for-the-indian-stock-market-can-nifty-50-touch-25k-soon-explained-11777865064317.html,2026-05-04 09:26:09 IST,"Election Results 2026: Experts predict a gap-up opening on Monday as the market estimates the BJP's victory in Assam, West Bengal and Puducherry assembly elections",https://www.livemint.com/rss/markets
Vodafone Idea share price jumps 10% after AGR relief; Should you buy the telecom stock?,https://www.livemint.com/market/stock-market-news/vodafone-idea-share-price-jumps-10-after-agr-relief-should-you-buy-the-telecom-stock-11777866207161.html,2026-05-04 09:18:36 IST,"Vodafone Idea share price has gained 26% in one month, but the stock has fallen 5% in three months. The telecom stock has gained 15% in six months and has rallied over 53% in one year.",https://www.livemint.com/rss/markets
Gold rate declines on MCX amid persisting inflation worries; US-Iran talks remain in focus,https://www.livemint.com/market/commodities/gold-price-today-rate-declines-on-mcx-amid-persisting-inflation-worries-us-iran-talks-remain-in-focus-11777865320817.html,2026-05-04 09:11:04 IST,"Gold price today: Gold rate declined on the MCX in morning deals on Monday, 4 May, amid an uptick in the US dollar and persisting concerns over a spike in inflation due to higher-for-longer crude oil prices.",https://www.livemint.com/rss/markets
Rupee opens 4 paise lower at 94.95 against US dollar,https://www.livemint.com/market/stock-market-news/rupee-opens-4-paise-lower-at-94-95-against-us-dollar-11777865617225.html,2026-05-04 09:06:37 IST,"The Indian rupee opened weaker at 94.95 against the US dollar, influenced by fluctuating oil prices and ongoing U.S.–Iran negotiations. Brent crude prices fell amid U.S. intervention efforts for stranded ships, while the rupee has dropped nearly 2% over the past eight days.",https://www.livemint.com/rss/markets
Distributors skirt SIF certification norms as talent shortage bites,https://www.livemint.com/market/stock-market-news/india-sif-distributors-sub-brokers-nism-xiii-derivatives-exam-shortage-violating-sebi-norms-11776853031841.html,2026-05-04 09:00:36 IST,"Unqualified sub-brokers are reportedly selling specialized investment funds, violating regulations as the segment faces a lack of certified sellers. This practice will likely concern Sebi, which will then hold asset management companies accountable, regulatory experts said.&amp;nbsp;",https://www.livemint.com/rss/markets
"Bitcoin Tops $80,000 for Three-Month High as Asian Stocks Rise",https://www.livemint.com/market/bitcoin-tops-80-000-for-three-month-high-as-asian-stocks-rise-11777865022812.html,2026-05-04 08:53:42 IST,"Bitcoin rose above $80,000 for the first time in more than three months as Asian stocks approached record highs.",https://www.livemint.com/rss/markets
Emerging-Market Stocks Rise to Record High on Tech Boost,https://www.livemint.com/market/emergingmarketstocks-rise-to-record-high-on-tech-boost-11777864773266.html,2026-05-04 08:49:32 IST,"Emerging-market assets gained, with strong tech earnings and hopes of a resumption in shipping through the Strait of Hormuz lifting sentiment.",https://www.livemint.com/rss/markets
Aluminum Gains as Trump Vows to Maintain Naval Blockade on Iran,https://www.livemint.com/market/aluminum-gains-as-trump-vows-to-maintain-naval-blockade-on-iran-11777864467470.html,2026-05-04 08:44:27 IST,"Aluminum gained, with traders seeing little prospect of an imminent opening of the Strait of Hormuz that would ease availability of the metal.",https://www.livemint.com/rss/markets
"OnEMI Technology Solutions IPO Day 2: Issue subscribed 29% so far. GMP, review, other key details. Should you apply?",https://www.livemint.com/market/ipo/onemi-technology-solutions-ipo-gmp-onemi-technology-solutions-ipo-review-onemi-technology-solutions-ipo-subscription-11777862437810.html,2026-05-04 08:37:30 IST,"OnEMI Technology Solutions IPO was 24% subscribed on the first day, with 66% from Qualified Institutional Buyers. The offering closes on May 5, with a price range of  ₹162 to  ₹171 per share, valuing the company at approximately  ₹2,900 crore.",https://www.livemint.com/rss/markets
Stocks to buy for short term: From Jio Financial to Hero MotoCorp - Jigar Patel of Anand Rathi recommends 3 shares,https://www.livemint.com/market/stock-market-news/stocks-to-buy-for-short-term-jio-financial-hero-motocorp-castrol-india-jigar-patel-anand-rathi-recommends-3-shares-11777860637235.html,2026-05-04 08:24:54 IST,"Stocks to buy for short term: Jigar S. Patel, Senior Manager of Equity Technical Research at Anand Rathi Share and Stock Brokers, recommends three stocks to buy for the short term, highlighting their ideal buying range, target prices, and stop losses.",https://www.livemint.com/rss/markets
Q4 results 2026: BHEL to Ambuja Cements among companies to declare Q4 results today; check full list here,https://www.livemint.com/market/stock-market-news/q4-results-2026-bhel-to-ambuja-cements-among-companies-to-declare-q4-results-today-check-full-list-here-11777859881317.html,2026-05-04 08:10:46 IST,"Q4 results 2026: Around 45 companies will declare their March quarter results on Monday. Checkout Q4 previews, along with full list of companies to release Q4 results today.",https://www.livemint.com/rss/markets
"Stock market today: Gift Nifty signals gap-up start; election results, India VIX to Q4 results — 7 stocks to buy or sell",https://www.livemint.com/market/stock-market-news/stock-market-today-gift-nifty-signals-gap-up-start-election-results-india-vix-to-q4-results-7-stocks-to-buy-or-sell-11777859518981.html,2026-05-04 08:06:10 IST,"Stock market today: Experts recommend these eight stocks to buy today —Sona Blw Precision Forgings, Sai Life Sciences, Reliance, SAIL, GPPL, Thermax, and Tata Capital",https://www.livemint.com/rss/markets
NCLAT rejects Vedanta's challenge to approval of Adani's resolution plan for Jaiprakash Associates,https://www.livemint.com/companies/nclat-vedanta-challenge-rejected-adanis-resolution-plan-jaiprakash-associates-no-illegality-committee-of-creditors-11777867951910.html,2026-05-04 11:00:40 IST,"Vedanta's challenge to Adani Enterprises' resolution plan for Jaiprakash Associates Ltd was dismissed by the National Company Law Appellate Tribunal. The tribunal found no legal flaws in the creditors' choice, marking a significant setback for Vedanta despite its claims of offering a superior bid.",https://www.livemint.com/rss/companies
New Mexico seeks child safety restrictions on Meta apps and algorithms in trials 2nd phase,https://www.livemint.com/companies/new-mexico-seeks-child-safety-restrictions-on-meta-apps-and-algorithms-in-trials-2nd-phase-11777867626101.html,2026-05-04 09:37:05 IST,New Mexico seeks child safety restrictions on Meta apps and algorithms in trial's 2nd phase,https://www.livemint.com/rss/companies
GameStop makes staggering $55.5 billion play to acquire online auction giant eBay,https://www.livemint.com/companies/news/gamestop-makes-staggering-55-5-billion-play-to-acquire-online-auction-giant-ebay-11777862951684.html,2026-05-04 08:59:09 IST,"GameStop has proposed a $55.5 billion acquisition of eBay, valuing it at $125.00 per share. GameStop CEO Ryan Cohen says he plans to lead the combined entity",https://www.livemint.com/rss/companies
"8th Pay Commission 6-month review: Key updates, consultation status and outlook",https://www.livemint.com/money/personal-finance/8th-pay-commission-6-month-review-key-updates-consultation-status-and-outlook-11777868962245.html,2026-05-04 10:54:02 IST,"The 8th Pay Commission review highlights progress in consultations, stakeholder engagement, and the policy focus on salaries, pensions, and reforms shaping the future of government employees across the country.",https://www.livemint.com/rss/money
How the falling rupee still affects households with no direct dollar expenses,https://www.livemint.com/money/falling-rupee-affects-households-with-no-direct-dollar-expenses-emergency-funds-global-investment-diversification-11777827129473.html,2026-05-04 10:48:13 IST,"Economists and financial planners urge the public to rebudget for essentials, build larger emergency funds, and consider global investment diversification as a hedge against accelerating imported inflation.",https://www.livemint.com/rss/money
"UPI hits record in FY26: 24,162 cr transactions worth  ₹314 lakh crore – 5 ways to stay safe while making UPI payments",https://www.livemint.com/money/personal-finance/upi-hits-record-in-fy26-24-162-crore-transactions-worth-rs-314-lakh-crore-5-ways-to-stay-safe-while-making-upi-payment-11777867205406.html,2026-05-04 10:13:23 IST,"Record UPI transactions in FY26 highlight rapid digital growth nationwide. UPI payments are best made through secure apps, with vigilant verification and protection of sensitive financial details.",https://www.livemint.com/rss/money
MCX shares drop 3% after Sebi chief's comments on commodity derivatives. What spooked investors?,https://economictimes.indiatimes.com/markets/stocks/news/mcx-shares-drop-3-after-sebi-chiefs-comments-on-commodity-derivatives-what-spooked-investors/articleshow/130774578.cms,2026-05-04 14:09:37 IST,MCX shares fell after SEBI signalled that banks and insurers are unlikely to be allowed into commodity derivatives. SEBI chief Tuhin Kanta Pandey said the regulator won’t push the proposal with Reserve Bank of India.,https://economictimes.indiatimes.com/markets/stocks/rssfeeds/2146843.cms
Stock picks of the week: 5 stocks with consistent score improvement and upside potential of up to 31%,https://economictimes.indiatimes.com/markets/stocks/news/stock-picks-of-the-week-5-stocks-with-consistent-score-improvement-and-upside-potential-of-up-to-31/articleshow/130772442.cms,2026-05-04 13:58:03 IST,"If there is no negative development over the next few days, there is unlikely to be pressure on a large part of the market. It is, in fact, likely that the Indian market will be part of any upmove that emerging markets may see if there is a decline in crude oil prices. Our selected stocks for today depict a strong upward trajectory in their overall average score which is based on five key pillars: Earnings, fundamentals, relative valuation, risk, and price momentum. This implies that there has been a significant improvement in their market outlook in the given time frame.",https://economictimes.indiatimes.com/markets/stocks/rssfeeds/2146843.cms
FIIs raised stakes in 13 stocks for 4 straight quarters; 5 turned multibaggers. Do you own any?,https://economictimes.indiatimes.com/markets/stocks/news/fiis-raised-stakes-in-13-stocks-for-4-straight-quarters-5-turned-multibaggers-do-you-own-any/slideshow/130773501.cms,2026-05-04 13:50:19 IST,"Foreign institutional investors increased stakes for four straight quarters in 49 stocks, with 13 delivering sharp gains of up to 353% and five turning multibaggers over the past year. The trend highlights strong institutional conviction, with consistent buying coinciding with significant price outperformance across select large and mid-cap companies.",https://economictimes.indiatimes.com/markets/stocks/rssfeeds/2146843.cms
Valor Estate shares locked in 20% upper circuit. What’s behind the sharp surge today?,https://economictimes.indiatimes.com/markets/stocks/news/valor-estate-shares-locked-in-20-upper-circuit-whats-behind-the-sharp-surge-today/articleshow/130772449.cms,2026-05-04 13:49:27 IST,"Valor Estate shares hit a 20% upper circuit after the Bombay High Court ruled in its favour in a long-pending Bhayandar land dispute. The verdict removes ownership uncertainty over a key land parcel, boosting sentiment. The company is now positioned to explore development and monetisation opportunities linked to the asset.",https://economictimes.indiatimes.com/markets/stocks/rssfeeds/2146843.cms
"Maruti Suzuki, Bajaj Auto, other auto stocks jump up to 5% after strong April sales",https://economictimes.indiatimes.com/markets/stocks/news/maruti-suzuki-bajaj-auto-other-auto-stocks-jump-up-to-5-after-strong-april-sales/articleshow/130770166.cms,2026-05-04 13:36:48 IST,"Shares of automakers like Maruti Suzuki and Bajaj Auto rose after strong April sales data lifted sentiment. The gains pushed the Nifty Auto index over 1% higher, led by robust performance from key players.",https://economictimes.indiatimes.com/markets/stocks/rssfeeds/2146843.cms
West Bengal election results put these 43 stocks under spotlight. Will BJP's win be a trigger?,https://economictimes.indiatimes.com/markets/stocks/news/west-bengal-election-results-outs-these-43-stocks-under-spotlight-will-bjps-win-be-a-trigger/articleshow/130766868.cms,2026-05-04 12:50:12 IST,"Early West Bengal election trends putting BJP ahead of TMC have pushed stocks like Bandhan Bank, CESC, and Berger Paints into focus. Investors are watching potential policy shifts, though analysts say the impact will be short-lived, with broader cues such as crude oil prices likely to drive overall market sentiment.",https://economictimes.indiatimes.com/markets/stocks/rssfeeds/2146843.cms
M&amp;M Q4 preview: PAT to rise up to 48% YoY amid sequential setback; revenue to grow up to 24% on strong volumes,https://economictimes.indiatimes.com/markets/stocks/news/mm-q4-preview-pat-to-rise-up-to-48-yoy-amid-sequential-setback-revenue-to-grow-up-to-24-on-strong-volumes/articleshow/130765565.cms,2026-05-04 12:39:00 IST,"Mahindra &amp; Mahindra is expected to post strong YoY growth in Q4FY25, with PAT rising up to 48% and revenue growing up to 24% on robust volumes. However, margin pressures and sequential decline in profitability remain concerns, as rising costs and EV mix weigh on performance across brokerages’ estimates.",https://economictimes.indiatimes.com/markets/stocks/rssfeeds/2146843.cms
"BHEL shares soar 13% after Q4 net profit rockets 156% YoY to Rs 1,290 crore, revenue up 37%",https://economictimes.indiatimes.com/markets/stocks/news/bhel-shares-soar-13-after-q4-net-profit-rockets-156-yoy-to-rs-1290-crore-revenue-up-37/articleshow/130762670.cms,2026-05-04 12:21:56 IST,"BHEL Share Price: Bharat Heavy Electricals Ltd (BHEL) shares surged over 13% after reporting a robust March quarter with a 156% jump in net profit to Rs 1,290.50 crore. Revenue from operations also saw a significant 37% increase. The company also recommended a final dividend of Rs 1.40 per share for FY26.",https://economictimes.indiatimes.com/markets/stocks/rssfeeds/2146843.cms
"Adani Power, Ports &amp; Enterprises: Why Jefferies just raised their target prices on 3 Adani group stocks",https://economictimes.indiatimes.com/markets/stocks/news/adani-power-ports-enterprises-why-jefferies-just-raised-their-target-prices-on-3-adani-group-stocks/articleshow/130762556.cms,2026-05-04 12:10:35 IST,"Jefferies has raised target prices on Adani Power, Adani Ports and Adani Enterprises, maintaining ‘Buy’ ratings on strong operational performance, capacity expansions and improving realisations. Adani Ports saw EBITDA beat estimates, supported by higher domestic port realisations and upcoming capacity additions. The brokerage expects steady volume growth and strong EBITDA momentum across the Adani group.",https://economictimes.indiatimes.com/markets/stocks/rssfeeds/2146843.cms
"Bank, insurance regulators not inclined to allow commodity derivative investments: SEBI",https://economictimes.indiatimes.com/markets/stocks/news/bank-insurance-regulators-not-inclined-to-allow-commodity-derivative-investments-sebi/articleshow/130760351.cms,2026-05-04 11:48:33 IST,"India's markets regulator, SEBI, will not permit banks and insurance companies to invest in commodity derivatives, according to its chairman. While SEBI had previously explored enabling pension funds to trade commodities, a decision remains undisclosed. The announcement led to a decline in Multi Commodity Exchange of India shares.",https://economictimes.indiatimes.com/markets/stocks/rssfeeds/2146843.cms
Zen Technologies shares tumble 11% after Q4 profit plunges 69% YoY,https://economictimes.indiatimes.com/markets/stocks/news/zen-technologies-shares-tumble-11-after-q4-profit-plunges-69-yoy/articleshow/130748592.cms,2026-05-04 09:51:42 IST,"Zen Technologies shares saw a sharp fall of 11 percent. This happened after the company reported a significant drop in its March quarter earnings. Net profit declined by 69 percent year-on-year. Revenue from operations also faced pressure, falling 45 percent. The company announced a final dividend of Re 1 per share. Its order book stood at Rs 1,336 crore.",https://economictimes.indiatimes.com/markets/stocks/rssfeeds/2146843.cms
10 penny stocks surged up to 490% in 6 months. Do you own any?,https://economictimes.indiatimes.com/markets/stocks/news/10-penny-stocks-surged-up-to-490-in-6-months-do-you-own-any/slideshow/130727855.cms,2026-05-03 10:46:42 IST,"Ten penny stocks surged up to 490% in six months, led by micro-cap momentum plays. Despite high returns, investors face risks like volatility, low liquidity, requiring careful research and disciplined risk management.",https://economictimes.indiatimes.com/markets/stocks/rssfeeds/2146843.cms
"Ambuja Cement Q4 results: Net profit rises 78% YoY to  ₹1,830 crore;  ₹2 per share dividend announced",https://www.livemint.com/market/stock-market-news/ambuja-cement-q4-results-net-profit-rises-78-yoy-to-1-830-crore-2-per-share-dividend-announced-11777884509146.html,2026-05-04 14:34:02 IST,"Ambuja Cement Q4 results: Net profit rises 78% YoY to  ₹1,830 crore;  ₹2 per share dividend announced",https://www.livemint.com/rss/markets
April manufacturing PMI: is the uptick temporary?,https://www.livemint.com/market/mark-to-market/april-manufacturing-pmi-uptick-temporary-inventory-building-soaring-crude-oil-prices-11777882363306.html,2026-05-04 14:26:41 IST,"The manufacturing PMI recovered mildly in April to 54.7 from a four-year low, driven partly by pre-emptive inventory building ahead of price hikes rather than genuine demand.&amp;nbsp;",https://www.livemint.com/rss/markets
