title,link,published,summary,source
How Charlie Munger found an ideal investment option during the global financial crisis in 2008?,https://www.livemint.com/market/stock-market-news/how-charlie-munger-found-an-ideal-investment-option-during-the-global-financial-crisis-in-2008-11780289078696.html,2026-06-01 10:26:51 IST,"What began as a contrarian investment during one of the worst financial crises eventually turned into a multi-billion-dollar success story, with Berkshire reportedly earning profits of around $10 billion by the time it substantially exited the investment in 2025.",https://www.livemint.com/rss/markets
"Stocks to buy or sell: Dharmesh Shah of ICICI Sec suggests buying Tata Power, Sona BLW shares on 1 June",https://www.livemint.com/market/stocks-to-buy-or-sell-dharmesh-shah-of-icici-sec-suggests-buying-tata-power-sona-blw-shares-on-1-june-11780287454009.html,2026-06-01 10:19:15 IST,"Indian benchmark indices opened higher on June 1, supported by gains in IndiGo and Asian Paints. The NSE Nifty rose 0.38% and the BSE Sensex gained 0.36% amid positive Asian market sentiment and recovery after recent sell-offs.",https://www.livemint.com/rss/markets
Crude oil prices rise 2% as concerns about Middle East conflict linger; Brent at $93. What's the near-term outlook?,https://www.livemint.com/market/commodities/crude-oil-prices-rise-2-as-concerns-about-middle-east-conflict-linger-brent-at-93-whats-the-near-term-outlook-11780285043296.html,2026-06-01 10:00:56 IST,"US-Iran war: MCX crude oil prices rose as much as 3.15% to  ₹8,542 per barrel. Here's what analysts say on the near-term outlook.",https://www.livemint.com/rss/markets
Reliance Industries share price jumps on Gujarat lignite gasification project with NLC India,https://www.livemint.com/market/stock-market-news/reliance-industries-share-price-jumps-on-gujarat-lignite-gasification-project-with-nlc-india-11780286607646.html,2026-06-01 09:38:43 IST,"Reliance Industries shares rose over 1% after announcing a partnership with NLC India to explore an underground lignite gasification project in Gujarat, aiming to enhance energy security and reduce dependence on LNG.",https://www.livemint.com/rss/markets
"Vardhman Textiles, Gokaldas Exports to KPR Mill: Textile stocks jump over 6% after cotton import duty exemption",https://www.livemint.com/market/stock-market-news/vardhman-textiles-gokaldas-exports-to-kpr-mill-textile-stocks-jump-over-6-after-cotton-import-duty-exemption-11780286800617.html,2026-06-01 09:37:51 IST,"Vardhman Textiles share price jumped over 6%, followed by Pearl Global Industries, Raymond Lifestyle and Trident shares rallying over 5%. Gokaldas Exports, KPR Mill and Welspun Living shares gained over 4% each, while Alok Industries share price surged over 3%.",https://www.livemint.com/rss/markets
Copper Gains With US Tariffs Deadline Less Than a Month Away,https://www.livemint.com/market/copper-gains-with-us-tariffs-deadline-less-than-a-month-away-11780286686290.html,2026-06-01 09:34:45 IST,Copper advanced in New York and London to kick off a crucial month that should deliver more clarity on the Trump administration’s plans for levies on imports of the metal to the US.,https://www.livemint.com/rss/markets
"For IndiGo, June quarter will be real earnings test of West Asia war impact",https://www.livemint.com/market/mark-to-market/indigo-q4-results-interglobe-aviation-share-price-india-airlines-forex-loss-11780283294744.html,2026-06-01 09:33:46 IST,"IndiGo’s shares had jumped 6% on the next trading day after CEO Walsh's appointment was announced on 31 March. To justify the steep valuation multiple that IndiGo is enjoying, it must achieve substantial improvement in profit hereon.",https://www.livemint.com/rss/markets
"IndiGo share price rises 5% despite a  ₹2,536 crore loss in Q4 results. Should you buy or sell?",https://www.livemint.com/market/stock-market-news/indigo-share-price-rises-5-despite-a-2-536-crore-loss-in-q4-results-should-you-buy-or-sell-11780285774994.html,2026-06-01 09:31:09 IST,"InterGlobe Aviation, the parent company of budget carrier IndiGo, share price rallied as much as 4.62% in Monday's trading session after the company posted its financial results for the quarter ending on March 31, 2026 on Friday.",https://www.livemint.com/rss/markets
"Gold price today: Rate drops on MCX amid stronger dollar, higher oil prices; experts highlight key levels to watch",https://www.livemint.com/market/commodities/gold-price-today-rate-drops-on-mcx-amid-stronger-dollar-higher-oil-prices-experts-highlight-key-levels-to-watch-11780284627283.html,2026-06-01 09:08:22 IST,"Gold price today: Rate dropped on MCX amid a stronger dollar and higher oil prices. The dollar index rose by about 0.20%, making greenback-denominated gold expensive for buyers in other currencies. Crude oil prices jumped by over 2% amid persistent uncertainty over a US-Iran deal.",https://www.livemint.com/rss/markets
Rupee opens 3 paise higher at 94.97 against US dollar,https://www.livemint.com/market/stock-market-news/rupee-opens-3-paise-higher-at-94-97-against-us-dollar-11780284711660.html,2026-06-01 09:03:18 IST,"The Indian rupee opened at 94.97 against the US dollar, slightly higher by 3 paise. Rising crude oil prices and foreign portfolio outflows are pressuring the currency, while recent RBI interventions have provided some recovery support amidst concerns over inflation and currency stability.",https://www.livemint.com/rss/markets
Stocks to buy for short term: JSW Energy among 3 stocks Anand Rathi's Jigar Patel recommends buying for next 1-2 weeks,https://www.livemint.com/market/stock-market-news/stocks-to-buy-for-short-term-jsw-energy-among-3-stocks-anand-rathis-jigar-patel-recommends-buying-for-next-1-2-weeks-11780128257951.html,2026-06-01 08:01:53 IST,Stocks to buy for the short term: Jigar Patel identifies three promising stocks for short-term investment. Discover their target prices and potential for growth in the coming weeks.,https://www.livemint.com/rss/markets
"Buy or sell: Gift Nifty signals gap-up opening, Vaishali Parekh recommends three stocks to buy today — 1 June 2026",https://www.livemint.com/market/stock-market-news/buy-or-sell-gift-nifty-signals-gap-up-opening-vaishali-parekh-recommends-three-stocks-to-buy-today-1-june-2026-11780277060339.html,2026-06-01 07:53:11 IST,"Buy or sell: Vaishali Parekh recommends three stocks to buy today —Latent View, Precision Camshafts, and IEX",https://www.livemint.com/rss/markets
"Raja Venkatraman, MarketSmith recommend five stocks for 1 June",https://www.livemint.com/market/stock-market-news/raja-venkatraman-marketsmith-recommend-five-stocks-for-1-june-11780277644949.html,2026-06-01 07:48:09 IST,"Indian stocks fell sharply on May 29, erasing gains and dragging the Sensex down by over 1,000 points. As June begins, analysts suggest a flat start, with institutional flows and geopolitical factors influencing market trends.",https://www.livemint.com/rss/markets
"Nifty 50, Sensex prediction today: Check how Indian stock market is expected to trade on 1 June",https://www.livemint.com/market/stock-market-news/nifty-50-sensex-prediction-today-check-how-indian-stock-market-is-expected-to-trade-on-1-june-11780278076770.html,2026-06-01 07:48:02 IST,"Nifty 50, Sensex prediction today: The trends on Gift Nifty also indicate a muted start for the Indian benchmark index. The Gift Nifty was trading around 23,726 level, a discount of nearly 22 points from the Nifty futures’ previous close.",https://www.livemint.com/rss/markets
"Stocks to watch: IndiGo, NMDC, PB Fintech among 10 shares in focus today; check list here",https://www.livemint.com/market/stock-market-news/stocks-to-watch-indigo-nmdc-pb-fintech-among-10-shares-in-focus-today-check-list-here-11780277360643.html,2026-06-01 07:23:52 IST,"Stock market today: The market is likely to continue its losing streak as trends in the Gift Nifty index signalled a negative opening on Monday. Amid this backdrop, these stocks will remain in focus on 1 June.",https://www.livemint.com/rss/markets
"From Gift Nifty, US-Iran talks to FPI outflows: 10 key things that changed for Indian stock market over weekend",https://www.livemint.com/market/stock-market-news/from-gift-nifty-us-iran-talks-to-fpi-outflows-10-key-things-that-changed-for-indian-stock-market-over-weekend-11780276459144.html,2026-06-01 07:07:14 IST,"Gift Nifty was trading around 23,702 level, a discount of nearly 46 points from the Nifty futures’ previous close, indicating a negative start for the Indian stock market indices.",https://www.livemint.com/rss/markets
Breakout stocks to buy or sell: Sumeet Bagadia recommends five shares to buy today — 1 June 2026,https://www.livemint.com/market/stock-market-news/breakout-stocks-to-buy-or-sell-sumeet-bagadia-recommends-five-shares-to-buy-today-1-june-2026-11780274864538.html,2026-06-01 06:41:02 IST,The Indian stock market ended Friday's session on a lower note. Sumeet Bagadia of Choice Broking recommends five breakout stocks to buy today.,https://www.livemint.com/rss/markets
"China index rebalancing to trigger $48 billion in passive flows, Goldman Sachs estimates",https://www.livemint.com/market/china-index-rebalancing-to-trigger-48-billion-in-passive-flows-goldman-sachs-estimates-11780275984222.html,2026-06-01 06:36:23 IST,"CHINA-INDEX/REBALANCING (PIX):China index rebalancing to trigger $48 billion in passive flows, Goldman Sachs estimates",https://www.livemint.com/rss/markets
"Dollar steadies as markets await signals on Iran war, central banks",https://www.livemint.com/market/dollar-steadies-as-markets-await-signals-on-iran-war-central-banks-11780274337081.html,2026-06-01 06:08:56 IST,"GLOBAL-FOREX/:FOREX-Dollar steadies as markets await signals on Iran war, central banks",https://www.livemint.com/rss/markets
RBI set to hold rates on 5 June as war-driven inflation clouds outlook,https://www.livemint.com/market/rbi-set-hold-policy-repo-rate-5-june-as-war-driven-inflation-clouds-outlook-mpc-11780216675183.html,2026-06-01 06:02:51 IST,"A Mint poll of 10 economists suggests that the RBI is likely to maintain the policy repo rate at 5.25% this week. The repo (repurchase) rate is the rate at which the central bank lends money to commercial banks for short-term requirements, typically against government securities as collateral.",https://www.livemint.com/rss/markets
"FPIs avoid IPOs, pivot to block deals amid high valuations, says Kotak's Ramesh",https://www.livemint.com/market/fpis-avoid-ipos-pivot-to-block-deals-amid-high-valuations-ramesh-srinivasan-kotak-investment-banking-11780207934216.html,2026-06-01 06:00:51 IST,"Foreign portfolio investors (FPIs) have reduced their interest in Indian IPOs, shifting focus to follow-on offerings and block trades. Global institutional participation has declined, with high valuations and global tech distractions affecting investor appetite.",https://www.livemint.com/rss/markets
Raja Venkatraman recommends three stocks for 1 June,https://www.livemint.com/market/stock-market-news/raja-venkatraman-recommends-three-stocks-for-1-june-top-stock-picks-11780144266427.html,2026-06-01 06:00:31 IST,Market expert Raja Venkatraman shares his top stock picks for 1 June. Here’s his technical outlook and trade strategy.,https://www.livemint.com/rss/markets
Stock recommendations for 1 June from MarketSmith India,https://www.livemint.com/market/stock-market-news/stock-recommendations-for-1-june-from-marketsmith-india-11780143314293.html,2026-06-01 06:00:31 IST,"MarketSmith India reveals its top stock recommendations for today, 1 June. Get expert insights into the best-performing stocks to guide your investment decisions.",https://www.livemint.com/rss/markets
"Inflation risks aren’t a crisis, investors can still earn double-digit returns: Invesco CIO",https://www.livemint.com/market/stock-market-news/invesco-cio-taher-badshah-inflation-crisis-double-digit-returns-multi-asset-strategy-11780206594802.html,2026-06-01 06:00:11 IST,"Taher Badshah says earnings remain resilient despite energy and geopolitical pressures, and multi-asset strategies may offer better risk-adjusted returns as volatility rises.",https://www.livemint.com/rss/markets
Soybeans rise in step with higher oil prices; corn eases,https://www.livemint.com/market/soybeans-rise-in-step-with-higher-oil-prices-corn-eases-11780273665112.html,2026-06-01 05:57:44 IST,GLOBAL-GRAINS/:GRAINS-Soybeans rise in step with higher oil prices; corn eases,https://www.livemint.com/rss/markets
Volume surge lifts Asian Paints out of slump; margin peak raises caution,https://www.livemint.com/market/volume-surge-lifts-asian-paints-out-of-slump-margin-peak-raises-caution-11780214853925.html,2026-06-01 05:51:11 IST,"Asian Paints posted a 12-quarter high volume growth of 12.4% in Q4FY26, signalling a demand revival after a bruising period of competition and pricing wars. But rising raw material costs, persistent competitive intensity, and rich valuations mean FY27 remains a high-stakes year for the paints giant.",https://www.livemint.com/rss/markets
Brokers find new use in GIFT City's global access licence for prop trades,https://www.livemint.com/market/gift-city-licence-brokers-prop-trading-firms-11780212684136.html,2026-06-01 05:46:11 IST,"GIFT City's Global Access Provider licence, designed to give Indian investors overseas market access, is increasingly being used by brokers for proprietary trading—drawn by a fee cap of $10,000 per quarter and a 20-year tax holiday.",https://www.livemint.com/rss/markets
"Leapfrog, IFC and NIIF eye  ₹400 crore minority stake in Marengo Asia Healthcare",https://www.livemint.com/companies/news/leapfrog-ifc-niif-eye-rs-400-crore-minority-stake-in-marengo-asia-healthcare-11780282524079.html,2026-06-01 10:37:24 IST,"Marengo will likely use the proceeds to fund its next level growth phase, including inorganic growth plans and expanding its Gurgaon and Faridabad capacity",https://www.livemint.com/rss/companies
"Cheaper AI could create more jobs, not fewer: Apollo's chief economist Torsten Sløk- What he means",https://www.livemint.com/companies/people/cheaper-ai-could-create-more-jobs-not-fewer-apollos-chief-economist-torsten-sl-k-what-he-means-11780287695871.html,2026-06-01 10:32:45 IST,"Apollo Global Management's chief economist Torsten Sløk says there is ‘zero evidence’ that AI is causing job losses. He argues that AI investment is creating jobs, while OpenAI CEO Sam Altman has also pushed back against fears of mass unemployment.",https://www.livemint.com/rss/companies
Bill Gates was once world's most admired man. Now even Microsoft doesn't want him at its CEO summit: Report,https://www.livemint.com/companies/people/bill-gates-was-once-worlds-most-admired-man-now-even-microsoft-doesnt-want-him-at-its-ceo-summit-report-11780279450844.html,2026-06-01 09:36:32 IST,"Bill Gates' philanthropic image is tarnishing due to his ties with Jeffrey Epstein, as per a latest report. The Microsoft co-founder was reportedly recently snubbedfrom Berkshire Hathaway's annual shareholder meeting and Microsoft's CEO summit",https://www.livemint.com/rss/companies
Indian firms line up for US tariff refunds amid looming legal challenge,https://www.livemint.com/companies/indian-companies-us-tariff-refunds-trump-legal-challenge-11780229590152.html,2026-06-01 09:28:19 IST,"Indian exporters including Ceat, Balkrishna, CNH India and Gokaldas are seeking refunds of Trump-era reciprocal tariffs after US courts ruled them illegal. However, uncertainty over eligibility, timelines and the administration's appeal has left companies awaiting clarity on potential recoveries.",https://www.livemint.com/rss/companies
"Adani’s little-known infra arm amasses  ₹50,000-cr orderbook, eyes acquisitions",https://www.livemint.com/companies/news/adanis-little-known-infra-arm-amasses-50-000-cr-orderbook-eyes-acquisitions-11779892599875.html,2026-06-01 05:55:51 IST,"Currently, the promoter-owned private company works with several leading engineering, procurement and construction (EPC) firms as a project management consultant (PMC) to manage projects across Adani Group companies.",https://www.livemint.com/rss/companies
Infosys is aging as young employees count lowest in 15 years,https://www.livemint.com/companies/infosys-is-aging-as-young-employees-count-lowest-in-15-years-tcs-11780214646359.html,2026-06-01 05:50:11 IST,"At the end of FY26, Infosys had 166,636 employees aged 30 and below, making up about 50.7% of its workforce, a Mint analysis of its annual filings over the last 15 years showed. The share of young employees fell from 53% in the previous fiscal year, continuing a trend of decline since FY23.",https://www.livemint.com/rss/companies
Berkshire Hathaway's first post- Warren Buffett acquisition: Buys homebuilder Taylor Morrison for $8.5 billion,https://www.livemint.com/companies/news/berkshire-hathaways-first-post-warren-buffett-acquisition-buys-homebuilder-taylor-morrison-for-8-5-billion-11780270627780.html,2026-06-01 05:48:54 IST,"Berkshire Hathaway agrees to buy US homebuilder Taylor Morrison for $8.5 billion in cash, its first takeover since Warren Buffett stepped down as CEO.",https://www.livemint.com/rss/companies
Virat Kohli's secret to success isn't just cricket— It can grow your wealth too - check 5 investing lessons,https://www.livemint.com/money/personal-finance/virat-kohlis-secret-to-success-isnt-just-cricket-it-can-grow-your-wealth-too-check-5-investing-lesson-11780285503433.html,2026-06-01 10:59:56 IST,"Virat Kohli led RCB to a five-wicket victory over GT in IPL 2026, delivering consistent performances through the marquee tournament and capping it off with an unbeaten 75 in the final. His disciplined approach is a reminder to investors to prioritize technique and strategy over aggressive tactics.",https://www.livemint.com/rss/money
"Gold and silver prices today, 1 June: Check retail rates of 24K, 22K gold and 999 silver in Delhi, Mumbai, other cities",https://www.livemint.com/money/personal-finance/gold-and-silver-prices-today-1-june-check-retail-rates-of-24k-22k-gold-and-999-silver-in-delhi-mumbai-other-cities-11780285971614.html,2026-06-01 10:26:46 IST,"Gold and silver prices today, 1 June: Gold rates declined on MCX amid a stronger US dollar and rising crude oil prices. Check the latest 24K and 22K gold prices, along with 999 silver rates, in Delhi, Mumbai, Bengaluru, Kolkata, Hyderabad, and Chennai.",https://www.livemint.com/rss/money
"Annapurna Yojana:  ₹3,000 transfer begins this week – How Lakshmir Bhandar beneficiaries can update bank details",https://www.livemint.com/money/personal-finance/annapurna-yojana-3-000-transfer-begins-this-week-how-lakshmir-bhandar-beneficiaries-can-update-bank-details-11780281254645.html,2026-06-01 08:28:45 IST,"West Bengal CM Suvendu Adhikari announced the Annapurna Yojana fund transfers starting June 3, providing  ₹3,000 to eligible women. Beneficiaries must ensure their Aadhaar-linked bank accounts are updated to avoid issues with payments.",https://www.livemint.com/rss/money
"Coinbase launches in India with direct INR support: How to deposit rupees, trade crypto and withdraw funds",https://www.livemint.com/money/personal-finance/coinbase-launches-in-india-with-direct-inr-support-how-to-deposit-rupees-trade-crypto-and-withdraw-funds-11780279236984.html,2026-06-01 07:52:47 IST,"Coinbase has launched operations in India, allowing users to deposit and withdraw Indian Rupees directly. This eliminates the need for peer-to-peer transactions, and users can trade various crypto assets with local order books and advanced trading tools.",https://www.livemint.com/rss/money
"8th Pay Commission: Retirement benefit rules could change – upto 100% pension, OPS-NPS-UPS under discussion",https://www.livemint.com/money/personal-finance/8th-pay-commission-pension-rules-could-change-upto-100-pension-ops-nps-ups-under-discussion-11780275747185.html,2026-06-01 07:20:56 IST,"8th Pay Commission: Pension rules could change - 70% pension at 65, increasing to 100% with age, Freedom to Pick OPS, NPS or UPS",https://www.livemint.com/rss/money
Nvidia picks Unitree for humanoid robot platform as Chinese startup eyes IPO,https://www.cnbc.com/2026/06/01/nvidia-unitree-humanoid-robotics-system-researchers.html,2026-06-01 11:15:45 IST,The U.S. chipmaker's first publicly available humanoid robotics system will use humanoids from Chinese startup Unitree.,https://www.cnbc.com/id/10000664/device/rss/rss.html
"China’s factory activity beats forecasts in May, private survey shows, despite softer official data",https://www.cnbc.com/2026/06/01/chinas-factory-activity-beats-forecasts-in-may-private-survey-shows-despite-softer-official-data.html,2026-06-01 08:04:38 IST,"China’s manufacturing activity expanded faster than expected in May, according to a private survey released Monday, although growth slowed from April.",https://www.cnbc.com/id/10000664/device/rss/rss.html
Berkshire Hathaway makes $6.8 billion housing bet with Taylor Morrison deal,https://www.cnbc.com/2026/06/01/berkshire-hathaway-taylor-morrison-home-acquisition-housing-market.html,2026-06-01 05:46:39 IST,"The acquisition marks one of the first major strategic deals under Warren Buffett's successor Greg Abel, who took over as CEO in the beginning of 2026.",https://www.cnbc.com/id/10000664/device/rss/rss.html
