title,link,published,summary,source
NSE launches Electronic Gold Receipts to formalise India’s gold market; successfully dematerialises 1 kg gold bar,https://economictimes.indiatimes.com/markets/stocks/news/nse-launches-electronic-gold-receipts-to-formalise-indias-gold-market-successfully-dematerialises-1-kg-gold-bar/articleshow/130794387.cms,2026-05-04 17:31:34 IST,"The National Stock Exchange introduced Electronic Gold Receipts, enabling dematerialised gold trading backed by physical assets in regulated vaults. The initiative enhances transparency, liquidity, and accessibility, bridging physical gold with financial markets for investors, jewellers, and institutions.",https://economictimes.indiatimes.com/markets/stocks/rssfeeds/2146843.cms
Earnings Boom: 10 stocks with over 100% profit growth in Q4FY26,https://economictimes.indiatimes.com/markets/stocks/news/earnings-boom-10-stocks-with-over-100-profit-growth-in-q4fy26/slideshow/130794277.cms,2026-05-04 17:08:35 IST,"​Several Nifty 500 companies reported over 100% year-on-year net profit growth in Q4FY26, reflecting strong earnings momentum. Firms like Eternal, India Cements, Kajaria Ceramics, and Chennai Petroleum led gains, showcasing improved profitability across sectors including finance, banking, and manufacturing.​",https://economictimes.indiatimes.com/markets/stocks/rssfeeds/2146843.cms
"US stock market today: Dow, S&amp;P 500 futures slip as renewed Middle East tensions lift oil prices",https://www.livemint.com/market/stock-market-news/us-stock-market-today-dow-s-p-500-futures-slip-as-renewed-middle-east-tensions-lift-oil-prices-11777895709011.html,2026-05-04 18:07:13 IST,"Investor anxiety surged as US stock futures fluctuated amid reports of a US warship incident near the Strait of Hormuz. While concerns over oil supply disruptions grow, April's robust corporate earnings helped maintain market momentum despite geopolitical risks.",https://www.livemint.com/rss/markets
"Carlyle buys majority stake in Knack, EqualizeRCM to build AI-led healthcare billing platform",https://www.livemint.com/companies/carlyle-buys-majority-stake-in-knack-equalizercm-ai-healthcare-rcm-us-11777894127555.html,2026-05-04 18:06:36 IST,"The private equity firm is betting on consolidation in a fragmented US billing services market, with plans to scale via acquisitions and global delivery",https://www.livemint.com/rss/companies
Citi appoints Raj Rathi as head of mergers &amp; acquisitions in India,https://www.livemint.com/companies/news/citi-india-raj-rathi-citi-investment-banking-11777895145900.html,2026-05-04 17:37:35 IST,"Rathi joins Citi from Dream Sports, where he served as head of strategy and corporate development.",https://www.livemint.com/rss/companies
Central Bank of India expects limited impact from new provisioning rules,https://www.livemint.com/companies/news/central-bank-of-india-q4fy26-central-bank-share-price-rbi-ecl-norms-11777872437055.html,2026-05-04 17:25:30 IST,"Central Bank of India managing director and CEO Kalyan Kumar says it is well buffered against the RBI’s shift to stricter, forward-looking loan-loss provisioning, with existing provisions and strong capital expected to absorb any transition impact,",https://www.livemint.com/rss/companies
"Safe personal loan EMI on  ₹30,000 salary: Simple budgeting tips explained",https://www.livemint.com/money/personal-finance/safe-personal-loan-emi-on-30-000-salary-simple-budgeting-tips-explained-11777896183850.html,2026-05-04 18:45:49 IST,"Understanding borrowing fundamentals is vital for personal loans. Keeping EMIs at 20-25% of income ensures financial stability. High EMIs risk missed payments, which negatively impact credit scores. Seek professional advice for sustainable financial planning.",https://www.livemint.com/rss/money
Can cancelling a credit card hurt your score? Here's how to minimise the impact on your credit history,https://www.livemint.com/money/personal-finance/can-cancel-credit-card-hurt-your-credit-score-how-minimise-impact-credit-history-money-personal-finance-loan-borrowers-11777895582460.html,2026-05-04 18:37:38 IST,"A strong credit score is necessary to show lenders that you are a reliable borrower, and first timers or young customers may wonder if closing your credit card could affect this number. Here's how you should manage card closures to protect your credit history…",https://www.livemint.com/rss/money
I-T returns: Want to verify if your Income-Tax notice is authentic? Here's a stepwise guide for how to do so,https://www.livemint.com/money/personal-finance/it-returns-want-to-verify-if-your-income-tax-notice-is-authentic-heres-a-stepwise-guide-for-how-to-do-so-11777890666525.html,2026-05-04 17:17:46 IST,"Filing income tax returns online has simplified the process, but it can confuse first-time taxpayers. Income Tax Notices inform taxpayers of issues like unreported income or discrepancies. Here's how you can verify a notice's authenticity.",https://www.livemint.com/rss/money
5 reasons strong savings rate matters more than market returns in building a secure and sustainable retirement plan,https://www.livemint.com/money/personal-finance/5-reasons-strong-savings-rate-matters-more-than-market-returns-in-building-a-secure-and-sustainable-retirement-plan-11777892346801.html,2026-05-04 17:13:11 IST,"A disciplined savings rate drives retirement planning by boosting compounding, reducing risk, and ensuring financial security, helping individuals build a stable, sustainable long-term wealth corpus.",https://www.livemint.com/rss/money
"Berkshire shares trade higher as Buffett successor Abel scores good marks at meeting, earnings jump",https://www.cnbc.com/2026/05/04/berkshire-shares-trade-higher-as-buffett-successor-abel-scores-good-marks-at-meeting-earnings-jump.html,2026-05-04 18:35:45 IST,Many in the investment community were reassured by Abel's firm grasp over Berkshire's sprawling enterprise.,https://www.cnbc.com/id/10000664/device/rss/rss.html
Weekly Top Picks: These stocks scored 10 on 10 on Stock Reports Plus,https://economictimes.indiatimes.com/markets/stocks/news/weekly-top-picks-these-stocks-scored-10-on-10-on-stock-reports-plus/articleshow/130805543.cms,2026-05-04 21:12:44 IST,"Stock Reports Plus, powered by Refinitiv, undertakes detailed company analysis for 4,000+ listed stocks. In addition to detailed company analyses, the report also collates analysts’ forecasts and trend analysis for each component. An average score in Stock Reports Plus is calculated by undertaking quantitative analysis of five key investment tools – earnings, fundamentals, relative valuation, risk, and price momentum.",https://economictimes.indiatimes.com/markets/stocks/rssfeeds/2146843.cms
Ahead of Market: 10 things that will decide stock market action on Tuesday,https://economictimes.indiatimes.com/markets/stocks/news/ahead-of-market-10-things-that-will-decide-stock-market-action-on-tuesday/articleshow/130805242.cms,2026-05-04 20:59:00 IST,"Indian markets ended higher driven by positive election trends, with gains in financials, pharma, and metals. Nifty held above key support levels despite range-bound movement. Analysts see bullish momentum intact, though global cues remain weak and near-term consolidation is possible.",https://economictimes.indiatimes.com/markets/stocks/rssfeeds/2146843.cms
Market Trading Guide: 5 stock ideas for gains up to 11% on Tuesday,https://economictimes.indiatimes.com/markets/stocks/news/market-trading-guide-5-stock-ideas-for-gains-up-to-11-on-tuesday/slideshow/130805083.cms,2026-05-04 20:33:35 IST,"Nifty ended higher amid positive election sentiment but faced resistance near 24,200. Analysts see support at 24,000, maintaining a bullish bias above key levels. Experts recommend selective trades, suggesting buying stocks like Adani Ports and Laurus Labs, while cautioning on CDSL weakness.",https://economictimes.indiatimes.com/markets/stocks/rssfeeds/2146843.cms
GameStop shares drop 6.5% after ambitious $55.5 billion bid for eBay,https://www.livemint.com/market/stock-market-news/gamestop-shares-drop-6-5-after-ambitious-55-5-billion-bid-for-ebay-11777905572087.html,2026-05-04 20:43:13 IST,"GameStop's shares fell 6.5% to $24.80 after proposing a $55.5 billion takeover of eBay. Investors are sceptical of the half-cash, half-stock deal, despite eBay's shares rising 6%. GameStop plans cost reductions to enhance eBay's earnings, while CEO Ryan Cohen may pursue a proxy fight if necessary.",https://www.livemint.com/rss/markets
"Wall Street mixed as Middle East tensions escalate, Tyson Foods dips 2.2%, eBay jumps 5.6%",https://www.livemint.com/market/stock-market-news/wall-street-falls-on-heightened-anxieties-over-middle-east-conflict-11777902033717.html,2026-05-04 19:22:13 IST,"As of 10:30 a.m. Eastern Time, The S&amp;amp;P 500 rose 0.1%, the Dow Jones Industrial Average was down 0.2%, and the Nasdaq Composite was 0.1% higher",https://www.livemint.com/rss/markets
"Small-cap stock under  ₹50 hits upper circuit for 13th straight session, declares  ₹500 crore fundraise move",https://www.livemint.com/market/stock-market-news/smallcap-stock-under-rs-50-hits-upper-circuit-for-13th-straight-session-declares-rs-500-crore-fundraise-move-11777901327006.html,2026-05-04 19:18:54 IST,"AVI Polymers shares surged to  ₹20.95, driven by a consistent upward trend. The company plans to raise  ₹500 crore and expand into technology services. Financial results reveal strong growth, with a net worth increase to  ₹115.99 crore by FY26's end.",https://www.livemint.com/rss/markets
Ambuja Cements resets expansion strategy as Karan Adani flags cost pressures and execution gaps,https://www.livemint.com/companies/company-results/ambuja-cements-strategy-reset-cost-cut-karan-adani-11777902648797.html,2026-05-04 21:22:30 IST,"Ambuja Cements said it would defer parts of growth plan, while prioritizing cost discipline and asset stabilization following FY26 revenue miss and margin pressure.",https://www.livemint.com/rss/companies
"Ather Energy cuts losses, moves closer to breakeven as FY26 revenue jumps on scale-up",https://www.livemint.com/companies/company-results/ather-moves-closer-to-breakeven-as-new-stores-boost-sales-across-india-11777901992158.html,2026-05-04 20:28:13 IST,"The electric two-wheeler maker cut its net loss to  ₹517 crore and pushed up revenue 66% in FY26, driven by strong volume growth and a rapidly expanding store network, even as commodity costs remain a drag.",https://www.livemint.com/rss/companies
"Godrej Properties targets  ₹39,000 crore in sales for FY27 after record-breaking year",https://www.livemint.com/companies/news/godrej-properties-targets-39-000-crore-in-sales-for-fy27-after-record-breaking-year-11777865433248.html,2026-05-04 19:39:25 IST,"In FY26, GPL's sales bookings rose 16% year-on-year to  ₹34,171 crore. That was achieved through the sale of 17,513 units spanning 27 million sq ft, the highest ever by an Indian real estate firm.",https://www.livemint.com/rss/companies
"Aadhaar gearing for ‘new look’? IT Ministry says no such plan, speculation ‘not correct’ — Here's all we know",https://www.livemint.com/money/personal-finance/aadhaar-gearing-for-new-look-hologram-colours-it-ministry-clarify-no-such-plans-speculation-not-correct-govt-all-we-know-11777906718877.html,2026-05-04 20:59:25 IST,"The IT Ministry clarifies that it has no plans for a “new look” for its Aadhaar cards, adding that such speculation is “not correct”. Here's what's new for the government's biometric ID so far in 2026.",https://www.livemint.com/rss/money
6 essential emergency fund rules every Indian household should know to stay debt-free,https://www.livemint.com/money/personal-finance/6-essential-emergency-fund-rules-every-indian-household-should-know-to-stay-debtfree-11777902763467.html,2026-05-04 20:40:20 IST,"Emergency fund rules help households build financial resilience. It is imperative to maintain 3–6 months' expenses, keeping funds separate, prioritising liquidity, starting small, refilling after use, and reviewing annually for stability.&amp;nbsp;",https://www.livemint.com/rss/money
Struggling with a credit score below 650? 6 simple ways to improve it and boost loan approval chances,https://www.livemint.com/money/personal-finance/struggling-with-a-credit-score-below-650-6-simple-ways-to-improve-it-and-boost-loan-approval-chances-11777900088903.html,2026-05-04 19:47:53 IST,"The strategy to improve a credit score below 650 focuses on timely EMI payments, reducing credit utilisation, limiting loan applications, clearing high-interest debts, maintaining old accounts, and regularly monitoring credit reports for accuracy.",https://www.livemint.com/rss/money
"Adani Ports, Tata Motors and Siemens Energy witness block deal action on Monday",https://economictimes.indiatimes.com/markets/stocks/news/adani-ports-tata-motors-and-siemens-energy-witness-block-deal-action-on-monday/articleshow/130806797.cms,2026-05-04 22:07:01 IST,"Institutional investors injected over Rs 7,400 crore into Adani Ports and Special Economic Zone (APSEZ) on Monday through significant block deals. Capital Group entities were major buyers, acquiring stakes from Worldwide Emerging Market Holding Limited. Smaller block deals also occurred in Tata Motors and Siemens Energy India.",https://economictimes.indiatimes.com/markets/stocks/rssfeeds/2146843.cms
"Two Trades for Today: A financial services major for an upmove of 7.85%, a mid-cap pharma stock for an almost 7% rise",https://economictimes.indiatimes.com/markets/stocks/news/two-trades-for-today-a-financial-services-major-for-an-upmove-of-7-85-a-mid-cap-pharma-stock-for-an-almost-7-rise/articleshow/130805927.cms,2026-05-04 21:36:58 IST,Our technical analysts identify select stocks every trading day that may gain momentum even in volatile markets. Here are the technical calls for today.,https://economictimes.indiatimes.com/markets/stocks/rssfeeds/2146843.cms
Dynacons Systems shares to be in focus on Tuesday as company bags  ₹751 crore private cloud order from RBI,https://www.livemint.com/market/stock-market-news/dynacons-systems-shares-to-be-in-focus-on-tuesday-as-company-bags-rs-751-crore-private-cloud-order-from-rbi-11777914978351.html,2026-05-04 23:00:49 IST,"Dynacons has won a major  ₹751 crore contract from the Reserve Bank of India for private cloud infrastructure at its new Odisha facility. The shares staged a strong comeback in April, surging 39% after closing lower in two of the previous three months.",https://www.livemint.com/rss/markets
"Gold, silver rates today: Comex gold drops $134/oz; silver tumbles $4/oz on oil-led inflation fears, firm US dollar",https://www.livemint.com/market/commodities/gold-silver-rates-today-comex-gold-drops-134-oz-silver-tumbles-4-oz-on-oil-led-inflation-fears-firm-us-dollar-11777909638791.html,2026-05-04 22:19:00 IST,"Gold and silver prices fell sharply on 4 May, with gold dropping to $4,681 and silver to $72 due to rising crude oil prices and a stronger US dollar. Tensions in the Middle East further fuelled inflation concerns, impacting investor sentiment on precious metals.",https://www.livemint.com/rss/markets
"Bank FDs earn up to 7.75% in May 2026! Check latest interest rate — Compare SBI, HDFC, ICICI and Yes Bank fixed deposits",https://www.livemint.com/money/personal-finance/bank-fixed-deposits-earn-upto-7-75-pc-may-2026-compare-latest-fds-interest-rate-sbi-hdfc-bank-icici-yes-kotak-mahindra-11777911996534.html,2026-05-04 22:26:05 IST,"FD rates comparison: Here's a look at the latest bank fixed deposit rates offered by the biggest lenders State Bank of India, ICICI Bank, HDFC Bank, Kotak Mahindra Bank and Yes Bank.",https://www.livemint.com/rss/money
"Traffic in the Strait of Hormuz won’t return to normal until August or later, according to Kalshi traders",https://www.cnbc.com/2026/05/04/strait-of-hormuz-traffic-disrupted-until-september-kalshi-traders-say.html,2026-05-04 22:16:52 IST,"With a lack of a breakthrough in negotiations between the U.S. and Iran, traders increasingly see traffic returning to normal later and later.",https://www.cnbc.com/id/10000664/device/rss/rss.html
"Anthropic teams with Goldman, Blackstone and others on $1.5 billion AI venture targeting PE-owned firms",https://www.cnbc.com/2026/05/04/anthropic-goldman-blackstone-ai-venture.html,2026-05-04 22:16:31 IST,The move marks Anthropic's latest effort to deepen its lead in the market for enterprise AI as competition intensifies with rivals including OpenAI,https://www.cnbc.com/id/10000664/device/rss/rss.html
These large-caps have ‘strong buy’ &amp; ‘buy’ recos and an upside potential of up to 25%,https://economictimes.indiatimes.com/markets/stocks/news/these-large-caps-have-strong-buy-buy-recos-and-an-upside-potential-of-up-to-25/articleshow/130808233.cms,2026-05-04 23:04:13 IST,"We are living in  times when the morning may see conciliatory exchanges between the US and Iran, leading to a cooling in crude oil prices. But by afternoon, the tone changes and we see crude prices moving higher again. In such circumstances, it is probably better to think unconventionally. How does one do that at this point of time?",https://economictimes.indiatimes.com/markets/stocks/rssfeeds/2146843.cms
Blackstone’s Jon Gray Sees AI Creating ‘Huge Boom’ in Blue Collar Jobs,https://www.livemint.com/companies/blackstones-jon-gray-sees-ai-creating-huge-boom-in-blue-collar-jobs-11777919488058.html,2026-05-05 00:01:27 IST,Blackstone Inc. President Jon Gray said the boom in artificial intelligence will lead to a surge in blue-collar employment as asset managers like his shell out billions on data centers and other infrastructure.,https://www.livemint.com/rss/companies
"Income-tax returns: Forms, disclosures, details and documentation — Top 10 common mistakes to avoid while filing ITR",https://www.livemint.com/money/personal-finance/incometax-returns-forms-disclosures-details-and-documentation-top-10-common-mistakes-to-avoid-while-filing-itr-11777913993479.html,2026-05-04 23:23:13 IST,"From using appropriate forms, to making proper income disclosures, filling correct details and attaching documentation for proof — Here are the top 10 common mistakes to avoid while filing your returns.",https://www.livemint.com/rss/money
Kalshi traders see April jobs report coming in better than economists' estimates,https://www.cnbc.com/2026/05/04/kalshi-traders-see-april-jobs-report-coming-in-better-than-economists-estimates.html,2026-05-05 00:18:20 IST,"The figure is higher than consensus estimates for 57,000 jobs gained in April, according to analysts polled by FactSet.",https://www.cnbc.com/id/10000664/device/rss/rss.html
US yields climb as Iran conflict pushes up crude oil prices,https://www.livemint.com/market/us-yields-climb-as-iran-conflict-pushes-up-crude-oil-prices-11777923321834.html,2026-05-05 01:05:21 IST,"USA-BONDS/ (UPDATE 1, GRAPHICS):TREASURIES-US yields climb as Iran conflict pushes up crude oil prices",https://www.livemint.com/rss/markets
Dollar higher as US-Iran conflict keeps risk appetite muted,https://www.livemint.com/market/dollar-higher-as-us-iran-conflict-keeps-risk-appetite-muted-11777922707173.html,2026-05-05 00:55:06 IST,GLOBAL-FOREX:Dollar higher as US-Iran conflict keeps risk appetite muted,https://www.livemint.com/rss/markets
"AP, Reuters, Minnesota Star Tribune among Pulitzer winners for 2025 work",https://www.livemint.com/companies/ap-reuters-minnesota-star-tribune-among-pulitzer-winners-for-2025-work-11777922519215.html,2026-05-05 00:51:58 IST,"AP, Reuters, Minnesota Star Tribune among Pulitzer winners for 2025 work",https://www.livemint.com/rss/companies
Traders are doubtful Cohen's GameStop can pull off monster eBay acquisition,https://www.cnbc.com/2026/05/04/traders-are-doubtful-cohens-gamestop-can-pull-off-monster-ebay-acquisition.html,2026-05-05 01:00:48 IST,"Traders on Kalshi and Polymarket give the company just a 25% and 15% chance, respectively, of successfully buying the online marketplace.",https://www.cnbc.com/id/10000664/device/rss/rss.html
