title,link,published,summary,source
IndiGo share price to remain in focus today after CEO Pieter Elbers resigns,https://www.livemint.com/market/stock-market-news/indigo-share-price-to-remain-in-focus-today-after-ceo-pieter-elbers-resigns-11773193943051.html,2026-03-11 07:57:07 IST,"Stock in focus: On Tuesday, the multibagger aviation stock closed 3.46% higher at  ₹4,383.50 apiece on NSE.",https://www.livemint.com/rss/markets
"Stock Market Today LIVE: Sensex, Nifty 50 flat as US-Iran war fuels caution; Brent crude remains below $90",https://www.livemint.com/market/stock-market-news/sensex-today-share-market-live-updates-crude-oil-prices-sensex-nifty-stock-market-today-11032026-11773142516270.html,2026-03-11 07:38:05 IST,"Stock Market Today LIVE: The benchmark indices Sensex and Nifty remained muted on Wednesday after witnessing a strong rally in the previous session. During the day, markets are likely to remain sensitive to developments in West Asia and movements in crude prices.",https://www.livemint.com/rss/markets
"Nifty 50, Sensex today: What to expect from Indian stock market in trade on March 11",https://www.livemint.com/market/stock-market-news/nifty-50-sensex-today-what-to-expect-from-indian-stock-market-in-trade-on-march-11-11773160158658.html,2026-03-11 07:29:09 IST,"Nifty 50, Sensex today: The trends on Gift Nifty also indicate a weak start for the Indian benchmark index. The Gift Nifty was trading around 24,303 level, a discount of nearly 90 points from the Nifty futures’ previous close.",https://www.livemint.com/rss/markets
Breakout stocks to buy or sell: Sumeet Bagadia recommends five shares to buy today — 11 March 2026,https://www.livemint.com/market/stock-market-news/breakout-stocks-to-buy-or-sell-sumeet-bagadia-recommends-five-shares-to-buy-today-11-march-2026-11773192481204.html,2026-03-11 07:19:48 IST,"Breakout stocks to buy or sell: Sumeet Bagadia recommends five shares to buy today — Anupam Rasayan India, Schneider Electric Infrastructure, MM Forgings, Godawari Power and Ispat, and Aurobindo Pharma.",https://www.livemint.com/rss/markets
"Indian stock market: 10 key things that changed for market overnight - Gift Nifty, US-Iran war, oil prices to gold rates",https://www.livemint.com/market/stock-market-news/indian-stock-market-10-key-things-that-changed-for-market-overnight-gift-nifty-us-iran-war-oil-prices-to-gold-rates-11773160444918.html,2026-03-11 07:16:34 IST,"Gift Nifty was trading around 24,334 level, a discount of nearly 60 points from the Nifty futures’ previous close, indicating a negative start for the Indian stock market indices.",https://www.livemint.com/rss/markets
"Meta acquires viral Reddit-style AI-agent platform Moltbook, hires its creators",https://www.livemint.com/companies/news/meta-acquires-moltbook-the-viral-reddit-like-ai-agent-only-platform-hires-its-creators-matt-schlicht-ben-parr-11773197126661.html,2026-03-11 08:32:54 IST,Meta has acquired the viral AI only social media platform Moltbook. The platform's creators Matt Schlicht and Ben Parr will be joining the Meta Superintelligence team led by Alexandr Wang.,https://www.livemint.com/rss/companies
"Volkswagen Layoffs: Carmaker to cut 50,000 jobs in Germany as profit falls, EV business faces pressure",https://www.livemint.com/companies/news/volkswagen-layoffs-carmaker-to-cut-50-000-jobs-in-germany-as-profit-falls-ev-business-faces-pressure-11773193480222.html,2026-03-11 07:27:23 IST,"Volkswagen announced it will cut 50,000 jobs in Germany by 2030 due to declining profits, among other reasons. Here's what we know so far.&amp;nbsp;",https://www.livemint.com/rss/companies
Air India to levy fuel surcharge: Full region-wise price hike list and implementation timeline,https://www.livemint.com/companies/news/air-india-to-levy-fuel-surcharge-full-region-wise-price-hike-list-and-implementation-timeline-11773189607895.html,2026-03-11 07:23:42 IST,US-Iran war: Air India announced a phased increase in fuel surcharges for both domestic and international flights due to rising jet fuel prices. Full details here.&amp;nbsp;,https://www.livemint.com/rss/companies
Reports of my death are greatly exaggerated! Why Nuvama is screaming buy on all top 10 IT stocks,https://economictimes.indiatimes.com/markets/stocks/news/reports-of-my-death-are-greatly-exaggerated-why-nuvama-is-screaming-buy-on-all-top-10-it-stocks/articleshow/129440142.cms,2026-03-11 11:05:08 IST,"Nuvama says fears that Gen-AI will cripple India’s IT services model are overblown, invoking Mark Twain’s line that “reports of my death are greatly exaggerated.” After a sharp AI-driven selloff that pushed valuations to multi-year lows, the brokerage has upgraded all top 10 IT stocks to “BUY,” arguing the sector is poised for a comeback as AI services demand accelerates.",https://economictimes.indiatimes.com/markets/stocks/rssfeeds/2146843.cms
Don't miss this train: BofA upgrades Sona Comstar on 3 growth engines,https://economictimes.indiatimes.com/markets/stocks/news/dont-miss-this-train-bofa-upgrades-sona-comstar-on-3-growth-engines/articleshow/129439658.cms,2026-03-11 10:53:28 IST,"Sona Comstar shares surged over 4% after BofA Securities upgraded the stock to 'buy' with a Rs 640 target price. The brokerage anticipates strong growth driven by its traction motors, driveline business recovery, and an underappreciated railways segment, projecting a 24% upside.",https://economictimes.indiatimes.com/markets/stocks/rssfeeds/2146843.cms
Happiest Minds Tech shares zoom 35% in just 3 days! What’s behind the stellar surge?,https://economictimes.indiatimes.com/markets/stocks/news/happiest-minds-tech-shares-zoom-35-in-just-3-days-whats-behind-the-stellar-surge/articleshow/129439588.cms,2026-03-11 10:52:00 IST,"Happiest Minds Technologies rose sharply on Wednesday, extending gains to over 35% in three days, driven by a sharp upgrade in its FY27 growth outlook to 12.5% and strong traction from its AI First strategy. Management cited broad-based demand, improved pipelines and accelerating AI-led adoption across sectors as key factors behind the stock’s sharp rally.",https://economictimes.indiatimes.com/markets/stocks/rssfeeds/2146843.cms
"Adani Total Gas, GAIL &amp; other gas stocks rally up to 15% amid supply worries in India. Here's why",https://economictimes.indiatimes.com/markets/stocks/news/adani-total-gas-gail-other-gas-stocks-rally-up-to-15-amid-supply-worries-in-india-heres-why/articleshow/129438641.cms,2026-03-11 10:29:55 IST,"Gas stocks rallied sharply on Wednesday as investors bet the Iran–Israel conflict may ease, potentially relieving supply constraints. The rebound follows last week’s sharp fall triggered by escalating tensions. India continues to face a deepening gas crisis, with prices surging and the government prioritising PNG, CNG and LPG to ensure uninterrupted supply.",https://economictimes.indiatimes.com/markets/stocks/rssfeeds/2146843.cms
"Buy, Sell or Hold: Motilal Oswal initiates coverage on Jio Financial Services; recommends buy on Bikaji Foods",https://economictimes.indiatimes.com/markets/stocks/news/buy-sell-or-hold-motilal-oswal-initiates-coverage-on-jio-financial-services-recommends-buy-on-bikaji-foods/articleshow/129438060.cms,2026-03-11 10:21:02 IST,"Motilal Oswal Financial Services remains bullish on select stocks across consumer, metals and financial services sectors. The brokerage maintained a Buy rating on Bikaji Foods and JSW Steel and initiated coverage on Jio Financial Services with a Buy call, citing strong growth visibility, capacity expansion and long term structural opportunities.",https://economictimes.indiatimes.com/markets/stocks/rssfeeds/2146843.cms
"Jefferies raises Coal India target price, says valuation reasonable",https://economictimes.indiatimes.com/markets/stocks/news/jefferies-raises-coal-india-target-price-says-valuation-reasonable/articleshow/129437816.cms,2026-03-11 10:11:47 IST,"Jefferies has raised Coal India target to Rs 485, citing reasonable valuation and improving earnings. The brokerage forecasts 9% CAGR in FY26–28, supported by higher e-auction premiums, rising dispatch volumes, and a rebound in power demand. Coal India remains a cash-rich, high-dividend PSU stock with strong market share.",https://economictimes.indiatimes.com/markets/stocks/rssfeeds/2146843.cms
Trading is a serious pursuit: Why India needs to treat it like a profession,https://economictimes.indiatimes.com/markets/stocks/news/trading-is-a-serious-pursuit-why-india-needs-to-treat-it-like-a-profession/articleshow/129437370.cms,2026-03-11 10:03:06 IST,"When people think about investing in the stock market, they often associate it with two distinct horizons: long term wealth creation and short term profits.",https://economictimes.indiatimes.com/markets/stocks/rssfeeds/2146843.cms
IT stocks in focus after Oracle’s strong results; Nuvama says valuations now attractive after correction,https://economictimes.indiatimes.com/markets/stocks/news/it-stocks-in-focus-after-oracles-strong-results-nuvama-says-valuations-now-attractive-after-correction/articleshow/129436861.cms,2026-03-11 09:49:40 IST,"Indian IT stocks may remain in focus after Oracle reported stronger than expected quarterly results and raised its revenue outlook. Nuvama said the recent 20% correction in Indian IT stocks amid concerns over AI disruption has made valuations attractive, though near term volatility may continue as the industry adapts to Gen AI.",https://economictimes.indiatimes.com/markets/stocks/rssfeeds/2146843.cms
Nazara Tech shares jump 4% as Morgan Stanley acquires stake worth Rs 69 crore via block deal,https://economictimes.indiatimes.com/markets/stocks/news/nazara-tech-shares-in-focus-as-morgan-stanley-acquires-stake-worth-rs-69-crore-via-block-deal/articleshow/129436496.cms,2026-03-11 09:39:40 IST,"Nazara Technologies shares surged 4% after Morgan Stanley Asia Singapore Pte acquired shares worth Rs 69.2 crore in a block deal. The gaming company, India's only listed one, reported strong Q3FY26 operational performance with revenue of Rs 406 crore and EBITDA rising 29% year-on-year.",https://economictimes.indiatimes.com/markets/stocks/rssfeeds/2146843.cms
Happiest Minds among 5 stocks showing bullish RSI upswing,https://economictimes.indiatimes.com/markets/stocks/news/happiest-minds-among-5-stocks-showing-bullish-rsi-upswing/slideshow/129436324.cms,2026-03-11 09:31:20 IST,"On March 10, five stocks from the Nifty500 universe entered the RSI Trending Up scan after gaining over 10%, according to StockEdge data. Their RSI readings moved above the 50 mark from lower levels, signalling improving price momentum and strengthening buying interest, a technical indicator that traders track for potential bullish continuation.",https://economictimes.indiatimes.com/markets/stocks/rssfeeds/2146843.cms
"​Authum Investment among 5 stocks flashing bullish signals, hinting at a possible uptrend",https://economictimes.indiatimes.com/markets/stocks/news/authum-investment-among-5-stocks-flashing-bullish-signals-hinting-at-a-possible-uptrend/slideshow/129436015.cms,2026-03-11 09:17:14 IST,"Five Nifty500 stocks gained more than 6% on March 10 and formed the bullish White Marubozu candlestick pattern, according to StockEdge technical scan data. The pattern signals strong buying pressure throughout the session and is often interpreted by traders as an indication of continued bullish momentum in the market.",https://economictimes.indiatimes.com/markets/stocks/rssfeeds/2146843.cms
"Gold Rate Today: Check the live price of 22K, 24K and 18K gold prices on 11 March 2026",https://www.livemint.com/market/gold-rate-today-check-the-live-price-of-22k-24k-and-18k-gold-prices-on-11-march-2026-11773202176431.html,2026-03-11 10:57:51 IST,"Gold prices today: Check how much gold prices have changed in Mumbai, Bengaluru, Chennai, Hyderabad, Delhi and Kolkata on Friday, 12 November.",https://www.livemint.com/rss/markets
"Shares to buy or sell: Ruchit Jain of Motilal Oswal recommends ABB India, Astral stock to buy today - 11 March",https://www.livemint.com/market/stock-market-news/shares-to-buy-or-sell-ruchit-jain-of-motilal-oswal-recommends-abb-india-astral-stock-to-buy-today-11-march-11773205694069.html,2026-03-11 10:55:17 IST,"On Wednesday, the Nifty 50 and Sensex fell by 0.7% and 0.8%, respectively, amid Middle East tensions affecting investor sentiment and oil prices. Analysts suggest that crude oil fluctuations are shaping market movements, with a focus on selective stock buying for potential gains.",https://www.livemint.com/rss/markets
"Rajputana Stainless IPO Day 3: Last day to buy; check GMP, subscription status, and key details - Apply or not?",https://www.livemint.com/market/ipo/rajputana-stainless-ipo-day-3-last-day-to-buy-check-ipo-gmp-subscription-status-and-key-details-apply-or-not-11773205031397.html,2026-03-11 10:43:04 IST,"Rajputana Stainless IPO opened on March 9 and closes today, aiming to raise  ₹255 crore. The price band is set at  ₹116-122 per share. Investor sentiment is muted with a grey market premium of  ₹1. Subscription status shows limited interest across various categories.",https://www.livemint.com/rss/markets
Innovision IPO Day 2: Issue sees tepid demand as GMP remains weak. Should you apply or not?,https://www.livemint.com/market/ipo/innovision-ipo-day-2-issue-sees-tepid-demand-as-gmp-remains-weak-should-you-apply-or-not-11773203270184.html,2026-03-11 10:04:26 IST,"Innovision IPO GMP today is nil. This means that shares of Innovision are trading at par with the IPO price. At the prevailing GMP, Innovision IPO listing price will be the same as the offer price. Shares of Innovision IPO are slated to list on both BSE and NSE on March 17.",https://www.livemint.com/rss/markets
"SEDEMAC Mechatronics share price lists at  ₹1,535 on NSE — premium of 13.54% over IPO price",https://www.livemint.com/market/stock-market-news/ipo-listing-sedemac-mechatronics-share-price-makes-lists-at-rs-1-535-on-nse-a-premium-of-13-54-from-ipo-price-11773202222451.html,2026-03-11 10:00:05 IST,"SEDEMAC Mechatronics shares debuted strongly on March 11, listing at  ₹1,535 on NSE, a 13.54% premium. The IPO was subscribed 2.68 times, raising  ₹1,087.45 crore. The company focuses on control electronics and innovative motor control technologies for automotive applications.",https://www.livemint.com/rss/markets
"TTK Prestige, Gandhimathi, Stove Kraft shares jump up to 15% amid gas supply shortage. Here's why",https://www.livemint.com/market/stock-market-news/ttk-prestige-gandhimathi-stove-kraft-shares-jump-up-to-15-amid-gas-supply-shortage-heres-why-11773202360008.html,2026-03-11 09:47:19 IST,"Shares of TTK Prestige, Gandhi Mathi Appliances, and Stovecraft rose by up to 15% due to LPG shortages in cities like Mumbai and Bengaluru, boosting demand for induction stoves. Market analysts believe consumers may shift to electric appliances, positively impacting these companies.",https://www.livemint.com/rss/markets
Why is IndiGo share price rising 3% despite CEO Pieter Elbers' resignation? Explained,https://www.livemint.com/market/stock-market-news/why-is-indigo-share-price-rising-3-despite-ceo-pieter-elbers-resignation-explained-11773201660623.html,2026-03-11 09:46:46 IST,"IndiGo share price: Shares of InterGlobe Aviation, parent company of the budget carrier IndiGo, surged as much as 2.61% to  ₹4,494.60 apiece in Wednesday's trading session.",https://www.livemint.com/rss/markets
This Ambani-owned stock's market cap slips below cash balance. Is it a deep value pick?,https://economictimes.indiatimes.com/markets/stocks/news/this-ambani-owned-stocks-market-cap-slips-below-cash-balance-is-it-a-deep-value-pick/articleshow/129442903.cms,2026-03-11 12:04:43 IST,"JustDial's market capitalization has fallen below its cash reserves, prompting questions about its valuation. Despite a significant drop in share price, the company's strategy for deploying its substantial cash holding remains unclear. Investors are advised to await a defined capital allocation policy before considering it a value pick.",https://economictimes.indiatimes.com/markets/stocks/rssfeeds/2146843.cms
This Ambani-owned stock's market cap slips below cash balance. Is it a deep value pick?,https://economictimes.indiatimes.com/markets/stocks/news/this-ambani-owned-stocks-market-cap-slips-below-cash-balance-is-it-a-deep-value-pick/articleshow/129443055.cms,2026-03-11 12:03:03 IST,"JustDial's market capitalization has fallen below its cash reserves, prompting questions about its valuation. Despite a significant drop in share price, the company's strategy for deploying its substantial cash holding remains unclear. Investors are advised to await a defined capital allocation policy before considering it a value pick.",https://economictimes.indiatimes.com/markets/stocks/rssfeeds/2146843.cms
Cupid shares plunge 6% after 15% rally over two days: What lies ahead?,https://economictimes.indiatimes.com/markets/stocks/news/cupid-shares-plunge-6-after-15-rally-over-two-days-what-lies-ahead/articleshow/129440911.cms,2026-03-11 11:22:45 IST,"Cupid shares experienced a dip on Wednesday  after a two-day rally that drove the stock 15% higher after the company's 4:1 bonus issue.  In January this year, Cupid announced its board of directors had approved the issue of bonus shares in the ratio of 4:1. The company had set March 9 as the record date to determine the eligibility of shareholders to receive the bonus shares.",https://economictimes.indiatimes.com/markets/stocks/rssfeeds/2146843.cms
"Sensex crashes over 1,000 points; Nifty 50 drops below 24,000— 5 key factors behind market fall explained",https://www.livemint.com/market/stock-market-news/sensex-crashes-over-1-000-points-nifty-50-drops-below-24-000-why-is-the-stock-market-falling-explained-11773210747016.html,2026-03-11 12:11:17 IST,"The 30-share pack Sensex crashed over 1,000 points, or 1.3%, to fall to an intraday low of 77,161, while the NSE counterpart Nifty 50 touched the day's low of 23,971.60, falling 1.20%.",https://www.livemint.com/rss/markets
"Apsis Aerocom IPO day 1: GMP, subscription status, price, other key details of SME IPO in 10 points",https://www.livemint.com/market/ipo/apsis-aerocom-ipo-day-1-gmp-subscription-status-price-other-key-details-of-sme-ipo-in-10-points-11773207702572.html,2026-03-11 11:59:08 IST,"Apsis Aerocom IPO opened for public subscription on Wednesday, March 11. Apsis Aerocom said it had raised over  ₹10 crore from anchor investors by allocating 9,15,600 shares at a price of  ₹110 per share.",https://www.livemint.com/rss/markets
"Adani Total Gas to Gujarat Gas, GAIL: Gas stocks surge up to 15% as US-Iran conflict raises supply concerns",https://www.livemint.com/market/stock-market-news/adani-total-gas-to-gujarat-gas-gail-gas-stocks-surge-up-to-15-as-us-iran-conflict-raises-supply-concerns-11773208894917.html,2026-03-11 11:48:51 IST,"The US-Iran conflict escalates, affecting global gas prices and supply routes, particularly through the Strait of Hormuz. Domestic gas prices in India have surged, with stock gains in gas companies. Despite President Trump's optimism about sanctions, risks remain high as tensions continue.",https://www.livemint.com/rss/markets
SRF to Asian Paints - Jay Thakkar suggests 3 stocks to buy or sell for short-term in F&amp;O segment,https://www.livemint.com/market/stock-market-news/srf-to-asian-paints-jay-thakkar-suggests-3-stocks-to-buy-or-sell-for-short-term-in-f-o-segment-11773208649264.html,2026-03-11 11:48:28 IST,"The Nifty 50 and Sensex declined on Wednesday, influenced by geopolitical tensions in the Middle East and fluctuating oil prices. Despite recent losses, Nifty 50 closed above 24,000, with analysts predicting potential rebounds if support holds at this level.",https://www.livemint.com/rss/markets
"Gold-silver ratio can rise to 70-72 zone, says Tata Mutual Fund: What does it mean for investors?",https://www.livemint.com/market/commodities/goldsilver-ratio-can-rise-to-70-72-zone-says-tata-mutual-fund-what-does-it-mean-for-investors-11773208585564.html,2026-03-11 11:37:01 IST,"Gold–silver ratio has rebounded to around 56 after earlier falling to multi-year lows, signalling that gold has recently started outperforming silver, according to Tata Mutual Fund. Looking ahead, the fund house expects the ratio to mean-revert toward the 70–72 range.",https://www.livemint.com/rss/markets
"IT sector valuations highly attractive after 21% YTD slump; Coforge, Infosys, TCS among top IT stocks to buy: Nuvama",https://www.livemint.com/market/stock-market-news/it-sector-valuations-highly-attractive-after-21-ytd-slump-coforge-infosys-tcs-among-top-it-stocks-to-buy-nuvama-11773207461883.html,2026-03-11 11:21:58 IST,"Indian IT stocks have undergone massive value erosion over the last few months amid fears of Gen-AI affecting the long-term business model of sectoral companies. The Nifty IT index has plunged 21% YTD, with large-cap IT stocks falling 20% and midcaps IT stocks correcting 25% over the same period.",https://www.livemint.com/rss/markets
"Oil shock, market jitters: What West Asia tensions mean for investors",https://www.livemint.com/money/personal-finance/oil-shock-market-jitters-west-asia-tensions-investors-markets-gold-fii-cash-portfolios-11773197674885.html,2026-03-11 12:07:33 IST,"Oil spikes, FII selling and geopolitical tensions have shaken markets and retail portfolios. Experts say investors should stay disciplined, deploy cash gradually and rebalance portfolios if allocations have drifted.&amp;nbsp;",https://www.livemint.com/rss/money
Global ETF premiums soar. Should investors wait or buy?,https://www.livemint.com/money/personal-finance/etf-india-global-stocks-equity-schemes-overseas-investment-sebi-rbi-mutual-funds-11773140523245.html,2026-03-11 11:36:28 IST,Global equity schemes allow investors to tap opportunities across markets worldwide. Strong demand has pushed international ETFs to trade at a premium to domestic ETFs. Should Indian investors still buy in?,https://www.livemint.com/rss/money
Adani Energy Raises $500 Million Bilateral Debt from Apollo,https://economictimes.indiatimes.com/markets/stocks/news/adani-energy-raises-500-million-bilateral-debt-from-apollo/articleshow/129446348.cms,2026-03-11 13:07:15 IST,"A unit of Adani Group raised about $500 million through a bond privately placed with funds managed by Apollo Global Management Inc., according to people familiar with the matter, highlighting the Indian conglomerate’s ongoing effort to tap funding outside the public dollar bond market.",https://economictimes.indiatimes.com/markets/stocks/rssfeeds/2146843.cms
"Sedemac Mechatronics shares jump 19% over IPO price on debut. Buy, sell or hold?",https://economictimes.indiatimes.com/markets/stocks/news/sedemac-mechatronics-shares-jump-19-over-ipo-price-on-debut-buy-sell-or-hold/articleshow/129444619.cms,2026-03-11 12:34:03 IST,"Sedemac Mechatronics shares surged over 19% on their market debut, exceeding grey market expectations despite muted subscription from retail and NII investors. Analysts remain cautiously positive, advising short-term traders to maintain a stop-loss at Rs 1,420 and long-term investors at Rs 1,320, citing potential near-term volatility.",https://economictimes.indiatimes.com/markets/stocks/rssfeeds/2146843.cms
"Jio Financial Services shares can rally 36%, says Motilal Oswal after initiating coverage with Buy. Here are 4 pillars of growth",https://economictimes.indiatimes.com/markets/stocks/news/jio-financial-services-shares-can-rally-36-says-motilal-oswal-after-initiating-coverage-with-buy-here-are-4-pillars-of-growth/articleshow/129443932.cms,2026-03-11 12:25:53 IST,"Jio Financial Services shares surged after Motilal Oswal initiated coverage with a 'Buy' rating and a Rs 320 target price, citing a 36% upside potential. The brokerage highlighted the company's ecosystem-led advantage, leveraging Jio's massive subscriber base and retail footprint for low-cost customer acquisition and hyper-personalized credit underwriting.",https://economictimes.indiatimes.com/markets/stocks/rssfeeds/2146843.cms
Rupee tailwind vs AI scare: Are India's beaten-down IT stocks attractive enough to buy amid US-Iran war?,https://economictimes.indiatimes.com/markets/stocks/news/rupee-tailwind-vs-ai-scare-are-indias-beaten-down-it-stocks-attractive-enough-to-buy-amid-us-iran-war/articleshow/129443246.cms,2026-03-11 12:07:54 IST,"Indian IT stocks are facing a dual challenge. Fears of artificial intelligence disrupting traditional outsourcing models are weighing on the sector. However, geopolitical tensions and a weaker rupee are providing unexpected support. Analysts are divided on whether current valuations offer attractive entry points for long-term investors. The sector is at a crossroads, with a structural transition underway.",https://economictimes.indiatimes.com/markets/stocks/rssfeeds/2146843.cms
"Penny stock under Re 1 hits upper circuit on dividend, expansion plans",https://www.livemint.com/market/stock-market-news/penny-stock-under-re-1-pulsar-international-share-pric-hits-upper-circuit-on-dividend-expansion-plans-11773213721815.html,2026-03-11 13:01:12 IST,Penny stock under Re 1: Pulsar International share price has fallen 30% in one month and has declined 54% on a year-to-date (YTD) basis. The penny stock has plunged 66% in six months and has dropped 92% in one year.,https://www.livemint.com/rss/markets
Input cost shock may puncture tyre sector margins,https://www.livemint.com/market/mark-to-market/tyre-stocks-india-rubber-prices-crude-oil-iran-war-jk-tyre-ceat-mrf-apollo-tyres-11773210248623.html,2026-03-11 12:59:29 IST,The downside risks to the tyre sector’s profitability have increased and may rise further if the ongoing West Asia conflict prolongs,https://www.livemint.com/rss/markets
