title,link,published,summary,source
Pre-market action: Here's the trade setup for today's session,https://economictimes.indiatimes.com/markets/stocks/news/pre-market-action-heres-the-trade-setup-for-todays-session/articleshow/131473831.cms,2026-06-03 06:52:39 IST,Indian stocks saw a slight recovery on Tuesday. The Nifty index rose by 0.4%. Analysts expect the market to trade within a range due to global uncertainty and foreign investor selling. Investor focus remains on the RBI monetary policy. IT stocks are also in the spotlight due to positive AI commentary and global tech strength.,https://economictimes.indiatimes.com/markets/stocks/rssfeeds/2146843.cms
"Stocks in news: Alkem Labs, Vedanta, Canara Bank, NHPC, Adani Ports",https://economictimes.indiatimes.com/markets/stocks/news/stocks-in-news-alkem-labs-vedanta-canara-bank-nhpc-adani-ports/articleshow/131473809.cms,2026-06-03 06:47:44 IST,"Markets closed higher on weekly expiry day despite volatility, with Nifty showing signs of recovery but facing resistance around 23,800-24,000. Key stocks like Alkem Labs, Vedanta, Canara Bank, NHPC, and Adani Ports are in focus due to significant corporate developments including block deals, ED visits, capital raising plans, oversubscribed OFS, and strong cargo volumes.",https://economictimes.indiatimes.com/markets/stocks/rssfeeds/2146843.cms
Sebi panel weighs cap on clearing house dividends,https://economictimes.indiatimes.com/markets/stocks/news/sebi-panel-weighs-cap-on-clearing-house-dividends/articleshow/131473664.cms,2026-06-03 06:08:57 IST,Regulators are considering new rules for stock exchanges. A plan to limit dividends from clearing houses is gaining traction. Other proposals aim to bolster the financial health of these crucial market entities. These measures seek to enhance stability in the securities market. Discussions are ongoing to finalize these important changes.,https://economictimes.indiatimes.com/markets/stocks/rssfeeds/2146843.cms
Godrej Industries launches wealth management company,https://economictimes.indiatimes.com/markets/stocks/news/godrej-industries-launches-wealth-management-company/articleshow/131473655.cms,2026-06-03 06:03:17 IST,"Godrej Industries has launched Godrej Wealth, its new wealth management arm, targeting ₹1 lakh crore in assets under management by 2031. The platform will cater to affluent and high net worth individuals with investable assets of ₹2 crore and above.",https://economictimes.indiatimes.com/markets/stocks/rssfeeds/2146843.cms
"These 7 private and public banking stocks have an upside of up to 23% in one year, according to analysts",https://economictimes.indiatimes.com/markets/stocks/news/these-7-private-and-public-banking-stocks-have-an-upside-of-up-to-23-in-one-year-according-to-analysts/articleshow/131473592.cms,2026-06-03 05:50:06 IST,"Given how the market has moved in the last five-six trading sessions, the probability is high that a new readjustment trade has started. This trade takes into account the second- and third-order impact of rising crude oil prices, as also a poor monsoon that could play spoilsport for the Indian economy. What does this mean for the banking sector? Check out Stock Reports Plus, powered by Refinitiv, for price targets of over 4,000 listed stocks along with detailed company analysis focusing on five key components ,earnings, fundamentals, relative valuation, risk, and price momentum, to generate standardised scores. SR+ Reports is a complimentary offering to ETPrime members.",https://economictimes.indiatimes.com/markets/stocks/rssfeeds/2146843.cms
"NHPC offer plugs into green energy appeal, more suited for patient play",https://economictimes.indiatimes.com/markets/stocks/news/nhpc-offer-plugs-into-green-energy-appeal-more-suited-for-patient-play/articleshow/131473563.cms,2026-06-03 05:37:20 IST,NHPC's offer for sale is underway. Analysts suggest it offers long-term potential for patient investors. The government is divesting up to 6% of its stake. The offer opened for non-retail investors with strong demand. The floor price is set at ₹71 per share. This move aligns with global energy security focus and domestic clean energy infrastructure investments.,https://economictimes.indiatimes.com/markets/stocks/rssfeeds/2146843.cms
"Nifty IT logs best run in a year at 4%; TCS, Infosys lead way",https://economictimes.indiatimes.com/markets/stocks/news/nifty-it-logs-best-run-in-a-year-at-4-tcs-infosys-lead-way/articleshow/131473557.cms,2026-06-03 05:29:09 IST,Indian IT stocks surged for a third consecutive day. The Nifty IT index saw its largest single-day gain in a year. This rally is supported by improving global software sentiment and expanding enterprise AI adoption. Factors like rupee depreciation and strong orderbooks also contribute. Analysts anticipate further upward movement in the IT benchmark.,https://economictimes.indiatimes.com/markets/stocks/rssfeeds/2146843.cms
ED investigates Vedanta Group for FEMA violations,https://economictimes.indiatimes.com/markets/stocks/news/ed-investigates-vedanta-group-for-fema-violations/articleshow/131473642.cms,2026-06-03 01:07:20 IST,"A Vedanta spokesperson said the company was cooperating with the authorities. ""We are extending full cooperation to the authorities and are providing all information sought. The company remains committed to compliance with all applicable laws and regulations. As the matter is currently under regulatory process, we are unable to comment further at this stage,"" the spokesperson said. -Our Bureau",https://economictimes.indiatimes.com/markets/stocks/rssfeeds/2146843.cms
Retail loan stress is the new growth driver for ARCs,https://economictimes.indiatimes.com/markets/stocks/news/retail-loan-stress-is-the-new-growth-driver-for-arcs/articleshow/131473618.cms,2026-06-03 00:52:33 IST,"During 2025-26, ARCs acquired stressed debt worth more than Rs 2 lakh crore, comprising Rs 1.5 lakh crore of corporate loans and Rs 50,000 crore of retail assets. Retail acquisitions increased Rs 54,727 crore year-on-year, while corporate acquisitions expanded Rs 1.5 lakh crore.",https://economictimes.indiatimes.com/markets/stocks/rssfeeds/2146843.cms
IndusInd Bank faces fresh whistleblower allegations,https://economictimes.indiatimes.com/markets/stocks/news/indusind-bank-faces-fresh-whistleblower-allegations/articleshow/131473610.cms,2026-06-03 00:39:51 IST,"The complaint, a copy of which was seen by ET, was also sent to the Serious Fraud Investigation Office (SFIO), National Financial Reporting Authority (NFRA) and other agencies. It alleges insider trading by Samir Agarwal, former zonal head of eastern India at IndusInd Bank, manipulation of financial records, evergreening of microfinance loans, suppression of audit findings and attempts by senior management and board members to conceal irregularities.",https://economictimes.indiatimes.com/markets/stocks/rssfeeds/2146843.cms
Regional curbs dampen microfin revival in South India as biz looks up,https://economictimes.indiatimes.com/markets/stocks/news/regional-curbs-dampen-microfin-revival-in-south-as-biz-looks-up/articleshow/131473603.cms,2026-06-03 00:30:02 IST,"Tamil Nadu saw a 2.3% quarter-on-quarter squeeze in the state's microfinance outstanding portfolio to Rs 38,900 crore at the end of March, while Karnataka recorded a mere 1.1% growth during the period, data from credit information company Crif High Mark showed. Karnataka had outstanding microfinance loans of Rs 28,600 crore at March-end.",https://economictimes.indiatimes.com/markets/stocks/rssfeeds/2146843.cms
"PMLA court takes cognisance of ED case against Religare chair Rashmi Saluja, advocate Pratap Venugopal",https://economictimes.indiatimes.com/markets/stocks/news/pmla-court-takes-cognisance-of-ed-case-against-religare-chair-rashmi-saluja-advocate-pratap-venugopal/articleshow/131473640.cms,2026-06-02 22:21:22 IST,"A Mumbai court has taken cognisance of a money laundering case filed by the Enforcement Directorate. The complaint names former Religare executive Rashmi Saluja and four others. Allegations involve obtaining legal opinions to bypass IRDAI objections on employee stock options. Senior advocate Pratap Venugopal denies the charges, calling them baseless.",https://economictimes.indiatimes.com/markets/stocks/rssfeeds/2146843.cms
"From Gift Nifty, US-Iran war, oil prices to Nikkei rally: 8 key things that changed for Indian stock market overnight",https://www.livemint.com/market/stock-market-news/from-gift-nifty-us-iran-war-oil-prices-to-nikkei-rally-8-key-things-that-changed-for-indian-stock-market-overnight-11780449324963.html,2026-06-03 07:06:51 IST,"Gift Nifty was trading around 23,469 level, a discount of nearly 134 points from the Nifty futures’ previous close, indicating a negative start for the Indian stock market indices.",https://www.livemint.com/rss/markets
Gold Steady as Uncertainty Clouds Talks to End US-Iran War,https://www.livemint.com/market/gold-steady-as-uncertainty-clouds-talks-to-end-us-iran-war-11780450557454.html,2026-06-03 07:05:57 IST,Gold was steady as renewed clashes in the Middle East cast doubt over negotiations between the US and Iran to end the war that’s upended energy flows and heightened inflation concerns.,https://www.livemint.com/rss/markets
"Stocks to buy for short term: Kotak Bank, Eternal among 5 stocks Pabitro Mukherjee of Bajaj Broking recommends",https://www.livemint.com/market/stock-market-news/stocks-to-buy-for-short-term-kotak-bank-eternal-among-5-stocks-pabitro-mukherjee-of-bajaj-broking-recommends-11780418912066.html,2026-06-03 07:00:28 IST,"Stocks to buy for the short term: Pabitro Mukherjee from Bajaj Broking identifies five promising stocks for short-term investment, including Kotak Mahindra Bank and Eternal, that offer potential gains. Discover the targets and strategies behind these expert recommendations.",https://www.livemint.com/rss/markets
Fomo is fueling the AI stock frenzy. Marvell’s spike is just the latest sign.,https://www.livemint.com/market/stock-market-news/fomo-is-fueling-the-ai-stock-frenzy-marvell-s-spike-is-just-the-latest-sign-11780448756665.html,2026-06-03 06:45:30 IST,"Marvell stock surged 30% in a day, building on gains of 158% so far this year.",https://www.livemint.com/rss/markets
Breakout stocks to buy or sell: Sumeet Bagadia recommends five shares to buy today — 3 June 2026,https://www.livemint.com/market/stock-market-news/breakout-stocks-to-buy-or-sell-sumeet-bagadia-recommends-five-shares-to-buy-today-3-june-2026-11780448009333.html,2026-06-03 06:43:00 IST,The Indian stock market ended Tuesday's session on a higher note. Sumeet Bagadia of Choice Broking recommends five breakout stocks to buy today.,https://www.livemint.com/rss/markets
Stock recommendations for 3 June from MarketSmith India,https://www.livemint.com/market/stock-market-news/stock-recommendations-for-3-june-from-marketsmith-india-11780401350323.html,2026-06-03 06:00:47 IST,"MarketSmith India reveals its top stock recommendations for today, 3 June. Get expert insights into the best-performing stocks to guide your investment decisions.",https://www.livemint.com/rss/markets
"Expert view: FPI outflows may meaningfully recede over next few months, says Pankaj Pandey of ICICI Securities",https://www.livemint.com/market/stock-market-news/expert-view-fpi-outflows-may-meaningfully-recede-over-next-few-months-says-pankaj-pandey-of-icici-securities-11780420892017.html,2026-06-03 06:00:47 IST,"Expert view: Pankaj Pandey from ICICI Securities suggests that despite recent foreign portfolio investor (FPI) selling, India's robust market fundamentals and attractive valuations could lead to a resurgence in investment flows.&amp;nbsp;",https://www.livemint.com/rss/markets
Raja Venkatraman recommends three stocks for 3 June,https://www.livemint.com/market/stock-market-news/raja-venkatraman-recommends-three-stocks-for-3-june-11780407640240.html,2026-06-03 06:00:47 IST,Market expert Raja Venkatraman shares his top stock picks for 3 June. Here’s his technical outlook and trade strategy.,https://www.livemint.com/rss/markets
Where will Wipro stock be in three years?,https://www.livemint.com/market/stock-market-news/wipro-share-price-wipro-stock-analysis-11780400509366.html,2026-06-03 06:00:27 IST,"As structural shifts and AI fears drag down returns, any future rebound for the IT stalwart hinges on reviving stagnant revenues and riding the AI wave.",https://www.livemint.com/rss/markets
Geopolitical chill splits IPO market as mainboard halts and SMEs defy,https://www.livemint.com/market/geopolitical-chill-splits-ipo-market-as-mainboard-halts-and-smes-defy-11780388659238.html,2026-06-03 05:50:26 IST,"The blockbuster mainboard IPO market hit a standstill in May as the West Asia war sparked severe risk aversion. Yet, the retail-driven SME segment continues to defy the chill, signalling a sharp split in investor appetite.",https://www.livemint.com/rss/markets
"Large brands gain as West Asia war, GST cut hit auto aftermarket’s small players",https://www.livemint.com/companies/large-brands-gain-as-west-asia-war-gst-cut-hit-auto-aftermarket-s-small-players-11780396704340.html,2026-06-03 06:01:07 IST,"Last year’s GST cuts have narrowed the price gap between formal automotive spare parts and cheaper alternatives sold by unorganized players, accelerating the shift towards formal brands.",https://www.livemint.com/rss/companies
"TCS, Infosys, Wipro double Copilot AI licences for employees within six months",https://www.livemint.com/companies/tcs-infosys-wipro-double-copilot-ai-licences-for-employees-within-six-months-11780407541005.html,2026-06-03 06:01:07 IST,"While the pace of adoption of its virtual intelligent assistant is great news for Microsoft, it also poses questions about the current billing model of India’s IT $315-billion outsourcing industry as well as its hiring practices.",https://www.livemint.com/rss/companies
"The case against listing Tata Sons, from one of Noel Tata’s closest advisers",https://www.livemint.com/companies/why-a-noel-tata-confidante-thinks-a-tata-sons-listing-would-be-a-mistake-11780392128570.html,2026-06-03 06:01:07 IST,"As pressure mounts for Tata Sons to go public, group veteran Farokh Subedar warns that it could fundamentally alter the freedom to invest in long-gestation projects.",https://www.livemint.com/rss/companies
Agilitas Sports raises  ₹225 crore from Nexus Venture Partners and Rainmatter,https://www.livemint.com/companies/news/agilitas-sports-raises-rs-225-crore-from-nexus-rainmatter-for-retail-brand-expansion-11780386423235.html,2026-06-03 06:00:47 IST,"Nexus Venture Partners led the round, with Rainmatter joining as a new investor, as the sportswear platform doubles down on manufacturing, brand building and multi-brand retail.",https://www.livemint.com/rss/companies
Withdrawing more than  ₹10 lakh from your bank account in a year? Here's what you must know,https://www.livemint.com/money/personal-finance/what-happens-if-you-withdraw-more-than-10-lakh-from-your-bank-account-in-a-year-all-you-need-to-know-11780423169512.html,2026-06-03 06:51:00 IST,"Bank customers can withdraw over  ₹10 lakh without automatic tax scrutiny, but large transactions must comply with reporting norms to avoid issues with the income tax department. Details here.",https://www.livemint.com/rss/money
Top 5 mid-cap index funds with lowest tracking error and benchmark-like returns,https://www.livemint.com/money/personal-finance/top-5-mid-cap-index-funds-with-lowest-tracking-error-and-benchmark-like-returns-11780375470216.html,2026-06-03 06:30:32 IST,"Since mid-cap index funds track a specific index, tracking error is an important factor to consider before investing. Here are the top 5 mid-cap index funds with the lowest tracking error.&amp;nbsp;",https://www.livemint.com/rss/money
Should small finance banks be a part of your FD strategy?,https://www.livemint.com/money/personal-finance/should-small-finance-banks-be-a-part-of-your-fd-strategy-11780380527143.html,2026-06-03 06:00:47 IST,"Unlike larger lenders with diversified and sticky deposit franchises, small finance banks rely more heavily on retail deposits to fund their loan books and, therefore, need to offer higher rates to attract and retain savers.",https://www.livemint.com/rss/money
"Fed Chair Warsh makes first hires at central bank, including ‘Project 2025’ author",https://www.cnbc.com/2026/06/02/fed-chair-warsh-makes-first-hires-at-central-bank-including-project-2025-author.html,2026-06-03 05:44:21 IST,"The new Fed chair has made his first hires. One wrote the Fed chapter in conservative policy blueprint ""Project 2025.""",https://www.cnbc.com/id/10000664/device/rss/rss.html
ITC shares fall 3% to fresh 52-week low; Motilal Oswal sees more pain ahead,https://economictimes.indiatimes.com/markets/stocks/news/itc-shares-fall-3-to-fresh-52-week-low-motilal-oswal-sees-more-pain-ahead/articleshow/131477738.cms,2026-06-03 12:01:05 IST,"ITC shares fell to a fresh 52-week low on Wednesday as investors reacted to steep tax hikes on cigarettes under the new GST 2.0 regime. Brokerage Motilal Oswal Financial Services remained cautious on the stock, noting that the revised tax framework, effective February 1, 2026, has increased cigarette taxes by around 60-65% for ITC.",https://economictimes.indiatimes.com/markets/stocks/rssfeeds/2146843.cms
"IndusInd Bank shares fall 3% after fresh whistleblower complaint reaches PMO, RBI",https://economictimes.indiatimes.com/markets/stocks/news/indusind-bank-shares-drop-3-after-pmo-rbi-receive-fresh-whistleblower-complaint-on-insider-trading/articleshow/131477112.cms,2026-06-03 11:26:50 IST,"IndusInd Bank shares fell on Wednesday after a fresh whistleblower complaint was sent to the Prime Minister’s Office, RBI, and other regulatory agencies, seeking an investigation into alleged insider trading, governance lapses, and deficiencies in audit and forensic reviews.",https://economictimes.indiatimes.com/markets/stocks/rssfeeds/2146843.cms
Concord Biotech shares jump 8% on USFDA nod for Mycophenolate Mofetil oral suspension,https://economictimes.indiatimes.com/markets/stocks/news/concord-biotech-jumps-8-on-usfda-nod-for-mycophenolate-mofetil-oral-suspension/articleshow/131476379.cms,2026-06-03 10:51:32 IST,Concord Biotech shares saw a significant jump on Wednesday. This surge followed the company's announcement of receiving approval from the USFDA for its Mycophenolate Mofetil for Oral Suspension. This antimetabolite immunosuppressant is used in organ transplant patients.,https://economictimes.indiatimes.com/markets/stocks/rssfeeds/2146843.cms
"TCS, Infosys, other IT stocks crash up to 7% after 3-day rally. What top brokerages are saying?",https://economictimes.indiatimes.com/markets/stocks/news/tcs-infosys-it-stocks-crash-up-to-7-after-3-day-rally-what-are-clsa-other-experts-saying/articleshow/131476306.cms,2026-06-03 10:43:15 IST,"IT stocks, including TCS, Infosys, HCL Tech, Wipro and Tech Mahindra, fell sharply on Wednesday, following a three-day rally. Despite AI-related disruption concerns, brokerages such as CLSA, Nuvama and Choice Institutional Equities remain optimistic, citing resilient earnings, strong order books and expanding enterprise AI opportunities.",https://economictimes.indiatimes.com/markets/stocks/rssfeeds/2146843.cms
"NHPC shares jump 5% as OFS worth Rs 4,300 crore opens for retail investors. Here's all you need to know",https://economictimes.indiatimes.com/markets/stocks/news/nhpc-shares-jump-5-as-ofs-worth-rs-4300-crore-opens-for-retail-investors-heres-all-you-need-to-know/articleshow/131476197.cms,2026-06-03 10:38:06 IST,"NHPC shares surged over 5% as the government's offer for sale (OFS) opened for retail investors. The OFS was oversubscribed 3.47 times on the first day, prompting the government to exercise its green shoe option. Retail investors and employees can now bid on June 3, 2026.",https://economictimes.indiatimes.com/markets/stocks/rssfeeds/2146843.cms
Did Anand Rathi Wealth shares really crash 50% in one day? Here's how the 1:1 bonus math works,https://economictimes.indiatimes.com/markets/stocks/news/did-anand-rathi-wealth-shares-really-crash-50-in-one-day-heres-how-the-11-bonus-math-works/articleshow/131476128.cms,2026-06-03 10:28:00 IST,"Anand Rathi Wealth shares appeared to tumble nearly 50% after turning ex-bonus for its 1:1 bonus issue. The decline was purely due to a price adjustment and not a loss in value. The company will issue one bonus share for every existing share, while capitalising Rs 41.51 crore from reserves.",https://economictimes.indiatimes.com/markets/stocks/rssfeeds/2146843.cms
Eternal to ICICI Bank: 15 stocks on Axis Securities buy list for June,https://economictimes.indiatimes.com/markets/stocks/news/eternal-to-icici-bank-15-stocks-on-axis-securities-buy-list-for-june/slideshow/131475628.cms,2026-06-03 09:34:03 IST,"Axis Securities has identified 15 stocks for investors to consider in June. These picks span large, mid, and small-cap segments, offering potential gains up to 44%. The brokerage remains optimistic about India's economy despite global challenges. Key recommendations include Eternal, Bharti Airtel, and ICICI Bank. Financials, consumption, and infrastructure-linked businesses are favored.",https://economictimes.indiatimes.com/markets/stocks/rssfeeds/2146843.cms
"Sensex tumbles over 950 points, Nifty below 23,200. 6 key factors behind today's D-Street rout",https://economictimes.indiatimes.com/markets/stocks/news/why-is-market-falling-today-sensex-drops-700-points-nifty-below-23300-5-key-factors-behind-today-d-street-rout/articleshow/131454333.cms,2026-06-03 09:27:23 IST,Indian stock markets experienced a significant downturn today. Benchmark indices Sensex and Nifty saw substantial declines. This drop was fueled by escalating Iran-US tensions and continued selling by foreign institutional investors. Rising oil prices and a weakening rupee also contributed to the cautious sentiment on Dalal Street. Investors are now keenly watching the upcoming RBI commentary.,https://economictimes.indiatimes.com/markets/stocks/rssfeeds/2146843.cms
Jefferies raises Titagarh Rail target price by 23%. Check upside potential and key triggers,https://economictimes.indiatimes.com/markets/stocks/news/jefferies-raises-titagarh-rail-share-price-target-by-23-check-upside-potential-key-reasons/articleshow/131475191.cms,2026-06-03 09:22:18 IST,Titagarh Rail Systems shares rose after Jefferies increased its target price. The brokerage noted a strong quarter and improving execution. Titagarh is set to benefit from government infrastructure projects. The company expects to deliver more coaches and trains in the coming years. Margins improved significantly in the March quarter. Wagon sales saw a decline but are expected to stabilize.,https://economictimes.indiatimes.com/markets/stocks/rssfeeds/2146843.cms
"Vedanta, Hindustan Zinc shares fall after metals giant confirms ED visits to offices",https://economictimes.indiatimes.com/markets/stocks/news/vedanta-hindustan-zinc-shares-in-focus-after-metals-giant-confirms-ed-visits-to-offices/articleshow/131475129.cms,2026-06-03 09:08:41 IST,Vedanta and Hindustan Zinc shares dipped after the Enforcement Directorate visited some of their offices as part of a FEMA probe. The companies confirmed the visits and stated they are fully cooperating with the authorities. This news comes after Vedanta's recent demerger and a positive rating upgrade from ICRA.,https://economictimes.indiatimes.com/markets/stocks/rssfeeds/2146843.cms
"Alkem Labs shares in focus as Goldman, Morgan Stanley, others purchase stake in Rs 930-crore block deal",https://economictimes.indiatimes.com/markets/stocks/news/alkem-labs-shares-in-focus-as-goldman-morgan-stanley-others-purchase-stake-in-rs-930-crore-block-deal/articleshow/131475088.cms,2026-06-03 08:59:47 IST,"Shares of Alkem Laboratories will be in focus after block deals worth around Rs 930 crore saw 17.88 lakh shares traded at Rs 5,200 apiece on Tuesday. Promoter-linked entities offloaded their stake, while domestic mutual funds and foreign institutional investors emerged as key buyers, signalling strong institutional participation. The company also launched semaglutide pre-filled syringes in India.",https://economictimes.indiatimes.com/markets/stocks/rssfeeds/2146843.cms
"AI, data centre boom powers these 9 stocks up to 477% in 2026. Can you still join the party?",https://economictimes.indiatimes.com/markets/stocks/news/ai-data-centre-boom-powers-these-9-stocks-up-to-477-in-2026-can-you-still-join-the-party/articleshow/131475070.cms,2026-06-03 08:58:07 IST,"India's data centre industry is experiencing a multi-year growth phase, fueled by digitalization, cloud adoption, and AI demand. This surge is driving significant gains in companies linked to data centre infrastructure, power, and hardware, with analysts suggesting the rally has further room to run.",https://economictimes.indiatimes.com/markets/stocks/rssfeeds/2146843.cms
NHPC among 5 F&amp;O stocks with a sharp rise in futures open interest,https://economictimes.indiatimes.com/markets/stocks/news/nhpc-among-5-fampo-stocks-with-a-sharp-rise-in-futures-open-interest/slideshow/131475048.cms,2026-06-03 08:49:16 IST,"As of June 2, five stocks in the NSE F&amp;O segment witnessed a notable surge in futures open interest, reflecting a total increase of over 10% compared to the previous trading session. The rise indicates stronger derivatives participation, with traders either initiating fresh positions or adding to existing ones, signalling heightened activity across select F&amp;O counters.",https://economictimes.indiatimes.com/markets/stocks/rssfeeds/2146843.cms
