title,link,published,summary,source
IndiGo shares fall as airline halts Manchester flights amid soaring operational costs,https://economictimes.indiatimes.com/markets/stocks/news/indigo-shares-in-focus-as-airline-halts-manchester-flights-amid-soaring-operational-costs/articleshow/131474975.cms,2026-06-03 08:45:55 IST,"IndiGo shares fell after it temporarily suspended its flights to Manchester from August 31 due to extended airspace restrictions and soaring operational costs. This decision will see one of its leased Boeing 787-9 Dreamliners returned. Despite strong passenger demand, longer flight times and escalating expenses forced the airline's hand, though it remains committed to long-haul expansion.",https://economictimes.indiatimes.com/markets/stocks/rssfeeds/2146843.cms
"TCS among 4 stocks flashing bullish signals, indicating possible uptrend",https://economictimes.indiatimes.com/markets/stocks/news/tcs-among-4-stocks-flashing-bullish-signals-indicating-possible-uptrend/slideshow/131474886.cms,2026-06-03 08:35:59 IST,"On June 2, four NSE large-cap stocks appeared on StockEdge’s White Marubozu bullish scanner, a candlestick pattern indicating strong buying pressure where the opening price is the lowest and the closing price is the highest. The formation reflects sustained buyer control throughout the session and is often used by traders to anticipate potential near-term upward price momentum.",https://economictimes.indiatimes.com/markets/stocks/rssfeeds/2146843.cms
TCS among 6 stocks showing bullish RSI upswing,https://economictimes.indiatimes.com/markets/stocks/news/tcs-among-6-stocks-showing-bullish-rsi-upswing/slideshow/131474795.cms,2026-06-03 08:27:18 IST,"On June 2, six Nifty500 stocks that gained 5% or more were highlighted in the RSI Trending Up scan based on data from StockEdge.com. The signal is generated when RSI crosses above 50 from lower levels, indicating improving momentum. Rising RSI values suggest strengthening price action and potential bullish continuation, helping traders identify possible buying opportunities.",https://economictimes.indiatimes.com/markets/stocks/rssfeeds/2146843.cms
Trent bonus issue alert! Last date to buy shares for 1:2 bonus reward. Do you own?,https://economictimes.indiatimes.com/markets/stocks/news/trent-bonus-issue-alert-last-date-to-buy-shares-for-12-bonus-reward-do-you-own/articleshow/131474109.cms,2026-06-03 07:35:14 IST,"Trent, the parent of Zudio and Westside, has announced its first bonus share issue. The record date is June 4, meaning today is the final chance to buy shares for eligibility. Investors will receive one bonus share for every two shares held. This corporate action is a significant event for shareholders.",https://economictimes.indiatimes.com/markets/stocks/rssfeeds/2146843.cms
Positive Breakout: These 8 stocks cross above their 200 DMAs,https://economictimes.indiatimes.com/markets/stocks/news/positive-breakout-these-8-stocks-cross-above-their-200-dmas/slideshow/131474072.cms,2026-06-03 07:25:23 IST,"As long as the stock is priced above the 200-day SMA on the daily time frame, it is generally considered to be an overall uptrend.",https://economictimes.indiatimes.com/markets/stocks/rssfeeds/2146843.cms
NMDC has twin boosts of pricing and firm demand,https://www.livemint.com/market/mark-to-market/nmdc-share-price-nmdc-q4fy26-results-iron-ore-prices-outlook-11780466340348.html,2026-06-03 12:14:14 IST,"NMDC’s shares have gained about 16% so far in 2026, and trade at an enterprise value of 6-6.5 times its FY27 estimated Ebitda. While the price trend looks favourable currently, the medium-term trajectory may not be very favourable.",https://www.livemint.com/rss/markets
"Ruchit Jain of Motilal Oswal suggests Premier Energies, Varun Beverages shares to buy for the short term",https://www.livemint.com/market/stock-market-news/ruchit-jain-of-motilal-oswal-suggests-premier-energies-varun-beverages-shares-to-buy-for-the-short-term-11780467883394.html,2026-06-03 12:12:20 IST,"Indian equity benchmarks fell sharply due to geopolitical tensions, rising crude oil prices, and foreign fund outflows. The Sensex dropped 1,000 pts and the Nifty 50 fell 300 pts, with investors cautious amid US-Iran negotiations and proposed tariffs on imports from several countries.",https://www.livemint.com/rss/markets
"Beyond ethanol and biogas, Praj needs to prove its growth case",https://www.livemint.com/market/stock-market-news/praj-industries-biofuel-bet-ethanol-cbg-saf-growth-drivers-stock-outlook-11780458635516.html,2026-06-03 11:52:48 IST,"While the green technology pioneer is beating the market slump on policy tailwinds, analysts warn near-term earnings depend on turning order visibility into hard revenue.",https://www.livemint.com/rss/markets
"TCS, Infosys to Coforge: IT stocks crash up to 9% after three-day rally; what's behind the selloff?",https://www.livemint.com/market/stock-market-news/tcs-infosys-to-coforge-it-stocks-crash-up-to-8-after-three-day-rally-whats-behind-the-selloff-11780467103562.html,2026-06-03 11:46:25 IST,"IT stocks fell sharply as profit-booking set in. Analysts highlight the impact of AI on traditional business models and caution against high valuations in a low-growth environment, leading to diminished foreign institutional investor interest.",https://www.livemint.com/rss/markets
Last day to buy Tata Group company Trent shares ahead of its first-ever bonus issue record date; do you own?,https://www.livemint.com/market/stock-market-news/last-day-to-buy-tata-group-company-trent-shares-ahead-of-its-first-ever-bonus-issue-record-date-do-you-own-11780466084389.html,2026-06-03 11:34:56 IST,"Trent shares are in focus as June 4 is the record date for the company's first bonus issue of 1:2. Investors must hold shares by this date to qualify. The company plans to issue 17.77 crore equity shares, capitalizing  ₹17.77 crore from its reserves.",https://www.livemint.com/rss/markets
"IndusInd Bank share price falls over 3% after report of whistleblower complaint to RBI, PMO",https://www.livemint.com/market/stock-market-news/indusind-bank-share-price-falls-over-3-after-report-of-whistleblower-complaint-to-rbi-pmo-11780464954862.html,2026-06-03 11:12:00 IST,"The complaint has reportedly been submitted to multiple authorities, including the Prime Minister’s Office (PMO), the Reserve Bank of India (RBI), the Serious Fraud Investigation Office (SFIO), the National Financial Reporting Authority (NFRA), and other regulatory agencies.",https://www.livemint.com/rss/markets
"Metals Q4 results: Strong operational performance sustains amid elevated metal prices; Hindalco, APL Apollo top picks",https://www.livemint.com/market/stock-market-news/metals-q4-results-strong-operational-performance-sustains-amid-elevated-metal-prices-hindalco-apl-apollo-top-picks-11780463273224.html,2026-06-03 11:10:33 IST,"Metals and mining sector showed resilience in Q4 FY26, supported by high commodity prices and strong demand. Most companies met or surpassed expectations, with APL Apollo Tubes and Hindalco receiving 'Buy' ratings from Axis Direct, highlighting their robust performance and strategic growth plans.",https://www.livemint.com/rss/markets
From $120 to $95: Crude oil prices surged 70% during the US-Iran war. Can Brent crude price drop to $80?,https://www.livemint.com/market/commodities/from-120-to-95-crude-oil-prices-surged-70-during-the-us-iran-war-can-brent-crude-price-drop-to-80-11780462146554.html,2026-06-03 10:57:02 IST,"Crude oil prices have surged due to US-Iran tensions, but historical trends suggest corrections of 30-40% are common after geopolitical spikes. Analysts warn that supply restorations are crucial for price stabilization, while the market remains sensitive to Middle East developments.",https://www.livemint.com/rss/markets
NHPC share price rises 5% as OFS opens for retail investors. Should you participate or not?,https://www.livemint.com/market/stock-market-news/nhpc-share-price-rises-5-as-ofs-opens-for-retail-investors-should-you-participate-or-not-11780459995282.html,2026-06-03 10:46:32 IST,"NHPC stock began the day at  ₹75.56 per share, up from its previous close of  ₹72.29 on Tuesday. Here are all the details about the OFS, along with the experts' opinion on whether retail investors should participate or not.",https://www.livemint.com/rss/markets
"Vodafone Idea share price gains despite stock market crash, jumps 40% in one month. More upside left?",https://www.livemint.com/market/stock-market-news/vodafone-idea-share-price-gains-despite-stock-market-crash-jumps-40-in-one-month-more-upside-left-11780462302180.html,2026-06-03 10:27:58 IST,Vodafone Idea share price has gained nearly 40% in one month and has risen over 21% on a year-to-date (YTD) basis. The telecom stock has rallied 34% in six month and has jumped 108% in one year.&amp;nbsp;,https://www.livemint.com/rss/markets
"Nifty 50 tanks 250 points, Sensex crashes 900 points; why is Indian stock market falling today? Explained with 5 reasons",https://www.livemint.com/market/stock-market-news/nifty-50-tanks-250-points-sensex-crashes-900-points-why-is-indian-stock-market-falling-today-explained-with-5-reasons-11780461477693.html,2026-06-03 10:20:26 IST,"Stock market crash: Following escalation in the US-Iran war and soaring crude oil prices, key indices of Dalal Street are under intense selling pressure, shedding over 1% each.",https://www.livemint.com/rss/markets
"Rajnandini Fashion share price makes flat debut, lists at  ₹63, same as SME IPO price",https://www.livemint.com/market/stock-market-news/rajnandini-fashion-share-price-makes-flat-debut-lists-at-rs-63-same-as-sme-ipo-price-11780459198625.html,2026-06-03 10:10:34 IST,"Rajnandini Fashion India debuted at  ₹63 on the BSE SME, meeting expectations with a grey market premium of  ₹6. The IPO was oversubscribed by 203.74 times, with significant interest from retail and institutional investors. The company aims to raise  ₹13.85 crore for business growth.",https://www.livemint.com/rss/markets
Chinese Investors Exit Hong Kong Stocks as AI Woos Money Onshore,https://www.livemint.com/market/chinese-investors-exit-hong-kong-stocks-as-ai-woos-money-onshore-11780461044438.html,2026-06-03 10:00:44 IST,"Chinese investors are exiting Hong Kong‑listed stocks in record numbers, highlighting waning appetite as mainland AI shares broaden their appeal.",https://www.livemint.com/rss/markets
"Vedanta, Hindustan Zinc shares slip 1% after Anil Agarwal-led company confirms ED visit to offices",https://www.livemint.com/market/stock-market-news/vedanta-share-price-hindustan-zinc-share-price-slip-1-after-anil-agarwal-led-company-confirms-ed-visit-to-offices-11780459720158.html,2026-06-03 09:48:17 IST,Shares of Vedanta and Hindustan Zinc fell 1% on June 3 after the Enforcement Directorate visited their offices amid a FEMA investigation. Vedanta confirmed its cooperation with authorities while reiterating its commitment to regulatory compliance.,https://www.livemint.com/rss/markets
Hindustan Zinc to Grasim - Jay Thakkar suggests 3 stocks to buy or sell for short-term in F&amp;O segment,https://www.livemint.com/market/stock-market-news/hindustan-zinc-to-grasim-jay-thakkar-suggests-3-stocks-to-buy-or-sell-for-short-term-in-f-o-segment-11780458771000.html,2026-06-03 09:44:21 IST,"The Indian stock market declined on investor caution due to escalating Gulf tensions and rising crude oil prices. Nifty 50 and Sensex opened lower, while analysts expect geopolitical uncertainty and foreign selling to keep equities under pressure in the near term.",https://www.livemint.com/rss/markets
CMR Green Technologies IPO Day 1 LIVE: GMP signals 33% listing pop; issue booked over 75% so far — Time to apply?,https://www.livemint.com/market/ipo/cmr-green-technologies-ipo-gmp-cmr-green-technologies-ipo-subscription-cmr-green-technologies-ipo-review-ipo-11780459149516.html,2026-06-03 09:42:42 IST,"CMR Green Technologies IPO Day 1 LIVE: CMR Green Technologies IPO has opened for bidding today, looking to raise  ₹630 crore. The offer is entirely a share sale by promoters and selling shareholders. The company is witnessing a strong trend in the grey market.",https://www.livemint.com/rss/markets
Crude oil prices gain as US-Iran peace deal remains elusive; Brent tops $97/bbl. Where are they headed next?,https://www.livemint.com/market/commodities/crude-oil-prices-gain-as-us-iran-peace-deal-remains-elusive-brent-tops-97-bbl-where-are-they-headed-next-11780456758239.html,2026-06-03 09:26:23 IST,"US-Iran war: MCX crude oil price rose as much as 1% to  ₹9,039 per barrel. Here's what's driving the crude oil prices today, along with experts opinion on near-term outlook.",https://www.livemint.com/rss/markets
"Gold rate today: MCX gold price rises above  ₹1.59 lakh per 10 grams, silver price falls amid renewed US-Iran conflict",https://www.livemint.com/market/commodities/gold-rate-today-mcx-gold-price-rises-above-rs-1-59-lakh-per-10-grams-silver-price-falls-amid-renewed-us-iran-conflict-11780457431766.html,2026-06-03 09:08:47 IST,"Gold rate today: Gold prices declined in the international market, as fresh escalation in the US-Iran war in the Middle East pushed crude oil prices higher, cementing fears that interest rates would stay ​higher for longer to tame inflation.",https://www.livemint.com/rss/markets
Silver rate today falls as strong US Jobs Data reinforces higher-for-longer interest rates amid Middle East tensions,https://www.livemint.com/market/stock-market-news/silver-rate-today-falls-as-strong-us-jobs-data-reinforces-higher-for-longer-interest-rates-amid-middle-east-tensions-11780456122098.html,2026-06-03 09:08:39 IST,"Recent US jobs data has strengthened expectations for prolonged elevated interest rates, impacting precious metals. Gold and silver prices are range-bound, recovering from lows while geopolitical tensions in the Middle East keep investors cautious.&amp;nbsp;",https://www.livemint.com/rss/markets
Rupee opens 19 paise lower at 95.45 against US dollar,https://www.livemint.com/market/stock-market-news/rupee-opens-19-paise-lower-at-95-45-against-us-dollar-11780457677139.html,2026-06-03 09:06:42 IST,"The Indian rupee fell 19 paise to 95.45 against the US dollar, influenced by rising crude oil prices and Asian currency weakness amid escalating tensions in the Gulf. Investor sentiment weakened due to Iranian military actions and ongoing FPI outflows, despite RBI interventions.",https://www.livemint.com/rss/markets
Crude oil prices rise as renewed West Asia tensions stoke supply concerns,https://www.livemint.com/market/commodities/crude-oil-prices-west-asia-war-crude-supply-iran-us-israel-war-11780454596354.html,2026-06-03 08:51:31 IST,"The ongoing war and the blockade of the Strait of Hormuz have shaved 20% off global LNG supplies and the longer Hormuz remains closed, the higher oil, gas, and electricity prices will rise",https://www.livemint.com/rss/markets
"CMR Green Technologies IPO Day 1: Issue booked 60% so far. Check GMP, review, key details. Should you apply or not?",https://www.livemint.com/market/ipo/cmr-green-technologies-ipo-gmp-cmr-green-technologies-ipo-review-cmr-green-technologies-ipo-details-cmr-green-ipo-gmp-11780454246306.html,2026-06-03 08:40:05 IST,"CMR Green Technologies IPO opens for public subscription from 3 June to 5 June, with a price band of  ₹182-192. The company raised  ₹188.44 crore through an anchor book, with shares tentatively listing on 10 June.",https://www.livemint.com/rss/markets
Stocks to buy: Ajit Mishra of Religare Broking recommends three shares to buy on Wednesday - 3 June 2026,https://www.livemint.com/market/stock-market-news/stocks-to-buy-ajit-mishra-of-religare-broking-recommends-three-shares-to-buy-on-wednesday-3-june-2026-11780453244436.html,2026-06-03 08:19:14 IST,"Stocks to buy: Ajit Mishra, SVP - Research, Religare Broking Limited believes Nifty rebounded after retesting its previous swing low around the 23,250 mark. Here are top stock recommendations from the analyst.",https://www.livemint.com/rss/markets
"Raja Venkatraman, MarketSmith recommend five stocks for 3 June",https://www.livemint.com/market/stock-market-news/raja-venkatraman-marketsmith-recommend-five-stocks-for-3-june-11780451120512.html,2026-06-03 07:44:46 IST,"On June 3, Indian equity benchmarks rebounded after four days of losses, driven by IT stocks and value buying. The Nifty 50 rose 0.43% to 23,483.55. Recommendations include Vijaya Diagnostic Centre, Syrma SGS Technology, and Shyam Metalics due to strong performance and market conditions.",https://www.livemint.com/rss/markets
"Stocks to watch: Vedanta, Canara Bank, Adani Ports among 10 shares in focus today; check list here",https://www.livemint.com/market/stock-market-news/stocks-to-watch-vedanta-canara-bank-adani-ports-among-10-shares-in-focus-today-check-list-here-11780449480744.html,2026-06-03 07:41:51 IST,"Stock market today: The market is likely to snap its gaining streak as trends in the Gift Nifty index signalled a negative opening on Wednesday. Amid this backdrop, these stocks will remain in focus on 3 June.",https://www.livemint.com/rss/markets
"Buy or sell: Gift Nifty down, Vaishali Parekh recommends three stocks to buy today — 3 June 2026",https://www.livemint.com/market/stock-market-news/buy-or-sell-gift-nifty-down-vaishali-parekh-recommends-three-stocks-to-buy-today-3-june-2026-11780450442158.html,2026-06-03 07:34:29 IST,"Buy or sell: Vaishali Parekh recommends three stocks to buy today — RVNL, RCF, and KFin Tech",https://www.livemint.com/rss/markets
Asian markets today: Japan's Nikkei 225 hits record high; yen at 160 per dollar amid US-Iran war uncertainty,https://www.livemint.com/market/stock-market-news/asian-markets-today-japans-nikkei-225-hits-record-high-yen-at-160-per-dollar-amid-us-iran-war-uncertainty-11780450554435.html,2026-06-03 07:34:09 IST,"Asian markets today: Japan’s Nikkei 225 advanced 0.91%, while the broader Topix index rose 0.93%. Australia’s S&amp;amp;P/ASX 200 also gained 0.32%, on Wednesday.",https://www.livemint.com/rss/markets
"Nifty 50, Sensex prediction today: Check how Indian stock market is expected to trade on 3 June",https://www.livemint.com/market/stock-market-news/nifty-50-sensex-prediction-today-check-how-indian-stock-market-is-expected-to-trade-on-3-june-11780450861140.html,2026-06-03 07:24:43 IST,"Nifty 50, Sensex prediction today: The trends on Gift Nifty also indicate a weak start for the Indian benchmark index. The Gift Nifty was trading around 23,456 level, a discount of nearly 147 points from the Nifty futures’ previous close.",https://www.livemint.com/rss/markets
"Indian IT eyes return to on-site model, but with a talent and cost twist",https://www.livemint.com/companies/indian-it-eyes-return-of-onsite-engineers-but-with-a-twist-11780395527508.html,2026-06-03 09:00:30 IST,"From the world’s largest banks to retail majors, customers now increasingly prefer engineers who combine AI expertise with sales and consulting skills to drive end-to-end deployment of the new technology.",https://www.livemint.com/rss/companies
"Microsoft doubles down on Windows, developers as US tightens AI oversight",https://www.livemint.com/companies/news/microsoft-windows-ai-satya-nadella-microsoft-ai-models-ai-operating-system-11780452662682.html,2026-06-03 08:08:02 IST,"Microsoft put up a bullish stance despite the US government’s decision, which will require all tech companies to give the US government access to frontier AI models 30 days before releasing them commercially.",https://www.livemint.com/rss/companies
Trading salary for Esops? The four tests that help you do the math,https://www.livemint.com/money/personal-finance/salary-vs-esops-cash-vs-esops-employee-starting-salary-india-11780428323075.html,2026-06-03 11:39:14 IST,Esops are not lottery tickets. But they become lottery tickets when people stop doing the math.,https://www.livemint.com/rss/money
Financial stress management explained: 5 practical ways to reduce money anxiety and improve financial control,https://www.livemint.com/money/personal-finance/financial-stress-management-explained-5-practical-ways-to-reduce-money-anxiety-and-improve-financial-control-11780464533799.html,2026-06-03 11:34:56 IST,"Take charge of your money today with practical financial stress-management strategies that reduce money anxiety, build savings, and help you create long-term financial stability. Don't hesitate to take professional guidance from a certified financial advisor if financial problems remain.&amp;nbsp;",https://www.livemint.com/rss/money
Small caps are rallying again. Should you get on board or stay away?,https://www.livemint.com/money/personal-finance/small-cap-funds-rally-should-you-invest-now-11780412624012.html,2026-06-03 11:27:48 IST,"Small cap mutual funds are drawing record inflows, driven by attractive valuations and a broader economic recovery. But investors still need a five-to-seven-year horizon and an SIP mindset to beat the volatility.",https://www.livemint.com/rss/money
"8th pay commission: Srinagar meet today, check dates for Ladakh, Uttar Pradesh, Odisha and West Bengal state visits here",https://www.livemint.com/money/personal-finance/8th-pay-commission-list-state-visits-srinagar-meet-today-june-july-west-bengal-uttar-pradesh-ladakh-odisha-jammu-kashmir-11780464445220.html,2026-06-03 11:18:11 IST,"8th CPC: Check here for the full list of state visits and employee meetings scheduled by the 8th pay commission in Jammu Kashmir, Ladakh, Odisha, Uttar Pradesh and West Bengal in June and July 2026.",https://www.livemint.com/rss/money
"Annapurna Yojana goes live today: How to check if your  ₹3,000 payment has been credited",https://www.livemint.com/money/personal-finance/annapurna-yojana-goes-live-today-how-to-check-if-your-3-000-payment-has-been-credited-11780462089867.html,2026-06-03 10:44:07 IST,"West Bengal Chief Minister Suvendu Adhikari will launch the Annapurna Yojana, providing  ₹3,000 monthly to women beneficiaries. The inauguration is set for 12.30 pm, with 100 beneficiaries per locality receiving sanction letters. The scheme replaces the previous Lakshmir Bhandar initiative.",https://www.livemint.com/rss/money
"When a taxpayer dies, filing ITR remains a legal obligation",https://www.livemint.com/money/personal-finance/taxpayer-assessment-tax-filing-india-itr-filing-income-tax-rules-india-11780427921257.html,2026-06-03 10:33:02 IST,"Under Indian tax law, a person's obligation to file and pay taxes does not end with death. The responsibility passes to their legal representative or legal heirs, and overlooking it can lead to notices, penalties and delays in settling financial affairs.",https://www.livemint.com/rss/money
"Gold and silver prices today, 3 June: Check retail rates of 24K, 22K gold and 999 silver in Delhi, Mumbai, other cities",https://www.livemint.com/money/personal-finance/gold-and-silver-prices-today-3-june-check-retail-rates-of-24k-22k-gold-and-999-silver-in-delhi-mumbai-other-cities-11780458953080.html,2026-06-03 10:08:03 IST,"Gold and silver prices rose on 3 June amid a weaker dollar and higher crude oil prices due to US-Iran tensions. MCX gold stayed above  ₹1.59 lakh/10g, while silver held firm. Check 24K, 22K gold and 999 silver rates across major Indian cities.",https://www.livemint.com/rss/money
I asked ChatGPT what salaried taxpayers should check before filing ITR in 2026 — and these 15 things came up,https://www.livemint.com/money/personal-finance/income-tax-returns-i-asked-chatgpt-what-salaried-taxpayers-should-check-before-filing-itr-2026-checklist-these-15-things-11780457322494.html,2026-06-03 09:34:11 IST,"Salaried taxpayers in India should thoroughly review their income-tax returns for FY 2025-26 before filing. Important checks include verifying pre-filled data, waiting for AIS updates, and ensuring all necessary deductions are claimed to avoid errors and delays.",https://www.livemint.com/rss/money
How to avoid over-diversification in mutual funds: 5 simple ways,https://www.livemint.com/money/personal-finance/how-to-avoid-over-diversification-in-mutual-funds-5-simple-ways-11780457801893.html,2026-06-03 09:33:04 IST,"Too many mutual funds can weaken returns. Over-diversification creates portfolio overlap, complexity and confusion. A focused mutual funds strategy with clear asset allocation can improve long-term investment performance. Take proper guidance from a certified financial advisor to manage finances.&amp;nbsp;",https://www.livemint.com/rss/money
I asked ChatGPT: Should I pay a CA to file ITR? It explains when expert help makes sense,https://www.livemint.com/money/personal-finance/i-asked-chatgpt-should-i-pay-a-ca-to-file-itr-it-explains-when-expert-help-makes-sense-11780454702026.html,2026-06-03 08:45:04 IST,"A discussion on whether salaried employees should file their ITR themselves or hire a Chartered Accountant. While DIY filing is feasible for straightforward cases, professional help can prevent costly errors and uncover tax-saving opportunities, especially when income sources are varied or complex.",https://www.livemint.com/rss/money
Credit card stolen? Here are 5 steps you should take immediately,https://www.livemint.com/money/personal-finance/credit-card-stolen-here-are-5-steps-you-should-take-immediately-11780452865623.html,2026-06-03 08:32:21 IST,"Act fast when a credit card is stolen. Quick reporting, card blocking, FIR filing and account monitoring can prevent fraud, protect your credit score and reduce financial losses. Don't panic; contact your credit card issuer promptly and follow the steps to resolve the issue.",https://www.livemint.com/rss/money
