title,link,published,summary,source
Value 360 Communications shares to list today. Here's what GMP signals ahead of debut,https://economictimes.indiatimes.com/markets/stocks/news/value-360-communications-shares-to-list-today-heres-what-gmp-signals-ahead-of-debut/articleshow/131001606.cms,2026-05-11 07:30:02 IST,"Value 360 Communications is set for its stock market debut on Monday, with grey market signals indicating a flat listing near its upper issue price of Rs 98. The Rs 41.69 crore IPO, which saw strong institutional interest but subdued retail demand, was subscribed 1.20 times overall.",https://economictimes.indiatimes.com/markets/stocks/rssfeeds/2146843.cms
"SBI bets on retail, MSME push to keep NIM above 3%",https://economictimes.indiatimes.com/markets/stocks/news/sbi-bets-on-retail-msme-push-to-keep-nim-above-3/articleshow/131001255.cms,2026-05-11 06:28:13 IST,"State Bank of India aims to maintain net interest margins above 3% in FY27, driven by easing funding costs from deposit repricing. However, slower CASA deposit growth compared to credit expansion may necessitate reliance on costlier term deposits. The bank plans to boost yields by accelerating growth in retail and MSME loans to offset margin pressures and support fee income.",https://economictimes.indiatimes.com/markets/stocks/rssfeeds/2146843.cms
"Stocks in news: Canara Bank, MCX, Urban Company, Ola Electric, Vodafone Idea",https://economictimes.indiatimes.com/markets/stocks/news/stocks-in-news-canara-bank-mcx-urban-company-ola-electric-vodafone-idea/articleshow/130995821.cms,2026-05-11 06:01:00 IST,"Indian markets closed higher amidst volatility, with global events like the US-Iran agreement keenly watched. Several companies, including Canara Bank and MCX, reported strong Q4 results, with MCX seeing a significant profit surge. Ola Electric's new scooter received approval, while Vodafone Idea is exploring capital infusion.",https://economictimes.indiatimes.com/markets/stocks/rssfeeds/2146843.cms
Weakness in GIFT Nifty signals gap-down start for Dalal Street,https://economictimes.indiatimes.com/markets/stocks/news/pre-market-action-heres-the-trade-setup-for-todays-session/articleshow/130995912.cms,2026-05-11 06:00:00 IST,"Nifty closed higher for a second consecutive week, gaining 0.7% amidst high volatility. Analysts anticipate institutional activity will be influenced by global developments, particularly US-Iran negotiations, impacting geopolitical stability and crude oil prices. The market sentiment appears weak, with potential for further correction if Nifty stays below 24,200.",https://economictimes.indiatimes.com/markets/stocks/rssfeeds/2146843.cms
"Undertone bullish, but Nifty faces resistance at 24,600",https://economictimes.indiatimes.com/markets/stocks/news/undertone-bullish-but-nifty-faces-resistance-at-24600/articleshow/131001091.cms,2026-05-11 05:51:43 IST,"Indian stock market benchmark Nifty is currently trading within a narrow range. Analysts observe mixed signals, with a bullish structure intact but facing resistance. Traders are awaiting a clear direction. Key levels to watch are 24,600 as resistance and 23,800 as support. Bank Nifty also shows improving momentum. Specific stock recommendations are provided for traders.",https://economictimes.indiatimes.com/markets/stocks/rssfeeds/2146843.cms
India underperforms Asian rivals amid earnings and valuation strain,https://economictimes.indiatimes.com/markets/stocks/news/india-underperforms-asian-rivals-amid-earnings-and-valuation-strain/articleshow/131001072.cms,2026-05-11 05:40:23 IST,"Indian stocks are facing losses while other economies see gains. This is due to a global AI investment frenzy benefiting chip makers like Samsung Electronics and SK Hynix. India lacks direct AI exposure, leading to lower corporate earnings growth. Foreign investors are seeking better returns elsewhere, impacting the Indian market.",https://economictimes.indiatimes.com/markets/stocks/rssfeeds/2146843.cms
Why global fund managers are giving D-St the cold shoulder,https://economictimes.indiatimes.com/markets/stocks/news/why-global-fund-managers-are-giving-d-st-the-cold-shoulder/articleshow/131001056.cms,2026-05-11 05:32:03 IST,"Foreign investors have significantly reduced their holdings in Indian equities, driven by slowing earnings growth, the AI boom in South Korea and Taiwan, and rising oil prices coupled with a falling rupee. This shift has led to substantial outflows, with strategists predicting a slowdown in selling but a slow return to popularity for Indian markets.",https://economictimes.indiatimes.com/markets/stocks/rssfeeds/2146843.cms
CMS Info Systems bags Rs 400 crore HDFC Bank ATM management mandate,https://economictimes.indiatimes.com/markets/stocks/news/cms-info-systems-bags-rs-400-crore-hdfc-bank-atm-management-mandate/articleshow/131001140.cms,2026-05-11 00:44:09 IST,"CMS Info Systems has won a significant Rs 400 crore contract with HDFC Bank. The deal spans five years and involves managing 6,000 ATMs. CMS will offer complete ATM services, including cash management and AI-driven optimization. This partnership follows CMS's previous work with ICICI Bank and State Bank of India.",https://economictimes.indiatimes.com/markets/stocks/rssfeeds/2146843.cms
"Stocks to watch: Canara Bank, Indian Hotels, MCX, Swiggy among 10 shares in focus today",https://www.livemint.com/market/stock-market-news/stocks-to-watch-canara-bank-indian-hotels-mcx-swiggy-among-10-shares-in-focus-today-11778464145022.html,2026-05-11 07:50:30 IST,"Stock market today: The Indian stock market is likely to continue its losing streak as trends in the Gift Nifty index signalled a negative opening on Monday. Amid this backdrop, these stocks will remain in focus on 11 May.",https://www.livemint.com/rss/markets
"Raja Venkatraman, MarketSmith recommend five stocks for 11 May",https://www.livemint.com/market/stock-market-news/raja-venkatraman-marketsmith-recommend-five-stocks-for-11-may-11778463627583.html,2026-05-11 07:43:25 IST,"The Indian stock market saw losses on 8 May, with Sensex down 516 points and Nifty 50 down 151 points due to banking stock weakness. Analysts suggest buying Metropolis Healthcare, Bharat Forge, and Timken India based on recovery trends and market analysis.",https://www.livemint.com/rss/markets
"Buy or sell: Gift Nifty down, Vaishali Parekh recommends three stocks to buy today —11 May 2026",https://www.livemint.com/market/stock-market-news/buy-or-sell-gift-nifty-down-vaishali-parekh-recommends-three-stocks-to-buy-today-11-may-2026-11778461730340.html,2026-05-11 07:38:37 IST,"Buy or sell: Gift Nifty down, Vaishali Parekh recommends three stocks to buy today — Morepen Laboratories, Reliance, and AU Small Finance Bank",https://www.livemint.com/rss/markets
"Nifty 50, Sensex prediction today: Check how Indian stock market is expected to trade on 11 May",https://www.livemint.com/market/stock-market-news/nifty-50-sensex-prediction-today-check-how-indian-stock-market-is-expected-to-trade-on-11-may-11778463626282.html,2026-05-11 07:29:14 IST,"Nifty 50, Sensex prediction today: The trends on Gift Nifty also indicate a negative start for the Indian benchmark index. The Gift Nifty was trading around 24,055 level, a discount of nearly 179 points from the Nifty futures’ previous close.",https://www.livemint.com/rss/markets
Crude oil prices jump 4% on US-Iran peace talks failure; Brent crude near $104 per barrel,https://www.livemint.com/market/commodities/crude-oil-prices-jump-4-on-us-iran-peace-talks-failure-brent-crude-near-104-per-barrel-11778462084424.html,2026-05-11 07:12:32 IST,"US-Iran war: Brent crude futures rose $3.18, or 3.14%, to $104.47 a barrel, building on Friday’s 1.23% gain. Here's what's driving the rally in crude oil prices.",https://www.livemint.com/rss/markets
"Goldman Says Yuan 20% Undervalued, Boosts Currency Forecasts",https://www.livemint.com/market/goldman-says-yuan-20-undervalued-boosts-currency-forecasts-11778463412804.html,2026-05-11 07:06:52 IST,"The Chinese yuan is more than 20% undervalued against the US dollar, according to Goldman Sachs Group Inc., which expects the currency to keep strengthening over the coming year.",https://www.livemint.com/rss/markets
Pidilite walks pricing tightrope as raw material costs soar,https://www.livemint.com/market/mark-to-market/pidilite-industries-price-hikes-raw-material-inflation-vam-prices-ebitda-margin-uvg-fevicol-roff-dr-fixit-11778389560607.html,2026-05-11 07:00:57 IST,"Pidilite has raised prices twice to offset a 40–50% spike in input costs triggered by the West Asia war, but sustaining peak margins amid inflation may prove difficult.",https://www.livemint.com/rss/markets
"From Gift Nifty, US-Iran peace talks, oil prices to Kospi: 8 things that changed for Indian stock market over weekend",https://www.livemint.com/market/stock-market-news/from-gift-nifty-us-iran-peace-talks-oil-prices-to-kospi-8-things-that-changed-for-indian-stock-market-over-weekend-11778462136334.html,2026-05-11 07:00:08 IST,"Gift Nifty was trading around 24,092 level, a discount of nearly 142 points from the Nifty futures’ previous close, indicating a negative start for the Indian stock market indices.",https://www.livemint.com/rss/markets
Australian shares fall after Trump rebuffs Iran; CSL sinks to near decade‑low,https://www.livemint.com/market/australian-shares-fall-after-trump-rebuffs-iran-csl-sinks-to-near-decadelow-11778462985835.html,2026-05-11 06:59:45 IST,AUSTRALIA-STOCKS/ MIDDAY:Australian shares fall after Trump rebuffs Iran; CSL sinks to near decade‑low,https://www.livemint.com/rss/markets
Breakout stocks to buy or sell: Sumeet Bagadia recommends five shares to buy today — 11 May 2026,https://www.livemint.com/market/stock-market-news/breakout-stocks-to-buy-or-sell-sumeet-bagadia-recommends-five-shares-to-buy-today-11-may-2026-11778460468416.html,2026-05-11 06:39:45 IST,The Indian stock market ended Friday's session on a lower note. Sumeet Bagadia of Choice Broking recommends five breakout stocks to buy today.,https://www.livemint.com/rss/markets
Why are midcap stocks gaining momentum ongoing geopolitical tensions? Explained,https://www.livemint.com/market/stock-market-news/why-are-midcap-stocks-gaining-momentum-ongoing-geopolitical-tensions-explained-11778409175212.html,2026-05-11 06:15:15 IST,"Market outlook now points to sustained MF and retail investor interest into 2026, supported by easing crude oil prices and solid consumer confidence, as evidenced by steady volume demand in Q4FY26 corporate earnings and consistent monthly GST inflows.",https://www.livemint.com/rss/markets
Stocks to trade: Raja Venkatraman recommends three stocks for 11 May,https://www.livemint.com/market/stock-market-news/stocks-to-trade-raja-venkatraman-three-stocks-nifty-sensex-metropolis-timken-india-bharat-forge-11778415701504.html,2026-05-11 06:01:16 IST,Market expert Raja Venkatraman shares his top stock picks for 11 May. Here’s his technical outlook and trade strategy.,https://www.livemint.com/rss/markets
Stock recommendations for 11 May from MarketSmith India,https://www.livemint.com/market/stock-market-news/stock-recommendations-for-11-may-from-marketsmith-india-11778416768122.html,2026-05-11 06:00:16 IST,"MarketSmith India reveals its top stock recommendations for today, 11 May. Get expert insights into the best-performing stocks to guide your investment decisions.",https://www.livemint.com/rss/markets
"Cash, with caveats: Is Sebi about to nudge the door open for  agri-commodities?",https://www.livemint.com/market/commodities/cash-with-caveats-is-sebi-about-to-nudge-the-door-open-on-agri-commodities-derivatives-ncdex-11778408784566.html,2026-05-11 05:50:35 IST,"Cash settlements may debut on setlect agricultral commodity derivatives, with some conditions. The move, greenlit by a Sebi committee, aims to balance the need to manage risks and deepen farm derivatives.",https://www.livemint.com/rss/markets
Dollar strengthens as Trump says Iran peace offer unacceptable,https://www.livemint.com/market/dollar-strengthens-as-trump-says-iran-peace-offer-unacceptable-11778458453342.html,2026-05-11 05:44:12 IST,GLOBAL-FOREX/:FOREX-Dollar strengthens as Trump says Iran peace offer 'unacceptable',https://www.livemint.com/rss/markets
"Nintendo shares slump as price hikes, games shortfall spook market",https://www.livemint.com/companies/nintendo-shares-slump-as-price-hikes-games-shortfall-spook-market-11778461387726.html,2026-05-11 06:33:07 IST,"NINTENDO-STOCKS/:Nintendo shares slump as price hikes, games shortfall spook market",https://www.livemint.com/rss/companies
"Logjam seen as Noel Tata votes against Venu Srinivasan, Vijay Singh at a Tata Trust affiliate",https://www.livemint.com/companies/people/india-noel-tata-votes-against-continuation-of-venu-srinivasan-vijay-singh-trust-affiliate-11778393144382.html,2026-05-11 06:00:56 IST,Noel Tata's rejection of Venu Srinivasan and Vijay Singh's reappointment at a Tata Trust affiliate signals a fracture within philanthropic entities that control the group. This discord complicates future decisions at Tata Sons given that most decisions at the trusts need unanimous approval.,https://www.livemint.com/rss/companies
Rolls-Royce bets big on India—from jet engines to nuclear reactors via a BP playbook,https://www.livemint.com/companies/news/rolls-royce-india-bp-playbook-jet-engines-nuclear-reactors-amca-engine-contracts-strategy-11778389172052.html,2026-05-11 06:00:56 IST,"The aerospace major is turning to a former BP India head and BP-style localization strategy to expand its footprint in defence, aviation and nuclear sectors.",https://www.livemint.com/rss/companies
India's largest container port JNPA engages investment banks for planned IPO,https://www.livemint.com/companies/news/indias-largest-container-port-jnpa-engages-investment-banks-for-planned-ipo-11778395556007.html,2026-05-11 06:00:16 IST,"The government has engaged state-backed investment banks to explore an IPO of JNPA, the country's largest container port handling 54% of national container traffic, as part of its National Monetization Pipeline.&amp;nbsp;",https://www.livemint.com/rss/companies
BigBasket’s quick-commerce rethink: profit trumps scale,https://www.livemint.com/companies/news/bigbasket-quick-commerce-profit-market-share-strategy-india-online-grocery-business-11778393231315.html,2026-05-11 05:45:55 IST,"BigBasket co-founder Vipul Parekh says it is not important to be in the top three, four, or five; what matters is being profitable.",https://www.livemint.com/rss/companies
"With 50% rally in 2026, Adani Power now most valued power company in India: What's working in its favour",https://economictimes.indiatimes.com/markets/stocks/news/with-50-rally-in-2026-adani-power-now-most-valued-power-company-in-india-whats-working-in-its-favour/articleshow/131006216.cms,2026-05-11 12:02:19 IST,"A nearly 50% rally in 2026 has made Adani Power India’s most valuable listed power firm, surpassing NTPC. Strong earnings, rising demand, high PLFs, new tariff PPAs and growing institutional ownership are driving the stock’s sharp re-rating, even as valuation risks remain.",https://economictimes.indiatimes.com/markets/stocks/rssfeeds/2146843.cms
"SBI, IndusInd Bank, Yes Bank, and other stocks tumble up to 4%, Nifty Bank drops 900 points. What lies ahead?",https://economictimes.indiatimes.com/markets/stocks/news/sbi-indusind-bank-yes-bank-and-other-stocks-tumble-up-to-4-nifty-bank-drops-900-points-what-lies-ahead/articleshow/131006082.cms,2026-05-11 11:59:28 IST,"The Nifty Bank index plunged nearly 900 points, driven by weak earnings from State Bank of India and broader market sentiment. SBI shares led the decline, while other major banks also saw significant drops. Analysts anticipate continued consolidation in the index, with key support and resistance levels identified.",https://economictimes.indiatimes.com/markets/stocks/rssfeeds/2146843.cms
Morgan Stanley warns oil market in ‘race against time’ as Strait of Hormuz remains shut amid Iran war,https://economictimes.indiatimes.com/markets/stocks/news/morgan-stanley-warns-oil-market-in-race-against-time-as-strait-of-hormuz-remains-shut-amid-iran-war/articleshow/131005993.cms,2026-05-11 11:54:00 IST,"Morgan Stanley warned that global oil markets are in “a race against time” as prolonged disruption in the Strait of Hormuz could sharply tighten supplies and push crude prices higher. Analysts said current market buffers may weaken if the closure extends into late June or July, raising risks for global energy markets.",https://economictimes.indiatimes.com/markets/stocks/rssfeeds/2146843.cms
​LIC bought shares worth $2 billion in these 10 companies in Q4. Do you own any?​,https://economictimes.indiatimes.com/markets/stocks/news/lic-bought-shares-worth-2-billion-in-these-10-companies-in-q4-do-you-own-any/slideshow/131005934.cms,2026-05-11 11:41:54 IST,"​State-run insurer LIC invested nearly $2 billion in 10 companies during Q4 FY26, including Bajaj Finance, Bharti Airtel, and TCS. Despite market downturns and AI disruption fears, LIC strategically bought shares in these firms, with some experiencing significant price drops during the quarter.​",https://economictimes.indiatimes.com/markets/stocks/rssfeeds/2146843.cms
"Bank of Baroda shares gain over 2% after Q4 results. Should you buy, sell or hold?",https://economictimes.indiatimes.com/markets/stocks/news/bank-of-baroda-shares-gain-over-2-after-q4-results-should-you-buy-sell-or-hold/articleshow/131005589.cms,2026-05-11 11:37:52 IST,"Bank of Baroda shares rose after the state-run lender reported an 11.2% year-on-year rise in Q4 consolidated net profit to Rs 5,616 crore, driven by a 9% growth in net interest income. However, the bank’s non-interest income declined 16% during the quarter.",https://economictimes.indiatimes.com/markets/stocks/rssfeeds/2146843.cms
MCX shares jump 4% despite overall market weakness. Here's why,https://economictimes.indiatimes.com/markets/stocks/news/mcx-shares-jump-4-despite-overall-market-weakness-heres-why/articleshow/131005232.cms,2026-05-11 11:21:00 IST,"Multi-Commodity Exchange of India shares surged after the company reported a sharp rise in Q4FY26 earnings. Net profit jumped 291% year-on-year, while revenue more than tripled amid higher participation and strong growth across commodity segments. The exchange also announced a final dividend of Rs 8 per share.",https://economictimes.indiatimes.com/markets/stocks/rssfeeds/2146843.cms
"IndiGo, Spicejet &amp; other travel stocks plunge up to 7%. Two big reasons why",https://economictimes.indiatimes.com/markets/stocks/news/indigo-spicejet-other-travel-stocks-plunge-up-to-7-two-big-reasons-why/articleshow/131004682.cms,2026-05-11 10:59:28 IST,"Travel stocks, including IndiGo, SpiceJet, ixigo, Toman Cook and Yatra Online, fell sharply after Prime Minister Narendra Modi urged citizens to avoid non-essential foreign travel for a year. Rising crude oil prices added further pressure, pushing aviation turbine fuel costs higher and weighing on margins, demand and sector sentiment.",https://economictimes.indiatimes.com/markets/stocks/rssfeeds/2146843.cms
"SBI shares plunge 10% in two days after Q4. Do Morgan Stanley, Citi &amp; Bernstein see a rebound soon?",https://economictimes.indiatimes.com/markets/stocks/news/sbi-shares-crash-10-in-two-days-after-q4-do-morgan-stanley-citi-bernstein-and-others-see-upside-in-swiggy/articleshow/131004597.cms,2026-05-11 10:54:40 IST,"SBI shares fell over 3% on Monday and are down 10% in two sessions despite the lender reporting a 6% YoY rise in Q4 standalone net profit to Rs 19,684 crore. Net interest income rose 4%, while provisions declined sharply. However, softer net interest margins weighed on investor sentiment following the March-quarter earnings announcement.",https://economictimes.indiatimes.com/markets/stocks/rssfeeds/2146843.cms
Tata Consumer shares soar 7% after better-than-expected Q4 earnings. Here’s what Morgan Stanley &amp; other top brokerages say,https://economictimes.indiatimes.com/markets/stocks/news/tata-consumer-shares-soar-7-after-better-than-expected-q4-earnings-heres-what-morgan-stanley-other-top-brokerages-say/articleshow/131004447.cms,2026-05-11 10:53:25 IST,"Tata Consumer Products shares rose sharply on Monday after strong Q4 earnings beat estimates. Consolidated net profit rose 21% YoY, supported by robust India-branded business performance. Brokerages including Morgan Stanley, Motilal Oswal and Elara Capital remain positive, projecting healthy growth, margin expansion and further upside for the FMCG major.",https://economictimes.indiatimes.com/markets/stocks/rssfeeds/2146843.cms
Goldman Sachs picks 12 alpha stocks amid record $22 billion FII exodus,https://economictimes.indiatimes.com/markets/stocks/news/goldman-sachs-picks-12-alpha-stocks-amid-record-22-billion-fii-exodus/articleshow/131003828.cms,2026-05-11 10:30:59 IST,"Goldman Sachs has identified 12 Indian stocks as medium-term alpha bets despite warning that the record $22 billion FII selloff in 2026 may persist. Foreign investors have already pulled out more than last year’s total, marking one of the sharpest equity outflows in over two decades amid continued global risk-off sentiment.",https://economictimes.indiatimes.com/markets/stocks/rssfeeds/2146843.cms
Who is your worst enemy in markets? Here’s what Buffett’s mentor Benjamin Graham says,https://economictimes.indiatimes.com/markets/stocks/news/who-is-your-worst-enemy-in-markets-heres-what-buffetts-mentor-benjamin-graham-says/articleshow/131003640.cms,2026-05-11 10:09:35 IST,"Benjamin Graham, Warren Buffett's mentor, identified investors themselves as their worst market enemies, attributing disaster to Wall Street's enthusiasm. He emphasized that temperament, not just knowledge, is key to investment success, advocating for a strong-minded approach based on the margin-of-safety principle. Graham also distinguished between speculation and investment, advising a separate, smaller fund for speculative ventures.",https://economictimes.indiatimes.com/markets/stocks/rssfeeds/2146843.cms
"Bajaj Auto's Rs 5,633 crore share buyback: Should you participate or avoid?",https://economictimes.indiatimes.com/markets/stocks/news/bajaj-autos-rs-5633-crore-share-buyback-should-you-participate-or-avoid/articleshow/131003511.cms,2026-05-11 10:03:54 IST,"Bajaj Auto is undertaking its largest share buyback at Rs 5,633 crore. The offer price of Rs 12,000 per share presents a premium for shareholders. Retail investors may benefit due to a reserved portion and promoter non-participation. This move signals management confidence and strong cash generation. Investors should await the record date and letter of offer for participation decisions.",https://economictimes.indiatimes.com/markets/stocks/rssfeeds/2146843.cms
"Swiggy shares plunge 7% after Q4 results. What are Nomura, Citi and others saying?",https://economictimes.indiatimes.com/markets/stocks/news/swiggy-shares-plunge-7-after-q4-results-what-are-nomura-citi-and-others-saying/articleshow/131003473.cms,2026-05-11 09:58:51 IST,"Swiggy shares plunged 7% after the company reported a Q4 FY26 net loss of Rs 800 crore. Despite narrowing losses and strong growth in food delivery and Instamart, brokerages flagged rising competition in quick commerce. Nuvama, Nomura and Citi retained bullish ratings, citing improving margins, strong execution and long-term growth potential in both delivery business.",https://economictimes.indiatimes.com/markets/stocks/rssfeeds/2146843.cms
Beyond Nifty: The 10 smallcap stocks that doubled investor wealth in the first 25 sessions of FY27,https://economictimes.indiatimes.com/markets/stocks/news/beyond-nifty-the-10-smallcap-stocks-that-doubled-investor-wealth-in-the-first-25-sessions-of-fy27/articleshow/131003239.cms,2026-05-11 09:46:08 IST,"Indian smallcap stocks are delivering impressive returns early in FY27. Over ten stocks have doubled investor wealth in just 25 sessions. This surge is driven by genuine earnings growth, with many companies exceeding expectations. While the Nifty shows modest gains, these smaller companies are benefiting from domestic capex and infrastructure spending. Investors are finding opportunities in these selective stocks.",https://economictimes.indiatimes.com/markets/stocks/rssfeeds/2146843.cms
Top Nifty50 stocks analysts suggest buying in this volatile week,https://economictimes.indiatimes.com/markets/stocks/news/top-nifty50-stocks-analysts-suggest-buying-in-this-volatile-week/articleshow/131003206.cms,2026-05-11 09:41:41 IST,"Stock Reports Plus, powered by Refinitiv, is a comprehensive report that evaluates five key components of 4,000+ listed stocks – earnings, fundamentals, relative valuation, risk, and price momentum – to generate standardised scores. The simple average of the above-mentioned five component ratings is normally distributed to reach an average score.",https://economictimes.indiatimes.com/markets/stocks/rssfeeds/2146843.cms
"Why is market falling today? Sensex crashes 1,100 points, Nifty below 23,900. 6 key factors",https://economictimes.indiatimes.com/markets/stocks/news/why-is-market-falling-today-sensex-tumbles-900-points-nifty-below-23400-6-key-factors/articleshow/131003150.cms,2026-05-11 09:37:43 IST,"Indian stock markets experienced a significant downturn on Monday. The Sensex and Nifty saw substantial drops, wiping out considerable market capitalization. This decline was triggered by Prime Minister Narendra Modi's appeal for energy conservation and diminishing prospects for an Iran-US peace deal.",https://economictimes.indiatimes.com/markets/stocks/rssfeeds/2146843.cms
