title,link,published,summary,source
GIFT Nifty up 190 points; here's the trading setup for today's session,https://economictimes.indiatimes.com/markets/stocks/news/pre-market-action-heres-the-trade-setup-for-todays-session/articleshow/128683641.cms,2026-02-23 06:11:00 IST,"Markets brace for weekend news as the Supreme Court struck down Trump's broad tariffs, prompting him to impose new levies under a different law. Asian markets showed mixed movements, with Japan's Nikkei dropping and Australia's ASX 200 gaining. The Indian rupee weakened against the dollar, nearing the 91 mark.",https://economictimes.indiatimes.com/markets/stocks/rssfeeds/2146843.cms
RBI likely to infuse Rs 5 lakh crore into market in FY27,https://economictimes.indiatimes.com/markets/stocks/news/rbi-likely-to-infuse-rs-5-lakh-crore-into-market-in-fy27/articleshow/128694096.cms,2026-02-23 06:05:50 IST,"Economists anticipate the Reserve Bank of India will inject at least ₹5 lakh crore through liquidity operations next fiscal year. This move aims to balance a significant supply-demand imbalance in the bond market, facilitating effective transmission of past rate cuts and controlling borrowing costs amid substantial issuances.",https://economictimes.indiatimes.com/markets/stocks/rssfeeds/2146843.cms
"Stocks in news: IDFC First Bank, Vedanta, Ola Electric, Bharti Airtel, Adani Power",https://economictimes.indiatimes.com/markets/stocks/news/stocks-in-news-idfc-first-bank-vedanta-ola-electric-bharti-airtel-adani-power/articleshow/128683499.cms,2026-02-23 06:01:00 IST,"Indian equities closed the week with modest gains, driven by value buying in fundamentally strong stocks. Markets are expected to remain volatile due to the upcoming monthly F&amp;O expiry. Several companies like IDFC First Bank, Vedanta, and Bharti Airtel are in focus due to significant news developments.",https://economictimes.indiatimes.com/markets/stocks/rssfeeds/2146843.cms
"Bulls may lose vigour near 26,000; support at 25,200: Analysts",https://economictimes.indiatimes.com/markets/stocks/news/bulls-may-lose-vigour-near-26000-support-at-25200-analysts/articleshow/128693792.cms,2026-02-23 05:51:45 IST,"Nifty is poised for a range-bound week, facing strong support near 25,200. Analysts suggest gains may be limited around 25,650. Traders are advised to watch for a decisive breakout. Specific stock recommendations include Bajaj Finance, Dixon Technologies, Bharat Electronics, Tata Steel, Navin Fluorine, and Colgate Palmolive. Strategies focus on navigating this anticipated market movement.",https://economictimes.indiatimes.com/markets/stocks/rssfeeds/2146843.cms
"Some short covering likely, but tariff flip-flop to weigh",https://economictimes.indiatimes.com/markets/stocks/news/some-short-covering-likely-but-tariff-flip-flop-to-weigh/articleshow/128693633.cms,2026-02-23 05:36:35 IST,"Indian markets approach Monday with cautious optimism following a US Supreme Court ruling on tariffs. While new levies are lower than initially feared, ongoing trade uncertainties and geopolitical tensions with Iran are expected to temper any significant gains. Analysts anticipate a modest rally, with investors now focusing on earnings and currency movements for future direction.",https://economictimes.indiatimes.com/markets/stocks/rssfeeds/2146843.cms
Bearish bets on local IT counters surge as AI fears spook investors,https://economictimes.indiatimes.com/markets/stocks/news/bearish-bets-on-local-it-counters-surge-as-ai-fears-spook-investors/articleshow/128693565.cms,2026-02-23 05:32:24 IST,"Indian IT stocks face increased bearish bets. Traders are positioning for future declines, with significant open interest build-up in IT stock futures. This trend intensifies following AI automation tool launches. The sector's growth trajectory is under scrutiny. Investors are closely watching upcoming contract expiries for further directional cues.",https://economictimes.indiatimes.com/markets/stocks/rssfeeds/2146843.cms
Stock Radar: Indian Bank stock in an uptrend; hits fresh record highs in February 2026 – time to buy or book profits?,https://economictimes.indiatimes.com/markets/stocks/news/stock-radar-indian-bank-stock-in-an-uptrend-hits-fresh-record-highs-in-february-2026-time-to-buy-or-book-profits/articleshow/128611880.cms,2026-02-23 05:00:00 IST,"Indian Bank has surged to a fresh record high, surpassing the Rs 920 resistance level and indicating continued upward momentum. Experts suggest short-term traders can target over Rs 1,000 in the coming weeks, with the stock showing strong bullish signals across multiple technical indicators.",https://economictimes.indiatimes.com/markets/stocks/rssfeeds/2146843.cms
"Indian stock market: 10 key things that changed for market over weekend - Gift Nifty, Trump tariffs to US-Iran talks",https://www.livemint.com/market/stock-market-news/indian-stock-market-10-key-things-that-changed-for-market-over-weekend-gift-nifty-trump-tariffs-to-us-iran-talks-11771788096801.html,2026-02-23 07:04:17 IST,"Gift Nifty was trading around 25,750 level, a premium of nearly 167 points from the Nifty futures’ previous close, indicating a gap-up start for the Indian stock market indices.",https://www.livemint.com/rss/markets
"Oil slides on Iran nuclear talks, fresh US tariff uncertainty",https://www.livemint.com/market/oil-slides-on-iran-nuclear-talks-fresh-us-tariff-uncertainty-11771809828517.html,2026-02-23 06:53:47 IST,"GLOBAL-OIL:Oil slides on Iran nuclear talks, fresh US tariff uncertainty",https://www.livemint.com/rss/markets
Australian stocks fall as US tariff move sours risk appetite,https://www.livemint.com/market/australian-stocks-fall-as-us-tariff-move-sours-risk-appetite-11771809588795.html,2026-02-23 06:49:48 IST,AUSTRALIA-STOCKS/ MIDDAY:Australian stocks fall as US tariff move sours risk appetite,https://www.livemint.com/rss/markets
"Gold, silver rates today: COMEX gold price near $5,200/oz, silver price surges 5%. Should you buy in this rally?",https://www.livemint.com/market/commodities/gold-silver-rates-today-comex-gold-price-near-5-200-oz-silver-price-surges-5-should-you-buy-in-this-rally-11771807146827.html,2026-02-23 06:47:10 IST,"Gold, silver rates today: Spot gold prices were up 1.61% to $5,160 per ounce, while silver prices climbed 5% to $86 per ounce, during the Asian trading hours on Monday.",https://www.livemint.com/rss/markets
Markets are churning furiously beneath a calm surface,https://www.livemint.com/market/markets-are-churning-furiously-beneath-a-calm-surface-11771808595177.html,2026-02-23 06:37:03 IST,AI is prompting investors to reassess every business model under the sun,https://www.livemint.com/rss/markets
Trump Tariff Twists: Why India and Asian markets could be the biggest winners,https://www.livemint.com/market/stock-market-news/donald-trump-tariff-twists-why-india-and-asian-stock-markets-could-be-biggest-winners-after-us-sc-verdict-on-tariffs-11771780713516.html,2026-02-23 06:27:33 IST,"Indian stock markets may see a relief rally this week despite fresh US trade policy changes. A Supreme Court ruling declared certain tariffs illegal, leading to a new 10% tariff.&amp;nbsp;",https://www.livemint.com/rss/markets
Stock recommendations for 23 February from MarketSmith India,https://www.livemint.com/market/stock-market-news/stock-recommendations-for-23-february-from-marketsmith-india-sensex-nifty-outlook-trade-set-up-11771591006605.html,2026-02-23 06:00:59 IST,"MarketSmith India reveals its top stock recommendations for today, 23 February. Get expert insights into the best-performing stocks to guide your investment decisions.",https://www.livemint.com/rss/markets
Did foreign investors and prop traders sniff the US tariff verdict?,https://www.livemint.com/market/stock-market-news/did-foreign-investors-and-prop-traders-sniff-the-us-supreme-court-tariff-verdict-donald-trump-11771746832537.html,2026-02-23 05:50:18 IST,"As if on anticipation of the US Supreme Court ruling on legality of the Trump tariffs , foreign institutional investors flipped bearish option bets to bullish ones, while proprietary traders also upped the ante ahead of the weekend",https://www.livemint.com/rss/markets
JSW Infra’s strong growth narrative outweighs equity dilution worries even as timely execution risks persist,https://www.livemint.com/market/mark-to-market/jsw-infrastructure-massive-fundraise-capex-growth-investor-impact-11771752033005.html,2026-02-23 05:45:38 IST,JSW Infra's management is front-loading capex to hit 175 mtpa volume by 2028. The upcoming QIP will provide the necessary liquidity to bridge the funding gap for its port expansion strategy.,https://www.livemint.com/rss/markets
Clean Max IPO bets on growth discount in a weak listing market,https://www.livemint.com/market/clean-max-ipo-green-energy-india-market-outlook-investor-dilemma-11771737641809.html,2026-02-23 05:45:18 IST,"Clean Max Enviro Energy Solutions has made a significant financial turnaround, achieving profitability in FY25 after previous losses. With impressive growth in revenue and EBITDA, the company's management is optimistic about continuing this momentum.",https://www.livemint.com/rss/markets
Nifty may scale new peaks in 12-18 months as valuations turn attractive: Nuvama AMC's Nikhil Ranka,https://www.livemint.com/market/stock-market-news/indian-stock-market-forecast-nuvama-cio-nifty-it-midcap-smallcap-sectors-invest-11771739533268.html,2026-02-23 05:30:18 IST,"Despite $30 billion in outflows, Nikhil Ranka, CIO-equity alternatives at Nuvama Asset Management, believes the worst of FII selling is over, and the Nifty is primed for a recovery within the next year.",https://www.livemint.com/rss/markets
PE-VC backed Indian companies see their median IPO timelines shrink to a decade-low in 2025,https://www.livemint.com/companies/news/pevc-backed-indian-companies-see-their-median-ipo-timelines-shrink-to-a-decade-low-in-2025-11771746989163.html,2026-02-23 06:00:59 IST,"Indian companies are hitting the stock market at a decade-high speed as regulations ease and domestic cash flows surge. The median age for PE-VC backed IPOs dropped last year, far outpacing that of traditional family businesses.",https://www.livemint.com/rss/companies
The rise of India's consultant CEO: From advisor to executor,https://www.livemint.com/companies/india-inc-hiring-strategic-consultants-top-executive-roles-11771743801368.html,2026-02-23 06:00:19 IST,"India Inc is increasingly hiring strategic consultants from firms like McKinsey, Bain, Kearney and BCG for top leadership roles, valuing their cross-sector expertise and ability to navigate complex, volatile environments. Consultants bring a global perspective and strong problem-solving skills.",https://www.livemint.com/rss/companies
Tata Steel to source at least half its ore from captive mines after leases end 2030: CEO T.V. Narendran,https://www.livemint.com/companies/india-tata-steel-captive-iron-ore-mines-sourcing-after-2030-ceo-tv-narendran-11771729254959.html,2026-02-23 06:00:19 IST,"Tata Steel aims to source half of its iron ore from captive mines after 2030, down from the current 100%—marking a change in strategy due to rising auction prices. The company is also working on overseas sourcing and recycling operations, although higher market dependency may raise costs.",https://www.livemint.com/rss/companies
HCL to supply 25% of India’s display chips in two years: Roshni Nadar,https://www.livemint.com/companies/news/hcl-to-supply-25-of-india-s-display-chips-in-two-years-roshni-nadar-11771756378132.html,2026-02-23 05:55:39 IST,"Returning to its hardware roots, HCL Group is investing  ₹3,700 crore in a semiconductor assembly venture. The move seeks to capitalize on India’s growing demand for locally made electronics components.",https://www.livemint.com/rss/companies
IT honchos dismiss AI fears ahead of annual industry gala,https://www.livemint.com/companies/news/it-ai-nasscom-tcs-infosys-hcltech-11771753080769.html,2026-02-23 05:50:19 IST,"Homegrown IT majors—TCS, Infosys and HCLTech—will be in the spotlight Tuesday at Nasscom’s annual meet, which takes stock of the sector and signals the direction of India’s tech services industry.",https://www.livemint.com/rss/companies
Behind the  ₹590-crore alleged fraud at IDFC First Bank's branch in Haryana,https://www.livemint.com/companies/news/behind-the-590-crore-alleged-fraud-at-idfc-first-bank-branch-in-haryana-chandigarh-11771763733618.html,2026-02-23 05:35:38 IST,"When an account holder wanted to close the account, it was found that the account balance was not what was expected. IDFC First Bank has begun investigating the matter, suspended officials and informed RBI.",https://www.livemint.com/rss/companies
Top Nifty50 stocks analysts suggest buying in this volatile week,https://economictimes.indiatimes.com/markets/stocks/news/top-nifty50-stocks-analysts-suggest-buying-in-this-volatile-week/articleshow/128698350.cms,2026-02-23 09:40:24 IST,"Stock Reports Plus, powered by Refinitiv, is a comprehensive report that evaluates five key components of 4,000+ listed stocks – earnings, fundamentals, relative valuation, risk, and price momentum – to generate standardised scores. The simple average of the above-mentioned five component ratings is normally distributed to reach an average score.",https://economictimes.indiatimes.com/markets/stocks/rssfeeds/2146843.cms
AI scare for SIP investors: Will a prolonged slump in IT stocks affect mutual fund returns?,https://economictimes.indiatimes.com/markets/stocks/news/ai-scare-for-sip-investors-will-a-prolonged-slump-in-it-stocks-affect-mutual-fund-returns/articleshow/128698457.cms,2026-02-23 09:39:28 IST,"Indian retail investors are worried as IT stocks face a sharp correction due to artificial intelligence fears. This downturn could impact mutual fund returns, affecting both lump sum investments and SIPs. Many diversified funds have significant IT exposure, raising concerns about overall portfolio performance. Investors are advised to examine sector allocations within their funds.",https://economictimes.indiatimes.com/markets/stocks/rssfeeds/2146843.cms
"Sensex surges over 600 pts, Nifty above 25,700; US tariff ruling, other key factors fuel rally",https://economictimes.indiatimes.com/markets/stocks/news/why-is-stock-market-rising-today-sensex-surges-over-600-pts-nifty-above-25700-us-tariff-ruling-other-key-factors-fuel-rally/articleshow/128698058.cms,2026-02-23 09:37:00 IST,"Indian stock markets surged on Monday, with the 30-stock index and Nifty both trading significantly higher. This positive movement was a direct reaction to the US Supreme Court's Friday decision to strike down President Donald Trump's global tariffs. Global markets are expected to follow suit, taking cues from the implications of this court order.",https://economictimes.indiatimes.com/markets/stocks/rssfeeds/2146843.cms
"Buy, Sell or Hold: Nuvama downgrades UPL to hold; DLF &amp; Phoenix Mills remain top picks on Citi",https://economictimes.indiatimes.com/markets/stocks/news/buy-sell-or-hold-nuvama-downgrades-upl-to-hold-dlf-phoenix-mills-remain-top-picks-on-citi/articleshow/128698317.cms,2026-02-23 09:33:39 IST,"Brokerages remain selective amid evolving market conditions. Nuvama downgraded UPL to Hold citing restructuring risks, while Citi maintained a Buy on Axis Bank and favoured DLF and Phoenix Mills in real estate. Strong balance sheets, improving asset quality and sectoral tailwinds continue to shape investment recommendations across segments.",https://economictimes.indiatimes.com/markets/stocks/rssfeeds/2146843.cms
Ola Electric shares in focus amid plans to cut physical stores,https://economictimes.indiatimes.com/markets/stocks/news/ola-electric-shares-in-focus-amid-plans-to-cut-physical-stores/articleshow/128697995.cms,2026-02-23 09:20:02 IST,"Ola Electric plans to cut its store network to 550 outlets amid declining market share and operational challenges. The company reported weaker sales and continued losses, though slightly improved year-on-year. With an oversold RSI and shifting investor holdings, the stock is likely to remain in focus in the near term.",https://economictimes.indiatimes.com/markets/stocks/rssfeeds/2146843.cms
How retail investors are playing a risky game by swimming against the market tide to survive Nifty bears,https://economictimes.indiatimes.com/markets/stocks/news/how-retail-investors-are-playing-a-risky-game-by-swimming-against-the-market-tide-to-survive-nifty-bears/articleshow/128697760.cms,2026-02-23 09:10:15 IST,"Indian retail investors are making bold moves in the stock market. They are buying stocks that have fallen in value and selling those that have performed well. This strategy, while providing market liquidity, often hurts personal investment returns. Data shows retail holdings increased in declining stocks and decreased in rising ones.",https://economictimes.indiatimes.com/markets/stocks/rssfeeds/2146843.cms
"​Hitachi Energy among 5 stocks flash bullish signals, indicating possible uptrend​",https://economictimes.indiatimes.com/markets/stocks/news/hitachi-energy-among-5-stocks-flash-bullish-signals-indicating-possible-uptrend/slideshow/128697524.cms,2026-02-23 08:48:29 IST,,https://economictimes.indiatimes.com/markets/stocks/rssfeeds/2146843.cms
Hyundai Motor among 5 stocks showing bullish RSI upswing,https://economictimes.indiatimes.com/markets/stocks/news/hyundai-motor-among-5-stocks-showing-bullish-rsi-upswing/slideshow/128697270.cms,2026-02-23 08:47:34 IST,"Five Nifty500 stocks, including Hyundai Motor India and Siemens, have shown a bullish RSI crossover above 50, signalling strengthening price momentum. Identified through StockEdge data, these stocks gained over 2.5% and may present potential short-term buying opportunities for traders tracking technical indicators.",https://economictimes.indiatimes.com/markets/stocks/rssfeeds/2146843.cms
AU Small Finance Bank shares slide 6% after Haryana govt de-empanels lender,https://economictimes.indiatimes.com/markets/stocks/news/au-small-finance-shares-in-focus-on-suspected-fraud-nifty-banks-top-gainer-de-empanelled-from-haryana-govt-business/articleshow/128696962.cms,2026-02-23 08:35:44 IST,"AU Small Finance Bank shares dropped over 6% after the Haryana government de-empanelled the lender from government business due to suspected fraudulent activities. The bank stated it initiated an internal review of two accounts, asserting they were duly opened and compliant with policies. This action follows a similar de-empanelment of IDFC First Bank over a Rs 590 crore fraud.",https://economictimes.indiatimes.com/markets/stocks/rssfeeds/2146843.cms
IDFC First Bank shares crash 20% after Rs 590 crore fraud disclosed at Chandigarh branch,https://economictimes.indiatimes.com/markets/stocks/news/idfc-first-bank-shares-in-focus-after-rs-590-crore-fraud-disclosed-at-chandigarh-branch/articleshow/128696544.cms,2026-02-23 08:16:25 IST,"IDFC First Bank shares plunged 20% after the lender disclosed a Rs 590 crore fraud at its Chandigarh branch involving Haryana government accounts. Four employees have been suspended as the bank initiates internal and external investigations, pursuing legal action and seeking to recover funds.",https://economictimes.indiatimes.com/markets/stocks/rssfeeds/2146843.cms
9 Sensex stocks with up to 40% upside potential — Are these in your portfolio?,https://economictimes.indiatimes.com/markets/stocks/news/9-sensex-stocks-with-up-to-40-upside-potential-are-these-in-your-portfolio/slideshow/128695595.cms,2026-02-23 07:25:32 IST,"For investors scanning the Sensex for potential outperformers, the latest analyst consensus highlights several heavyweight names that could deliver strong returns in the coming year.",https://economictimes.indiatimes.com/markets/stocks/rssfeeds/2146843.cms
Positive Breakout: These 9 stocks cross above their 200 DMAs,https://economictimes.indiatimes.com/markets/stocks/news/positive-breakout-these-9-stocks-cross-above-their-200-dmas/slideshow/128695262.cms,2026-02-23 07:10:53 IST,"As long as the stock is priced above the 200-day SMA on the daily timeframe, it is generally considered to be in an overall uptrend.",https://economictimes.indiatimes.com/markets/stocks/rssfeeds/2146843.cms
DEE Development share price jumps 11% after winning order from BHEL. Do you own?,https://www.livemint.com/market/stock-market-news/dee-development-share-price-jumps-11-after-winning-order-from-bhel-do-you-own-11771819353921.html,2026-02-23 09:38:23 IST,DEE Development share price rises 11% to  ₹257.36 apiece in Monday's trading session after the company announced it has secured a new order from Bharat Heavy Electrical Limited (BHEL).,https://www.livemint.com/rss/markets
UPL share price crashes 10% on restricting plans; Nuvama downgrades stock — Why is Dalal Street cautious?,https://www.livemint.com/market/stock-market-news/upl-share-price-crashes-8-on-restricting-plans-nuvama-downgrades-stock-why-is-dalal-street-cautious-11771819003998.html,2026-02-23 09:34:34 IST,"UPL Limited's shares fell 8% following the announcement of a group restructuring aimed at integrating its Indian and international crop protection businesses, leading to negative reactions from brokerages and investors.",https://www.livemint.com/rss/markets
"Shree Ram Twistex IPO Day 1: Issue opens today. GMP hints 5% listing pop.Check review, subscription, issue details, more",https://www.livemint.com/market/ipo/shree-ram-twistex-ipo-day-1-issue-opens-today-gmp-hints-5-listing-pop-check-review-subscription-issue-details-more-11771817037318.html,2026-02-23 09:32:47 IST,"Shree Ram Twistex IPO Day 1: Shree Ram Twistex's  ₹110 cr IPO opens Monday, with a GMP suggesting decent listing gains. The co, plans to use proceeds for renewable energy projects, debt repayment, and working capital. The IPO is entirely a fresh issue of 1.06 cr shares priced between  ₹95- ₹104.",https://www.livemint.com/rss/markets
IDFC First Bank fraud: Stock hits 10% lower circuit on  ₹590 crore fraud; Haryana govt de-empanels lender,https://www.livemint.com/market/stock-market-news/idfc-first-bank-fraud-idfc-first-bank-share-price-hits-10-lower-circuit-on-rs-590-crore-fraud-haryana-govt-deempanel-11771817213113.html,2026-02-23 09:17:07 IST,"IDFC First Bank share price hit the10% lower circuit after revealing fraudulent transactions worth  ₹590 crore at its Chandigarh branch. The Haryana government de-empanelled the bank from handling state business, citing compliance lapses.",https://www.livemint.com/rss/markets
"Gold rate jumps 2%, silver surges 6% on MCX amid escalating US-Iran tensions, dollar's sharp fall",https://www.livemint.com/market/commodities/gold-price-today-mcx-gold-silver-rate-up-on-us-iran-tensions-dollars-weakness-experts-highlight-key-levels-to-watch-11771817141529.html,2026-02-23 09:11:21 IST,"Gold price today: Gold rate jumped sharply on Monday morning. MCX gold April futures jumped by over  ₹3,700, or 2.4%, to  ₹1,60,600 per 10 grams, while MCX silver March futures jumped by nearly  ₹15,200, or 6%, to  ₹2,68,120 per kg.",https://www.livemint.com/rss/markets
"Silver rate today jumps 6% to reclaim  ₹2,68,000 amid Trump tariff twists and US Iran uncertainty - Should you buy?",https://www.livemint.com/market/commodities/silver-rate-today-jumps-6-to-rs-2-68-000-amid-trump-tariff-twists-us-iran-war-gold-price-also-up-should-you-buy-11771816133909.html,2026-02-23 09:07:01 IST,"Silver prices rose on Monday as the dollar weakened amid trade agreement uncertainties and US-Iran tensions. The US Supreme Court's ruling on tariffs boosted demand for safe-haven assets, pushing silver up 6% to  ₹2,68,120, while gold reached a three-week high.",https://www.livemint.com/rss/markets
Religare Enterprises: Can a demerger fix what poor governance had broken?,https://www.livemint.com/market/stock-market-news/religare-enterprises-demerger-rel-share-price-care-health-insurance-11771747767075.html,2026-02-23 09:00:22 IST,"Even though the demerger promises the unlocking of shareholder value, Religare Enterprises investors were not impressed. REL has corrected by 9% since 14 February, bringing the stock close to its support level.&amp;nbsp;&amp;nbsp;",https://www.livemint.com/rss/markets
"Gold, silver rates today LIVE: MCX gold tests  ₹1.60 lakh, silver jumps over 5% — how to trade?",https://www.livemint.com/market/commodities/gold-silver-rates-today-live-comex-gold-silver-prices-jump-mcx-gold-silver-rate-trump-tariffs-us-fed-rate-cut-11771815780632.html,2026-02-23 08:55:09 IST,"Gold, silver rates today: Following trade uncertainty and geopolitical tension, the COMEX silver rates today is trading green with over 6% intraday gain",https://www.livemint.com/rss/markets
"Clean Max Enviro IPO: Issue opens today. Check latest GMP, key dates, subscription, more. Apply or avoid?",https://www.livemint.com/market/ipo/clean-max-enviro-ipo-gmp-clean-max-enviro-energy-solutions-ipo-gmp-clean-max-enviro-ipo-review-clean-max-enviro-ipo-11771814118498.html,2026-02-23 08:47:02 IST,"The Clean Max Enviro IPO, valued at  ₹12,325 crore, opens on February 23, featuring a price range of  ₹1,000 to  ₹1,053 per share. The company secured  ₹921 crore from anchor investors, with significant participation from domestic institutional investors. Clean Max Enviro IPO GMP is  ₹3.",https://www.livemint.com/rss/markets
