title,link,published,summary,source
"Select stocks can gain 10-37% on Budget, trade deal boost",https://economictimes.indiatimes.com/markets/stocks/news/select-stocks-can-gain-10-37-on-budget-trade-deal-boost/articleshow/127963729.cms,2026-02-06 07:02:21 IST,Top 15 high conviction stock ideas from leading brokerages following the key events,https://economictimes.indiatimes.com/markets/stocks/rssfeeds/2146843.cms
Gift Nifty falls over 100 pts; here's trading setup for the day,https://economictimes.indiatimes.com/markets/stocks/news/gift-nifty-falls-over-100-pts-heres-trading-setup-for-the-day/articleshow/127962843.cms,2026-02-06 06:38:34 IST,"Indian stock markets moved sideways on Thursday. Investors adopted a cautious stance, awaiting new domestic cues. The Nifty index remained within a narrow band, struggling to break out. Analysts anticipate continued range-bound trading for the index. Select individual stocks may show strength. The India VIX, a fear gauge, saw a slight decrease.",https://economictimes.indiatimes.com/markets/stocks/rssfeeds/2146843.cms
"Stocks in news: Tata Steel, Hero MotoCorp, Bharti Airtel, RIL, Nykaa",https://economictimes.indiatimes.com/markets/stocks/news/stocks-in-news-tata-steel-hero-motocorp-bharti-airtel-ril-nykaa/articleshow/127962909.cms,2026-02-06 06:28:00 IST,"Markets experienced a dip on Thursday, with analysts suggesting a buy-on-dips strategy for the Nifty above 25,400. Several companies like Tata Steel, Hero MotoCorp, Nykaa, Bharti Airtel, Tata Motors PV, RIL, and RVNL are in focus due to their recent financial results and business developments.",https://economictimes.indiatimes.com/markets/stocks/rssfeeds/2146843.cms
"Asian stocks tumble as AI rout deepens, silver hammered",https://economictimes.indiatimes.com/markets/stocks/news/asian-stocks-tumble-as-ai-rout-deepens-silver-hammered/articleshow/127962703.cms,2026-02-06 06:19:35 IST,"Asian stocks extended losses for a second day, mirroring a Wall Street selloff driven by concerns over AI's impact on software profits and rising U.S. layoffs. Precious metals and cryptocurrencies also experienced significant volatility, with gold, silver, bitcoin, and ether all declining sharply.",https://economictimes.indiatimes.com/markets/stocks/rssfeeds/2146843.cms
Wall Street ends sharply down as AI worries weigh,https://economictimes.indiatimes.com/markets/stocks/news/wall-street-ends-sharply-down-as-ai-worries-weigh/articleshow/127962587.cms,2026-02-06 06:15:06 IST,"Wall Street closed sharply lower as tech giants like Microsoft and Amazon saw significant drops following Alphabet's announcement of doubled AI capital spending. Investors grew wary of hefty AI investments, fearing they may not translate into immediate revenue and profit boosts, impacting software stocks. The market saw a rotation into cheaper stocks as volatility increased.",https://economictimes.indiatimes.com/markets/stocks/rssfeeds/2146843.cms
Stock Radar: Bandhan Bank stock takes support above 50-DMA; time to buy?,https://economictimes.indiatimes.com/markets/stocks/news/stock-radar-bandhan-bank-stock-takes-support-above-50-dma-time-to-buy/articleshow/127928853.cms,2026-02-06 05:00:00 IST,"Bandhan Bank stock has bounced back, breaking out of its consolidation range after finding support above the 50-day moving average. Experts suggest short-term traders with a high-risk profile can buy the stock for a target of Rs 165 in the next 2-3 weeks, with a stop loss below Rs 153.",https://economictimes.indiatimes.com/markets/stocks/rssfeeds/2146843.cms
"Indian stock market: 10 key things that changed overnight - Gift Nifty, US tech stocks rout, gold rate to Bitcoin price",https://www.livemint.com/market/stock-market-news/indian-stock-market-10-key-things-that-changed-overnight-gift-nifty-us-tech-stocks-rout-gold-rate-to-bitcoin-price-11770314094078.html,2026-02-06 07:05:03 IST,"Gift Nifty was trading around 25,585 level, a discount of nearly 140 points from the Nifty futures’ previous close, indicating a negative start for the Indian stock market indices.",https://www.livemint.com/rss/markets
AI power play: How MTAR Technologies is fuelling the data center boom,https://www.livemint.com/market/stock-market-news/mtar-technologies-stock-analysis-mtar-technologies-share-price-11770297777598.html,2026-02-06 07:00:37 IST,"As the primary manufacturing partner for America’s Bloom Energy, MTAR is scaling up its ‘hotbox’ production to meet the skyrocketing needs of high-performance AI infrastructure.",https://www.livemint.com/rss/markets
"The age of a treacherous, falling dollar",https://www.livemint.com/market/the-age-of-a-treacherous-falling-dollar-11770340323510.html,2026-02-06 06:43:51 IST,Those holding American assets will have to get used to it,https://www.livemint.com/rss/markets
RBI MPC Meet 2026 LIVE: RBI Governor Sanjay Malhotra-led MPC to announce repo rate decision today,https://www.livemint.com/market/stock-market-news/rbi-mpc-policy-meet-2026-live-updates-repo-rates-mpc-rbi-monetary-policy-sanjay-malhotra-gdp-inflation-6-february-2026-11770314292509.html,2026-02-06 06:08:39 IST,"RBI MPC Meet 2026 LIVE: The RBI’s Monetary Policy Committee (MPC) - the rate setting panel - is widely expected to keep repo rates unchanged at 5.25%, with focus likely to remain on liquidity management and transmission.",https://www.livemint.com/rss/markets
Stock recommendations for 6 February from MarketSmith India,https://www.livemint.com/market/stock-market-news/stock-recommendations-6-february-marketsmith-india-nifty-sensex-mangalore-refinery-rain-industries-11770299015915.html,2026-02-06 06:00:56 IST,"MarketSmith India reveals its top stock recommendations for today, 6 February. Get expert insights into the best-performing stocks to guide your investment decisions.",https://www.livemint.com/rss/markets
Stocks to buy: Raja Venkatraman's recommends three stocks for 6 February,https://www.livemint.com/market/stock-market-news/stocks-to-buy-raja-venkatraman-recommends-three-stocks-6-february-sensex-nifty-outlook-trade-set-up-11770298791388.html,2026-02-06 06:00:36 IST,"Market expert Raja Venkatraman shares his three top stock picks to buy today, 6 February. Discover his exclusive picks and analysis to inform your investment strategy.",https://www.livemint.com/rss/markets
Anand Rathi Wealth’s Feroze Azeez on what US tariff rollback means for Indian markets,https://www.livemint.com/market/feroz-azeez-us-india-trade-deal-markets-indian-investors-11770279508916.html,2026-02-06 06:00:36 IST,"With the US easing tariffs on India, markets and the rupee have rallied. Anand Rathi Wealth’s Feroz Azeez explains why the impact goes beyond sentiment, when FIIs may return, and where investors should look next.",https://www.livemint.com/rss/markets
Motilal Oswal Group targets 10 owned office towers across major cities by 2028,https://www.livemint.com/market/stock-market-news/motilal-oswal-group-targets-10-owned-office-towers-across-major-cities-by-2028-11770262108511.html,2026-02-06 06:00:16 IST,"As most companies embrace co-working and asset-light models, Motilal Oswal Group is going the other way—investing heavily in owned office towers to build culture, trust and long-term value.",https://www.livemint.com/rss/markets
Mutual funds want commodity ETFs other than gold and silver. But is this feasible?,https://www.livemint.com/market/commodities/copper-etf-india-sebi-etf-regulations-gold-etfs-11770270831132.html,2026-02-06 06:00:16 IST,"Current regulations limit commodity ETFs to these two precious metals, but discussions are now underway between mutual funds and exchanges regarding other commodities, especially copper. However, several hurdles stand in the way.",https://www.livemint.com/rss/markets
Aye Finance to test IPO market even as non-bank peers prefer to wait,https://www.livemint.com/companies/aye-finance-ipo-bad-loan-nbfc-microfinance-industry-startups-india-11770210760099.html,2026-02-06 06:00:36 IST,Aye Finance has trimmed the offer size even as several NBFCs and microlenders delayed their IPOs amid sectoral pain and rising bad loans.,https://www.livemint.com/rss/companies
"AI startups positioned to transform India's IT services, despite SaaS setbacks",https://www.livemint.com/companies/india-saas-market-artificial-intelligence-startups-it-services-11770284949337.html,2026-02-06 06:00:16 IST,"As global AI agents begin to automate legacy migrations, Indian IT firms face a valuation crisis, prompting venture capital firms like Lightspeed to hunt for entrepreneurs who can increase margins through automation.",https://www.livemint.com/rss/companies
Uber ordered to pay $8.5 million in trial over driver sex assault claims,https://www.livemint.com/companies/news/uber-ordered-to-pay-8-5-million-in-trial-over-driver-sex-assault-claims-11770336132758.html,2026-02-06 05:36:05 IST,"The case was the first trial – known as a 'bellwether' – of more than 3,000 similar lawsuits against Uber that have been consolidated in U.S. federal court. Bellwether trials are used to test legal theories and help gauge the value of claims for possible settlements.",https://www.livemint.com/rss/companies
It's all about hours clocked—Urban Company data punctures work value talk,https://www.livemint.com/companies/news/urban-company-gig-worker-earnings-income-mobility-challenges-india-11770197469198.html,2026-02-06 05:30:35 IST,"Urban Company's top 5% professionals spent an average of 167 hours a month working for the platform, nearly double the hours logged by the average Urban Company ‘partner’.",https://www.livemint.com/rss/companies
Reddit forecasts strong revenue as AI tools drive ad sales,https://www.livemint.com/companies/news/reddit-forecasts-strong-revenue-as-ai-tools-drive-ad-sales-11770335234207.html,2026-02-06 05:23:39 IST,"Q4 revenue rose 70% to $726 million, beating estimates of $665.4 million. Its earnings per share of $1.24 also exceeded estimates of 94 cents. Daily active unique visitors rose 19%, to 121.4 million in the quarter ended December 31, while its global average revenue per user increased by 42%.",https://www.livemint.com/rss/companies
"Sensex, Nifty open little changed ahead of RBI MPC decision; mid, smallcaps slip",https://economictimes.indiatimes.com/markets/stocks/news/sensex-nifty-open-little-changed-ahead-of-rbi-mpc-decision-mid-smallcaps-slip/articleshow/127968078.cms,2026-02-06 09:26:14 IST,"Indian stock markets, Nifty and Sensex, began Friday trading with slight declines. This marks a second consecutive session of losses for the benchmark indices. Investors are adopting a cautious stance. This is due to the upcoming Reserve Bank of India's Monetary Policy Committee policy announcement later today. Global market sentiment also appears subdued.",https://economictimes.indiatimes.com/markets/stocks/rssfeeds/2146843.cms
RVNL shares in focus after Q3 profit rises 4% YoY to Rs 324 crore,https://economictimes.indiatimes.com/markets/stocks/news/rvnl-shares-in-focus-after-q3-profit-rises-4-yoy-to-rs-324-crore/articleshow/127967769.cms,2026-02-06 09:12:37 IST,"Shares of Rail Vikas Nigam Ltd (RVNL) will be in focus on February 6 after the state-owned rail infrastructure firm reported a modest 4% year-on-year rise in Q3FY26 net profit to Rs 324 crore. Revenue grew 3% to Rs 4,684 crore, while higher expenses capped margin expansion despite an increase in total income.",https://economictimes.indiatimes.com/markets/stocks/rssfeeds/2146843.cms
British International invests Rs 90 crore in UC Impower Fund,https://economictimes.indiatimes.com/markets/stocks/news/british-international-invests-rs-90-crore-in-uc-impower-fund/articleshow/127967570.cms,2026-02-06 09:05:08 IST,"British International Investment has invested Rs 90 crore in UC Impower, an India-focused early growth-stage equity fund, marking the largest commitment to the Rs 500 crore vehicle. The fund backs financial services and climate solution firms. UC Impower has raised about Rs 435 crore so far and plans to build a portfolio of 10–11 investments.",https://economictimes.indiatimes.com/markets/stocks/rssfeeds/2146843.cms
"Bharti Airtel shares in focus after Q3 profit drops 55% YoY to Rs 6,630 crore. Buy, sell or hold?",https://economictimes.indiatimes.com/markets/stocks/news/bharti-airtel-shares-in-focus-after-q3-profit-drops-55-yoy-to-rs-6630-crore-buy-sell-or-hold/articleshow/127966966.cms,2026-02-06 08:45:27 IST,"Bharti Airtel shares are in focus after a sharp year-on-year decline in profit despite strong revenue, EBITDA, and ARPU growth. India operations, home business expansion, lower capex, and reduced net debt supported performance. Brokerages remain positive, citing robust cash flows, subscriber additions, and improving operational metrics.",https://economictimes.indiatimes.com/markets/stocks/rssfeeds/2146843.cms
Exclusive | Why BofA's Amish Shah is booking profit in defence stocks after Budget,https://economictimes.indiatimes.com/markets/stocks/news/exclusive-why-bofas-amish-shah-is-booking-profit-in-defence-stocks-after-budget/articleshow/127966074.cms,2026-02-06 08:21:31 IST,"BofA Global Research’s Amish Shah is booking profits in defence stocks after a sharp rally, citing stretched valuations despite a strong Budget capex push. Shah prefers rotating into rate-sensitive cyclicals and sees Nifty at 29,000 by December 2026, with earnings growth expected to accelerate in FY27.",https://economictimes.indiatimes.com/markets/stocks/rssfeeds/2146843.cms
Suzlon Energy shares in focus after Q3 profit rises 15% YoY to Rs 445 crore,https://economictimes.indiatimes.com/markets/stocks/news/suzlon-energy-shares-in-focus-after-q3-profit-rises-15-yoy-to-rs-445-crore/articleshow/127965826.cms,2026-02-06 08:14:28 IST,"Suzlon Energy reported a 15% year-on-year rise in Q3FY26 profit to Rs 445 crore, supported by strong revenue growth, higher volumes, and margin expansion. The company posted record deliveries, a robust order book, and a net cash position, reinforcing confidence in its clean energy growth strategy.",https://economictimes.indiatimes.com/markets/stocks/rssfeeds/2146843.cms
"Stocks to buy in 2026 for long term: Emami, Solar Industries among 5 stocks that could give 10-50% return",https://economictimes.indiatimes.com/markets/stocks/news/stocks-to-buy-in-2026-for-long-term-emami-solar-industries-among-5-stocks-that-could-give-10-50-return/slideshow/127965599.cms,2026-02-06 08:01:57 IST,"Brokerage houses have identified select stocks across FMCG, defence manufacturing, housing finance, and staffing services as long-term investment opportunities for 2026. Recommendations on Emami, Solar Industries, Aptus Value Housing Finance, Devyani International, and TeamLease Services indicate potential returns ranging from 10% to 50%, backed by earnings visibility and valuation comfort.",https://economictimes.indiatimes.com/markets/stocks/rssfeeds/2146843.cms
"LIC shares in focus after Q3 profit rises 17% YoY to Rs 12,930 crore",https://economictimes.indiatimes.com/markets/stocks/news/lic-shares-in-focus-after-q3-profit-rises-17-yoy-to-rs-12930-crore/articleshow/127964889.cms,2026-02-06 07:43:20 IST,"Life Insurance Corporation of India's shares are in focus after a strong December quarter. The company reported a 17% year-on-year rise in net profit to Rs 12,930 crore. Net premium income also saw a 17% increase. The Value of New Business grew by nearly 28%. LIC's solvency ratio improved, and assets under management increased by over 8%.",https://economictimes.indiatimes.com/markets/stocks/rssfeeds/2146843.cms
Sebi proposes tighter rules for single-stock derivatives strategy,https://economictimes.indiatimes.com/markets/stocks/news/sebi-proposes-tighter-rules-for-single-stock-derivatives-strategy/articleshow/127964723.cms,2026-02-06 07:37:02 IST,"India's market regulator Sebi is proposing new margin rules for single-stock derivatives. The changes will affect trading strategies involving different expiry dates. Specifically, benefits from offsetting positions will not be available on the day a contract expires. This move aims to reduce risks for traders and trading members.",https://economictimes.indiatimes.com/markets/stocks/rssfeeds/2146843.cms
"Tata Motors PV shares in focus after Q3 loss widens to Rs 3,486 crore on JLR cyber incident",https://economictimes.indiatimes.com/markets/stocks/news/tata-motors-pv-shares-in-focus-after-q3-loss-widens-to-rs-3486-crore-on-jlr-cyber-incident/articleshow/127964537.cms,2026-02-06 07:32:05 IST,"Tata Motors Passenger Vehicles Ltd shares will be in spotlight reported a significant consolidated loss of Rs 3,486 crore in Q3, primarily due to a cyber incident at Jaguar Land Rover (JLR) which impacted revenue by 26%. Despite challenges, the company anticipates a strong recovery in the fourth quarter with JLR's normalization and continued domestic growth.",https://economictimes.indiatimes.com/markets/stocks/rssfeeds/2146843.cms
Technical snag at NSDL delays settlement of trades since Tuesday,https://economictimes.indiatimes.com/markets/stocks/news/technical-snag-at-nsdl-delays-settlement-of-trades-since-tuesday/articleshow/127964005.cms,2026-02-06 07:11:14 IST,A technical issue at National Securities Depository has disrupted share settlements for three days. Investors' purchased shares are not appearing in their demat accounts. This prevents them from selling these holdings. The problem stems from NSDL's inability to process inter-depository transfers. This impacts the routine movement of securities between depositories. Operations are delayed as a result.,https://economictimes.indiatimes.com/markets/stocks/rssfeeds/2146843.cms
"Stocks to buy: Rajesh Palviya of Axis Sec suggests Birlasoft, SAIL, Adani Energy shares today",https://www.livemint.com/market/stock-market-news/stocks-to-buy-rajesh-palviya-of-axis-sec-suggests-birlasoft-sail-adani-energy-shares-today-11770348541385.html,2026-02-06 09:34:21 IST,"On Friday, the Nifty 50 and Sensex began the day unchanged amid anticipation of the central bank's policy decision. Most sectors were in the red, and the indices are likely to continue their sideways trend unless they break the resistance levels above 26,000-26,400.",https://www.livemint.com/rss/markets
"Silver rate today falls 6% on MCX on strong US dollar, tech rout - Right time to buy?",https://www.livemint.com/market/commodities/silver-rate-today-fell-6-on-mcx-on-strong-us-dollar-tech-rout-right-time-to-buy-gold-prices-also-down-11770347902134.html,2026-02-06 09:06:43 IST,"Silver rates fell 6% on February 6, marking a second consecutive session of losses due to a global selloff in tech stocks and a stronger U.S. dollar. Prices on MCX reached  ₹2,29,187 per kg, leading to a nearly 16% weekly decline.",https://www.livemint.com/rss/markets
Gold rate crashes 2% on MCX on profit booking; RBI MPC outcome in focus; experts highlight key levels to watch,https://www.livemint.com/market/commodities/gold-price-today-rate-climbs-on-mcx-on-value-buying-silver-rate-in-focus-experts-highlight-key-levels-to-watch-11770348346901.html,2026-02-06 09:04:29 IST,"Gold rate declined sharply on Friday. MCX gold April futures dropped by nearly  ₹2,700, or almost 2%, to  ₹1,49,396 per 10 grams, while MCX silver March contracts crashed by  ₹14,600, or 6%, to  ₹2,29,187 per kg.",https://www.livemint.com/rss/markets
"Buy or sell: Amid RBI MPC meeting buzz, Vaishali Parekh recommends three intraday stocks to buy today — 6 February 2026",https://www.livemint.com/market/stock-market-news/buy-or-sell-amid-rbi-mpc-meeting-buzz-vaishali-parekh-recommends-three-intraday-stocks-to-buy-today-6-february-2026-11770347279840.html,2026-02-06 09:04:25 IST,"Buy or sell: Vaishali Parekh recommends three intraday stocks to buy today — LIC, GMR Power, and PNB Housing Finance",https://www.livemint.com/rss/markets
Anant Raj stock has fallen sharply. Does the three-year view look different?,https://www.livemint.com/market/stock-market-news/anant-raj-share-price-anant-raj-stock-price-target-stock-price-anant-raj-share-price-target-11770289713306.html,2026-02-06 09:01:00 IST,"Anant Raj has gained attention following the announcements in the Union Budget 2026, which provided a favourable push to data center stocks.",https://www.livemint.com/rss/markets
"Stocks to Watch: Tata Motors PV, Tata Steel, Bharti Airtel, RVNL, Nykaa, others in focus on 6 February",https://www.livemint.com/market/stock-market-news/stocks-to-watch-tata-motors-pv-tata-steel-bharti-airtel-rvnl-nykaa-others-in-focus-on-6-february-11770345426630.html,2026-02-06 08:44:06 IST,"Stocks to Watch: The Sensex and Nifty 50 are likely to open lower as global market declines affect sentiment. Earnings reports from several companies, including Bharti Airtel and Tata Motors, will be in focus, along with the RBI's upcoming monetary policy decision.",https://www.livemint.com/rss/markets
Stocks to buy for short term: Ajit Mishra of Religare Broking suggests these 3 technical picks; do you own any?,https://www.livemint.com/market/stock-market-news/stocks-to-buy-for-short-term-ioc-indus-towers-rec-ajit-mishra-of-religare-broking-suggests-these-3-technical-picks-11770345040982.html,2026-02-06 08:43:26 IST,"Ajit Mishra from Religare Broking identifies three promising stocks for short-term investment amid a volatile market. With a focus on technical patterns and market trends, Mishra provides insights that can help investors navigate their strategies effectively.",https://www.livemint.com/rss/markets
"Q3 results today: Tata Steel, Kalyan Jewellers, BEML among 200 companies to declare Q3 earnings 2026 today",https://www.livemint.com/market/stock-market-news/q3-results-today-tata-steel-kalyan-jewellers-beml-among-200-companies-to-declare-q3-earnings-2026-full-list-here-11770346971209.html,2026-02-06 08:39:37 IST,"Approximately 200 companies, including Tata Steel and Kalyan Jewellers, will report their Q3 results on February 6. The Indian stock market saw significant losses recently, with the Sensex down 504 points. Tata Steel's performance is expected to be stable despite challenges.",https://www.livemint.com/rss/markets
An AI fight is threatening the market. How to avoid getting hurt.,https://www.livemint.com/market/an-ai-fight-is-threatening-the-market-how-to-avoid-getting-hurt-11770344943816.html,2026-02-06 08:00:18 IST,Tech is ailing while other sectors are holding up. How to stay safe and avoid the AI knife fight.,https://www.livemint.com/rss/markets
"Gold, Silver Rates Today LIVE: MCX gold near  ₹1.50 lakh, silver crashes 5% to  ₹2.32 lakh per kg — how  to trade?",https://www.livemint.com/market/commodities/gold-silver-rates-today-live-breakdown-in-gold-silver-prices-today-comex-gold-below-4-800-silver-below-70oz-11770343694852.html,2026-02-06 07:54:27 IST,"Gold, Silver Rates Today LIVE: The COMEX gold rate today witnessed strong selling and touched an intraday low of $4,671.74/oz, whereas the COMEX silver rate today slipped below $70/oz and touched an intraday low of $63.900 per ounce",https://www.livemint.com/rss/markets
"Stock Market Today LIVE: Sensex, Nifty 50 open marginally lower; Rupee opens 7 paisa up ahead RBI policy",https://www.livemint.com/market/stock-market-news/stock-market-today-live-sensex-today-nifty-50-rbi-policy-nasdaq-nikkei-us-tech-stocks-gold-rate-usd-vs-inr-rupee-dollar-11770344123822.html,2026-02-06 07:53:17 IST,"Stock Market Today LIVE: The domestic benchmark indices opened marginally lower on February 6, with Sensex at 83,249.32 (down 64.61 points or 0.08%) and Nifty 50 at 25,605.80 (down 37 points or 0.14%).",https://www.livemint.com/rss/markets
"Gold, Silver Rates Today: COMEX gold dips below $4800, silver tanks 10% as easing US-Iran tension fuels US Dollar",https://www.livemint.com/market/commodities/gold-silver-rates-today-live-comex-gold-dips-below-4800-silver-tanks-10-as-easing-us-iran-tension-fuels-us-dollar-11770340759598.html,2026-02-06 07:31:41 IST,"Gold, Silver Rates Today: The COMEX gold rate today witnessed strong selling and touched an intraday low of $4,671.74/oz, whereas the COMEX silver rate today slipped below $70/oz and touched an intraday low of $63.900 per ounce",https://www.livemint.com/rss/markets
"Nifty 50, Sensex today: What to expect from Indian stock market in trade on February 6 ahead of RBI policy",https://www.livemint.com/market/stock-market-news/nifty-50-sensex-today-what-to-expect-from-indian-stock-market-in-trade-on-february-6-ahead-of-rbi-policy-11770313810501.html,2026-02-06 07:25:25 IST,"Nifty 50, Sensex today: The trends on Gift Nifty also indicate a negative start for the Indian benchmark index. The Gift Nifty was trading around 25,609 level, a discount of nearly 115 points from the Nifty futures’ previous close.",https://www.livemint.com/rss/markets
Walmart Pharmacy pay increase: How much will employees earn now? Who is eligible?,https://www.livemint.com/companies/news/walmart-pharmacy-pay-increase-how-much-will-employees-earn-now-who-is-eligible-11770343839633.html,2026-02-06 08:23:57 IST,"In a press release, Walmart said that 3,000 pharmacy technician roles were elevated to operations team lead positions, increasing their average pay to $28 per hour from $22.",https://www.livemint.com/rss/companies
"SBI Q3 preview: Net profit seen rising 5%, loan growth to stay strong",https://www.livemint.com/companies/news/sbi-q3-preview-net-profit-seen-rising-5-loan-growth-to-stay-strong-11770295185095.html,2026-02-06 08:00:19 IST,India's largest lender is expected to report steady margins and stable asset quality in its December-quarter earnings.,https://www.livemint.com/rss/companies
