title,link,published,summary,source
"SpaceX shares slide 32% from record high, but remain 13% above IPO price",https://www.livemint.com/market/stock-market-news/spacex-shares-slide-32-from-record-high-but-remain-13-above-ipo-price-11782752072175.html,2026-06-29 22:55:29 IST,"SpaceX's shares have dropped 32% from their peak after a record-breaking IPO, erasing initial gains. Despite this, the stock remains above its IPO price. SpaceX is also set to join the Nasdaq-100 Index, which could boost demand from investment funds.",https://www.livemint.com/rss/markets
"Gold, silver rates today: Comex gold and silver prices fall as Middle East tensions spark Fed rate hike fears",https://www.livemint.com/market/commodities/gold-silver-rates-today-comex-gold-and-silver-prices-fall-as-middle-east-tensions-spark-fed-rate-hike-fears-11782743153479.html,2026-06-29 21:10:31 IST,"Gold and silver prices fell again on 29 June, driven by Middle East tensions and inflation concerns. Comex gold futures dropped to an intraday low of $4,012, while silver fell to $57.84, marking a significant downturn for both metals amid rate hike fears.",https://www.livemint.com/rss/markets
"Comcast shares surge 17% as company announces NBCUniversal, Sky spin-off plan",https://www.livemint.com/market/stock-market-news/comcast-shares-surge-17-as-company-announces-nbcuniversal-sky-spin-off-plan-11782740474515.html,2026-06-29 20:30:03 IST,"Comcast shares rose 17% to $27.10 after announcing plans to spin off NBCUniversal and Sky, creating a standalone media company. This move aims to help both entities focus on their strategic priorities amid ongoing industry changes.",https://www.livemint.com/rss/markets
Layoff looms as Tech industry sheds over 1 lakh jobs in first half of 2026 amid AI-led cost cuts,https://www.livemint.com/companies/news/layoff-looms-as-tech-industry-sheds-over-1-lakh-jobs-in-first-half-of-2026-amid-ai-led-cost-cuts-11782745148281.html,2026-06-29 22:29:13 IST,"Companies like Cloudflare, Cisco, and LinkedIn are also reducing staff, driven by AI and automation's growing influence on operations.",https://www.livemint.com/rss/companies
"Yes Bank plans to raise up to  ₹16,000 crore through equity, debt",https://www.livemint.com/companies/news/yes-bank-plans-to-raise-up-to-16-000-crore-through-equity-debt-11782742948422.html,2026-06-29 21:35:09 IST,The bank said these were enabling provisions and would be subject to shareholders’ approval and other regulatory and statutory approvals.,https://www.livemint.com/rss/companies
Big relief for EV buyers! Delhi now offers tax waiver on electric cars up to  ₹30 lakh,https://www.livemint.com/money/big-relief-for-ev-buyers-delhi-now-offers-tax-waiver-on-electric-cars-up-to-30-lakh-11782750669015.html,2026-06-29 22:54:05 IST,"The Delhi government has approved a new EV policy offering &amp;nbsp;incentives for electric vehicle buyers, including road tax exemptions and subsidies for two-wheelers. Here's which vehicles will benefit from the policy.",https://www.livemint.com/rss/money
"I-T dept flags up to 20,000 ITRs for ‘swapped provisions’ used to lower net tax liability — What happens next?",https://www.livemint.com/money/personal-finance/it-dept-flags-up-to-20-000-itrs-for-swapped-provisions-used-to-lower-net-tax-liability-what-happens-next-11782747505753.html,2026-06-29 21:50:41 IST,"The income tax department has identified 15,000-20,000 cases of taxpayers using swapped provisions to reduce taxable income. This involves replacing exemptions to lower tax liability without valid reasons and documents. Details here.",https://www.livemint.com/rss/money
No restriction on buying petrol and diesel from July 1? Here's what changes,https://www.livemint.com/money/personal-finance/no-restriction-buy-petrol-and-diesel-from-1-july-what-changes-for-you-retail-pump-users-commercial-consumers-fuel-supply-11782748187224.html,2026-06-29 21:48:33 IST,"The Indian government will lift restrictions on petrol and diesel sales starting July 1, following an improvement in fuel supplies. The move indicates stability in fuel distribution and supply in India, as per the Centre.&amp;nbsp;",https://www.livemint.com/rss/money
These large-caps have ‘strong buy’ &amp; ‘buy’ recos and an upside potential of up to 24%,https://economictimes.indiatimes.com/markets/stocks/news/these-large-caps-have-strong-buy-buy-recos-and-an-upside-potential-of-up-to-24/articleshow/132077407.cms,2026-06-29 23:35:17 IST,"Any long-term investor knows that corrections are part of every bull run. But it is important that they be aware whether the correction is led by global or domestic factors. Why? Because the magnitude of a correction in terms of price damage, how long it lasts, and how the recovery shapes up are different for those sparked by global and domestic events. The latest correction in India probably is a mix of both. A war in the Gulf and an increase in oil prices leading to domestic problems: Fiscal pressure and the possibility of a spike in inflation.",https://economictimes.indiatimes.com/markets/stocks/rssfeeds/2146843.cms
"Delhi EV policy to give purchase incentives: Two-wheeler buyers can get up to  ₹30,000,  ₹1 lakh for electric trucks",https://www.livemint.com/money/personal-finance/delhi-ev-policy-what-proposed-purchase-incentives-subsidy-electric-vehicle-e-auto-three-two-wheelers-30000-trucks-1-lakh-11782750601314.html,2026-06-29 23:04:56 IST,"Delhi EV policy: Here's a look at the proposed electric vehicle subsidy and purchase incentives for buyers of e-autos, electric trucks, two-wheelers and three-wheelers offered by the state government.&amp;nbsp;",https://www.livemint.com/rss/money
Stock Radar: Oberoi Realty breaks out of inverse head &amp; shoulder pattern; time to buy?,https://economictimes.indiatimes.com/markets/stocks/news/stock-radar-oberoi-realty-breaks-out-of-inverse-head-shoulder-pattern-time-to-buy/articleshow/132069029.cms,2026-06-30 05:00:00 IST,"Oberoi Realty shares are showing strong upward potential after breaking out of an inverse head and shoulder pattern on daily charts. Experts suggest short-term traders could target around 2,000 levels in the coming weeks. The stock has demonstrated robust price action, trading above key moving averages and exhibiting positive momentum indicators, signaling a bullish trend.",https://economictimes.indiatimes.com/markets/stocks/rssfeeds/2146843.cms
