title,link,published,summary,source
eClerx Services rallies 4% after Q3 profit surge; bonus issue nod,https://economictimes.indiatimes.com/markets/stocks/news/eclerx-services-rallies-4-after-q3-profit-surge-bonus-issue-nod/articleshow/127756597.cms,2026-01-29 10:35:46 IST,eClerx shares surged following a robust quarterly performance. The company's board approved a 1:1 bonus share issue. Net profit rose 40% year-on-year to Rs 192 crore for the December quarter. Revenue from operations also saw a significant increase. The bonus shares will be issued from retained earnings. The company expects to credit bonus shares by March 2026.,https://economictimes.indiatimes.com/markets/stocks/rssfeeds/2146843.cms
"Hindustan Copper shares soar to record high, surge 40% in 4 days. What's behind the rally?",https://economictimes.indiatimes.com/markets/stocks/news/hindustan-copper-shares-soar-to-record-high-surge-40-in-4-days-whats-behind-the-rally/articleshow/127756140.cms,2026-01-29 10:26:35 IST,Hindustan Copper share price surged 40% in four sessions to a 52-week high as record global copper prices and the company’s emergence as the preferred bidder for a new mining block in Madhya Pradesh fueled a fresh wave of buying in the state-owned miner.,https://economictimes.indiatimes.com/markets/stocks/rssfeeds/2146843.cms
Hindustan Zinc OFS opens: How can retail investors participate?,https://economictimes.indiatimes.com/markets/stocks/news/hindustan-zinc-ofs-opens-how-can-retail-investors-participate/articleshow/127755722.cms,2026-01-29 10:15:45 IST,"Hindustan Zinc’s Offer For Sale (OFS) opens for retail investors on Thursday, January 29, after strong demand from non-retail participants. Vedanta, the promoter, aims to raise up to Rs 4,500 crore through the sale of 0.79% of the company’s equity, with a green shoe option of 0.59% additional stake if demand remains robust. The indicative price is Rs 691.15.",https://economictimes.indiatimes.com/markets/stocks/rssfeeds/2146843.cms
"GRSE shares soar 5%, up 18% in two sessions. What’s triggering the surge?",https://economictimes.indiatimes.com/markets/stocks/news/grse-shares-soar-5-up-18-in-two-sessions-whats-triggering-the-surge/articleshow/127755633.cms,2026-01-29 10:13:27 IST,"GRSE shares rallied sharply after the defence shipbuilder posted strong year-on-year growth in profit and revenue for the December 2025 quarter. Higher operational scale, steady margins and a second interim dividend announcement boosted investor sentiment.",https://economictimes.indiatimes.com/markets/stocks/rssfeeds/2146843.cms
Silver up 50% this month. Is it now time for gold to outpace its poor cousin?,https://economictimes.indiatimes.com/markets/stocks/news/silver-up-50-this-month-is-it-now-time-for-gold-to-outpace-its-poor-cousin/articleshow/127754335.cms,2026-01-29 09:41:14 IST,"Silver Rate Today: Silver has surged nearly 50% this month, dramatically outshining gold. Investors are now questioning if gold will catch up. Both metals have seen significant gains, driven by geopolitical uncertainty and expectations of interest rate cuts. Experts suggest gold offers stability, while silver's sharp rise comes with higher volatility.",https://economictimes.indiatimes.com/markets/stocks/rssfeeds/2146843.cms
"Sensex sinks over 600 pts, Nifty below 25,200 as Union Budget focus takes hold",https://economictimes.indiatimes.com/markets/stocks/news/sensex-falls-over-400-pts-nifty-below-25300-as-union-budget-focus-takes-hold/articleshow/127753822.cms,2026-01-29 09:40:23 IST,Indian stock markets opened lower today. The Sensex and Nifty saw a slight dip. Investors are now focusing on the upcoming federal budget. This comes after a recent rally driven by trade agreement optimism. Market participants are shifting their attention to domestic policy announcements expected this weekend.,https://economictimes.indiatimes.com/markets/stocks/rssfeeds/2146843.cms
"Buy, Sell or Hold? Goldman Sachs reiterates Buy on L&amp;T; Morgan Stanley stays Overweight on TVS Motor",https://economictimes.indiatimes.com/markets/stocks/news/buy-sell-or-hold-goldman-sachs-reiterates-buy-on-lt-morgan-stanley-stays-overweight-on-tvs-motor/articleshow/127754027.cms,2026-01-29 09:33:17 IST,"Brokerages are positive on L&amp;T, TVS Motor, and Maruti Suzuki. L&amp;T shows strong order inflows and profitability. TVS Motor benefits from margin expansion and industry tailwinds. Maruti Suzuki expects new products and export growth to boost earnings. These companies are poised for growth driven by various factors.",https://economictimes.indiatimes.com/markets/stocks/rssfeeds/2146843.cms
"Defence, PSU stocks outperform as budget narratives gain traction",https://www.livemint.com/market/stock-market-news/defence-companies-psu-stocks-budget-divestment-equity-market-11769616448598.html,2026-01-29 10:49:28 IST,"Defence and PSU stocks jumped as risk appetite improved ahead of the Union Budget. However, rich valuations, selective participation and modest earnings growth suggest the budget-led upside may be capped.",https://www.livemint.com/rss/markets
India-EU free trade agreement: A look at over 20 stocks to buy — Check sector-wise winners and losers,https://www.livemint.com/market/stock-market-news/indiaeu-free-trade-agreement-analyst-recommend-over-20-stocks-to-buy-check-sector-wise-winners-and-losers-11769661544705.html,2026-01-29 10:25:27 IST,"The India-EU FTA is set to transform Indian markets, particularly benefiting textiles and pharmaceuticals through tariff reductions. However, challenges exist for capital goods and alcobev sectors. The agreement's effects will be felt gradually, with operationalization expected in 2027.",https://www.livemint.com/rss/markets
"KRM Ayurveda IPO listing: Shares make strong debut, list at 28% premium",https://www.livemint.com/market/stock-market-news/krm-ayurveda-ipo-listing-shares-make-strong-debut-list-at-28-premium-11769660557248.html,2026-01-29 10:17:05 IST,KRM Ayurveda share price opened at  ₹172.10 on NSE SME as against the offer price of  ₹135. This means that the IPO allottees made 28% listing gain.,https://www.livemint.com/rss/markets
"Sensex crashes over 600 points, Nifty 50 nears 25,150— Why is the stock market down ahead of the Economic Survey 2026?",https://www.livemint.com/market/stock-market-news/sensex-crashes-over-600-points-nifty-50-nears-25-150-why-is-the-stock-market-down-ahead-of-the-economic-survey-2026-11769661589044.html,2026-01-29 10:15:06 IST,"The 30-share pack Sensex crashed over 600 points, or 0.80%, to an intraday low of 81,707.94, while the Nifty 50 also dropped by 0.70% to its day's low of 25,159.80.",https://www.livemint.com/rss/markets
"Stocks to buy or sell: Osho Krishan of Angel One suggests buying Apollo Micro Systems, IRFC shares on 29 January",https://www.livemint.com/market/stock-market-news/stocks-to-buy-or-sell-osho-krishan-of-angel-one-suggests-buying-apollo-micro-systems-irfc-shares-on-29-january-11769660036713.html,2026-01-29 10:07:38 IST,"Stocks to buy or sell: Indian stock markets showed resilience with Nifty 50 closing at 25,350, gaining 0.66%. Anticipation for the budget influenced trading, while analysts suggest buying Apollo Micro Systems and IRFC based on recent technical indicators.",https://www.livemint.com/rss/markets
Hindustan Zinc OFS: Analysts advise retail investors to ‘avoid’ — Key reasons explained,https://www.livemint.com/market/stock-market-news/hindustan-zinc-ofs-analysts-advise-retail-investors-to-avoid-key-reasons-explained-11769661038493.html,2026-01-29 10:05:10 IST,"Hindustan Zinc's parent, Vedanta, is looking to offload a 1.59% stake in the zinc producer to cash in on the smart surge seen in the metal stock amid the sharp silver price rally.",https://www.livemint.com/rss/markets
Rupee slips to record low of  92.00 against US dollar. Where is INR headed now?,https://www.livemint.com/market/stock-market-news/rupee-slips-to-record-low-of-92-00-against-us-dollar-where-is-inr-headed-now-11769659202969.html,2026-01-29 09:32:16 IST,"INR vs USD: The dollar index recovered slightly after the US Federal Reserve’s policy decision, while US Treasury yields rose after the Fed acknowledged that inflation remained elevated and the labour market continued to stabilize.",https://www.livemint.com/rss/markets
"If wealth creation is the goal, how does the Indian Budget balance market-friendly policies with revenue pressures?",https://economictimes.indiatimes.com/markets/stocks/news/if-wealth-creation-is-the-goal-how-does-the-indian-budget-balance-market-friendly-policies-with-revenue-pressures/articleshow/127759767.cms,2026-01-29 11:48:21 IST,"Investors are looking for a Budget that encourages growth without weakening fiscal stability. A focus on productive capex, selective incentives and realistic revenue planning usually enhances confidence. The interplay between market-friendly policy choices and fiscal pressures will shape the overall response.",https://economictimes.indiatimes.com/markets/stocks/rssfeeds/2146843.cms
MCX shares soar nearly 20% in 3 sessions! What’s behind the sharp surge?,https://economictimes.indiatimes.com/markets/stocks/news/mcx-shares-soar-nearly-20-in-3-sessions-whats-behind-the-sharp-surge/articleshow/127759326.cms,2026-01-29 11:41:25 IST,"Multi Commodity Exchange of India shares surged on Thursday. The company reported a significant 151% year-on-year jump in net profit for the quarter ended December 31, 2026. This bullishness was further fueled by rising gold and silver prices. Higher trading volumes directly boosted MCX revenues and operational performance. The exchange also saw substantial growth in trading activity across segments.",https://economictimes.indiatimes.com/markets/stocks/rssfeeds/2146843.cms
"Bharat Electronics shares slip 3% as Nomura retains ‘Neutral’ rating, citing rich valuations",https://economictimes.indiatimes.com/markets/stocks/news/bharat-electronics-shares-slip-3-as-nomura-retains-neutral-rating-citing-rich-valuations/articleshow/127759174.cms,2026-01-29 11:36:17 IST,"The company’s order backlog stood at Rs 730.2 billion as of December 2025, up 3% year-on-year. The company said that this implies an order inflow of Rs 56.8 billion during 3QFY26, which was broadly in line with estimates.",https://economictimes.indiatimes.com/markets/stocks/rssfeeds/2146843.cms
"Rs 3 lakh crore wiped out! Sensex slumps over 600 points, Nifty below 25,200. What spooked the market today?",https://economictimes.indiatimes.com/markets/stocks/news/why-is-stock-market-falling-today-rs-3-lakh-crore-wiped-out-sensex-slumps-over-600-points-nifty-below-25200-what-spooked-the-market-today/articleshow/127757964.cms,2026-01-29 11:12:53 IST,"Indian equities experienced a sharp decline on Thursday, erasing recent gains as caution set in ahead of the Union Budget. Investors locked in profits and pivoted from global trade optimism to domestic policy risks, leading to a broad-based selloff. Market strategists suggest the recent rally was tactical, with foreign institutional investors maintaining a 'sell India' strategy.",https://economictimes.indiatimes.com/markets/stocks/rssfeeds/2146843.cms
ITC Q3 Results 2026 LIVE: ITC share price near 52-week low — Muted earnings likely; all eyes on dividend,https://www.livemint.com/market/stock-market-news/itc-q3-results-2026-live-itc-q3-results-today-itc-share-price-itc-cigarette-sales-hotels-itc-q3-earnings-29-january-2026-11769666984268.html,2026-01-29 12:07:21 IST,"ITC Q3 Results 2026 LIVE: Ahead of the results announcement, ITC share price traded close to the 52-week low of  ₹318. During the trade today, ITC fell to  ₹318.05 while its high is  ₹322.95.",https://www.livemint.com/rss/markets
Stock to buy: Choice Broking's Sumeet Bagadia recommends this multibagger PSU stock as his Budget Day Pick 2026,https://www.livemint.com/market/stock-market-news/stock-to-buy-choice-brokings-sumeet-bagadia-recommends-multibagger-psu-stock-ntpc-as-his-budget-day-pick-2026-11769667960744.html,2026-01-29 12:07:10 IST,"As the Union Budget 2026 approaches, NTPC is highlighted as a strong stock pick by Sumeet Bagadia of Choice Broking, backed by a breakout on the daily chart and bullish indicators. The stock has shown significant gains recently and is advised for long positions near current levels.",https://www.livemint.com/rss/markets
Gold loan stocks jump up to 5% as precious metal tops  ₹1.80 lakh amid geopolitical tensions,https://www.livemint.com/market/stock-market-news/gold-loan-stocks-jump-up-to-5-as-precious-metal-tops-rs-1-80-lakh-amid-geopolitical-tensions-11769665160068.html,2026-01-29 11:58:41 IST,"Gold prices extended gains for a third straight session, with February futures on the MCX rising another 9% to a fresh record high of  ₹1,80,799 per 10 grams, crossing the  ₹1.80 lakh mark for the first time.",https://www.livemint.com/rss/markets
"Budget 2026: Infosys, NTPC, Coal India, NMDC, among key stock picks by Rajesh Bhosale of Angel One",https://www.livemint.com/market/stock-market-news/budget-2026-infosys-ntpc-coal-india-nmdc-among-key-stock-picks-by-rajesh-bhosale-of-angel-one-11769662284790.html,2026-01-29 11:51:50 IST,"With the 2026 Union Budget approaching, market expectations are tempered as fiscal discipline remains a priority. Analysts highlight the Public Sector Enterprises and IT sectors as promising, while also cautioning about market volatility and external risks potentially impacting investor confidence.",https://www.livemint.com/rss/markets
Oil prices rise more than 1% on escalating US-Iran tension. More upside ahead?,https://www.livemint.com/market/commodities/oil-prices-rise-more-than-1-on-escalating-us-iran-tension-more-upside-ahead-11769662375683.html,2026-01-29 11:45:51 IST,"Brent crude futures advanced 99 cents, or 1.5%, to $69.39 a barrel, while U.S. West Texas Intermediate crude rose $1.06, or 1.7%, to $64.27 a barrel.",https://www.livemint.com/rss/markets
Tata Motors Q3 Results 2026 LIVE: What to expect from Tata Group's CV arm in December quarter; stock at record high,https://www.livemint.com/market/stock-market-news/tata-motors-q3-results-2026-live-tata-motors-commercial-vehicles-q3-earnings-tata-motors-share-price-jlr-sales-profits-11769665054375.html,2026-01-29 11:21:27 IST,"Tata Motors Q3 Results 2026 LIVE: Tata Motors Commercial Vehicles is set to report its Q3FY26 results on January 29, with expectations of a strong quarter driven by robust CV volumes, operating leverage and margin expansion following the demerger.",https://www.livemint.com/rss/markets
Hindustan Copper share price skyrockets 18% as copper prices hit record high amid 7% rally: More gains ahead?,https://www.livemint.com/market/stock-market-news/hindustan-copper-share-price-skyrockets-18-as-copper-prices-hit-record-high-amid-7-rally-more-gains-ahead-11769664975612.html,2026-01-29 11:13:53 IST,Hindustan Copper's recent surge is attributed to rising copper prices and supply constraints. The stock gained 18% to reach a 52-week high today. Analysts suggest this may mark a new phase of market recognition for the company.,https://www.livemint.com/rss/markets
Elon Musk says Tesla ending Models S and X production as Tesla reports its first annual revenue decline on record,https://www.livemint.com/companies/news/elon-musk-end-ev-tesla-model-s-model-x-record-revenue-decline-manufacture-facility-to-optimus-humanoid-robot-production-11769661025155.html,2026-01-29 11:24:47 IST,"Elon Musk announced the end of production for Tesla's Model S and Model X. He added that the company's Fremont factory will shift focus to manufacturing humanoid robots, with plans for mass production of Optimus.",https://www.livemint.com/rss/companies
Kearney turns to AI to eliminate human bias in consulting hiring,https://www.livemint.com/companies/kearney-ai-hiring-india-consulting-jobs-11769592095455.html,2026-01-29 10:21:06 IST,"Kearney is overhauling its hiring process by using AI to reduce human bias. Piloted in India, the firm is analysing past applicant data and using AI-led interviews to improve accuracy, reduce hiring errors, and identify best-fit candidates amid intense competition for consulting talent.",https://www.livemint.com/rss/companies
Indonesia financial regulator says it will impose 15% stock free float requirement,https://economictimes.indiatimes.com/markets/stocks/news/indonesia-financial-regulator-says-it-will-impose-15-stock-free-float-requirement/articleshow/127762617.cms,2026-01-29 12:46:34 IST,"Indonesia's financial watchdog is boosting the free float requirement for listed companies to 15% to address MSCI's transparency concerns, which triggered significant market sell-offs. The Financial Services Authority is also enhancing supervision timeliness and effectiveness. Authorities view MSCI's feedback positively and are awaiting a response to proposed solutions, aiming for resolution by March.",https://economictimes.indiatimes.com/markets/stocks/rssfeeds/2146843.cms
Realty stocks tumble up to 28% in January ahead of Budget’ 26; can sops lift the laggards?,https://economictimes.indiatimes.com/markets/stocks/news/realty-stocks-tumble-up-to-28-in-january-ahead-of-budget-26-can-sops-lift-the-laggards/articleshow/127762416.cms,2026-01-29 12:43:26 IST,"Within these five years, January 2025 marked the sector’s steepest decline, as the Nifty Realty index plunged 12.45%. Other years were also weak, with declines of 4.69% in 2023, 0.81% in 2022, and 2.61% in 2021. The lone outlier was 2024, when the index posted gains of over 9%.",https://economictimes.indiatimes.com/markets/stocks/rssfeeds/2146843.cms
Balu Forge Industries shares hit 10% upper circuit. Here’s what’s behind the surge,https://economictimes.indiatimes.com/markets/stocks/news/balu-forge-industries-shares-hit-10-upper-circuit-heres-whats-behind-the-surge/articleshow/127761338.cms,2026-01-29 12:20:50 IST,"Balu Forge Industries shares surged significantly after its formal induction into the NATO supply chain. The company will now manufacture and supply critical defence components, including artillery shell bodies, to NATO member states. This strategic milestone positions Balu Forge at the forefront of the alliance's industrial efforts.",https://economictimes.indiatimes.com/markets/stocks/rssfeeds/2146843.cms
Small-cap stock Pavna Industries rises 2% despite the stock market crash. Do you own?,https://www.livemint.com/market/stock-market-news/smallcap-stock-pavna-industries-rises-2-despite-the-stock-market-crash-do-you-own-11769666983141.html,2026-01-29 12:47:46 IST,"In an exchange filing on Wednesday, Pavna Industries announced that the board has approved an investment in the equity shares of its subsidiary, Pavna SMC, for a cash consideration of  ₹4,00,000.",https://www.livemint.com/rss/markets
"Stocks to buy: Nagaraj Shetti recommends MRPL, Jupiter Wagons shares to buy",https://www.livemint.com/market/stock-market-news/stocks-to-buy-nagaraj-shetti-recommends-mrpl-jupiter-wagons-shares-to-buy-11769668910125.html,2026-01-29 12:29:36 IST,"Nifty 50 and Sensex fell on Thursday after gains, as attention shifts to the upcoming federal budget. Nifty 50 decreased by 0.23% and Sensex by 0.21%. Nagaraj Shetti recommends buying Mangalore Refinery and Jupiter Wagons for short-term gains.",https://www.livemint.com/rss/markets
Sebi's liquidity window for corporate bonds finds no takers as issuers balk at cumbersome norms,https://www.livemint.com/market/bonds/sebi-corporate-bond-liquidity-window-11769660438263.html,2026-01-29 12:28:28 IST,"The newly introduced liquidity window for corporate bonds in India is facing an uphill battle. Despite the Securities and Exchange Board of India's intentions to boost market liquidity, many issuers are hesitant to adopt this facility due to stringent conditions and low incentives.&amp;nbsp;",https://www.livemint.com/rss/markets
"Economic Survey 2026: India’s economy seen growing around 7% in FY27, inflation largely stable— 10 key takeaways",https://www.livemint.com/market/stock-market-news/economic-survey-2026-india-s-economy-seen-growing-around-7-in-fy27-inflation-largely-stable-10-key-takeaways-11769668486958.html,2026-01-29 12:24:42 IST,"Economic Survey 2026: Economic Survey 2025-26, prepared by Chief Economic Adviser V. Anantha Nageswaran and his team in the Finance Ministry, underscores that global economic growth remains fragile, but the Indian economy is reflecting strong growth momentum.",https://www.livemint.com/rss/markets
"ABB gives confident outlook for 2026, launches $2 billion buyback",https://economictimes.indiatimes.com/markets/stocks/news/abb-gives-confident-outlook-for-2026-launches-2-billion-buyback/articleshow/127763303.cms,2026-01-29 12:59:05 IST,"Swiss engineering group ABB reported fourth-quarter earnings exceeding forecasts and announced a new $2 billion share buyback, expressing confidence for 2026. The company is benefiting from the AI boom, strong demand in rail and marine sectors, and achieved record full-year orders and revenue. ABB aims for further growth and margin improvement by 2026.",https://economictimes.indiatimes.com/markets/stocks/rssfeeds/2146843.cms
"Economic Survey 2026 Highlights: From gems &amp; jewellery to textiles, key sectors impacted by Trump tariffs",https://www.livemint.com/market/stock-market-news/economic-survey-2026-highlights-from-gems-jewellery-to-textiles-key-sectors-impacted-by-trump-tariffs-11769672485116.html,2026-01-29 13:55:46 IST,"On January 29, Finance Minister Nirmala Sitharaman presented the Economic Survey for FY 2025-26, noting a shift in Indian exports from the US to other regions like the Middle East and Europe, amidst a decline in US demand, especially in the gems and jewellery sector.",https://www.livemint.com/rss/markets
"Hindustan Copper, National Aluminium drive Nifty Metal to a new peak; gains over 2.4%",https://www.livemint.com/market/stock-market-news/hindustan-copper-national-aluminium-drive-nifty-metal-to-a-new-peak-gains-over-24-11769670664246.html,2026-01-29 13:09:58 IST,"Hindustan Copper surged 19% while National Aluminium and Jindal Steel also gained, driven by rising metal prices and a weaker US dollar. The Nifty Metal index climbed to a record high, reflecting strong investor sentiment amid geopolitical tensions.",https://www.livemint.com/rss/markets
"Amazon layoffs: India-based employees among those expected to be hit as e-commerce giant slashes 16,000 jobs—details",https://www.livemint.com/companies/news/amazon-layoffs-india-based-employees-among-those-expected-to-be-hit-as-e-commerce-giant-slashes-16-000-jobsdetails-11769674416739.html,2026-01-29 13:57:47 IST,"Initial reports about the latest round of job cuts had not provided specifics about the geographies and departments that are likely to be affected, but now, internal communications from the e-commerce giant has shed some light on the same.",https://www.livemint.com/rss/companies
Airtel partners Adobe to offer Express Premium access free to 360 mn customers,https://www.livemint.com/companies/news/airtel-partners-adobe-to-offer-express-premium-access-free-to-360-mn-customers-11769674935865.html,2026-01-29 13:55:50 IST,"Bharti Airtel on Thursday said it will provide free access to Adobe Express Premium to 360 million customers, enabling them to create high-quality social assets, marketing materials, short videos, and design other content.",https://www.livemint.com/rss/companies
PE firm InvAscent writes bigger cheques in pharma as rising costs reset capital needs,https://www.livemint.com/companies/start-ups/pe-firm-invascent-invascent-capital-pharma-health-tech-ipo-11769661581960.html,2026-01-29 13:14:34 IST,"This comes on the back of increased investor interest in the pharma and healthcare sectors, driven by higher income spends, expanding healthcare coverage and growing medical tourism",https://www.livemint.com/rss/companies
"Delhi high court summons Priya Kapur, others on Rani Kapur’s plea to cancel family trust",https://www.livemint.com/companies/sunjay-kapur-priya-kapur-rani-kapur-family-trust-sona-comstar-11769668610970.html,2026-01-29 13:09:15 IST,"The Delhi high court has also issued summons to 23 other defendants named by Rani Kapur in her plea. These include her grandchildren Samaira Kapur and Kiaan Kapur, children of the late Sunjay Kapur and his former wife, actress Karisma Kapoor.",https://www.livemint.com/rss/companies
Budget 2026 and your portfolio: Track but retain long-term focus,https://www.livemint.com/money/personal-finance/union-budget-portfolio-long-term-investment-strategy-market-reaction-11769669891186.html,2026-01-29 13:24:52 IST,The budget 2026 is just one stop on your investment journey—it does not change your destination.,https://www.livemint.com/rss/money
From multibaggers to laggards: 12 FY25 stars plunge up to 55% in FY26,https://economictimes.indiatimes.com/markets/stocks/news/from-multibaggers-to-laggards-12-fy25-stars-plunge-up-to-55-in-fy26/slideshow/127767012.cms,2026-01-29 14:06:59 IST,Here are the stocks that standout as multibaggers in FY25—rallying more than 100%—but have since slipped into the laggards’ camp in FY26.,https://economictimes.indiatimes.com/markets/stocks/rssfeeds/2146843.cms
"Adani Power Q3 Results: PAT down 18.9% YoY to  ₹2,479 crore; revenue fell 9%",https://www.livemint.com/market/adani-power-q3-results-pat-down-18-9-yoy-to-rs-2-479-crore-revenue-fell-9-11769676175137.html,2026-01-29 14:15:17 IST,"Adani Power Q3 Results: Adani Power reported an 18.9% decline in Q3 FY26 net profit at  ₹2,479.58 crore, down from  ₹3,057.21 crore. Revenue fell 8.9% to  ₹12,451 crore. Despite this, the company secured a new 3,200 MW power purchase agreement and maintained robust liquidity.",https://www.livemint.com/rss/markets
