title,link,published,summary,source
Weekly Top Picks: These stocks scored 10 on 10 on Stock Reports Plus,https://economictimes.indiatimes.com/markets/stocks/news/weekly-top-picks-these-stocks-scored-10-on-10-on-stock-reports-plus/articleshow/129690108.cms,2026-03-20 06:32:02 IST,"Stock Reports Plus, powered by Refinitiv, undertakes detailed company analysis for 4,000+ listed stocks. In addition to detailed company analyses, the report also collates analysts’ forecasts and trend analysis for each component. An average score in Stock Reports Plus is calculated by undertaking quantitative analysis of five key investment tools – earnings, fundamentals, relative valuation, risk, and price momentum.",https://economictimes.indiatimes.com/markets/stocks/rssfeeds/2146843.cms
Indian indices log biggest single-day decline in nearly two years,https://economictimes.indiatimes.com/markets/stocks/news/indian-indices-log-biggest-single-day-decline-in-nearly-two-years/articleshow/129690097.cms,2026-03-20 06:29:10 IST,"Indian equity benchmarks experienced their steepest single-day drop in nearly two years, plummeting over 3% on Thursday. Attacks on West Asian oil and gas infrastructure fueled inflation concerns, while HDFC Bank's sharp decline added further pressure. The Nifty closed below 23,000, and the Sensex fell significantly, wiping out recent gains and impacting market capitalization.",https://economictimes.indiatimes.com/markets/stocks/rssfeeds/2146843.cms
Tax authorities ask FPIs to appoint local representatives for compliance,https://economictimes.indiatimes.com/markets/stocks/news/tax-authorities-ask-fpis-to-appoint-local-representatives-for-compliance/articleshow/129690066.cms,2026-03-20 06:21:41 IST,"Indian tax authorities are pushing foreign portfolio investors (FPIs) to designate a 'representative assessee' for tax default engagement. This move, following an incident with Jane Street, has raised concerns among FPIs and custodians about potential liabilities. Discussions are ongoing between tax bodies, SEBI, and financial institutions regarding the implications for nominated individuals.",https://economictimes.indiatimes.com/markets/stocks/rssfeeds/2146843.cms
GIFT Nifty up 75 points; here's the trading setup for today's session,https://economictimes.indiatimes.com/markets/stocks/news/pre-market-action-heres-the-trade-setup-for-todays-session/articleshow/129686198.cms,2026-03-20 06:11:00 IST,"Indian equities experienced a significant downturn on Thursday, breaking a three-day winning streak due to escalating West Asian tensions and a global risk-off sentiment. Analysts suggest markets are highly fragile, with geopolitical developments and rising crude prices dictating sentiment. The India VIX surged 22% to 22.80 levels, reflecting increased market fear.",https://economictimes.indiatimes.com/markets/stocks/rssfeeds/2146843.cms
"HDFC Bank spooks Street, then says all's well",https://economictimes.indiatimes.com/markets/stocks/news/hdfc-bank-spooks-street-then-says-alls-well/articleshow/129690038.cms,2026-03-20 06:10:09 IST,"HDFC Bank reassures investors after its non-executive chairman's abrupt exit citing ethical misalignment. Interim chairman Keki Mistry stated there are no material issues, suggesting relationship dynamics may have contributed to the departure. The bank's stock experienced a significant intraday slump following the news.",https://economictimes.indiatimes.com/markets/stocks/rssfeeds/2146843.cms
HDFC Bank's shares take steepest single-day fall in 21 months,https://economictimes.indiatimes.com/markets/stocks/news/hdfc-banks-shares-take-steepest-single-day-fall-in-21-months/articleshow/129690022.cms,2026-03-20 06:07:27 IST,"HDFC Bank shares saw a significant drop of over 5 percent. This decline followed the resignation of non-executive chairman Atanu Chakraborty. His departure cited practices not in line with his personal values. Analysts suggest this, along with CEO Sashidhar Jagdishan's term renewal uncertainty, may pressure the stock. The bank's market value decreased by ₹69,026 crore.",https://economictimes.indiatimes.com/markets/stocks/rssfeeds/2146843.cms
"Stocks in news: HDFC Bank, NTPC, Adani Ports, ICICI Bank, SBI, Nestle India",https://economictimes.indiatimes.com/markets/stocks/news/stocks-in-news-hdfc-bank-ntpc-adani-ports-icici-bank-sbi-nestle-india/articleshow/129686094.cms,2026-03-20 06:01:00 IST,"Indian markets experienced a significant downturn on Thursday. This sell-off erased recent gains, driven by global concerns and geopolitical issues. Several major companies like HDFC Bank, ICICI Bank, and NTPC are in focus today due to specific news. Investors are watching these developments closely as the market navigates current challenges.",https://economictimes.indiatimes.com/markets/stocks/rssfeeds/2146843.cms
"FPIs pull out Rs 89,916 crore in record 15-day sell-off, Nifty slides 10%",https://economictimes.indiatimes.com/markets/stocks/news/fpis-pull-out-rs-89916-crore-in-record-15-day-sell-off-nifty-slides-10/articleshow/129689964.cms,2026-03-20 05:55:08 IST,"Foreign investors have withdrawn a record 89,916 crore from Indian stocks. This outflow over 15 sessions is the largest in two decades. Domestic mutual funds bought 71,183 crore to support the market. Previous heavy selling by foreign investors was also cushioned by domestic fund purchases.",https://economictimes.indiatimes.com/markets/stocks/rssfeeds/2146843.cms
Trade for Today: A leading private sector power player for a 8.05% upmove,https://economictimes.indiatimes.com/markets/stocks/news/trade-for-today-a-leading-private-sector-power-player-for-a-8-05-upmove/articleshow/129689945.cms,2026-03-20 05:51:28 IST,Our technical analysts identify select stocks that may gain momentum even in volatile markets. Here are the technical calls for today.,https://economictimes.indiatimes.com/markets/stocks/rssfeeds/2146843.cms
Small-caps bear the brunt as geopolitical risks dent valuations,https://economictimes.indiatimes.com/markets/stocks/news/small-caps-bear-the-brunt-as-geopolitical-risks-dent-valuations/articleshow/129689947.cms,2026-03-20 05:48:58 IST,"Small-cap stocks are facing greater valuation pressure due to geopolitical concerns. More than half of these smaller companies trade below their three-year average valuations. Technical indicators also suggest small-caps are entering oversold territory faster. This trend persists across longer timeframes, indicating significant price exhaustion in the small-cap segment.",https://economictimes.indiatimes.com/markets/stocks/rssfeeds/2146843.cms
"These large- and mid-cap stocks with ‘Strong Buy’ &amp; ‘Buy’ recos can rally over 26%, according to analysts",https://economictimes.indiatimes.com/markets/stocks/news/these-large-and-mid-cap-stocks-with-strong-buy-buy-recos-can-rally-over-26-according-to-analysts/articleshow/129689895.cms,2026-03-20 05:42:42 IST,"Global equity markets will continue hitting sudden air pockets and face turbulence. They are probably still not discounting the impact of an extended war and a longer disruption in the energy markets; or, indeed, what it might mean for inflation in the US and other developed markets. There is a high probability that inflation will impact growth in these economies. In short, these are very uncertain times. And uncertain times require a different approach to investing.",https://economictimes.indiatimes.com/markets/stocks/rssfeeds/2146843.cms
Sebi may allow FPIs to settle net value of cash market trades,https://economictimes.indiatimes.com/markets/stocks/news/sebi-may-allow-fpis-to-settle-net-value-of-cash-market-trades/articleshow/129689922.cms,2026-03-20 05:40:26 IST,"Sebi is set to consider proposals to allow FPIs to net cash market trades, aiming to reduce costs and boost foreign investment amid record outflows. The regulator also plans to review 'fit and proper' criteria for intermediaries, potentially removing automatic disqualification for individuals facing unproven economic offense allegations.",https://economictimes.indiatimes.com/markets/stocks/rssfeeds/2146843.cms
Stock Radar: MCX stock slides after hitting record high in January 2026; takes support above 50-DMA and bounces back,https://economictimes.indiatimes.com/markets/stocks/news/stock-radar-mcx-stock-slides-after-hitting-record-high-in-january-2026-takes-support-above-50-dma-and-bounces-back/articleshow/129679577.cms,2026-03-20 05:00:00 IST,"Multi Commodity Exchange of India Ltd stock shows strength. Experts recommend buying for short-term gains. The stock is expected to surpass previous highs. Recent SEBI approvals and increased trading volumes in Crude Oil are positive factors. Traders can aim for a target of Rs 2,830 in the coming weeks. A stop loss is advised below Rs 2,625.",https://economictimes.indiatimes.com/markets/stocks/rssfeeds/2146843.cms
When a non-playing captain steps up,https://economictimes.indiatimes.com/markets/stocks/news/when-a-non-playing-captain-steps-up-atanu-chakraborty-hdfc-chairman/articleshow/129689980.cms,2026-03-20 01:12:30 IST,HDFC Bank chairman Atanu Chakraborty has resigned unexpectedly. This move follows reports of disagreements with the bank's leadership. Sources suggest Chakraborty's involvement in daily operations and senior promotions caused friction. The bank's management and the regulator reportedly aligned against the chairman's actions. This development follows the significant merger of HDFC and HDFC Bank.,https://economictimes.indiatimes.com/markets/stocks/rssfeeds/2146843.cms
"Indian stock market: 10 key things that changed for market overnight - Gift Nifty, US-Iran war, gold rate to oil prices",https://www.livemint.com/market/stock-market-news/indian-stock-market-10-key-things-that-changed-for-market-overnight-gift-nifty-us-iran-war-gold-rate-to-oil-prices-11773939182854.html,2026-03-20 07:00:48 IST,"Gift Nifty was trading around 23,177 level, a premium of nearly 122 points from the Nifty futures’ previous close, indicating a positive start for the Indian stock market indices.",https://www.livemint.com/rss/markets
Breakout stocks to buy or sell: Sumeet Bagadia recommends five shares to buy today — 20 March 2026,https://www.livemint.com/market/stock-market-news/breakout-stocks-to-buy-or-sell-sumeet-bagadia-recommends-five-shares-to-buy-today-20-march-2026-11773942272284.html,2026-03-20 06:37:05 IST,"Breakout stocks to buy or sell: Sumeet Bagadia recommends five shares to buy today — Torrent Power, Bharat Heavy Electricals, Linde India, Fertilisers And Chemicals Travancore, and Coal India.",https://www.livemint.com/rss/markets
"Stocks to watch: HDFC Bank, NTPC, Wipro among 10 shares in focus today",https://www.livemint.com/market/stock-market-news/stocks-to-watch-hdfc-bank-ntpc-wipro-among-10-shares-in-focus-today-11773943831003.html,2026-03-20 06:35:09 IST,"Stock market today: On Thursday, the Nifty 50 dropped 775 points, or 3.26%, to close at 23,000, while the BSE Sensex ended at 74,207, also down 3.26% from the previous session",https://www.livemint.com/rss/markets
Stocks to buy: Raja Venkatraman recommends three stocks for 20 March,https://www.livemint.com/market/stock-market-news/stocks-to-buy-raja-venkatraman-recommends-three-stocks-for-20-march-11773919469498.html,2026-03-20 06:06:02 IST,Market expert Raja Venkatraman shares his top stock picks for 20 March. Here’s his technical outlook and trade strategy.,https://www.livemint.com/rss/markets
"Bearish bets on HDFC Bank at record highs, volatility may persist",https://www.livemint.com/market/stock-market-news/hdfc-bank-stock-record-short-bets-fpi-selling-correction-likely-11773932272893.html,2026-03-20 06:00:42 IST,"Foreign investors, HDFC Bank’s biggest shareholder category, likely drove short bets after the resignation of chairman Atanu Chakraborty.",https://www.livemint.com/rss/markets
"Dhurandhar 2’s potential success may lift PVR Inox, but only for now",https://www.livemint.com/market/mark-to-market/pvr-inox-stock-outlook-movie-pipeline-debt-reduction-strategy-dhurandhar-11773917198638.html,2026-03-20 06:00:02 IST,"After Dhurandar: The Revenge, the near-term movie pipeline looks weak for PVR Inox. Apart from Drishyam 3, there are not many big Hindi releases lined up. This means occupancies and revenues would be soft in Q1FY27",https://www.livemint.com/rss/markets
"West Asia conflict to prolong earnings recovery cycle, but worst is over: Gaurav Dua of Standard Chartered Securities",https://www.livemint.com/market/stock-market-news/west-asia-conflict-to-prolong-earnings-recovery-cycle-but-worst-is-over-gaurav-dua-of-standard-chartered-securities-11773913966723.html,2026-03-20 05:50:42 IST,"Annual 10-12% pullbacks are normal and occur every year for markets; in hindsight, these dips from recent highs are actually investment opportunities, says Gaurav Dua of Standard Chartered Securities",https://www.livemint.com/rss/markets
Titan leans on silver as gold rally prices out entry-level buyers,https://www.livemint.com/companies/news/titan-gold-silver-jewellery-india-jewellery-market-tanishq-mia-shaya-11773894750337.html,2026-03-20 06:00:22 IST,"Titan is expanding design-led silver offerings to retain entry-level buyers, rather than relying only on lower-carat gold or pricing tweaks.",https://www.livemint.com/rss/companies
"Singer India eyes premiumization, diversification to garner greater market share",https://www.livemint.com/companies/singer-india-premiumization-zig-zag-sewing-machine-consumer-durables-appliances-diversification-manufacturing-11773895060299.html,2026-03-20 05:50:22 IST,"The sewing machine manufacturer is modernizing its portfolio by focusing on high-value electric zig zag models, aiming to capture a larger share of the domestic market currently dominated by Chinese goods.",https://www.livemint.com/rss/companies
HDFC Bank crisis: Investors in the dark despite repeated reassurance,https://www.livemint.com/news/hdfc-bank-crisis-investors-in-the-dark-despite-repeated-reassurance-11773920830960.html,2026-03-20 05:50:22 IST,"Bank insists nothing wrong on regulatory side, but market takes fright.",https://www.livemint.com/rss/companies
Why aren’t petrol prices rising in India despite global crude surge?,https://www.livemint.com/money/personal-finance/crude-oil-prices-petrol-india-oil-marketing-companies-excise-duty-fuel-west-asia-conflict-indian-oil-11773897069376.html,2026-03-20 06:00:22 IST,"Even as global crude prices surge past $100, petrol prices in India remain stable. Here’s how OMCs, taxes and government intervention act as shock absorbers for consumers.",https://www.livemint.com/rss/money
"In current times, look at debt investments for accrual only",https://www.livemint.com/money/personal-finance/in-current-times-look-at-debt-investments-for-accrual-only-11773910043142.html,2026-03-20 05:56:02 IST,"With RBI likely pausing rate cuts after aggressive easing, bond gains from falling yields fade, pushing investors to focus on accrual, shorter duration and selective credit risk",https://www.livemint.com/rss/money
Will health insurance cover LASIK surgery? Here’s what you need to know,https://www.livemint.com/money/personal-finance/will-health-insurance-cover-lasik-surgery-here-s-what-you-need-to-know-11773896516408.html,2026-03-20 05:50:22 IST,"Most health insurance plans in India don’t automatically cover LASIK, but exceptions exist. Here’s how medical necessity, limits and waiting periods determine your eligibility.",https://www.livemint.com/rss/money
"D-St rebounds: Rs 6 lakh crore added! Sensex jumps 900 points; Nifty nears 23,300; easing oil prices among key factors",https://economictimes.indiatimes.com/markets/stocks/news/d-st-rebounds-rs-6-lakh-crore-added-sensex-jumps-900-points-nifty-nears-23300-easing-oil-prices-among-key-factors/articleshow/129691437.cms,2026-03-20 09:32:30 IST,"Indian stock markets surged on Friday. The Sensex and Nifty saw substantial gains, reversing yesterday's losses. Easing oil prices and other factors boosted investor confidence. Several major companies experienced significant upticks. This positive sentiment added considerable value to the overall market capitalization. The market showed broad-based strength across sectors.",https://economictimes.indiatimes.com/markets/stocks/rssfeeds/2146843.cms
US Stock Market | Wall Street pushes Fed rate cut expectations to September amid oil shock,https://economictimes.indiatimes.com/markets/stocks/news/us-stock-market-wall-street-pushes-fed-rate-cut-expectations-to-september-amid-oil-shock/articleshow/129691594.cms,2026-03-20 09:17:25 IST,Global investment bank Morgan Stanley now expects the US Federal Reserve to start cutting interest rates in September. This is a shift from its earlier June projection. Rising oil prices due to Middle East tensions are a key reason. Other major banks like Goldman Sachs and Barclays have also revised their forecasts.,https://economictimes.indiatimes.com/markets/stocks/rssfeeds/2146843.cms
"Rs 1.32 lakh crore shock! Maruti Suzuki shares tumble 25%, worst among peers! Overdone or more pain?",https://economictimes.indiatimes.com/markets/stocks/news/rs-1-32-lakh-crore-shock-maruti-suzuki-shares-tumble-25-worst-among-peers-overdone-or-more-pain/articleshow/129691596.cms,2026-03-20 09:14:50 IST,"Maruti Suzuki India's stock has experienced a sharp fall in early 2026. Concerns about market share, margins, and production capacity are impacting the company. Analysts are divided on the outlook. The company aims to regain market share with new launches and capacity expansion. Exports remain a strong point for Maruti Suzuki India.",https://economictimes.indiatimes.com/markets/stocks/rssfeeds/2146843.cms
Nestle India shares in focus as firm expands Munch production at Sanand factory,https://economictimes.indiatimes.com/markets/stocks/news/nestle-india-shares-in-focus-as-firm-expands-munch-production-at-sanand-factory/articleshow/129691392.cms,2026-03-20 09:03:19 IST,"Nestle India is expanding its production capacity. A new manufacturing line for its Munch chocolate brand is being set up in Sanand, Gujarat. This expansion is expected to add 8,300 tonnes to its annual output. The project involves an investment of Rs 225 crore. This move aims to meet future consumer demand for the popular chocolate.",https://economictimes.indiatimes.com/markets/stocks/rssfeeds/2146843.cms
"TCS, Infosys, other IT stocks rise up to 3% on Accenture’s Q2 results. What are analysts saying?",https://economictimes.indiatimes.com/markets/stocks/news/tcs-infosys-other-it-stocks-in-focus-on-accentures-q2-results-what-are-analysts-saying/articleshow/129691432.cms,2026-03-20 09:01:38 IST,"Indian IT stocks surged following Accenture's robust results, which beat revenue expectations and saw record bookings. The global IT giant also raised its full-year revenue growth forecast. Analysts see strong AI-driven demand, particularly in financial services, though macro uncertainties persist. Valuations are now considered attractive.",https://economictimes.indiatimes.com/markets/stocks/rssfeeds/2146843.cms
JSW Steel shares in focus after arm seeks govt help to secure gas supplies amid Middle East crisis,https://economictimes.indiatimes.com/markets/stocks/news/jsw-steel-shares-in-focus-after-arm-seeks-govt-help-to-secure-gas-supplies-amid-middle-east-crisis/articleshow/129691310.cms,2026-03-20 08:50:05 IST,"JSW Steel shares are in focus after its arm sought government support to secure LNG and propane supplies amid disruptions linked to the Middle East crisis. Supply risks via the Strait of Hormuz have raised concerns over output continuity, with industry players flagging potential downstream impact and supply shortages.",https://economictimes.indiatimes.com/markets/stocks/rssfeeds/2146843.cms
Adani Total Gas among 5 stocks showing bullish RSI upswing,https://economictimes.indiatimes.com/markets/stocks/news/adani-total-gas-among-5-stocks-showing-bullish-rsi-upswing/slideshow/129691278.cms,2026-03-20 08:42:08 IST,"On March 19, five Nifty 500 stocks appeared in the RSI Trending Up scan. Their RSI moved above the 50 level from lower zones, signalling strengthening momentum. The indicator is often used by traders to spot improving sentiment and potential bullish continuation setups in select counters across the market.",https://economictimes.indiatimes.com/markets/stocks/rssfeeds/2146843.cms
"Nifty Bank logs 3rd-worst March fall since the global financial crisis. HDFC Bank, SBI among top culprits",https://economictimes.indiatimes.com/markets/stocks/news/nifty-bank-logs-3rd-worst-march-fall-since-the-global-financial-crisis-hdfc-bank-sbi-among-top-culprits/articleshow/129691130.cms,2026-03-20 08:31:38 IST,"Nifty Bank posted its third-worst March in two decades, falling around 12%, with PSU and private banks under pressure. Heavy FII outflows, global macro headwinds, rising oil prices and geopolitical tensions have intensified the correction. Major constituents like HDFC Bank and ICICI Bank have significantly dragged the index lower.",https://economictimes.indiatimes.com/markets/stocks/rssfeeds/2146843.cms
"JBM Auto, Tejas Networks among 5 stocks close below VWAP",https://economictimes.indiatimes.com/markets/stocks/news/jbm-auto-tejas-networks-among-5-stocks-close-below-vwap/slideshow/129691070.cms,2026-03-20 08:22:50 IST,"vwap stocks india, stocks below vwap today, nifty500 losers list, tejas networks share fall, jbm auto stock news, beml share price drop, thermax stock analysis, ksb share news, bearish stocks india today, stockedge scan stocks",https://economictimes.indiatimes.com/markets/stocks/rssfeeds/2146843.cms
"HDFC Bank shares fall another 2%, down nearly 8% in two sessions. What are experts saying?",https://economictimes.indiatimes.com/markets/stocks/news/hdfc-bank-shares-could-fall-more-if-adr-is-an-indicator-whats-happening/articleshow/129691005.cms,2026-03-20 08:21:18 IST,"HDFC Bank share price continued to slide, dropping 2% on Friday, following a sharp 5% fall on Thursday. The decline, which erased nearly Rs 1 lakh crore in investor wealth over two sessions, is linked to the sudden resignation of former chairman Atanu Chakraborty.",https://economictimes.indiatimes.com/markets/stocks/rssfeeds/2146843.cms
Stocks to buy in 2026 for long term: Metro Brands Ujjivan Small Finance Bank among 5 stocks that could give 10-40% return,https://economictimes.indiatimes.com/markets/stocks/news/stocks-to-buy-in-2026-for-long-term-metro-brands-ujjivan-small-finance-bank-among-5-stocks-that-could-give-10-40-return/slideshow/129690699.cms,2026-03-20 07:46:28 IST,We have collated a list of recommendations from top brokerage firms from ETNow and other sources:,https://economictimes.indiatimes.com/markets/stocks/rssfeeds/2146843.cms
Negative Breakout: These 10 stocks cross below their 200 DMAs,https://economictimes.indiatimes.com/markets/stocks/news/negative-breakout-these-10-stocks-cross-below-their-200-dmas/slideshow/129690571.cms,2026-03-20 07:35:53 IST,Trading below the 200 DMA is considered a negative signal because it indicates that the stock's price is below its long-term trend line.,https://economictimes.indiatimes.com/markets/stocks/rssfeeds/2146843.cms
"HDFC Bank share price falls 2%, set for worst monthly fall in 6 years: Should you buy the dip or sell the stock?",https://www.livemint.com/market/stock-market-news/hdfc-bank-share-price-falls-2-set-for-worst-monthly-fall-in-6-years-should-you-buy-the-dip-or-sell-the-stock-11773978810776.html,2026-03-20 09:27:33 IST,"HDFC Bank share price hit the day's low of  ₹781 and hovered close to their 52-week low of  ₹772 hit in last trading session. So far in March, HDFC Bank stock has lost over 10%, putting it on track for the worst monthly decline since March 2020.",https://www.livemint.com/rss/markets
Rupee hits fresh record low at 92.92 against dollar as US-Iran war sparks economic concerns,https://www.livemint.com/market/stock-market-news/rupee-hits-fresh-record-low-at-92-92-against-as-us-iran-war-sparks-economic-concerns-11773978617199.html,2026-03-20 09:24:51 IST,Rupee hits fresh record low at 92.92 against $ as US-Iran war sparks economic concerns,https://www.livemint.com/rss/markets
"Gold rate jumps over 2% on MCX on value buying; dollar's strength, dimming US Fed rate cut hopes remain key risks",https://www.livemint.com/market/commodities/gold-price-today-rate-jumps-over-2-on-mcx-on-value-buying-dollars-strength-dimming-us-fed-rate-cut-hopes-key-risks-11773976823832.html,2026-03-20 09:09:18 IST,"Gold rate jumped sharply on value-buying on Friday morning. MCX gold April futures jumped by  ₹3,350, or 2.30%, to  ₹1,48,302 per 10 grams, while MCX silver May contracts surged by  ₹8,540, or 3.7%, to  ₹2,40,000 per kg.",https://www.livemint.com/rss/markets
"Silver rate today: White metal recovers to  ₹2.4 lakh on MCX on soft dollar, headed for a weekly decline",https://www.livemint.com/market/commodities/gold-price-silver-rate-today-silver-price-recovers-to-rs-2-4-lakh-on-mcx-on-soft-dollar-headed-for-a-weekly-decline-11773974251030.html,2026-03-20 09:07:29 IST,"Silver prices rose over 3% on March 20, recovering from previous losses, but are still set for a weekly decline due to a hawkish US Federal Reserve. On MCX, silver climbed to  ₹2,40,000 per kg, while gold prices also saw a slight increase.",https://www.livemint.com/rss/markets
Parag Parikh buys 3.65% in this cash management company. Betting on a dip or a structural winner?,https://www.livemint.com/market/stock-market-news/parag-parikh-stake-cms-info-systems-share-price-cash-management-india-11773921056187.html,2026-03-20 09:00:25 IST,"A consolidating sector, rising market share, but weakening profitability: Parag Parikh's bet in CMS signals conviction, but is it on a temporary dip or a deeper structural opportunity?",https://www.livemint.com/rss/markets
