title,link,published,summary,source
Pre-market action: Here's the trade setup for today's session,https://economictimes.indiatimes.com/markets/stocks/news/pre-market-action-heres-the-trade-setup-for-todays-session/articleshow/126222297.cms,2025-12-29 06:30:56 IST,"Markets closed the holiday-shortened week with modest gains, continuing a consolidation phase. The upcoming week, marking the transition to 2026, is expected to see increased volatility due to the December F&amp;O expiry. Key domestic data releases and FII/DII actions will be closely watched.",https://economictimes.indiatimes.com/markets/stocks/rssfeeds/2146843.cms
"Stocks in news: PNB, IndiGo, Sigachi Industries, Coal India, Coforge",https://economictimes.indiatimes.com/markets/stocks/news/stocks-in-news-pnb-indigo-sigachi-industries-coal-india-coforge/articleshow/126222281.cms,2025-12-29 06:25:36 IST,"Indian markets saw a slight dip, continuing their consolidation phase. Trading activity remained subdued due to low volumes. However, specific company news is creating opportunities. PNB reported a large fraud. IndiGo's market share decreased. Coal India appointed a new CEO. Vedanta received a conditional nod for drilling. Sigachi Industries' MD and CEO was remanded.",https://economictimes.indiatimes.com/markets/stocks/rssfeeds/2146843.cms
"Global stocks hold near record, silver falls from peak",https://economictimes.indiatimes.com/markets/stocks/news/global-stocks-hold-near-record-silver-at-all-time-high/articleshow/126222247.cms,2025-12-29 06:21:12 IST,"Global stocks hovered near record highs amid light trading, while silver surged to a new peak, extending a historic year-end rally. Equities saw gains in Australia, with modest declines anticipated in Japan. Investors are closely watching AI trends and Federal Reserve interest rate policy for 2026 market direction.",https://economictimes.indiatimes.com/markets/stocks/rssfeeds/2146843.cms
Will Encora acquisition cement Coforge’s AI leadership in healthcare and hi-tech?,https://economictimes.indiatimes.com/markets/stocks/news/will-encora-acquisition-cement-coforges-ai-leadership-in-healthcare-and-hi-tech/articleshow/126222169.cms,2025-12-29 05:59:27 IST,"Coforge is acquiring California-based Encora for $2.35 billion, bolstering its AI capabilities in healthcare and hi-tech, and expanding its US market presence. This strategic move aims to position Coforge for future growth, with the combined entity projected to significantly increase revenue and potentially become India's seventh-largest software exporter.",https://economictimes.indiatimes.com/markets/stocks/rssfeeds/2146843.cms
"Nifty faces 26,200 hurdle; indicators flag uncertainty",https://economictimes.indiatimes.com/markets/stocks/news/nifty-faces-26200-hurdle-indicators-flag-uncertainty/articleshow/126222095.cms,2025-12-29 05:41:31 IST,"Nifty 50 is consolidating near all-time highs, facing resistance at 26,200, indicating near-term indecision. Analysts suggest range-bound trade with sector-specific opportunities, while Bank Nifty shows signs of potential profit-booking. Experts recommend specific stock bets like Lupin and Varun Beverages for potential gains.",https://economictimes.indiatimes.com/markets/stocks/rssfeeds/2146843.cms
Stock Radar: Manappuram Finance hits fresh record highs in December; will the rally continue in 2026?,https://economictimes.indiatimes.com/markets/stocks/news/stock-radar-manappuram-finance-hits-fresh-record-highs-in-december-will-the-rally-continue-in-2026/articleshow/126186892.cms,2025-12-29 05:00:00 IST,"Manappuram Finance broke out of a three-month consolidation to hit fresh record highs, signalling further upside. Strong volumes, bullish MACD, and a Supertrend buy trigger support momentum. Analysts highlight accumulation near 290 and improving gold-loan demand. Traders may buy with a target of Rs 330 in 2–3 weeks and a stop loss below Rs 305.",https://economictimes.indiatimes.com/markets/stocks/rssfeeds/2146843.cms
"Bandhan Bank sells Rs 3,212 crore microfinance bad loans to ARCIL",https://economictimes.indiatimes.com/markets/stocks/news/bandhan-bank-sells-rs-3212-crore-microfinance-bad-loans-to-arcil/articleshow/126222128.cms,2025-12-29 00:25:23 IST,"Bandhan Bank has sold a ₹3,212 crore microfinance non-performing loan portfolio to ARCIL for ₹578 crore. This sale followed a Swiss Challenge process. The bank also initiated a process to sell an additional ₹3,720 crore in loans. These actions come as the bank's asset quality faced pressure from the microfinance segment.",https://economictimes.indiatimes.com/markets/stocks/rssfeeds/2146843.cms
Finance ministry to take a relook at crop insurance plan,https://economictimes.indiatimes.com/markets/stocks/news/finance-ministry-to-take-a-relook-at-crop-insurance-plan/articleshow/126222120.cms,2025-12-29 00:19:51 IST,"The finance ministry is reviewing the Pradhan Mantri Fasal Bima Yojana's cup-and-cap model. This comes as crop insurance business declines, with premium collections expected to fall significantly. Large states are shifting to the cup-and-cap model, which limits insurer risk and profitability. The review aims to ensure the scheme's long-term sustainability and effective farmer coverage.",https://economictimes.indiatimes.com/markets/stocks/rssfeeds/2146843.cms
Banks urge RBI to extend trade relief measures beyond December,https://economictimes.indiatimes.com/markets/stocks/news/banks-urge-rbi-to-extend-trade-relief-measures-beyond-december/articleshow/126222033.cms,2025-12-29 00:14:43 IST,Banks are asking the Reserve Bank of India for more time on loan relief for exporters. The current scheme ends this month. Exporters face ongoing challenges from global trade issues. Banks believe the real impact of these issues will be seen next quarter. An extension would offer a crucial safety net for exporters.,https://economictimes.indiatimes.com/markets/stocks/rssfeeds/2146843.cms
Chicago wheat futures slip after Zelenskiy-Trump peace talks,https://www.livemint.com/market/commodities/chicago-wheat-futures-slip-after-zelenskiy-trump-peace-talks-11766971213415.html,2025-12-29 06:50:12 IST,GLOBAL-GRAINS/:GRAINS-Chicago wheat futures slip after Zelenskiy-Trump peace talks,https://www.livemint.com/rss/markets
Debt mutual funds see slower inflows than hybrid and equity,https://www.livemint.com/market/debt-mutual-funds-rbi-liquidity-impact-equity-11766915089577.html,2025-12-29 06:31:14 IST,"While equity and hybrid assets grew 1.8 times since November 2023, debt assets grew only 1.3 times. A combination of the 2023 taxation overhaul, which eliminated indexation benefits, and a persistent lack of retail awareness has led to net outflows of  ₹22,105 crore this year.",https://www.livemint.com/rss/markets
Silver crosses $80 mark for first time; platinum hits record high,https://www.livemint.com/market/commodities/silver-crosses-80-mark-for-first-time-platinum-hits-record-high-11766969374921.html,2025-12-29 06:19:34 IST,GLOBAL-PRECIOUS:PRECIOUS-Silver crosses $80 mark for first time; platinum hits record high,https://www.livemint.com/rss/markets
Top three stocks to buy today—recommended by Ankush Bajaj for 29 December,https://www.livemint.com/market/stock-market-news/top-stocks-to-buy-best-stock-picks-ankush-bajaj-sensex-nifty-11766930229261.html,2025-12-29 06:00:53 IST,"Market expert Ankush Bajaj recommends three stocks to buy on Monday, 29 December",https://www.livemint.com/rss/markets
"Foreign money could turn to India if AI trade stalls, says Sunil Singhania",https://www.livemint.com/market/stock-market-news/stock-market-outlook-2026-mutual-fund-equity-sunil-singhania-11766902676434.html,2025-12-29 06:00:33 IST,"Sunil Singhania, founder of Abakkus Asset Manager, views the current stagnation in Indian equities as a necessary ‘time correction’ rather than a price collapse.",https://www.livemint.com/rss/markets
Stocks to buy: Raja Venkatraman's top picks for 29 December,https://www.livemint.com/market/stock-market-news/stocks-to-buy-raja-venkatraman-top-picks-29-december-nmdc-oberoi-realty-ltimindtree-11766838348843.html,2025-12-29 06:00:33 IST,"Market expert Raja Venkatraman shares his top three stock picks to buy today, 29 December. Discover his exclusive picks and analysis to inform your investment strategy.",https://www.livemint.com/rss/markets
Markets likely to stay cautious in final trading week of 2025,https://www.livemint.com/market/markets-likely-to-stay-cautious-in-final-trading-week-of-2025-nifty-fpis-nse-11766923331851.html,2025-12-29 06:00:33 IST,"Nifty likely to trend within a 25800-26200 short- term range with a bearish bias amid thin volumes, as high frequency traders and foreign portfolio investors pile up bearish bets. Trading volumes generally thin during the year-end with most investors away on holiday.",https://www.livemint.com/rss/markets
Stock recommendations for 29 December from MarketSmith India,https://www.livemint.com/market/stock-market-news/stock-recommendations-29-december-marketsmith-india-sensex-nifty-outlook-trade-set-up-11766757941784.html,2025-12-29 06:00:13 IST,"MarketSmith India reveals its top stock recommendations for today, 29 December. Get expert insights into the best-performing stocks to guide your investment decisions.",https://www.livemint.com/rss/markets
Indonesia Set to Revamp Benchmark Rates for Money Market,https://www.livemint.com/market/stock-market-news/indonesia-set-to-revamp-benchmark-rates-for-money-market-11766965349303.html,2025-12-29 05:12:28 IST,"Indonesia is set to phase out a key money-market benchmark this week, concluding a years-long transition to align with global standards.",https://www.livemint.com/rss/markets
JBM Group signs exclusivity pact to buy Fortum’s EV charging business in India,https://www.livemint.com/companies/news/jbm-group-acquires-glida-fortum-india-electric-vehicle-charging-network-11766893813966.html,2025-12-29 05:40:52 IST,JBM Group is drawn to GLIDA's 850 charging points across 29 cities and 25 highways in 17 states amid India’s green-mobility push that depends on the expansion of an effective EV charging network. JBM Group’s flagship firm JBM Auto Ltd is one of India’s largest electric bus manufacturers.,https://www.livemint.com/rss/companies
"MCX, Vedanta among 6 stocks witness 5-year swing high breakout",https://economictimes.indiatimes.com/markets/stocks/news/mcx-vedanta-among-6-stocks-witness-5-year-swing-high-breakout/slideshow/126223628.cms,2025-12-29 09:01:10 IST,"Six stocks from the Nifty 500 universe touched a 5-year swing high at the close on December 26, signalling strengthening bullish momentum. A 5-year swing high marks the highest price over five years and reflects sustained buying interest, often indicating trend continuation though distinct from a long-term breakout.",https://economictimes.indiatimes.com/markets/stocks/rssfeeds/2146843.cms
South Korean shares hit near 2-month high as chipmakers rally,https://economictimes.indiatimes.com/markets/stocks/news/south-korean-shares-hit-near-2-month-high-as-chipmakers-rally/articleshow/126223557.cms,2025-12-29 08:57:08 IST,"South Korean stocks reached a near two-month high on Monday. Chipmakers like Samsung Electronics and SK Hynix saw significant gains. This surge was driven by optimism surrounding future demand for semiconductors. The KOSPI index performed strongly, marking it as the world's best performer this year. Other sectors showed mixed movements. The South Korean won also strengthened against the dollar.",https://economictimes.indiatimes.com/markets/stocks/rssfeeds/2146843.cms
"Hindustan Zinc shares in focus as Silver hits new record, crosses $82. What should investors do?",https://economictimes.indiatimes.com/markets/stocks/news/hindustan-zinc-shares-in-focus-as-silver-hits-new-record-crosses-82-what-should-investors-do/articleshow/126223533.cms,2025-12-29 08:55:43 IST,"Hindustan Zinc shares are in focus as silver prices hit record highs, driven by low supply and rising demand. The company, a top silver producer, is poised to benefit from these trends, with analysts projecting strong earnings growth and improved cost efficiency. Higher silver prices are expected to significantly boost EBITDA in FY27.",https://economictimes.indiatimes.com/markets/stocks/rssfeeds/2146843.cms
Japan's Nikkei slips as tech stocks track Wall Street lower,https://economictimes.indiatimes.com/markets/stocks/news/japans-nikkei-slips-as-tech-stocks-track-wall-street-lower/articleshow/126223530.cms,2025-12-29 08:55:05 IST,"Tokyo's Nikkei index saw a slight dip on Monday, breaking a two-day rally. Technology shares mirrored a weak Wall Street close. Some major companies traded ex-dividend, impacting the market. Banks, however, showed gains following discussions on interest rate hikes. Value stocks performed better, driven by retail investor interest in NISA accounts.",https://economictimes.indiatimes.com/markets/stocks/rssfeeds/2146843.cms
Hindustan Copper shares soar 30% in 6 days to hit record high. What’s fueling the surge and what should traders do now?,https://economictimes.indiatimes.com/markets/stocks/news/hindustan-copper-shares-soar-30-in-6-days-to-hit-record-high-whats-fueling-the-surge-and-what-should-traders-do-now/articleshow/126223511.cms,2025-12-29 08:54:44 IST,"Hindustan Copper shares rallied sharply in December, hitting record highs amid rising global copper prices and strong technical momentum. While favourable macro factors and currency trends support the outlook, experts caution on elevated valuations and overbought signals, advising a buy-on-dips strategy for fresh investors.",https://economictimes.indiatimes.com/markets/stocks/rssfeeds/2146843.cms
Ola Electric shares in focus as Bharat Cell scooter deliveries scale up across 4 states,https://economictimes.indiatimes.com/markets/stocks/news/ola-electric-shares-in-focus-as-bharat-cell-scooter-deliveries-scale-up-across-4-states/articleshow/126223436.cms,2025-12-29 08:47:11 IST,"Ola Electric Mobility’s shares are set to be in focus after the company said it has scaled up deliveries of scooters powered by its indigenously manufactured 4680 Bharat Cell battery across four states, marking a wider rollout of its in-house EV technology.",https://economictimes.indiatimes.com/markets/stocks/rssfeeds/2146843.cms
"Defence stocks HAL, BEL, others in focus ahead Defence Acquisition Council meet",https://economictimes.indiatimes.com/markets/stocks/news/defence-stocks-hal-bel-others-in-focus-ahead-defence-acquisition-council-meet/articleshow/126223325.cms,2025-12-29 08:40:59 IST,"Defence stocks are in focus as the Defence Acquisition Council meets today to consider high-value proposals, potentially worth Rs 80,000 crore, for critical military systems. The meeting is expected to boost the order pipeline for domestic manufacturers, with approvals for missile systems and drone leasing on the agenda.",https://economictimes.indiatimes.com/markets/stocks/rssfeeds/2146843.cms
IRCTC among 4 stocks showing bullish RSI upswing,https://economictimes.indiatimes.com/markets/stocks/news/irctc-among-4-stocks-showing-bullish-rsi-upswing/slideshow/126223366.cms,2025-12-29 08:39:21 IST,"Four Nifty 200 stocks showed improving momentum on December 26 after their RSI crossed above the key 50 level from lower zones. This RSI upswing indicates strengthening price action and an emerging bullish bias, helping traders identify early-stage buying opportunities amid improving market sentiment.",https://economictimes.indiatimes.com/markets/stocks/rssfeeds/2146843.cms
Sigachi Industries shares in focus after CEO remanded in Hyderabad unit fire probe,https://economictimes.indiatimes.com/markets/stocks/news/sigachi-industries-shares-in-focus-after-ceo-remanded-in-hyderabad-unit-fire-probe/articleshow/126223291.cms,2025-12-29 08:36:41 IST,"Sigachi Industries shares are set to remain in focus after the company disclosed that its Managing Director and CEO was remanded in connection with the Hyderabad unit fire probe. While investigations continue, the company has assured operational continuity and appointed an interim leader to oversee day-to-day business activities.",https://economictimes.indiatimes.com/markets/stocks/rssfeeds/2146843.cms
"IRFC, NBCC and 4 other stocks flash bullish signals, indicating possible uptrend",https://economictimes.indiatimes.com/markets/stocks/news/irfc-nbcc-and-4-other-stocks-flash-bullish-signals-indicating-possible-uptrend/slideshow/126223265.cms,2025-12-29 08:32:07 IST,"On December 26, six NSE-listed stocks with market capitalisation above Rs 1,000 crore appeared on the bullish “White Marubozu” scanner. The pattern reflects strong intraday buying interest, where prices moved from session lows to highs, signalling firm buyer control and suggesting potential continuation of upward momentum.",https://economictimes.indiatimes.com/markets/stocks/rssfeeds/2146843.cms
"PNB shares in focus after lender reports Rs 2,434 crore fraud linked to SREI firms",https://economictimes.indiatimes.com/markets/stocks/news/pnb-shares-in-focus-after-lender-reports-rs-2434-crore-fraud-linked-to-srei-firms/articleshow/126222706.cms,2025-12-29 07:50:40 IST,"Punjab National Bank shares are under scrutiny after revealing a Rs 2,434 crore borrowing fraud involving SREI Equipment Finance and SREI Infrastructure Finance. The bank has fully provisioned for the outstanding amounts linked to these companies, which previously underwent insolvency proceedings. This news follows a period of strong returns for PNB stock.",https://economictimes.indiatimes.com/markets/stocks/rssfeeds/2146843.cms
Coforge shares in focus on announcing $2.35 billion acquisition of AI firm Encora,https://economictimes.indiatimes.com/markets/stocks/news/coforge-shares-in-focus-on-announcing-2-35-billion-acquisition-of-ai-firm-encora/articleshow/126222690.cms,2025-12-29 07:47:23 IST,"Coforge is set to be in focus after announcing a $2.35 billion acquisition of AI firm Encora to boost its artificial intelligence capabilities and expand its global reach. The deal, which aims to generate $2 billion in annual revenues by March 2027, marks a significant international expansion for the IT services provider.",https://economictimes.indiatimes.com/markets/stocks/rssfeeds/2146843.cms
"Stocks to buy for 2026: Midwest, Brigade Enterprises among 4 stocks that could give 10-50% return in 1 year",https://economictimes.indiatimes.com/markets/stocks/news/stocks-to-buy-for-2026-midwest-brigade-enterprises-among-4-stocks-that-could-give-10-50-return-in-1-year/slideshow/126222645.cms,2025-12-29 07:37:34 IST,We have collated a list of recommendations from top brokerage firms from ETNow and other sources.,https://economictimes.indiatimes.com/markets/stocks/rssfeeds/2146843.cms
Positive Breakout: These 9 stocks cross above their 200 DMAs,https://economictimes.indiatimes.com/markets/stocks/news/positive-breakout-these-9-stocks-cross-above-their-200-dmas/slideshow/126222617.cms,2025-12-29 07:33:42 IST,"As long as the stock is priced above the 200-day SMA on the daily time frame, it is generally considered to be an overall uptrend.",https://economictimes.indiatimes.com/markets/stocks/rssfeeds/2146843.cms
Shyam Dhani Industries heads into debut tomorrow with 100% GMP. What to expect on listing day,https://economictimes.indiatimes.com/markets/stocks/news/shyam-dhani-industries-heads-into-debut-tomorrow-with-100-gmp-what-to-expect-on-listing-day/articleshow/126222577.cms,2025-12-29 07:32:45 IST,"Shyam Dhani Industries is poised for a strong market debut on NSE SME on December 30, with grey market indicators suggesting a 90% listing premium. The company's Rs 38.49 crore IPO saw an overwhelming subscription of 988 times, driven by retail investors.",https://economictimes.indiatimes.com/markets/stocks/rssfeeds/2146843.cms
Silver rally in December prompts ominous warning from Elon Musk — Why Tesla CEO thinks it's ‘not good’,https://www.livemint.com/market/stock-market-news/silver-rally-in-december-prompts-ominous-warning-from-elon-musk-why-tesla-ceo-thinks-its-not-good-11766978654547.html,2025-12-29 09:10:41 IST,"Silver has been touching record highs almost every day over the past few days, and has given better returns than most assets. Now, Elon Musk has warned about it.",https://www.livemint.com/rss/markets
"Stocks to watch: Coforge, PNB Bank, NBCC, Vedanta among 10 shares in focus today; Check list here",https://www.livemint.com/market/stock-market-news/stocks-to-watch-coforge-pnb-bank-nbcc-vedanta-among-10-shares-in-focus-today-check-list-here-11766976996740.html,2025-12-29 09:06:15 IST,"Stocks to watch: Coforge, PNB Bank, NBCC, Vedanta are some of the stocks that will remain in focus on Monday, 29 December 2025.",https://www.livemint.com/rss/markets
The US remained the market to beat in 2025. Will that last?,https://www.livemint.com/market/stock-market-news/the-us-remained-the-market-to-beat-in-2025-will-that-last-11766978661351.html,2025-12-29 08:56:18 IST,"Other markets look worse than in the U.S. But cracks are starting to form, Ashley Lester writes in a guest commentary.",https://www.livemint.com/rss/markets
"Nifty 50, Sensex today: What to expect from Indian stock market in trade on December 29",https://www.livemint.com/market/stock-market-news/nifty-50-sensex-today-what-to-expect-from-indian-stock-market-in-trade-on-december-29-11766974957267.html,2025-12-29 08:23:31 IST,"Sensex ended the week at 85,041, consolidating just below all-time highs amid subdued participation and selective selling in heavyweight stocks. Nifty 50 ended the week at 26,042, continuing to respect its long-term rising channel on the daily chart.",https://www.livemint.com/rss/markets
7 key things that changed for market overnight - Gift Nifty to geopolitical cues,https://www.livemint.com/market/7-key-things-that-changed-for-market-overnight-gift-nifty-to-geopolitical-cues-11766971424705.html,2025-12-29 08:17:33 IST,"The trends on Gift Nifty also indicate a positive start for the Indian benchmark index. The Gift Nifty was trading near the 26,094 level, up 20.50 points or 0.8% from the Nifty futures’ previous close.",https://www.livemint.com/rss/markets
"Silver rate today: White metal trumps NVIDIA, becomes second most valuable asset in the world",https://www.livemint.com/market/commodities/silver-rate-today-white-metal-trumps-nvidia-becomes-second-most-valuable-asset-in-the-world-11766973838094.html,2025-12-29 08:09:55 IST,Spot Silver rates today touched a new peak of $84 per ounce on weak US Dollar and escalating geopolitical tensions,https://www.livemint.com/rss/markets
Oil Edges Higher With Ukraine Talks and China’s Pledge in Focus,https://www.livemint.com/market/commodities/oil-edges-higher-with-ukraine-talks-and-china-s-pledge-in-focus-11766975729237.html,2025-12-29 08:05:28 IST,"Oil ticked higher as US-led talks to end the war in Ukraine failed to yield a breakthrough, and China vowed to support growth next year.",https://www.livemint.com/rss/markets
"Gold Price Today LIVE: Gold prices rise to record high of  ₹1,40,000 per 10 grams — Can they rally more?",https://www.livemint.com/market/commodities/gold-rate-today-gold-price-today-gold-rate-today-delhi-gold-gold-price-gold-rate-gold-record-high-11766939233419.html,2025-12-29 07:31:54 IST,"Gold Price Today LIVE: Driven by accommodative monetary policy, de-dollarisation trends, and persistent global trade tensions, gold prices have seen a massive boom this year. Gold rate today has risen to a fresh high above the  ₹1,40,000 mark per 10 grams.",https://www.livemint.com/rss/markets
"Silver Price Today LIVE: White metal surges 175% this year — Is it still a good buy? Check silver rate today, outlook",https://www.livemint.com/market/commodities/silver-price-today-silver-rate-today-silver-rate-today-delhi-silver-price-delhi-silver-price-in-india-today-silver-11766938003689.html,2025-12-29 07:31:30 IST,"Silver Price Today LIVE: Silver prices are trading at record high levels with the white metal rising 15% in the last week alone. On the MCX, silver prices have risen to  ₹2.42 lakh per kg. Meanwhile, in the international market, silver rate today is close to hitting the $80 mark.",https://www.livemint.com/rss/markets
South Korean shares hit near 2-month high as chipmakers rally,https://www.livemint.com/market/stock-market-news/south-korean-shares-hit-near-2-month-high-as-chipmakers-rally-11766973293396.html,2025-12-29 07:24:52 IST,SOUTHKOREA-MARKETS/MIDDAY:South Korean shares hit near 2-month high as chipmakers rally,https://www.livemint.com/rss/markets
"Buy or sell: Vaishali Parekh recommends three stocks to buy today. Gold, silver rates in focus",https://www.livemint.com/market/stock-market-news/buy-or-sell-vaishali-parekh-recommends-three-stocks-to-buy-today-gold-silver-rates-in-focus-11766971638448.html,2025-12-29 07:24:33 IST,"Buy or sell: Amid soaring gold, silver rates, Vaishali Parekh has recommended three stocks to buy today — Mishra Dhatu, Madras Fertilizers, and Graphite India",https://www.livemint.com/rss/markets
Breakout stocks to buy or sell: Sumeet Bagadia recommends five shares to buy today — 29 December 2025,https://www.livemint.com/market/stock-market-news/breakout-stocks-to-buy-or-sell-sumeet-bagadia-recommends-five-shares-to-buy-today-29-december-2025-11766969884357.html,2025-12-29 06:57:47 IST,"Breakout stocks to buy or sell: Sumeet Bagadia recommends five shares to buy today - NBCC, Karur Vysya Bank, Engineers India, IRCTC, CCI",https://www.livemint.com/rss/markets
Oil gains as investors weigh Middle East tensions,https://www.livemint.com/market/commodities/oil-gains-as-investors-weigh-middle-east-tensions-11766971580901.html,2025-12-29 06:56:20 IST,GLOBAL-OIL/:Oil gains as investors weigh Middle East tensions,https://www.livemint.com/rss/markets
