title,link,published,summary,source
"Asian stocks rise, Nikkei jumps after Takaichi win",https://economictimes.indiatimes.com/markets/stocks/news/asian-stocks-rise-nikkei-jumps-after-takaichi-win/articleshow/128091862.cms,2026-02-09 06:37:44 IST,"Asian markets opened higher, mirroring a Wall Street surge. Investors are showing renewed interest in cyclical stocks, moving away from technology. This shift comes as markets assess demand and intense scrutiny on artificial intelligence valuations. A strong performance in Japan's Nikkei 225 index also boosted sentiment. This sets a dynamic tone for the week ahead.",https://economictimes.indiatimes.com/markets/stocks/rssfeeds/2146843.cms
Stake of local institutions in Indian cos hits new high,https://economictimes.indiatimes.com/markets/stocks/news/stake-of-local-institutions-in-indian-cos-hits-new-high/articleshow/128091568.cms,2026-02-09 06:27:02 IST,"Domestic institutions have reached an all-time high ownership of 18.72% in Indian firms, surpassing foreign investors whose stake fell to a 14-year low of 16.6%. This shift is driven by steady inflows from systematic investment plans, wealthy individuals, and increased equity exposure from pension funds, with mutual funds leading the charge.",https://economictimes.indiatimes.com/markets/stocks/rssfeeds/2146843.cms
RBI signals pause after December cut as inflation pressures edge up,https://economictimes.indiatimes.com/markets/stocks/news/rbi-signals-pause-after-december-cut-as-inflation-pressures-edge-up/articleshow/128091182.cms,2026-02-09 06:08:41 IST,The Reserve Bank of India's rate cuts may be over. Economists predict a pause as inflation pressures rise and growth prospects improve. Trade deals with the USA and EU boost economic outlook. The central bank has kept its policy rate steady. This suggests monetary policy easing is largely complete. Some still anticipate one final cut.,https://economictimes.indiatimes.com/markets/stocks/rssfeeds/2146843.cms
Seafood stocks dip amid margin pressure and competition,https://economictimes.indiatimes.com/markets/stocks/news/seafood-stocks-dip-amid-margin-pressure-and-competition/articleshow/128091092.cms,2026-02-09 06:02:57 IST,"Seafood stocks saw a dip after a rally, despite a positive medium-term outlook from the India-US trade deal expected to boost marine exports. Investors remain cautious due to near-term margin pressures and intense competition. The deal's success hinges on ongoing negotiations and the US tariff stance for other exporters, crucial as the US is India's largest market.",https://economictimes.indiatimes.com/markets/stocks/rssfeeds/2146843.cms
GIFT Nifty up 240 points; here's the trading setup for today's session,https://economictimes.indiatimes.com/markets/stocks/news/pre-market-action-heres-the-trade-setup-for-todays-session/articleshow/128076680.cms,2026-02-09 06:01:00 IST,"Indian equity benchmarks closed slightly higher Friday, with the Nifty reaching 25,693. Analysts anticipate a range-bound market ahead, driven by earnings and global uncertainties. The Nifty shows positive momentum, potentially heading towards 26,000, with dips offering buying opportunities. Foreign investors showed strong buying interest, while the rupee weakened against the dollar.",https://economictimes.indiatimes.com/markets/stocks/rssfeeds/2146843.cms
"Stocks in news: SBI, BSE, Anand Rathi Share, Tata Steel, PFC, Kotak Mahindra Bank",https://economictimes.indiatimes.com/markets/stocks/news/stocks-in-news-sbi-bse-anand-rathi-share-tata-steel-pfc-kotak-mahindra-bank/articleshow/128076434.cms,2026-02-09 06:01:00 IST,"Markets remained range-bound, ending flat as consolidation continues with a positive bias above 25,400 for Nifty. SBI reported a 24% YoY net profit growth, while Tata Steel saw a 723% jump. Other key updates include IREDA's fundraising plan, a Rs 13 crore fraud at Anand Rathi, and Titan's luxury watch sales expectations.",https://economictimes.indiatimes.com/markets/stocks/rssfeeds/2146843.cms
"Nifty likely to stay firm, 26,000–26,300 key hurdle: Analysts",https://economictimes.indiatimes.com/markets/stocks/news/nifty-likely-to-stay-firm-2600026300-key-hurdle/articleshow/128090797.cms,2026-02-09 05:49:15 IST,"Nifty is expected to maintain a positive bias, with 25,800 as a key level and resistance around 26,000–26,300. Support is seen at 25,200–25,450, with market action driven by stock- and sector-specific moves. Analysts suggest a moderately bullish Bull Call Spread strategy for February 10 weekly expiry.",https://economictimes.indiatimes.com/markets/stocks/rssfeeds/2146843.cms
D-Street likely to raise more toasts to US deal,https://economictimes.indiatimes.com/markets/stocks/news/d-street-likely-to-raise-more-toasts-to-us-deal/articleshow/128090520.cms,2026-02-09 05:28:26 IST,"Indian stock markets are set for a positive start on Monday. This follows the announcement of a broad India-US trade deal over the weekend. Positive global cues, including a strong Wall Street performance, are also supporting the market. Sectors expected to benefit from the deal may see investor interest.",https://economictimes.indiatimes.com/markets/stocks/rssfeeds/2146843.cms
Torrent Power forms Double Bottom pattern; What should investors do?,https://economictimes.indiatimes.com/markets/stocks/news/torrent-power-forms-double-bottom-pattern-what-should-investors-do/articleshow/127968040.cms,2026-02-09 05:01:00 IST,"Torrent Power has formed a double bottom pattern after weeks of consolidation, triggering a technical bounce. Analysts see improved momentum, supported by Supertrend, RSI and MACD indicators. A breakout above key resistance could pave the way for further upside in the coming months.",https://economictimes.indiatimes.com/markets/stocks/rssfeeds/2146843.cms
CreditAccess looks for a partner to let some investors exit,https://economictimes.indiatimes.com/markets/stocks/news/creditaccess-looks-for-a-partner-to-let-some-investors-exit/articleshow/128090966.cms,2026-02-09 00:35:03 IST,"CreditAccess India BV is looking for new investors. This move aims to provide an exit for long-term shareholders in its microfinance lender, CreditAccess Grameen. The company is open to strategic or financial partners. Some investors have held stakes since 2007 and seek liquidity. CreditAccess Grameen plans significant loan portfolio growth by 2028.",https://economictimes.indiatimes.com/markets/stocks/rssfeeds/2146843.cms
"Nifty 50, Sensex today: What to expect from Indian stock market in trade on February 9",https://www.livemint.com/market/stock-market-news/nifty-50-sensex-today-what-to-expect-from-indian-stock-market-in-trade-on-february-9-11770559774144.html,2026-02-09 07:16:46 IST,"Nifty 50, Sensex today: The trends on Gift Nifty also indicate a gap-up start for the Indian benchmark index. The Gift Nifty was trading around 25,926 level, a premium of nearly 191 points from the Nifty futures’ previous close.",https://www.livemint.com/rss/markets
Chicago soybeans pull back after four-day rally; traders eye USDA crop report,https://www.livemint.com/market/chicago-soybeans-pull-back-after-four-day-rally-traders-eye-usda-crop-report-11770601083784.html,2026-02-09 07:08:03 IST,GLOBAL-GRAINS/:GRAINS-Chicago soybeans pull back after fo,https://www.livemint.com/rss/markets
"Stock market today: Trade setup for Nifty 50, gold, silver rate to India-US deal; five stocks to buy or sell on Monday",https://www.livemint.com/market/stock-market-news/stock-market-today-trade-setup-for-nifty-50-gold-silver-rate-to-india-us-deal-five-stocks-to-buy-or-sell-on-monday-11770553264971.html,2026-02-09 07:03:14 IST,"Stock market today: Experts have recommended five stocks to buy today — Torrent Power, Jindal Steel, ITC, Bharti Airtel, and Kotak Mahindra Bank",https://www.livemint.com/rss/markets
Three stocks turning around just as the market mood improves,https://www.livemint.com/market/stock-market-news/three-indian-companies-profit-turnaround-market-sentiment-improves-investment-11770516470563.html,2026-02-09 07:00:33 IST,"Here are three businesses where profitability has returned in Q3FY26 through genuine operating leverage and cost discipline, not accounting creativity.",https://www.livemint.com/rss/markets
"Indian stock market: 8 key things that changed for market over weekend - Gift Nifty, Nikkei rally to India-US trade deal",https://www.livemint.com/market/stock-market-news/indian-stock-market-8-key-things-that-changed-for-market-over-weekend-gift-nifty-nikkei-rally-to-india-us-trade-deal-11770560375072.html,2026-02-09 06:56:36 IST,"Gift Nifty was trading around 25,947 level, a premium of nearly 212 points from the Nifty futures’ previous close, indicating a gap-up start for the Indian stock market indices.",https://www.livemint.com/rss/markets
"Gold, silver rates today: Gold price above $5,000/oz, silver price hovering around $79. Should you buy?",https://www.livemint.com/market/commodities/gold-silver-rates-today-gold-price-above-5-000-oz-silver-price-hovering-around-79-should-you-buy-11770597844185.html,2026-02-09 06:55:18 IST,"Gold, silver rates today: Spot gold prices advanced nearly 1.18% to $5,040 an ounce; meanwhile, spot silver prices surged as much as 3.39% to $79.89 during the Asian trading hours on Monday.",https://www.livemint.com/rss/markets
"India-US trade deal: Interim pact to boost Indian stock markets, over 30 stocks to buy today — 9 February 2026",https://www.livemint.com/market/stock-market-news/indiaus-trade-deal-interim-trade-deal-to-boost-indian-stock-markets-nifty-50-sensex-over-30-stocks-to-buy-today-11770565748647.html,2026-02-09 06:14:39 IST,"India-US trade deal: The Indian stock market is expected to rise following a surge in US markets. A new Interim Trade Agreement between India and the US aims to enhance trade, offer tariff visibility, and target non-tariff barriers",https://www.livemint.com/rss/markets
Stock recommendations for 9 February from MarketSmith India,https://www.livemint.com/market/stock-market-news/stock-recommendations-for-9-february-from-marketsmith-india-sensex-nifty-outlook-trade-set-up-11770381758789.html,2026-02-09 06:00:51 IST,"MarketSmith India reveals its top stock recommendations for today, 9 February. Get expert insights into the best-performing stocks to guide your investment decisions.",https://www.livemint.com/rss/markets
Stocks to buy for short term: From Gujarat Gas to IFCI— Jigar Patel of Anand Rathi suggests 3 technical picks,https://www.livemint.com/market/stock-market-news/stocks-to-buy-for-short-term-gujarat-gas-ifci-godrej-properties-jigar-patel-of-anand-rathi-suggests-3-shares-11770559922769.html,2026-02-09 06:00:51 IST,"Stocks to buy for the short term: Discover three promising stocks recommended by Jigar Patel from Anand Rathi for short-term trading gains. With technical indicators signalling potential uptrends, Patel provides insights on entry points, stop losses, and price targets.",https://www.livemint.com/rss/markets
Will India-US trade pact reverse foreign outflows? Fine print holds the key,https://www.livemint.com/market/india-us-trade-deal-foreign-portfolio-investment-stock-market-11770535483987.html,2026-02-09 06:00:31 IST,"The joint statement from India and the US is likely to lift sentiment on Monday, with Gift Nifty suggesting a gap-up opening. But earnings and rupee will also shape the future course of the markets.&amp;nbsp;",https://www.livemint.com/rss/markets
"Australian shares rebound on boost from banks, miners",https://www.livemint.com/market/australian-shares-rebound-on-boost-from-banks-miners-11770597004373.html,2026-02-09 06:00:03 IST,"AUSTRALIA-STOCKS/MIDDAY:Australian shares rebound on boost from banks, miners",https://www.livemint.com/rss/markets
Bharti Airtel’s tough choice: Investors want faster growth strategy using more debt or increased dividend payout,https://www.livemint.com/market/mark-to-market/bharti-airtel-q3-earnings-africa-growth-india-arpu-data-centers-leverage-dividend-11770545822104.html,2026-02-09 05:45:50 IST,Strong Africa growth and a robust balance sheet are being overshadowed by stagnant Indian Arpu and management's conservative stance on capital allocation and 5G monetization challenge.,https://www.livemint.com/rss/markets
"Gold and silver may settle in a range, equity to outperform commodities: Samco MF CEO Viraj Gandhi",https://www.livemint.com/market/india-market-foreign-flows-equity-gold-silver-samco-mutual-fund-viraj-gandhi-11770527206023.html,2026-02-09 05:30:50 IST,"While gold and silver are expected to enter a sideways range after a historic run, Viraj Gandhi, chief executive officer at Samco Mutual Fund, said that equity is poised to outperform bullion over the next two years.",https://www.livemint.com/rss/markets
Mixed summer for hiring: Gig jobs rise as permanent roles stay elusive,https://www.livemint.com/companies/news/mixed-summer-for-hiring-gig-jobs-rise-as-permanent-roles-stay-elusive-11770540404761.html,2026-02-09 06:00:51 IST,"While mandates are coming in from e-commerce and logistics players, banking, consumer durables, and electronics companies with physical stores are largely limiting hiring to replacements.",https://www.livemint.com/rss/companies
Upstox looks beyond broking as regulator tames retail mania,https://www.livemint.com/companies/news/as-regulators-squeeze-trading-led-growth-upstox-looks-beyond-broking-for-growth-11770536721353.html,2026-02-09 06:00:11 IST,"Upstox, backed by Tiger Global, is diversifying by applying for NBFC and asset management licenses amidst regulatory challenges. Despite a stagnant FY25, the company anticipates profit doubling in FY26, focusing on high-value traders and expanding into new revenue streams like insurance and lending.",https://www.livemint.com/rss/companies
Why Hyundai hitched its wagon to the ICC as cricket aims to go global,https://www.livemint.com/companies/people/hyundai-cricket-sponsorship-icc-premier-partner-11770281514771.html,2026-02-09 05:45:30 IST,"A decade since its last partnership, Hyundai Motor has struck a new deal to sponsor all men’s games organised by the ICC this year and next. Despite an India-heavy campaign, Hyundai is looking at the ICC as a global marketing opportunity.&amp;nbsp;",https://www.livemint.com/rss/companies
Hudco eyes $2 bn overseas borrowing to complement govt's urban infra blitz,https://www.livemint.com/companies/news/hudco-to-raise-1-bn-from-world-bank-adb-1-bn-yen-debt-for-urban-development-11770546961373.html,2026-02-09 05:45:10 IST,"The funds are expected to be used through Hudco’s Urban Invest Window to assist urban local bodies in developing bankable, high-impact infrastructure. The funding will complement the government's focus on developing city economic regions unveiled in the budget for 2026-27.",https://www.livemint.com/rss/companies
Asia rallies as Japan shares surge to record peak post Takaichi's win,https://www.business-standard.com/markets/news/asia-rallies-as-japan-shares-surge-to-record-peak-post-takaichi-s-win-126020900036_1.html,2026-02-09 07:11:00 IST,"Japan's Nikkei surged 4.2 per cent to all-time highs, with investors expecting increased spending and tax cuts",https://www.business-standard.com/rss/markets-106.rss
"Hitachi Energy, Nykaa shares turn bullish; analysts see up to 26% upside",https://www.business-standard.com/markets/news/stocks-stock-picks-navin-fluorine-hitachi-energy-nykaa-share-price-buy-target-126020900044_1.html,2026-02-09 06:57:44 IST,"Navin Fluorine, Hitachi Energy India and Nykaa shares show strong bullish breakouts. Kunal Kamble of Bonanza recommends 'Buy' as he sees up to 26 per cent upside in stocks in near-term",https://www.business-standard.com/rss/markets-106.rss
"Emcure Pharma, Schaeffler shares look bullish; Osho Krishan suggests 'Buy'",https://www.business-standard.com/markets/news/stocks-stock-picks-emcure-schaeffler-share-price-buy-target-technical-analysis-126020900039_1.html,2026-02-09 06:26:09 IST,Emcure Pharmaceuticals and Schaeffler shares show strong bullish technical setups. Osho Krishan of Angel One recommend 'Buy' with defined stop losses and target prices.,https://www.business-standard.com/rss/markets-106.rss
