title,link,published,summary,source
Stock Radar: Star Health stock breaks out from multi-year resistance band to hit fresh 52-week high in June; time to buy?,https://economictimes.indiatimes.com/markets/stocks/news/stock-radar-star-health-stock-breaks-out-from-multi-year-resistance-band-to-hit-fresh-52-week-high-in-june-time-to-buy/articleshow/131989716.cms,2026-06-29 05:00:00 IST,"Star Health and Allied Insurance has surged past a significant multi-year resistance, hitting a fresh 52-week high. Experts suggest this breakout signals improving momentum, recommending a buy for medium-term traders targeting Rs 800 within the next 2-3 months. The stock's recovery from a previous downtrend and bullish technical indicators support this optimistic outlook.",https://economictimes.indiatimes.com/markets/stocks/rssfeeds/2146843.cms
"Kotak Mahindra Bank shares fall 3% after CEO's surprise exit. What Nomura, Jefferies said",https://economictimes.indiatimes.com/markets/stocks/news/kotak-mahindra-bank-shares-fall-3-after-ceos-surprise-exit-what-nomura-jefferies-said/articleshow/132063129.cms,2026-06-29 10:17:23 IST,"Analysts at Nomura and Jefferies, however, maintain 'Buy' ratings, with Nomura highlighting Anup Kumar Saha as a strong internal candidate. Despite the leadership change, analysts believe the bank's strategic direction will remain consistent.",https://economictimes.indiatimes.com/markets/stocks/rssfeeds/2146843.cms
Astral shares drop 6% after demerger. What should investors do?,https://economictimes.indiatimes.com/markets/stocks/news/astral-shares-drop-6-after-demerger-what-should-investors-do/articleshow/132063103.cms,2026-06-29 10:14:08 IST,"Astral shares fell nearly 6% on Monday after the company’s board approved the demerger of its chemicals business into a newly incorporated entity, Astral Chemie. According to an exchange filing, the Composite Scheme of Arrangement also includes Astral Limited and Al-Aziz Plastics. The stock hit a low of Rs 1,389 amid the development and approval process.",https://economictimes.indiatimes.com/markets/stocks/rssfeeds/2146843.cms
"Persistent Systems shares slide 8% after Nagarro deal; Elara retains 'Sell' on growth, margin worries",https://economictimes.indiatimes.com/markets/stocks/news/persistent-systems-shares-slide-7-after-1-14-billion-offer-to-buy-germanys-nagarro/articleshow/132062643.cms,2026-06-29 09:38:25 IST,"Persistent Systems' shares dropped significantly following its announcement to acquire German digital engineering firm Nagarro for approximately EUR 1.27 billion. While this move aims to boost European presence and revenue, analysts express concerns about near-term growth and profitability impacts due to the premium acquisition price and Nagarro's weaker financial performance. The deal, financed by a bridge loan, is expected to reduce US market dependence and expand industry verticals.",https://economictimes.indiatimes.com/markets/stocks/rssfeeds/2146843.cms
"2 years, zero returns: Is it time for Nifty investors to be fearful or greedy?",https://economictimes.indiatimes.com/markets/stocks/news/2-years-zero-returns-is-it-time-for-nifty-investors-to-be-fearful-or-greedy/articleshow/132062399.cms,2026-06-29 09:27:36 IST,"Nifty investors face two years of flat returns, mirroring past periods that historically led to significant market recoveries. Data shows that after similar stagnation, one-year gains ranged from 5% to 50%. Valuations have become attractive, and earnings growth is projected to accelerate. Despite some concerns, the current market setup suggests a potential for strong returns as economic fundamentals improve.",https://economictimes.indiatimes.com/markets/stocks/rssfeeds/2146843.cms
Top Nifty50 stocks analysts suggest buying in this volatile week,https://economictimes.indiatimes.com/markets/stocks/news/top-nifty50-stocks-analysts-suggest-buying-in-this-volatile-week/articleshow/132062384.cms,2026-06-29 09:22:46 IST,"Stock Reports Plus, powered by Refinitiv, is a comprehensive report that evaluates five key components of 4,000+ listed stocks – earnings, fundamentals, relative valuation, risk, and price momentum – to generate standardised scores. The simple average of the above-mentioned five component ratings is normally distributed to reach an average score.",https://economictimes.indiatimes.com/markets/stocks/rssfeeds/2146843.cms
"Interglobe Aviation among 4 stocks flashing bullish signals, hinting at a possible uptrend",https://economictimes.indiatimes.com/markets/stocks/news/interglobe-aviation-among-4-stocks-flashing-bullish-signals-hinting-at-a-possible-uptrend/slideshow/132062204.cms,2026-06-29 09:01:01 IST,"​Four Nifty500 stocks formed a bullish White Marubozu pattern, signalling strong buying interest throughout the session. Mahindra &amp; Mahindra Financial Services, Tata Motors, Asahi India Glass and InterGlobe Aviation featured on the scanner.",https://economictimes.indiatimes.com/markets/stocks/rssfeeds/2146843.cms
PFC-REC merger approved! Here's what will happen to your existing shares after mega merger,https://economictimes.indiatimes.com/markets/stocks/news/pfc-rec-merger-approved-heres-what-will-happen-to-your-existing-shares-after-mega-merger/articleshow/132061857.cms,2026-06-29 08:37:44 IST,"PFC and REC boards approved their merger scheme with a share-swap ratio of 88 PFC shares for every 100 REC shares. The merger aims to create India’s largest power financing institution. Analysts advise staggered investment, citing regulatory approvals, execution risks and valuation concerns despite long-term sector support.",https://economictimes.indiatimes.com/markets/stocks/rssfeeds/2146843.cms
SBI Cards And Payment Services among 3 stocks showing bullish RSI upswing,https://economictimes.indiatimes.com/markets/stocks/news/sbi-cards-and-payment-services-among-3-stocks-showing-bullish-rsi-upswing/slideshow/132061819.cms,2026-06-29 08:31:09 IST,"Three stocks in the NSE mid-cap segment featured in the RSI Trending Up scan on June 25 after showing improving momentum. The RSI moved above the 50 mark from lower levels, signalling strengthening price action, improving sentiment and potential short-term buying opportunities for traders tracking bullish technical setups.",https://economictimes.indiatimes.com/markets/stocks/rssfeeds/2146843.cms
Anubhav Plast shares list flat at IPO price of Rs 80 on BSE SME platform,https://economictimes.indiatimes.com/markets/stocks/news/anubhav-plast-shares-to-list-today-check-gmp-ahead-of-debut/articleshow/132061435.cms,2026-06-29 08:05:18 IST,"Anubhav Plast shares debuted at their IPO price of Rs 80 on the BSE SME platform, mirroring grey market expectations. The company's Rs 80 crore IPO saw a 2.18 times subscription, with strong retail investor interest. Anubhav Plast manufactures ERW steel pipes and tubes, and swaged steel tubular poles, primarily for government projects. Proceeds will fund a new facility for crash barriers and solar panel structures.",https://economictimes.indiatimes.com/markets/stocks/rssfeeds/2146843.cms
Negative Breakout: These 8 stocks cross below their 200 DMAs,https://economictimes.indiatimes.com/markets/stocks/news/negative-breakout-these-8-stocks-cross-below-their-200-dmas/slideshow/132061203.cms,2026-06-29 07:41:41 IST,The 200 DMA is used as a key indicator by traders for determining the overall trend in a particular stock.,https://economictimes.indiatimes.com/markets/stocks/rssfeeds/2146843.cms
Foreign outflows thin down on healthier cues in June,https://economictimes.indiatimes.com/markets/stocks/news/foreign-outflows-thin-down-on-healthier-cues-in-june/articleshow/132060721.cms,2026-06-29 06:23:08 IST,"Overseas investors significantly reduced their selling of Indian equities in June, with outflows nearing December 2025 lows. Easing crude oil prices and receding geopolitical tensions, particularly following an initial US-Iran agreement, improved market sentiment. While foreign portfolio investors have been net sellers year-to-date, domestic investors continue their strong buying streak, providing a crucial support to the market.",https://economictimes.indiatimes.com/markets/stocks/rssfeeds/2146843.cms
"Stocks in news: Waaree Energies, Kotak Bank, HDFC Bank, Strides Pharma, Persistent Systems",https://economictimes.indiatimes.com/markets/stocks/news/stocks-in-news-waaree-energies-kotak-bank-hdfc-bank-strides-pharma-persistent-systems/articleshow/132055110.cms,2026-06-29 06:11:00 IST,"Indian markets showed volatility, ending nearly flat despite positive signals. Analysts note Nifty faces resistance from key moving averages, with a decisive close above 24,200 crucial for further gains. Several companies like Waaree Energies, Kotak Bank, and Tata Motors are in focus due to significant developments, including US investigations, strategic partnerships, and EV expansion plans.",https://economictimes.indiatimes.com/markets/stocks/rssfeeds/2146843.cms
Markets poised for a cautious start as GIFT Nifty trades flat,https://economictimes.indiatimes.com/markets/stocks/news/pre-market-action-heres-the-trade-setup-for-todays-session/articleshow/132055215.cms,2026-06-29 06:11:00 IST,"Indian markets ended Thursday on a high note, with the Nifty 50 climbing nearly 1% from its lowest point. This positive momentum was fueled by declining energy prices, a stronger rupee, and favorable global trends. Analysts anticipate a continued positive outlook for Indian equities, with the Nifty expected to hold above the 24,000 mark, bolstered by stable geopolitical conditions and robust foreign investment.",https://economictimes.indiatimes.com/markets/stocks/rssfeeds/2146843.cms
Nifty has more room to run; stay selective: Analysts,https://economictimes.indiatimes.com/markets/stocks/news/nifty-has-more-room-to-run-stay-selective-analysts/articleshow/132060667.cms,2026-06-29 06:10:30 IST,"Indian stock markets are showing cautious optimism, with the Nifty eyeing the 24,300-25,000 zone amid ongoing volatility. Analysts recommend selective trading and specific strategies like a moderately bullish Call Spread. Top stock picks include TVS Motor, Samvardhana Motherson International, Oberoi Realty, Aurobindo Pharma, Vijaya Diagnostic Centre, and Mahindra &amp; Mahindra Financial Services, each presenting unique buying opportunities with defined targets and stop losses.",https://economictimes.indiatimes.com/markets/stocks/rssfeeds/2146843.cms
Persistent's Nagarro deal could be a near-term pain for long-term gain,https://economictimes.indiatimes.com/markets/stocks/news/persistents-nagarro-deal-could-be-a-near-term-pain-for-long-term-gain/articleshow/132060643.cms,2026-06-29 05:55:05 IST,"Persistent Systems is acquiring Nagarro SE for $1.3 billion, aiming for European expansion and reduced US market reliance. While strategically beneficial long-term, the deal, funded by debt, faces short-term pressure due to Nagarro's decelerating growth and a high acquisition price. Persistent must now focus on boosting combined revenue without sacrificing profitability, a key challenge ahead.",https://economictimes.indiatimes.com/markets/stocks/rssfeeds/2146843.cms
"PFC, REC boards approve merger scheme, share exchange ratio at 88 PFC shares for every 100 REC shares",https://economictimes.indiatimes.com/markets/stocks/news/pfc-rec-boards-approve-merger-scheme-share-exchange-ratio-at-88-pfc-shares-for-every-100-rec-shares/articleshow/132060775.cms,2026-06-28 23:39:34 IST,"Power Finance Corporation and REC Ltd boards have greenlit their merger, creating India's largest power financier with over Rs 11 lakh crore in loans. The approved share swap ratio is 88 PFC shares for every 100 REC shares. This consolidation aims to boost operational efficiency and bolster the balance sheet, positioning the combined entity to significantly fund India's energy transition and infrastructure growth.",https://economictimes.indiatimes.com/markets/stocks/rssfeeds/2146843.cms
"Twinkle Papers IPO Day 1: GMP, subscription status, review, other details in 10 points",https://www.livemint.com/market/ipo/twinkle-papers-ipo-day-1-gmp-subscription-status-review-other-details-in-10-points-11782708701561.html,2026-06-29 10:50:29 IST,"Twinkle Papers IPO GMP today: According to market observers, shares of the company are available at a premium of  ₹9 in the grey market today",https://www.livemint.com/rss/markets
"Turtlemint Fintech share price makes weak debut, lists at 11% discount",https://www.livemint.com/market/stock-market-news/turtlemint-fintech-solutions-share-price-makes-weak-debut-lists-at-11-discount-11782704852561.html,2026-06-29 10:07:47 IST,Turtlemint Fintech IPO listing: Turtlemint Fintech Solutions share price opened at  ₹134.90 per share on NSE and 10.39% discount at  ₹136 apiece on BSE.,https://www.livemint.com/rss/markets
Persistent Systems share price crashes 9% to hit a 52-week low; is it a stock to buy?,https://www.livemint.com/market/stock-market-news/persistent-systems-share-price-crashes-9-to-hit-a-52-week-low-is-it-a-stock-to-buy-11782706485788.html,2026-06-29 09:59:05 IST,"Persistent Systems shares opened at  ₹4,500 against their previous close of  ₹4,840.45 and plunged 9% to their one-year low of  ₹4,404. The BSE Information Technology index declined 1% during the session.",https://www.livemint.com/rss/markets
Transrail Lighting share price jumps 4% after winning overseas orders worth  ₹459 crore,https://www.livemint.com/market/stock-market-news/transrail-lighting-share-price-jumps-4-after-winning-overseas-orders-worth-rs-459-crore-11782706841010.html,2026-06-29 09:55:54 IST,"Transrail Lighting share price has risen 9% in one month and has gained 10% in three months. The smallcap stock has fallen 8% in six months, while it has dropped nearly 21% in one year.",https://www.livemint.com/rss/markets
Stocks to buy or sell: Dharmesh Shah of ICICI Sec suggests buying Kotak Mahindra Bank shares on 29 June,https://www.livemint.com/market/stock-market-news/stocks-to-buy-or-sell-dharmesh-shah-of-icici-sec-suggests-buying-kotak-mahindra-bank-shares-on-29-june-11782705461243.html,2026-06-29 09:52:30 IST,"Indian benchmark indices opened mixed following a significant weekly winning streak. The Nifty 50 showed little change, while the BSE Sensex dipped slightly. Investors are cautious amid geopolitical tensions, with attention on US-Iran diplomatic efforts.",https://www.livemint.com/rss/markets
"IOC, HPCL to BPCL: OMC stocks dip on rising crude oil prices. ONGC, Oil India stocks gain",https://www.livemint.com/market/stock-market-news/ioc-hpcl-to-bpcl-omc-stocks-dip-on-rising-crude-oil-prices-ongc-oil-india-stocks-gain-11782705243685.html,2026-06-29 09:46:56 IST,"US-Iran war: IOC turned the biggest laggard among the OMC stocks, declining over 2%. Other OMC stocks, HPCL and BPCL shares, also witnessed similar downward movement of 1.60% and 1.81% on 29 June.",https://www.livemint.com/rss/markets
"Aastha Spintex IPO Day 1: GMP, subscription status, review, other details. Apply or not?",https://www.livemint.com/market/ipo/aastha-spintex-ipo-day-1-gmp-subscription-status-review-other-details-apply-or-not-11782702503114.html,2026-06-29 09:16:37 IST,"Aastha Spintex IPO GMP today: According to market observers, shares of the company are available at a premium of  ₹5 in the grey market today",https://www.livemint.com/rss/markets
"Gold rate declines on MCX as fresh escalations in US-Iran tensions drive oil prices up, fueling US Fed rate-hike bets",https://www.livemint.com/market/commodities/gold-rate-declines-on-mcx-as-fresh-escalations-in-us-iran-tensions-drive-oil-prices-up-fueling-us-fed-rate-hike-bets-11782704217748.html,2026-06-29 09:13:51 IST,"Gold and silver rates declined on MCX as fresh escalations in US-Iran tensions drove oil prices up. MCX gold August futures were 0.40% down at  ₹1,43,583 per 10 grams, while MCX silver September contracts were 0.26% down at  ₹2,22,899 per kg around 9:15 am.",https://www.livemint.com/rss/markets
Rupee opens 5 paise higher at 94.35 against US dollar,https://www.livemint.com/market/stock-market-news/rupee-opens-5-paise-higher-at-94-35-against-us-dollar-11782704274972.html,2026-06-29 09:09:12 IST,"The Indian rupee strengthened to 94.35 against the US dollar, supported by lower oil prices despite potential global risks. Analysts suggest the rupee may trade within the 94-95 range, with strong capital inflows providing some buffer against a firm US dollar.",https://www.livemint.com/rss/markets
Stocks to buy for short term: Anand Rathi's Jigar Patel recommends 3 shares for next 1-2 weeks; do you own any?,https://www.livemint.com/market/stock-market-news/stocks-to-buy-for-short-term-anand-rathis-jigar-patel-recommends-3-shares-for-next-1-2-weeks-do-you-own-any-11782702292425.html,2026-06-29 09:05:58 IST,"Stocks to buy for short term: Jigar Patel recommends three promising stocks for short-term gains. With technical patterns suggesting solid entry points, you can capitalise on these insights.",https://www.livemint.com/rss/markets
"Waterways Leisure Tourism IPO allotment date likely today. GMP, steps to check share allotment status online",https://www.livemint.com/market/ipo/waterways-leisure-tourism-ipo-allotment-date-likely-today-gmp-steps-to-check-share-allotment-status-online-11782702360134.html,2026-06-29 08:48:43 IST,"Waterways Leisure Tourism IPO allotment date is likely today, 29 June 2026. Waterways Leisure Tourism IPO allotment status online check can be done through the websites of BSE, NSE and the IPO registrar. MUFG Intime India is the Waterways Leisure Tourism IPO registrar.",https://www.livemint.com/rss/markets
"US dollar set to log highest monthly gain in one-year. US-Iran war, job data in focus",https://www.livemint.com/market/stock-market-news/us-dollar-set-to-log-highest-monthly-gain-in-one-year-us-iran-war-job-data-in-focus-11782702667837.html,2026-06-29 08:44:21 IST,"The US dollar is set for its largest monthly gain in a year, rising 2.5% in June due to safe-haven demand amid US-Iran tensions and Federal Reserve rate hike expectations. The euro, sterling, and Australian dollar are all facing declines as market uncertainties grow.",https://www.livemint.com/rss/markets
"CSM Technologies IPO Day 3: Issue booked 66% so far. Check GMP, key dates, review. Should you apply or skip?",https://www.livemint.com/market/ipo/csm-technologies-ipo-gmp-csm-technologies-ipo-review-csm-technologies-ipo-apply-or-not-csm-technologies-ipo-size-11782700610774.html,2026-06-29 08:29:42 IST,"CSM Technologies IPO opened on 24 June 2026and closed on 29 June 2026. The company raised  ₹20 crore from anchor investors and has a price band of  ₹107-113. The IPO is aimed at supporting growth, particularly in GovTech and digital transformation services.",https://www.livemint.com/rss/markets
Stocks to buy today: Ganesh Dongre of Anand Rathi recommends three shares to buy or sell,https://www.livemint.com/market/stock-market-news/stocks-to-buy-today-ganesh-dongre-of-anand-rathi-recommends-three-shares-to-buy-or-sell-11782700420404.html,2026-06-29 08:23:19 IST,Indian stock market: Ganesh Dongre of Anand Rathi recommends three stocks to buy on Monday. Check top stock picks by the market expert.,https://www.livemint.com/rss/markets
"Stocks to watch: HDFC Bank, Torrent Power, IIFL Finance among shares in focus today; check list here",https://www.livemint.com/market/stock-market-news/stocks-to-watch-hdfc-bank-torrent-power-iifl-finance-among-shares-in-focus-today-check-list-here-11782698497729.html,2026-06-29 07:58:13 IST,"Stock market today: On Thursday, the Sensex advanced 109.25 points, or 0.14%, to close at 77,100.47, while the Nifty 50 gained 34.35 points, or 0.14%, to settle at 24,056.00",https://www.livemint.com/rss/markets
"Buy or sell: Gift Nifty up, Vaishali Parekh recommends three stocks to buy amid escalation in the US-Iran war",https://www.livemint.com/market/stock-market-news/buy-or-sell-gift-nifty-up-vaishali-parekh-recommends-three-stocks-to-buy-amid-escalation-in-the-us-iran-war-11782697152483.html,2026-06-29 07:54:42 IST,"Buy or sell: Vaishali Parekh recommends three stocks to buy today — Refex Industries, Tata Consumer Products, and Samvardhana Motherson International",https://www.livemint.com/rss/markets
"Stock market today: Gift Nifty hints muted start; US-Iran peace talks, gold to crude oil prices - 8 stocks to buy",https://www.livemint.com/market/stock-market-news/stock-market-today-gift-nifty-hints-muted-start-us-iran-peace-talks-gold-to-crude-oil-prices-8-stocks-to-buy-11782697135864.html,2026-06-29 07:52:18 IST,"Indian markets expected to open lower as geopolitical tensions rise following US-Iran clashes. Despite a modest gain on Thursday, investor sentiment remains cautious. Analysts suggest monitoring key support and resistance levels for Nifty 50 and Bank Nifty amidst ongoing diplomatic negotiations.",https://www.livemint.com/rss/markets
"Nifty 50, Sensex prediction today: Check how Indian stock market is expected to trade on 29 June",https://www.livemint.com/market/stock-market-news/nifty-50-sensex-prediction-today-check-how-indian-stock-market-is-expected-to-trade-on-29-june-11782697553307.html,2026-06-29 07:28:53 IST,"Nifty 50, Sensex prediction today: The trends on Gift Nifty also indicate a tepid start for the Indian benchmark index. The Gift Nifty was trading around 24,089 level, a discount of nearly 13 points from the Nifty futures’ previous close.",https://www.livemint.com/rss/markets
"Asian stocks today: Kospi, Nikkei crash up to 3% on escalation in US-Iran war",https://www.livemint.com/market/stock-market-news/asian-stocks-today-kospi-nikkei-crash-up-to-3-on-escalation-in-us-iran-war-11782697110997.html,2026-06-29 07:28:41 IST,"Asian stocks today: Japan's Nikkei 225 declined 1%, while the broader Topix advanced 0.43%. South Korea's Kospi fell 3% at the open on Monday.",https://www.livemint.com/rss/markets
"From Gift Nifty, US-Iran war to Asian stocks: 8 key things that changed for Indian stock market over weekend",https://www.livemint.com/market/stock-market-news/from-gift-nifty-us-iran-war-to-asian-stocks-8-key-things-that-changed-for-indian-stock-market-over-weekend-11782694666862.html,2026-06-29 07:09:31 IST,"Gift Nifty was trading around 24,087 level, a discount of nearly 15 points from the Nifty futures’ previous close, indicating a tepid start for the Indian stock market indices.",https://www.livemint.com/rss/markets
"Crude oil prices rise amid escalating US-Iran war, supply fears; Brent above $70 per barrel",https://www.livemint.com/market/commodities/crude-oil-prices-rise-amid-escalating-us-iran-war-supply-fears-brent-above-70-per-barrel-11782695660401.html,2026-06-29 07:05:33 IST,"US-Iran war: international benchmark Brent crude gained 0.36% to trade at $72.25 a barrel. Meanwhile, US benchmark West Texas Intermediate (WTI) crude futures rose 0.71% to $69.72 a barrel on Monday.",https://www.livemint.com/rss/markets
Breakout stocks to buy or sell: Sumeet Bagadia recommends five shares to buy today - 29 June 2026,https://www.livemint.com/market/stock-market-news/breakout-stocks-to-buy-or-sell-sumeet-bagadia-recommends-five-shares-to-buy-today-29-june-2026-11782694236346.html,2026-06-29 06:40:36 IST,The Indian stock market ended Thursday's session on a higher note. Sumeet Bagadia of Choice Broking recommends five breakout stocks to buy today.,https://www.livemint.com/rss/markets
Raja Venkatraman recommends three stocks for 29 June,https://www.livemint.com/market/stock-market-news/raja-venkatraman-recommends-three-stocks-for-29-june-11782692707703.html,2026-06-29 06:05:11 IST,Market expert Raja Venkatraman shares his top stock picks for 29 June. Here’s his technical outlook and trade strategy.,https://www.livemint.com/rss/markets
"Revenue, not margin expansion, will drive next leg of growth: DSP CIO Anish Tawakley",https://www.livemint.com/market/stock-market-news/revenue-not-margin-expansion-will-drive-next-leg-of-growth-says-dsp-cio-anish-tawakley-11782632406687.html,2026-06-29 06:00:12 IST,"Anish Tawakley said he favours large caps over smaller peers due to accounting red flags, while betting on domestic financials, cement, and autos over export-oriented manufacturing.",https://www.livemint.com/rss/markets
Stock recommendations for 29 June from MarketSmith India,https://www.livemint.com/market/stock-market-news/stock-recommendations-for-29-june-from-marketsmith-india-11782438623529.html,2026-06-29 06:00:12 IST,"MarketSmith India reveals its top stock recommendations for today, 29 June. Get expert insights into the best-performing stocks to guide your investment decisions.",https://www.livemint.com/rss/markets
Mindgrove's vision chip moves closer to market with Prama MoU,https://www.livemint.com/companies/news/mindgrove-inks-prama-mou-vision-chip-commercial-deployment-11782653500360.html,2026-06-29 06:01:52 IST,"The MoU facilitates joint development efforts, allowing both firms to tailor the product before its commercial launch.",https://www.livemint.com/rss/companies
Inside Rajesh Exports' paper trail—a complex web of auditors and arms,https://www.livemint.com/companies/news/auditors-rajesh-exports-kpmg-pwc-sebi-11782638190751.html,2026-06-29 06:00:52 IST,"A limited-purpose, non-statutory opinion issued by KPMG Switzerland for Global Gold Refineries AG (GGR), the firm's Swiss arm, was likely used to prepare the group's consolidated financial statements, documents reviewed by Mint showed.",https://www.livemint.com/rss/companies
