title,link,published,summary,source
Pre-market action: Here's the trade setup for today's session,https://economictimes.indiatimes.com/markets/stocks/news/pre-market-action-heres-the-trade-setup-for-todays-session/articleshow/129429713.cms,2026-03-11 06:39:13 IST,"Indian benchmark indices concluded March 10 on a strong note, with the Nifty surpassing 24,250. Analysts anticipate consolidation between 24,500 and 23,700, with immediate support at 24,150. The India VIX saw a significant drop, while foreign investors were net sellers.",https://economictimes.indiatimes.com/markets/stocks/rssfeeds/2146843.cms
"Stocks in news: Nazara Technologies, IndiGo, Hindustan Zinc, NTPC Green, RIL",https://economictimes.indiatimes.com/markets/stocks/news/stocks-in-news-nazara-technologies-indigo-hindustan-zinc-ntpc-green-ril/articleshow/129429439.cms,2026-03-11 06:34:26 IST,"Indian markets saw a strong rebound on Tuesday, recovering some losses. Global cues improved and crude oil price worries eased. Several companies are in focus today. Nazara Technologies saw a significant block deal. IndiGo's CEO stepped down. RIL is boosting LPG production. Vedanta calls for unlocking domestic resources. NTPC Green Energy added new solar capacity.",https://economictimes.indiatimes.com/markets/stocks/rssfeeds/2146843.cms
"AIFs could get upto Rs 17,000 crore after PFRDA opens NPS door",https://economictimes.indiatimes.com/markets/stocks/news/aifs-could-get-upto-rs-17000-crore-after-pfrda-opens-nps-door/articleshow/129429307.cms,2026-03-11 06:27:02 IST,"India's pension fund regulator has permitted 1% of the ₹17 lakh crore assets under management to be invested in alternative investment funds. This move aims to channel domestic institutional money into private equity and venture capital, addressing a long-standing gap in the alternatives ecosystem.",https://economictimes.indiatimes.com/markets/stocks/rssfeeds/2146843.cms
"D-St bulls, rupee regain ground amid global oil price rollercoaster",https://economictimes.indiatimes.com/markets/stocks/news/d-st-bulls-rupee-regain-ground-amid-global-oil-price-rollercoaster/articleshow/129428901.cms,2026-03-11 06:18:33 IST,"Indian stocks and the rupee saw a strong rebound on Tuesday.  This recovery followed a significant drop in crude oil prices.  Asian markets also experienced gains.  Traders cut bearish bets as tensions eased.  Investors are deploying cash into the market.  Sectoral indices mostly climbed, with auto and consumer durables leading the gains.  Volatility remains a concern for the market.",https://economictimes.indiatimes.com/markets/stocks/rssfeeds/2146843.cms
RBI aligns capital rules of banks with global norms,https://economictimes.indiatimes.com/markets/stocks/news/rbi-aligns-capital-rules-of-banks-with-global-norms/articleshow/129428393.cms,2026-03-11 06:02:40 IST,"The Reserve Bank of India has updated bank capital rules, aligning them with global standards and clarifying how lenders assess trading partner default risk. New guidelines require banks to include trading-partner exposures from all consolidated entities.  Updated 'add-on' percentages for off-balance-sheet trades like derivatives are now in effect, impacting capital requirements for clearing members on exchanges.",https://economictimes.indiatimes.com/markets/stocks/rssfeeds/2146843.cms
RBI links bank dividends to Common Equity Tier 1 ratio,https://economictimes.indiatimes.com/markets/stocks/news/rbi-links-bank-dividends-to-cet1-ratio/articleshow/129428292.cms,2026-03-11 05:59:26 IST,"The Reserve Bank of India has revised dividend payout norms for banks, linking them to Common Equity Tier 1 (CET1) ratios instead of CRAR and NPAs. The new guidelines, effective April 1, 2027, offer greater flexibility to well-capitalized banks, with payouts ranging from 0% to 100% of adjusted profit after tax, subject to a cap.",https://economictimes.indiatimes.com/markets/stocks/rssfeeds/2146843.cms
"These 9 banking stocks have an upside potential of more than 16% in 1 year, according to analysts",https://economictimes.indiatimes.com/markets/stocks/news/these-9-banking-stocks-have-an-upside-potential-of-more-than-16-in-1-year-according-to-analysts/articleshow/129427738.cms,2026-03-11 05:54:32 IST,"The way things are panning out in the Gulf war, the probability of ever greater volatility in markets across the globe is high. Given that the Indian economy and oil have a strong correlation which can impact many sectors, it might be better to think twice before acting in the stock market. And remember this: Don't take any statement by any of the parties involved as gospel truth. Check out Stock Reports Plus, powered by Refinitiv, for price targets of over 4,000 listed stocks along with detailed company analysis focusing on five key components ,earnings, fundamentals, relative valuation, risk, and price momentum, to generate standardised scores. SR+ Reports is a complimentary offering to ETPrime members.",https://economictimes.indiatimes.com/markets/stocks/rssfeeds/2146843.cms
Aluminium stocks jump up to 10% as global supply disruptions lift prices,https://economictimes.indiatimes.com/markets/stocks/news/aluminium-stocks-jump-up-to-10-as-global-supply-disruptions-lift-prices/articleshow/129428059.cms,2026-03-11 05:53:24 IST,"Global aluminium prices have surged due to plant shutdowns in Qatar and Bahrain and Strait of Hormuz disruptions, boosting Indian producers like Nalco, Hindalco, and Vedanta.  These supply issues are expected to widen the global aluminium deficit, potentially driving prices higher through the first half of FY27.",https://economictimes.indiatimes.com/markets/stocks/rssfeeds/2146843.cms
"Valuations moderate after market fall, but India’s premium limits FII comeback",https://economictimes.indiatimes.com/markets/stocks/news/valuations-moderate-after-market-fall-but-indias-premium-limits-fii-comeback/articleshow/129427252.cms,2026-03-11 05:30:18 IST,"Indian stock markets have seen valuations ease after a recent sell-off. However, key indices still trade at a premium compared to emerging market peers. This valuation gap, coupled with investor caution, is impacting foreign fund inflows. India's equity market performance has been among the weakest globally this year. Investors remain watchful of geopolitical events.",https://economictimes.indiatimes.com/markets/stocks/rssfeeds/2146843.cms
IndiGo CEO Elbers quits 3 months after airline’s worst-ever crisis,https://economictimes.indiatimes.com/markets/stocks/news/indigo-ceo-elbers-quits-3-months-after-airlines-worst-ever-crisis/articleshow/129429070.cms,2026-03-11 05:30:00 IST,"In a dramatic shift for IndiGo, CEO Pieter Elbers has stepped down following a significant operational failure that led to the cancellation of over 5,000 flights last December, stranding numerous travelers. The situation prompted government intervention to restore order in the airline's operations.",https://economictimes.indiatimes.com/markets/stocks/rssfeeds/2146843.cms
Stock Radar: Down nearly 50% from highs! This investment company is showing signs of a turnaround,https://economictimes.indiatimes.com/markets/stocks/news/stock-radar-down-nearly-50-from-highs-this-investment-company-is-showing-signs-of-a-turnaround/articleshow/129386741.cms,2026-03-11 05:00:00 IST,"Tata Investment Corporation stock shows signs of a potential reversal from crucial January 2026 support levels around Rs 580. Experts suggest medium-term investors with a high-risk profile can buy for a target of Rs 900 in 2-3 months, citing accumulation and strong volume.",https://economictimes.indiatimes.com/markets/stocks/rssfeeds/2146843.cms
"HC quashes Rs 1 crore GST seizure, orders return",https://economictimes.indiatimes.com/markets/stocks/news/hc-quashes-1cr-gst-seizure-orders-return/articleshow/129427741.cms,2026-03-11 00:49:52 IST,"GST cases: Smruti Waghdhare, proprietor of M/s Platinum International, had challenged seizure orders dated June 27 and June 28, 2023 issued in Form GST INS-02.",https://economictimes.indiatimes.com/markets/stocks/rssfeeds/2146843.cms
Jindal Steel wins Thakurani A1 iron ore block in Odisha,https://economictimes.indiatimes.com/markets/stocks/news/jindal-steel-wins-thakurani-a1-iron-ore-block-in-odisha/articleshow/129427801.cms,2026-03-11 00:44:48 IST,"The steelmaker won the block by committing a premium of 101.20% to the government. Bidding for the mine, conducted online on Tuesday, started at a premium of 101.05%.",https://economictimes.indiatimes.com/markets/stocks/rssfeeds/2146843.cms
Cheques &amp; balances: IDFC First brings in extra layer of security,https://economictimes.indiatimes.com/markets/stocks/news/cheques-balances-idfc-first-brings-in-extra-layer-of-security/articleshow/129427864.cms,2026-03-11 00:33:18 IST,"IDFC First said it is implementing two new controls for government, banking and institutional accounts. Under the revised protocol, the bank will first send an email to the registered email ID of the concerned account holder and will clear the transaction only after receiving explicit confirmation from that address, a spokesperson said.",https://economictimes.indiatimes.com/markets/stocks/rssfeeds/2146843.cms
"Iran war may dent India's growth story, says Moody's",https://economictimes.indiatimes.com/markets/stocks/news/west-asia-war-could-impact-demand-and-hurt-the-economy-says-moodys/articleshow/129428186.cms,2026-03-10 16:47:26 IST,"An ongoing crisis in West Asia poses significant risks to the Indian economy. Experts suggest a potential contraction in GDP, accompanied by higher interest rates and climbing inflation rates. Such conditions could stifle growth and dampen consumer spending, while financial institutions may encounter their own challenges.",https://economictimes.indiatimes.com/markets/stocks/rssfeeds/2146843.cms
CreditAccess Grameen signs pact with global banks to raise $75 million,https://economictimes.indiatimes.com/markets/stocks/news/creditaccess-grameen-signs-pact-with-global-banks-to-raise-75-million/articleshow/129427916.cms,2026-03-10 09:29:00 IST,CreditAccess has secured over $300 million in commitments this fiscal. HSBC arranged a social loan facility for the company. These funds will support eligible social projects. The company is diversifying its resource base. This move reinforces investor confidence in the microfinance sector. CreditAccess met over 15% of its borrowing needs through foreign sources this fiscal.,https://economictimes.indiatimes.com/markets/stocks/rssfeeds/2146843.cms
"Gold, silver rates today: Gold prices climb above $5,200, silver prices reach $89 an ounce. What should investors do?",https://www.livemint.com/market/commodities/gold-silver-rates-today-gold-prices-climb-above-5-200-silver-prices-reach-89-an-ounce-what-should-investors-do-11773189907095.html,2026-03-11 06:53:44 IST,"Gold, silver rates today: Spot gold rate today was trading 0.34% lower at $5224 per ounce. Meanwhile, spot silver prices were also trading in red, down 0.32% to $89.35 per ounce, during the Asian trading hours.",https://www.livemint.com/rss/markets
Crude oil prices fall on reports of IEA proposal for reserve release; Brent oil slips below $88 a barrel,https://www.livemint.com/market/commodities/crude-oil-prices-fall-on-reports-of-iea-proposal-for-reserve-release-brent-oil-slips-below-88-a-barrel-11773190638735.html,2026-03-11 06:31:54 IST,"Brent crude oil prices have risen nearly 50% since the start of the year due to the effective closure of the Strait of Hormuz, which typically handles one-fifth of global oil flows.",https://www.livemint.com/rss/markets
"SEDEMAC Mechatronics IPO listing date today. GMP, experts signal share debut at a modest premium in Indian stock market",https://www.livemint.com/market/ipo/sedemac-mechatronics-ipo-listing-date-today-gmp-experts-signal-share-debut-at-a-modest-premium-in-indian-stock-market-11773160595304.html,2026-03-11 06:16:01 IST,"SEDEMAC Mechatronics IPO listing date is today, 11 March 2026. Ahead of the debut, SEDEMAC Mechatronics IPO GMP today and analysts signal a modest listing of shares.",https://www.livemint.com/rss/markets
Australian shares extend recovery as miners rally on strong metal prices,https://www.livemint.com/market/australian-shares-extend-recovery-as-miners-rally-on-strong-metal-prices-11773189464973.html,2026-03-11 06:07:44 IST,AUSTRALIA-STOCKS/ MIDDAY:Australian shares extend recovery as miners rally on strong metal prices,https://www.livemint.com/rss/markets
Australian dollar hits multi-year highs as bulls scent rate rise,https://www.livemint.com/market/australian-dollar-hits-multi-year-highs-as-bulls-scent-rate-rise-11773189222693.html,2026-03-11 06:03:42 IST,AUSTRALIA-FOREX/:Australian dollar hits multi-year highs as bulls scent rate rise,https://www.livemint.com/rss/markets
Stocks to buy: Raja Venkatraman recommends three stocks for 11 March,https://www.livemint.com/market/stock-market-news/stocks-to-buy-raja-venkatraman-recommendations-three-stocks-for-11-march-sensex-nifty-trade-set-up-11773143439761.html,2026-03-11 06:01:17 IST,Market expert Raja Venkatraman shares his top stock picks for 11 March. Here’s his technical outlook and trade strategy.,https://www.livemint.com/rss/markets
Stock recommendations for 11 March from MarketSmith India,https://www.livemint.com/market/stock-market-news/stock-recommendations-marketsmith-india-top-stock-picks-sensex-nifty-11773143097570.html,2026-03-11 06:00:57 IST,"MarketSmith India reveals its top stock recommendations for today, 11 March. Get expert insights into the best-performing stocks to guide your investment decisions.",https://www.livemint.com/rss/markets
"With oil on the boil, here are four small cap stocks for your watch list",https://www.livemint.com/market/stock-market-news/oil-stocks-india-small-cap-oil-stocks-11773143383653.html,2026-03-11 06:00:17 IST,"A blockade at the Strait of Hormuz, a choke point that carries about a fifth of global oil, has reignited supply shock fears, lifting crude prices and heightening risks for import-dependent economies such as India’s.",https://www.livemint.com/rss/markets
War jitters revive demand for Reits after IT-driven sell-off,https://www.livemint.com/market/commercial-real-estate-trusts-office-space-yields-stability-reit-11773130338786.html,2026-03-11 05:30:56 IST,REITs have emerged as a defensive refuge amid geopolitical volatility. But slowing IT hiring and tenant concentration risks still hang over the sector.,https://www.livemint.com/rss/markets
Buy or sell: Vaishali Parekh recommends three stocks to buy today — 11 March 2026,https://www.livemint.com/market/stock-market-news/buy-or-sell-vaishali-parekh-recommends-three-stocks-to-buy-today-11-march-2026-11773160189996.html,2026-03-11 05:13:16 IST,"Buy or sell stocks: Vaishali Parekh recommends three stocks to buy today — Piramal Pharma, Bharat Dynamics, and Oberoi Realty",https://www.livemint.com/rss/markets
ROI-Private credit alarm bells echo 2007 subprime warnings: McGeever,https://www.livemint.com/market/roiprivate-credit-alarm-bells-echo-2007-subprime-warnings-mcgeever-11773185471926.html,2026-03-11 05:01:11 IST,"MARKETS-CRISIS/PRIVATE CREDIT (REPEAT, ROI, COLUMN, PIX, GRAPHICS):RPT-ROI-Private credit alarm bells echo 2007 subprime warnings: McGeever",https://www.livemint.com/rss/markets
VinFast hires seasoned auto executives to accelerate India expansion,https://www.livemint.com/companies/vinfast-india-hiring-auto-industry-executives-ev-expansion-11773133443243.html,2026-03-11 05:45:17 IST,"The Vietnamese EV maker has recruited more than half a dozen senior leaders and executives with prior stints at firms such as Hyundai Motor Company, Honda Motor Co., Nissan Motor Co., Renault, BMW, and MG Motor over the past eight months.",https://www.livemint.com/rss/companies
"Sensex opens nearly flat above 78,000, Nifty below 24,250 amid mixed global cues",https://economictimes.indiatimes.com/markets/stocks/news/sensex-opens-nearly-flat-above-78000-nifty-below-24250-amid-mixed-global-cues/articleshow/129435353.cms,2026-03-11 09:25:26 IST,"Indian stock markets began Wednesday with minimal movement. The Sensex saw a slight increase, while the Nifty opened lower. Investors are closely watching the ongoing conflict between Iran and Israel-US. This cautious trading follows a sharp rebound in the previous session. Key sectors like Metal and Pharma showed gains, while Auto and FMCG faced declines.",https://economictimes.indiatimes.com/markets/stocks/rssfeeds/2146843.cms
"On March 10, five Nifty500 stocks formed bullish White Marubozu pattern",https://economictimes.indiatimes.com/markets/stocks/news/on-march-10-five-nifty500-stocks-formed-bullish-white-marubozu-pattern/slideshow/129436015.cms,2026-03-11 09:17:14 IST,"Five Nifty500 stocks gained more than 6% on March 10 and formed the bullish White Marubozu candlestick pattern, according to StockEdge technical scan data. The pattern signals strong buying pressure throughout the session and is often interpreted by traders as an indication of continued bullish momentum in the market.",https://economictimes.indiatimes.com/markets/stocks/rssfeeds/2146843.cms
"Shakti Pumps, NCC &amp; KEC International soar up to 8% as govt clears Rs 8.7 lakh crore Jal Jeevan Mission extension",https://economictimes.indiatimes.com/markets/stocks/news/15-stocks-in-focus-as-govt-approves-rs-8-7-lakh-crore-jal-jeevan-mission-extension-check-full-list/articleshow/129435043.cms,2026-03-11 09:12:14 IST,"Shares of Shakti Pumps, NCC, and KEC International rallied after the Union Cabinet approved the Jal Jeevan Mission's extension until 2028. The program has a Rs 8.69 lakh crore outlay. This decision is expected to benefit several engineering, procurement, and construction companies. Pump manufacturers and pipe makers will also see support. A new digital framework, Sujalam Bharat, will be introduced.",https://economictimes.indiatimes.com/markets/stocks/rssfeeds/2146843.cms
IndiGo shares in focus as CEO Pieter Elbers resigns just 3 months after December flight disruptions,https://economictimes.indiatimes.com/markets/stocks/news/indigo-shares-in-focus-as-ceo-pieter-elbers-resigns-just-3-months-after-december-flight-disruptions/articleshow/129434929.cms,2026-03-11 09:01:22 IST,"IndiGo shares will be in focus after CEO Pieter Elbers resigned nearly three months after major operational disruptions that stranded passengers. Managing Director Rahul Bhatia will oversee operations temporarily. The airline also faces sector risks from rising crude prices and geopolitical tensions, though brokerages still see long-term growth potential.",https://economictimes.indiatimes.com/markets/stocks/rssfeeds/2146843.cms
Nifty's 18-month slump: How the AI shift and wars are rewriting the bull playbook,https://economictimes.indiatimes.com/markets/stocks/news/niftys-18-month-slump-how-the-ai-shift-and-wars-are-rewriting-the-bull-playbook/articleshow/129434787.cms,2026-03-11 08:58:00 IST,"Indian equity investors face an 18-month return drought, with the Nifty and smallcaps significantly below recent peaks. Despite fears surrounding AI and geopolitical tensions, strategists urge against raising cash, advocating for increased equity allocation due to attractive valuations and a potential market turn.",https://economictimes.indiatimes.com/markets/stocks/rssfeeds/2146843.cms
Reliance Industries shares in focus as Trump announces $300 billion US refinery project with company backing,https://economictimes.indiatimes.com/markets/stocks/news/reliance-industries-shares-in-focus-as-trump-announces-300-billion-us-refinery-project-with-company-backing/articleshow/129434612.cms,2026-03-11 08:53:47 IST,"Reliance Industries shares will be in focus after U.S. President Donald Trump announced a proposed $300 billion oil refinery project in Texas with investment backing from the Indian conglomerate. The facility at the Port of Brownsville is expected to boost U.S. energy output and exports, though Reliance has not confirmed the partnership.",https://economictimes.indiatimes.com/markets/stocks/rssfeeds/2146843.cms
"Stocks to buy in 2026 for long term: Ambuja Cement, Apollo Hospitals among 5 stocks that could give 10-30% return",https://economictimes.indiatimes.com/markets/stocks/news/stocks-to-buy-in-2026-for-long-term-ambuja-cement-apollo-hospitals-among-5-stocks-that-could-give-10-30-return/slideshow/129434428.cms,2026-03-11 08:43:20 IST,We have collated a list of recommendations from top brokerage firms from ETNow and other sources:,https://economictimes.indiatimes.com/markets/stocks/rssfeeds/2146843.cms
Sedemac Mechatronics shares to list today. Here's what GMP indicates,https://economictimes.indiatimes.com/markets/stocks/news/sedemac-mechatronics-shares-to-list-today-heres-what-gmp-indicates/articleshow/129433941.cms,2026-03-11 08:37:19 IST,"The Rs 1,087 crore IPO of Sedemac Mechatronics had opened for subscription from March 4 to March 6. The public issue was entirely an offer for sale (OFS) of about 80.43 lakh shares, meaning the company itself will not receive any proceeds from the issue and the funds will go to existing shareholders selling their stakes.",https://economictimes.indiatimes.com/markets/stocks/rssfeeds/2146843.cms
Positive Breakout: These 12 stocks cross above their 200 DMAs,https://economictimes.indiatimes.com/markets/stocks/news/positive-breakout-these-12-stocks-cross-above-their-200-dmas/slideshow/129433729.cms,2026-03-11 08:19:02 IST,"As long as the stock is priced above the 200-day SMA on the daily time frame, it is generally considered to be in an overall uptrend.",https://economictimes.indiatimes.com/markets/stocks/rssfeeds/2146843.cms
Reliance Industries share price gains amid plans for new oil refinery in Texas,https://www.livemint.com/market/stock-market-news/reliance-industries-share-price-gains-on-plans-for-new-oil-refinery-in-texas-11773200498843.html,2026-03-11 09:19:24 IST,US President Donald Trump said the US will get its first new oil refinery in 50 years with the help of investment from India’s Reliance Industries Ltd.,https://www.livemint.com/rss/markets
Silver rate today slips marginally as US-Iran conflict keeps investors cautious: Should you buy amid current volatility?,https://www.livemint.com/market/commodities/gold-silver-rate-today-slips-marginally-as-us-iran-war-keeps-investors-cautious-should-you-buy-silver-amid-volatility-11773198665096.html,2026-03-11 09:09:35 IST,"Silver rates declined on March 11 due to investor caution amid the US-Israel-Iran war, with gold benefiting from easing oil prices and a weaker dollar. Geopolitical tensions are disrupting oil supply, contributing to ongoing market volatility and uncertainty over future interest rates.",https://www.livemint.com/rss/markets
"Gold rate slips on MCX due to profit booking; geopolitical tensions, dollar's weakness limit losses",https://www.livemint.com/market/commodities/gold-price-today-rate-slips-on-mcx-due-to-profit-booking-geopolitical-tensions-dollars-weakness-limit-losses-11773199268137.html,2026-03-11 09:05:42 IST,"MCX gold April futures declined about half a per cent to  ₹1,62,638 per 10 grams, while MCX silver May futures dropped nearly 1% to  ₹2,75,402 per kg in early deals.",https://www.livemint.com/rss/markets
"SEDEMAC Mechatronics Share Price LIVE: GMP, experts hint flat share debut in Indian stock market",https://www.livemint.com/market/ipo/sedemac-mechatronics-ipo-gmp-sedemac-mechatronics-share-price-sedemac-mechatronics-ipo-listing-sedemac-mechatronics-11773198365537.html,2026-03-11 08:58:33 IST,"SEDEMAC Mechatronics IPO listing date is today, 11 March 2026. Ahead of the debut, SEDEMAC Mechatronics IPO GMP today and analysts signal a flat listing of shares.",https://www.livemint.com/rss/markets
"Gold, Silver Rates Today LIVE: Comex gold prices above $5,200 an ounce, silver price near $90 amid US-Iran war",https://www.livemint.com/market/commodities/gold-silver-rates-today-live-mcx-gold-rate-today-mcx-silver-price-us-iran-war-israel-donald-trump-us-fed-11-march-2026-11773197883509.html,2026-03-11 08:36:31 IST,"Gold, Silver Rates Today LIVE: Gold prices traded higher on easing inflation worries, while investors awaited a slew of US economic data this week to gauge the Federal Reserve’s policy outlook. Spot gold price traded above $5,200 per ounce, while silver price was near $90 per ounce.",https://www.livemint.com/rss/markets
"Stocks to watch: IndiGo, Reliance Industries, Adani Enterprises among 10 shares in focus on Wednesday",https://www.livemint.com/market/stock-market-news/stocks-to-watch-indigo-reliance-industries-adani-enterprises-among-10-shares-in-focus-on-wednesday-11773196146897.html,2026-03-11 08:33:32 IST,"Stock market today: The Indian stock market is expected to open lower on Wednesday, tracking mixed global cues amid caution surrounding the US-Iran conflict.",https://www.livemint.com/rss/markets
"Stock market today: Trade setup for Nifty 50, US-Iran war, crude oil, gold, silver rates — 8 stocks to buy or sell",https://www.livemint.com/market/stock-market-news/stock-market-today-trade-setup-for-nifty-50-us-iran-war-crude-oil-gold-silver-rates-8-stocks-to-buy-or-sell-11773193667627.html,2026-03-11 08:17:54 IST,"Stock market today: Market analysts recommend eight stocks for intraday trading, including Can Fin Homes and Emcure Pharmaceuticals, citing technical analysis and market conditions. Investors are advised to monitor geopolitical developments and market volatility closely for potential opportunities.",https://www.livemint.com/rss/markets
