title,link,published,summary,source
For investors with 1- to 2-year perspective and ability to ignore volatility: 6 stocks with an upside potential of up to 26%,https://economictimes.indiatimes.com/markets/stocks/news/for-investors-with-1-to-2-year-perspective-and-ability-to-ignore-volatility-6-stocks-with-an-upside-potential-of-up-to-26/articleshow/132488919.cms,2026-07-19 06:44:30 IST,"The US-Iran war is escalating again, with all that means for crude prices and nervous markets. And halfway across the world, the long AI trade is unwinding, dragging down the high-priced names that led the rally. Between the two, volatility, which has been the defining feature of 2026, is set to rise again. But volatility has a shelf life. It comes, it frightens, and it goes. What survives it is the underlying business, the quality of the management running it, and their proven ability to handle exactly this kind of complexity.",https://economictimes.indiatimes.com/markets/stocks/rssfeeds/2146843.cms
Have metal stocks’ dependence moved from Chinese apartments to world's power grid? 5 metal stocks with upside potential of up to 34%,https://economictimes.indiatimes.com/markets/stocks/news/have-metal-stocks-dependence-moved-from-chinese-apartments-to-worlds-power-grid-5-metal-stocks-with-upside-potential-of-up-to-34/articleshow/132488795.cms,2026-07-19 05:56:17 IST,"Weak Chinese growth has traditionally been a warning signal for metal stocks. Yet, the latest disappointing data from China has caused only a limited reaction, or literally nothing. It can be because of two reasons: Either the old rule is changing, or the bad news has been discounted by the market. Either way, it is time to relook at metal stocks, but only by investors who have the ability to be contrarian as well as tactical. Coming back to China: Has it stopped mattering? Not quite. It has started mattering in a more complicated way. And that is where the AI connection for metal starts.",https://economictimes.indiatimes.com/markets/stocks/rssfeeds/2146843.cms
"After a decade of falling behind, UTI AMC begins its turnaround under a new chief",https://www.livemint.com/companies/uti-amc-turnaround-strategy-vetri-subramaniam-growth-plan-mfs-funds-11784186187143.html,2026-07-19 07:00:09 IST,"Subramaniam, who took charge in February ahead of the annual planning cycle, likens his career to football—having progressed from team captain as head of equities to manager as chief investment officer, and now to running the club as chief executive.",https://www.livemint.com/rss/companies
A viral SIP myth is fooling investors. Here's why,https://www.livemint.com/money/personal-finance/sip-systematic-investment-plan-mutual-funds-nifty-xirr-equity-funds-investing-11784273389103.html,2026-07-19 07:00:29 IST,A viral post claims SIPs delivered just 6.7% over two decades. But the calculation is flawed—and the flat market it cites is precisely when SIPs quietly do their best work.,https://www.livemint.com/rss/money
"Bank holidays this week: SBI, HDFC, ICICI, PNB to remain closed for upto 3 days — RBI calendar here",https://www.livemint.com/money/personal-finance/bank-holidays-this-week-sbi-hdfc-icici-pnb-to-remain-closed-for-upto-3-days-rbi-calendar-here-11784421624289.html,2026-07-19 06:54:46 IST,"Bank holidays this week: Banks in India will be closed for upto three days this week, but digital platforms like UPI and banking apps will remain operational. Customers should note that in-branch services are suspended on Sundays and specific regional holidays.&amp;nbsp;",https://www.livemint.com/rss/money
These 9 penny stocks rallied up to 360% in 6 months; 4 turned multibaggers,https://economictimes.indiatimes.com/markets/stocks/news/these-9-penny-stocks-rallied-up-to-360-in-6-months-4-turned-multibaggers/slideshow/132489826.cms,2026-07-19 09:43:57 IST,"These stocks were identified using specific filters: a market capitalisation below Rs 1,000 crore, a share price under Rs 20, and a minimum average trading volume of 5 lakh shares.",https://economictimes.indiatimes.com/markets/stocks/rssfeeds/2146843.cms
"F&amp;O Talk: Nifty IT gaining strong momentum, says Sudeep Shah; outlines HDFC Bank, ICICI Bank strategy after Q1",https://economictimes.indiatimes.com/markets/stocks/news/fo-talk-nifty-it-gaining-strong-momentum-says-sudeep-shah-outlines-hdfc-bank-icici-bank-strategy-after-q1/articleshow/132489745.cms,2026-07-19 09:42:46 IST,"The Nifty IT index has rebounded nearly 13.5% from its July 1 low and gained around 5% this week, signalling improving momentum. Technical indicators, including the RSI, MACD and Relative Rotation Graph (RRG), point to strengthening bullish sentiment. The 29,600–29,650 zone is the key resistance, while 28,500–28,550 is expected to act as immediate support.",https://economictimes.indiatimes.com/markets/stocks/rssfeeds/2146843.cms
"Will Sensex, Nifty extend gains on Monday? Q1 earnings, global tech selloff among 6 factors to steer D-St this week",https://economictimes.indiatimes.com/markets/stocks/news/will-sensex-nifty-extend-gains-on-monday-q1-earnings-global-tech-selloff-among-6-factors-to-steer-d-st-this-week/articleshow/132489722.cms,2026-07-19 09:37:40 IST,"Dalal Street ended the week on a strong note, with the Sensex and Nifty gaining over 1% on Friday. Investors will track six key market triggers this week, including the peak of the Q1 earnings season, the escalating Iran-US conflict, surging crude oil prices, the global tech selloff, rupee movement and FII flows. Analysts remain cautiously optimistic on market sentiment.",https://economictimes.indiatimes.com/markets/stocks/rssfeeds/2146843.cms
Indian stock market: How are Sensex and Nifty 50 likely to perform next week amid global tech sell-off?,https://www.livemint.com/market/stock-market-news/indian-stock-market-how-are-sensex-and-nifty-50-likely-to-perform-next-week-amid-global-tech-selloff-11784437788577.html,2026-07-19 11:10:30 IST,"Indian stock market: The benchmark indices ended the week on a strong note, with the Nifty 50 rising about 0.53% to close at 24,334.30, while the Sensex climbed nearly 0.75% to settle at 78,151.45",https://www.livemint.com/rss/markets
Stocks under  ₹100: Sumeet Bagadia recommends three shares to buy on Monday - 20 July 2026,https://www.livemint.com/market/stock-market-news/stocks-under-rs-100-sumeet-bagadia-recommends-three-shares-to-buy-on-monday-20-july-2026-11784432397307.html,2026-07-19 09:34:06 IST,"The Indian stock ended the week on a positive note on Friday. Check Sumeet Bagadia's outlook for the market in the coming with, along with the three stocks under  ₹100 that he feels are a buy in current situation.",https://www.livemint.com/rss/markets
Buy or sell: Ganesh Dongre of Anand Rathi recommends 3 stocks to buy on Monday - 20 July 2026,https://www.livemint.com/market/stock-market-news/buy-or-sell-ganesh-dongre-of-anand-rathi-recommends-3-stocks-to-buy-on-monday-20-july-2026-11784430255201.html,2026-07-19 09:06:07 IST,"Indian stock market: Amid ongoing Middle East Tension, Ganesh Dongre of Anand Rathi recommends three stocks to buy on Monday. Check top stock picks by the market expert.",https://www.livemint.com/rss/markets
"Q1 results FY27 to US-Iran war, FII flows: Top five triggers that may dictate the Indian stock market this week",https://www.livemint.com/market/stock-market-news/q1-results-fy27-to-us-iran-war-fii-flows-top-five-triggers-that-may-dictate-the-indian-stock-market-this-week-11784426782119.html,2026-07-19 08:08:24 IST,"Stock market today: Benchmark indices registered solid weekly gains, with the Nifty 50 rising about 0.53% to end at 24,334.30. While some of the global triggers continue this week, read on to know what are the fresh factors to watch out for this week.",https://www.livemint.com/rss/markets
Retirement planning: Why the rule of 1% upgrade works better than a 1% increase in SIP amount,https://www.livemint.com/money/personal-finance/retirement-planning-why-the-rule-of-1-upgrade-works-better-than-a-1-increase-in-sip-amount-11784432119696.html,2026-07-19 11:05:19 IST,The rule of 1% upgrade encourages investors to increase the share of their income invested by one percentage point every year. A small annual increase in the share of income invested can significantly boost long-term retirement savings.,https://www.livemint.com/rss/money
EPF Scheme 2026: Why you must keep 25% of your PF balance before retirement,https://www.livemint.com/money/personal-finance/epf-scheme-2026-why-you-must-keep-25-of-your-pf-balance-before-retirement-11784437895909.html,2026-07-19 10:49:08 IST,"The new EPF Scheme introduces a 25% minimum balance requirement for partial withdrawals. Here's what the rule means, how eligible member balance is calculated, and when you can withdraw your full PF corpus.",https://www.livemint.com/rss/money
"₹25,000 monthly SIP at 12%: Check estimated corpus after 10, 20 and 30 years and see how compounding builds  ₹8.74 crore",https://www.livemint.com/money/personal-finance/25000-monthly-sip-at-12-check-estimated-corpus-after-10-20-and-30-years-and-see-how-compounding-builds-8-74-crore-11784378423532.html,2026-07-19 09:48:28 IST,"A  ₹25,000 monthly SIP earning an assumed 12% annual return can grow to  ₹8.74 crore in 30 years. Check how compounding, understanding of core principles, disciplined investing and staying invested help create long-term wealth for retirement, children's education and financial independence.",https://www.livemint.com/rss/money
"Sold house for  ₹1.10 crore, tax computed on  ₹1.96 crore? ITAT explains when Section 54 relief is still available",https://www.livemint.com/money/personal-finance/sold-house-for-1-10-crore-tax-computed-on-1-96-crore-itat-explains-when-section-54-relief-is-still-available-11784433824676.html,2026-07-19 09:39:41 IST,"The Pune ITAT has ruled that capital gains computed using the higher stamp duty value under Section 50C do not automatically deny Section 54 exemption. The tax benefit, however, is available only if the taxpayer satisfies all conditions for claiming the exemption.",https://www.livemint.com/rss/money
Health insurance: 63% policyholders unable to switch from their plan — Here's why and key things to keep in mind,https://www.livemint.com/money/personal-finance/health-insurance-63-policyholders-unable-to-switch-from-plan-why-key-things-11783875824041.html,2026-07-19 09:33:13 IST,"An analysis by CoverSure showed that besides under-penetration of health insurance, another growing problem for many policyholders is that coverage exists but as many as 63% are unable to switch plans.",https://www.livemint.com/rss/money
"Monsoon Home Insurance: Focus on fine print, cheap premiums could cost you dearly",https://www.livemint.com/money/monsoon-home-insurance-focus-on-fine-print-cheap-premiums-could-cost-you-dearly-11784114438033.html,2026-07-19 09:04:05 IST,"There are many exclusions in your home insurance policy, and the policyholder must carefully review them to avoid being caught off guard at the worst possible moment.",https://www.livemint.com/rss/money
"Salary slip shows TDS deducted, but Form 26AS doesn't? Here's how the ITAT ruling protected the taxpayer",https://www.livemint.com/money/personal-finance/salary-slip-shows-tds-deducted-but-form-26as-doesnt-heres-how-the-itat-ruling-protected-the-taxpayer-11784428116281.html,2026-07-19 08:44:10 IST,An ITAT ruling reinforces that salaried employees cannot be asked to pay tax twice if their employer deducts TDS but fails to deposit it. The decision strengthens taxpayer protection and serves as a timely reminder to verify TDS records before filing income tax returns.,https://www.livemint.com/rss/money
"Atal Pension Yojana: How to open account, eligibility criteria, pension scheme payout — Check top FAQs answered here",https://www.livemint.com/money/personal-finance/atal-pension-yojana-apy-how-open-account-bank-savings-aadhaar-eligibility-indian-pension-scheme-payout-top-faqs-answered-11784308985878.html,2026-07-19 07:59:36 IST,"Atal Pension Yojana: Today we answer the most frequently asked questions about eligibility criteria, requirements, documents needed, payout amount and other top FAQs about the government-run pension scheme…",https://www.livemint.com/rss/money
8 Sensex stocks with up to 30% upside potential. Are these in your portfolio?,https://economictimes.indiatimes.com/markets/stocks/news/8-sensex-stocks-with-up-to-30-upside-potential-are-these-in-your-portfolio/slideshow/132491327.cms,2026-07-19 12:52:55 IST,,https://economictimes.indiatimes.com/markets/stocks/rssfeeds/2146843.cms
M-cap of five of top 10 most valued firms jumps Rs 1.54 lakh cr; TCS biggest winner,https://economictimes.indiatimes.com/markets/stocks/news/m-cap-of-five-of-top-10-most-valued-firms-jumps-rs-1-54-lakh-cr-tcs-biggest-winner/articleshow/132490890.cms,2026-07-19 12:16:18 IST,"Last week marked a significant uplift in the market valuation of five of the top 10 firms, appreciating by Rs 1.54 lakh crore. Tata Consultancy Services claimed the spotlight, boosting its valuation by Rs 72,072.3 crore. ICICI Bank and Reliance Industries also experienced notable increases. However, the tide turned for HDFC Bank and Bharti Airtel, which faced declines. Overall, Indian equity markets concluded the week on a robust note.",https://economictimes.indiatimes.com/markets/stocks/rssfeeds/2146843.cms
Should you buy Reliance shares after strong Q1 results 2026?,https://www.livemint.com/market/stock-market-news/should-you-buy-reliance-shares-after-strong-q1-results-2026-11784444729654.html,2026-07-19 12:55:20 IST,"Reliance Industries share price gained 2.50% on Friday, ending the session at  ₹1,328.80 apiece.",https://www.livemint.com/rss/markets
Q1 results 2026: Infosys to Eternal among companies to declare Q1 results next week; check full list here,https://www.livemint.com/market/stock-market-news/q1-results-2026-infosys-to-eternal-among-companies-to-declare-q1-results-next-week-check-full-list-here-11784439990844.html,2026-07-19 12:23:54 IST,"Q1 results 2026: Infosys, Eternal, One 97 Communications Paytm, Bajaj Auto, Adani Energy Solutions, Indian Hotels Company, Bharat Petroleum Corporation, Interglobe Aviation, NTPC, and IDFC First Bank are among the marquee companies to report their Q1 results FY27 next week.",https://www.livemint.com/rss/markets
"JSW Steel sees West Asia reconstruction opportunity, warns of steel import diversion",https://www.livemint.com/companies/jsw-steel-sees-west-asia-reconstruction-opportunity-warns-of-steel-import-diversion-exports-11784386573437.html,2026-07-19 13:13:42 IST,"JSW Steel expects post-war reconstruction in West Asia to create fresh demand, while warning that surplus steel from China, Japan and Russia could be diverted to India.",https://www.livemint.com/rss/companies
Looking to invest in debt funds for a 1-3 year horizon? Expert shares 4 categories you can consider,https://www.livemint.com/money/personal-finance/looking-to-invest-in-debt-funds-for-a-1-3-year-horizon-expert-shares-4-categories-you-can-consider-11784443543453.html,2026-07-19 13:01:13 IST,"For a 1-3 year investment horizon, short-duration, dynamic bond, corporate bond, and banking &amp;amp; PSU funds are among the best debt fund categories you can consider. Unlike others, credit risk funds invest in lower-rated bonds, making them riskier.",https://www.livemint.com/rss/money
Bank seized your property after loan default? RBI's new rules explained,https://www.livemint.com/money/personal-finance/what-happens-after-a-bank-takes-over-your-property-rbis-new-rules-explained-11784443523840.html,2026-07-19 12:30:28 IST,"The Reserve Bank of India has issued a new framework governing how banks must value, manage and sell properties acquired while recovering defaulted loans. The rules, effective October 1, 2026, also bar banks from selling such properties back to defaulting borrowers.",https://www.livemint.com/rss/money
Government may roll out flexible pension scheme for all workers under EPFO 3.0 reforms: Report,https://www.livemint.com/money/personal-finance/government-may-roll-out-flexible-pension-scheme-for-all-workers-under-epfo-3-0-reforms-report-11784438771493.html,2026-07-19 12:01:51 IST,"The proposed contributory pension scheme could cover formal, unorganised, gig and higher-wage workers, with flexible withdrawals and a “Target Retirement Sum” approach.",https://www.livemint.com/rss/money
Ahead of Market: 10 things that will decide D-Street action on Monday,https://economictimes.indiatimes.com/markets/stocks/news/ahead-of-market-10-things-that-will-decide-d-street-action-on-monday/articleshow/132492765.cms,2026-07-19 15:38:43 IST,"The Sensex surged over 960 points and the Nifty climbed more than 1% on Friday, driven by strong Q1 earnings optimism and buying in IT and banking stocks. Analysts said domestic institutional investors are rotating into attractively valued large-cap stocks, while selective profit booking in mid- and small-caps continues. Consumer durables also remain in focus on improving demand expectations.",https://economictimes.indiatimes.com/markets/stocks/rssfeeds/2146843.cms
"Nifty breakout isn’t convincing yet; a move above 24,600 could unlock record high: Anand James",https://economictimes.indiatimes.com/markets/stocks/news/nifty-breakout-isnt-convincing-yet-a-move-above-24600-could-unlock-record-high-anand-james/articleshow/132492717.cms,2026-07-19 15:35:26 IST,"Nifty’s Friday rebound has broken its recent range, but a sustained uptrend is yet to be confirmed. Geojit’s Anand James sees 24,400 as near-term resistance and flags India Cements and Bharat Forge as top trading picks.",https://economictimes.indiatimes.com/markets/stocks/rssfeeds/2146843.cms
"Nifty weekly outlook: 24,500 holds the key to next leg of gains; focus on stock-specific bets",https://economictimes.indiatimes.com/markets/stocks/news/nifty-weekly-outlook-24500-holds-the-key-to-next-leg-of-gains-focus-on-stock-specific-bets/articleshow/132492041.cms,2026-07-19 14:34:10 IST,"The Nifty ended the week with modest gains as the index defended the crucial 23,800–24,000 support zone, keeping the broader technical structure positive. Analysts expect the next move to hinge on the 24,500 resistance level, where the 100-week moving average could pose a hurdle. A breakout above this zone may revive stronger upside momentum, while support remains intact.",https://economictimes.indiatimes.com/markets/stocks/rssfeeds/2146843.cms
"Bonus, dividends and stock splits: Bharti Airtel, Hero MotoCorp among 88 stocks turning ex-date this week. Do you own any?",https://economictimes.indiatimes.com/markets/stocks/news/bonus-dividends-and-stock-splits-bharti-airtel-hero-motocorp-among-88-stocks-turning-ex-date-this-week-do-you-own-any/articleshow/132491671.cms,2026-07-19 13:55:14 IST,Investors must hold shares in their demat accounts on the respective record dates to be eligible. Here is the complete day-wise list of key corporate actions to track.,https://economictimes.indiatimes.com/markets/stocks/rssfeeds/2146843.cms
"Expert view: Selective bets &amp; strong fundamentals amid global chaos, says Vinod Nair",https://www.livemint.com/market/stock-market-news/expert-view-selective-bets-strong-fundamentals-amid-global-chaos-says-vinod-nair-11784452456648.html,2026-07-19 14:52:51 IST,"Early Q1 results have also helped reinforce expectations that Indian equities may outperform global peers over the medium term, aided by resilient domestic demand and more reasonable valuations",https://www.livemint.com/rss/markets
Mcap of five of top-10 most valued firms jumps  ₹1.54 lakh cr; TCS biggest winner,https://www.livemint.com/market/stock-market-news/mcap-of-five-of-top-10-most-valued-firms-jumps-rs-1-54-lakh-cr-tcs-biggest-winner-11784452341307.html,2026-07-19 14:45:01 IST,"The market valuation of five top firms increased by  ₹1.54 lakh crore last week, led by TCS, amid positive equity trends. The Sensex and Nifty also rose, supported by strong IT earnings and renewed interest in financial stocks.&amp;nbsp;",https://www.livemint.com/rss/markets
"Upcoming IPOs: Cube Highways IPO, Xtranet Tech IPO among new issues to open next week; check full list here",https://www.livemint.com/market/upcoming-ipos-cube-highways-ipo-xtranet-tech-ipo-among-new-issues-to-open-next-week-check-full-list-here-11784449725282.html,2026-07-19 14:40:46 IST,"Upcoming IPOs: Cube Highways Trust IPO, Xtranet Technologies IPO, Lohia Corp IPO, and Indo-MIM IPO are among the mainboard issues to open for bidding next week.",https://www.livemint.com/rss/markets
HDFC Bank vs ICICI Bank vs Yes Bank: Which stock to buy after Q1 results 2026?,https://www.livemint.com/market/stock-market-news/hdfc-bank-vs-icici-bank-vs-yes-bank-which-stock-to-buy-after-q1-results-2026-11784446257168.html,2026-07-19 13:54:09 IST,"According to Seema Srivastava, Senior Research Analyst at SMC Global Securities, for long-term investors, the private lender is the defensive compounder.",https://www.livemint.com/rss/markets
Accenture reworks salary hikes to include more employees: Splits base pay and one-time lumpsum — Here's what changes,https://www.livemint.com/companies/news/accenture-rework-salary-hike-50-pc-split-basic-payment-one-time-lumpsum-bonus-cash-include-compensation-more-employees-11784452932577.html,2026-07-19 15:30:01 IST,"Accenture has reworked its salary hike composition to include more employees in the June cycle, according to a report. The new approach aims to reward more staff while managing payroll. Here's a look at what changes…&amp;nbsp;",https://www.livemint.com/rss/companies
Meta layoffs: US judge rejects bid to halt AI discrimination job cuts,https://www.livemint.com/companies/news/meta-layoffs-us-judge-rejects-bid-to-halt-ai-discrimination-job-cuts-11784445113506.html,2026-07-19 14:43:08 IST,"A US judge has ruled that Meta can proceed with layoffs impacting 8,000 employees, despite disputes over AI usage in selecting job cuts.&amp;nbsp;",https://www.livemint.com/rss/companies
"Late-night Argentina-Spain Fifa final fuels business for bars, hotels and delivery apps",https://www.livemint.com/companies/news/latenight-argentina-spain-fifa-final-fuels-business-for-bars-hotels-food-delivery-apps-hospitality-11784385028826.html,2026-07-19 14:32:42 IST,"Extended bar timings, packed screenings and a surge in food delivery orders are turning the Fifa World Cup final into an unexpected late-night revenue opportunity for India's hospitality industry.",https://www.livemint.com/rss/companies
Jio says Arpu is not under pressure. Analysts aren't so sure,https://www.livemint.com/companies/news/jio-arpu-growth-under-pressure-telecom-tariff-hikes-digital-services-analysts-11784447411715.html,2026-07-19 14:07:54 IST,"Jio says organic Arpu growth is still running at 4-5% without tariff hikes. But analysts warn the easy gains may be over, forcing telcos to look beyond connectivity for growth.",https://www.livemint.com/rss/companies
Can builder's loose papers lead to an income tax notice? ITAT explains the law,https://www.livemint.com/money/personal-finance/can-builders-loose-papers-lead-to-an-income-tax-notice-itat-explains-the-law-11784455378682.html,2026-07-19 15:44:12 IST,A Mumbai ITAT ruling has held that the Income Tax Department cannot tax a property buyer merely because their name appears in a builder's seized cash records. The Revenue must prove an undisclosed cash payment with independent corroborative evidence before invoking Section 69A.,https://www.livemint.com/rss/money
ITR filing 2026: When should a salaried taxpayer file ITR-2 instead of ITR-1?,https://www.livemint.com/money/personal-finance/itr-filing-2026-when-should-a-salaried-taxpayer-file-itr-2-instead-of-itr1-11784452296069.html,2026-07-19 15:43:14 IST,Taxpayers must file accurate income tax returns using the correct ITR form to avoid being flagged for defects. The e-filing portal aids in selection. Here's when a salaried taxpayer needs to file ITR-2 instead of ITR-1.&amp;nbsp;,https://www.livemint.com/rss/money
AMFI's Mutual Funds Sahi Hai shares a list of dos and don'ts for investors to avoid online frauds,https://www.livemint.com/money/personal-finance/amfis-mutual-funds-sahi-hai-shares-a-list-of-dos-and-donts-for-investors-to-avoid-online-frauds-11784452457577.html,2026-07-19 15:41:35 IST,"AMFI’s investor education initiative “Mutual Funds Sahi Hai” advised investors not to share sensitive information such as OTPs, passwords, and investment details with unauthorised distributors.",https://www.livemint.com/rss/money
"Average active small-cap fund delivered 20.1% CAGR, with 16 percentage points lower drawdown than the benchmark",https://www.livemint.com/money/personal-finance/average-active-small-cap-fund-delivered-20-1-cagr-with-16-percentage-points-lower-drawdown-than-the-benchmark-11784447078444.html,2026-07-19 14:39:53 IST,"On average, active equity mutual funds have generated higher annualised returns while limiting losses better than their benchmark indices. An average active small-cap fund posted the strongest outperformance among the funds have been live since 2013.",https://www.livemint.com/rss/money
"‘Adulting looks cheaper, but…’: Pune woman shares monthly expense of family of 3: From  ₹31,000 rent to  ₹16,000 for nanny",https://www.livemint.com/money/personal-finance/adulting-looks-cheaper-but-pune-woman-shares-monthly-expense-of-family-of-3-from-31-000-rent-to-16-000-for-nanny-11784445583947.html,2026-07-19 13:45:09 IST,"A Pune woman shared monthly expenses of family of 3 living in Baner with two earning members. From  ₹31,000 rent to  ₹16,000 for nanny, let's have a look at the full list of expenditures.",https://www.livemint.com/rss/money
