title,link,published,summary,source
"Sensex plunges over 800 points, Nifty 50 nears 24,350: Key factors behind stock market crash explained",https://www.livemint.com/market/stock-market-news/sensex-plunges-over-800-points-nifty-50-nears-24-350-key-factors-behind-stock-market-crash-explained-11776833973422.html,2026-04-22 10:39:16 IST,"The Sensex crashed more than 800 points, or 1%, to an intraday low of 78,442, while the NSE barometer Nifty 50 plunged over 200 points, or nearly 1%, to the day's low of 24,353.",https://www.livemint.com/rss/markets
"Gold and silver price today, 22 April: Check live rates of 24K, 22K gold and 999 silver in Delhi, Mumbai, other cities",https://www.livemint.com/market/commodities/gold-and-silver-price-today-22-april-check-live-rates-of-24k-22k-gold-and-999-silver-in-delhi-mumbai-other-cities-11776831069385.html,2026-04-22 10:29:36 IST,"&amp;nbsp;Gold gained nearly 1% on April 22, while silver prices also surged due to demand and currency shifts. Current gold and silver prices vary across major Indian cities. Here's the full list of live rates.",https://www.livemint.com/rss/markets
"TARIL share price tanks 12% after Q4 results 2026, announces dividend of  ₹0.25 per share",https://www.livemint.com/market/stock-market-news/multibagger-small-cap-stock-taril-share-price-tanks-12-after-q4-results-2026-announces-dividend-of-rs-0-25-per-share-11776833367312.html,2026-04-22 10:27:13 IST,"TARIL's Q4 FY26 results show a 12% drop in share price despite a 9.06% QoQ net profit increase to  ₹77.47 crore. Revenue rose 6.83% QoQ to  ₹752.33 crore, but total expenses also increased, impacting profitability. The company announced a 25% dividend, pending approval.",https://www.livemint.com/rss/markets
"Warren Buffett on economists: ‘They don’t make money buying or selling stocks, but still traders listen to them’",https://www.livemint.com/market/stock-market-news/warren-buffett-on-economists-they-don-t-make-money-buying-or-selling-stocks-but-still-traders-listen-to-them-11776832755477.html,2026-04-22 10:26:43 IST,"Throughout his career, Warren Buffett and Charlie Munger have largely ignored macroeconomic variables. Instead, their approach has remained firmly rooted in business fundamentals: understanding what a company is worth and comparing it to its current market price.",https://www.livemint.com/rss/markets
"Persistent Systems shares crash 5% after Q4 results; should you buy, sell, or hold?",https://www.livemint.com/market/stock-market-news/persistent-systems-shares-crash-5-after-q4-results-should-you-buy-sell-or-hold-11776832103984.html,2026-04-22 10:04:40 IST,"Persistent Systems' share price crashed almost 5% in intraday trade on Wednesday, 22 April, a day after the company announced its March quarter (Q4FY26) results.",https://www.livemint.com/rss/markets
"Bank of Maharashtra shares extend Q4 results rally for the second straight session, rises 15% in two days",https://www.livemint.com/market/stock-market-news/bank-of-maharashtra-shares-extend-q4-results-rally-for-the-second-straight-session-rises-15-in-two-days-11776830961634.html,2026-04-22 09:51:18 IST,"Bank of Maharashtra shares rose 15% over two days following a strong Q4 report, with net profit up 35% to  ₹2,014 crore. Overall income increased to  ₹8,693 crore, driven by higher interest income and a significant rise in loans.",https://www.livemint.com/rss/markets
Sunteck Realty share price jumps over 12% after Q4 results,https://www.livemint.com/market/stock-market-news/sunteck-realty-share-price-jumps-over-12-after-q4-results-11776831020114.html,2026-04-22 09:47:22 IST,"Sunteck Realty share price has gained over 23% in one month, but has declined more than 11% on a year-to-date (YTD) basis. The real estate stock has fallen 5% in one year, but has rallied 36% over the past five years.",https://www.livemint.com/rss/markets
Ola Electric Mobility share price rallies 65% this month. Is the worst behind?,https://www.livemint.com/market/stock-market-news/ola-electric-mobility-share-price-rallies-65-this-month-is-the-worst-behind-11776830554853.html,2026-04-22 09:40:30 IST,Ola Electric Mobility shares have rallied from  ₹22.80 to  ₹38.10 per share in April 2026,https://www.livemint.com/rss/markets
"HCL Tech, Infosys to TCS: IT stocks crash up to 10% today — What's behind the massive selloff?",https://www.livemint.com/market/stock-market-news/nifty-it-index-it-stocks-crash-up-to-9-as-hcl-tech-q4-results-disappoint-should-you-steer-clear-of-the-sector-11776830614367.html,2026-04-22 09:38:41 IST,"Shares of leading IT stocks witnessed a massive decline in the early morning trade on Wednesday, 22 April, after leading tech firm HCL Technologies' March quarter results and poor management commentary sparked a fresh selloff in the sector.",https://www.livemint.com/rss/markets
"HCL Tech share price crashes 9% after Q4 results. Should you buy, sell or hold?",https://www.livemint.com/market/stock-market-news/hcl-tech-share-price-crashes-8-after-q4-results-should-you-buy-sell-or-hold-11776829741985.html,2026-04-22 09:21:52 IST,"HCL Tech share price opened at  ₹1,345 today, as compared to previous close of  ₹1,441 per share on Tuesday. Here's Q4 results highlights, along with expert's take on should you buy or sell the stock.",https://www.livemint.com/rss/markets
Silver price in India jumps 2% after 2-day slide as crude oil cools and dollar slips as US extends Iran ceasefire,https://www.livemint.com/market/commodities/silver-price-today-in-india-jumps-2-after-2-day-slide-as-crude-oil-cools-and-dollar-slips-as-us-extends-iran-ceasefire-11776827976825.html,2026-04-22 09:08:06 IST,"Silver prices in India rose 2% to  ₹2,49,423 per kg amid easing oil prices and a weaker dollar, following U.S. President Trump's Iran ceasefire extension. Global spot silver increased 1.5%, tracking gains in gold, though geopolitical tensions and oil supply concerns persist.",https://www.livemint.com/rss/markets
"Gold price today: Rate jumps 1% on MCX as dollar, crude oil prices decline after US extends ceasefire with Iran",https://www.livemint.com/market/commodities/gold-price-today-rate-jumps-1-on-mcx-as-dollar-crude-oil-prices-decline-after-us-extends-ceasefire-with-iran-11776828455237.html,2026-04-22 09:07:24 IST,"Gold price today: MCX gold June futures rose by more than  ₹2,000, or 1.3%, to  ₹1,53,699 per 10 grams, while MCX silver May futures jumped by more than  ₹4,700, or nearly 2%, to  ₹2,49,423 per kg in early trade.",https://www.livemint.com/rss/markets
Rupee opens 21 paise lower at 93.71 against US dollar,https://www.livemint.com/market/stock-market-news/rupee-opens-21-paise-lower-at-93-71-against-us-dollar-11776828740525.html,2026-04-22 09:04:03 IST,"The rupee opened lower at 93.71 against the US dollar as oil prices rose. Trump's indefinite ceasefire with Iran did not boost the currency, which may struggle to recover due to high Brent crude prices, while the Reserve Bank of India is expected to intervene.",https://www.livemint.com/rss/markets
"Stock market today: Gift Nifty hints gap-down start; US-Iran, India VIX to gold, silver rates — 8 stocks to buy or sell",https://www.livemint.com/market/stock-market-news/stock-market-today-gift-nifty-live-hints-gap-down-start-us-iran-news-india-vix-gold-silver-rates-stocks-to-buy-or-sell-11776823069510.html,2026-04-22 08:54:22 IST,"Stock market today: Experts recommend eight stocks to buy today — Fortis Healthcare, SBI, Bank of India, KFin Technologies, Indus Towers, Bombay Dyeing, Dabur India, and Honasa Consumer",https://www.livemint.com/rss/markets
"Q4 results 2026: Tech Mahindra, Trent, SBI Life among companies to declare earnings today; check full list here",https://www.livemint.com/market/stock-market-news/q4-results-2026-tech-mahindra-trent-sbi-life-among-companies-to-declare-earnings-today-check-full-list-here-11776825910802.html,2026-04-22 08:39:43 IST,"Around 17 companies are scheduled to release their financial results for the quarter ending on March 31, 2026 on Wednesday, 22 April. Checkout the full list along with Q4 previews.",https://www.livemint.com/rss/markets
TCS to ITC- Jay Thakkar suggests 3 stocks to buy or sell for short-term in F&amp;O segment,https://www.livemint.com/market/stock-market-news/tcs-to-itc-jay-thakkar-suggests-3-stocks-to-buy-or-sell-for-short-term-in-f-o-segment-11776824406881.html,2026-04-22 08:27:39 IST,"The Indian stock market shows a negative start with Gift Nifty trading at 24,445. Despite a positive close on April 21, analysts highlight short covering and support levels at 24,500, with potential targets up to 25,200. Recommendations include buying futures for Bank of India, TCS, and ITC.",https://www.livemint.com/rss/markets
"China Property Tipping Point Will Drive Up Stocks, JPMorgan Says",https://www.livemint.com/market/china-property-tipping-point-will-drive-up-stocks-jpmorgan-says-11776826577171.html,2026-04-22 08:26:16 IST,"China’s beaten-down property market is likely at a turning point that will help the nation’s stocks outperform their emerging-market peers, according to JPMorgan Chase &amp; Co.",https://www.livemint.com/rss/markets
China’s ‘National Team’ Cut ETF Stakes Below 20% Disclosure Mark,https://www.livemint.com/market/chinas-national-team-cut-etf-stakes-below-20-disclosure-mark-11776826148050.html,2026-04-22 08:19:07 IST,"China’s “national team” has stepped back from its dominant role in the country’s biggest stock ETFs, pointing to efforts to rein in an overheated rally earlier this year.",https://www.livemint.com/rss/markets
"Stocks to watch: Tech Mahindra, HCL Tech, Trent, BEML among 10 shares in focus today",https://www.livemint.com/market/stock-market-news/stocks-to-watch-tech-mahindra-hcl-tech-trent-beml-among-10-shares-in-focus-today-11776820511180.html,2026-04-22 08:01:04 IST,"Stock market today: Looking at the Gift Nifty trends, the Indian stock market is likely to snap its gaining streak on Wednesday, as the index signals a negative opening. Amid this backdrop, these stocks will remain in focus on Wednesday, April 22.",https://www.livemint.com/rss/markets
"Sensex, Nifty 50 | Stock Market LIVE Updates: Sensex down 600 pts, Nifty below 24,500; HCL Tech tanks over 9%",https://www.livemint.com/market/stock-market-news/stock-market-sensex-nifty-50-live-updates-gift-nifty-us-iran-ceasefire-crude-oil-prices-gold-rate-today-22-april-2026-11776824326072.html,2026-04-22 07:54:20 IST,"Sensex, Nifty 50 | Stock Market LIVE Updates: Globally, Asian markets traded mixed. Sensex tanks 831 points or 1% to its day's low of 78,442.30, while Nifty 50 lost 224 points or 0.9% to its intra-day low of 24,352.90.",https://www.livemint.com/rss/markets
"Raja Venkatraman, MarketSmith recommend five stocks for 22 April",https://www.livemint.com/market/stock-market-news/raja-venkatraman-marketsmith-recommend-five-stocks-for-22-april-11776822640205.html,2026-04-22 07:46:24 IST,"On April 21, Indian equity markets rebounded, with the Nifty 50 rising 0.87% and Sensex up 0.96%. Investors focused on global indicators, particularly the US-Iran talks. Analysts recommend buying Adani Ports, Gujarat Ambuja Exports, AU Small Finance Bank, Delhivery, and Cupid for potential gains.",https://www.livemint.com/rss/markets
"Gold, silver rates today: Gold prices rise 1%, silver near $78 after US-Iran ceasefire extended",https://www.livemint.com/market/commodities/gold-silver-rates-today-gold-prices-rise-1-silver-near-78-after-us-iran-ceasefire-extended-what-lies-next-11776821580473.html,2026-04-22 07:41:02 IST,"Gold, silver rates today: Gold and silver prices rebounded by 1.8% on Wednesday. Here's what driving bullion today, along with expert's take on near-term outlook.",https://www.livemint.com/rss/markets
"Meta to track keystrokes, mouse movements for AI training; employees push back",https://www.livemint.com/companies/news/meta-to-track-keystrokes-mouse-movements-for-ai-training-employees-push-back-11776826991953.html,2026-04-22 09:36:07 IST,"Meta is implementing software to track its US employees' keystrokes and mouse movements for AI training, causing internal backlash. Details here.&amp;nbsp;",https://www.livemint.com/rss/companies
"RBI updates e-mandate norms: No OTP needed for recurring payments up to  ₹15,000 — here's what it means for users",https://www.livemint.com/money/personal-finance/rbi-updates-e-mandate-norms-no-otp-needed-for-recurring-payments-up-to-15-000-heres-what-it-means-for-users-11776822756977.html,2026-04-22 08:18:03 IST,"RBI on Tuesday issued a consolidated digital payments e-mandate framework, setting a threshold of  ₹15,000 per transaction for recurring payments without requiring an OTP. The framework includes provisions for cross-border payments and mandates pre-debit alerts, among other measures. Details here.",https://www.livemint.com/rss/money
Gold in 2026: How much should you hold in your portfolio and is now the right time to invest?,https://www.livemint.com/money/personal-finance/gold-in-2026-how-much-should-you-hold-in-your-portfolio-and-is-now-the-right-time-to-invest-11776734911557.html,2026-04-22 08:07:24 IST,"Gold is increasingly viewed as a hedge amid global uncertainty. Investors face questions about whether to invest, how much to hold, and which options to choose, including &amp;nbsp;Gold ETFs, physical gold, and digital gold.",https://www.livemint.com/rss/money
"TARIL shares crash 11% after Q4 results, dividend announcement: What’s spooking investors?",https://economictimes.indiatimes.com/markets/stocks/news/taril-shares-crash-11-after-q4-results-dividend-announcement-whats-spooking-investors/articleshow/130434486.cms,2026-04-22 12:26:28 IST,"Shares of Transformers and Rectifiers (India) slumped over 11% on Wednesday after Q4 results showed a dip in consolidated net profit despite strong revenue growth and a large order book. Margin pressures and rising expenses appear to have spooked investors, even as the company announced a dividend and outlined fresh capex plans.",https://economictimes.indiatimes.com/markets/stocks/rssfeeds/2146843.cms
"Rs 92,000 crore ripple effect! HCL Tech’s weak Q4 drags IT pack; Infosys, Tech Mahindra slump up to 6%",https://economictimes.indiatimes.com/markets/stocks/news/rs-92000-crore-ripple-effect-hcl-techs-weak-q4-drags-it-pack-infosys-tech-mahindra-slump-up-to-6/articleshow/130434073.cms,2026-04-22 12:05:56 IST,"HCL Technologies’s weak Q4 triggered a ₹92,000 crore sell-off in IT stocks, dragging peers like Infosys and Tech Mahindra down up to 6% amid sector-wide concerns.",https://economictimes.indiatimes.com/markets/stocks/rssfeeds/2146843.cms
"Morgan Stanley reiterates ‘Overweight’ rating on TCS, sees 10% upside potential",https://economictimes.indiatimes.com/markets/stocks/news/morgan-stanley-reiterates-overweight-rating-on-tcs-sees-10-upside-potential/articleshow/130432991.cms,2026-04-22 11:31:20 IST,"Tata Consultancy Services is gaining attention after Morgan Stanley reiterated an “Overweight” rating with a ₹2,880 target, implying ~10% upside. Despite short-term pressure on the stock, the brokerage expects a recovery in growth and potential valuation re-rating, signalling a possible turnaround.",https://economictimes.indiatimes.com/markets/stocks/rssfeeds/2146843.cms
"HCL Tech shares wipe out Rs 38,000 crore as target price falls to Rs 1,165. Why every second broker is busy downgrading",https://economictimes.indiatimes.com/markets/stocks/news/hcl-tech-shares-wipe-out-rs-38000-crore-as-target-price-falls-to-rs-1165-why-every-second-broker-is-busy-downgrading/articleshow/130432873.cms,2026-04-22 11:02:04 IST,"HCL Technologies share price plummeted nearly 10%, wiping out Rs 38,000 crore in market cap following a brutal Q4 earnings report. The IT major missed revenue, margin, and guidance targets, triggering widespread broker downgrades and price target cuts. Analysts are scrambling to reprice the stock amid concerns over client-specific headwinds and AI-driven deflation.",https://economictimes.indiatimes.com/markets/stocks/rssfeeds/2146843.cms
"Vodafone Idea, JP Power, Groww, Rolex Rings among the most traded stocks today, 22 April 2026",https://www.livemint.com/market/stock-market-news/vodafone-idea-jp-power-groww-rolex-rings-among-the-most-traded-stocks-today-22-april-2026-11776837312806.html,2026-04-22 12:32:38 IST,"Most traded stocks today: Vodafone Idea, Jaiprakash Power Ventures (JP Power), Billionbrains Garage Ventures (Groww), Suzlon Energy, Rolex Rings, and Adani Power were among the most traded stocks on the NSE on Wednesday.",https://www.livemint.com/rss/markets
"FPI Exodus: Financial sector sees over  ₹19,000 crore outflows in April; IT, FMCG, Auto also hit",https://www.livemint.com/market/stock-market-news/fpi-exodus-financial-sector-sees-over-rs-19-000-crore-outflows-in-april-it-fmcg-auto-also-hit-11776835854334.html,2026-04-22 11:59:51 IST,"FPIs have sold Indian equities worth  ₹48,141 crore in early April 2026, with financial services hit hardest. The ongoing West Asian conflict influences global equity markets, creating volatility in FPI flows, while select sectors like power experience slight inflows amidst broader downturns.",https://www.livemint.com/rss/markets
Crude oil prices remain unchanged after 9% gains in last two sessions. What's the near-term outlook?,https://www.livemint.com/market/commodities/crude-oil-prices-remain-unchanged-after-9-gains-in-last-two-sessions-whats-the-near-term-outlook-11776834193447.html,2026-04-22 11:58:01 IST,"Oil prices were mostly unchanged on Wednesday, after an initial rise of around $1 in early Asian trading. Here's what experts say on oil prices' near-term outlook.",https://www.livemint.com/rss/markets
"Vedanta Demerger Explained: From listing timeline, price discovery to passive flows - all you need to know",https://www.livemint.com/market/stock-market-news/vedanta-demerger-explained-from-listing-timeline-price-discovery-to-passive-flows-all-you-need-to-know-11776837992186.html,2026-04-22 11:56:45 IST,"Vedanta demerger record date is May 1, 2026. The company’s board of directors have fixed May 1 as the demerger effective date and the demerger record date for determining the shareholders eligible to receive shares in the newly carved-out businesses.",https://www.livemint.com/rss/markets
Nestle India share price jumps 3% to hit record high post strong Q4 results FY26: What brokerages have to say,https://www.livemint.com/market/stock-market-news/nestle-india-share-price-jumps-3-to-hit-record-high-post-strong-q4-results-fy26-what-brokerages-have-to-say-11776837323714.html,2026-04-22 11:41:56 IST,"Nestlé India achieved a 23% YoY revenue increase and maintained EBITDA margins at 26.3%. While Elara Capital raised its target price, analysts show mixed views on the stock's valuation. The company continues to focus on strong fundamentals and execution amidst a challenging commodity landscape.",https://www.livemint.com/rss/markets
"Trent shares jump 7% this week: Should you buy this Tata group stock ahead of bonus, dividend and Q4 results?",https://www.livemint.com/market/stock-market-news/trent-shares-jump-7-this-week-should-you-buy-this-tata-group-stock-ahead-of-bonus-dividend-and-q4-results-2026-11776834300868.html,2026-04-22 11:08:38 IST,"Trent shares dipped marginally today, 22 April, amid a broader market weakness and as investors booked gains following a five-day rise. In this week alone, the Tata group stock has risen 7% ahead of bonus issue and dividend announcement.",https://www.livemint.com/rss/markets
The ten commandments from a Wall Street legend every Indian investor needs to know,https://www.livemint.com/market/stock-market-news/ten-commandments-from-a-wall-street-legend-bob-farrell-every-indian-investor-needs-to-know-11776834417993.html,2026-04-22 11:07:30 IST,"Bob Farrell’s ten rules offer insights into market behaviour, illustrating how human emotions like greed and fear shape cycles. For Indian investors, recognizing these patterns is crucial in avoiding extremes and fostering long-term investment success despite market unpredictability.",https://www.livemint.com/rss/markets
"HCLTech stock plunges on weak guidance, AI-led growth concerns",https://www.livemint.com/companies/company-results/hcltech-stock-plunges-on-weak-guidance-ai-led-growth-concerns-11776838458110.html,2026-04-22 12:26:39 IST,"Missed targets, a softer outlook and early AI-led pricing pressure sent HCL Tech shares lower on Wednesday, echoing post-earnings declines at TCS and Wipro.",https://www.livemint.com/rss/companies
Akasa taps Hajj travel to offset other West Asia route cuts,https://www.livemint.com/companies/akasa-air-hajj-travel-west-asia-route-cuts-mecca-in-saudi-arabia-pilgrims-jeddah-11776829904493.html,2026-04-22 12:20:23 IST,"Hajj 2026 travel to Mecca in Saudi Arabia begins in April, with the first flights carrying pilgrims having landed in Jeddah on 18 April. This marks the start of the arrival window, which will continue until May 21, ahead of the main rituals set for May 25-29.",https://www.livemint.com/rss/companies
M2P Fintech brings in CFO Vivek Seshadri as IPO groundwork begins,https://www.livemint.com/companies/start-ups/m2p-fintech-vivek-seshadri-madhusudanan-r-ipo-plans-fintech-ipo-banking-as-a-service-international-expansion-heli-11776828256532.html,2026-04-22 11:10:27 IST,"The company was last valued at over $750 million in 2024 after raising nearly $100 million from Helios. In total, it has secured more than $200 million from investors including Tiger Global, Better Capital and MUFG Innovation Partners, the venture arm of Mitsubishi UFJ Financial Group.",https://www.livemint.com/rss/companies
"Hajj can cost up to  ₹10 lakh, Umrah starts at  ₹1.5 lakh: What drives the huge price difference in Mecca pilgrimages?",https://www.livemint.com/money/personal-finance/hajj-can-cost-up-to-rs-10-lakh-umrah-starts-at-rs-1-5-lakh-what-drives-the-huge-price-difference-in-mecca-pilgrimages-11776837475110.html,2026-04-22 12:40:50 IST,"Cost is a key factor for pilgrims deciding between Hajj and Umrah. Hajj is a mandatory religious duty and significantly more expensive than Umrah, which is a recommended practice and more flexible in scheduling and pricing.",https://www.livemint.com/rss/money
"ITR filing 2026: Can super senior citizens avoid filing income tax? Exemptions, conditions and rules explained",https://www.livemint.com/money/personal-finance/itr-filing-2026-can-super-senior-citizens-avoid-filing-income-tax-exemptions-conditions-and-rules-explained-11776834730426.html,2026-04-22 12:07:00 IST,Super senior citizens may not need to file income tax returns if they meet conditions under Section 194P. Complete exemption applies to those 75+ with only a pension and interest income from a specified bank. Details here.&amp;nbsp;,https://www.livemint.com/rss/money
FD or MF: Where should you park your emergency fund? Best options for high and low tax bracket,https://www.livemint.com/money/personal-finance/fd-or-mf-where-should-you-park-your-emergency-fund-best-options-for-high-and-low-tax-bracket-11776826261646.html,2026-04-22 11:57:58 IST,"Fixed deposits are recommended for immediate needs, while mutual funds may be better for slightly delayed emergencies",https://www.livemint.com/rss/money
"Flexi Cap mutual funds explained: Key differences and returns of HDFC, ICICI, Parag Parikh &amp; Mirae Asset",https://www.livemint.com/money/personal-finance/flexi-cap-mutual-funds-explained-with-key-differences-between-hdfc-icici-parag-parikh-mirae-asset-including-ret-11776833944141.html,2026-04-22 11:19:49 IST,"Flexi cap mutual funds gain traction amid volatile markets, offering dynamic allocation across stocks. Compare HDFC, ICICI, Parag Parikh and Mirae Asset strategies, risks and returns before investing.",https://www.livemint.com/rss/money
Tech Mahindra declares Rs 36/share final dividend; sets July 3 as record date,https://economictimes.indiatimes.com/markets/stocks/news/tech-mahindra-declares-rs36/share-final-dividend-along-with-q4-results-sets-july-3-as-record-date/articleshow/130436189.cms,2026-04-22 14:04:04 IST,"Tech Mahindra's board has proposed a final dividend of Rs 36 per share for FY26, bringing the total payout to Rs 51. This comes as the IT giant reported a strong March quarter with net profit up 16% year-on-year. Shareholders will vote on the dividend at the upcoming AGM, with July 3 set as the record date.",https://economictimes.indiatimes.com/markets/stocks/rssfeeds/2146843.cms
Pahalgam anniversary: How the 2025 terror attack triggered Rs 3 lakh crore defence boom and created 3 multibagger stocks,https://economictimes.indiatimes.com/markets/stocks/news/pahalgam-anniversary-how-the-2025-terror-attack-triggered-rs-3-lakh-crore-defence-boom-and-3-multibagger-stocks/articleshow/130435117.cms,2026-04-22 13:03:14 IST,"One year after the Pahalgam terror attack, India’s defence sector has entered a major upcycle, adding Rs 2.9 lakh crore in market cap as the Nifty India Defence Index gained 37%. Stocks like MTAR Technologies, Apollo Micro Systems, and Data Patterns turned multibaggers, supported by record FY26 procurement approvals worth Rs 9.3 lakh crore.",https://economictimes.indiatimes.com/markets/stocks/rssfeeds/2146843.cms
