title,link,published,summary,source
"Titan shares crash 6% after Q4 results. What are Goldman Sachs, Morgan Stanley, Bernstein, other brokerages saying?",https://economictimes.indiatimes.com/markets/stocks/news/titan-shares-crash-6-after-q4-results-what-are-goldman-sachs-morgan-stanley-bernstein-other-brokerages-saying/articleshow/131002634.cms,2026-05-11 09:34:10 IST,"Titan Company shares fell despite reporting a 35% net profit growth in Q4FY26. While the jewellery business saw exceptional 50% growth, international business losses impacted overall earnings. Analysts remain largely positive, with multiple brokerages maintaining 'Buy' or 'Overweight' ratings and raising price targets, citing strong jewellery outlook and long-term growth prospects.",https://economictimes.indiatimes.com/markets/stocks/rssfeeds/2146843.cms
"Buy, Sell or Hold: Elara Capital stays bullish on Titan Company, keeps ‘sell’ call on ABB India",https://economictimes.indiatimes.com/markets/stocks/news/buy-sell-or-hold-elara-capital-stays-bullish-on-titan-company-keeps-sell-call-on-abb-india/articleshow/131002694.cms,2026-05-11 09:07:47 IST,"Brokerages remain divided on large-cap stocks, with Elara Capital backing Titan Company on strong jewellery demand and revenue growth, while Bernstein stays positive on State Bank of India despite margin pressures, citing healthy loan growth and stable asset quality.",https://economictimes.indiatimes.com/markets/stocks/rssfeeds/2146843.cms
"Explained: Why Titan, Kalyan Jewellers, Senco Gold, other stocks tanked up to 9% on Monday",https://economictimes.indiatimes.com/markets/stocks/news/explained-why-titan-kalyan-jewellers-other-gold-stocks-will-be-in-focus-on-monday/articleshow/131002683.cms,2026-05-11 08:57:27 IST,"Jewellery stocks like Titan, Senco Gold, and Kalyan Jewellers saw significant drops of up to 9% following Prime Minister Modi's appeal to reduce gold purchases for weddings. This, combined with March quarter earnings, impacted the sector. Despite strong financial results from Titan and Kalyan Jewellers, the market reacted negatively to the government's conservation efforts.",https://economictimes.indiatimes.com/markets/stocks/rssfeeds/2146843.cms
Urban Company shares tank 9% after Q4 net loss swells to Rs 161 crore despite a sharp revenue uptick,https://economictimes.indiatimes.com/markets/stocks/news/urban-company-shares-in-focus-after-q4-net-loss-swells-to-rs-161-crore-despite-a-sharp-revenue-uptick/articleshow/131002361.cms,2026-05-11 08:32:26 IST,"Urban Company shares dropped nearly 9% after the company reported a significant surge in its March quarter net loss to Rs 161 crore, despite a strong 43% year-on-year revenue growth to Rs 426 crore. Net transacting value also saw a 42% increase, reaching its highest in 15 quarters.",https://economictimes.indiatimes.com/markets/stocks/rssfeeds/2146843.cms
"Vodafone Idea, YES Bank, Ola Electric, HFCL among the most traded stocks on NSE today, 11 May 2026",https://www.livemint.com/market/stock-market-news/vodafone-idea-yes-bank-ola-electric-hfcl-among-the-most-traded-stocks-on-nse-today-11-may-2026-11778478359612.html,2026-05-11 11:53:35 IST,"Most traded stocks today: Meanwhile, Vodafone Idea, YES Bank, HFCL, Ola Electric Mobility, GTL Infrastructure, Rain Industries, and PC Jeweller &amp;nbsp;were among the most traded stocks, or most active stocks in terms of volume, on the NSE.",https://www.livemint.com/rss/markets
Canara Bank Q4 Results 2026 LIVE: Canara Bank share price falls ahead of earnings today. Dividend in focus,https://www.livemint.com/market/stock-market-news/canara-bank-q4-results-2026-live-canara-bank-q4-earnings-canara-bank-share-price-psu-bank-canara-bank-profit-11-may-2026-11778479446436.html,2026-05-11 11:41:34 IST,"Canara Bank Q4 Results 2026 LIVE: Canara Bank is expected to report a decline in its earnings during the fourth quarter of FY26, weighed down by sluggish operating profitability.",https://www.livemint.com/rss/markets
"Vinay Rajani of HDFC Sec suggests NLC India, Apollo Hospitals shares to buy",https://www.livemint.com/market/stock-market-news/vinay-rajani-of-hdfc-sec-suggests-nlc-india-apollo-hospitals-shares-to-buy-11778478797116.html,2026-05-11 11:41:24 IST,"India's benchmark indices fell on May 11, with Nifty 50 down 1.04%. The rupee weakened amid rising oil prices. While large caps struggled, mid and small-cap stocks showed strong performance, signaling a potential shift in market dynamics.",https://www.livemint.com/rss/markets
PVR Inox Q4 Results 2026 LIVE: Will Dhurandhar 2's success power March quarter show? Here's what analysts say,https://www.livemint.com/market/stock-market-news/pvr-inox-q4-results-2026-live-pvr-inox-share-price-pvr-inox-q4-earnings-profit-dhurandhar-2-release-11-may-2026-11778475995268.html,2026-05-11 11:08:25 IST,PVR Inox Q4 Results 2026 LIVE: PVR Inox shares traded 2% lower ahead of the March quarter results announcement. The company's earnings are in focus especially in the light of Dhurandhar's box office success.,https://www.livemint.com/rss/markets
Copper Shrugs Off Middle East Uncertainty to Aim for Record High,https://www.livemint.com/market/copper-shrugs-off-middle-east-uncertainty-to-aim-for-record-high-11778477577852.html,2026-05-11 11:02:57 IST,Copper headed for its highest-ever close and other metals advanced as traders shrugged off the apparent deadlock between the US and Iran to join a broader rally for risk assets.,https://www.livemint.com/rss/markets
"Oil Market in ‘Race Against Time’ on Hormuz, Morgan Stanley Says",https://www.livemint.com/market/oil-market-in-race-against-time-on-hormuz-morgan-stanley-says-11778477201011.html,2026-05-11 10:56:40 IST,"The oil market is in “a race against time” as the factors that combined to restrain price rises from the Iran war so far may no longer hold if the Strait of Hormuz stays closed into June, according to Morgan Stanley.",https://www.livemint.com/rss/markets
"Nifty Bank crashes nearly 1,000 points, IT pack resilient amid stock market fall: What's behind this trend?",https://www.livemint.com/market/stock-market-news/nifty-bank-crashes-nearly-1-000-points-it-pack-resilient-amid-stock-market-fall-whats-behind-this-trend-11778476794561.html,2026-05-11 10:53:36 IST,"The flagship Nifty Bank index tumbled 1.70% in intraday deals today, as barring Bank of Baroda (BoB), all stocks faced intense selling pressure. State Bank of India (SBI) emerged as the biggest laggard as it extended its post-earnings decline.",https://www.livemint.com/rss/markets
Value 360 Communications share price hits 5% upper circuit after weak debut,https://www.livemint.com/market/stock-market-news/value-360-communications-share-price-hits-5-upper-circuit-after-weak-debut-11778475142997.html,2026-05-11 10:44:47 IST,"Value 360 Communications debuted on NSE SME at  ₹78.40, 20% below the issue price. The stock reached a high of  ₹82.30 after hitting an intraday low of  ₹74.50. The IPO was oversubscribed 1.20 times, driven mainly by institutional investors.",https://www.livemint.com/rss/markets
"JBM Auto, Ola Electric Mobility, and Ather Energy: Why these auto stocks rising after PM Modi’s speech?",https://www.livemint.com/market/stock-market-news/jbm-auto-ola-electric-mobility-and-ather-energy-why-these-auto-stocks-rising-after-pm-modi-s-speech-11778476316378.html,2026-05-11 10:44:10 IST,"JBM Auto share price jumped as much as 7.26%, Ola Electric shares surged 4.49%, Ather Energy stock price spiked 5.6%, while Olectra Greentech shares rallied 4.9%.",https://www.livemint.com/rss/markets
SpiceJet to IndiGo: Why are aviation stocks down up to 5% today? Explained,https://www.livemint.com/market/stock-market-news/spicejet-to-indigo-why-are-aviation-stocks-down-up-to-5-today-explained-11778475384424.html,2026-05-11 10:32:58 IST,"Aviation stocks like SpiceJet, Interglobe Aviation (IndiGo), GMR Airports share price fell up to 5% in Monday's trading session as crude oil prices and PM Modi's appeal to avoid international travel weighed on sentiments.",https://www.livemint.com/rss/markets
Vodafone Idea share price zooms over 4% despite stock market crash,https://www.livemint.com/market/stock-market-news/vodafone-idea-share-price-zooms-over-4-despite-stock-market-crash-11778474533105.html,2026-05-11 10:17:59 IST,"Vodafone Idea share price surged as much as 4.62% to  ₹11.77 apiece in Monday's trading session. Here's what's behind the rally, along with share price trend.",https://www.livemint.com/rss/markets
"Gold, silver prices today: Check retail rates of 24K, 22K gold, 999 silver on 11 May in Delhi, Mumbai and Kolkata",https://www.livemint.com/market/commodities/gold-silver-prices-today-check-retail-rates-of-24k-22k-gold-999-silver-on-11-may-in-delhi-mumbai-and-kolkata-11778470020449.html,2026-05-11 10:12:24 IST,"Gold price today remained steady across major Indian cities as 24K, 22K gold and silver rates showed limited movement amid rising geopolitical tensions and strong safe-haven demand.",https://www.livemint.com/rss/markets
"Ambani's Jio Platforms IPO pivots to pure fundraise, no offer for sale: Report",https://www.livemint.com/market/ipo/jio-ipo-update-ambanis-jio-platforms-ipo-pivots-to-pure-fundraise-no-investor-exits-sources-say-11778473348150.html,2026-05-11 09:55:14 IST,"Ambani's ​Jio Platforms, which houses the world's second-largest telecom company by users after China Mobile, counts Meta, Google and Vista Equity Partners among its investors.",https://www.livemint.com/rss/markets
Crude oil prices continue to rise amid US-Iran uncertainty. What's the near-term outlook?,https://www.livemint.com/market/commodities/crude-oil-prices-continue-to-rise-amid-us-iran-uncertainty-whats-the-near-term-outlook-11778470651890.html,2026-05-11 09:48:37 IST,"US-Iran war: MCX crude oil prices rose as much as 5.51% to  ₹9,471 per barrel on Monday, 11 May. Here's what's behind the rally, along with experts opnion on near-term outlook.",https://www.livemint.com/rss/markets
"Chalet Hotels, Lemon Tree to IHCL: Hotel stocks drop up to 3% on PM Modi's appeal",https://www.livemint.com/market/stock-market-news/chalet-hotels-lemon-tree-to-ihcl-hotel-stocks-drop-up-to-3-on-pm-modis-appeal-11778471850535.html,2026-05-11 09:32:27 IST,Shares of major hospitality companies fell over 2% on May 11 following Prime Minister Modi's call for a temporary pause on foreign travel. He urged citizens to focus on domestic tourism to support the local economy during the ongoing global crisis.,https://www.livemint.com/rss/markets
"Sensex crashes almost 1,200 points; investors lose  ₹5 lakh crore: Key factors behind stock market crash explained",https://www.livemint.com/market/stock-market-news/sensex-crashes-1-000-points-nifty-50-down-investors-lose-4-lakh-crore-factors-behind-stock-market-crash-explained-11778471532915.html,2026-05-11 09:31:13 IST,"Stock market crash: The Sensex crashed almost 1,200 points, or more than 1%, to an intraday low of 76,166, while the Nifty 50 plunged more than 1% to the day's low of 23,845.",https://www.livemint.com/rss/markets
"Titan, Kalyan, Senco, Sky Gold among other jewellery stocks crash up to 12% after PM Narendra Modi’s speech",https://www.livemint.com/market/stock-market-news/titan-kalyan-senco-sky-gold-among-other-jewellery-stocks-crash-up-to-12-after-pm-narendra-modi-s-speech-11778471479299.html,2026-05-11 09:23:36 IST,"Titan share price declined as much as 6.4%, Kalyan Jewellers shares dropped 8.3%, Sky Gold stock price plunged 12.2%, Senco Gold stock tanked 10.7%, PN Gadgil Jewellers shares slipped 7%, PC Jeweller shares fell 5% and Tribhovandas Bhimji Zaveri shares cracked 6.3%.",https://www.livemint.com/rss/markets
"Stock market today: Gift Nifty signals big gap-down opening; US-Iran war, oil, gold to silver — 7 stocks to buy or sell",https://www.livemint.com/market/stock-market-news/stock-market-today-gift-nifty-signals-big-gap-down-opening-us-iran-war-oil-gold-to-silver-7-stocks-to-buy-or-sell-11778465477105.html,2026-05-11 09:16:24 IST,"Stock market today: Experts recommend eight stocks to buy today —Carborundum Universal, UNO Minda, PNB, LIC, Lodha Developers, Bharat Wire, and M&amp;amp;M Financial Services",https://www.livemint.com/rss/markets
Rupee opens 40 paise lower at 94.88 against the US dollar,https://www.livemint.com/market/stock-market-news/rupee-opens-40-paise-lower-at-94-88-against-the-us-dollar-11778470566051.html,2026-05-11 09:07:32 IST,"The Indian rupee fell to 94.88 against the dollar as crude oil prices surged and U.S.-Iran tensions escalated. Experts note India's growing dollar dependence, despite healthy foreign reserves, affecting currency performance.",https://www.livemint.com/rss/markets
"Gold price falls on MCX as higher crude oil prices, stalled US–Iran peace talks fuel inflation worries",https://www.livemint.com/market/commodities/gold-rate-today-price-falls-on-mcx-as-higher-crude-oil-prices-stalled-us-iran-peace-talks-fuel-inflation-worries-11778470100994.html,2026-05-11 09:07:12 IST,"Higher crude oil prices and derailed US-Iran talks have fuelled inflation worries, strengthening the expectations of no rate cuts by the US Federal Reserve this year. Higher-for-longer interest rates are negative for non-yielding bullion.",https://www.livemint.com/rss/markets
Stocks to buy for short term: From CDSL to Patanjali Foods - Jigar Patel of Anand Rathi recommends 3 shares,https://www.livemint.com/market/stock-market-news/stocks-to-buy-for-short-term-from-cdsl-to-patanjali-foods-jigar-patel-of-anand-rathi-recommends-3-shares-11778468912391.html,2026-05-11 08:54:26 IST,Stocks to buy for short term: CDSL and Patanjali Foods are among the three shares Jigar Patel of Anand Rathi recommends buying for the next 1-2 weeks.,https://www.livemint.com/rss/markets
"JPMorgan Hikes Kospi Bull Case Target to 10,000 on Memory Boom",https://www.livemint.com/market/jpmorgan-hikes-kospi-bull-case-target-to-10-000-on-memory-boom-11778468490547.html,2026-05-11 08:31:30 IST,"JPMorgan Chase &amp; Co. raised its targets for South Korean stocks for the second time in less than a month, citing improvement in the semiconductor cycle, corporate governance reforms and industrial-sector growth.",https://www.livemint.com/rss/markets
Q4 results 2026: Canara Bank to Indian Hotels among companies to declare Q4 results today; full list here,https://www.livemint.com/market/stock-market-news/q4-results-2026-canara-bank-to-indian-hotels-among-companies-to-declare-q4-results-today-full-list-here-11778466174108.html,2026-05-11 08:30:22 IST,Q4 results 2026: More than 70 companies are scheduled to release their Q4 results next week. Here's preview and full list companies to declare earnings in the coming week.,https://www.livemint.com/rss/markets
"Stocks to buy or sell: Dharmesh Shah of ICICI Sec suggests buying Godrej Properties, Schaffler shares on 11 May",https://www.livemint.com/market/stock-market-news/stocks-to-buy-or-sell-dharmesh-shah-of-icici-sec-suggests-buying-godrej-properties-schaffler-shares-on-11-may-11778466909170.html,2026-05-11 08:23:33 IST,"Indian markets may open weak as GIFT Nifty shows a decline. The Sensex and Nifty 50 faced losses due to banking stocks, while mid and small-cap indices outperformed. Analysts remain optimistic about future performance, anticipating a challenge for Nifty 50 to reach 24,900.",https://www.livemint.com/rss/markets
"‘AI not likely to replace you, but…’: Jensen Huang assures fresh grads that this is the best time to start a career",https://www.livemint.com/companies/people/ai-not-likely-to-replace-you-but-jensen-huang-assures-fresh-grads-that-this-is-the-best-time-to-start-a-career-11778466025826.html,2026-05-11 09:40:58 IST,"Jensen Huang told the new grads that AI was closing the “technology divide,” allowing anyone to build something useful.",https://www.livemint.com/rss/companies
"OpenAI staff cashed out 6.6 billion dollars in one day, says report. How much richer did it make the employees?",https://www.livemint.com/money/openai-staff-cashed-out-6-6-billion-dollars-in-one-day-says-report-how-much-richer-did-it-make-the-employees-11778471158995.html,2026-05-11 09:29:03 IST,"More than 600 OpenAI employees sold a combined 6.6 billion dollars worth of stock in a single day in October 2025, averaging 11 million dollars each. Here is how artificial intelligence is creating unprecedented wealth for technology workers before a single IPO has taken place.",https://www.livemint.com/rss/money
Why Rahul Gandhi's investment advisor refused to become India's largest mutual fund distributor,https://economictimes.indiatimes.com/markets/stocks/news/why-rahul-gandhis-investment-advisor-refused-to-become-indias-largest-mutual-fund-distributor/articleshow/131009835.cms,2026-05-11 15:04:28 IST,"Chennai-based mutual fund distributor Muthukrishnan Dhandapani, who manages Rahul Gandhi’s investments, says he stopped taking new clients a decade ago—a choice that may have cost him a tenfold rise in income. He insists on keeping work strictly professional, never seeking favours, and values contentment over scaling his business.",https://economictimes.indiatimes.com/markets/stocks/rssfeeds/2146843.cms
ET Alpha Wealth Summit 2026: India’s top investment minds decode the next decade of wealth creation,https://economictimes.indiatimes.com/markets/stocks/news/et-alpha-wealth-summit-2026-indias-top-investment-minds-decode-the-next-decade-of-wealth-creation/articleshow/131008768.cms,2026-05-11 14:08:33 IST,"The ET Alpha Wealth Summit 2026, hosted by The Economic Times on 4th June in Mumbai, is an exclusive, closed-door event where India’s top investment leaders will decode the next decade of wealth creation. Focused on portfolio repositioning, India-global allocation, alpha generation, market cycles, and wealth continuity, it offers sharp insights and premium networking for serious HNIs and family offices in one high-impact day",https://economictimes.indiatimes.com/markets/stocks/rssfeeds/2146843.cms
Explained: What PM Modi’s comments on deferring gold purchases for 1 year mean for yellow metal investors?,https://economictimes.indiatimes.com/markets/stocks/news/explained-what-pm-modis-comments-on-deferring-gold-purchases-for-1-year-mean-for-yellow-metal-investors/articleshow/131008152.cms,2026-05-11 13:31:57 IST,"Prime Minister Narendra Modi urged Indians to avoid buying gold for the next year, a notable appeal in a country where the metal is deeply tied to savings and tradition. The move is seen as an attempt to ease pressure on India’s foreign exchange reserves, as rising gold imports increase demand for U.S. dollars amid growing global uncertainty.",https://economictimes.indiatimes.com/markets/stocks/rssfeeds/2146843.cms
5 stocks with consistent score improvement and upside potential of up to 27%,https://economictimes.indiatimes.com/markets/stocks/news/5-stocks-with-consistent-score-improvement-and-upside-potential-of-up-to-27/articleshow/131007687.cms,2026-05-11 13:15:07 IST,"The only certainty at this point of time is that the uncertainty quotient of the market will remain high, and that it will impact all asset classes. Our selected stocks for today depict a strong upward trajectory in their overall average score which is based on five key pillars: Earnings, fundamentals, relative valuation, risk, and price momentum. This implies that there has been a significant improvement in their market outlook in the given time frame.",https://economictimes.indiatimes.com/markets/stocks/rssfeeds/2146843.cms
Vodafone Idea shares jump 8% to 4-month high. What’s driving the rally amid stock market crash?,https://economictimes.indiatimes.com/markets/stocks/news/vodafone-idea-shares-jump-8-to-4-month-high-whats-driving-the-rally-amid-stock-market-crash/articleshow/131007561.cms,2026-05-11 13:05:16 IST,"Vodafone Idea shares surged over 8% to a four-month high after reports suggested parent Vodafone Group may transfer part of its stake to the telecom operator. The move could strengthen Vodafone Idea’s balance sheet, support fundraising efforts and improve its ability to manage government dues and future investments.",https://economictimes.indiatimes.com/markets/stocks/rssfeeds/2146843.cms
Election impact! 6 West Bengal-linked stocks that can benefit from new BJP government,https://economictimes.indiatimes.com/markets/stocks/news/election-impact-6-west-bengal-linked-stocks-that-can-benefit-from-new-bjp-government/articleshow/131007437.cms,2026-05-11 12:58:03 IST,"The BJP's decisive win in West Bengal signals a potential economic revival, with investors eyeing stocks poised to benefit from pro-growth policies. The new government's focus on industrial parks, infrastructure, and rural development could boost companies like CESC, ITC, Berger Paints, Texmaco Rail, Shyam Metalics, and Emami. This shift mirrors Andhra Pradesh's post-election rerating.",https://economictimes.indiatimes.com/markets/stocks/rssfeeds/2146843.cms
"Hyundai shares jump 5% despite 22% YoY fall in Q4 net profit to Rs 1,256 crore",https://economictimes.indiatimes.com/markets/stocks/news/hyundai-shares-jump-5-even-after-q4-net-profit-drops-22-heres-why-nomura-other-brokerages-remain-bullish/articleshow/131006756.cms,2026-05-11 12:24:54 IST,"Hyundai Motor India shares surged nearly 5% despite a 22% drop in Q4 FY26 net profit, as brokerages maintained 'Buy' ratings. The automaker's revenue grew over 5% in the quarter, and its board recommended a Rs 21 per share dividend. Analysts remain optimistic about future growth driven by new model launches and strong exports.",https://economictimes.indiatimes.com/markets/stocks/rssfeeds/2146843.cms
"Equity inflows fall 5% MoM to  ₹38,440 crore in April; SIP inflows steady at  ₹31,115 crore: AMFI data",https://www.livemint.com/market/stock-market-news/equity-inflows-fall-5-mom-to-rs-38-440-crore-in-april-sip-inflows-steady-at-rs-31-115-crore-amfi-data-11778495079850.html,2026-05-11 15:58:41 IST,"The equity inflows into mutual funds moderated by 5% on a month-on-month (MoM) basis to  ₹38,440.20 crore, showed the latest data released by the Association of Mutual Funds in India (AMFI) on Monday, 11 May, amid a significant slowdown in investments in sectoral and thematic schemes.",https://www.livemint.com/rss/markets
Should you buy gold ETF as PM Modi urges domestic investors to avoid buying physical gold?,https://www.livemint.com/market/commodities/should-you-buy-gold-etf-as-pm-modi-urges-domestic-investors-to-avoid-buying-physical-gold-11778487072034.html,2026-05-11 15:50:53 IST,"MCX gold futures for June 2026 delivery fell  ₹532, or 0.3%, to  ₹1,52,000 per 10 grams on Monday. Here's what experts say on Gold ETFs outlook.",https://www.livemint.com/rss/markets
"Top Gainers &amp; Losers on May 11: Swiggy, Tejas Networks, SBI, Tata Motors, Eternal, Anant Raj among top losers",https://www.livemint.com/market/stock-market-news/top-gainers-losers-on-may-11-swiggy-tejas-networks-sbi-tata-motors-eternal-anant-raj-among-top-losers-11778492063778.html,2026-05-11 15:41:23 IST,"On May 11, the Indian stock market experienced a sharp decline, with the Nifty and Sensex both recording significant drops. Investor sentiment soured due to rising crude oil prices and stalled U.S.-Iran negotiations.&amp;nbsp;",https://www.livemint.com/rss/markets
Do you know why companies opt for share buybacks?,https://www.livemint.com/market/stock-market-news/do-you-know-why-companies-opt-for-share-buybacks-11778476941095.html,2026-05-11 15:12:46 IST,"Share buybacks involve companies repurchasing their own shares, signalling confidence in undervalued stocks. They enhance earnings per share and can stabilise market sentiment, though investors should assess broader business fundamentals before making decisions.",https://www.livemint.com/rss/markets
"SBI shares sink another 4.5%, hit 4-month low as post-earnings selloff extends to second day",https://www.livemint.com/market/stock-market-news/sbi-shares-sink-another-4-5-hit-4-month-low-as-post-earnings-selloff-extends-to-second-day-11778490867106.html,2026-05-11 15:04:04 IST,"State Bank of India shares fell 4.5% to  ₹974, marking a second-day cumulative decline of 11%. The drop followed disappointing Q4 results, erasing  ₹1.11 lakh crore in market cap. Brokerages adjusted their earnings estimates but maintained 'buy' ratings with revised target prices.",https://www.livemint.com/rss/markets
Silver rate today: Is it the right time to buy as precious white metal rises after PM Modi's speech?,https://www.livemint.com/market/commodities/silver-rate-today-is-it-the-right-time-to-buy-as-precious-white-metal-slips-after-pm-modis-speech-11778482392403.html,2026-05-11 14:41:25 IST,"MCX silver futures for July 2026 delivery jumped  ₹3,000, or 1.1%, to  ₹2,64,922 per kg, continuing their upward momentum after the white metal had gained  ₹3,500 in the previous trading session.",https://www.livemint.com/rss/markets
PVR Inox Q4 Results: Firm posts net profit of  ₹186 crore against loss YoY; revenue jumps 26%,https://www.livemint.com/market/stock-market-news/pvr-inox-q4-results-firm-posts-net-profit-of-rs-186-crore-against-loss-yoy-revenue-jumps-26-11778488326214.html,2026-05-11 14:07:09 IST,"PVR Inox Q4 Results: PVR Inox reported a consolidated net profit of  ₹186.7 crore for Q4 FY26, recovering from a net loss of  ₹125 crore in Q4 FY25. Revenue increased 25.8% to  ₹1,547.3 crore, with EBITDA rising 56% to  ₹452 crore, driven by strong box office collections.",https://www.livemint.com/rss/markets
