title,link,published,summary,source
Nidhi Granites consolidated net profit rises 135.11% in the December 2025 quarter,https://www.business-standard.com/markets/capital-market-news/nidhi-granites-consolidated-net-profit-rises-135-11-in-the-december-2025-quarter-126021600275_1.html,2026-02-16 11:19:02 IST,Sales rise 15.96% to Rs 15.55 crore,https://www.business-standard.com/rss/markets-106.rss
Digjam standalone net profit declines 66.45% in the December 2025 quarter,https://www.business-standard.com/markets/capital-market-news/digjam-standalone-net-profit-declines-66-45-in-the-december-2025-quarter-126021600274_1.html,2026-02-16 11:18:55 IST,Sales rise 30.47% to Rs 6.98 crore,https://www.business-standard.com/rss/markets-106.rss
Magnum Ventures standalone net profit declines 96.89% in the December 2025 quarter,https://www.business-standard.com/markets/capital-market-news/magnum-ventures-standalone-net-profit-declines-96-89-in-the-december-2025-quarter-126021600273_1.html,2026-02-16 11:18:47 IST,Sales decline 1.24% to Rs 101.88 crore,https://www.business-standard.com/rss/markets-106.rss
Veer Energy & Infrastructure standalone net profit rises 414.29% in the December 2025 quarter,https://www.business-standard.com/markets/capital-market-news/veer-energy-infrastructure-standalone-net-profit-rises-414-29-in-the-december-2025-quarter-126021600272_1.html,2026-02-16 11:18:40 IST,Sales decline 77.97% to Rs 0.52 crore,https://www.business-standard.com/rss/markets-106.rss
Supra Pacific Financial Services standalone net profit rises 4080.00% in the December 2025 quarter,https://www.business-standard.com/markets/capital-market-news/supra-pacific-financial-services-standalone-net-profit-rises-4080-00-in-the-december-2025-quarter-126021600270_1.html,2026-02-16 11:18:31 IST,Sales rise 104.45% to Rs 24.33 crore,https://www.business-standard.com/rss/markets-106.rss
Fourth Generation Information Systems reports standalone net loss of Rs 0.18 crore in the December 2025 quarter,https://www.business-standard.com/markets/capital-market-news/fourth-generation-information-systems-reports-standalone-net-loss-of-rs-0-18-crore-in-the-december-2025-quarter-126021600269_1.html,2026-02-16 11:18:23 IST,Reported sales  nil,https://www.business-standard.com/rss/markets-106.rss
Velox Shipping and Logistics standalone net profit rises 271.43% in the December 2025 quarter,https://www.business-standard.com/markets/capital-market-news/velox-shipping-and-logistics-standalone-net-profit-rises-271-43-in-the-december-2025-quarter-126021600268_1.html,2026-02-16 11:18:17 IST,Reported sales  nil,https://www.business-standard.com/rss/markets-106.rss
Duke Offshore reports standalone net profit of Rs 0.89 crore in the December 2025 quarter,https://www.business-standard.com/markets/capital-market-news/duke-offshore-reports-standalone-net-profit-of-rs-0-89-crore-in-the-december-2025-quarter-126021600267_1.html,2026-02-16 11:18:10 IST,Reported sales  nil,https://www.business-standard.com/rss/markets-106.rss
Singer India standalone net profit rises 256.95% in the December 2025 quarter,https://www.business-standard.com/markets/capital-market-news/singer-india-standalone-net-profit-rises-256-95-in-the-december-2025-quarter-126021600266_1.html,2026-02-16 11:18:04 IST,Sales rise 52.54% to Rs 161.01 crore,https://www.business-standard.com/rss/markets-106.rss
Covance Softsol consolidated net profit rises 1241.49% in the December 2025 quarter,https://www.business-standard.com/markets/capital-market-news/covance-softsol-consolidated-net-profit-rises-1241-49-in-the-december-2025-quarter-126021600265_1.html,2026-02-16 11:17:56 IST,Sales rise 8.01% to Rs 36.83 crore,https://www.business-standard.com/rss/markets-106.rss
Orissa Bengal Carrier reports consolidated net loss of Rs 2.39 crore in the December 2025 quarter,https://www.business-standard.com/markets/capital-market-news/orissa-bengal-carrier-reports-consolidated-net-loss-of-rs-2-39-crore-in-the-december-2025-quarter-126021600264_1.html,2026-02-16 11:17:49 IST,Sales decline 16.15% to Rs 77.55 crore,https://www.business-standard.com/rss/markets-106.rss
Modi Rubber consolidated net profit declines 17.93% in the December 2025 quarter,https://www.business-standard.com/markets/capital-market-news/modi-rubber-consolidated-net-profit-declines-17-93-in-the-december-2025-quarter-126021600263_1.html,2026-02-16 11:17:43 IST,Reported sales  nil,https://www.business-standard.com/rss/markets-106.rss
Radhagobind Commercial reports standalone net loss of Rs 0.12 crore in the December 2025 quarter,https://www.business-standard.com/markets/capital-market-news/radhagobind-commercial-reports-standalone-net-loss-of-rs-0-12-crore-in-the-december-2025-quarter-126021600262_1.html,2026-02-16 11:17:36 IST,Reported sales  nil,https://www.business-standard.com/rss/markets-106.rss
Thomas Scott India standalone net profit rises 65.67% in the December 2025 quarter,https://www.business-standard.com/markets/capital-market-news/thomas-scott-india-standalone-net-profit-rises-65-67-in-the-december-2025-quarter-126021600261_1.html,2026-02-16 11:17:29 IST,Sales rise 45.93% to Rs 66.25 crore,https://www.business-standard.com/rss/markets-106.rss
Espire Hospitality standalone net profit rises 193.55% in the December 2025 quarter,https://www.business-standard.com/markets/capital-market-news/espire-hospitality-standalone-net-profit-rises-193-55-in-the-december-2025-quarter-126021600260_1.html,2026-02-16 11:17:19 IST,Sales decline 0.53% to Rs 40.97 crore,https://www.business-standard.com/rss/markets-106.rss
Desh Rakshak Aushdhalaya standalone net profit declines 25.00% in the December 2025 quarter,https://www.business-standard.com/markets/capital-market-news/desh-rakshak-aushdhalaya-standalone-net-profit-declines-25-00-in-the-december-2025-quarter-126021600259_1.html,2026-02-16 11:17:12 IST,Sales decline 25.53% to Rs 1.40 crore,https://www.business-standard.com/rss/markets-106.rss
Samrat Pharmachem reports standalone net loss of Rs 0.46 crore in the December 2025 quarter,https://www.business-standard.com/markets/capital-market-news/samrat-pharmachem-reports-standalone-net-loss-of-rs-0-46-crore-in-the-december-2025-quarter-126021600258_1.html,2026-02-16 11:17:06 IST,Sales decline 0.36% to Rs 63.43 crore,https://www.business-standard.com/rss/markets-106.rss
Sanco Trans standalone net profit rises 125.00% in the December 2025 quarter,https://www.business-standard.com/markets/capital-market-news/sanco-trans-standalone-net-profit-rises-125-00-in-the-december-2025-quarter-126021600257_1.html,2026-02-16 11:16:58 IST,Sales rise 34.86% to Rs 37.99 crore,https://www.business-standard.com/rss/markets-106.rss
Monotype India reports standalone net loss of Rs 0.07 crore in the December 2025 quarter,https://www.business-standard.com/markets/capital-market-news/monotype-india-reports-standalone-net-loss-of-rs-0-07-crore-in-the-december-2025-quarter-126021600256_1.html,2026-02-16 11:16:51 IST,Reported sales  nil,https://www.business-standard.com/rss/markets-106.rss
Fabtech Tech secures $7.05 million order from West Africa,https://www.business-standard.com/markets/capital-market-news/fabtech-tech-secures-7-05-million-order-from-west-africa-126021600246_1.html,2026-02-16 11:05:10 IST,Fabtech Technologies has announced that it has secured an order worth $7.05 million (approximately Rs 63.6 crore) from a company based in West Africa.,https://www.business-standard.com/rss/markets-106.rss
"GMR Airports jumps 6% on releasing Jan traffic data, Q3; JM maintains Buy",https://www.business-standard.com/markets/news/gmr-airports-jumps-6-percent-on-releasing-jan-traffic-data-q3-numbers-jm-maintains-buy-126021600241_1.html,2026-02-16 10:57:42 IST,"GMR Airports Infrastructure reported a 3.9 per cent year-on-year (Y-o-Y) increase in passenger traffic across all GMR airports, reaching 11,133,269 passengers in January 2026",https://www.business-standard.com/rss/markets-106.rss
Groww fall 5% as JM Financial projects 13% downside; initiates with 'Sell',https://www.business-standard.com/markets/news/groww-fall-5-as-jm-financial-projects-13-downside-initiates-with-sell-126021600183_1.html,2026-02-16 10:54:48 IST,Groww share price fell as much as 4.87 per cent to ₹164.5 per share on the National Stock Exchange (NSE),https://www.business-standard.com/rss/markets-106.rss
"Keystone Realtors wins Om Nagar CHS redevelopment in Andheri, Mumbai",https://www.business-standard.com/markets/capital-market-news/keystone-realtors-wins-om-nagar-chs-redevelopment-in-andheri-mumbai-126021600233_1.html,2026-02-16 10:51:38 IST,"Keystone Realtors said it has been appointed as the developer for the landmark redevelopment of Om Nagar Co-operative Housing Society Federation in Andheri (East), Mumbai.",https://www.business-standard.com/rss/markets-106.rss
Aye Finance lists at par; slips below IPO price,https://www.business-standard.com/markets/capital-market-news/aye-finance-lists-at-par-slips-below-ipo-price-126021600232_1.html,2026-02-16 10:51:28 IST,"Shares of Aye Finance were currently trading at Rs 123.45 at 10:30 IST on the BSE, representing a discount of 4.30% as compared with the issue price of Rs 129.",https://www.business-standard.com/rss/markets-106.rss
HFCL secures $4.67 million export order for optical fiber cables,https://www.business-standard.com/markets/capital-market-news/hfcl-secures-4-67-million-export-order-for-optical-fiber-cables-126021600231_1.html,2026-02-16 10:51:20 IST,HFCL has announced that it has secured an export order worth approximately $4.67 million (around Rs 42.34 crore) from a reputed international customer for the supply of optical fiber cables.,https://www.business-standard.com/rss/markets-106.rss
Natco Pharma soars as CDSCO clears diabetes drug Semaglutide,https://www.business-standard.com/markets/capital-market-news/natco-pharma-soars-as-cdsco-clears-diabetes-drug-semaglutide-126021600230_1.html,2026-02-16 10:51:10 IST,Natco Pharma surged 11.24% to Rs 914.50 after the company received approval for Semaglutide from Central Drug Standard Control Organization (CDSCO) to manufacture and market generic Semaglutide Injection in India.,https://www.business-standard.com/rss/markets-106.rss
Fractal Analytics is off to a flat start,https://www.business-standard.com/markets/capital-market-news/fractal-analytics-is-off-to-a-flat-start-126021600229_1.html,2026-02-16 10:51:00 IST,"Shares of Fractal Analytics were currently trading at Rs 878.10 at 10:15 IST on the BSE, representing a discount of 2.43% as compared with the issue price of Rs 900.",https://www.business-standard.com/rss/markets-106.rss
Stock picks of the week: 5 stocks with consistent score improvement and upside potential of up to 39%,https://economictimes.indiatimes.com/markets/stocks/news/stock-picks-of-the-week-5-stocks-with-consistent-score-improvement-and-upside-potential-of-up-to-39/articleshow/128413052.cms,2026-02-16 13:17:46 IST,"The way the market has been acting in the last two weeks, the bias seems to have changed. Yes, there is the challenge that volatility in the Nasdaq can bring on the table. But there have been some positive developments that can mean something for the bulls. Our selected stocks for today depict a strong upward trajectory in their overall average score which is based on five key pillars: Earnings, fundamentals, relative valuation, risk, and price momentum. This implies that there has been a significant improvement in their market outlook in the given time frame.",https://economictimes.indiatimes.com/markets/stocks/rssfeeds/2146843.cms
$53 billion value unlocking! D-St braces for 85 IPO lock-in expiries in 3 months. Check details,https://economictimes.indiatimes.com/markets/stocks/news/53-billion-dalal-street-braces-for-85-ipo-lock-in-expiries-in-next-3-months-check-details/articleshow/128409942.cms,2026-02-16 12:00:07 IST,"Dalal Street is set for a wave of IPO lock-in expiries, with about 85 companies seeing restrictions lifted between February and May 2026, potentially unlocking $53 billion worth of shares, according to Nuvama Alternative &amp; Quantitative Research.",https://economictimes.indiatimes.com/markets/stocks/rssfeeds/2146843.cms
Inox Wind shares fall over 8%. What brokerages didn't like in Q3 results,https://economictimes.indiatimes.com/markets/stocks/news/inox-wind-shares-fall-over-8-what-brokerages-didnt-like-in-q3-results/articleshow/128409412.cms,2026-02-16 11:43:30 IST,"Inox Wind shares fell to their 52-week low on Monday after a weak Q3 marked by slow execution, missed revenue estimates, and higher interest costs. Brokerages, including Nomura and Motilal Oswal, slashed price targets, citing softer guidance and trimmed growth forecasts despite retaining ‘BUY’ ratings.",https://economictimes.indiatimes.com/markets/stocks/rssfeeds/2146843.cms
Small-cap stock hits 52-week high after this strategic business update,https://www.livemint.com/market/stock-market-news/smallcap-stock-hits-52-week-high-after-this-strategic-business-update-r-m-drip-sprinklers-systems-11771225448707.html,2026-02-16 13:05:05 IST,"R M Drip &amp;amp; Sprinklers Systems' stock rose over 1.5% after the company partnered with a farm automation technology firm, highlighting its focus on IoT-driven smart irrigation and a commitment to innovation in agriculture.",https://www.livemint.com/rss/markets
"Fractal Analytics share price falls over 5% after muted listing. Should you buy, sell or hold the AI stock?",https://www.livemint.com/market/stock-market-news/fractal-analytics-share-price-falls-over-5-after-muted-listing-should-you-buy-sell-or-hold-the-ai-stock-11771226863331.html,2026-02-16 13:04:18 IST,"Fractal Analytics shares were listed at  ₹876 apiece on the NSE, a discount of 2.66% from its issue price of  ₹900 per share. The stock witnessed heavy selling after listing and declined to an intraday low of  ₹852 apiece, down 2.73% from its listing price, and down 5.33% from its issue price.",https://www.livemint.com/rss/markets
Stock market holiday: Is the US market open or closed today on Presidents' Day?,https://www.livemint.com/market/stock-market-news/stock-market-holiday-is-the-us-market-open-or-closed-today-on-presidents-day-11771223144957.html,2026-02-16 12:51:31 IST,Stock market holiday: Trading on the NYSE and Nasdaq will remain suspended. The US bond market will also be closed for trading on Presidents' Day.,https://www.livemint.com/rss/markets
"TCS, Infosys to Wipro: Nifty IT index sees worst fall since 2008 financial crisis, drops 32% from peak",https://www.livemint.com/market/stock-market-news/tcs-vs-infosys-vs-wipro-nifty-it-index-sees-worst-fall-since-2008-financial-crisis-drops-32-from-peak-11771224123314.html,2026-02-16 12:24:20 IST,"IT stocks, including Infosys and TCS, continued to decline on February 16, marking four consecutive sessions of losses. The Nifty IT index fell 1.1%, down 32% from its peak, as concerns over AI disruption impact investor sentiment.",https://www.livemint.com/rss/markets
"HAL, BEL, Mazagon Dock, and more: A look at top defence stocks to buy for long term - check full list",https://www.livemint.com/market/stock-market-news/hal-bel-mazagon-dock-and-more-a-look-at-top-defence-stocks-for-buy-for-long-term-check-full-list-11771173229599.html,2026-02-16 12:19:29 IST,"The Indian defence sector is set for expansion, supported by a record budget allocation and substantial capital acquisition approvals. Companies such as HAL, BEL, and Mazagon Dock are highlighted as key beneficiaries, with expectations of sustained growth.",https://www.livemint.com/rss/markets
"Max Financial Services shares hit a record high, jump 14% in February so far— Time to buy more or book profits?",https://www.livemint.com/market/stock-market-news/max-financial-services-shares-hit-a-record-high-jump-14-in-february-so-far-time-to-buy-more-or-book-profits-11771222720273.html,2026-02-16 12:16:00 IST,"Max Financial Services share price has been on a roll this month, rising about 14%, on course to snap its two-month losing run. It hit a 52-week low of  ₹972.55 on March 4 last year, and at present, it is up over 90% from its one-year low.",https://www.livemint.com/rss/markets
"Small-cap multibagger stock declares 1:2 stock split, 1:2 bonus shares. Details here",https://www.livemint.com/market/stock-market-news/smallcap-multibagger-stock-r-b-denims-share-price-declares-1-2-stock-split-1-2-bonus-shares-details-here-11771223624471.html,2026-02-16 12:13:39 IST,R&amp;amp;B Denims share price has gained 27% in one month and has rallied 51% in three months. The smallcap stock has jumped 93% in six months and has delivered multibagger returns of 196% in the past two years.,https://www.livemint.com/rss/markets
How will silver price fare in 2026?,https://www.livemint.com/market/commodities/silver-price-india-silver-rate-today-silver-price-in-2026-silver-price-outlook-11771220396315.html,2026-02-16 12:08:44 IST,"After stunning gains seen in 2025, silver price experienced the sharpest crash in its history in just one week. Will silver price rise again? Read on…",https://www.livemint.com/rss/markets
Vinay Rajani of HDFC Sec suggests these 2 stocks to buy in the near-term,https://www.livemint.com/market/stock-market-news/vinay-rajani-of-hdfc-sec-suggests-these-2-stocks-to-buy-in-the-nearterm-11771222124833.html,2026-02-16 12:05:25 IST,"On Monday, Indian stock markets started negatively amid AI-related concerns in IT. The Nifty 50 and Sensex saw slight gains, but volatility remains high. Analysts indicate a cautious market outlook, with Nifty trading within a defined range of support and resistance levels.",https://www.livemint.com/rss/markets
PPFAS to ICICI Pru Larecap: India's top mutual funds hold over 10% in IT stocks — Should retail investors worry?,https://www.livemint.com/market/stock-market-news/ppfas-to-icici-pru-larecap-indias-top-mutual-funds-hold-over-10-in-it-stocks-should-retail-investors-worry-11771222406295.html,2026-02-16 11:59:10 IST,"Amid fears that AI's rise could disrupt the Indian IT sector, focus is shifting to high holdings in tech stocks of Indian mutual funds. PPFAS has a 25% exposure to IT stocks while several other funds also hold 10% or more, creating a concern for retail investors.",https://www.livemint.com/rss/markets
Brainbees Solutions shares tumble 10% to record low after weak Q3; stock now 47% below IPO price,https://www.livemint.com/market/stock-market-news/brainbees-solutions-shares-tumble-10-to-record-low-after-weak-q3-stock-now-47-below-ipo-price-11771222143981.html,2026-02-16 11:54:36 IST,"Brainbees Solutions, operator of FirstCry, saw its shares plummet 10% to  ₹244 after Q3 results, as net losses widened to  ₹39 crore. Revenue grew 12% to  ₹2,424 crore, but margins declined. The stock is now down over 45% from its IPO price.",https://www.livemint.com/rss/markets
"Post-HUL demerger, Kwality Wall's aims to become a ‘snacking’ firm",https://www.livemint.com/companies/kwality-walls-hindustan-unilever-snacks-ice-cream-fmcg-demerger-magnum-india-11771212560412.html,2026-02-16 11:30:26 IST,Kwality Walls eyes year-round demand and a quick commerce boost.,https://www.livemint.com/rss/companies
Your toughest investment opponent is yourself: Bajaj Finserv MF's Ganesh Mohan,https://www.livemint.com/money/personal-finance/mutual-fund-bank-deposits-financial-influencers-investor-psychology-11771222617074.html,2026-02-16 13:21:19 IST,"At the Mint Money Festival 2026, Bajaj Finserv Mutual Fund MD Ganesh Mohan explains why investor psychology, and not market timing, largely determines long-term returns.",https://www.livemint.com/rss/money
Prime Minister highlights role of budget in driving inclusive growth and strengthening India's position in global economy,https://www.business-standard.com/markets/capital-market-news/prime-minister-highlights-role-of-budget-in-driving-inclusive-growth-and-strengthening-india-s-position-in-global-economy-126021600443_1.html,2026-02-16 13:05:20 IST,Powered by Capital Market - Live News,https://www.business-standard.com/rss/markets-106.rss
Dynacons Systems & Solutions announces strategic collaboration with Cygeni,https://www.business-standard.com/markets/capital-market-news/dynacons-systems-solutions-announces-strategic-collaboration-with-cygeni-126021600442_1.html,2026-02-16 13:05:02 IST,"To deliver AI-driven cyber defense and AI governance solutions across India, Middle East & APAC",https://www.business-standard.com/rss/markets-106.rss
Alkem Lab arm Enzene receives 6 observations after USFDA inspection,https://www.business-standard.com/markets/capital-market-news/alkem-lab-arm-enzene-receives-6-observations-after-usfda-inspection-126021600416_1.html,2026-02-16 12:51:34 IST,"Alkem Laboratories has informed that the United States Food and Drug Administration (USFDA) has completed a pre-approval inspection (PAI) at the manufacturing facility of Enzene Biosciences in India (Enzene), a subsidiary of the company in India.",https://www.business-standard.com/rss/markets-106.rss
Kwality Wall's lists at discount post HUL demerger; open offer at Rs 21.33 announced,https://www.business-standard.com/markets/capital-market-news/kwality-wall-s-lists-at-discount-post-hul-demerger-open-offer-at-rs-21-33-announced-126021600415_1.html,2026-02-16 12:51:26 IST,"Shares of Kwality Wall's (India) began trading on the bourses on Monday, marking the standalone listing of the ice cream business following its demerger from Hindustan Unilever.",https://www.business-standard.com/rss/markets-106.rss
RACL Geartech Ltd leads gainers in 'B' group,https://www.business-standard.com/markets/capital-market-news/racl-geartech-ltd-leads-gainers-in-b-group-126021600414_1.html,2026-02-16 12:51:18 IST,"Anuroop Packaging Ltd, Precision Wires India Ltd, Bharat Seats Ltd and Pavna Industries Ltd are among the other gainers in the BSE's 'B' group today, 16 February 2026.",https://www.business-standard.com/rss/markets-106.rss
"Sensex, Nifty trade in positive terrain; media shares skid for 3rd day",https://www.business-standard.com/markets/capital-market-news/sensex-nifty-trade-in-positive-terrain-media-shares-skid-for-3rd-day-126021600413_1.html,2026-02-16 12:51:06 IST,Media shares dropped for three consecutive trading sessions.,https://www.business-standard.com/rss/markets-106.rss
Shakti Pumps stock plunges 14% as Q3 net profit falls 70%,https://www.business-standard.com/markets/news/shakti-pumps-stock-plunges-14-as-q3-net-profit-falls-70-126021600307_1.html,2026-02-16 12:37:59 IST,"Shakti Pumps (India) declined as much as 13.8 per cent to ₹552.10, the lowest level since December 11, 2025 per share on the National Stock Exchange (NSE)",https://www.business-standard.com/rss/markets-106.rss
EFC (I) Q3 PAT jumps 54% YoY to Rs 62 cr,https://www.business-standard.com/markets/capital-market-news/efc-i-q3-pat-jumps-54-yoy-to-rs-62-cr-126021600380_1.html,2026-02-16 12:31:52 IST,EFC (I)'s consolidated net profit jumped 54.21% to Rs 62.41 crore on a 52.09% rise in revenue from operations to Rs 269.58 crore in Q3 FY26 over Q3 FY25.,https://www.business-standard.com/rss/markets-106.rss
"STT hike, US deal, NSE listing: SMC's Aggarwal decodes 2026 market roadmap",https://www.business-standard.com/markets/news/stt-hike-us-deal-nse-listing-smc-s-aggarwal-decodes-2026-market-roadmap-126021600339_1.html,2026-02-16 12:26:12 IST,"The reduction in US tariffs and the interim trade deal framework are set to significantly boost India's export competitiveness, said Subhash C. Aggarwal",https://www.business-standard.com/rss/markets-106.rss
Crypto traders cautious as macro data reinforces 'higher for longer' stance,https://www.business-standard.com/markets/cryptocurrency/crypto-traders-cautious-as-macro-data-reinforces-higher-for-longer-stance-126021600363_1.html,2026-02-16 12:20:50 IST,"A strong recovery in Bitcoin above $70,000, analysts believe, could help restore broader market confidence, while failure to hold current supports may trigger another wave of risk-off sentiment",https://www.business-standard.com/rss/markets-106.rss
KFin Tech climbs after Q3 PAT rises 2% YoY to Rs 92 cr,https://www.business-standard.com/markets/capital-market-news/kfin-tech-climbs-after-q3-pat-rises-2-yoy-to-rs-92-cr-126021600361_1.html,2026-02-16 12:17:16 IST,"KFin Technologies rallied 5.53% to Rs 1,021.60 after the company's consolidated net profit increased 2.02% to Rs 91.99 crore on 27.88% jump in revenue from operations to Rs 370.87 crore in Q3 FY26 over Q3 FY25.",https://www.business-standard.com/rss/markets-106.rss
Earkart bags Rs 4-cr government order via GeM,https://www.business-standard.com/markets/capital-market-news/earkart-bags-rs-4-cr-government-order-via-gem-126021600360_1.html,2026-02-16 12:17:07 IST,Earkart has announced that it has been awarded a government order worth Rs 4.12 crore through the Government e-Marketplace (GeM) platform from Artificial Limbs Manufacturing Corporation of India (ALIMCO).,https://www.business-standard.com/rss/markets-106.rss
Easy Trip Planners Ltd leads gainers in 'A' group,https://www.business-standard.com/markets/capital-market-news/easy-trip-planners-ltd-leads-gainers-in-a-group-126021600359_1.html,2026-02-16 12:16:59 IST,"Natco Pharma Ltd, Cartrade Tech Ltd, KFin Technologies Ltd and Engineers India Ltd are among the other gainers in the BSE's 'A' group today, 16 February 2026.",https://www.business-standard.com/rss/markets-106.rss
