title,link,published,summary,source
Tariff Tantrum 2.0: Time to look beyond 2026? 6 stocks from different sectors with at least one ‘moat’; and upside potential of up to 31%,https://economictimes.indiatimes.com/markets/stocks/news/tariff-tantrum-2-0-time-to-look-beyond-2026-6-stocks-from-different-sectors-with-at-least-one-moat-and-upside-potential-of-up-to-31/articleshow/128799109.cms,2026-02-26 06:55:01 IST,"The market can live with clear bullishness or even a bearish trend. What it really hates is uncertainty. And these are uncertain times – marked by a spike in volatility. The absence of a clear trend means that these are uncertain times for investors as well. You could “sit out the volatility”, of course. But if you insist on deploying money in the market, it would be safer to look at stocks that may be from different sectors but have at least one common factor – an edge their peers don’t have.",https://economictimes.indiatimes.com/markets/stocks/rssfeeds/2146843.cms
Export uncertainty may dull domestic momentum for solar companies,https://economictimes.indiatimes.com/markets/stocks/news/export-uncertainty-may-dull-domestic-momentum-for-solar-companies/articleshow/128799006.cms,2026-02-26 06:37:30 IST,"US imposition of a 125.87% countervailing duty on Indian solar modules is set to impact domestic companies by potentially lowering module prices. Exporters may redirect unsold inventory to India, while companies like Waaree Energies are strengthening US manufacturing to mitigate the effects. The duty erodes future revenue visibility for Indian manufacturers targeting the US market.",https://economictimes.indiatimes.com/markets/stocks/rssfeeds/2146843.cms
"Analysts cautious on IRFC OFS, see limited upside",https://economictimes.indiatimes.com/markets/stocks/news/analysts-cautious-on-irfc-ofs-see-limited-upside/articleshow/128798797.cms,2026-02-26 06:17:17 IST,The government is selling a stake in Indian Railway Finance Corporation. Analysts suggest caution for investors. The offer for sale aims to meet public shareholding norms. The floor price offers limited discount. IRFC has seen loan growth supported by railway capital expenditure. Future gains may depend on market sentiment.,https://economictimes.indiatimes.com/markets/stocks/rssfeeds/2146843.cms
Pre-market action: Here's the trade setup for today's session,https://economictimes.indiatimes.com/markets/stocks/news/pre-market-action-heres-the-trade-setup-for-todays-session/articleshow/128790341.cms,2026-02-26 06:11:00 IST,"Equities advanced on Wednesday amid positive global cues, though trade uncertainties kept sentiment cautious. Analysts anticipate a range-bound market, guided by macro developments and sector-specific catalysts, with immediate support at 25300 and resistance at 25650-25750. Foreign investors showed strong buying interest.",https://economictimes.indiatimes.com/markets/stocks/rssfeeds/2146843.cms
"Stocks in news: IRFC, Adani Ports, Lodha Developers, Lupin, RIL",https://economictimes.indiatimes.com/markets/stocks/news/stocks-in-news-irfc-adani-ports-lodha-developers-lupin-ril/articleshow/128789709.cms,2026-02-26 06:11:00 IST,"Markets closed higher despite initial volatility on the first day of the new expiry series, though analysts suggest potential for further downside. Several companies like IRFC, Adani Ports, Lodha Developers, Lupin, and RIL are in focus due to significant news developments impacting their operations and financial standing.",https://economictimes.indiatimes.com/markets/stocks/rssfeeds/2146843.cms
"Vedanta board clears Rs 3,000 crore NCD fundraise",https://economictimes.indiatimes.com/markets/stocks/news/vedanta-board-clears-rs-3000-crore-ncd-fundraise/articleshow/128798730.cms,2026-02-26 06:08:49 IST,"Vedanta's board has greenlit a ₹3,000 crore fundraising initiative via unsecured, rated, and listed non-convertible debentures. These instruments, with a face value of ₹1,00,000 each, are slated for listing on the BSE. CRISIL has assigned a 'CRISIL AA' rating to these NCDs, placing them under 'Rating Watch with Developing Implications'.",https://economictimes.indiatimes.com/markets/stocks/rssfeeds/2146843.cms
"Bulk Deal Buzz: Promoters offload 5.3% in Aditya Infotech, shares rally 7.3%",https://economictimes.indiatimes.com/markets/stocks/news/bulk-deal-buzz-promoters-offload-5-3-in-aditya-infotech-shares-rally-7-3/articleshow/128798696.cms,2026-02-26 06:04:45 IST,"Promoter Hari Khemka Business Family Trust and Dixon Technologies divested shares of Aditya Infotech (CPPLUS) worth ₹920.8 crore in bulk deals. The entities sold 62.6 lakh shares at ₹1,470 each, offloading 5.3% of the company's total equity. Major mutual funds and HDFC Life Insurance were among the buyers.",https://economictimes.indiatimes.com/markets/stocks/rssfeeds/2146843.cms
India's stock market offers scale and growth: Pandey,https://economictimes.indiatimes.com/markets/stocks/news/indias-stock-market-offers-scale-and-growth-pandey/articleshow/128798621.cms,2026-02-26 05:55:44 IST,"India is building a transparent, well-governed, and investable stock market to attract long-term institutional capital, according to Sebi chief Tuhin Kanta Pandey. He highlighted that the country offers scale and growth, with foreign portfolio investor assets tripling to ₹71 lakh crore. Domestic institutional investors are now providing a crucial counterbalance, enhancing market resilience.",https://economictimes.indiatimes.com/markets/stocks/rssfeeds/2146843.cms
Sebi ramps up broker dealing room scrutiny,https://economictimes.indiatimes.com/markets/stocks/news/sebi-ramps-up-broker-dealing-room-scrutiny/articleshow/128798582.cms,2026-02-26 05:52:06 IST,"India's market regulator is intensifying its watch on stockbrokers' dealing rooms. This move aims to curb front running, a practice where employees exploit insider knowledge of large trades for personal gain. Authorities are investigating how trades are initiated and executed, focusing on institutional and high-net-worth clients.",https://economictimes.indiatimes.com/markets/stocks/rssfeeds/2146843.cms
SAT adjourns hearing in Jane Street case to April 17,https://economictimes.indiatimes.com/markets/stocks/news/sat-adjourns-hearing-in-jane-street-case-to-april-17/articleshow/128798521.cms,2026-02-26 05:46:44 IST,The Securities Appellate Tribunal has postponed a key hearing. This case involves US trader Jane Street and market regulator Sebi. Sebi had previously imposed a hefty fine and trading ban on Jane Street. The firm has challenged Sebi's order. The tribunal will now hear the matter on April 17. Jane Street had deposited the fine amount.,https://economictimes.indiatimes.com/markets/stocks/rssfeeds/2146843.cms
"Metal stocks rise 7%, analysts see potential upside of up to 25%",https://economictimes.indiatimes.com/markets/stocks/news/metal-stocks-rise-7-analysts-see-potential-upside-of-up-to-25/articleshow/128798479.cms,2026-02-26 05:43:29 IST,"Metal stocks surged over 7% on Wednesday, driven by firm base metal prices and reduced uncertainty over US tariffs. Analysts suggest buying on dips, anticipating up to 25% upside.  Companies like Lloyds Metals, National Aluminium, and Vedanta saw significant gains as investors shifted funds from IT to the buoyant metal sector.",https://economictimes.indiatimes.com/markets/stocks/rssfeeds/2146843.cms
"IT bounce breaks 5-day losing run, but analysts warn relief may be short-lived",https://economictimes.indiatimes.com/markets/stocks/news/it-bounce-breaks-5-day-losing-run-analysts-warn-relief-may-be-short-lived/articleshow/128798366.cms,2026-02-26 05:33:50 IST,"Indian IT stocks saw a brief rebound on Wednesday, ending a losing streak. However, analysts caution this relief might be temporary. Most derivative bets remain bearish after the IT index's substantial drop. The sector experienced pressure throughout February, with new AI tools intensifying concerns about future revenue. Short covering fueled the bounce, but underlying weakness persists.",https://economictimes.indiatimes.com/markets/stocks/rssfeeds/2146843.cms
Stock Radar: Colgate Palmolive stock moves above the Alligator indicator – time to buy?,https://economictimes.indiatimes.com/markets/stocks/news/stock-radar-colgate-palmolive-stock-moves-above-the-alligator-indicator-time-to-buy/articleshow/128776635.cms,2026-02-26 05:00:00 IST,"Colgate-Palmolive India shows bullish signs, breaking above the Alligator indicator. Experts suggest short-term traders consider buying for a potential Rs 2,450 target within weeks. The stock has recovered from a recent decline, with technical indicators like DMI and MACD supporting an upward trend. Entry is recommended in the Rs 2,240-2,220 range.",https://economictimes.indiatimes.com/markets/stocks/rssfeeds/2146843.cms
RBI summons Yes Bank executives over forex card breach,https://economictimes.indiatimes.com/markets/stocks/news/rbi-summons-yes-bank-executives-over-forex-card-breach/articleshow/128798656.cms,2026-02-26 01:29:28 IST,"The Reserve Bank of India has called in senior Yes Bank executives after a major security incident involving the Yes Bank–BookMyForex multi-currency forex card. According to reports, card numbers and CVV details of numerous customers may have been exposed. The RBI has demanded a full account of how the breach occurred and what safeguards failed.",https://economictimes.indiatimes.com/markets/stocks/rssfeeds/2146843.cms
"Microfinance in revival mode; MFIs, private banks expand business in January",https://economictimes.indiatimes.com/markets/stocks/news/microfinance-in-revival-mode-mfis-private-banks-expand-business-in-january/articleshow/128798640.cms,2026-02-26 01:14:39 IST,"The microfinance sector is consolidating after a period of stress. Private banks and NBFC-MFIs have increased their lending portfolios. While the overall market saw a slight dip, early delinquency rates are improving. Experts anticipate a return to normal growth by the end of the first quarter of FY27. This marks an inflection point for the industry.",https://economictimes.indiatimes.com/markets/stocks/rssfeeds/2146843.cms
Credit card spends moderate in Jan from festival highs in Dec,https://economictimes.indiatimes.com/markets/stocks/news/credit-card-spends-moderate-in-jan-from-festival-highs-in-dec/articleshow/128798428.cms,2026-02-26 00:27:04 IST,"Credit card spending in India moderated in January to Rs 1.99 lakh crore, down from December's festival-led high but up over 8% year-on-year. This indicates a normalization of growth after a festive surge, with active card numbers rising to 116.6 million, though new additions slowed due to tighter underwriting and regulatory caution.",https://economictimes.indiatimes.com/markets/stocks/rssfeeds/2146843.cms
"Indian stock market: 10 things that changed for market overnight- Gift Nifty, Nasdaq, Nikkei rally to Nvidia Q4 earnings",https://www.livemint.com/market/stock-market-news/indian-stock-market-10-things-that-changed-for-market-overnight-gift-nifty-nasdaq-nikkei-rally-to-nvidia-q4-earnings-11772038982002.html,2026-02-26 07:08:25 IST,"Gift Nifty was trading around 25,669 level, a premium of nearly 41 points from the Nifty futures’ previous close, indicating a positive start for the Indian stock market indices.",https://www.livemint.com/rss/markets
"Gold, silver rates today: Gold prices fall back to $5,200/oz, silver price near $90. What next?",https://www.livemint.com/market/commodities/gold-silver-rates-today-gold-prices-fall-back-to-5-200-oz-silver-price-near-90-what-next-11772066616149.html,2026-02-26 07:05:25 IST,"Gold, silver rates today: The COMEX gold rate fell nearly 0.50% to $5,201 per ounce; meanwhile, the COMEX silver price slid around 2% to $89.5 per ounce during Asian trading hours on Thursday.",https://www.livemint.com/rss/markets
Stock recommendations for 26 February from MarketSmith India,https://www.livemint.com/market/stock-market-news/stock-recommendations-for-26-february-from-marketsmith-india-11772021652778.html,2026-02-26 06:01:03 IST,"MarketSmith India reveals its top stock recommendations for today, 26 February. Get expert insights into the best-performing stocks to guide your investment decisions.",https://www.livemint.com/rss/markets
Stocks to buy: Raja Venkatraman recommends two stocks for 26 February,https://www.livemint.com/market/stock-market-news/stocks-to-buy-raja-venkatraman-stock-picks-26-february-11772026142256.html,2026-02-26 06:00:24 IST,Market expert Raja Venkatraman shares his top stock picks for 26 February. Here’s his technical outlook and trade strategy.,https://www.livemint.com/rss/markets
A thaw in the renewable energy deal market? Investors eye CleanMax IPO for pricing cues,https://www.livemint.com/market/ipo/india-renewable-energy-deals-stalled-cleanmax-ipo-valuation-benchmark-11772002268309.html,2026-02-26 05:51:03 IST,"The  ₹3,100 crore listing is expected to set pricing benchmarks for private transactions, including platform sales, stake deals and upcoming listings.",https://www.livemint.com/rss/markets
Jensen Huang says ‘markets got it wrong’ after Nvidia posts stellar fourth quarter results defying AI bubble worries,https://www.livemint.com/companies/company-results/jensen-huang-says-markets-got-it-wrong-after-nvidia-posts-stellar-fourth-quarter-results-defying-ai-bubble-worries-11772064517558.html,2026-02-26 06:27:18 IST,"Speaking to investors and analysts during a conference call, Jensen Huang predicted that AI will not go anywhere and will only get better. Nvidia posted a smashing 73% year-on-year surge in its fourth quarter fiscal revenue at $68.1 billion.",https://www.livemint.com/rss/companies
Synergy between renewable energy and data centers core to NIIF's Master Fund II,https://www.livemint.com/companies/news/niif-master-fund-ii-renewable-energy-data-centers-digital-infrastructure-ai-led-demand-artificial-intelligence-11772015156832.html,2026-02-26 06:05:44 IST,"NIIF’s data centre push is anchored in India’s surging demand for digital infrastructure, particularly since AI entered the mainstream.",https://www.livemint.com/rss/companies
"Uber pumps  ₹3,000 crore into India arm as Rapido challenge intensifies",https://www.livemint.com/auto-news/uber-pumps-3-000-crore-into-india-arm-as-rapido-challenge-intensifies-ola-cabs-ride-hailing-11772018099231.html,2026-02-26 05:31:02 IST,"Uber and Rapido are in a fierce competition for market share in India's ride-hailing sector, with Uber investing heavily to counter Rapido's rapid growth.&amp;nbsp;",https://www.livemint.com/rss/companies
"US shares, undisclosed dividend: is BMA penalty inevitable?",https://www.livemint.com/money/personal-finance/us-shares-undisclosed-dividend-is-bma-penalty-inevitable-11771948247666.html,2026-02-26 05:50:43 IST,"An Indian investor disclosed foreign shares but not the associated dividend income, assuming it was taxed in the US. The  ₹20 lakh threshold for penalty under the Black Money Act pertains to foreign assets, not income. What can be done to mitigate penalties?",https://www.livemint.com/rss/money
"Sensex, Nifty off to a positive start as IT stocks spark surge",https://economictimes.indiatimes.com/markets/stocks/news/sensex-nifty-off-to-a-positive-start-as-it-stocks-spark-surge/articleshow/128801614.cms,2026-02-26 09:28:57 IST,"Indian stock markets are on the rise for a second day. The Sensex opened higher by over 140 points. The Nifty is trading above 25,500. Technology stocks are leading the gains, following their Wall Street counterparts. Major IT firms like Tech Mahindra and Infosys are seeing significant increases. Some other companies are also performing well.",https://economictimes.indiatimes.com/markets/stocks/rssfeeds/2146843.cms
IRFC OFS open for retail investors today. Should you wait or subscribe?,https://economictimes.indiatimes.com/markets/stocks/news/irfc-ofs-open-for-retail-investors-today-should-you-wait-or-subscribe/articleshow/128801534.cms,2026-02-26 09:21:37 IST,"IRFC's Offer for Sale (OFS) opened flat at Rs 104, with the government divesting a 2% stake. The issue saw 95% subscription from non-retail investors on the first day. Experts suggest IRFC remains fundamentally strong, with the OFS presenting a tactical opportunity for investors to reassess positioning.",https://economictimes.indiatimes.com/markets/stocks/rssfeeds/2146843.cms
"Bharti Airtel's Rs 20,000 crore NBFC gambit: A Jio-style pivot or costly distraction?",https://economictimes.indiatimes.com/markets/stocks/news/bharti-airtels-rs-20000-crore-nbfc-gambit-a-jio-style-pivot-or-costly-distraction/articleshow/128801474.cms,2026-02-26 09:18:32 IST,"Bharti Airtel is injecting Rs 20,000 crore into its new NBFC, Airtel Money Limited. This move positions the company as a direct lender, competing with established players. Airtel aims to leverage its vast customer base and data capabilities. The company previously acted as a loan distributor. This strategic pivot seeks to capture a significant share of India's underserved credit market.",https://economictimes.indiatimes.com/markets/stocks/rssfeeds/2146843.cms
"Infosys, TCS, other IT stocks to remain in focus after tech rally following strong Nvidia earnings",https://economictimes.indiatimes.com/markets/stocks/news/infosys-tcs-other-it-stocks-to-remain-in-focus-after-tech-rally-following-strong-nvidia-earnings/articleshow/128801158.cms,2026-02-26 09:04:34 IST,"Indian IT stocks are poised for focus following Nvidia's robust quarterly earnings, which spurred a Wall Street rally. This positive sentiment emerges amidst recent volatility in the IT sector, triggered by AI startup Anthropic's new tools. Analysts suggest the AI technology cycle is in its early monetization phase, with Indian IT firms expected to benefit significantly from increased AI spending.",https://economictimes.indiatimes.com/markets/stocks/rssfeeds/2146843.cms
IRFC shares in focus as government won’t exercise greenshoe option in OFS; retail participation opens today,https://economictimes.indiatimes.com/markets/stocks/news/irfc-shares-in-focus-as-government-wont-exercise-greenshoe-option-in-ofs-retail-participation-opens-today/articleshow/128801212.cms,2026-02-26 09:04:08 IST,"IRFC shares are in focus after the government chose not to exercise the greenshoe option in its OFS amid undersubscription from institutional investors. While retail bidding opens today, the PSU continues to report steady financial performance, with record quarterly profit and improving margins despite a marginal dip in revenue.",https://economictimes.indiatimes.com/markets/stocks/rssfeeds/2146843.cms
"Nvidia’s solid Q4, upbeat guidance, quashes fears of AI slowdown but China overhang remains",https://economictimes.indiatimes.com/markets/stocks/news/nvidias-solid-q4-upbeat-guidance-quashes-fears-of-ai-slowdown-but-china-overhang-remains/articleshow/128801117.cms,2026-02-26 08:59:02 IST,"Nvidia posted a strong fourth quarter, with data centre revenue surging 75% and guidance beating Street estimates, easing concerns of an AI spending slowdown. However, China-related restrictions remain a key overhang, even as the company secures licences for limited chip shipments and faces rising competition from AMD and Google.",https://economictimes.indiatimes.com/markets/stocks/rssfeeds/2146843.cms
"LT Foods shares in focus as US slashes duty on soybean, eases liability by Rs 163 crore",https://economictimes.indiatimes.com/markets/stocks/news/lt-foods-shares-in-focus-as-us-slashes-duty-on-soybean-eases-liability-by-rs-163-crore/articleshow/128801079.cms,2026-02-26 08:56:27 IST,"Shares of LT Foods Ltd are in focus after the U.S. Department of Commerce sharply cut countervailing duty on its subsidiary’s organic soybean meal exports. The move significantly reduces potential liability and follows a review period covering 2023 exports, supporting sentiment amid steady quarterly performance.",https://economictimes.indiatimes.com/markets/stocks/rssfeeds/2146843.cms
Mankind Pharma among 4 stocks showing bullish RSI upswing,https://economictimes.indiatimes.com/markets/stocks/news/mankind-pharma-among-4-stocks-showing-bullish-rsi-upswing/slideshow/128800892.cms,2026-02-26 08:41:02 IST,"Four Nifty200 stocks, including Mankind Pharma and Aurobindo Pharma, signalled strengthening momentum on February 25 as their RSI crossed above the 50 mark. The RSI Trending Up scan highlights improving price strength, often interpreted by traders as a potential buying opportunity amid sustained upward movement.",https://economictimes.indiatimes.com/markets/stocks/rssfeeds/2146843.cms
"Lloyds Metals &amp; Energy among 6 stocks flash bullish signals, indicating possible uptrend",https://economictimes.indiatimes.com/markets/stocks/news/lloyds-metals-energy-among-6-stocks-flash-bullish-signals-indicating-possible-uptrend/slideshow/128800817.cms,2026-02-26 08:36:18 IST,"Six Nifty500 stocks, including Lloyds Metals &amp; Energy, Mankind Pharma and National Aluminium Company, formed a bullish White Marubozu pattern on February 25, signalling strong buying interest. The candlestick formation indicates sustained upward momentum, with traders viewing it as a potential early indicator of further price strength in the near term.",https://economictimes.indiatimes.com/markets/stocks/rssfeeds/2146843.cms
"Stocks to buy in 2026 for long term: TVS Motor, Pidilite Industries among 5 stocks that could give 10-50% return",https://economictimes.indiatimes.com/markets/stocks/news/stocks-to-buy-in-2026-for-long-term-tvs-motor-pidilite-industries-among-5-stocks-that-could-give-10-50-return/slideshow/128800009.cms,2026-02-26 07:48:45 IST,We have collated a list of recommendations from top brokerage firms from ETNow and other sources.,https://economictimes.indiatimes.com/markets/stocks/rssfeeds/2146843.cms
Positive Breakout: These 13 stocks cross above their 200 DMAs,https://economictimes.indiatimes.com/markets/stocks/news/positive-breakout-these-13-stocks-cross-above-their-200-dmas/slideshow/128799805.cms,2026-02-26 07:30:20 IST,"As long as the stock is priced above the 200-day SMA on the daily timeframe, it is generally considered to be in an overall uptrend.",https://economictimes.indiatimes.com/markets/stocks/rssfeeds/2146843.cms
"Omnitech Engineering IPO Day 2: Issue booked 9% so far. Here's GMP, subscription status - Apply or not?",https://www.livemint.com/market/ipo/omnitech-engineering-ipo-day-2-issue-booked-9-so-far-heres-gmp-subscription-status-apply-or-not-11772076714335.html,2026-02-26 09:26:55 IST,"The GMP of Omnitech Engineering IPO has fallen to  ₹0 from  ₹4, according to websites tracking grey market trends. This means that the estimated listing price of Omnitech Engineering IPO is likely to be the same as the IPO price of  ₹227, as per Investorgain.",https://www.livemint.com/rss/markets
Buy or sell: Vaishali Parekh recommends three intraday stocks to buy today — 26 February 2026,https://www.livemint.com/market/stock-market-news/buy-or-sell-vaishali-parekh-recommends-three-intraday-stocks-to-buy-today-26-february-2026-11772075027683.html,2026-02-26 09:23:40 IST,"Buy or sell: Vaishali Parekh recommends three intraday stocks to buy today — Zen Technologies, Nelcast, and Cipla",https://www.livemint.com/rss/markets
Silver rate today: White metal falls 2% on MCX - What should investors do?,https://www.livemint.com/market/commodities/silver-rate-today-white-metal-falls-2-on-mcx-gold-price-down-what-should-investors-do-11772075990057.html,2026-02-26 09:11:27 IST,"Silver rates fell 2% on MCX to  ₹2,62,892.00 as US-Iran talks eased tariff uncertainty. Gold prices approached $5,200, with spot gold up 0.3% at $5,183.85. Investors await jobless claims data for insights on Federal Reserve policy.",https://www.livemint.com/rss/markets
"Gold rate drops on MCX due to profit booking; weak dollar, global uncertainties limit losses",https://www.livemint.com/market/commodities/gold-price-today-rate-drops-on-mcx-due-to-profit-booking-weak-dollar-global-uncertainties-limit-losses-11772076767711.html,2026-02-26 09:08:18 IST,"Gold rate dropped on the MCX due to profit booking. MCX gold April futures dropped by over  ₹600, or 0.40%, to  ₹1,60,516 per 10 grams, while MCX silver March contracts declined by over  ₹5,400, or 2%, to  ₹2,62,892 per kg.",https://www.livemint.com/rss/markets
"Stocks to buy for short term: Amol Athawale of Kotak Securities shares Nifty 50 outlook, top stock picks",https://www.livemint.com/market/stock-market-news/stocks-to-buy-for-short-term-amol-athawale-of-kotak-securities-shares-nifty-50-outlook-top-stock-picks-11772075887209.html,2026-02-26 08:59:07 IST,"Amol Athawale from Kotak Securities shares valuable insights on the Nifty 50's outlook and highlights three stocks—DCB Bank, Fortis Healthcare, and Mahindra &amp;amp; Mahindra—as potential short-term investments.&amp;nbsp;",https://www.livemint.com/rss/markets
"Clean Max Enviro IPO allotment date likely today. GMP, steps to check share allotment status online",https://www.livemint.com/market/ipo/clean-max-enviro-ipo-allotment-date-likely-today-gmp-steps-to-check-share-allotment-status-online-11772075684395.html,2026-02-26 08:54:26 IST,"Clean Max Enviro IPO allotment date is likely today, February 26. Investors can check Clean Max Enviro IPO allotment status online through the websites of BSE and NSE, along with the official portal of the IPO registrar. MUFG Intime India is the Clean Max Enviro IPO registrar.",https://www.livemint.com/rss/markets
