title,link,published,summary,source
Small-cap stocks bought by FIIs in the March quarter,https://www.livemint.com/market/stock-market-news/fii-buying-smallcap-stocks-march-quarter-foreign-investors-contrarian-bets-nifty-sensex-11775821929292.html,2026-04-11 07:00:31 IST,"Amid all the selling by FIIs in the quarter gone by, these select smallcaps bucked the trend and received buying interest.",https://www.livemint.com/rss/markets
RBI proposals for large NBFCs leaves Tata Sons as only unlisted one,https://www.livemint.com/companies/rbi-proposes-changes-to-nbfc-norms-upper-layer-list-not-revealed-yet-11775816636625.html,2026-04-11 05:45:49 IST,"The RBI has proposed changes to regulations for non-banking financial companies, simplifying criteria for upper layer NBFCs. The status of Tata Sons, which faces internal disagreements among its shareholders on a listing, remains unclear as it had previously surrendered its NBFC licence.",https://www.livemint.com/rss/companies
"Meet broad-based rules while serving AIFs, Sebi clarifies",https://economictimes.indiatimes.com/markets/stocks/news/meet-broad-based-rules-while-serving-aifs-sebi-clarifies/articleshow/130184324.cms,2026-04-11 09:49:42 IST,"In a push to tighten regulations, Sebi has laid down fresh guidelines for asset management companies overseeing alternative investment funds. Each scheme is now required to include at least 20 investors, ensuring that no individual investor exceeds a 25% stake in the fund's total corpus.",https://economictimes.indiatimes.com/markets/stocks/rssfeeds/2146843.cms
D-Street goes green after streak of red,https://economictimes.indiatimes.com/markets/stocks/news/d-street-goes-green-after-streak-of-red/articleshow/130184153.cms,2026-04-11 09:37:03 IST,"After enduring a challenging six-week slump, Indian stock markets made a notable comeback, with the Nifty and Sensex soaring significantly. The positive momentum was fueled by heightened investor enthusiasm surrounding US-Iran ceasefire discussions. This surge not only elevated the market capitalizations of various companies but also attracted foreign portfolio investors as they shifted to net buyers.",https://economictimes.indiatimes.com/markets/stocks/rssfeeds/2146843.cms
Global Funds Flee Indian Stocks at Record Pace on Growth Fears,https://www.livemint.com/market/global-funds-flee-indian-stocks-at-record-pace-on-growth-fears-11775878617032.html,2026-04-11 09:06:56 IST,Global funds are dumping Indian equities at a record clip as an energy shock from the US-Iran war threatens to derail the outlook of the world’s fastest-growing major economy.,https://www.livemint.com/rss/markets
Why is Ola Electric share price skyrocketing in FY27? Explained,https://www.livemint.com/market/stocks-to-buy-today-why-is-ola-electric-share-price-skyrocketing-in-fy27-explained-11775874531785.html,2026-04-11 08:56:33 IST,"Ola Electric share price has skyrocketed from  ₹23.92 apiece to  ₹40.40 per share on the NSE, logging around 70% rise in one month",https://www.livemint.com/rss/markets
"Gold rate today, 11 April 2026: MCX gold logs 2% weekly gain on US-Iran ceasefire buzz. Is it the right time to buy?",https://www.livemint.com/market/commodities/gold-rate-today-11-april-2026-mcx-gold-logs-2-weekly-gain-on-us-iran-ceasefire-buzz-is-it-the-right-time-to-buy-11775869873708.html,2026-04-11 07:40:16 IST,"Gold price today: The MCX gold rate surged from  ₹1,49,650 per 10 gm to  ₹1,52,690 last week, logging a weekly gain for the second straight session",https://www.livemint.com/rss/markets
Kalshi wins reprieve from Arizona criminal case at CFTC’s urging,https://www.livemint.com/companies/news/kalshi-wins-reprieve-from-arizona-criminal-case-at-cftc-s-urging-11775878025828.html,2026-04-11 09:22:02 IST,Kalshi Inc. won a temporary reprieve from criminal prosecution in Arizona when a judge suspended the case at the behest of a federal regulator.,https://www.livemint.com/rss/companies
"Sam Altman's home hit by Molotov cocktail, OpenAI CEO shares rare family photo in first reaction — ‘We try to be…’",https://www.livemint.com/companies/people/sam-altmans-home-hit-by-molotov-cocktail-openai-ceo-shares-rare-family-photo-in-first-reaction-we-try-to-be-11775872359338.html,2026-04-11 07:34:53 IST,"San Francisco police arrested a 20-year-old man for allegedly throwing a Molotov cocktail at Sam Altman's home in the city and for making threats outside the artificial intelligence startup's headquarters, OpenAI said on Friday.",https://www.livemint.com/rss/companies
"Concurrent Gainers: 11 stocks that gained for five straight days, rallying 15–30%",https://economictimes.indiatimes.com/markets/stocks/news/concurrent-gainers-11-stocks-that-gained-for-five-straight-days-rallying-1530/slideshow/130185263.cms,2026-04-11 10:53:13 IST,,https://economictimes.indiatimes.com/markets/stocks/rssfeeds/2146843.cms
"FIIs sell Indian equities worth Rs 48,213 crore in April, so far; FY26 sell-off balloons to Rs 1.79 lakh crore",https://economictimes.indiatimes.com/markets/stocks/news/fiis-sell-indian-equities-worth-rs-48213-crore-in-april-so-far-fy26-sell-off-balloons-to-rs-1-79-lakh-crore/articleshow/130184582.cms,2026-04-11 10:08:25 IST,"Foreign investors continued their significant sell-off in Indian equities, offloading Rs 48,213 crore in April alone. Despite this trend, domestic markets ended Friday with strong gains, buoyed by buying from local institutional investors. Market direction hinges on upcoming US-Iran peace talks, which could impact crude prices and investor sentiment.",https://economictimes.indiatimes.com/markets/stocks/rssfeeds/2146843.cms
Global funds flee Indian stocks at record pace on growth fears,https://economictimes.indiatimes.com/markets/stocks/news/global-funds-flee-indian-stocks-at-record-pace-on-growth-fears/articleshow/130184531.cms,2026-04-11 10:06:02 IST,"Global funds are exiting Indian equities at a record pace, driven by an energy shock from the US-Iran war and a lack of compelling AI-linked investment narratives. This sustained selling has pressured local shares, with over $600 billion wiped off their value from last year's peak, despite strong domestic inflows.",https://economictimes.indiatimes.com/markets/stocks/rssfeeds/2146843.cms
Regulator bars 39 entities for alleged manipulation of RRP Semicon share price,https://economictimes.indiatimes.com/markets/stocks/news/regulator-bars-39-entities-for-alleged-manipulation-of-rrp-semicon-share-price/articleshow/130184461.cms,2026-04-11 10:00:20 IST,"The Securities and Exchange Board of India has intervened in the case of RRP Semiconductor, taking serious measures against 39 entities implicated in suspected stock price manipulation. The regulator discovered a systematic approach that inflated the company's share price beyond sustainable limits.",https://economictimes.indiatimes.com/markets/stocks/rssfeeds/2146843.cms
Guardrails for MFIs need to continue,https://economictimes.indiatimes.com/markets/stocks/news/guardrails-for-mfis-need-to-continue/articleshow/130184371.cms,2026-04-11 09:52:26 IST,"In a recent advisory, Sa-Dhan, a key player in the microfinance arena, underscores the necessity of upholding lending standards for financially vulnerable populations. These standards not only mitigate the risk of over-borrowing but also enhance trust within the financial ecosystem. The microfinance sector continues to demonstrate its resilience amid market fluctuations.",https://economictimes.indiatimes.com/markets/stocks/rssfeeds/2146843.cms
War? Inflation? The market is moving on.,https://www.livemint.com/market/war-inflation-the-market-is-moving-on-11775882374951.html,2026-04-11 10:10:48 IST,The cease-fire announced on Tuesday led to the best day for the stock market in almost exactly a year. But it’s too soon to look past the war.,https://www.livemint.com/rss/markets
Stocks to buy under  ₹100: Mehul Kothari of Anand Rathi recommends three shares to buy or sell,https://www.livemint.com/market/stock-market-news/stocks-to-buy-under-rs-100-mehul-kothari-of-anand-rathi-recommends-three-shares-to-buy-or-sell-11775878511904.html,2026-04-11 10:07:13 IST,"Stocks to buy under  ₹100: Mehul Kothari recommends three shares to buy or sell — Network18, Motherson Sumi Wiring India, and Suzlon Energy",https://www.livemint.com/rss/markets
IBM to pay $17 million as settlement linked to anti-DEI probe — What was the tech major accused of?,https://www.livemint.com/companies/news/ibm-to-pay-17-million-as-settlement-linked-to-anti-dei-probe-what-was-the-tech-major-accused-of-11775878822522.html,2026-04-11 10:00:50 IST,The settlement comes as the first resolution from the US Justice Department's unit formed last year called “Civil Rights Fraud Initiative” to crack down on DEI policies using a civil anti-fraud law.,https://www.livemint.com/rss/companies
725X jump: Sebi bans 39 entities for alleged stock price manipulation in interim order,https://economictimes.indiatimes.com/markets/stocks/news/725x-jump-sebi-bans-39-entities-for-alleged-stock-price-manipulation-in-interim-order/articleshow/130185978.cms,2026-04-11 11:58:55 IST,"Market regulator Sebi has barred 39 individuals and entities from capital markets due to irregularities in RRP Semiconductor. The stock saw a 725-fold jump from Rs 15 to Rs 10,887.10 in 19 months, driven by alleged manipulation and misleading social media information. Sebi also ordered impounding of Rs 2 crore in unlawful gains.",https://economictimes.indiatimes.com/markets/stocks/rssfeeds/2146843.cms
From complexity to clarity: How AI is transforming insurance for customers,https://economictimes.indiatimes.com/markets/stocks/news/from-complexity-to-clarity-how-ai-is-transforming-insurance-for-customers/articleshow/130185935.cms,2026-04-11 11:53:36 IST,"Artificial Intelligence is revolutionizing insurance in India. Customers now start their search online, with AI simplifying complex policies into easy conversations. This technology makes insurance understandable and accessible, even in smaller cities. AI-powered tools handle queries, speed up processes, and personalize recommendations. This shift is crucial for increasing insurance penetration across the nation.",https://economictimes.indiatimes.com/markets/stocks/rssfeeds/2146843.cms
From Panic to Patience: 7 investing lessons from James O’Shaughnessy for today’s turbulent markets,https://economictimes.indiatimes.com/markets/stocks/news/from-panic-to-patience-7-investing-lessons-from-james-oshaughnessy-for-todays-turbulent-markets/articleshow/130185713.cms,2026-04-11 11:33:41 IST,"Amidst global market turmoil driven by inflation and geopolitical risks, veteran investor James O’Shaughnessy’s timeless principles offer a crucial guide. His framework stresses a long-term perspective, a robust process over chasing quick gains, ignoring forecasts, and unwavering discipline.  Mastering behavior, not predicting the future, is key to weathering volatility and achieving lasting wealth.",https://economictimes.indiatimes.com/markets/stocks/rssfeeds/2146843.cms
Why will climbing 25K not be easy for the Nifty 50 index? Explained with 5 reasons,https://www.livemint.com/market/stock-market-news/why-will-climbing-25k-not-be-easy-for-the-nifty-50-explained-with-5-reasons-11775888003734.html,2026-04-11 11:59:22 IST,"Indian stock market: Following a US-Iran ceasefire, the Nifty 50 index rose sharply and decisively broke above the 200-DEMA placed at 23,800",https://www.livemint.com/rss/markets
"Gold, silver rate today, 11 April: Check live price of 24 kt, 22 kt, 18 kt gold and 10 gm, 100 gm, 1 kg silver",https://www.livemint.com/market/commodities/gold-silver-rate-today-11-april-check-live-price-of-24-kt-22-kt-18-kt-gold-and-10-gm-100-gm-1-kg-silver-11775882437063.html,2026-04-11 11:39:39 IST,"Gold, silver rates today, 11 April: Check the live price of gold and silver today in Delhi, Mumbai, Bangalore. Kolkata, Chennai and other major Indian cities.",https://www.livemint.com/rss/markets
Stock market correction: Have domestic inflows changed the rules for Indian equities?,https://www.livemint.com/money/personal-finance/stock-market-correction-have-domestic-inflows-changed-the-rules-for-indian-equities-11775885911945.html,2026-04-11 11:31:34 IST,"For years, foreign institutional investors (FIIs) drove market direction. Now, domestic institutional investors (DIIs), backed by mutual fund and SIP inflows, have taken that role. This shift has quietly changed how markets behave.",https://www.livemint.com/rss/money
"UltraTech Cement, HPCL among 5 stocks Emkay adds to model portfolio; upside seen at 118%",https://economictimes.indiatimes.com/markets/stocks/news/ultratech-cement-hpcl-among-5-stocks-emkay-adds-to-model-portfolio-upside-seen-at-118/slideshow/130186856.cms,2026-04-11 12:57:33 IST,"Emkay has added five stocks including UltraTech Cement and HPCL to its model portfolio, projecting potential upside of up to 118%.",https://economictimes.indiatimes.com/markets/stocks/rssfeeds/2146843.cms
This time it’s different? Why your brain betrays you in a market crash,https://economictimes.indiatimes.com/markets/stocks/news/this-time-its-different-why-your-brain-betrays-you-in-a-market-crash/articleshow/130186709.cms,2026-04-11 12:49:36 IST,"Indian markets are near 2023 highs, yet many stocks lag. Experienced investors express uncertainty about the current downturn, a sentiment the author attributes to Kahneman's 'Two Selves' theory. This psychological concept explains how the 'remembering self' recalls past successes, while the 'experiencing self' feels present fear, leading to the 'this time it's different' fallacy.",https://economictimes.indiatimes.com/markets/stocks/rssfeeds/2146843.cms
"Execution, order inflows to drive L&amp;T growth; BEL rides defence push: Siddhartha Khemka",https://economictimes.indiatimes.com/markets/stocks/news/execution-order-inflows-to-drive-lt-growth-bel-rides-defence-push-siddhartha-khemka/articleshow/130186637.cms,2026-04-11 12:45:46 IST,"India's capital goods sector is experiencing robust growth, fueled by strong order backlogs and increasing project execution across infrastructure, power, and industrial segments. Government focus on development and manufacturing, alongside new-age tech investments, is driving demand. Companies are poised for steady revenue expansion and stable profitability, with key players like L&amp;T and BEL showing strong prospects.",https://economictimes.indiatimes.com/markets/stocks/rssfeeds/2146843.cms
Unique Picks: 8 stocks held by a single MF scheme in March; fall up to 35% in CY26,https://economictimes.indiatimes.com/markets/stocks/news/unique-picks-8-stocks-held-by-a-single-mf-scheme-in-march-fall-up-to-35-in-cy26/slideshow/130186581.cms,2026-04-11 12:25:05 IST,"A set of 8 uniquely held stocks—each owned by just one mutual fund scheme—saw sharp declines of up to 35% in CY26, highlighting concentrated portfolio risks.",https://economictimes.indiatimes.com/markets/stocks/rssfeeds/2146843.cms
"Defence stocks set for mixed Q4; Nuvama bets on BEL, Solar Industries, and a smallcap pick",https://economictimes.indiatimes.com/markets/stocks/news/defence-stocks-set-for-mixed-q4-nuvama-bets-on-bel-solar-industries-and-a-smallcap-pick/articleshow/130186050.cms,2026-04-11 12:23:56 IST,"Defence sector companies anticipate mixed Q4FY26 results despite strong order books. Nuvama Institutional Equities highlights BEL, Data Patterns, and Solar Industries as top picks. While order inflows remain robust, growth momentum is expected to moderate. Defence stocks have seen a strong rebound in April, with further action anticipated following earnings announcements and geopolitical developments.",https://economictimes.indiatimes.com/markets/stocks/rssfeeds/2146843.cms
Buy or sell: Sumeet Bagadia recommends three stocks to buy on Monday — 13 April 2026,https://www.livemint.com/market/stock-market-news/buy-or-sell-sumeet-bagadia-recommends-three-stocks-to-buy-on-monday-13-april-2026-11775891637752.html,2026-04-11 13:54:41 IST,"Buy or sell: Sumeet Bagadia recommends three stocks to buy on Monday — Asian Paints, M&amp;amp;M, and SBI",https://www.livemint.com/rss/markets
Latest FD rates: Top 5 Small Finance Banks of India offer up to 8.10% fixed deposit interest rates — Check inside,https://www.livemint.com/money/personal-finance/latest-fd-rates-top-5-small-finance-banks-of-india-offer-up-to-8-10-fixed-deposit-interest-rates-check-inside-11775888811435.html,2026-04-11 13:11:55 IST,"While all banks have their own fixed deposits, small finance banks often offer significantly better FD interest rates to their customers. Here are the best FD interest rates of 5 most popular small finance banks in India.&amp;nbsp;",https://www.livemint.com/rss/money
FD Investment: How does compounding work? How much will  ₹2 lakh investment become in 3 years? Explained,https://www.livemint.com/money/personal-finance/fd-investment-how-does-compounding-work-how-much-will-2-lakh-investment-become-in-3-years-explained-11775894306456.html,2026-04-11 14:44:18 IST,"Understanding how interest on fixed deposits is compounded helps you maximise returns through strategic planning, tenure selection, and choosing the correct institution as per your requirement.",https://www.livemint.com/rss/money
"Aurobindo Pharma share buyback, Muthoot Fin dividend, 2 other corporate actions next week",https://economictimes.indiatimes.com/markets/stocks/news/aurobindo-pharma-share-buyback-muthoot-fin-dividend-2-other-corporate-actions-next-week/slideshow/130188906.cms,2026-04-11 15:17:52 IST,Aurobindo Pharma’s share buyback and Muthoot Finance’s dividend announcement headline a set of four key corporate actions lined up for the coming week.,https://economictimes.indiatimes.com/markets/stocks/rssfeeds/2146843.cms
"Silver rate today, 11 April: Why you should buy the dip in white metal? Explained",https://www.livemint.com/market/commodities/silver-rate-today-11-april-why-you-should-buy-the-dip-explained-with-crude-oil-us-iran-war-us-fed-rate-cut-11775897222671.html,2026-04-11 15:05:29 IST,"Silver rate today: The MCX silver price shot up from  ₹2,32,600 per kg to  ₹2,43,300, logging a weekly gain of  ₹10,700 or 4.60%",https://www.livemint.com/rss/markets
"ICICI Prudential Mutual Fund declares IDCW payout: What does the option mean? Check date, payout, eligibility &amp; more",https://www.livemint.com/money/personal-finance/icici-prudential-mutual-fund-mf-declares-idcw-what-option-record-date-13-april-2026-payout-amount-who-eligible-investors-11775899385990.html,2026-04-11 15:38:59 IST,"ICICI Prudential Mutual Fund has declared payout under its Income Distribution cum Capital Withdrawal (IDCW) option for its Medium-Term Bond Fund. Check record date, payout amount, availability and other details…",https://www.livemint.com/rss/money
