title,link,published,summary,source
This penny stock under  ₹20 erases 12-month losses with 74% rally in just four sessions,https://www.livemint.com/market/stock-market-news/this-penny-stock-under-rs-20-erases-12-month-losses-with-74-rally-in-just-four-sessions-11766384655895.html,2025-12-22 12:24:24 IST,"TCI Finance has seen a 74% increase in stock price over four sessions, reaching  ₹19.50. The rally, driven by technical factors, has caught investor attention and turned year-to-date losses positive at 5%. The stock is on track for its largest monthly surge since June 2024.",https://www.livemint.com/rss/markets
Small-cap multibagger stock MIC Electronics jumps after receipt of order worth  ₹105 crore under Amrit Bharat Scheme,https://www.livemint.com/market/stock-market-news/small-cap-multibagger-stock-mic-electronics-jumps-after-receipt-of-order-worth-105-crore-under-amrit-bharat-scheme-11766385235550.html,2025-12-22 12:20:28 IST,"Small-cap multibagger stock MIC Electronics surged nearly 2.09% to  ₹44.85 apiece in Monday's trading session after the company announced it has received a LOA variation received from Central Railway Zone, Nagpur division.",https://www.livemint.com/rss/markets
"Shyam Dhani Industries IPO day 1: GMP shows 70% listing pop; subscription status, price, other details of NSE SME IPO",https://www.livemint.com/market/ipo/shyam-dhani-industries-ipo-day-1-gmp-shows-70-listing-pop-subscription-status-price-other-details-of-nse-sme-ipo-11766384545502.html,2025-12-22 12:08:19 IST,"Shyam Dhani Industries IPO day 1: The initial public offering (IPO) of Shyam Dhani Industries opened for public subscription on Monday, December 22. Shyam Dhani Industries IPO GMP was  ₹47 on Monday morning. This indicates the stock could list at a premium of 67% on the NSE SME.",https://www.livemint.com/rss/markets
"For IT companies, will 2026 be a year of healing?",https://www.livemint.com/market/mark-to-market/indian-it-sector-outlook-2026-nifty-it-stocks-indian-it-earnings-accenture-earnings-11766382145042.html,2025-12-22 12:03:18 IST,"Revenue visibility for Q4 remains bleak for IT companies amid prevailing client caution and global macro-economic uncertainty. Plus, Accenture's quarter ending November results is hardly encouraging",https://www.livemint.com/rss/markets
Here's evergreen advice Warren Buffett gave students on ‘seizing big opportunities’ whether in life or investments,https://www.livemint.com/money/personal-finance/warren-buffett-evergreen-money-advice-students-seize-big-opportunity-life-markets-investment-approach-20-slot-punch-card-11766381140595.html,2025-12-22 12:10:36 IST,"Warren Buffett believes that big opportunities are rare and must be seized, but decisions should be well thought out and considered rather than impulsive, if you want to make money.",https://www.livemint.com/rss/money
"IRCTC, Jupiter Wagons, other rail stocks surge up to 15%. Can Union Budget 2026 deliver a boost?",https://economictimes.indiatimes.com/markets/stocks/news/irctc-jupiter-wagons-other-rail-stocks-surge-up-to-15-can-union-budget-2026-deliver-a-boost/articleshow/126117864.cms,2025-12-22 13:36:13 IST,"Railway stocks rallied on December 22 led by IRCTC, Jupiter Wagons, RailTel and RVNL on stock-specific triggers, including fare rationalisation and promoter buying. The bounce follows a weak 2025 for the sector, with hopes now pinned on higher railway capex in Budget 2026–27.",https://economictimes.indiatimes.com/markets/stocks/rssfeeds/2146843.cms
"Japan's Nikkei jumps on weaker yen, renewed AI optimism",https://economictimes.indiatimes.com/markets/stocks/news/japans-nikkei-jumps-on-weaker-yen-renewed-ai-optimism/articleshow/126117283.cms,2025-12-22 12:57:04 IST,"Japan's Nikkei share index surged for a second day. A weaker yen and strong AI investment sentiment fueled the gains. US stocks also rose on positive chipmaker forecasts. SoftBank Group, a key AI investor, saw a significant jump. This positive momentum is now visible in the Japanese market.",https://economictimes.indiatimes.com/markets/stocks/rssfeeds/2146843.cms
Stock picks of the week: 5 stocks with consistent score improvement and an upside potential of up to 30%,https://economictimes.indiatimes.com/markets/stocks/news/stock-picks-of-the-week-5-stocks-with-consistent-score-improvement-and-an-upside-potential-of-up-to-30/articleshow/126116972.cms,2025-12-22 12:49:33 IST,"After staying under pressure for a while, the broader indices, the Nifty and Sensex, as well as market breadth are making a comeback. The questions to ask are: How sustainable will this upmove be? What will market breadth be like during this period? And one thing to be kept in mind: While the bulls are making a comeback, valuations are still high. So, keep an eye on fundamentals and how things are shaping up in the sector.",https://economictimes.indiatimes.com/markets/stocks/rssfeeds/2146843.cms
"Nifty to climb to 29,500 in 2026, ICICI Direct says, picks Bajaj Finance, Bank of Baroda among 7 top bets",https://economictimes.indiatimes.com/markets/stocks/news/nifty-to-climb-to-29500-in-2026-icici-direct-says-picks-bajaj-finance-bank-of-baroda-among-7-top-bets/articleshow/126117081.cms,2025-12-22 12:45:52 IST,"ICICI Direct projects a stronger phase for Indian equities, targeting the Nifty 50 at 29,500 by December 2026, supported by an earnings revival, favourable macro conditions and more reasonable valuations. The brokerage highlights select stock picks and sectors while maintaining a constructive medium-term outlook for the market.",https://economictimes.indiatimes.com/markets/stocks/rssfeeds/2146843.cms
"HCC shares surge over 8%, extend rally for third day after securing major Railways contract",https://economictimes.indiatimes.com/markets/stocks/news/hcc-shares-surge-over-8-extend-rally-for-third-day-after-securing-major-railways-contract/articleshow/126115301.cms,2025-12-22 11:07:40 IST,"Hindustan Construction Company shares climbed for a third straight session after its joint venture secured a Rs 901 crore railway tunnel project from Northeast Frontier Railway. While the order boosted sentiment, technical indicators continue to point to underlying weakness in the stock’s broader trend.",https://economictimes.indiatimes.com/markets/stocks/rssfeeds/2146843.cms
‘You will get very rich with very few ideas..’: Warren Buffett’s simple investment tip for long-term wealth creation,https://www.livemint.com/market/stock-market-news/you-will-get-very-rich-with-very-few-ideas-warren-buffett-s-simple-investment-tip-for-long-term-wealth-creation-11766389723866.html,2025-12-22 13:35:27 IST,"A resurfaced video of Warren Buffett emphasizes that wealth can be built with a few good investments rather than numerous trades. His advice highlights the importance of patience and understanding in investing, advocating for a disciplined approach over constant trading.",https://www.livemint.com/rss/markets
"Why did Rail Vikas Nigam, RailTel Corp and other railway stocks jump up to 5%? Explained",https://www.livemint.com/market/stock-market-news/why-did-rail-vikas-nigam-railtel-corp-and-other-railway-stocks-jump-up-to-5-explained-11766389374136.html,2025-12-22 13:34:16 IST,"Railway stocks saw a rise of 1-5% on December 22 after Indian Railways announced fare hikes effective December 26. The adjustments aim to balance operational costs while limiting passenger impact, generating an estimated  ₹600 crore in additional revenue this fiscal year.",https://www.livemint.com/rss/markets
Mint Explainer | Asset tokenization enters India’s policy spotlight—what it is and why it matters,https://www.livemint.com/market/asset-tokenization-india-explained-policy-regulation-11766384286907.html,2025-12-22 13:31:50 IST,"As global markets move real-world assets such as stocks, gold and real estate onto blockchains, India is beginning to debate how tokenization should be regulated, and what it could mean for investors.",https://www.livemint.com/rss/markets
Sensex's two-day surge raises hopes of Santa Rally. Are sharp gains ahead for Dalal Street in last week of the year?,https://www.livemint.com/market/stock-market-news/sensex-two-day-surge-raises-hopes-of-santa-rally-are-sharp-gains-ahead-for-indian-stock-market-in-last-week-of-year-11766389358218.html,2025-12-22 13:30:11 IST,"The Santa Claus Rally is a seasonal stock market pattern where prices tend recorded by indices amid improved sentiment, lighter volumes, and year-end positioning.",https://www.livemint.com/rss/markets
Infosys to Wipro - IT stocks gain up to 3% on FII inflows. Do you own any?,https://www.livemint.com/market/stock-market-news/infosys-to-wipro-it-stocks-gain-up-to-3-on-fii-inflows-do-you-own-any-11766383512089.html,2025-12-22 13:19:59 IST,"Wipro share price led the pack by rising 3% to  ₹272.22 on December, followed by Infosys shares gaining 2.25% to  ₹1,675.60 on Monday.",https://www.livemint.com/rss/markets
"Shriram to retain board, management control at Shriram Finance after MUFG deal",https://www.livemint.com/companies/news/shriram-finance-mufg-deal-nbfc-banking-india-mitsubishi-ufj-11766378053379.html,2025-12-22 13:27:53 IST,"The deal leverages Shriram’s unique ownership structure, which allows for potential future management control, and its superior return on assets compared to traditional banks.",https://www.livemint.com/rss/companies
"What drove Varun Beverages arm Bevco to acquire South African Twizza for  ₹1,118.7 crore?",https://www.livemint.com/companies/news/varun-beverages-subsidiary-bevco-to-acquire-twizza-rs-1118-crore-enterprise-value-south-africa-franchisee-market-growth-11766382591050.html,2025-12-22 13:25:49 IST,"Varun Beverages has announced the acquisition of South Africa-based Twizza through its subsidiary Bevco for an Enterprise Value of  ₹1,118.7 crore (ZAR 2,095 million) in cash. Here are the factors driving this decision.&amp;nbsp;",https://www.livemint.com/rss/companies
Motilal Oswal Alternates picks minority stake in Sensa Core for $72 mn,https://www.livemint.com/companies/news/motilal-oswal-alternates-investment-sensa-core-funding-medical-diagnostic-equipment-india-11766387162582.html,2025-12-22 13:12:07 IST,Motilal Oswal Alternates' investment will enable Sensa Core to accelerate product development and expand its footprint globally,https://www.livemint.com/rss/companies
European shares steady after record close entering holiday week,https://economictimes.indiatimes.com/markets/stocks/news/european-shares-steady-after-record-close-entering-holiday-week/articleshow/126118888.cms,2025-12-22 14:32:13 IST,"European shares held steady on Monday, with gains in tech and commodity-linked stocks providing support, as investors started ‌a holiday-shortened ‌week on a tepid note following the previous session's record-high close.",https://economictimes.indiatimes.com/markets/stocks/rssfeeds/2146843.cms
"Bajaj Finance, Bank of Baroda among 7 top bets for 2026 by ICICI Direct",https://economictimes.indiatimes.com/markets/stocks/news/bajaj-finance-bank-of-baroda-among-7-top-bets-for-2026-by-icici-direct/slideshow/126118287.cms,2025-12-22 13:55:39 IST,"ICICI Direct expects Indian equities to regain momentum on the back of an earnings recovery and supportive macro conditions, targeting the Nifty 50 at 29,500 by December 2026. The brokerage has identified seven high-conviction stock picks across banking, financials, telecom, IT, real estate and cement, citing valuation comfort and earnings visibility.",https://economictimes.indiatimes.com/markets/stocks/rssfeeds/2146843.cms
"Gurmeet Chadha sees Indian bond yields aligning with developed economies, reveals 5-year portfolio strategy",https://economictimes.indiatimes.com/markets/stocks/news/gurmeet-chadha-sees-indian-bond-yields-aligning-with-developed-economies-reveals-5-year-portfolio-strategy/articleshow/126118205.cms,2025-12-22 13:54:24 IST,"Wealth management expert Gurmeet Chadha has reiterated a structurally positive outlook on India’s economy and markets, citing falling borrowing costs and rising foreign interest. He expects Indian bond yields to decline over the next few years and favours a portfolio heavily weighted towards equities, reflecting confidence in India’s long-term growth prospects.",https://economictimes.indiatimes.com/markets/stocks/rssfeeds/2146843.cms
FIIs backed 12 stocks for 3 quarters; 7 turned multibaggers in CY25. Do you own any?,https://economictimes.indiatimes.com/markets/stocks/news/fiis-backed-12-stocks-for-3-quarters-7-turned-multibaggers-in-cy25-do-you-own-any/slideshow/126118301.cms,2025-12-22 13:49:36 IST,"FIIs quietly raised stakes in select stocks for three straight quarters, with several turning into CY25 multibaggers.",https://economictimes.indiatimes.com/markets/stocks/rssfeeds/2146843.cms
NSE SME stock edges higher following Indian stock market rally. Details here,https://www.livemint.com/market/stock-market-news/nse-sme-stock-cellecor-gadgets-share-price-edges-higher-following-indian-stock-market-rally-details-here-11766393646495.html,2025-12-22 14:46:48 IST,"Cellecor Gadgets' stock rose 2% amid a rally in Indian markets on December 22, driven by a strong rupee and positive global cues. The company announced plans to expand internationally with subsidiaries in the UK and Africa to enhance its global presence.",https://www.livemint.com/rss/markets
"Sundrex Oil Day 1: Latest GMP, subscription status, listing date &amp; other details about SME IPO",https://www.livemint.com/market/stock-market-news/sundrex-oil-day-1-latest-gmp-subscription-status-listing-date-other-details-about-sme-ipo-11766391114507.html,2025-12-22 13:59:03 IST,"Sundrex Oil's IPO opened for bidding today, receiving a healthy response with 0.41 times subscription. The IPO aims to raise  ₹32.25 crore with a price band of  ₹81-86 per share. Allotment is set for December 26, and listing on BSE SME is on December 30.",https://www.livemint.com/rss/markets
"EPW India IPO Day 1: Issue subscribed 10% so far. Here's GMP, price band and other key details",https://www.livemint.com/market/ipo/epw-india-ipo-day-1-issue-subscribed-10-so-far-heres-gmp-price-band-and-other-key-details-11766389931055.html,2025-12-22 13:58:58 IST,"The shares of EPW India IPO is currently at a premium of  ₹0 in the grey market, as per Investorgain. This means that the GMP of EPW India is +0.",https://www.livemint.com/rss/markets
"Small-cap stock under  ₹100 announces open offer at  ₹1.45 per share following preferential allotment, promoter exit",https://www.livemint.com/market/stock-market-news/smallcap-stock-under-rs-100-banganga-paper-reveal-open-offer-at-rs-1-45-following-preferential-allotment-promoter-exit-11766391433313.html,2025-12-22 13:57:17 IST,"Banganga Paper Industries announced a mandatory open offer to acquire 3,47,88,000 equity shares at  ₹1.45 each, representing 100% of public shareholding. The offer, valued at  ₹5.04 crore, follows a board approval for a preferential allotment and strategic corporate actions.",https://www.livemint.com/rss/markets
"'India has best ingredients for growth...', says Ray Dalio on Nikhil Kamath's WTF podcast; here's what makes him bullish",https://www.livemint.com/market/stock-market-news/india-has-best-ingredients-for-growth-says-ray-dalio-on-nikhil-kamaths-wtf-podcast-heres-what-makes-him-bullish-11766391732694.html,2025-12-22 13:56:22 IST,"Billionaire investor Ray Dalio, in a recent podcast with Zerodha co-founder Nikhil Kamath, said that India has all the ingredients to achieve the strongest growth rate and improvement over the next decade.",https://www.livemint.com/rss/markets
PlasmaGen Biosciences secures  ₹150 crore to expand into global markets,https://www.livemint.com/companies/plasmagen-biosciences-fundraise-150-crore-global-markets-exports-vins-bioproducts-minority-stake-biopharma-11766377222481.html,2025-12-22 14:00:21 IST,"The new equity financing will support PlasmaGen Biosciences' international expansion and enhance its portfolio of plasma-derived therapeutics, following a total of  ₹600 crore raised since 2010.",https://www.livemint.com/rss/companies
"Kerala women to get  ₹1000 under Sthree Suraksha Scheme — Apply today! Know eligibility, documents required, more",https://www.livemint.com/money/personal-finance/kerala-women-get-under-sthree-suraksha-scheme-apply-december-22-know-eligibility-documents-required-apploication-status-11766390421592.html,2025-12-22 14:07:14 IST,Application submission for the Kerala government's Sthree Suraksha Scheme has reportedly begun. The state government had earlier released the guidelines and norms related to the implementation of the scheme.,https://www.livemint.com/rss/money
IT stocks rally up to 4% after soft US labour data and benign inflation raise Fed rate cut hopes,https://economictimes.indiatimes.com/markets/stocks/news/it-stocks-rally-up-to-4-after-soft-us-labour-data-and-benign-inflation-raise-fed-rate-cut-hopes/articleshow/126119748.cms,2025-12-22 15:27:11 IST,"IT stocks jumped up to 4% as softer US labour data and easing inflation revived hopes of a Fed rate cut. The Nifty IT index rose over 2% for a fourth straight session, led by Persistent Systems, Infosys, Wipro and Tech Mahindra, as lower borrowing costs are expected to support global tech spending.",https://economictimes.indiatimes.com/markets/stocks/rssfeeds/2146843.cms
"Gujarat Kidney and Super Specialty IPO Day 1: Issue subscribed 90%; GMP, price band and key details",https://economictimes.indiatimes.com/markets/stocks/news/gujarat-kidney-and-super-specialty-ipo-day-1-issue-subscribed-90-gmp-price-band-and-key-details/articleshow/126119581.cms,2025-12-22 15:17:37 IST,"The Gujarat Kidney and Super Specialty IPO received a strong response on its opening day, with 90% subscription led by robust retail participation. While grey market signals point to a steady listing, analysts have flagged valuation concerns and advised caution given the company’s aggressive expansion plans and premium pricing.",https://economictimes.indiatimes.com/markets/stocks/rssfeeds/2146843.cms
"Axis Securities sees Nifty at 28,100 by 2026: Key growth drivers, top 9 stock picks, and 5 sector themes explained",https://economictimes.indiatimes.com/markets/stocks/news/axis-securities-sees-nifty-at-28100-by-2026-key-growth-drivers-top-9-stock-picks-and-5-sector-themes-explained/articleshow/126119388.cms,2025-12-22 15:02:34 IST,"Axis Securities has set a base-case Nifty target of 28,100 for December 2026, expecting markets to shift from valuation-led consolidation to an earnings-driven cycle. Improving macro fundamentals, resilient domestic demand, rising corporate earnings and strong domestic liquidity are seen supporting equities, with a buy-on-dips strategy recommended despite global and currency-related risks.",https://economictimes.indiatimes.com/markets/stocks/rssfeeds/2146843.cms
"BSE shares jump 3% on plans to launch new monthly index options, revamp Bankex",https://economictimes.indiatimes.com/markets/stocks/news/bse-shares-jump-3-on-plans-to-launch-new-monthly-index-options-revamp-bankex/articleshow/126119226.cms,2025-12-22 14:56:33 IST,"BSE shares witnessed an uptick on Monday after an ET report suggested that the exchange plans to launch new monthly index option products and revamp the Bankex index. The move aims to boost BSE’s derivatives market share beyond weekly expiries, with management betting on cheaper monthly options and improved liquidity to deepen trader participation.",https://economictimes.indiatimes.com/markets/stocks/rssfeeds/2146843.cms
"Top Gainers &amp; Losers on Dec 22: Jupiter Wagons, Cochin Shipyard, MCX, Nalco, Trent, Wipro among top gainers today",https://www.livemint.com/market/top-gainers-losers-on-dec-22-jupiter-wagons-cochin-shipyard-mcx-nalco-trent-wipro-among-top-gainers-today-11766398148018.html,2025-12-22 15:44:39 IST,"The Nifty 50 reclaimed 26,000, closing at 26,172, while the Sensex reached 85,567, supported by gains in tech and metal stocks.",https://www.livemint.com/rss/markets
"Sensex jumps over 600 points, investors earn  ₹4 lakh crore in a day— 10 key highlights from Indian stock market today",https://www.livemint.com/market/stock-market-news/sensex-jumps-over-600-points-investors-earn-4-lakh-crore-in-a-day-10-key-highlights-from-indian-stock-market-today-11766396849939.html,2025-12-22 15:33:35 IST,"Extending gains to the second consecutive session, the Sensex ended 638 points, or 0.75%, higher at 85,567.48, while the Nifty 50 closed at 26,172.40, gaining 206 points, or 0.79%. The BSE Midcap index rose by 0.86% and the Smallcap index jumped 1.12%.",https://www.livemint.com/rss/markets
"Gold price to touch $10,000, S&amp;P set for robust gains. Should you bet on this wealth creation opportunity?",https://www.livemint.com/market/commodities/gold-price-to-touch-10-000-s-p-set-for-robust-gains-should-you-bet-for-this-wealth-creation-opportunity-11766393425867.html,2025-12-22 15:22:45 IST,"Market strategist Ed Yardeni forecasts bullish trends for the S&amp;amp;P 500 and gold, predicting both could reach the 10,000 mark by 2029.&amp;nbsp;",https://www.livemint.com/rss/markets
"Exports, the rupee and FII flows: Mirae Asset CIO on what’s driving markets now",https://www.livemint.com/market/stock-market-news/india-markets-exports-rupee-fii-flows-earnimgs-mirae-asset-cio-11766258834957.html,2025-12-22 15:15:26 IST,"As export dynamics shift and foreign investors turn cautious, Mirae Asset CIO Neelesh Surana outlines why earnings visibility, execution and domestic capital now matter more for markets.",https://www.livemint.com/rss/markets
Gold vs Silver: Which precious metal to invest during Christmas 2025?,https://www.livemint.com/market/commodities/gold-vs-silver-which-precious-metal-to-invest-during-christmas-2025-11766392764393.html,2025-12-22 15:11:42 IST,"Currently, the Gold-Silver Ratio (GSR) is at 64-66 levels with Gold at $4449 and Silver $69. On a period comparison of the bullish rally, Gold is already in a 10-year bull run and Silver close to a 5 ½ year rally, calling for a lot of catch-up.",https://www.livemint.com/rss/markets
Small-cap stock under  ₹20 hits upper circuit following bull trend on Dalal Street,https://www.livemint.com/market/stock-market-news/upper-circuit-stocks-small-cap-stock-under-rs-20-hits-upper-circuit-following-bull-trend-on-dalal-street-11766394669291.html,2025-12-22 15:02:24 IST,"Osia Hyper Retail shares hit a 5% upper circuit limit at  ₹17.14, ending a four-day losing streak. Despite this rebound, the stock remains 7% lower for December and has fallen 41% this year, marking its second consecutive year of decline.",https://www.livemint.com/rss/markets
Meesho shares crash 10% to hit lower circuit — Is it an opportunity to buy?,https://www.livemint.com/market/stock-market-news/meesho-shares-crash-10-hit-lower-price-band-is-it-an-opportunity-to-buy-11766395669362.html,2025-12-22 15:02:01 IST,"Meesho shares had hit a record high of  ₹254.65 on Friday, but soon witnessed a selling spree. In Monday's trade, Meesho share price plunged 10% to hit the lower price band of  ₹202.05 on the BSE, taking the two-day losses to over 14%.",https://www.livemint.com/rss/markets
NSEL investors to urge Finance Ministry for faster execution of OTS,https://www.livemint.com/companies/news/nsel-investors-to-urge-finance-ministry-for-faster-execution-of-ots-11766396987925.html,2025-12-22 15:19:47 IST,NSEL investors to urge Finance Ministry for faster execution of OTS,https://www.livemint.com/rss/companies
Deccan Gold begins production trials at Kyrgyzstan gold project,https://www.livemint.com/companies/news/deccan-gold-begins-production-trials-at-kyrgyzstan-gold-project-11766396679704.html,2025-12-22 15:14:39 IST,"India's Deccan Gold Mines Ltd said on Monday that it has begun pre-commissioning trials at its Altyn Tor Gold Project in Kyrgyzstan, marking a key step toward full-scale gold production and advancing one of India's first overseas gold mining investments, according to an official statement.",https://www.livemint.com/rss/companies
"Who is Anand Varadarajan? The Indian-origin, 18-yr Amazon veteran appointed as Starbucks new executive VP and CTO",https://www.livemint.com/companies/news/anand-varadarajan-who-indian-origin-18-yr-amazon-veteran-appointed-new-starbucks-executive-vp-cto-brian-niccol-11766387755016.html,2025-12-22 15:10:20 IST,"Starbucks has appointed Indian-origin Anand Varadarajan as its new executive vice president and chief technology officer, effective January 19. He brings nearly 20 years of experience from Amazon and will succeed Deb Hall Lefevre who retired in September.",https://www.livemint.com/rss/companies
"Private Equity investment in India slows in 2025, but long-term outlook remains strong: KPMG",https://www.livemint.com/companies/news/private-equity-investment-in-india-slows-in-2025-but-long-term-outlook-remains-strong-kpmg-11766395873282.html,2025-12-22 15:01:12 IST,"In a report titled Pulse of private equity Q3'25 KPMG, a quarterly analysis of global private equity activity, KPMG said as of the end of Q3 of 2025, PE investment in India was just $14.9 billion across 217 deals, compared to $26.3 billion across 289 deals during all of 2024.",https://www.livemint.com/rss/companies
