title,link,published,summary,source
GIFT Nifty jumps 700 points as Trump agrees to two-week ceasefire; here's the trading setup for today's session,https://economictimes.indiatimes.com/markets/stocks/news/pre-market-action-heres-the-trade-setup-for-todays-session/articleshow/130099741.cms,2026-04-08 06:38:14 IST,"Benchmark indices extended gains for the fourth consecutive session, supported by a marginal cooling in crude oil prices. Stocks are expected to react to the RBI monetary policy and geopolitical developments, with volatility likely to remain elevated. India VIX fell 3.3% to 24.70 levels.",https://economictimes.indiatimes.com/markets/stocks/rssfeeds/2146843.cms
"Stocks in news: Torrent Power, GAIL, J&amp;K Bank, Ola Electric, Vedanta, Infosys",https://economictimes.indiatimes.com/markets/stocks/news/stocks-in-news-torrent-power-gail-jk-bank-ola-electric-vedanta-infosys/articleshow/130099706.cms,2026-04-08 06:33:51 IST,"Markets ended higher for the third consecutive session amidst volatility. Today's trade will focus on ceasefire developments and the MPC meeting's commentary. Key stocks in focus include Torrent Power, GAIL, J&amp;K Bank, Ola Electric, Vedanta, and Infosys due to various corporate actions and news.",https://economictimes.indiatimes.com/markets/stocks/rssfeeds/2146843.cms
"These 8 private and public banking stocks have an upside of up to 28% in one year, according to analysts",https://economictimes.indiatimes.com/markets/stocks/news/these-8-private-and-public-banking-stocks-have-an-upside-of-up-to-28-in-one-year-according-to-analysts/articleshow/130099572.cms,2026-04-08 06:23:49 IST,"The markets will react to the two-week conditional ceasefire announced by US President Trump and accepted by Iran, also conditionally. There are still many missteps that might occur and it remains to be seen how freely Iran permits ships to pass through the Strait of Hormuz. And, most importantly for the Indian markets, how crude oil prices react. Check out Stock Reports Plus, powered by Refinitiv, for price targets of over 4,000 listed stocks along with detailed company analysis focusing on five key components ,earnings, fundamentals, relative valuation, risk, and price momentum, to generate standardised scores. SR+ Reports is a complimentary offering to ETPrime members.",https://economictimes.indiatimes.com/markets/stocks/rssfeeds/2146843.cms
"Market bets on Aurobindo as Europe, US sales show uptick",https://economictimes.indiatimes.com/markets/stocks/news/market-bets-on-aurobindo-as-europe-us-sales-show-uptick/articleshow/130099598.cms,2026-04-08 06:16:02 IST,Aurobindo Pharma stock is performing well.  Sales in Europe are improving. New products are launching in the US.  The company is also developing weight loss drugs.  Future growth will come from more product launches and a recent acquisition.  Backward integration projects are also boosting profitability.  The company expects strong earnings growth.,https://economictimes.indiatimes.com/markets/stocks/rssfeeds/2146843.cms
"Visa's India, South Asia head Sandeep Ghosh to quit",https://economictimes.indiatimes.com/markets/stocks/news/visas-india-south-asia-head-sandeep-ghosh-to-quit/articleshow/130099577.cms,2026-04-08 06:12:24 IST,"Sandeep Ghosh, Visa's India and South Asia head, is stepping down after more than four years to pursue an external opportunity. His departure occurs as the payments company intensifies its focus on digital payments and regional partnerships. A successor has been identified and will be announced shortly to ensure a seamless transition.",https://economictimes.indiatimes.com/markets/stocks/rssfeeds/2146843.cms
IndiaFirst deal with BNP Cardif hits a UBI pact hurdle,https://economictimes.indiatimes.com/markets/stocks/news/indiafirst-deal-with-bnp-cardif-hits-a-ubi-pact-hurdle/articleshow/130099558.cms,2026-04-08 06:07:16 IST,IndiaFirst Life's proposed stake sale to BNP Paribas Cardif is delayed. Union Bank of India has exited its corporate agency tie-up with IndiaFirst Life. This development impacts the deal closure and growth visibility. Bancassurance is a key business driver for IndiaFirst Life. Discussions are continuing regarding the renewal of the agreement.,https://economictimes.indiatimes.com/markets/stocks/rssfeeds/2146843.cms
JPMorgan assigns overweight tag to Hindalco and Vedanta,https://economictimes.indiatimes.com/markets/stocks/news/jpmorgan-assigns-overweight-tag-to-hindalco-and-vedanta/articleshow/130099468.cms,2026-04-08 05:45:30 IST,"JPMorgan has upgraded Hindalco Industries and Vedanta Limited to 'overweight', setting price targets of ₹1,125 and ₹850 respectively. The brokerage anticipates a sustained upcycle in aluminium prices due to supply disruptions, particularly from the West Asia conflict, predicting a sharp tightening of ex-China aluminium markets.",https://economictimes.indiatimes.com/markets/stocks/rssfeeds/2146843.cms
"D-Street shows trust in IT resilience, stocks gain ahead of Q4 results",https://economictimes.indiatimes.com/markets/stocks/news/d-street-shows-trust-in-it-resilience-stocks-gain-ahead-of-q4-results/articleshow/130099446.cms,2026-04-08 05:42:32 IST,"Traders are exhibiting unexpected confidence in IT stocks ahead of the Q4 results season, cutting bearish bets and initiating long positions. This shift is driven by expectations of a slowdown in AI adoption, coupled with attractive valuations and oversold conditions, signaling a potential contrarian opportunity for the sector.",https://economictimes.indiatimes.com/markets/stocks/rssfeeds/2146843.cms
Stock Radar: Aurobindo Pharma stock hits fresh 52-week high in April; time to buy or book profits?,https://economictimes.indiatimes.com/markets/stocks/news/stock-radar-aurobindo-pharma-stock-hits-fresh-52-week-high-in-april-time-to-buy-or-book-profits/articleshow/130086208.cms,2026-04-08 05:00:00 IST,"Aurobindo Pharma stock is showing strong upward momentum. Experts suggest buying the stock for a target of Rs 1,496 in the coming weeks. The stock has hit a 52-week high and is trading above key moving averages. Technical indicators point to sustained trend strength and potential outperformance.",https://economictimes.indiatimes.com/markets/stocks/rssfeeds/2146843.cms
Lenders' fields may yield less as collections wilt in summer,https://economictimes.indiatimes.com/markets/stocks/news/lenders-fields-may-yield-less-as-collections-wilt-in-summer/articleshow/130099538.cms,2026-04-08 00:57:21 IST,"""Collections fell by about two percentage points last summer, and we expect a similar dip this year,"" said the head of a non-bank lender, who did not wish to be identified. ""Field visits will reduce, and some customers may seek deferments as business activity slows. Collection should normalise once temperatures ease.""",https://economictimes.indiatimes.com/markets/stocks/rssfeeds/2146843.cms
"Korean Stocks, Won Surge After Iran Ceasefire Brings Relief",https://www.livemint.com/market/korean-stocks-won-surge-after-iran-ceasefire-brings-relief-11775613451304.html,2026-04-08 07:27:30 IST,"South Korean assets surged after President Donald Trump agreed to a two-week ceasefire with Iran, easing fears of prolonged disruptions to global energy supplies and triggering a broad risk-on move.",https://www.livemint.com/rss/markets
"Nifty 50, Sensex prediction today: Check how Indian stock market is expected to trade on 8 April amid US-Iran ceasefire",https://www.livemint.com/market/stock-market-news/nifty-50-sensex-prediction-today-check-how-indian-stock-market-is-expected-to-trade-on-8-april-amid-us-iran-ceasefire-11775580489395.html,2026-04-08 07:23:10 IST,"Nifty 50, Sensex prediction today: The trends on Gift Nifty also indicate a gap-up start for the Indian benchmark index. The Gift Nifty was trading around 23,840 level, a premium of nearly 689 points from the Nifty futures’ previous close.",https://www.livemint.com/rss/markets
"US-Iran war: Can crude oil price crash enable Nifty 50 to climb 25,000?",https://www.livemint.com/market/stock-market-news/crude-oil-price-crashes-amid-us-iran-truce-hopes-can-nifty-50-hit-25-000-indian-stock-market-to-see-a-sustained-rally-11775610396913.html,2026-04-08 07:17:44 IST,"With the recent US-Iran ceasefire leading to a significant drop in crude oil prices, market analysts predict a potential surge in Nifty 50. Will the stability in oil prices lead to a bullish market?",https://www.livemint.com/rss/markets
"From Gift Nifty, US-Iran ceasefire to crude oil prices: 7 key things that changed for Indian stock market overnight",https://www.livemint.com/market/stock-market-news/from-gift-nifty-us-iran-ceasefire-to-crude-oil-prices-7-key-things-that-changed-for-indian-stock-market-overnight-11775580769169.html,2026-04-08 07:10:09 IST,"Gift Nifty was trading around 23,830 level, a premium of nearly 679 points from the Nifty futures’ previous close, indicating a gap-up start for the Indian stock market indices.",https://www.livemint.com/rss/markets
"RBI MPC meeting: Date, time, where &amp; how to watch Governor Sanjay Malhotra's policy address",https://www.livemint.com/market/stock-market-news/rbi-mpc-meeting-date-time-where-how-to-watch-governor-sanjay-malhotras-policy-address-11775610799707.html,2026-04-08 07:05:17 IST,"RBI Governor Sanjay Malhotra is set to announce the outcome of the three-day meeting today. Check the date, time and where to watch the upcoming RBI MPC outcome, along with expectations.",https://www.livemint.com/rss/markets
"Gold, silver rates today: Gold prices climb to $4,800, silver prices surge 7% to $76 after de-escalation in US-Iran war",https://www.livemint.com/market/commodities/gold-silver-rates-today-gold-prices-climb-to-4-800-silver-prices-surge-7-to-76-after-de-escalation-in-us-iran-war-11775608644366.html,2026-04-08 06:47:12 IST,"Gold, silver rates today: Gold prices have dropped around 10%, and silver prices have declined over 17% since the conflict started at the end of February. Here's the near-term outlook for both precious metals.",https://www.livemint.com/rss/markets
RBI MPC Meeting 2026 LIVE: Sanjay Malhotra-led MPC likely to keep repo rate steady amid inflation worries,https://www.livemint.com/market/stock-market-news/rbi-mpc-meeting-2026-live-updates-sanjay-malhotra-repo-rate-cut-interest-rate-monetary-policy-latest-news-8-april-2026-11775580959588.html,2026-04-08 06:34:15 IST,"RBI MPC Meeting 2026 LIVE: RBI’s Monetary Policy Committee (MPC) is expected to keep repo rates unchanged at 5.25%, and maintain policy stance at ‘Neutral’. Economists expect the tone of the MPC to be cautious amid fears of an uptick in domestic inflation and slowing economic growth in FY27.",https://www.livemint.com/rss/markets
US stock market: Dow Jones futures rally 2% as Trump extends Strait of Hormuz deadline for two weeks,https://www.livemint.com/market/stock-market-news/us-stock-market-dow-jones-futures-rally-2-as-trump-extends-strait-of-hormuz-deadline-for-two-weeks-11775608807415.html,2026-04-08 06:32:51 IST,US stock market: Dow Jones futures has surged nearly 2% during the early morning dealings in the Asian markets today,https://www.livemint.com/rss/markets
"US-Iran Ceasefire to Fuel Asia Relief Rally, Strategists Say",https://www.livemint.com/market/usiran-ceasefire-to-fuel-asia-relief-rally-strategists-say-11775608781421.html,2026-04-08 06:09:40 IST,"Donald Trump’s announcement of a two-week ceasefire between the US and Iran brings welcome relief to Asian markets, according to strategists. Equities should see strong rallies across the region in the near term, they say.",https://www.livemint.com/rss/markets
The most undervalued CDMO stocks in India to watch,https://www.livemint.com/market/stock-market-news/undervalued-cdmo-stocks-india-investment-opportunities-analysis-11775567310578.html,2026-04-08 06:00:39 IST,"Within pharma, the CDMO segment is touted as the fastest-growing. Here are some undervalued companies in this space to track.",https://www.livemint.com/rss/markets
Stocks to trade: Raja Venkatraman recommends five stocks for 8 April,https://www.livemint.com/market/stock-market-news/stocks-to-trade-raja-venkatraman-marketsmith-recommend-five-stocks-for-8-april-11775569023904.html,2026-04-08 06:00:39 IST,Market expert Raja Venkatraman shares his top stock picks for 8 April. Here’s his technical outlook and trade strategy.,https://www.livemint.com/rss/markets
Stock recommendations for 8 April from MarketSmith India,https://www.livemint.com/market/stock-market-news/stock-recommendations-8-april-marketsmith-india-11775568214416.html,2026-04-08 06:00:20 IST,"MarketSmith India reveals its top stock recommendations for today, 8 April. Get expert insights into the best-performing stocks to guide your investment decisions.",https://www.livemint.com/rss/markets
Multi-asset is how PMS firms spell ‘diversification’ as rich clients leave behind advisory services,https://www.livemint.com/market/india-wealth-managers-portfolio-pms-multi-asset-diversification-mutual-funds-bond-commodities-11775537024025.html,2026-04-08 06:00:19 IST,"The rise of multi-asset models among Indian wealth managers marks a response to investor demand for diversified portfolios. This approach combines mutual funds, bonds, and commodities—a shift away from traditional advisory models. Learn more in Mint-only conversations with India's top PMS firms.",https://www.livemint.com/rss/markets
FTSE Confirms Vietnam’s Upgrade to Emerging Market in September,https://www.livemint.com/market/ftse-confirms-vietnam-s-upgrade-to-emerging-market-in-september-11775607924974.html,2026-04-08 05:55:24 IST,"Vietnam will be included in FTSE Russell’s secondary emerging markets group for the first time, propelling one of Asia’s fastest growing economies into the same league as China, India and Indonesia.",https://www.livemint.com/rss/markets
"Crude oil prices crash after US-Iran ceasefire deal; Brent, WTI oil below $100 a barrel",https://www.livemint.com/market/commodities/crude-oil-prices-crash-after-us-iran-ceasefire-deal-wti-oil-below-100-a-barrel-11775606663588.html,2026-04-08 05:36:12 IST,"The Strait of Hormuz transits about a fifth of the world’s oil and liquefied natural gas. The near-closure of the Strait due to the US-Iran war has roiled energy markets, with WTI still up about 40% since the conflict started at the end of February.",https://www.livemint.com/rss/markets
China Bank Stocks Emerge as Haven as Iran War Jolts Markets,https://www.livemint.com/market/china-bank-stocks-emerge-as-haven-as-iran-war-jolts-markets-11775606211018.html,2026-04-08 05:26:50 IST,"Chinese bank shares have outpaced the broader market since the war in Iran broke out, with attractive dividend yields and improving earnings prospects likely to provide further tailwinds, according to analysts.",https://www.livemint.com/rss/markets
"Travel shifts could favour India amid global turmoil, says Minor Hotels founder Heinecke",https://www.livemint.com/companies/news/minor-hotels-tourism-india-hospitality-industry-west-asia-war-11775555468836.html,2026-04-08 06:00:59 IST,"Minor Hotels is expanding in India, adapting to the growing domestic travel market and aims to balance city and leisure offerings, leveraging its diverse brands for global travellers.",https://www.livemint.com/rss/companies
"KreditBee raises $280 million, enters the unicorn club",https://www.livemint.com/companies/kreditbee-raises-280-million-unicorn-club-11775572959080.html,2026-04-08 06:00:20 IST,"KreditBee has raised $280 million in Series E funding, valued at $1.5 billion and becoming a unicorn. The majority of the funds will be used to grow its lending portfolio and explore new financial services, reflecting strong investor confidence.",https://www.livemint.com/rss/companies
"As India's hospitality market hots up, hotel chains race to flag new hotels",https://www.livemint.com/companies/news/india-and-global-hospitality-hotel-management-chains-add-550-new-hotels-across-india-2025-11775549085054.html,2026-04-08 05:55:19 IST,"Data from hotel chains and consultancies shows at least three companies have signed over a dozen hotels this year, riding the domestic tourism boom and demand for branded experiences.",https://www.livemint.com/rss/companies
"Tata Trusts CEO defends action after Srinivasan, Singh accuse him of bias",https://www.livemint.com/companies/people/tata-trusts-ceo-siddharth-sharma-defends-action-after-venu-srinivasan-vijay-singh-accuse-him-of-bias-11775571241524.html,2026-04-08 05:50:59 IST,"Siddharth Sharma says he and Noel Tata felt a legal opinion was not equal to a judicial pronoucement, and hence decided to ask Venu Srinivasan and Vijay Singh if they wanted to step down",https://www.livemint.com/rss/companies
Tata's Agratas taps banks for $730 mn loans to power giga plans,https://www.livemint.com/companies/tata-group-agratas-lithium-ion-cell-battery-bank-loan-funding-air-india-tata-electronics-11775557673142.html,2026-04-08 05:45:39 IST,"Agratas is the latest Tata firm to close in on $1 billion funding for its project, with the group’s three other new ventures Air India, Tata Digital and Tata Electronics having already crossed $1 billion infusion from the parent firm.",https://www.livemint.com/rss/companies
Applied Materials looks to ramp up investment in India’s deep-tech startups,https://www.livemint.com/companies/start-ups/applied-materials-india-deep-tech-investment-semiconductor-manufacturing-ecosystem-growth-11775569223822.html,2026-04-08 05:30:59 IST,"Applied Materials is spending more time tracking opportunities in India than before, as policy support and early-stage investments are beginning to translate into a stronger pipeline of startups.",https://www.livemint.com/rss/companies
