title,link,published,summary,source
"CarTrade Tech share price gains after UBS assigns ‘Buy’ call, sees over 42% upside potential",https://www.livemint.com/market/stock-market-news/cartrade-tech-share-price-gains-after-ubs-assigns-buy-call-sees-over-42-upside-potential-11783917488921.html,2026-07-13 10:12:53 IST,"CarTrade Tech share price has risen 19% in one month, and has gained 56% in three months. The stock has rallied 48% in one year, and has delivered multibagger returns of 237% in two years and 443% over the past three years.",https://www.livemint.com/rss/markets
"Stocks to buy or sell: Dharmesh Shah of ICICI Sec suggests buying Shriram Finance, Brigade Enterprise on 13 July",https://www.livemint.com/market/stock-market-news/stocks-to-buy-or-sell-dharmesh-shah-of-icici-sec-suggests-buying-shriram-finance-brigade-enterprise-on-13-july-11783915650685.html,2026-07-13 09:52:55 IST,"Indian benchmark indices fell on Monday as tensions in the Middle East and Iran's claim of closing the Strait of Hormuz dampened sentiment. Nifty 50 declined 0.69%, and BSE Sensex dropped 0.78%, with all sector indices in negative territory amidst rising crude oil prices.",https://www.livemint.com/rss/markets
HCL Tech share price edges higher ahead of Q1 results 2026. Should you buy or sell?,https://www.livemint.com/market/stock-market-news/hcl-tech-share-price-edges-higher-ahead-of-q1-results-2026-should-you-buy-or-sell-11783914941502.html,2026-07-13 09:34:48 IST,"HCL Technologies share price surged as much as 0.61% to  ₹1,171.20 apiece in Monday's trading session ahead of the company's financial results announcement.",https://www.livemint.com/rss/markets
"Avenue Supermarts share price slips over 4% after Q1 results. Should you buy, sell or hold DMart shares?",https://www.livemint.com/market/stock-market-news/avenue-supermarts-share-price-slips-over-4-after-q1-results-should-you-buy-sell-or-hold-the-dmart-stock-11783915039006.html,2026-07-13 09:32:21 IST,"Avenue Supermarts reported an 11.3% year-on-year rise in consolidated net profit to  ₹860.6 crore in the quarter ended June 2026, while the company’s revenue grew 14.9% YoY to  ₹18,794 crore.",https://www.livemint.com/rss/markets
"Sensex crashes over 700 points, India VIX jumps 10%; 5 key factors driving the stock market down explained",https://www.livemint.com/market/stock-market-news/sensex-crashes-over-700-points-india-vix-jumps-10-5-key-factors-driving-the-stock-market-down-explained-11783914963080.html,2026-07-13 09:29:21 IST,"The Sensex dropped over 700 points, or nearly 1%, to an intraday low of 76,857, while the Nifty 50 shed more than 200 points, or nearly 1%, to an intraday low of 24,000.",https://www.livemint.com/rss/markets
"Gold price drops 1%, silver rates crash over 2% on MCX as inflation fears, rate hike concerns revive",https://www.livemint.com/market/commodities/gold-price-drops-1-silver-rates-crash-over-2-on-mcx-as-inflation-fears-rate-hike-concerns-revive-11783912345951.html,2026-07-13 09:07:51 IST,"MCX gold August futures declined over 1% to  ₹1,41,820 per 10 grams, while MCX silver September futures crashed more than 2% to  ₹2,17,448 per kg in early deals after crude oil prices jumped 4%, driving the dollar index higher.",https://www.livemint.com/rss/markets
Rupee slips 37 paise to open at 95.70 against US dollar,https://www.livemint.com/market/stock-market-news/rupee-slips-37-paise-to-open-at-95-70-against-us-dollar-11783913684375.html,2026-07-13 09:06:34 IST,"The Indian rupee fell 37 paise to 95.70 against the dollar due to escalating US-Iran conflict and rising crude oil prices, increasing concerns about India's import costs. Experts predict the rupee remains under pressure amid geopolitical tensions and market volatility in oil prices.",https://www.livemint.com/rss/markets
Laser Power IPO Day 3: Issue booked 2.72x so far. GMP hints 16% listing gain. Should you apply or skip?,https://www.livemint.com/market/ipo/laser-power-and-infra-ipo-gmp-laser-power-ipo-gmp-laser-power-ipo-subscription-status-laser-power-ipo-review-laser-11783911145853.html,2026-07-13 08:43:18 IST,"The Laser Power IPO opened on 9 July and will close on 13 July, with shares priced between  ₹205–214. The company aims to raise  ₹742 crore, allocating 50% for QIBs, and 15% for NIIs. Listing is expected on 16 July.",https://www.livemint.com/rss/markets
Q1 results 2026: HCL Tech to ICICI Prudential AMC among companies to declare Q1 results today; full list here,https://www.livemint.com/market/stock-market-news/q1-results-2026-hcl-tech-to-icici-prudential-amc-among-companies-to-declare-q1-results-today-full-list-here-11783910770504.html,2026-07-13 08:34:43 IST,"Q1 results 2026: HCL Technologies, Bajaj Consumer Care, ICICI Prudential Asset Management Company, and Nuvoco Vistas Corporation are among the companies to declare their Q1 results FY27 on Monday.",https://www.livemint.com/rss/markets
US stock market to Kospi: Here’s world equity heatmap you should know before opening of the Indian stock market today,https://www.livemint.com/market/stock-market-news/us-stock-market-to-kospi-here-s-world-equity-heatmap-you-should-know-before-opening-of-the-indian-stock-market-today-11783911043902.html,2026-07-13 08:29:07 IST,"US stock market to Kospi: Global market cues remained weak, with investors shifting towards risk-off assets after crude oil prices surged sharply following renewed geopolitical tensions.",https://www.livemint.com/rss/markets
Vaishali Parekh recommends three intraday stocks to buy or sell on Monday — 13 July 2026,https://www.livemint.com/market/stock-market-news/vaishali-parekh-recommends-three-intraday-stocks-to-buy-or-sell-on-monday-13-july-2026-11783909325929.html,2026-07-13 08:13:07 IST,"Buy or sell stocks, 13 July 2026: Vaishali Parekh recommends three stocks to buy today — Astral, Apl Apollo Tubes and Sammaan Capital.",https://www.livemint.com/rss/markets
"Stock market today: Gift Nifty hints a gap-down start; eight day trading stocks to buy on Monday, 13 July",https://www.livemint.com/market/stock-market-news/stock-market-today-gift-nifty-hints-a-gap-down-start-eight-day-trading-stocks-to-buy-on-monday-13-july-11783907165958.html,2026-07-13 08:12:02 IST,"Indian benchmark indices are expected to begin Monday weaker, influenced by global cues and rising crude oil prices due to renewed US-Iran tensions. Despite this, domestic equities closed strong on Friday, with the BSE Sensex and NSE Nifty 50 rising significantly amid cautious investor sentiment.",https://www.livemint.com/rss/markets
"Stocks to buy for short term: Swiggy, Tata Power among 3 shares Anand Rathi's Jigar Patel recommends for next 1-2 weeks",https://www.livemint.com/market/stock-market-news/stocks-to-buy-for-short-term-swiggy-tata-power-among-3-shares-anand-rathis-jigar-patel-recommends-for-next-1-2-weeks-11783840393460.html,2026-07-13 08:00:33 IST,"Stocks to buy for the short term: Anand Rathi's Jigar Patel highlights Swiggy and Tata Power as top stock picks for the next 1-2 weeks, backed by improving technical indicators and bullish momentum.&amp;nbsp;",https://www.livemint.com/rss/markets
Income tax penalties explained: What happens if you under-report income or miss ITR filing,https://www.livemint.com/money/personal-finance/income-tax-penalties-explained-what-happens-if-you-under-report-income-or-miss-itr-filing-11783919201441.html,2026-07-13 10:50:30 IST,"Taxpayers can face late filing fees, interest and penalties for different types of income tax defaults. Here's a simple guide to the key provisions under the Income Tax Act and what they could cost you.",https://www.livemint.com/rss/money
India-UK social security pact: How EPF savings will benefit Indian professionals working in the UK,https://www.livemint.com/money/personal-finance/indiauk-social-security-pact-how-epf-savings-will-benefit-indian-professionals-working-in-the-uk-11783915906706.html,2026-07-13 10:49:57 IST,"From 15 July, the India-UK Double Contribution Convention Agreement will allow eligible Indian professionals on temporary UK assignments to continue building EPF savings in India instead of paying towards UK social security contributions.&amp;nbsp;",https://www.livemint.com/rss/money
EPF interest 2025-26: Why your PF earns interest every month but gets credited once a year,https://www.livemint.com/money/personal-finance/epf-interest-2025-26-why-your-pf-earns-interest-every-month-but-gets-credited-once-a-year-11783916127953.html,2026-07-13 09:52:08 IST,"While EPFO calculates interest on your provident fund every month, it credits the accumulated amount only after the end of the financial year.",https://www.livemint.com/rss/money
"Gold, silver prices today, 13 July: Check retail rates of 24K, 22K gold, 999 silver in Delhi, Mumbai and Kolkata",https://www.livemint.com/money/personal-finance/gold-silver-prices-today-13-july-check-retail-rates-of-24k-22k-gold-999-silver-in-delhi-mumbai-and-kolkata-11783907174242.html,2026-07-13 09:43:05 IST,"Gold and silver prices today, 13 July: Check the latest 24K, 22K gold and 999 silver retail rates across Delhi, Mumbai, Kolkata and other major Indian cities, along with MCX market updates, along with other important geopolitical updates.",https://www.livemint.com/rss/money
Annapurna Yojana: West Bengal may allow rejected applicants to edit forms instead of reapplying,https://www.livemint.com/money/personal-finance/annapurna-yojana-west-bengal-may-allow-rejected-applicants-to-edit-forms-instead-of-reapplying-11783911755189.html,2026-07-13 09:23:05 IST,"West Bengal may soon allow corrections for 27.8 lakh rejected Annapurna Yojana applications. The proposed edit facility will help applicants fix Aadhaar, mobile and data errors, resubmit forms and improve chances of receiving welfare benefits under the state scheme.",https://www.livemint.com/rss/money
