title,link,published,summary,source
"Value 360 Communications IPO day 1: Issue subscribed 3% so far. Check GMP, status and other key details",https://www.livemint.com/market/ipo/value-360-communications-ipo-day-1-issue-subscribed-3-so-far-check-gmp-status-and-other-key-details-11777880682816.html,2026-05-04 14:23:11 IST,The shares of Value Communications IPO are commanding a premium of  ₹0 in the grey market. This means that the GMP of Value Communications IPO is +0.,https://www.livemint.com/rss/markets
Himadri Speciality shares jump 6% to hit a 52-week high after a 38% rise in April amid focus on revenue growth,https://www.livemint.com/market/stock-market-news/himadri-speciality-shares-jump-6-to-hit-a-52-week-high-gains-38-in-april-amid-focus-on-revenue-growth-11777882340389.html,2026-05-04 13:55:17 IST,"Himadri Speciality Chemicals shares surged 6% to reach a 52-week high, driven by a 38% increase in April. With plans to double profits by FY28 and expand into high-margin segments, the company is set to redefine its market position and reduce India's import dependence in key chemical sectors.",https://www.livemint.com/rss/markets
"Aluminium up, cement down: geopolitics drives sector rotation",https://www.livemint.com/market/stock-market-news/aluminium-up-cement-down-geopolitics-drives-sector-rotation-energy-costs-global-metals-11777871909720.html,2026-05-04 13:34:48 IST,"Energy costs and supply shocks drive a divergence between global metals and domestic plays, with analysts flagging a potential reversal if tensions ease.",https://www.livemint.com/rss/markets
"Vodafone Idea, HFCL, Meesho, JP Power, BHEL among the most traded stocks today, 4 May 2026",https://www.livemint.com/market/stock-market-news/vodafone-idea-hfcl-meesho-jp-power-bhel-among-the-most-traded-stocks-today-4-may-2026-11777878609589.html,2026-05-04 13:22:56 IST,"Most traded stocks today: Vodafone Idea, HFCL, Meesho, Jaiprakash Power Ventures (JP Power), Bharat Heavy Electricals (BHEL), and Vedanta were the most traded stocks, or the most active stocks in terms of volume, on the NSE.",https://www.livemint.com/rss/markets
Sebi urges GST Council to fix tax issues in commodity derivatives,https://www.livemint.com/market/commodities/sebi-urges-gst-council-to-fix-tax-issues-in-commodity-derivatives-11777878826569.html,2026-05-04 13:19:35 IST,The regulator has also proposed an integrated GST mechanism for physically delivered commodity derivatives.,https://www.livemint.com/rss/markets
Why Avenue Supermarts may find it challenging to maintain margin,https://www.livemint.com/market/mark-to-market/avenue-supermarts-share-price-avenue-supermarts-q4fy26-dmart-stores-quick-commerce-india-11777877735254.html,2026-05-04 13:04:11 IST,"After dropping 5% on Monday following Q4 results, Avenue Supermarts stock is still up around 15% so far in 2026. The stock will take cues from near-term growth rates.",https://www.livemint.com/rss/markets
₹2.75 to  ₹151.50: Multibagger penny stock turns  ₹1 lakh into  ₹55 lakh in four years,https://www.livemint.com/market/stock-market-news/275-to-151-50-multibagger-penny-stock-magnus-steel-and-infra-turns-1-lakh-into-55-lakh-in-four-years-11777872511082.html,2026-05-04 12:52:48 IST,"Magnus Steel and Infra share price, which was once priced at  ₹2.77 apiece in May 2022, is now trading at  ₹151.50 on the BSE. Here's the share price trend and investment growth of the multibagger penny stock.",https://www.livemint.com/rss/markets
Tamil Nadu election results impact: Why have Sun TV Network shares crashed over 9% today?,https://www.livemint.com/market/stock-market-news/sun-tv-network-shares-crash-9-5-as-tvks-vijay-thalapathy-looks-set-to-defeat-dmk-in-assembly-polls-11777878103715.html,2026-05-04 12:34:01 IST,"Sun TV, part of the Sun Group, is led by Indian billionaire media proprietor Kalanithi Maran — who is closely related to DMK leaders. Maran is the grandnephew of DMK president M Karunanidhi and nephew of the current chief minister MK Stalin.",https://www.livemint.com/rss/markets
Tactical tool or red flag? Inside the Q4 promoter pledging churn,https://www.livemint.com/market/stock-market-news/tactical-tool-red-flag-q4-promoter-pledging-churn-market-volatility-stock-price-correction-pledging-intent-debt-11777872676152.html,2026-05-04 12:32:03 IST,Moderating pledge levels give way to resurfacing stress as market corrections expose underlying promoter debt,https://www.livemint.com/rss/markets
"1,400% returns in five years! Multibagger small-cap stock Spice Lounge hits upper circuit",https://www.livemint.com/market/stock-market-news/1400-returns-in-five-years-multibagger-small-cap-stock-spice-lounge-hits-upper-circuit-11777876180197.html,2026-05-04 12:07:06 IST,"Spice Lounge Food Works share price has fallen 23% in one month and has declined 28% in three months. The smallcap has dropped 46% on a year-to-date (YTD) basis, while it has plunged 63% in six months.",https://www.livemint.com/rss/markets
"Vinay Rajani of HDFC Sec suggests Tata Steel, Linde India shares to buy",https://www.livemint.com/market/stock-market-news/vinay-rajani-of-hdfc-sec-suggests-tata-steel-linde-india-shares-to-buy-11777874290382.html,2026-05-04 11:47:51 IST,"The domestic equity benchmarks rallied on May 4, supported by positive auto stock performance and a dip in crude prices. Nifty 50 increased by 1% to 24,236, indicating a consolidation phase as it faces resistance levels, while broader markets may need time to stabilize.",https://www.livemint.com/rss/markets
Repertoire drinking spurs new spirit launches,https://www.livemint.com/companies/news/indian-alcohol-companies-new-spirits-repertoire-drinking-consumer-trends-11777782997585.html,2026-05-04 14:33:33 IST,"Nearly a dozen products are either already in market or being introduced through early 2026-27 across whisky, brandy, vodka, gin, rum and tequila.",https://www.livemint.com/rss/companies
How Navi is sharpening its IPO pitch ahead of a fresh FY27 filing,https://www.livemint.com/companies/news/navi-ipo-pitch-fresh-fy27-filing-fintech-companies-rajiv-naresh-payments-lending-insurance-investments-debt-market-11777874818425.html,2026-05-04 13:27:02 IST,"Navi Ltd plans to file for an IPO in FY27, focusing on profitability and a diversified business model. The fintech aims to attract investors with its offerings in payments, lending, insurance, and investments.",https://www.livemint.com/rss/companies
Lost or stolen credit card? Here are 6 steps to follow to avoid financial loss,https://www.livemint.com/money/personal-finance/lost-or-stolen-credit-card-here-are-6-steps-to-follow-to-avoid-financial-loss-11777882967999.html,2026-05-04 14:42:37 IST,"A lost or stolen credit card requires immediate action, including blocking the card, checking transactions, reporting to the bank, disputing fraud, securing accounts, and requesting a replacement to prevent financial loss.",https://www.livemint.com/rss/money
"DA hike: IBA announces Dearness Allowance increase in bank employee salaries for May, June, July 2026 — Details",https://www.livemint.com/money/personal-finance/da-hike-iba-indian-banks-dearness-allowance-increase-bank-workmen-officer-employees-salary-basic-pay-may-june-july-2026-11777880651127.html,2026-05-04 14:26:57 IST,"The government revised the Dearness Allowance (DA) for bank employees for May, June, and July 2026, impacting salaries for workmen and officer employees. Here's how this impacts monthly pay for bank staff…",https://www.livemint.com/rss/money
How bureau and account aggregator data are redefining lending risk,https://www.livemint.com/money/personal-finance/how-bureau-and-account-aggregator-data-are-redefining-lending-risk-loans-11777878037495.html,2026-05-04 13:06:37 IST,The evolution of lending practices towards precision underwriting emphasizes using both historical and real-time data for improved risk management.,https://www.livemint.com/rss/money
"8th pay commission: State visits to Telangana, Ladakh and Jammu &amp; Kashmir planned in May and June — Check latest updates",https://www.livemint.com/money/personal-finance/8th-central-pay-commission-cpc-state-visits-plan-telangana-ladakh-jammu-kashmir-meets-may-june-2026-check-latest-updates-11777875744706.html,2026-05-04 13:04:12 IST,"8th central pay commission: The 8th CPC has planned state visits to Telangana, Ladakh and Jammu &amp;amp; Kashmir in May and June 2026. Here's a look at the latest updates as the panel calls for consultations.",https://www.livemint.com/rss/money
"SBI, PNB, Bank of Baroda, and 4 other PSU banks offer personal loan rates starting at 7.10% in May 2026. See comparison",https://www.livemint.com/money/personal-finance/sbi-pnb-bank-of-baroda-4-other-psu-banks-offer-personal-loan-rates-starting-from-7-10-in-may-2026-see-compari-11777874341283.html,2026-05-04 12:35:44 IST,"Public sector banks offer competitive personal loan interest rates starting at 7.10% in May 2026. Key factors that influence borrowing decisions include credit score, tenure, and processing charges.",https://www.livemint.com/rss/money
"I asked ChatGPT how to retire at 45 on  ₹1.5 lakh a month: AI suggests mutual funds, gives detailed personal finance plan",https://www.livemint.com/money/personal-finance/i-asked-chatgpt-how-to-retire-at-45-on-1-5-lakh-a-month-ai-suggests-mutual-funds-gives-detailed-personal-finance-plan-11777877608026.html,2026-05-04 12:29:54 IST,I asked ChatGPT how to retire at 45 on  ₹1.5 lakh a month. The AI tool suggested specific mutual funds while giving a detailed personal finance plan.,https://www.livemint.com/rss/money
"Don’t chase returns, rebalance them amid cycles and noise: DSP's Kalpen Parekh",https://www.livemint.com/money/personal-finance/dont-chase-returns-rebalance-amid-cycles-noise-dsps-kalpen-parekh-11777861126454.html,2026-05-04 12:13:38 IST,"DSP MF CEO Kalpen Parekh trims gold after a sharp rally, raises equity via hybrid funds and sticks to disciplined asset allocation—ignoring noise, chasing value and respecting cycles.",https://www.livemint.com/rss/money
The retail bond illusion: Are investors buying yield or risk?,https://www.livemint.com/money/the-retail-bond-illusion-investors-buying-yield-risk-equity-markets-11777822212116.html,2026-05-04 12:08:02 IST,"Fintech platforms have made bonds look simple and safe. But behind curated yields and clean dashboards lie credit, liquidity and structural risks many retail investors may not fully grasp.",https://www.livemint.com/rss/money
World Cup prize pool nears $900 million as FIFA boosts payouts. Here’s who gets what,https://www.cnbc.com/2026/05/04/fifa-world-cup-team-payouts-ticket-prices.html,2026-05-04 11:41:02 IST,"FIFA's upcoming World Cup is set to be the most lucrative on-record, with a 'record breaking' prize pool on offer, as FIFA shrugs off other controversies.",https://www.cnbc.com/id/10000664/device/rss/rss.html
"Gainers &amp; Losers: BHEL, DMart among 6 big movers on Monday",https://economictimes.indiatimes.com/markets/stocks/news/gainers-amp-losers-bhel-dmart-among-6-big-movers-on-monday/slideshow/130789857.cms,2026-05-04 16:42:16 IST,"Indian markets closed higher as election trends boosted sentiment. Stocks such as Valor Estate, BHEL, and Vedanta surged, whereas Sun TV, Avenue Supermarts, and Kotak Bank declined.",https://economictimes.indiatimes.com/markets/stocks/rssfeeds/2146843.cms
ET Alpha Wealth Summit: D-St moguls set to decode the next wealth-creation avenues,https://economictimes.indiatimes.com/markets/stocks/news/et-alpha-wealth-summit-d-st-moguls-set-to-decode-the-next-wealth-creation-avenues/articleshow/130782616.cms,2026-05-04 15:43:44 IST,"The Economic Times will host the ET Alpha Wealth Summit on June 4 in Mumbai. Fund managers and market veterans like Saurabh Mukherjea, S Naren, Nilesh Shah, Vikash Khemani, Rajeev Thakkar and Rajesh Saluja will discuss future wealth creation avenues. Sessions will explore identifying opportunities in a market with fewer cheap stocks.",https://economictimes.indiatimes.com/markets/stocks/rssfeeds/2146843.cms
Election impact on stock market explained: What likely BJP win in West Bengal means for investors,https://economictimes.indiatimes.com/markets/stocks/news/election-impact-on-stock-market-explained-what-likely-bjp-win-in-west-bengal-means-for-investors/articleshow/130782780.cms,2026-05-04 15:34:28 IST,"West Bengal's election results signal a significant political shift with the BJP leading, prompting a surge in market sentiment. Analysts anticipate gradual improvements and long-term benefits for sectors like real estate and infrastructure, aligning with the BJP's manifesto. However, global macro indicators remain key drivers for Indian equities.",https://economictimes.indiatimes.com/markets/stocks/rssfeeds/2146843.cms
"Commodity Radar: As gold holds near Rs 1.5 lakh support, NFP data to decide next breakout. Buy-on-dips strategy emerges",https://economictimes.indiatimes.com/markets/stocks/news/commodity-radar-as-gold-holds-near-rs-1-5-lakh-support-nfp-data-to-decide-next-breakout-buy-on-dips-strategy-emerges/articleshow/130782052.cms,2026-05-04 15:29:33 IST,"Gold prices are consolidating near key support levels around Rs 1.5 lakh after a brief correction, with analysts recommending a buy-on-dips strategy. Market direction hinges on upcoming US Nonfarm Payrolls data, which could influence dollar strength and interest rate expectations, thereby determining gold’s next breakout or continued range-bound movement.",https://economictimes.indiatimes.com/markets/stocks/rssfeeds/2146843.cms
Sebi-backed PaRRVA mechanism for performance validation becomes operational. Check details,https://economictimes.indiatimes.com/markets/stocks/news/sebi-backed-parrva-mechanism-for-performance-validation-becomes-operational-check-details/articleshow/130781572.cms,2026-05-04 15:23:28 IST,"CARE Ratings Limited and National Stock Exchange of India have launched PaRRVA, a framework to verify performance claims in the securities market. Conceptualised by Securities and Exchange Board of India, the platform aims to independently validate risk-return data and standardise disclosures for investors as market participation grows.",https://economictimes.indiatimes.com/markets/stocks/rssfeeds/2146843.cms
"Baazar Style, Senco Gold, other stocks jump up to 9% on BJP's early lead in West Bengal elections. Here's why",https://economictimes.indiatimes.com/markets/stocks/news/baazar-style-senco-gold-other-stocks-jump-up-to-9-on-bjps-early-lead-in-west-bengal-elections-heres-why/articleshow/130780982.cms,2026-05-04 15:18:58 IST,"Shares of Kolkata-based companies surged after early trends in the West Bengal Assembly elections showed a strong lead for the BJP. Stocks like Baazar Style Retail, Senco Gold and CESC rallied on expectations of higher consumption and economic activity, although analysts caution that the market impact may remain short term.",https://economictimes.indiatimes.com/markets/stocks/rssfeeds/2146843.cms
TVK poised for Tamil Nadu win: What Thalapathy Vijay’s victory could mean for companies operating in the state,https://www.livemint.com/market/stock-market-news/tvk-poised-for-tamil-nadu-win-what-thalapathy-vijay-s-victory-could-mean-for-companies-operating-in-the-state-11777890484610.html,2026-05-04 16:49:43 IST,Vijay's Tamilaga Vettri Kazhagam (TVK) is set to win the Tamil Nadu Assembly Election 2026. Most exit polls had projected that the DMK-led alliance under Chief Minister M K Stalin would retain power.,https://www.livemint.com/rss/markets
"Manappuram Finance Q4 Results: Firm swings to black with  ₹405 crore profit, announces  ₹0.50 dividend",https://www.livemint.com/market/stock-market-news/manappuram-finance-q4-results-firm-swings-to-black-with-rs-405-crore-profit-announces-rs-0-50-dividend-11777893199463.html,2026-05-04 16:46:49 IST,"Manappuram Finance's Q4 consolidated profit came in at  ₹404.79 crore as against a loss of  ₹203.17 crore in the same period a year ago. Meanwhile, on a quarter-on-quarter (QoQ) basis, the figure rose 69% from  ₹238.55 crore in the December quarter.",https://www.livemint.com/rss/markets
"Gold, silver rates today nosedive up to 5% as crude oil price soars after escalation in the US-Iran war",https://www.livemint.com/market/commodities/gold-silver-rates-today-4-may-2026-nosedive-up-to-5-as-crude-oil-price-soars-us-iran-news-strait-of-hormuz-in-focus-11777890370782.html,2026-05-04 16:39:38 IST,"US-Iran war: According to the News Agency Reuters, Iran hit two missiles at a US warship on Monday, when it was sailing near Jask island",https://www.livemint.com/rss/markets
Crude oil jumps over 5% as US-Iran tensions flare again; Brent crude climbs past $114,https://www.livemint.com/market/stock-market-news/crude-oil-jumps-over-5-as-us-iran-tensions-flare-again-brent-crude-climbs-past-114-11777891892017.html,2026-05-04 16:39:34 IST,"Crude oil prices rose on May 4 after a tanker was reportedly hit in the Strait of Hormuz. Tensions escalated between the U.S. and Iran, with Trump promising to guide ships through the strait, while Iran warned of military action against US forces and urged coordination for passing vessels.",https://www.livemint.com/rss/markets
Rupee falls 39 paise to end at all-time low of 95.23 against US dollar — What's plaguing the domestic currency?,https://www.livemint.com/market/stock-market-news/rupee-falls-39-paise-to-end-at-all-time-low-of-95-23-against-us-dollar-whats-plaguing-the-domestic-currency-11777892426631.html,2026-05-04 16:34:57 IST,"At the interbank foreign exchange market, the rupee opened at 94.95 against the US dollar, then lost ground and finally settled for the day at 95.23 (provisional), registering a fall of 39 paise over its previous close.",https://www.livemint.com/rss/markets
"Top Gainers &amp; Losers on May 4: Meesho, Vedanta, HFCL, BHEL, Cemindia Projects, Anant Raj among top gainers",https://www.livemint.com/market/stock-market-news/top-gainers-losers-on-may-4-meesho-vedanta-hfcl-bhel-cemindia-projects-anant-raj-among-top-gainers-11777888789396.html,2026-05-04 15:40:56 IST,"On May 4, major indices saw gains due to strong buying in heavyweight stocks and positive state election trends for the Bharatiya Janata Party. The Nifty 50 rose 0.51% to 24,119, while the S&amp;amp;P BSE Sensex increased 0.31% to 77,159, with midcap and smallcap indices outperforming.",https://www.livemint.com/rss/markets
FPI outflows persist in equities; primary market sees continued interest,https://www.livemint.com/market/stock-market-news/fpi-outflows-persist-in-equities-primary-market-sees-continued-interest-11777880344551.html,2026-05-04 15:11:14 IST,"In 2026, IPO activity is subdued with few listings, while Foreign Portfolio Investors (FPIs) invested  ₹12,339 crore in the primary market. Despite significant outflows from equities, FPIs are attracted to primary issues due to appealing valuations and yield prospects.",https://www.livemint.com/rss/markets
BSE SME stock rebounds after announcement of H2 results 2026,https://www.livemint.com/market/stock-market-news/bse-sme-stock-rebounds-after-announcement-of-h2-results-2026-11777884705258.html,2026-05-04 15:06:07 IST,"Harshdeep Hortico Limited's stock rose 9% to  ₹100 following positive H2FY26 results, with revenue increasing nearly 15% year-on-year. The company reported improved EBITDA and a 25% rise in net profit, reflecting strong financial performance.",https://www.livemint.com/rss/markets
"Gold, silver prices outlook: Where are bullion prices headed this month?",https://www.livemint.com/market/commodities/gold-silver-prices-outlook-where-are-bullion-prices-headed-this-month-11777885680736.html,2026-05-04 14:58:24 IST,"Gold, Silver prices outlook: Persistent inflation and expectations of delayed interest rate cuts may cap the upside in gold prices in the near term. However, ongoing geopolitical tensions and steady physical demand are likely to provide underlying support.",https://www.livemint.com/rss/markets
Bank Nifty falls 8% in 2026 so far: Is this correction a buying opportunity?,https://www.livemint.com/market/stock-market-news/bank-nifty-falls-8-in-2026-so-far-is-this-correction-a-buying-opportunity-11777884575080.html,2026-05-04 14:57:30 IST,"As Bank Nifty faces an 8% decline in 2026, experts debate whether this downturn presents a buying opportunity for investors. While some advise caution, others highlight the attractive entry points for select banking stocks amidst ongoing market volatility and regulatory changes.",https://www.livemint.com/rss/markets
"Aditya Birla Capital Q4 Results: Profit rises 31% YoY to  ₹1,129 crore",https://www.livemint.com/market/stock-market-news/aditya-birla-capital-q4-results-profit-rises-31-yoy-to-rs-1-129-crore-11777886326851.html,2026-05-04 14:49:46 IST,"Aditya Birla Capital Q4 Results: Aditya Birla Capital reported a 30.6% increase in Q4 consolidated net profit to  ₹1,129.16 crore, with total income rising to  ₹13,475.74 crore. The lending portfolio expanded 32%, while the direct-to-consumer platform onboarded 1.1 crore customers by March 2026.",https://www.livemint.com/rss/markets
Milky Mist raises  ₹482 crore in pre-IPO round led by Temasek arm,https://www.livemint.com/companies/milky-mist-pre-ipo-funding-temasek-ipo-india-dairy-11777885672471.html,2026-05-04 15:43:41 IST,"The entire primary investment was led by Jongsong Investments, while promoters Sathishkumar T. and Anitha S. sold 89,43,903 equity shares at  ₹139.76 a share, aggregating roughly  ₹125 crore, as part of a secondary transaction.",https://www.livemint.com/rss/companies
"Salary  ₹50,000? Here’s how much PF corpus you can build in 20 years",https://www.livemint.com/money/personal-finance/salary-50-000-here-s-how-much-pf-corpus-you-can-build-in-20-years-11777877706357.html,2026-05-04 16:14:01 IST,"EPF corpus from a  ₹50,000 salary can grow substantially over 20 years through disciplined contributions, employer support and compounding, potentially reaching  ₹40–60 lakh with salary increments.",https://www.livemint.com/rss/money
Section 80C: Here's how you can unlock up to  ₹1.5 lakh tax deductions in Income-Tax return filings,https://www.livemint.com/money/personal-finance/section-80c-ita-how-you-unlock-1-5-lakh-tax-deductions-income-tax-return-filing-itr-money-saving-ppf-epf-nps-nsc-sukanya-11777885388013.html,2026-05-04 15:55:23 IST,Section 80C provides taxpayers with deduction benefit up to  ₹1.5 lakh for investment in certain government saving schemes during a given financial or assessment year. Here's how you can claim the tax benefit…,https://www.livemint.com/rss/money
Thalapathy government? Why Vijay's historic rise in India's industrial powerhouse state matters for stock market,https://economictimes.indiatimes.com/markets/stocks/news/thalapathy-government-why-vijays-historic-rise-in-indias-industrial-powerhouse-state-matters-for-stock-market/articleshow/130798865.cms,2026-05-04 18:13:46 IST,"Vijay’s TVK is set to reshape Tamil Nadu’s political landscape, prompting investors to assess what a “Thalapathy government” could mean for industry and markets. With the state being a key auto, electronics and export hub, policy clarity on incentives, welfare spending and governance will drive sentiment for TN-linked companies.",https://economictimes.indiatimes.com/markets/stocks/rssfeeds/2146843.cms
"Quote of the day by Walter Schloss: ""One of the things you learn in this business is humility because you see your mistakes the next day.""",https://economictimes.indiatimes.com/markets/stocks/news/quote-of-the-day-by-walter-schloss-one-of-the-things-you-learn-in-this-business-is-humility-because-you-see-your-mistakes-the-next-day-/articleshow/130757125.cms,2026-05-04 18:00:00 IST,"Walter Schloss highlights that investing demands humility, as markets quickly expose mistakes through immediate feedback. Rather than avoiding errors, successful investors learn from them—using humility to adapt, cut losses, and refine strategies.",https://economictimes.indiatimes.com/markets/stocks/rssfeeds/2146843.cms
"Bajaj Auto and 4 other stocks hit a 52-week high, rally up to 40% in a month",https://economictimes.indiatimes.com/markets/stocks/news/bajaj-auto-and-4-other-stocks-hit-a-52-week-high-rally-up-to-40-in-a-month/slideshow/130797550.cms,2026-05-04 17:57:35 IST,"Five BSE 100 stocks, including Adani Power, Adani Ports, Nestle India, Cummins India and Bajaj Auto, hit fresh 52-week highs after rallying up to 40% over the past month.",https://economictimes.indiatimes.com/markets/stocks/rssfeeds/2146843.cms
Sebi proposes changes to SDI rules to facilitate growth in listed securitisation market,https://economictimes.indiatimes.com/markets/stocks/news/sebi-proposes-changes-to-sdi-rules-to-facilitate-growth-in-listed-securitisation-market/articleshow/130794563.cms,2026-05-04 17:34:50 IST,"Markets regulator Sebi on Monday proposed a series of changes to norms governing securitised debt instruments (SDIs), including allowing single-asset securitisation by RBI-regulated entities, winding up of securitisation transactions and easing certain structural restrictions to boost market development.",https://economictimes.indiatimes.com/markets/stocks/rssfeeds/2146843.cms
