title,link,published,summary,source
Stocks to buy for short term: From IRCTC to Tata Chemicals— Jigar Patel of Anand Rathi suggests 3 shares,https://www.livemint.com/market/stock-market-news/stocks-to-buy-for-short-term-irctc-tata-chemicals-colgate-palmolive-jigar-patel-of-anand-rathi-suggests-3-shares-11771813127370.html,2026-02-23 08:44:53 IST,"Stocks to buy for the short term: Discover investment opportunities in the Indian stock market as Jigar Patel from Anand Rathi recommends three stocks poised for growth. With technical indicators suggesting a bullish outlook, find out how to strategically navigate the market for potential profits.",https://www.livemint.com/rss/markets
"Stocks to watch: SBI, IDFC First Bank, Airtel among 10 shares in focus today; full list here",https://www.livemint.com/market/stock-market-news/stocks-to-watch-sbi-idfc-first-bank-airtel-among-10-shares-in-focus-today-full-list-here-11771813768581.html,2026-02-23 08:30:36 IST,"Stock market today: The Indian stock market benchmark indices, Sensex and Nifty 50, are expected to open on a positive note on Monday.",https://www.livemint.com/rss/markets
"Bitcoin slips below $65,000 levels, down 4.8% amid Trump tariffs uncertainty",https://www.livemint.com/market/cryptocurrency/bitcoin-slips-below-65000-levels-down-4-8-pc-amid-donald-trump-tariffs-uncertainty-supreme-court-cryptocurrency-markets-11771814317332.html,2026-02-23 08:30:34 IST,"Bitcoin fell to an eight-month low below $65,000 today amid uncertainty over US tariffs. Uncertainty surrounding Trump's tariffs has left the market fragile. Analysts indicate $65,000 is a critical support level for Bitcoin.",https://www.livemint.com/rss/markets
"Stock market today: Trade setup for Nifty 50, gold, silver rates to Trump's tariffs on India; 5 stocks to buy or sell",https://www.livemint.com/market/stock-market-news/stock-market-today-trade-setup-for-nifty-50-gold-silver-rates-to-trumps-tariffs-on-india-5-stocks-to-buy-or-sell-11771809405553.html,2026-02-23 07:56:14 IST,"Stock market today: Experts have recommended eight stocks to buy today — Vardhman Textiles, ABSLAMC, BHEL, Cummins India, and JSW Energy",https://www.livemint.com/rss/markets
Breakout stocks to buy or sell: Sumeet Bagadia recommends five shares to buy today — 23 February 2026,https://www.livemint.com/market/stock-market-news/breakout-stocks-to-buy-or-sell-sumeet-bagadia-recommends-five-shares-to-buy-today-23-february-2026-11771811744166.html,2026-02-23 07:50:50 IST,"Breakout stocks to buy or sell: Sumeet Bagadia recommends five shares to buy today — Bajaj Consumer Care, Happy Forgings, Yatharth Hospital &amp;amp; Trauma Care Services, Mahindra Logistics, and Torrent Power.",https://www.livemint.com/rss/markets
"Stock Market Today LIVE: IDFC First Bank share price crashes 15%; Sensex jumps over 500 points, Nifty 50 above 25,700",https://www.livemint.com/market/stock-market-news/stock-market-today-live-sensex-today-gift-nifty-trump-tariffs-gold-rate-today-silver-prices-us-iran-talks-railtel-idfc-11771812391107.html,2026-02-23 07:43:14 IST,"Stock Market Today LIVE: Sensex rallied 600 points, while the Nifty 50 traded above 25,700 level. Broader markets supported the rally, with the Nifty Smallcap 100 and the Nifty Midcap 100 indices trading in the green.",https://www.livemint.com/rss/markets
"Asian Markets Today: Kospi hits record high amid Trump’s Tariff move; Hang Seng gains, Nikkei closed for trading holiday",https://www.livemint.com/market/stock-market-news/asian-markets-today-kospi-hits-record-high-amid-trump-s-tariff-move-hang-seng-gains-nikkei-closed-for-trading-holiday-11771809297602.html,2026-02-23 07:23:48 IST,"Asian markets today: South Korea’s Kospi extended its gains for a third consecutive session, climbing 1.7% to a new record high, led by index heavyweights SK Hynix and Samsung Electronics, which advanced more than 3% and 2%, respectively",https://www.livemint.com/rss/markets
"Nifty 50, Sensex today: What to expect from Indian stock market in trade on February 23",https://www.livemint.com/market/stock-market-news/nifty-50-sensex-today-what-to-expect-from-indian-stock-market-in-trade-on-february-23-11771787797844.html,2026-02-23 07:21:17 IST,"Nifty 50, Sensex today: The trends on Gift Nifty also indicate a gap-up start for the Indian benchmark index. The Gift Nifty was trading around 25,748 level, a premium of nearly 163 points from the Nifty futures’ previous close.",https://www.livemint.com/rss/markets
"How the Ola empire is fueling Bhavish’s personal AI business, Krutrim",https://www.livemint.com/companies/india-ola-empire-fueling-bhavish-aggarwal-ai-business-krutrim-governance-concerns-11771744693911.html,2026-02-23 09:00:42 IST,"Bhavish Aggarwal's AI venture, Krutrim, heavily relies on revenue from Ola companies, raising governance concerns. With 90% of its  ₹101.7 crore revenue sourced from and costs shared with related entities, experts urge transparency and flag director responsibilities to minority shareholders.",https://www.livemint.com/rss/companies
"HSBC, StanChart Earnings to Show Effects of Strategy Shifts",https://www.livemint.com/companies/hsbc-stanchart-earnings-to-show-effects-of-strategy-shifts-11771815217229.html,2026-02-23 08:23:36 IST,The shock exit of Standard Chartered Plc’s finance chief and the implications of HSBC Holdings Plc’s multibillion-dollar purchase of a bank stake will loom large as the two report earnings.,https://www.livemint.com/rss/companies
"AU Small Finance Bank de-empanelment: What we know about  ₹47 crore funds transfer, timeline, internal review details",https://www.livemint.com/companies/news/au-small-finance-bank-clarify-de-empanelment-haryana-govt-account-transactions-internal-review-assess-reasons-idfc-first-11771811075341.html,2026-02-23 07:45:22 IST,"AU Small Finance Bank has initiated an internal review after being de-empaneled by the Haryana government along with IDFC First Bank. Here's what the internal review found, and all we know so far…&amp;nbsp;",https://www.livemint.com/rss/companies
Malaysia’s Anti-Graft Chief Questioned in Shareholding Probe,https://www.livemint.com/companies/malaysias-anti-graft-chief-questioned-in-shareholding-probe-11771812219070.html,2026-02-23 07:33:38 IST,"Malaysia’s anti-graft chief Azam Baki was summoned by a special committee set up to probe his stock ownership to explain the matter on Thursday, as authorities respond to calls for him to be investigated.",https://www.livemint.com/rss/companies
