title,link,published,summary,source
Are bluechip stocks cheap and safe to invest in now? Radhika Gupta explains why the answer isn't so simple,https://economictimes.indiatimes.com/markets/stocks/news/are-bluechip-stocks-cheap-and-safe-to-invest-in-now-radhika-gupta-explains-why-the-answer-isnt-so-simple/articleshow/132253411.cms,2026-07-08 09:39:13 IST,"Edelweiss Mutual Fund MD &amp; CEO Radhika Gupta says investors should move beyond the belief that large-cap stocks are inherently safer, arguing India's evolving economy favours bottom-up investing across market caps. She remains optimistic about domestic inflows, advocates diversified portfolios with global exposure, and expects double-digit equity returns, while cautioning against relying on outdated market narratives.",https://economictimes.indiatimes.com/markets/stocks/rssfeeds/2146843.cms
Trent among 5 F&amp;O stocks with a sharp rise in futures open interest,https://economictimes.indiatimes.com/markets/stocks/news/trent-among-5-fampo-stocks-with-a-sharp-rise-in-futures-open-interest/slideshow/132253348.cms,2026-07-08 09:31:13 IST,"Five NSE F&amp;O stocks recorded over 5% growth in futures open interest on July 7, led by Trent and Cochin Shipyard, signalling fresh position buildup and heightened trader participation in derivatives.",https://economictimes.indiatimes.com/markets/stocks/rssfeeds/2146843.cms
"Sensex tumbles over 550 points, Nifty falls below 24,250 as Iran-US conflict escalates",https://economictimes.indiatimes.com/markets/stocks/news/sensex-tumbles-over-500-points-nifty-falls-below-24300-as-iran-us-conflict-escalates/articleshow/132230742.cms,2026-07-08 09:29:12 IST,"Indian stock markets experienced a decline on Wednesday as oil prices surged. Benchmark indices Sensex and Nifty fell significantly due to renewed Iran-US conflict escalations. Broader market indices also slipped into the red, reflecting widespread bearish sentiment. Foreign investors, however, continued their buying trend for a fifth consecutive session. The Indian rupee opened lower against the US dollar amid these developments.",https://economictimes.indiatimes.com/markets/stocks/rssfeeds/2146843.cms
Himadri Speciality among 4 stocks that closed below VWAP,https://economictimes.indiatimes.com/markets/stocks/news/himadri-speciality-among-4-stocks-that-closed-below-vwap/slideshow/132253126.cms,2026-07-08 09:22:00 IST,"Four Nifty 500 stocks closed over 1.5% below their VWAP on July 7, signalling potential selling pressure, according to StockEdge's technical scan.",https://economictimes.indiatimes.com/markets/stocks/rssfeeds/2146843.cms
Cochin Shipyard shares dip 2% as govt’s OFS opens for retail investors today,https://economictimes.indiatimes.com/markets/stocks/news/cochin-shipyard-shares-in-focus-as-govts-ofs-opens-for-retail-investors-today/articleshow/132252912.cms,2026-07-08 09:11:04 IST,"Cochin Shipyard shares fell over 2% as the Centre's OFS opens for retail investors after the non-retail portion was subscribed 3.52 times. The government plans to sell up to a 5.04% stake, potentially raising around Rs 1,800 crore. The stock has delivered multibagger long-term returns despite recent weakness, with shares down over 29% in the past year.",https://economictimes.indiatimes.com/markets/stocks/rssfeeds/2146843.cms
Uno Minda shares in focus as firm enters 4-wheeler seating systems segment with Rs 320-crore capex,https://economictimes.indiatimes.com/markets/stocks/news/uno-minda-shares-in-focus-as-firm-enters-4-wheeler-seating-systems-segment-with-rs-320-crore-capex/articleshow/132252808.cms,2026-07-08 08:51:49 IST,Uno Minda is expanding into four-wheeler passenger vehicle seating systems. A new manufacturing facility will be established in Maharashtra. This facility represents a significant capital expenditure for the company. Operations are expected to begin in the fourth quarter of FY28. The company has secured an anchor order from a leading OEM.,https://economictimes.indiatimes.com/markets/stocks/rssfeeds/2146843.cms
"Jubilant FoodWorks among 4 stocks closed above VWAP, signalling bullish shift",https://economictimes.indiatimes.com/markets/stocks/news/jubilant-foodworks-among-4-stocks-closed-above-vwap-signalling-bullish-shift/slideshow/132252782.cms,2026-07-08 08:45:57 IST,"On July 7, four Nifty500 stocks closed more than 1% above their VWAP levels, indicating improving buying interest and positive intraday sentiment. A close above the Volume Weighted Average Price is often viewed as a short-term bullish signal, reflecting sustained demand and the potential for further upside, according to technical scan data.",https://economictimes.indiatimes.com/markets/stocks/rssfeeds/2146843.cms
"Info Edge among 3 stocks flashing bullish signals, hinting at a possible uptrend",https://economictimes.indiatimes.com/markets/stocks/news/info-edge-among-3-stocks-flashing-bullish-signals-hinting-at-a-possible-uptrend/slideshow/132252733.cms,2026-07-08 08:41:31 IST,"On July 7, three stocks in the Nifty500 appeared on the 'White Marubozu' bullish scanner, according to StockEdge's technical scan data. The bullish candlestick pattern reflects strong buying momentum throughout the trading session, signalling sustained positive sentiment and the potential for a continuation of the upward price trend.",https://economictimes.indiatimes.com/markets/stocks/rssfeeds/2146843.cms
Swiggy among 5 stocks showing bullish RSI upswing,https://economictimes.indiatimes.com/markets/stocks/news/swiggy-among-5-stocks-showing-bullish-rsi-upswing/slideshow/132252660.cms,2026-07-08 08:37:41 IST,"Five stocks from the Nifty500 segment that gained over 3% featured in the RSI Trending Up scan on July 7 after showing improving momentum. The RSI moved above the 50 mark from lower levels, signalling strengthening price action, improving sentiment and potential short-term buying opportunities for traders tracking bullish technical setups.",https://economictimes.indiatimes.com/markets/stocks/rssfeeds/2146843.cms
Drone stock IdeaForge Technology share price jumps over 4% after launch of  ₹500-crore QIP,https://www.livemint.com/market/stock-market-news/drone-stock-ideaforge-technology-share-price-jumps-over-4-after-launch-of-rs-500-crore-qip-11783488778200.html,2026-07-08 11:07:02 IST,"IdeaForge Technology share price has fallen 9% in one month, but has jumped by a staggering 104% in just three months. The drone stock has rallied 80% in six months, while it has surged 48% in one year.",https://www.livemint.com/rss/markets
Adani Enterprises shares trade flat after closure of  ₹1500 crore QIP. Do you own?,https://www.livemint.com/market/stock-market-news/adani-enterprises-shares-trade-flat-after-closure-of-rs-1500-crore-qip-do-you-own-11783484199103.html,2026-07-08 10:44:22 IST,"Adani Enterprises has successfully closed its  ₹1,500 crore Qualified Institutions Placement, approving the allotment of over 5.2 crore equity shares at  ₹2,883 each. The QIP reflects a 5% discount to its floor price, and shares are not registered under the U.S. Securities Act.",https://www.livemint.com/rss/markets
Multibagger stock jumps over 4% after order win from RITES. Do you own?,https://www.livemint.com/market/stock-market-news/multibagger-stock-silver-touch-technologies-share-price-jumps-over-4-after-order-win-from-rites-do-you-own-11783484960255.html,2026-07-08 10:07:06 IST,"Silver Touch Technologies share price has rallied 46% in one month, and has gained 16% in six months. The smallcap stock has delivered multibagger returns of 160% in one year, and a staggering 407% over the past three years.",https://www.livemint.com/rss/markets
₹2 lakh crore gone! Why is the Indian stock market falling today? Explained with top five reasons,https://www.livemint.com/market/stock-market-news/stock-market-crash-rs-2-lakh-crore-gone-why-is-the-indian-stock-market-falling-today-explained-with-top-five-reasons-11783483785287.html,2026-07-08 10:06:34 IST,"Stock market crash: Escalation in the US-Iran tension and rising crude oil prices are the prime reasons that are dragging global bourses, including Dalal Street",https://www.livemint.com/rss/markets
Penny stock under  ₹10 PC Jeweller jumps 5% despite stock market sell-off,https://www.livemint.com/market/stock-market-news/penny-stock-under-rs-10-pc-jeweller-jumps-5-despite-stock-market-selloff-11783484760580.html,2026-07-08 10:00:33 IST,"PC Jeweller share price rose 6% on July 8 after announcing the repayment of all outstanding debt under a settlement with two consortium banks, marking a significant step towards becoming debt-free.",https://www.livemint.com/rss/markets
"Knack Packaging share price makes strong debut, lists with over 10% premium at  ₹188 on NSE",https://www.livemint.com/market/stock-market-news/knack-packaging-share-price-makes-strong-debut-lists-with-over-10-premium-at-188-on-nse-11783482802755.html,2026-07-08 09:56:46 IST,Knack Packaging IPO listing: Knack Packaging share price opened at  ₹188 on NSE and  ₹186 on BSE.&amp;nbsp;,https://www.livemint.com/rss/markets
Infosys to PFC - Jay Thakkar suggests 3 stocks to buy or sell for short-term in F&amp;O segment,https://www.livemint.com/market/stock-market-news/infosys-to-pfc-jay-thakkar-suggests-3-stocks-to-buy-or-sell-for-short-term-in-f-o-segment-11783482615835.html,2026-07-08 09:52:56 IST,"Indian stock indices opened lower amid US-Iran tensions and rising crude oil prices. The Nifty 50 fell 0.57% while the BSE Sensex declined 0.47%. With all sectors in the red, market sentiment remains weak, and key support levels are in focus for future movements.",https://www.livemint.com/rss/markets
RCF FPO: PSU stock Rashtriya Chemicals and Fertilizers declares  ₹1500 crore fundraise. Details here,https://www.livemint.com/market/stock-market-news/rcf-fpo-psu-stock-rashtriya-chemicals-and-fertilizers-declares-rs-1500-crore-fundraise-details-here-11783481938295.html,2026-07-08 09:45:53 IST,"Rashtriya Chemicals and Fertilizers Ltd. (RCF) plans to raise up to  ₹1,500 crore via a Further Public Offering, pending regulatory approvals. The board has also approved amendments to its Memorandum of Association for entering new sectors like renewable energy, water management, and agrochemicals.",https://www.livemint.com/rss/markets
Cochin Shipyard OFS opens today for retail investors. Should you participate in this defence stock offer?,https://www.livemint.com/market/stock-market-news/cochin-shipyard-ofs-opens-today-for-retail-investors-should-you-participate-in-this-defence-stock-offer-11783481469677.html,2026-07-08 09:20:43 IST,"Cochin Shipyard OFS: The non-retail portion of the OFS, which opened on Tuesday, was subscribed 3.52 times",https://www.livemint.com/rss/markets
"Gold, Silver Rate Today: MCX gold price falls near  ₹1.45 lakh per 10 grams, silver eases amid escalating US-Iran war",https://www.livemint.com/market/commodities/gold-silver-rate-today-mcx-gold-price-falls-near-rs-1-45-lakh-per-10-grams-silver-eases-amid-escalating-us-iran-war-11783481875465.html,2026-07-08 09:11:09 IST,"Gold, Silver Rate Today: Gold and silver prices in India opened lower on MCX, following weakness in global bullion prices, as escalation in the tensions between the US and Iran in the Middle East stoked inflation fears and lifted dollar.",https://www.livemint.com/rss/markets
Rupee falls 20 paise to open at 95.17 against US dollar amid rise in crude oil prices,https://www.livemint.com/market/stock-market-news/rupee-falls-20-paise-to-open-at-95-17-against-us-dollar-amid-rise-in-crude-oil-prices-11783481570723.html,2026-07-08 09:04:57 IST,"Indian rupee fell to 95.17 against the US dollar due to rising crude oil prices and US Treasury yields, amid geopolitical tensions. Despite recent support from foreign portfolio investments, concerns over inflation persist, challenging the rupee's stability.",https://www.livemint.com/rss/markets
Four critical mineral stocks with strong growth plans,https://www.livemint.com/market/stock-market-news/critical-minerals-rare-earth-stocks-critical-mineral-stocks-expansion-rare-earth-minerals-11783425256792.html,2026-07-08 09:01:06 IST,The race for critical minerals has quietly become one of the biggest investment themes and these Indian companies are at the centerstage.,https://www.livemint.com/rss/markets
"IC Electricals IPO allotment today: SME IPO subscribed 420x, GMP rises. Here's how to check status online",https://www.livemint.com/market/ipo/ic-electricals-ipo-allotment-today-sme-ipo-subscribed-420x-gmp-rises-heres-how-to-check-status-online-11783480070658.html,2026-07-08 08:48:39 IST,"IC Electricals allotment date is likely to be finalised today, July 8. Investors can check your IPO allotment status online through the websites of NSE, BSE and the IPO registrar - Skyline Financial Services.",https://www.livemint.com/rss/markets
US stock market to Nikkei: Here’s world equity heatmap you should know before the opening of Indian stock market today,https://www.livemint.com/market/stock-market-news/us-stock-market-to-nikkei-here-s-world-equity-heatmap-you-should-know-before-the-opening-of-indian-stock-market-today-11783479918473.html,2026-07-08 08:43:28 IST,"Global market cues remain weak. Asian markets traded lower, weighed down by selloff in semiconductor stocks and concerns over escalating tensions in the Middle East.",https://www.livemint.com/rss/markets
Kusumgar IPO Day 1: Issue opens today. GMP hints 40% listing pop. Should you apply or not?,https://www.livemint.com/market/ipo/kusumgar-ipo-gmp-kusumgar-ipo-review-kusumgar-ipo-details-kusumgar-ipo-date-kusumgar-ipo-good-or-bad-kusumgar-ipo-11783478700978.html,2026-07-08 08:35:34 IST,"The Kusumgar IPO subscription opens on July 8 and closes on July 10. The company raised  ₹193.9 crore from anchor investors, allocating equity shares at  ₹419 each. The IPO is 100% offer-for-sale, with no fresh capital raised, and is set to list on July 15.",https://www.livemint.com/rss/markets
TCS Q1 preview: CEO Krithivasan's toughest earnings test yet,https://www.livemint.com/companies/news/tcs-q1-earnings-ceo-krithivasan-tcs-share-price-infosys-hcl-tech-11783482077732.html,2026-07-08 10:52:45 IST,"TCS reported its first revenue decline last fiscal year and three quarterly revenue contractions over the past eight quarters, amid mounting concerns over AI-led disruption and slowing client spending.",https://www.livemint.com/rss/companies
Blue Tokai Coffee courts PE funds for its largest ever fundraise at $100 million,https://www.livemint.com/companies/blue-tokai-coffee-roasters-tpg-temasek-chryscapital-private-equity-fundraising-11783477661719.html,2026-07-08 09:27:43 IST,"Blue Tokai has initiated talks with TPG, Temasek and ChrysCapital to raise at least $100 million as investor interest in India's fast-growing specialty coffee market gathers pace.",https://www.livemint.com/rss/companies
"Bengaluru corporate couple ‘accidentally started saving  ₹30,000 a month’ after relocating to Manali to work remotely",https://www.livemint.com/money/personal-finance/bengaluru-corporate-couple-accidentally-started-saving-rs-30-000-a-month-after-relocating-to-manali-to-work-remotely-11783481296049.html,2026-07-08 10:28:33 IST,"A Bengaluru corporate couple relocated to Manali to work remotely. They shared their experience detailing how they accidentally started saving  ₹30,000 a month.",https://www.livemint.com/rss/money
"Exclusive holdings: Stocks owned by just one mutual fund scheme, with no other scheme holding them",https://www.livemint.com/money/personal-finance/exclusive-holdings-stocks-owned-by-just-one-mutual-fund-scheme-with-no-other-scheme-holding-them-11783480454413.html,2026-07-08 10:22:56 IST,Value Research data shows that 13 stocks are owned by only one mutual fund scheme each. Such exclusive holdings offer an insight into the differentiated investment strategies adopted by some fund managers.,https://www.livemint.com/rss/money
NPS update: Government extends 2 new investment options to these employees,https://www.livemint.com/money/personal-finance/nps-update-government-extends-2-new-investment-options-to-these-employees-11783484632663.html,2026-07-08 10:19:16 IST,"The Finance Ministry has extended two additional investment choices under the National Pension System to employees of central autonomous bodies. Eligible subscribers can now opt for pension funds with equity exposure of up to 75%, depending on their risk appetite.",https://www.livemint.com/rss/money
"Gold, silver prices today, 8 July: Check retail rates of 24K, 22K gold, 999 silver in Delhi, Mumbai and Kolkata",https://www.livemint.com/money/personal-finance/gold-silver-prices-today-8-july-check-retail-rates-of-24k-22k-gold-999-silver-in-delhi-mumbai-and-kolkata-11783204895885.html,2026-07-08 09:59:20 IST,"Gold and silver prices today, 8 July: Check the latest 24K, 22K gold and 999 silver retail rates across Delhi, Mumbai, Kolkata and other major Indian cities, along with MCX market updates.",https://www.livemint.com/rss/money
Can delayed home construction cost you Section 54 relief? ITAT answers,https://www.livemint.com/money/personal-finance/can-delayed-home-construction-cost-you-section-54-relief-itat-answers-11783477233175.html,2026-07-08 09:10:10 IST,Sold a house and reinvested the gains but missed the construction deadline due to Covid? The Chennai ITAT says that alone is not enough to deny Section 54 tax exemption. The Tribunal held that pandemic-related delays cannot be treated as negligence and allowed the capital gains exemption claim.,https://www.livemint.com/rss/money
"Paying over  ₹50,000 in monthly rent? Here's why you must deduct TDS before making payment to your landlord",https://www.livemint.com/money/personal-finance/paying-over-50-000-in-monthly-rent-heres-why-you-must-deduct-tds-before-making-payment-to-your-landlord-11783477280783.html,2026-07-08 09:05:34 IST,"Individuals paying monthly rent above  ₹50,000 are required to deduct TDS at 2% before making the payment to the landlord. Timely deduction, deposit of TDS through Form 26QC and issuance of Form 16C can help avoid unnecessary penalties and tax notices.",https://www.livemint.com/rss/money
What health insurance retention data reveals—and conceals,https://www.livemint.com/money/personal-finance/health-insurance-retention-rates-india-pmfby-nl47-policy-renewal-analysis-11783424070360.html,2026-07-08 09:00:26 IST,Mint's analysis of insurers' NL-47 disclosures shows the average retention rate for top-selling retail health insurance plans was just 73% in FY26. What's driving the churn?&amp;nbsp;,https://www.livemint.com/rss/money
ITR filing AY 2026-27: 5 key tax rules that intraday and F&amp;O traders must know before filing returns,https://www.livemint.com/money/personal-finance/itr-filing-ay-2026-27-5-key-tax-rules-that-intraday-and-f-o-traders-must-know-before-filing-returns-11783478403002.html,2026-07-08 08:41:39 IST,"ITR filing for AY 2026-27 requires intraday and F&amp;amp;O traders to report business income correctly using ITR-3. Check the latest disclosure rules, business codes, turnover reporting requirements, tax audit thresholds, filing deadline and common mistakes to avoid for smooth tax compliance.",https://www.livemint.com/rss/money
10 microcap stocks rally up to 430% in CY26; 5 turn multibaggers: Here’s FII and MF exposure,https://economictimes.indiatimes.com/markets/stocks/news/10-microcap-stocks-rally-up-to-430-in-cy26-5-turn-multibaggers-heres-fii-and-mf-exposure/slideshow/132256662.cms,2026-07-08 12:44:02 IST,"Microcap stocks delivered stellar CY26 gains, with several companies rallying over 50%. Sterlite Technologies, MTAR Technologies and others emerged as multibaggers, attracting significant FII and mutual fund interest.",https://economictimes.indiatimes.com/markets/stocks/rssfeeds/2146843.cms
Titan vs Kalyan Jewellers: What Q1 sales indicate about demand and which stock to buy,https://economictimes.indiatimes.com/markets/stocks/news/titan-vs-kalyan-jewellers-what-q1-sales-indicate-about-demand-and-which-stock-to-buy/articleshow/132256342.cms,2026-07-08 12:35:03 IST,"India’s gold jewellery sector faced multiple challenges in Q1FY27, including inflation concerns, higher interest rate expectations and the Adhik Maas period impacting wedding-related demand. Despite these pressures, Titan and Kalyan Jewellers reported strong business updates, supported by resilient jewellery demand, store expansion and growth across domestic and international markets.",https://economictimes.indiatimes.com/markets/stocks/rssfeeds/2146843.cms
"Land, then power, now water: India's next scarcity. 5 stocks from the water ecosystem to look at with a long-term perspective",https://economictimes.indiatimes.com/markets/stocks/news/land-then-power-now-water-indias-next-scarcity-5-stocks-from-the-water-ecosystem-to-look-at-with-a-long-term-perspective/articleshow/132255907.cms,2026-07-08 12:25:22 IST,"Overall, the Indian stock market seems to be consolidating. And the underlying sentiment appears to be bullish. And in the small- and mid-cap segments, valuations are better than they were in 2024. There are opportunities here for those who know how to pick the right stocks.",https://economictimes.indiatimes.com/markets/stocks/rssfeeds/2146843.cms
Knack Packaging shares list at 11% premium; expert sees further upside,https://economictimes.indiatimes.com/markets/stocks/news/knack-packaging-shares-list-at-11-premium-expert-sees-further-upside/articleshow/132255570.cms,2026-07-08 11:57:53 IST,"Knack Packaging achieved a strong market debut, listing at a premium. Experts recommend holding the stock for potential further gains. Investors can consider accumulating shares on dips after reviewing performance. The company manufactures printed and laminated woven polypropylene bags for various industries. Knack Packaging exports its products to seventy-one countries globally.",https://economictimes.indiatimes.com/markets/stocks/rssfeeds/2146843.cms
Kalyan Jewellers shares soar over 6% as 38% YoY revenue jump in Q1 update,https://economictimes.indiatimes.com/markets/stocks/news/kalyan-jewellers-shares-soar-over-6-as-38-yoy-revenue-jump-in-q1-update/articleshow/132255507.cms,2026-07-08 11:54:37 IST,"Kalyan Jewellers shares rose sharply on Wednesday after the company reported an estimated 38% year-on-year growth in consolidated Q1 revenue, driven by robust demand in India and strong same-store sales. Its international business and digital jewellery platform Candere also posted healthy growth, despite the seasonal impact of Adhik Maas.",https://economictimes.indiatimes.com/markets/stocks/rssfeeds/2146843.cms
"Multibagger Cupid shares rally 19% in 6 days after Q1 update, skyrocket 940% in one year. What lies ahead?",https://economictimes.indiatimes.com/markets/stocks/news/multibagger-cupid-shares-rally-19-in-6-days-after-q1-update-skyrocket-940-in-one-year-what-lies-ahead/articleshow/132254699.cms,2026-07-08 11:08:13 IST,Cupid shares climbed significantly after a positive business update for the April-June quarter. The company raised its FY27 revenue guidance to over Rs 660 crore. This upward revision reflects strong performance and expanding global opportunities. Cupid's management highlighted diversification and growth across multiple business verticals. The company also noted steady progress in its In Vitro Diagnostics business segment.,https://economictimes.indiatimes.com/markets/stocks/rssfeeds/2146843.cms
South Indian Bank shares tumble 9% after four-day rise; RBI clears Mahesh Pai as MD &amp; CEO,https://economictimes.indiatimes.com/markets/stocks/news/south-indian-bank-shares-tumble-9-after-four-day-rise-rbi-clears-mahesh-pai-as-md-ceo/articleshow/132254649.cms,2026-07-08 11:04:05 IST,"South Indian Bank shares fell sharply on Wednesday, snapping a four-session winning streak as investors booked profits after a sharp three-month rally. Meanwhile, the RBI approved the appointment of Mahesh Muralidhar Pai as the bank's Managing Director and CEO for a three-year term, effective October 1, 2026, subject to further approvals.",https://economictimes.indiatimes.com/markets/stocks/rssfeeds/2146843.cms
"Stocks to buy for short term: Reliance, Bharti Airtel, BEL among 5 shares Bajaj Broking's expert recommends for July",https://www.livemint.com/market/stock-market-news/stocks-to-buy-for-short-term-reliance-bharti-airtel-bel-among-5-shares-bajaj-brokings-expert-recommends-for-july-11783491139690.html,2026-07-08 13:43:53 IST,"Pabitro Mukherjee, Deputy Vice President - Technical, Bajaj Broking, recommends five stocks poised for potential short-term gains amid a bullish Nifty 50 outlook. Discover why Reliance, Bharti Airtel, BEL, HDFC Bank, and ITC are on his short-list and how to act in these market conditions.",https://www.livemint.com/rss/markets
₹939 crore order impact? INOX India share price jumps over 5% despite muted trends in the Indian stock market,https://www.livemint.com/market/stock-market-news/rs-939-crore-order-impact-inox-india-share-price-jumps-over-5-despite-muted-trends-in-the-indian-stock-market-11783496868366.html,2026-07-08 13:30:19 IST,"INOX India saw a 5% rise in its share price on July 8 after announcing orders totaling  ₹939 crore since May. The orders covered Industrial Gas, LNG, and Cryo-scientific Solutions, further establishing the company in the cryogenic systems market.",https://www.livemint.com/rss/markets
