title,link,published,summary,source
Ethanol ecosystem: Judging fear by noise is not evidence; is an index the answer? 15 stocks from the ecosystem,https://economictimes.indiatimes.com/markets/stocks/news/ethanol-ecosystem-judging-fear-by-noise-is-not-evidence-is-an-index-the-answer-15-stocks-from-the-ecosystem/articleshow/132339798.cms,2026-07-12 07:31:29 IST,"Sugar is one of the oldest distressed sectors in India. For decades it has swung between glut and shortage, carried heavy debt, was dependent on politically-set cane prices, and left farmers unpaid. Many of the companies have been financially weak for years, some for most of their listed lives. Ethanol was meant to change all that, giving mills a second, steadier stream of income and changing the whole ecosystem. Has it? Check out Stock Reports Plus, powered by Refinitiv, for price targets of over 4,000 listed stocks along with detailed company analysis focusing on five key components – earnings, fundamentals, relative valuation, risk, and price momentum – to generate standardised scores. SR+ Reports is a complimentary offering to ETPrime members.",https://economictimes.indiatimes.com/markets/stocks/rssfeeds/2146843.cms
Businesses that inch up even as the market consolidates: 5 mid- and small-cap stocks with an upside potential of up to 26%,https://economictimes.indiatimes.com/markets/stocks/news/businesses-that-inch-up-even-as-the-market-consolidates-5-mid-and-small-cap-stocks-with-an-upside-potential-of-up-to-26/articleshow/132339532.cms,2026-07-12 05:22:40 IST,"This is a market to be selective in, not brave in. The safer way to play a turn in the market is to stay with businesses whose demand does not depend on the mood on the street, the state of the economy, or the direction of the Nifty.",https://economictimes.indiatimes.com/markets/stocks/rssfeeds/2146843.cms
How Onida plans to reclaim its place in Indian homes,https://www.livemint.com/companies/news/onida-consumer-electronics-brands-india-smart-tv-brands-india-micron-11783661861680.html,2026-07-12 07:04:12 IST,"Once known for its 'Neighbour's envy, owner's pride' tagline, the consumer electronics brand is targeting mass-premium buyers under a new management team.",https://www.livemint.com/rss/companies
Switching jobs? Here is how you can convert your group health policy into an individual or family coverage plan,https://www.livemint.com/money/personal-finance/insurance-switching-jobs-what-you-can-do-steps-convert-your-employer-group-health-policy-individual-family-coverage-plan-11783779427271.html,2026-07-12 07:21:00 IST,"Want to switch jobs and keep your current insurance plan? Here is what you can do to convert your employer group health policy into an individual or family coverage plan. Check eligibility, steps, rules…",https://www.livemint.com/rss/money
"Reporting errors, not evasion, spark most tax litigations, say experts",https://www.livemint.com/money/personal-finance/tax-litigations-income-tax-filing-errors-taxpayers-itr-capital-gains-india-11783675373370.html,2026-07-12 07:01:31 IST,"The most avoidable source of tax litigation between individual taxpayers and the department is disputes over classification and disclosure—specifically, mismatches between how taxpayers report income or investments and how the department interprets them.",https://www.livemint.com/rss/money
Home loan EMI: Why paying more than 30% of income could hurt your financial freedom,https://www.livemint.com/money/personal-finance/home-loan-emi-why-paying-more-than-30-of-income-could-hurt-your-financial-freedom-11783512695345.html,2026-07-12 06:05:35 IST,"A high home loan EMI can strain monthly finances and delay wealth creation. Experts recommend keeping EMIs within 25-30% of monthly income to maintain savings, investments and financial security while managing homeownership comfortably and preparing for unexpected expenses.",https://www.livemint.com/rss/money
