title,link,published,summary,source
Vedanta to have special trading session for demerger today. What to expect,https://economictimes.indiatimes.com/markets/stocks/news/vedanta-to-have-special-trading-session-for-demerger-today-what-to-expect/articleshow/130612102.cms,2026-04-30 08:00:00 IST,Vedanta shares will trade ex-demerger today. A special session will adjust prices. Four new entities will list soon. This restructuring aims to unlock value. Investors should focus on future listings. Vedanta's Q4 results showed strong profit growth. The demerger is a significant corporate move in India's metals sector.,https://economictimes.indiatimes.com/markets/stocks/rssfeeds/2146843.cms
"GIFT Nifty trades lower, hints at a weak start for Dalal Street",https://economictimes.indiatimes.com/markets/stocks/news/pre-market-action-heres-the-trade-setup-for-todays-session/articleshow/130620724.cms,2026-04-30 06:38:51 IST,"Indian markets opened firm on Wednesday, buoyed by global cues and easing geopolitical tensions. However, gains were capped by surging crude oil prices and a weak rupee. Investor sentiment remains cautious ahead of state election exit poll results, with final outcomes expected to add to market volatility.",https://economictimes.indiatimes.com/markets/stocks/rssfeeds/2146843.cms
"Stocks in news: HUL, Bajaj Finance, Adani Power, Adani Enterprises, Vedanta, Tata Motors PV",https://economictimes.indiatimes.com/markets/stocks/news/stocks-in-news-hul-bajaj-finance-adani-power-adani-enterprises-vedanta-tata-motors-pv/articleshow/130620700.cms,2026-04-30 06:34:19 IST,"Indian markets anticipate the US Fed's decision and election exit polls today. Key companies including HUL, Bajaj Finance, and Adani Power will be watched closely. Adani Green plans significant battery storage expansion. Jaguar Land Rover faces a refund order. Vedanta foresees increased aluminium production costs due to geopolitical tensions.",https://economictimes.indiatimes.com/markets/stocks/rssfeeds/2146843.cms
FPI exodus in four months of 2026 surpasses all of last year,https://economictimes.indiatimes.com/markets/stocks/news/fpi-exodus-in-four-months-of-2026-surpasses-all-of-last-year/articleshow/130620628.cms,2026-04-30 06:20:09 IST,"Foreign investors have sold Indian stocks worth over ₹1.8 lakh crore in 2026. This outflow exceeds 2025's total. A weak rupee, high oil prices, and fewer AI investment chances are driving this trend. This selling is the most in the first four months of any year. South Korea and Taiwan saw more foreign interest due to AI and semiconductor themes.",https://economictimes.indiatimes.com/markets/stocks/rssfeeds/2146843.cms
Sebi fines Axis Trustee Services Rs 10 lakhs,https://economictimes.indiatimes.com/markets/stocks/news/sebi-fines-axis-trustee-services-rs-10-lakhs/articleshow/130620592.cms,2026-04-30 06:13:49 IST,Sebi has fined Axis Trustee Services ₹10 lakh. The penalty is for not promptly disclosing a ruling against former REIT executive Aravind Maiya. The National Financial Reporting Authority found Maiya guilty of misconduct. This information was crucial for unitholders and stock exchanges. Axis Trustee's delay in disclosure led to the regulatory action.,https://economictimes.indiatimes.com/markets/stocks/rssfeeds/2146843.cms
Vedanta shares likely to trade at Rs 300-325 post demerger,https://economictimes.indiatimes.com/markets/stocks/news/vedanta-shares-likely-to-trade-at-rs-300-325-post-demerger/articleshow/130620473.cms,2026-04-30 05:56:03 IST,"Vedanta is set to undergo a significant restructuring. From May, the company will be divided into five separate entities. The main Vedanta entity will trade independently from Thursday, excluding the four newly demerged businesses. Shareholders will receive one share in each of the four new companies for every Vedanta share they hold.",https://economictimes.indiatimes.com/markets/stocks/rssfeeds/2146843.cms
"D-St indices rise on strong earnings cues, war respite",https://economictimes.indiatimes.com/markets/stocks/news/d-st-indices-rise-on-strong-earnings-cues-war-respite/articleshow/130620379.cms,2026-04-30 05:33:58 IST,"Indian stock markets saw a strong rise on Wednesday. The Nifty and Sensex gained 0.8 percent each. This surge was fueled by positive earnings from major companies. Peace in West Asia also contributed to the market's upward movement. Despite high crude oil prices, investors showed confidence. Markets are expected to consolidate in the coming days.",https://economictimes.indiatimes.com/markets/stocks/rssfeeds/2146843.cms
Company's income not taxable in shareholders' hands: HC,https://economictimes.indiatimes.com/markets/stocks/news/companys-income-not-taxable-in-shareholders-hands-hc/articleshow/130620333.cms,2026-04-30 00:54:22 IST,"The Delhi High Court ruled shareholders do not own company assets. They only own shares. Therefore, they cannot be taxed on a company's income. Dividend income may be taxed. The court dismissed appeals by the Income Tax Department. It upheld a tribunal's order. Shareholders were not beneficial owners of company assets.",https://economictimes.indiatimes.com/markets/stocks/rssfeeds/2146843.cms
"India’s credit card market expands to 119 million, PSU banks gain in spends",https://economictimes.indiatimes.com/markets/stocks/news/indias-credit-card-market-expands-to-119-million-psu-banks-gain-in-spends/articleshow/130620518.cms,2026-04-30 00:53:00 IST,"India's credit card market has surpassed 119 million cards. HDFC Bank, SBI Cards, ICICI Bank, and Axis Bank dominate this sector. HDFC Bank is expanding its lead in both card numbers and spending value. Public sector banks are showing strong growth, especially in tier-2 and tier-3 markets. This expansion is driven by wider networks and partnerships.",https://economictimes.indiatimes.com/markets/stocks/rssfeeds/2146843.cms
Banks allowed to offer natural calamity relief suo motu from July 1,https://economictimes.indiatimes.com/markets/stocks/news/banks-allowed-to-offer-natural-calamity-relief-suo-motu-from-july-1/articleshow/130620528.cms,2026-04-30 00:52:09 IST,"The Reserve Bank of India is enabling banks to provide immediate relief to borrowers impacted by natural disasters. Banks can now offer rescheduling, moratoriums, and additional finance without waiting for borrower requests. The implementation of a new resolution framework has been postponed to July 1. This move aims to support those facing financial stress due to weather-related disruptions.",https://economictimes.indiatimes.com/markets/stocks/rssfeeds/2146843.cms
"RBI rejects NBFC pleas on funds, norms tightening",https://economictimes.indiatimes.com/markets/stocks/news/rbi-rejects-nbfc-pleas-on-funds-norms-tightening/articleshow/130620534.cms,2026-04-29 19:59:00 IST,The Reserve Bank of India has rejected several suggestions from Non-Banking Finance Companies. Equity investments in group entities will not be excluded from indirect public funds. Borrowings from promoters and related parties will be treated as public funds. Intra-group loans will be considered customer interface. These decisions are part of final directions for small NBFCs.,https://economictimes.indiatimes.com/markets/stocks/rssfeeds/2146843.cms
Stocks to buy for short term: From Lodha Developers to TVS Motor- Kotak Securities’ Amol Athawale suggests 3 shares,https://www.livemint.com/market/stock-market-news/stocks-to-buy-for-short-term-from-lodha-developers-to-tvs-motor-kotak-securities-amol-athawale-suggests-3-shares-11777477602775.html,2026-04-30 08:00:35 IST,"Stocks to buy for short term: Amol Athawale from Kotak Securities shares insights on short-term stock opportunities, including TVS Motor and Lodha Developers, emphasising key support levels and potential targets.",https://www.livemint.com/rss/markets
"Raja Venkatraman, MarketSmith recommend five stocks for 30 April",https://www.livemint.com/market/stock-market-news/raja-venkatraman-marketsmith-recommend-five-stocks-for-30-april-11777513009735.html,2026-04-30 07:37:59 IST,"The Indian stock indices Nifty 50 and Sensex saw gains on April 29, boosted by stock-specific advancements. Analysts suggest buying Vedanta, IndusInd Bank, Tata Consumer, Siemens Energy, and Navin Fluorine as the market faces pressures from rising oil prices and geopolitical uncertainties.",https://www.livemint.com/rss/markets
Vedanta Demerger LIVE Updates: Vedanta shares to trade ex-demerger today. Special price discovery session shortly,https://www.livemint.com/market/stock-market-news/vedanta-demerger-live-updates-vedanta-demerger-record-date-last-date-share-entitlement-price-discovery-listing-timeline-11777486702829.html,2026-04-30 07:35:48 IST,"Vedanta Demerger LIVE Updates: Follow Vedanta demerger LIVE updates as investors track May 1 record date, and April 30 share price discovery session. Vedanta demerger share entitlement ratio is 1:1, and the expected listing timeline for the demerged entities is mid-June.",https://www.livemint.com/rss/markets
"Buy or sell: Gift Nifty down after escalation in US-Iran war, Vaishali Parekh recommends three stocks to buy today",https://www.livemint.com/market/stock-market-news/buy-or-sell-gift-nifty-live-us-iran-war-us-fed-rate-vaishali-parekh-recommends-three-stocks-to-buy-today-11777512178503.html,2026-04-30 07:31:32 IST,"Buy or sell: Gift Nifty down, Vaishali Parekh recommends three stocks to buy today — Urban Company, Cipla, and KFin Tech",https://www.livemint.com/rss/markets
"Stocks to watch: Hindustan Unilever, Bajaj Finance, L&amp;T among 10 shares in focus today",https://www.livemint.com/market/stock-market-news/stocks-to-watch-hindustan-unilever-bajaj-finance-l-t-among-10-shares-in-focus-today-11777511633939.html,2026-04-30 07:27:49 IST,"Stock market today: The Indian stock market is likely to snap its gaining streak as trends in the Gift Nifty index signalled a negative opening on Thursday. Amid this backdrop, these stocks will remain in focus on Thursday, 30 April.",https://www.livemint.com/rss/markets
Crude nears $120 as Trump signals Hormuz blockade to continue,https://www.livemint.com/market/commodities/brent-crude-price-oil-prices-india-today-strait-of-hormuz-blockade-us-iran-war-11777511597576.html,2026-04-30 07:27:15 IST,"Brent crude traded close to $120 a barrel, following comments by US President Donald Trump that Washington would not end the ongoing naval blockade of the Strait of Hormuz until a nuclear deal is signed with Iran.",https://www.livemint.com/rss/markets
"Nifty 50, Sensex prediction today: Check how Indian stock market is expected to trade on 30 April",https://www.livemint.com/market/stock-market-news/nifty-50-sensex-prediction-today-check-how-indian-stock-market-is-expected-to-trade-on-30-april-11777513603762.html,2026-04-30 07:25:23 IST,"Nifty 50, Sensex prediction today: The trends on Gift Nifty also indicate a negative start for the Indian benchmark index. The Gift Nifty was trading around 24,165 level, a discount of nearly 86 points from the Nifty futures’ previous close.",https://www.livemint.com/rss/markets
"Gift Nifty, US Fed, oil prices to Microsoft, Google, Meta earnings: 15 things that changed for stock market overnight",https://www.livemint.com/market/stock-market-news/gift-nifty-us-fed-oil-prices-to-microsoft-google-meta-earnings-15-things-that-changed-for-stock-market-overnight-11777512845373.html,2026-04-30 07:11:44 IST,"Gift Nifty was trading around 24,185 level, a discount of nearly 67 points from the Nifty futures’ previous close, indicating a negative start for the Indian stock market indices.",https://www.livemint.com/rss/markets
Breakout stocks to buy or sell: Sumeet Bagadia recommends five shares to buy today — 30 April 2026,https://www.livemint.com/market/stock-market-news/breakout-stocks-to-buy-or-sell-sumeet-bagadia-recommends-five-shares-to-buy-today-30-april-2026-11777509728462.html,2026-04-30 06:34:22 IST,The Indian stock market ended Wednesday's session on a negative note. Sumeet Bagadia of Choice Broking recommends five breakout stocks to buy today.,https://www.livemint.com/rss/markets
Stocks to trade: Raja Venkatraman recommends 3 stocks for 30 April,https://www.livemint.com/market/stock-market-news/stocks-to-trade-raja-venkatraman-recommends-3-stocks-for-30-april-11777480249740.html,2026-04-30 06:29:33 IST,Market expert Raja Venkatraman shares his top stock picks for 30 April. Here’s his technical outlook and trade strategy.,https://www.livemint.com/rss/markets
Stock recommendations for 30 April from MarketSmith India,https://www.livemint.com/market/stock-market-news/stock-recommendations-for-30-april-from-marketsmith-india-11777465367331.html,2026-04-30 06:00:13 IST,"MarketSmith India reveals its top stock recommendations for today, 30 April. Get expert insights into the best-performing stocks to guide your investment decisions.",https://www.livemint.com/rss/markets
Gold Holds Three-Day Decline as Hawkish Fed Flags Inflation Risk,https://www.livemint.com/market/gold-holds-three-day-decline-as-hawkish-fed-flags-inflation-risk-11777507667245.html,2026-04-30 05:37:46 IST,Gold held a three-day loss after a divided Federal Reserve kept US interest rates steady and said the war in Iran was clouding the economic outlook.,https://www.livemint.com/rss/markets
Bet early and exit often: How IIMA Ventures creates a healthy investment cycle,https://www.livemint.com/companies/bet-early-and-exit-often-how-iima-ventures-creates-a-healthy-investment-cycle-deeptech-startups-funding-11777455951415.html,2026-04-30 06:22:33 IST,IIMA Ventures exited Pune-based Unbox Robotics earlier this year when the warehouse automation startup raised $28 million in its Series B round led by ICICI Venture. Other exits include a 60X return on its investment in drone delivery startup Airbound.,https://www.livemint.com/rss/companies
SIP + lump sum: A roadmap to  ₹10 crore in 25 years,https://www.livemint.com/money/personal-finance/sip-strategy-lump-sum-investment-asset-allocation-balanced-advantage-fund-flexi-cap-fund-multi-cap-fund-equity-savings-11777440416124.html,2026-04-30 05:45:12 IST,"With  ₹25,000 monthly SIPs and  ₹10–12 lakh to deploy, here’s a structured asset allocation plan to target a  ₹10–15 crore corpus over 25 years while managing volatility and risk",https://www.livemint.com/rss/money
Another buyback offer coming soon! This time it's from Bajaj Auto,https://economictimes.indiatimes.com/markets/stocks/news/another-buyback-offer-coming-soon-this-time-its-from-bajaj-auto/articleshow/130624283.cms,2026-04-30 11:04:19 IST,"Bajaj Auto has announced that its board will consider a share buyback proposal on May 6, 2026, signalling plans to return surplus cash to shareholders. The move, if approved, will follow regulations under the Companies Act, 2013 and Sebi’s buyback rules.",https://economictimes.indiatimes.com/markets/stocks/rssfeeds/2146843.cms
"After April's 8% gains, Nifty bulls look to ride May's positive seasonality on DII support",https://economictimes.indiatimes.com/markets/stocks/news/after-aprils-8-gains-nifty-bulls-look-to-ride-mays-positive-seasonality-on-dii-support/articleshow/130623912.cms,2026-04-30 10:43:46 IST,"Indian stock markets are poised for a positive May, following an 8% gain in April, with historical data showing a bullish trend for the month. Domestic institutional investors (DIIs) have consistently provided support, often counterbalancing volatile foreign institutional investor (FII) flows. This DII strength is expected to aid market stability as May begins.",https://economictimes.indiatimes.com/markets/stocks/rssfeeds/2146843.cms
"Vedanta's 65% share price crash an illusion, the stock is down just 5%. Here's why",https://economictimes.indiatimes.com/markets/stocks/news/vedantas-65-share-price-crash-an-illusion-the-stock-is-down-just-5-heres-why/articleshow/130623628.cms,2026-04-30 10:36:22 IST,"Vedanta shares adjusted significantly post-demerger, appearing to crash but actually declining 5% as four entities (Aluminium, Power, Oil &amp; Gas, Steel) were separated. This restructuring aims to unlock shareholder value by allowing independent businesses to be valued more fairly. The demerger, approved by NCLT, sees the base metals business remain with a restructured Vedanta, while new entities will list separately.",https://economictimes.indiatimes.com/markets/stocks/rssfeeds/2146843.cms
"Stock market holiday alert: Are BSE, NSE open or closed on May 1?",https://economictimes.indiatimes.com/markets/stocks/news/stock-market-holiday-alert-are-bse-nse-open-or-closed-on-may-1/articleshow/130623178.cms,2026-04-30 10:05:32 IST,"NSE holidays 2026: Indian stock markets will observe a shortened trading week, with both NSE and BSE closed on Friday, May 1, for Maharashtra Day. A total of 16 holidays are scheduled for 2026, with 8 more closures to follow after this week. MCX will have a partial closure, while NCDEX will be fully closed.",https://economictimes.indiatimes.com/markets/stocks/rssfeeds/2146843.cms
Volatile market? You would have made up to 400% return in these 12 penny stocks in just 6 months,https://economictimes.indiatimes.com/markets/stocks/news/volatile-market-you-would-have-made-up-to-400-return-in-these-12-penny-stocks-in-just-6-months/articleshow/130623214.cms,2026-04-30 10:05:23 IST,"Despite a struggling broader market, several penny stocks delivered exceptional returns, with some surging over 400% in just six months. These low-priced stocks significantly outperformed benchmark indices, driven by speculative interest and a shift towards higher-risk, higher-return segments by domestic investors seeking quick gains amidst global uncertainty.",https://economictimes.indiatimes.com/markets/stocks/rssfeeds/2146843.cms
"KFin Technologies shares slip 2% after YoY drop in Q4 profit; Jefferies maintains ‘buy’, sees 26% upside",https://economictimes.indiatimes.com/markets/stocks/news/kfin-technologies-shares-slip-2-after-yoy-drop-in-q4-profit-jefferies-maintains-buy-sees-26-upside/articleshow/130623058.cms,2026-04-30 09:59:41 IST,"KFin Technologies saw a dip on Thursday after reporting a 4.6% YoY drop in Q4 FY26 profit, though revenue rose 23%. Jefferies maintained a “buy” rating with a Rs 1,200 target, citing strong MF and international growth. Despite short-term weakness and bearish technical signals, long-term prospects remain supported by robust fundamentals and expansion.",https://economictimes.indiatimes.com/markets/stocks/rssfeeds/2146843.cms
"Adani Enterprises, GMR Airports, among 11 stocks where promoters increased stake. How many do you own?",https://economictimes.indiatimes.com/markets/stocks/news/adani-enterprises-gmr-airports-among-11-stocks-where-promoters-increased-stake-how-many-do-you-own/slideshow/130622846.cms,2026-04-30 09:35:39 IST,"Indian promoters have reversed a two-year selling trend, investing over $4 billion into their companies since January 1, 2026, as valuations became more attractive after a market correction. This significant shift sees major stake increases in companies like Adani Enterprises and GMR Airports, signaling renewed confidence from insiders.",https://economictimes.indiatimes.com/markets/stocks/rssfeeds/2146843.cms
"Bajaj Finance shares jump 4% after strong Q4 results. Why Jefferies, Morgan Stanley and others are bullish",https://economictimes.indiatimes.com/markets/stocks/news/bajaj-finance-shares-jump-4-after-strong-q4-results-why-jefferies-morgan-stanley-and-others-are-bullish/articleshow/130622707.cms,2026-04-30 09:32:26 IST,"Bajaj Finance shares rose up to 4.2% after the company reported a 22% YoY jump in Q4 net profit to Rs 5,553 crore. AUM crossed Rs 5 lakh crore, growing 22%, while quarterly AUM addition stood at Rs 25,498 crore. Strong momentum was driven by robust loan growth, with 12.89 million loans booked and customer base rising 17% to 119.33 million.",https://economictimes.indiatimes.com/markets/stocks/rssfeeds/2146843.cms
Forget the noise: These 54 smallcap stocks attracted FII buying in March quarter,https://economictimes.indiatimes.com/markets/stocks/news/forget-the-noise-these-54-smallcap-stocks-attracted-fii-buying-in-march-quarter/articleshow/130622670.cms,2026-04-30 09:30:15 IST,"Foreign institutional investors are strategically buying into beaten-down smallcap stocks in India, increasing stakes in 54 companies despite broader market caution. This ""buy the dip"" approach signals a search for value among temporarily mispriced, structurally sound businesses. The accumulation occurred during the March quarter, contrasting with exits from other smallcaps.",https://economictimes.indiatimes.com/markets/stocks/rssfeeds/2146843.cms
"Why is market falling today? Sensex slumps 1,200 pts, Nifty below 23,850; 7 key triggers behind bloodbath",https://economictimes.indiatimes.com/markets/stocks/news/why-is-the-market-falling-today-sensex-drops-900-points-nifty-below-24000-7-key-factors/articleshow/130622569.cms,2026-04-30 09:28:04 IST,"Indian stock markets experienced a significant downturn on Thursday, with Sensex and Nifty dropping over 1% each. Soaring oil prices to historic levels, a plunging rupee to an all-time low, and sustained foreign investor selling contributed to the broad-based selloff, erasing nearly Rs 9 lakh crore from market capitalization.",https://economictimes.indiatimes.com/markets/stocks/rssfeeds/2146843.cms
F&amp;O Radar: Bull Call strategy for Reliance Industries this week,https://economictimes.indiatimes.com/markets/stocks/news/fo-radar-bull-call-strategy-for-reliance-industries-this-week/articleshow/130622549.cms,2026-04-30 09:24:40 IST,"Reliance Industries shows signs of a technical reversal after bouncing from key weekly support aligned with its 200-week EMA. A bullish engulfing pattern, rising open interest and improving RSI indicate fresh long build-up. Analysts suggest a call ratio spread strategy, with resistance at Rs 1500 and Rs 1600 levels.",https://economictimes.indiatimes.com/markets/stocks/rssfeeds/2146843.cms
"ITC among 4 stocks flashing bullish signals, hinting at a possible uptrend",https://economictimes.indiatimes.com/markets/stocks/news/itc-among-4-stocks-flashing-bullish-signals-hinting-at-a-possible-uptrend/slideshow/130622386.cms,2026-04-30 09:04:31 IST,A White Marubozu is a bullish candlestick pattern in technical analysis that occurs when the opening price is the lowest for a given period and the closing price is the highest.,https://economictimes.indiatimes.com/markets/stocks/rssfeeds/2146843.cms
"L&amp;T shares in focus as firm set to sell entire stake in Hyderabad Metro Rail arm for Rs 1,461 crore",https://economictimes.indiatimes.com/markets/stocks/news/lt-shares-in-focus-as-firm-set-to-sell-entire-stake-in-hyderabad-metro-rail-arm-for-rs-1461-crore/articleshow/130622172.cms,2026-04-30 08:55:35 IST,"Larsen &amp; Toubro will sell its stake in L&amp;T Metro Rail Hyderabad. The deal is valued at Rs 1,461.47 crore. This transaction will make L&amp;T Metro Rail Hyderabad no longer a subsidiary. The sale is expected to conclude by June 30. Hyderabad Metro Rail Limited will refinance the existing debt. L&amp;T's corporate guarantee will be released upon completion.",https://economictimes.indiatimes.com/markets/stocks/rssfeeds/2146843.cms
Tech Mahindra among 5 stocks showing bullish RSI upswing,https://economictimes.indiatimes.com/markets/stocks/news/tech-mahindra-among-5-stocks-showing-bullish-rsi-upswing/slideshow/130622261.cms,2026-04-30 08:54:04 IST,An uptrend signal is generated when the RSI crosses above 50 from below.,https://economictimes.indiatimes.com/markets/stocks/rssfeeds/2146843.cms
Godfrey Phillips India among 5 stocks that closed above VWAP,https://economictimes.indiatimes.com/markets/stocks/news/godfrey-phillips-india-among-5-stocks-that-closed-above-vwap/slideshow/130622143.cms,2026-04-30 08:48:17 IST,"Five stocks from the Nifty 500 universe closed over 1% above their VWAP on April 29, indicating strong intraday buying and improving market sentiment. A close above VWAP reflects price strength during the session and is considered a short-term bullish signal, suggesting sustained accumulation and the potential for continued upward momentum.",https://economictimes.indiatimes.com/markets/stocks/rssfeeds/2146843.cms
"Waaree Energies shares crash 9% despite 75% increase in Q4 net profit, upbeat FY27 guidance",https://economictimes.indiatimes.com/markets/stocks/news/waaree-energies-shares-in-focus-after-q4-net-profit-rockets-75-firm-gives-strong-fy27-guidance/articleshow/130622003.cms,2026-04-30 08:44:49 IST,"Waaree Energies shares tanked as much as 9% even after a robust March quarter and full-year performance. The company reported significant revenue and profit growth. Strategic investments in polysilicon and expansion of module and ingot facilities are underway. Waaree also announced a new glass manufacturing unit. The company has guided for strong EBITDA in FY27, signaling continued growth and value chain integration.",https://economictimes.indiatimes.com/markets/stocks/rssfeeds/2146843.cms
Negative Breakout: These 7 stocks closed below their 200 DMA,https://economictimes.indiatimes.com/markets/stocks/news/negative-breakout-these-7-stocks-closed-below-their-200-dma/slideshow/130621978.cms,2026-04-30 08:39:17 IST,"Seven large-cap stocks slipped below their 200-day moving averages, signalling weakening technical momentum and a potential bearish trend. This breakdown reflects sustained selling pressure and rising investor caution, as the 200 DMA is widely tracked as a crucial long-term support level used to assess overall market direction and trend strength.",https://economictimes.indiatimes.com/markets/stocks/rssfeeds/2146843.cms
