title,link,published,summary,source
Big Four look beyond metros to tap growth goals of smaller businesses,https://www.livemint.com/companies/news/big-four-small-cities-sme-consulting-tax-business-11782624866556.html,2026-06-29 06:00:32 IST,"The Big Four consulting firms are expanding into India's tier-2 and -3 cities, drawn by smaller businesses and family-run enterprsies increasingly seeking professionalization and a surge in GCCs. AI platforms and agentic AI are enabling this push, reducing the need for on-ground partner teams.",https://www.livemint.com/rss/companies
Inside the shift in CEO pay structure of a 100-year-old apparel company,https://www.livemint.com/companies/people/inside-the-shift-in-ceo-pay-structure-of-a-100-year-old-apparel-company-raymond-lifestyle-11782635859501.html,2026-06-29 05:55:32 IST,"Raymond Lifestyle has restructured new CEO Satyaki Ghosh's pay package as the company tries to end a run of four CEO exits in five years. The move comes even as the company's revenue and profit have grown post-demerger, while its stock has sharply underperformed peers and the broader market.",https://www.livemint.com/rss/companies
"Gold, silver prices today, 29 June: Check retail rates of 24K, 22K gold, 999 silver in Delhi, Mumbai and Kolkata",https://www.livemint.com/money/personal-finance/gold-silver-prices-today-29-june-check-retail-rates-of-24k-22k-gold-999-silver-in-delhi-mumbai-and-kolkata-11782703990436.html,2026-06-29 09:49:00 IST,"Gold and silver prices today, 29 June: Check the latest 24K, 22K gold and 999 silver retail rates across Delhi, Mumbai, Kolkata and other major Indian cities, along with MCX market updates.",https://www.livemint.com/rss/money
How to e-Verify your income tax return: Different ways to verify your ITR and step-by-step process,https://www.livemint.com/money/personal-finance/how-to-e-verify-your-income-tax-return-different-ways-to-verify-your-itr-and-step-by-step-process-11782698650921.html,2026-06-29 09:33:37 IST,"e-Verify is a digital process to authenticate your Income Tax Return after filing. You must e-Verify your ITR within 30 days from the date of filing your return. If not done within the deadline, the IT department may treat your return as invalid.",https://www.livemint.com/rss/money
"EPFO portal upgrade 2026 enters final day, EPF claim services expected to resume soon",https://www.livemint.com/money/personal-finance/epfo-portal-upgrade-2026-enters-final-day-epf-claim-services-expected-to-resume-soon-11782700135269.html,2026-06-29 08:56:56 IST,"The final day of the EPFO portal upgrade marks the last phase of the planned system overhaul. The upgrade is set to improve EPF claim processing, boost service efficiency and deliver a faster digital experience for millions of EPF members, with services likely to be restored from tomorrow.&amp;nbsp;",https://www.livemint.com/rss/money
Aarogya Setu 2.0 launch today: How India’s new digital health platform may cut healthcare costs,https://www.livemint.com/money/personal-finance/aarogya-setu-2-0-launch-today-how-india-s-new-digital-health-platform-may-cut-healthcare-costs-11782696368338.html,2026-06-29 07:40:00 IST,"A smarter healthcare future begins with Aarogya Setu 2.0, bringing digital health records, ABHA integration, insurance support and easier access to medical services. The new platform aims to simplify healthcare access, reduce paperwork and improve patient experiences.",https://www.livemint.com/rss/money
8th Pay Commission: 5 key employee demands take centre stage ahead of crucial July consultations,https://www.livemint.com/money/personal-finance/8th-pay-commission-5-key-employee-demands-take-centre-stage-ahead-of-crucial-july-consultations-11782692730592.html,2026-06-29 06:41:39 IST,"8th Pay Commission: Five major employee demands move into focus ahead of July consultations. Demands include pension revision, pay parity, maternity benefits and other allowances.",https://www.livemint.com/rss/money
From ITR filing to TDS: 6 major tax deadlines in July 2026 that every taxpayer should know,https://www.livemint.com/money/personal-finance/from-itr-filing-to-tds-6-major-tax-deadlines-in-july-2026-that-every-taxpayer-should-know-11782574257342.html,2026-06-29 06:02:52 IST,"July is crucial for taxpayers due to key compliance deadlines, including income tax return filing. Missing deadlines can result in penalties and late fees. Full list of due dates this month.",https://www.livemint.com/rss/money
"EPFO 3.0: UPI, ATM withdrawal facility rollout date, limit, will you get an ATM card — All questions answered",https://www.livemint.com/money/personal-finance/epfo-3-0-upi-atm-withdrawal-facility-rollout-date-limit-will-you-get-an-atm-card-faqs-answered-11782569614538.html,2026-06-29 05:42:06 IST,EPFO subscribers can soon withdraw provident fund savings via UPI apps and EPF-linked ATMs under the new EPFO 3.0 digital platform.&amp;nbsp;,https://www.livemint.com/rss/money
The AI boom won't burst all at once. It will pop in 'rolling bubbles': Macquarie,https://economictimes.indiatimes.com/markets/stocks/news/the-ai-boom-wont-burst-all-at-once-it-will-pop-in-rolling-bubbles-macquarie/articleshow/132069940.cms,2026-06-29 16:07:16 IST,"Macquarie expects the AI investment boom to unwind through a series of ""rolling bubbles"" rather than a single crash, as different segments of the AI ecosystem heat up and cool down over time. Global AI investment has surged to about $850 billion in 2026, far exceeding historical technology booms.",https://economictimes.indiatimes.com/markets/stocks/rssfeeds/2146843.cms
HAL announces final dividend of Rs 10 for FY26. Check record date and other details,https://economictimes.indiatimes.com/markets/stocks/news/hal-announces-final-dividend-of-rs-10-for-fy26-check-record-date-and-other-details/articleshow/132068280.cms,2026-06-29 14:40:14 IST,"HAL has declared a final dividend of Rs 10 per share (200%) for FY26, subject to shareholder approval at the upcoming AGM. The record date is set for August 14, 2026. The payout will be made within 30 days of approval, along with updates on recent financial performance.",https://economictimes.indiatimes.com/markets/stocks/rssfeeds/2146843.cms
Aastha Spintex IPO off to a steady start; issue subscribed 52% on Day 1. Check GMP &amp; key details,https://economictimes.indiatimes.com/markets/stocks/news/aastha-spintex-ipo-off-to-a-steady-start-issue-subscribed-52-on-day-1-check-gmp-key-details/articleshow/132068095.cms,2026-06-29 14:34:34 IST,"Aastha Spintex IPO saw a steady start on Day 1, subscribed 52% by mid-session, with strong NII demand leading the response. The issue carries a 4% grey market premium, indicating modest listing gains. Proceeds will fund Falcon Yarns acquisition, working capital needs, and general corporate purposes.",https://economictimes.indiatimes.com/markets/stocks/rssfeeds/2146843.cms
"Rs 8,350 crore crash in Persistent shares explained: Why investors are worried about Nagarro deal",https://economictimes.indiatimes.com/markets/stocks/news/rs-8350-crore-crash-in-persistent-shares-explained-why-investors-are-worried-about-nagarro-deal/articleshow/132067201.cms,2026-06-29 13:39:09 IST,"Persistent Systems' shares plunged nearly 11% following its announcement to acquire Germany-based Nagarro for €1.27 billion. While the deal aims to boost European presence and revenue, brokerages expressed caution over pricey valuations and execution risks.",https://economictimes.indiatimes.com/markets/stocks/rssfeeds/2146843.cms
Stock picks of the week: 5 stocks with consistent score improvement and upside potential of up to 28%,https://economictimes.indiatimes.com/markets/stocks/news/stock-picks-of-the-week-5-stocks-with-consistent-score-improvement-and-upside-potential-of-up-to-28/articleshow/132066950.cms,2026-06-29 13:38:59 IST,"It is quite likely that the news cycle this and the next week will be about the direction of US interest rates and yield. If that turns out to be a headwind, then the bulls may face some issues; but if it does not (and no shocks emerge from the Gulf region), things may be better for the bulls. Our selected stocks for today depict a strong upward trajectory in their overall average score which is based on five key pillars: Earnings, fundamentals, relative valuation, risk, and price momentum. This implies that there has been a significant improvement in their market outlook in the given time frame.",https://economictimes.indiatimes.com/markets/stocks/rssfeeds/2146843.cms
"Dividend alert! Last day to buy Bajaj Finance, 2 other Bajaj Group stocks for dividends worth Rs 138",https://economictimes.indiatimes.com/markets/stocks/news/dividend-alert-last-day-to-buy-bajaj-finance-2-other-bajaj-group-stocks-for-dividends-worth-rs-138/articleshow/132066570.cms,2026-06-29 13:12:43 IST,"Investors have a final chance today to buy shares in Bajaj Finance, Bajaj Finserv, and Bajaj Holdings and Investment to be eligible for significant dividends. Bajaj Finance offers Rs 6 per share, Bajaj Finserv Rs 1.50, and Bajaj Holdings and Investment a substantial Rs 130 per share.  This opportunity arises due to the T+1 settlement cycle, making today as the last day to secure these payouts.",https://economictimes.indiatimes.com/markets/stocks/rssfeeds/2146843.cms
"Zerodha now wants to enter investment banking space, seeks Sebi nod",https://economictimes.indiatimes.com/markets/stocks/news/zerodha-now-wants-to-enter-investment-banking-space-seeks-sebi-nod/articleshow/132066400.cms,2026-06-29 13:05:31 IST,"Zerodha has applied to SEBI for a Category I merchant banking licence, signalling its entry into investment banking. The move aligns with India’s strong IPO pipeline and expanding capital markets activity. If approved, it will deepen Zerodha’s diversification beyond broking into a broader financial services platform",https://economictimes.indiatimes.com/markets/stocks/rssfeeds/2146843.cms
"FIIs double stakes in 14 stocks; rally up to 400% in a year, 5 turn multibaggers",https://economictimes.indiatimes.com/markets/stocks/news/fiis-double-stakes-in-14-stocks-rally-up-to-400-in-a-year-5-turn-multibaggers/slideshow/132066296.cms,2026-06-29 12:51:01 IST,"Foreign Institutional Investors doubled their stakes in 14 stocks within the BSE 1000 universe between March 2025 and March 2026, signalling accumulation. Around 51 stocks saw holdings more than double. Of these, 22 delivered over 25% returns. The highlighted 14 stocks gained 50–400%, with five turning into multibaggers over the year.",https://economictimes.indiatimes.com/markets/stocks/rssfeeds/2146843.cms
Nifty indices rejig goes live today: Which stocks will see biggest inflows and outflows?,https://economictimes.indiatimes.com/markets/stocks/news/nifty-indices-rejig-goes-live-today-which-stocks-will-see-biggest-inflows-and-outflows/articleshow/132065646.cms,2026-06-29 12:34:30 IST,"The NSE’s quarterly index rebalancing takes effect today, triggering significant passive fund flows across Indian equities due to changes in free-float weights. While the Nifty 50 sees limited adjustments, broader strategic indices are witnessing sharper reshuffling.",https://economictimes.indiatimes.com/markets/stocks/rssfeeds/2146843.cms
"Amazon’s rapid delivery push triggers $15 billion rout for Eternal, Swiggy",https://economictimes.indiatimes.com/markets/stocks/news/amazons-rapid-delivery-push-triggers-15-billion-rout-for-eternal-swiggy/articleshow/132065171.cms,2026-06-29 12:06:08 IST,"Eternal and Swiggy have pioneered India’s 10-minute delivery space, but rising competition is intensifying pressure. Blinkit and Instamart shares have fallen sharply amid concerns over Amazon and Flipkart expanding into rapid commerce through dark stores. The $11 billion segment is heating up further as Zepto prepares a $1 billion IPO to strengthen its expansion plans.",https://economictimes.indiatimes.com/markets/stocks/rssfeeds/2146843.cms
"PFC-REC merger explained: Swap ratio, rationale, other key details as merger set to create Rs 11 lakh cr power financing giant",https://economictimes.indiatimes.com/markets/stocks/news/pfc-rec-merger-explained-swap-ratio-rationale-other-key-details-as-merger-set-to-create-rs-11-lakh-cr-power-financing-giant/articleshow/132065085.cms,2026-06-29 12:00:15 IST,"The proposed merger of Power Finance Corporation and REC will create India's largest power sector financing institution with a combined loan book exceeding Rs 11 lakh crore. Here's a look at the approved share swap ratio, merger rationale, pending approvals, record date details, and what the restructuring means for shareholders.",https://economictimes.indiatimes.com/markets/stocks/rssfeeds/2146843.cms
Hexaware Technologies shares jump 8% after securing Anthropic authorised reseller status for Amazon Bedrock,https://economictimes.indiatimes.com/markets/stocks/news/hexaware-technologies-shares-jump-8-after-securing-anthropic-authorised-reseller-status-for-amazon-bedrock/articleshow/132064151.cms,2026-06-29 11:17:32 IST,"Hexaware Technologies shares rose sharply on Monday after the IT services company became an Anthropic Authorised Reseller for Amazon Bedrock. The designation allows Hexaware to sell, integrate and support Claude AI models for enterprises, strengthening its AI offerings and expanding its enterprise-focused generative AI capabilities across multiple industries.",https://economictimes.indiatimes.com/markets/stocks/rssfeeds/2146843.cms
Waaree Energies shares crash 5%. Can this US ruling dent solar panel maker's image for long?,https://economictimes.indiatimes.com/markets/stocks/news/waaree-energies-shares-crash-5-can-this-us-ruling-dent-solar-panel-makers-image-for-long/articleshow/132064045.cms,2026-06-29 11:12:53 IST,"Waaree Energies shares fell nearly 5% after a US Customs ruling triggered concerns over reputational impact despite the company’s clarification. JM Financial retained its ‘Add’ rating, saying downside may remain limited, though tariff outcomes, appeals and potential spillover effects remain key factors to monitor.",https://economictimes.indiatimes.com/markets/stocks/rssfeeds/2146843.cms
"Market wrap: Sensex falls 372 points, Nifty closes below 23,950; Kotak Mahindra Bank drops 3%",https://economictimes.indiatimes.com/markets/stocks/news/sensex-falls-50-points-nifty-above-24050-eternal-sun-pharma-techm-rise-1/articleshow/132062424.cms,2026-06-29 09:30:25 IST,"Indian markets ended lower as Sensex and Nifty snapped a two-session winning streak, pressured by geopolitical tensions in the Middle East and broad-based selling. While pharma outperformed, auto stocks dragged. Analysts flagged near-term volatility but maintained a constructive outlook for Nifty above key support levels amid mixed global cues.",https://economictimes.indiatimes.com/markets/stocks/rssfeeds/2146843.cms
"Top Gainers &amp; Losers on June 29: Persistent Systems, Netweb Tech, Astral, MRF, Berger Paints, OLA among top losers",https://www.livemint.com/market/stock-market-news/top-gainers-losers-on-june-29-persistent-systems-netweb-tech-astral-mrf-berger-paints-ola-among-top-losers-11782728130470.html,2026-06-29 15:52:15 IST,"Indian equities continued their decline on June 29, with the Nifty 50 dropping 0.46% and the BSE Sensex falling 0.44% amid renewed Middle East tensions. While pharmaceutical and metal stocks gained, auto and technology shares suffered notable losses, reflecting mixed sectoral performance.",https://www.livemint.com/rss/markets
"Stock market today: Sensex falls 400 points, Nifty 50 ends below 23,950; Reliance, Kotak Mahindra Bank among top drags",https://www.livemint.com/market/stock-market-news/stock-market-today-sensex-falls-400-points-nifty-50-ends-below-23-950-reliance-kotak-mahindra-bank-among-top-drags-11782726454107.html,2026-06-29 15:33:21 IST,"The Sensex ended the day 372 points, or 0.48%, lower at 76,728.37, while the Nifty 50 settled at 23,946.25, down 110 points, or 0.46%. The Nifty Midcap 100 index dropped 0.37%, while the Smallcap 100 index declined 0.62%.",https://www.livemint.com/rss/markets
Small-cap stock under  ₹50 jumps after announcement of amalgamation move,https://www.livemint.com/market/stock-market-news/smallcap-stock-under-rs-50-jumps-after-announcement-of-amalgamation-move-11782725267110.html,2026-06-29 15:27:35 IST,"VMS TMT's stock rose following the announcement of an approved merger with Aditya Ultra Steel Limited, aimed at creating a larger and more efficient steel manufacturing entity, pending necessary approvals. Shareholders of AUSL will receive 75 VMS TMT shares for every 100 shares held.",https://www.livemint.com/rss/markets
Hexaware Technologies stock gains 9% after expanding AI partnership with Anthropic,https://www.livemint.com/market/stock-market-news/hexaware-technologies-stock-gains-9-after-expanding-ai-partnership-with-anthropic-11782722964191.html,2026-06-29 15:16:47 IST,"Hexaware Technologies shares rose 9% to  ₹539 after becoming an Anthropic Authorized Reseller for Amazon Bedrock, allowing direct integration of Claude models for enterprise use, enhancing its AI-first strategy and offering clients customized AI solutions.",https://www.livemint.com/rss/markets
Multibagger defence stock Apollo Micro Systems jumps 7% despite stock market sell-off,https://www.livemint.com/market/stock-market-news/multibagger-defence-stock-apollo-micro-systems-jumps-7-despite-stock-market-selloff-11782723132185.html,2026-06-29 14:55:19 IST,"Apollo Micro Systems shares rose over 7% on June 29, following news of a potential  ₹30,000-crore order for Bharat Electronics Ltd under the QRSAM program, expected to be approved soon. The company also plans a Board meeting on July 6 for potential fundraising.",https://www.livemint.com/rss/markets
Big boost for Zee Media Corporation! Mauritius-based FII raises stake to 5.04%,https://www.livemint.com/market/stock-market-news/big-boost-for-zee-media-corporation-mauritius-based-fii-raises-stake-to-504-11782724298796.html,2026-06-29 14:52:17 IST,"Zee Media has disclosed that Magnifica Global Opportunities VCC acquired 4.5 crore convertible warrants, raising its holding to 5.04%. The warrants, issued at  ₹8.50 each, are convertible within 18 months. Prior to this, the fund held 0.06% of voting shares.",https://www.livemint.com/rss/markets
Stock market strategy: Buy on dips or sell on rallies? Here’s what experts recommend,https://www.livemint.com/market/stock-market-news/stock-market-strategy-buy-on-dips-or-sell-on-rallies-here-s-what-experts-recommend-11782723893359.html,2026-06-29 14:45:42 IST,"Stock market strategy: Rather than focusing solely on Nifty 50 stocks, investors should consider companies outside the index that are delivering robust earnings growth. Attractive opportunities currently exist across large-cap, mid-cap and small-cap segments, analyst said.",https://www.livemint.com/rss/markets
NBFC stock Aptus Value Housing Finance climbs over 3%; Citi sees over 30% upside potential,https://www.livemint.com/market/stock-market-news/nbfc-stock-aptus-value-housing-finance-climbs-over-3-citi-sees-over-30-upside-potential-11782722286037.html,2026-06-29 14:35:01 IST,"Shares of Aptus Value Housing Finance have been enjoying healthy buying interest of late. They have jumped over 35% in the last three months. So far in June, the stock is up more than 3%.",https://www.livemint.com/rss/markets
"Nifty IT index crashes 28% YTD. Buy or wait, as renewed US-Iran tension may jeopardise crude oil supply again?",https://www.livemint.com/market/stock-market-news/nifty-it-index-crashes-28-ytd-buy-or-wait-as-renewed-us-iran-tension-may-jeopardise-crude-oil-supply-again-11782720049632.html,2026-06-29 14:15:28 IST,"Indian IT stocks have declined 28.71% YTD, outpacing the Nifty 50's 8.32% drop due to concerns over slowing global spending. Analysts suggest a tentative recovery, influenced by delayed client decisions and geopolitical tensions, as traditional growth models face disruption from AI.",https://www.livemint.com/rss/markets
Jivial Industries IPO allotment likely to be out today. Here's step-by-step guide on how to check status,https://www.livemint.com/market/ipo/jivial-industries-ipo-allotment-likely-to-be-out-today-heres-step-by-step-guide-on-how-to-check-status-11782719020035.html,2026-06-29 14:06:56 IST,"The IPO has been priced at  ₹196 per share and consists of a fresh issue worth  ₹26.65 crore and an offer-for-sale (OFS) of  ₹5.34 crore, taking the total issue size to  ₹31.99 crore.",https://www.livemint.com/rss/markets
Can Astral's demerger catalyze chemicals growth?,https://www.livemint.com/market/mark-to-market/astral-demerger-stock-falls-astral-chemie-pidilite-industries-11782716517708.html,2026-06-29 13:55:08 IST,"Astral's chemicals demerger sharpens business focus, but investors remain unconvinced. The key question is whether the spin-off can revive margins and justify the stock's rich valuation.",https://www.livemint.com/rss/markets
"Radico Khaitan, Allied Blenders shares get Jefferies’ ‘Buy’ rating; up to 25% upside seen; Should you buy?",https://www.livemint.com/market/stock-market-news/radico-khaitan-allied-blenders-shares-get-jefferies-buy-rating-up-to-25-upside-seen-should-you-buy-11782720597618.html,2026-06-29 13:45:57 IST,"Jefferies noted that Indian alcoholic beverage stocks have significantly outperformed the broader staples sector during FY23–FY26, delivering an earnings per share (EPS) CAGR of over 30%, compared with mid-to-high single-digit growth for staples.",https://www.livemint.com/rss/markets
The trade-off in the Persistent-Nagarro deal is hard to ignore,https://www.livemint.com/market/mark-to-market/persistent-systems-nagarro-acquisition-stock-analysis-11782714336441.html,2026-06-29 13:14:16 IST,Persistent Systems' share price fell 11% after the IT company announced the acquisition of Munich-based Nagarro SE – its largest ever – at an enterprise valuation of €1.27 billion.,https://www.livemint.com/rss/markets
"Advit Jewels IPO allotment to be finalised today. Here's GMP, how to check status",https://www.livemint.com/market/ipo/advit-jewels-ipo-allotment-to-be-finalised-today-heres-gmp-how-to-check-status-status-11782711048978.html,2026-06-29 13:09:08 IST,"Advit Jewels IPO is commanding a grey market premium (GMP) of  ₹51 today. The allotment is likely to be finalised on Monday, 29 June.",https://www.livemint.com/rss/markets
Astral share price slips 10% after demerger announcement. Should you buy or sell?,https://www.livemint.com/market/stock-market-news/astral-share-price-slips-10-after-demerger-announcement-should-you-buy-or-sell-11782717810155.html,2026-06-29 13:02:46 IST,"Astral demerger ratio is set at 1:1. This means subject to the necessary approvals, Astral shareholders will receive shares of Astral Chemie in proportion to their existing shareholding (in ratio of 1:1).",https://www.livemint.com/rss/markets
"Vinay Rajani of HDFC Sec suggests L&amp;T Finance, Welspun Enterprises shares to buy in near-term",https://www.livemint.com/market/stock-market-news/vinay-rajani-of-hdfc-sec-suggests-l-t-finance-welspun-enterprises-shares-to-buy-in-nearterm-11782716873259.html,2026-06-29 12:49:17 IST,"Indian equity benchmarks, Nifty 50 and Sensex, declined due to geopolitical tensions impacting investor sentiment. The BSE Sensex fell over 400 pts, and Nifty 50 dropped around 115 pts. Upcoming domestic macroeconomic indicators will guide investors amid concerns over US-Iran military exchanges.",https://www.livemint.com/rss/markets
"IPO GMPs: Advit Jewels IPO, CSM Technologies IPO to Knack Packaging IPO; here's what GMP hints",https://www.livemint.com/market/ipo/advit-jewels-ipo-gmp-waterways-leisure-tourism-ipo-gmp-csm-technologies-ipo-gmp-aastha-spintex-ipo-gmp-knack-ipo-11782712476291.html,2026-06-29 12:13:58 IST,"India's primary market remains active with new IPO listings. Turtlemint Fintech debuted at a discount, while Advit Jewels saw strong demand, with a 212.63x subscription. Upcoming IPOs, including CSM Technologies, Aastha Spintex, and Knack Packaging, maintain market momentum despite volatility.",https://www.livemint.com/rss/markets
Small-cap stock Blue Cloud Softech Solution has been empanelled by BSNL. Details here,https://www.livemint.com/market/stock-market-news/smallcap-stock-blue-cloud-softech-solution-has-been-empaneled-by-bsnl-details-here-11782712368046.html,2026-06-29 11:52:09 IST,"Blue Cloud Softech Solutions share price opened at  ₹20.10 apiece today, as compared to previous close of  ₹21.03 on Thursday last week.",https://www.livemint.com/rss/markets
Kotak Mahindra Bank shares drop over 3% as CEO Ashok Vaswani opts out of second term,https://www.livemint.com/market/stock-market-news/kotak-mahindra-bank-shares-drop-over-3-as-ceo-ashok-vaswani-opts-out-of-second-term-11782713175902.html,2026-06-29 11:47:06 IST,"Kotak Mahindra Bank shares witnessed some profit booking as its chief executive officer (CEO), Ashok Vaswani, said he will step down at the end of his current term on 31 December 2026.",https://www.livemint.com/rss/markets
"Turtlemint Fintech share price gains 7% after weak listing. Should you buy, sell or hold the stock?",https://www.livemint.com/market/stock-market-news/turtlemint-fintech-share-price-gains-7-after-weak-listing-should-you-buy-sell-or-hold-the-stock-11782712991264.html,2026-06-29 11:41:43 IST,"Turtlemint Fintech Solutions IPO listing was weaker than the Street estimates, as indicated in the grey market premium (GMP). Ahead of the debut, Turtlemint Fintech IPO GMP today was  ₹-5 apiece, signalling a listing with more than 3% discount.",https://www.livemint.com/rss/markets
