title,link,published,summary,source
"Stocks to watch: IRFC, SBI Life, Reliance Industries among 10 shares in focus today; full list here",https://www.livemint.com/market/stock-market-news/stocks-to-watch-irfc-sbi-life-reliance-industries-among-10-shares-in-focus-today-full-list-here-11772071796881.html,2026-02-26 08:51:34 IST,"Stock market today: The Indian stock market is likely to open higher on Thursday, February 26, driven by global market cues.",https://www.livemint.com/rss/markets
"Stock Market Today LIVE: Sensex, Nifty turn flat as ICICI, Axis Bank fall even as IT stocks rise post Nvidia earnings",https://www.livemint.com/market/stock-market-today-live-nifty-50-sensex-nvidia-gift-nifty-it-stocks-silver-rate-gold-solar-stocks-trump-tariffs-irfc-11772073364995.html,2026-02-26 08:48:54 IST,"Stock Market Today LIVE: Indian equity benchmarks, Sensex and Nifty 50, open on a positive note on Thursday, tracking firm cues from global markets.",https://www.livemint.com/rss/markets
"Shree Ram Twistex IPO allotment date in focus today; latest GMP, step-by-step guide to check status",https://www.livemint.com/market/ipo/shree-ram-twistex-ipo-gmp-shree-ram-twistex-ipo-subscription-status-shree-ram-twistex-ipo-allotment-date-11772074433955.html,2026-02-26 08:44:59 IST,"Shree Ram Twistex IPO allotment will be finalized today. Investors can check their allotment status on Bigshare Services Pvt Ltd. The IPO was oversubscribed 43.66 times. Shares will be credited to demat accounts on February 27, with refunds for unsuccessful applicants starting the same day.",https://www.livemint.com/rss/markets
"TCS to Infosys, HCL Tech: Indian IT stocks in focus after AI Chipmaker Nvidia post strong Q4 earnings",https://www.livemint.com/market/stock-market-news/tcs-to-infosys-hcl-tech-indian-it-stocks-in-focus-after-ai-chipmaker-nvidia-q3-earning-report-11772072693816.html,2026-02-26 08:03:23 IST,"Indian IT stocks like Infosys and TCS are in focus after Nvidia reported record quarterly revenue of $68.1 billion, driven by strong AI chip demand. Despite initial stock gains, profit-taking led to a slight decline, highlighting ongoing investor concerns about the sustainability of the AI boom.",https://www.livemint.com/rss/markets
How Peter Lynch picked stocks that soared—and how you can in India,https://www.livemint.com/market/stock-market-news/how-peter-lynch-picked-stocks-that-soared-and-how-you-can-in-india-11772016748513.html,2026-02-26 08:01:06 IST,"From PE ratios to debt limits, Lynch’s proven strategy shows retail investors how to find high-growth opportunities.",https://www.livemint.com/rss/markets
IRFC OFS opens for retail investors today: Should you apply or avoid? Explained,https://www.livemint.com/market/stock-market-news/irfc-ofs-opens-for-retail-investors-today-should-you-apply-or-avoid-explained-11772025704369.html,2026-02-26 07:58:42 IST,"IRFC OFS: Given the IRFC OFS' floor price of  ₹104, which is not at any material discount from the current levels and the possibility of future such divestment by the government, analysts see little value for retailers to participate in the offer.",https://www.livemint.com/rss/markets
"Stock market today: Trade setup for Nifty 50, gold, silver rates, USD vs INR to US-Iran talks; 5 stocks to buy or sell",https://www.livemint.com/market/stock-market-news/stock-market-today-trade-setup-for-nifty-50-gold-silver-rates-usd-vs-inr-to-us-iran-talks-5-stocks-to-buy-or-sell-11772068612670.html,2026-02-26 07:57:25 IST,"Stock market today: Experts have recommended these eight stocks to buy today — GVT&amp;amp;D, BoB, M&amp;amp;M, SAIL, PNB&amp;nbsp;",https://www.livemint.com/rss/markets
"Global markets today: Japan's Nikkei hits all-time high on Takaichi Trade, crosses 59,000 mark",https://www.livemint.com/market/stock-market-news/global-markets-today-japans-nikkei-hits-all-time-high-on-takaichi-trade-crosses-59-000-mark-11772071901515.html,2026-02-26 07:51:13 IST,"Global markets today: Japan's Nikkei 225 surged 1.1% to an all-time high of 59,199.31, marking its third consecutive session of record gains.",https://www.livemint.com/rss/markets
"Bitcoin price today: World's largest cryptocurrency rises over 3% to move past $68,000 mark amid stellar Nvidia results",https://www.livemint.com/market/cryptocurrency/bitcoin-price-today-worlds-largest-cryptocurrency-rises-over-3-to-move-past-68-000-mark-amid-stellar-nvidia-results-11772068592753.html,2026-02-26 07:37:39 IST,"At the time of writing, Bitcoin climbed 3.49% over the past 24 hours to $68,441.44, according to data from CoinMarketCap. Trading volume also rose over 29% to $53.38 billion on improved investor sentiments fuelled by gain in technology stocks.",https://www.livemint.com/rss/markets
Breakout stocks to buy or sell: Sumeet Bagadia recommends five shares to buy today — 26 February 2026,https://www.livemint.com/market/stock-market-news/breakout-stocks-to-buy-or-sell-sumeet-bagadia-recommends-five-shares-to-buy-today-26-february-2026-11772069373434.html,2026-02-26 07:32:47 IST,"Breakout stocks to buy or sell: Sumeet Bagadia recommends five shares to buy today — Vedanta, Laurus Labs, Aurobindo Pharma, Mangalam Cement, and Bank of Maharashtra.",https://www.livemint.com/rss/markets
"Nifty 50, Sensex today: What to expect from Indian stock market in trade on February 26",https://www.livemint.com/market/stock-market-news/nifty-50-sensex-today-what-to-expect-from-indian-stock-market-in-trade-on-february-26-11772038554330.html,2026-02-26 07:23:34 IST,"Nifty 50, Sensex today: The trends on Gift Nifty also indicate a positive start for the Indian benchmark index. The Gift Nifty was trading around 25,667 level, a premium of nearly 39 points from the Nifty futures’ previous close.",https://www.livemint.com/rss/markets
"Google, Microsoft, Amazon to pay their own data centre power bills? Trump summons big tech leaders to woo public",https://www.livemint.com/companies/news/google-microsoft-amazon-to-pay-their-own-data-centre-power-bills-trump-summons-big-tech-leaders-to-woo-public-11772072326718.html,2026-02-26 09:06:44 IST,"The promises, if made by the companies, will lack the force of law and therefore will not be binding. However, officials of the Trump administration still believe that a public and formal pledge could bring accountability and offer some assurance to consumers.",https://www.livemint.com/rss/companies
Entry-level luxury car: Is the prestige worth the financial burden?,https://www.livemint.com/money/personal-finance/entry-level-luxury-car-india-financial-investment-ownership-costs-11772018715895.html,2026-02-26 09:00:08 IST,"Dreaming of that premium German car? Before you sign the dotted line, discover the hidden financial realities beyond the showroom floor.",https://www.livemint.com/rss/money
How should investors navigate portfolios amid a shaky opening to 2026 across asset classes,https://www.livemint.com/money/personal-finance/how-should-investors-navigate-portfolios-as-2026-opens-shaky-with-equities-ai-disruption-tariff-uncertainty-vola-11772071048616.html,2026-02-26 08:12:53 IST,"Indian markets enter 2026 on shaky ground as equities falter, AI disruption rattles IT, tariffs cloud trade and precious metals swing. Discipline, diversification and asset allocation emerge as the real alpha. Here is a structured look at asset class performance and investor response.",https://www.livemint.com/rss/money
"Tejas Networks shares rocket 10%, snap 4-day losing streak. What’s triggering the massive surge?",https://economictimes.indiatimes.com/markets/stocks/news/tejas-networks-shares-rocket-10-snap-4-day-losing-streak-whats-triggering-the-massive-surge/articleshow/128803467.cms,2026-02-26 11:10:08 IST,Shares of Tejas Networks rose sharply after the company sealed a major agreement with NEC Corporation to manufacture and supply 5G massive MIMO radios. MIMO (Multiple-Input Multiple-Output) is a wireless technology that enhances data speeds and signal reliability by using multiple antennas at both the transmitter and receiver.,https://economictimes.indiatimes.com/markets/stocks/rssfeeds/2146843.cms
"Nykaa shares' 64% rally crowns it as internet leader, but do rich valuations justify the risk-reward?",https://economictimes.indiatimes.com/markets/stocks/news/nykaa-shares-64-rally-crowns-it-as-internet-leader-but-do-rich-valuations-justify-the-risk-reward/articleshow/128802227.cms,2026-02-26 10:28:07 IST,"Nykaa's parent company, FSN E-Commerce Ventures, has seen its shares surge by 64% over the past year. This rally follows strong operational performance and robust profit growth. Despite the impressive comeback, experts are divided on whether the current stock price offers a favorable risk-reward proposition. Some analysts recommend a buy on dips, while others suggest booking profits.",https://economictimes.indiatimes.com/markets/stocks/rssfeeds/2146843.cms
Did Angel One shares really crash 90%? Here's why you should ignore the massive plunge,https://economictimes.indiatimes.com/markets/stocks/news/did-angel-one-shares-really-crash-90-heres-why-you-should-ignore-the-massive-plunge/articleshow/128802458.cms,2026-02-26 10:20:07 IST,"Angel One shares appeared to crash 90% on Thursday, but the sharp fall was due to a 1:10 stock split adjustment on the record date. The stock opened at Rs 251 compared to the previous close of Rs 2,489.90 and was down about 1% in early trade.",https://economictimes.indiatimes.com/markets/stocks/rssfeeds/2146843.cms
Sanofi Consumer Healthcare shares zoom 14% after Q4 profit jumps 50%; declares dividend of Rs 75,https://economictimes.indiatimes.com/markets/stocks/news/sanofi-consumer-healthcare-shares-zoom-14-after-q4-profit-jumps-50-declares-dividend-of-rs-75/articleshow/128802402.cms,2026-02-26 10:14:57 IST,"Sanofi Consumer Healthcare shares surged over 14% following a robust 50% year-on-year net profit increase to Rs 66.5 crore in Q4. Driven by product relaunches and strong export growth, the company reported a 47% revenue jump. Full-year profit rose 33%, prompting a Rs 75 per share dividend payout.",https://economictimes.indiatimes.com/markets/stocks/rssfeeds/2146843.cms
Frightful February for IT stocks: How Anthropic’s 6 AI tools sparked a multi-billion dollar meltdown in 4 weeks,https://economictimes.indiatimes.com/markets/stocks/news/frightful-february-for-it-stocks-how-anthropics-6-ai-tools-sparked-a-multi-billion-dollar-meltdown-in-4-weeks/articleshow/128802165.cms,2026-02-26 10:01:00 IST,"Indian IT stocks have seen a sharp downturn in February, with the Nifty IT index dropping 21%. This decline was triggered by new AI launches and capabilities from startup Anthropic, raising investor concerns about potential disruptions to the sector. Major IT firms experienced significant single-day losses following these developments.",https://economictimes.indiatimes.com/markets/stocks/rssfeeds/2146843.cms
25 stocks that survived AI crash reveal what themes could work within Indian IT space,https://economictimes.indiatimes.com/markets/stocks/news/25-stocks-that-survived-ai-crash-reveal-what-themes-could-work-within-indian-it-space/articleshow/128801902.cms,2026-02-26 09:44:10 IST,"Indian IT stocks experienced a significant downturn due to AI concerns, with the Nifty IT index falling 21% in February. However, 25 select stocks defied the slump, showing positive returns by focusing on AI infrastructure, integration, and specialized engineering, indicating potential future growth themes for the sector.",https://economictimes.indiatimes.com/markets/stocks/rssfeeds/2146843.cms
"Last day to buy PNGS Reva Diamond Jewellery IPO: Check GMP, subscription status, and more - Apply or not?",https://www.livemint.com/market/ipo/last-day-to-buy-pngs-reva-diamond-jewellery-ipo-check-gmp-subscription-status-and-more-apply-or-not-11772082125558.html,2026-02-26 11:04:16 IST,"PNGS Reva Diamond Jewellery's IPO, aiming to raise  ₹380 crore, saw weak demand, with subscriptions at 0.86 times by Day 3. Brokerage firms suggest a long-term subscription. The stock is expected to debut on March 4.",https://www.livemint.com/rss/markets
Ashish Kacholia portfolio stock Balu Forge skyrockets over 9%. Do you own?,https://www.livemint.com/market/stock-market-news/ashish-kacholia-portfolio-stock-balu-forge-skyrockets-over-9-do-you-own-11772081631868.html,2026-02-26 10:58:59 IST,"Balu Forge stock surged over 9% after an agreement with a NATO-affiliated organization for supplying large-caliber ammunition from its Belgaum facility. The contract spans five years, delivering 30,000 units of 155 mm and 10,000 units of 152 mm ammunition monthly, starting April 2026.",https://www.livemint.com/rss/markets
"Mobilise App Lab IPO share allotment in focus today; GMP, how to check status in 5 steps",https://www.livemint.com/market/ipo/mobilise-app-lab-ipo-share-allotment-in-focus-today-gmp-how-to-check-status-in-5-steps-11772080595344.html,2026-02-26 10:36:07 IST,"Mobilise App Lab's IPO concluded on February 25 with a 100 times subscription. Share allotment is expected today, with shares credited by February 27. The stock will list on NSE SME on March 2 at a premium of  ₹87. Retail subscription was 96 times and NIIs at 175 times.",https://www.livemint.com/rss/markets
Small-cap multibagger stock jumps over 5% on order win. Do you own?,https://www.livemint.com/market/stock-market-news/smallcap-multibagger-stock-shaily-engineering-plastics-share-price-jumps-over-5-on-order-win-do-you-own-11772081069864.html,2026-02-26 10:27:07 IST,"Shaily Engineering Plastics share price has fallen 24% in three months and has dropped 7% in six months. However, the smallcap stock has risen 32% in one year, and has delivered multibagger returns of 283% in two years.",https://www.livemint.com/rss/markets
"PNGS Reva Diamond Jewellery IPO Day 3 LIVE: GMP, subscription status, other details. Apply or not?",https://www.livemint.com/market/ipo/pngs-reva-diamond-jewellery-ipo-day-3-live-gmp-subscription-status-other-details-apply-or-not-11772079573861.html,2026-02-26 10:03:47 IST,"PNGS Reva Diamond Jewellery IPO GMP: According to market observers, company's shares are available at a premium of  ₹9 in the grey market today",https://www.livemint.com/rss/markets
IRFC share price gains around 1% as OFS opens for retail investors; fails to get fully booked from institutional buyers,https://www.livemint.com/market/stock-market-news/irfc-share-price-gains-1-as-ofs-opens-for-retail-investors-today-fails-to-get-fully-booked-from-institutional-buyers-11772077566265.html,2026-02-26 09:47:25 IST,"IRFC stock rose nearly 1% on February 26 ahead of the retail portion of its offer for sale. Institutional bids accounted for 94.98% of shares. The government plans to sell over 26 crore shares, maintaining an 86.36% stake post-divestment.",https://www.livemint.com/rss/markets
"SEDEMAC Mechatronics IPO: Price band set at  ₹1,287- 1,352 per share; check key dates, issue details, more",https://www.livemint.com/market/ipo/sedemac-mechatronics-ipo-price-band-set-at-rs-1-287-1-352-per-share-check-key-dates-issue-details-more-11772078015625.html,2026-02-26 09:45:23 IST,"SEDEMAC Mechatronics has set its IPO price band between  ₹1,287 and  ₹1,352 per share, with subscription dates from March 4 to March 6. Allocation for anchor investors is on March 2, and shares will be listed on BSE and NSE on March 11.",https://www.livemint.com/rss/markets
NCLAT refuses to stay India’s first corporate class action against Jindal Poly Films,https://www.livemint.com/companies/news/nclat-refuses-to-stay-india-s-first-corporate-class-action-against-jindal-poly-films-11772083791169.html,2026-02-26 11:24:11 IST,"The appellate tribunal's decision will allow NCLT proceedings to continue in minority shareholders’  ₹2,500-crore siphoning allegations case, marking a key test of India’s class action framework.",https://www.livemint.com/rss/companies
"DeepSeek hides upcoming flagship AI model from US chipmakers like Nvidia, shows preview to Chinese Huawei: Report",https://www.livemint.com/companies/news/deepseek-hides-upcoming-flagship-ai-model-from-us-chipmakers-like-nvidia-shows-preview-to-chinese-huawei-report-11772082672048.html,2026-02-26 10:47:58 IST,"For its forthcoming model, which was expected to be released around the Lunar New Year holiday, DeepSeek did not provide access to Nvidia and AMD and gave Chinese chipmakers, including Huawei, a head start of several weeks to optimize the software for their processors.",https://www.livemint.com/rss/companies
Can your NPS pay hospital bills? ICICI Pru tests a new model,https://www.livemint.com/money/personal-finance/can-your-nps-pay-hospital-bills-icici-pru-tests-a-new-model-medical-expenses-health-insurance-11772073161353.html,2026-02-26 10:49:50 IST,"ICICI Prudential launches NPS Swasthya Equity Plus under PFRDA’s sandbox, blending retirement savings with healthcare liquidity and high equity exposure.",https://www.livemint.com/rss/money
Why your retirement target isn’t as impossible as it looks,https://www.livemint.com/money/personal-finance/retirement-planning-corpus-expenses-step-up-investing-inflation-lifestyle-11772040115275.html,2026-02-26 10:32:28 IST,"A simple retirement formula may tell you the target. Step-up investing shows you how to reach it, without feeling crushed by multi-crore numbers.",https://www.livemint.com/rss/money
China holiday spending sends a strong signal on consumer stimulus plans,https://www.cnbc.com/2026/02/26/china-lunar-new-year-holiday-spending-signal-consumer-stimulus-outlook.html,2026-02-26 09:56:21 IST,"China's nine-day Lunar New Year holiday showed consumers were eager to travel, while remaining price-conscious.",https://www.cnbc.com/id/10000664/device/rss/rss.html
"Waaree, Premier Energies shares rise 2% as brokers brush off US CVD fears",https://economictimes.indiatimes.com/markets/stocks/news/waaree-premier-energies-shares-rise-2-as-brokers-brush-off-us-cvd-fears/articleshow/128804004.cms,2026-02-26 11:35:10 IST,"Indian solar energy stocks saw gains on Thursday. Brokerages reassured investors, downplaying the impact of new US import duties. Companies like Waaree Energies and Premier Energies are expected to remain largely unaffected. This is due to their sourcing strategies and limited reliance on Indian-made solar cells for US exports.",https://economictimes.indiatimes.com/markets/stocks/rssfeeds/2146843.cms
"HAL, BDL to BEL: Defence stocks extend rally on India-Israel defence deal buzz",https://www.livemint.com/market/stock-market-news/hal-bdl-to-bel-defence-stocks-extend-rally-on-india-israel-defence-deal-buzz-11772081591933.html,2026-02-26 12:19:14 IST,"India-Israel defence deal: Amid strong investor interest, the Nifty Defence India index is up 1.07%",https://www.livemint.com/rss/markets
Shree Ram Twistex IPO allotment date LIVE: Step-by-step guide to check status; here's what GMP hints about listing,https://www.livemint.com/market/ipo/shree-ram-twistex-ipo-gmp-shree-ram-twistex-ipo-subscription-status-shree-ram-twistex-ipo-allotment-date-shree-ram-11772087524625.html,2026-02-26 12:18:07 IST,"Shree Ram Twistex IPO allotment date LIVE: The Shree Ram Twistex IPO allotment status can be verified on the NSE and BSE websites. Allotments will be finalized today, with shares credited to demat accounts on February 27. The IPO listing is scheduled for March 2 at an estimated price of  ₹98.",https://www.livemint.com/rss/markets
"KSB stock climbs to 8-week high, logging 12% intraday gain. Why is this small-cap rising in a range-bound market?",https://www.livemint.com/market/stock-market-news/ksb-stock-climbs-to-8-week-high-logging-12-intraday-gain-why-is-this-small-cap-rising-in-a-range-bound-market-11772085040217.html,2026-02-26 11:52:26 IST,"KSB shares surged 12% to  ₹803.85 on February 26, reaching an eight-week high. The rise follows a solid fiscal Q4 report, with net profit increasing 10.8% YoY. The stock has gained 12.3% in February, marking its first monthly gain in six months.",https://www.livemint.com/rss/markets
"SBI Life declares interim dividend of  ₹2.7, stock rises around 1.5% - Check record date here",https://www.livemint.com/market/stock-market-news/sbi-life-declares-interim-dividend-of-rs-2-7-sbi-life-share-price-rises-around-1-5-check-sbi-life-record-date-here-11772084393198.html,2026-02-26 11:50:09 IST,"SBI Life Insurance shares rose 1.5% following the announcement of an interim dividend of  ₹2.7 per share for FY26. The record date for eligible shareholders is March 6, with payout expected by March 27, 2026.",https://www.livemint.com/rss/markets
"Stocks to buy or sell: Osho Krishan of Angel One suggests buying Central Bank, Engineers India shares in the near-term",https://www.livemint.com/market/stock-market-news/stocks-to-buy-or-sell-osho-krishan-of-angel-one-suggests-buying-central-bank-engineers-india-shares-in-the-nearterm-11772083899393.html,2026-02-26 11:27:28 IST,"&amp;nbsp;Nifty 50 and Sensex gained slightly, driven by IT stocks following Nvidia's strong earnings. Institutional buying supported the markets, while mixed trends were noted in wider markets. Analysts suggest cautious trading due to low risk appetite amidst a lack of domestic catalysts.",https://www.livemint.com/rss/markets
"Clean Max Enviro IPO Allotment LIVE: GMP, steps to check share allotment status online on BSE, NSE, MUFG",https://www.livemint.com/market/ipo/clean-max-enviro-ipo-allotment-live-clean-max-enviro-ipo-gmp-today-ipo-allotment-status-bse-nse-mufg-26-february-2026-11772085028395.html,2026-02-26 11:26:55 IST,"Clean Max Enviro IPO Allotment LIVE: Investors can check Clean Max Enviro IPO allotment status online through the websites of BSE and NSE, along with the official portal of the IPO registrar. MUFG Intime India is the Clean Max Enviro IPO registrar.",https://www.livemint.com/rss/markets
From youth dividend to credit ready: How India’s Yuva Shakti Budget impacts first-time borrowers,https://www.livemint.com/money/personal-finance/from-youth-dividend-to-credit-ready-how-india-s-yuva-shakti-budget-impacts-first-time-borrowers-11772086111425.html,2026-02-26 11:55:58 IST,"India's Union Budget emphasizes youth empowerment and entrepreneurship, recognizing the potential of its young population as a key driver of economic growth. It focuses on skill development, credit access, and financial literacy to transform demographic advantages into productive economic capacity.",https://www.livemint.com/rss/money
Smallcap AI shares locked in 20% upper circuit on US transport agency deal,https://economictimes.indiatimes.com/markets/stocks/news/smallcap-ai-shares-locked-in-20-upper-circuit-on-us-transport-agency-deal/articleshow/128805097.cms,2026-02-26 12:23:54 IST,"Shares of XTGlobal Infotech hit the 20% upper circuit at Rs 33.18 on the BSE after the company secured an AI Enablement for Engineering Services contract from a US-based state transportation agency. The six-month engagement is valued at about $796,900. Managing Director Ramarao Atchuta Mullapudi said the win strengthens its transportation vertical and US public sector presence.",https://economictimes.indiatimes.com/markets/stocks/rssfeeds/2146843.cms
"From YES Bank, IDFC First Bank to Eternal— These are the top most traded stocks on the NSE today",https://www.livemint.com/market/stock-market-news/from-yes-bank-idfc-first-bank-to-eternal-these-are-the-top-most-traded-stocks-on-the-nse-today-11772087303631.html,2026-02-26 12:44:50 IST,"Vodafone Idea, IDFC First Bank, Tata Silver Exchange Traded Fund, YES Bank, Eternal, Filatex Fashions were among the most traded stocks, or most active stocks in terms of volume, on the NSE",https://www.livemint.com/rss/markets
Multibagger stock Hazoor Multi Projects jumps amid choppy session on Dalal Street,https://www.livemint.com/market/stock-market-news/multibagger-stock-hazoor-multi-projects-jumps-amid-choppy-session-on-dalal-street-11772088648488.html,2026-02-26 12:27:30 IST,"Hazoor Multi Projects share price has risen 2% in one month, but has fallen 15% in three months. The smallcap stock has declined 27% in six months, while it has dropped 23% in one year. Hazoor Multi Projects stock price has delivered multibagger returns of 244% in three years.",https://www.livemint.com/rss/markets
"Apple in talks with ICICI Bank, HDFC Bank and Axis Bank to start payment service in India: Report",https://www.livemint.com/companies/news/apple-in-talks-with-icici-bank-hdfc-bank-and-axis-bank-to-start-payment-service-in-india-11772089475257.html,2026-02-26 12:40:34 IST,Apple Inc. is in discussions with key Indian banks and global card networks in preparation to start Apple Pay in the world’s most populous country.,https://www.livemint.com/rss/companies
Nifty 50 enters March series with lower OI; FII shorts reduce sharply,https://www.livemint.com/market/stock-market-news/nifty-50-enters-march-series-with-lower-oi-fii-shorts-reduce-sharply-11772094363495.html,2026-02-26 14:08:42 IST,"Nifty’s February series rollover stood at 68.2%, falling below the previous expiry’s 70.8% and the three- and six-month averages of 70.6% and 75.6%, as the March series commenced with 142.73 lakh shares in open interest (OI), reflecting a decline of 31.54 lakh shares despite a 1% rise in prices.",https://www.livemint.com/rss/markets
How Waaree Energies may sidestep US duties,https://www.livemint.com/market/mark-to-market/waaree-energies-share-price-countervailing-duties-solar-tariffs-solar-exports-green-energy-11772089227725.html,2026-02-26 13:53:26 IST,"Even as Waaree’s new green businesses pave the way for robust growth, it is strategically integrating backwards to protect margins.",https://www.livemint.com/rss/markets
