title,link,published,summary,source
"HFCL among 6 stocks flashing bullish signals, hinting at a possible uptrend",https://economictimes.indiatimes.com/markets/stocks/news/hfcl-among-6-stocks-flashing-bullish-signals-hinting-at-a-possible-uptrend/slideshow/131495827.cms,2026-06-04 08:51:07 IST,"Six Nifty500 stocks, including RHI Magnesita India, RR Kabel and HFCL, formed a White Marubozu pattern on June 3, signaling strong buying interest and potential bullish momentum, according to StockEdge.",https://economictimes.indiatimes.com/markets/stocks/rssfeeds/2146843.cms
​Ipca Laboratories among 5 stocks showing bullish RSI upswing,https://economictimes.indiatimes.com/markets/stocks/news/ipca-laboratories-among-5-stocks-showing-bullish-rsi-upswing/slideshow/131495775.cms,2026-06-04 08:51:05 IST,"Five Nifty500 stocks, including Leela Palaces, Eris Lifesciences, Indian Bank, Mankind Pharma, and Ipca Laboratories, showed bullish momentum as their RSI crossed above 50, signaling potential upward price movement.",https://economictimes.indiatimes.com/markets/stocks/rssfeeds/2146843.cms
"Lenskart shares in focus as Softbank’s Rs 2,873-crore stake sale draws Goldman, Fidelity, others",https://economictimes.indiatimes.com/markets/stocks/news/lenskart-shares-in-focus-as-softbanks-rs-2873-crore-stake-sale-draws-goldman-fidelity-others/articleshow/131495720.cms,2026-06-04 08:47:37 IST,"Lenskart Solutions shares:  Global and domestic institutional investors picked up shares in a large block deal worth about Rs 2,873 crore.This came after SoftBank affiliate SVF II Lightbulb (Cayman) pared its stake in the eyewear retailer by selling 5.65 crore shares at Rs 508.55 apiece, according to exchange data.",https://economictimes.indiatimes.com/markets/stocks/rssfeeds/2146843.cms
IT stocks crash! Planning to buy the dip? Here's what analysts say,https://economictimes.indiatimes.com/markets/stocks/news/it-stocks-crash-planning-to-buy-the-dip-heres-what-analysts-say/articleshow/131494868.cms,2026-06-04 07:40:40 IST,"Indian IT shares saw a significant drop on Wednesday, wiping out recent gains. Analysts suggest this was largely due to profit booking after a rapid rise. They advise investors to be cautious, citing concerns about growth slowdown and AI's impact on traditional outsourcing. While some see long-term potential, short-term volatility is expected.",https://economictimes.indiatimes.com/markets/stocks/rssfeeds/2146843.cms
Reliance Industries dividend alert! Last date to buy shares of Mukesh Ambani-led company for Rs 6 final dividend,https://economictimes.indiatimes.com/markets/stocks/news/reliance-industries-dividend-alert-last-date-to-buy-shares-of-mukesh-ambani-led-company-for-rs-6-final-dividend/articleshow/131494847.cms,2026-06-04 07:36:48 IST,"Reliance Industries has set June 5 as the record date for its final dividend of Rs 6 per share for FY26, making June 4 the last day to buy shares for eligibility. The company's stock has seen a decline in the short term, with a 17% drop year-to-date in 2026.",https://economictimes.indiatimes.com/markets/stocks/rssfeeds/2146843.cms
"Wipro buyback alert! Last date to buy shares to participate in Rs 15,000 crore share buyback",https://economictimes.indiatimes.com/markets/stocks/news/wipro-buyback-alert-last-date-to-buy-shares-to-participate-in-rs-15000-crore-share-buyback/articleshow/131494823.cms,2026-06-04 07:33:27 IST,"Investors must purchase Wipro shares by today, June 4th, to be eligible for the company's Rs 15,000 crore share buyback, as Friday, June 5th, is the record date. The buyback offers Rs 250 per share, a 22.5% premium, with analysts projecting potential short-term returns of 8-14% for retail investors.",https://economictimes.indiatimes.com/markets/stocks/rssfeeds/2146843.cms
Negative Breakout: These 12 stocks cross below their 200 DMAs,https://economictimes.indiatimes.com/markets/stocks/news/negative-breakout-these-12-stocks-cross-below-their-200-dmas/slideshow/131494793.cms,2026-06-04 07:23:36 IST,The 200 DMA is used as a key indicator by traders for determining the overall trend in a particular stock.,https://economictimes.indiatimes.com/markets/stocks/rssfeeds/2146843.cms
Muted opening likely as GIFT Nifty indicates a negative start for D-St,https://economictimes.indiatimes.com/markets/stocks/news/pre-market-action-heres-the-trade-setup-for-todays-session/articleshow/131494608.cms,2026-06-04 06:48:35 IST,"Nifty resumed its downward trend, falling  on Wednesday due to geopolitical tensions in West Asia and elevated crude oil prices. Persistent FII outflows and a depreciating rupee further pressured the market. Analysts anticipate continued volatility as tensions escalate.",https://economictimes.indiatimes.com/markets/stocks/rssfeeds/2146843.cms
"Stocks in news: Rajesh Exports, Lenskart, Suzlon Energy, Aurobindo Pharma, Tata Motors",https://economictimes.indiatimes.com/markets/stocks/news/stocks-in-news-rajesh-exports-lenskart-suzlon-energy-aurobindo-pharma-tata-motors/articleshow/131494588.cms,2026-06-04 06:43:27 IST,Indian markets saw volatility and closed lower on Wednesday. Key companies are in focus due to significant developments. SoftBank reduced its stake in Lenskart. Sebi issued an interim order against Rajesh Exports. Tata Motors revised its Avinya EV strategy. Suzlon Energy is diversifying into battery storage. RIL's subsidiary signed MoUs with the Haryana Government.,https://economictimes.indiatimes.com/markets/stocks/rssfeeds/2146843.cms
India plans to scrap capital gains tax on FPI investments in government securities,https://economictimes.indiatimes.com/markets/stocks/news/india-plans-to-scrap-capital-gains-tax-on-fpi-investments-in-government-securities/articleshow/131494500.cms,2026-06-04 06:21:56 IST,"India is set to eliminate capital gains tax for foreign portfolio investors on government securities to boost overseas capital inflows. This move, approved via an ordinance, aims to counter economic impacts from the Iran war and address negative foreign portfolio flows and rupee depreciation. Further measures are anticipated to enhance market attractiveness for foreign investment.",https://economictimes.indiatimes.com/markets/stocks/rssfeeds/2146843.cms
Sebi bars Chairman Mehta from trading in Rajesh Exports shares,https://economictimes.indiatimes.com/markets/stocks/news/sebi-bars-chairman-mehta-from-trading-in-rajesh-exports-shares/articleshow/131494480.cms,2026-06-04 06:07:29 IST,"Securities and Exchange Board of India has barred Rajesh Mehta, chairman of Rajesh Exports, from trading company shares. A forensic probe uncovered alleged revenue inflation and fund diversion over four years. The regulator found the company presented a misleading financial picture. Sebi has ordered a fresh audit and referred auditors' conduct for action.",https://economictimes.indiatimes.com/markets/stocks/rssfeeds/2146843.cms
"Deficient monsoon risk rises, but macro impact on GDP expected to stay muted",https://economictimes.indiatimes.com/markets/stocks/news/deficient-monsoon-risk-rises-but-macro-impact-on-gdp-expected-to-stay-muted/articleshow/131494447.cms,2026-06-04 05:55:37 IST,"India's agricultural output and inflation face heightened concerns as the India Meteorological Department forecasts a stronger probability of deficient rainfall. However, the impact on agriculture GVA and overall GDP growth is expected to be limited due to a weakening correlation with rainfall over the past two decades, attributed to factors like increased irrigation and a growing share of non-crop sectors.",https://economictimes.indiatimes.com/markets/stocks/rssfeeds/2146843.cms
"IT stocks snap three-day rally, plunge over 5% in sharpest fall in nearly four months",https://economictimes.indiatimes.com/markets/stocks/news/it-stocks-snap-three-day-rally-plunge-over-5-in-sharpest-fall-in-nearly-four-months/articleshow/131494415.cms,2026-06-04 05:50:07 IST,"Indian IT stocks experienced their steepest single-day fall in nearly four months, plunging over 5% as concerns about AI's impact on revenue streams resurfaced. The Nifty IT index slumped, dragging the broader market lower, with analysts citing immense pressure and uncertainty driving liquidation. While the sector's recovery is questioned, significant further downside is not anticipated.",https://economictimes.indiatimes.com/markets/stocks/rssfeeds/2146843.cms
Brokers prepare rollout of algo trading tools for retail investors,https://economictimes.indiatimes.com/markets/stocks/news/brokers-line-up-algo-offerings-to-tap-growing-retail-demand/articleshow/131494341.cms,2026-06-04 05:34:05 IST,"Major brokers are set to launch algorithmic trading tools for retail investors in the coming months, following enhanced regulatory clarity. This move aims to expand broker revenue streams and help fintech firms scale by offering accessible algo strategies, potentially for as low as ₹5,000 per strategy.",https://economictimes.indiatimes.com/markets/stocks/rssfeeds/2146843.cms
"Warburg, KKR, TPG among PE giants vying for 25% stake in Cloudnine",https://economictimes.indiatimes.com/markets/stocks/news/warburg-kkr-tpg-among-pe-giants-vying-for-25-stake-in-cloudnine/articleshow/131494522.cms,2026-06-04 05:30:00 IST,"Global private equity giants, including Warburg Pincus and KKR, are vying for a 25% stake in India's largest maternity and pediatric hospital chain, Cloudnine. The deal is expected to value the company at approximately $1 billion, with existing investor True North exiting completely. Cloudnine reported revenues of ₹2,000 cr and EBITDA of ₹300 cr in FY26.",https://economictimes.indiatimes.com/markets/stocks/rssfeeds/2146843.cms
Suzlon seeks to put the wind in all sails of its renewables ship,https://economictimes.indiatimes.com/markets/stocks/news/suzlon-aims-to-revolutionize-renewable-energy-with-ambitious-10-gw-wind-and-solar-strategy-by-fy31/articleshow/131494469.cms,2026-06-04 00:46:02 IST,"Suzlon Group is set to significantly expand its renewable energy business. The company aims to quadruple annual sales to 10 GW and grow managed assets to 70 GW by FY31. Suzlon will now offer integrated solutions including wind, solar, and battery storage. A new battery manufacturing facility is planned.",https://economictimes.indiatimes.com/markets/stocks/rssfeeds/2146843.cms
RBI’s Swaminathan warns banks on rising risks beyond balance sheets,https://economictimes.indiatimes.com/markets/stocks/news/rbis-swaminathan-warns-banks-on-rising-risks-beyond-balance-sheets/articleshow/131494530.cms,2026-06-03 20:06:21 IST,"Indian banks face a new era of resilience.  RBI Deputy Governor Swaminathan J highlighted the need to manage complex uncertainties from geopolitics, climate change, and AI.  This shift moves beyond balance sheet stress.  Banks must adapt to unpredictable risks.  The Indian financial system is entering this phase with strong fundamentals.",https://economictimes.indiatimes.com/markets/stocks/rssfeeds/2146843.cms
MPC's repo rate pause will help stabilise growth: SBI chairman,https://economictimes.indiatimes.com/markets/stocks/news/rate-pause-will-help-stabilise-growth-sbi-chairman/articleshow/131494488.cms,2026-06-03 16:46:24 IST,"State Bank of India Chairman CS Setty anticipates a Reserve Bank of India interest rate pause to foster stable growth. He highlighted India's future economic expansion depends on boosting entrepreneurship, improving market access, and investing in its large young population.  Banks must scale up financing for infrastructure, manufacturing, and green initiatives to meet ambitious targets.",https://economictimes.indiatimes.com/markets/stocks/rssfeeds/2146843.cms
"RBI denies report of $12 billion gold sale, says holdings unchanged",https://economictimes.indiatimes.com/markets/stocks/news/rbi-denies-report-of-12-billion-gold-sale-says-holdings-unchanged/articleshow/131494465.cms,2026-06-03 12:09:17 IST,"The Reserve Bank of India has refuted claims of selling gold reserves. Reports suggested a sale of approximately $12 billion in gold. The RBI stated its physical gold stock remains unchanged at 880.52 tonnes. These reports are inaccurate, according to the central bank. The RBI's stance clarifies its position on its gold holdings.",https://economictimes.indiatimes.com/markets/stocks/rssfeeds/2146843.cms
Rajesh Exports share price in focus after SEBI flags  ₹15 lakh crore misstatement in accounts,https://www.livemint.com/market/stock-market-news/rajesh-exports-share-price-in-focus-after-sebi-flags-15-lakh-crore-misstatement-in-accounts-11780541132670.html,2026-06-04 08:39:14 IST,"The SEBI has accused Rajesh Exports of misrepresenting nearly all of its revenue over a five-year period, raising doubts on the reliability of the jewellery manufacturer's financial disclosures.",https://www.livemint.com/rss/markets
Indiabulls share price in focus: Real estate firm raises  ₹1000 crore through issuance of convertible warrants,https://www.livemint.com/market/stock-market-news/indiabulls-share-price-in-focus-real-estate-firm-raises-rs-1000-crore-through-issuance-of-convertible-warrants-11780541008967.html,2026-06-04 08:37:35 IST,"Indiabulls plans to issue up to 51.55 crore warrants at an issue price of  ₹19.40 per warrant, including a premium of  ₹17.40 per share. Each warrant will be convertible into one fully paid-up equity share of the company.",https://www.livemint.com/rss/markets
"Block Deals: Lenskart Solutions, GMR Airports shares to be in focus",https://www.livemint.com/market/stock-market-news/block-deals-lenskart-solutions-gmr-airports-shares-to-be-in-focus-11780541755741.html,2026-06-04 08:33:24 IST,"Block Deals: SVF II Lightbulb (Cayman), an investment vehicle owned by SoftBank Group, sold 5.65 crore Lenskart shares, representing a 3.25% stake in the company at  ₹508.55 apiece, taking the total deal value to  ₹2,873.30 crore.",https://www.livemint.com/rss/markets
"CMR Green Technologies IPO Day 2: Issue subscribed 2.46x so far. Check GMP, review, key dates. Apply or not?",https://www.livemint.com/market/ipo/cmr-green-technologies-ipo-gmp-cmr-green-technologies-ipo-review-cmr-green-technologies-ipo-details-cmr-green-ipo-gmp-11780540560476.html,2026-06-04 08:32:08 IST,"CMR Green Technologies IPO opens for public subscription from 3 June to 5 June, with a price band of  ₹182-192. The company raised  ₹188.44 crore through an anchor book, with shares tentatively listing on 10 June.",https://www.livemint.com/rss/markets
"Asian markets today: Nikkei 225, Kospi fall up to 2% on renewed US-Iran war in the Middle East",https://www.livemint.com/market/stock-market-news/asian-markets-today-nikkei-225-kospi-fall-up-to-2-on-renewed-us-iran-war-in-the-middle-east-11780538684046.html,2026-06-04 07:58:12 IST,"Asian markets today: South Korea's Kospi dropped 1.25%, while the small-cap Kosdaq surged more than 3.83% as trading resumed following a public holiday.",https://www.livemint.com/rss/markets
"Raja Venkatraman, MarketSmith recommend five stocks for 4 June",https://www.livemint.com/market/stock-market-news/raja-venkatraman-marketsmith-recommend-five-stocks-for-4-june-11780537381504.html,2026-06-04 07:49:42 IST,"The Gift Nifty Live Chart shows a negative start for the Indian stock market today. By 7:45 AM, the Gift Nifty was trading around the 23,300.5 level, a discount of 105 points from the Nifty futures’ previous close of 23,405.60.",https://www.livemint.com/rss/markets
"Nifty 50, Sensex prediction today: Check how Indian stock market is expected to trade on 4 June",https://www.livemint.com/market/stock-market-news/nifty-50-sensex-prediction-today-check-how-indian-stock-market-is-expected-to-trade-on-4-june-11780537370082.html,2026-06-04 07:25:54 IST,"Nifty 50, Sensex prediction today: The trends on Gift Nifty also indicate a negative start for the Indian benchmark index. The Gift Nifty was trading around 23,315 level, a discount of nearly 200 points from the Nifty futures’ previous close.",https://www.livemint.com/rss/markets
"Stocks to watch: BHEL, NBCC, Lenskart, GMR Airports among 10 shares in focus today; check list here",https://www.livemint.com/market/stock-market-news/stocks-to-watch-bhel-nbcc-lenskart-gmr-airports-among-10-shares-in-focus-today-check-list-here-11780535914178.html,2026-06-04 07:24:59 IST,"Stock market today: The market is likely to continue its losing streak as trends in the Gift Nifty index signalled a negative opening on Thursday. Amid this backdrop, these stocks will remain in focus on 4 June.",https://www.livemint.com/rss/markets
"Buy or sell: Gift Nifty signals big gap-down start, Vaishali Parekh recommends three stocks to buy today — 4 June 2026",https://www.livemint.com/market/stock-market-news/buy-or-sell-gift-nifty-signals-big-gap-down-start-vaishali-parekh-recommends-three-stocks-to-buy-today-4-june-2026-11780534925539.html,2026-06-04 07:22:34 IST,"Buy or sell stocks, 4 June 2026: Vaishali Parekh recommends three stocks to buy today — PNB, Oswal Pumps, and JK Tyre",https://www.livemint.com/rss/markets
"From Gift Nifty, FII selling, oil prices to gold rates: 10 key things that changed for Indian stock market overnight",https://www.livemint.com/market/stock-market-news/from-gift-nifty-fii-selling-oil-prices-to-gold-rates-10-key-things-that-changed-for-indian-stock-market-overnight-11780536236355.html,2026-06-04 07:06:13 IST,"Gift Nifty was trading around 23,346 level, a discount of nearly 170 points from the Nifty futures’ previous close, indicating a negative start for the Indian stock market indices.",https://www.livemint.com/rss/markets
Gold Rises as Dip-Buyers Return After Israel-Lebanon Ceasefire,https://www.livemint.com/market/gold-rises-as-dip-buyers-return-after-israel-lebanon-ceasefire-11780535789490.html,2026-06-04 06:46:28 IST,"Gold pushed higher after Israel and Lebanon agreed to a conditional ceasefire, a possible step toward resolving the wider Middle East conflict that’s upended global energy markets and raised inflation risks.",https://www.livemint.com/rss/markets
Breakout stocks to buy or sell: Sumeet Bagadia recommends five shares to buy today — 4 June 2026,https://www.livemint.com/market/stock-market-news/breakout-stocks-to-buy-or-sell-sumeet-bagadia-recommends-five-shares-to-buy-today-4-june-2026-11780534300885.html,2026-06-04 06:41:19 IST,The Indian stock market ended Wednesday's session on a lower note. Sumeet Bagadia of Choice Broking recommends five breakout stocks to buy today.,https://www.livemint.com/rss/markets
Raja Venkatraman recommends three stocks for 4 June,https://www.livemint.com/market/stock-market-news/raja-venkatraman-recommends-three-stocks-for-4-june-11780501018059.html,2026-06-04 06:01:13 IST,Market expert Raja Venkatraman shares his top stock picks for 4 June. Here’s his technical outlook and trade strategy.,https://www.livemint.com/rss/markets
Stock recommendations for 4 June from MarketSmith India,https://www.livemint.com/market/stock-market-news/stock-recommendations-for-4-june-from-marketsmith-india-11780499702165.html,2026-06-04 06:00:33 IST,"MarketSmith India reveals its top stock recommendations for today, 4 June. Get expert insights into the best-performing stocks to guide your investment decisions.",https://www.livemint.com/rss/markets
Shooting for the stars: three Indian space stocks worth watching,https://www.livemint.com/market/stock-market-news/shooting-for-the-stars-three-indian-space-stocks-worth-watching-11780488664987.html,2026-06-04 06:00:33 IST,"ISRO is throwing open its doors to private players, the government is loosening foreign direct investment (FDI) rules, and a sector once locked behind government gates is suddenly buzzing.",https://www.livemint.com/rss/markets
FPIs beat mutual funds by rupee returns despite  $27 billion exodus,https://www.livemint.com/market/fpis-beat-mutual-funds-on-rupee-returns-despite-record-27-billion-exodus-11780481426099.html,2026-06-04 06:00:13 IST,"Despite record outflow of $27 bn or  ₹2.4 trillion, foreign portfolio investors' totted a rupee return on assets of 7.7% against MFs' 4.4%, thanks to Nifty outperforming broader markets last year. In dollar terms though their returns lag those of MFs.",https://www.livemint.com/rss/markets
Wall Street Giants Lose Out to Taiwan Rivals in New Wealth Race,https://www.livemint.com/market/wall-street-giants-lose-out-to-taiwan-rivals-in-new-wealth-race-11780531384529.html,2026-06-04 05:33:04 IST,"Global asset management giants are being squeezed out in the race for a piece a $300 billion retail investment boom in Taiwan, surpassed by nimbler domestic competitors with massive brokerage networks.",https://www.livemint.com/rss/markets
Google's AI race gets costlier as Alphabet upsizes equity raise to $84.75 billion,https://www.livemint.com/companies/news/googles-ai-race-gets-costlier-as-alphabet-upsizes-equity-raise-to-84-75-billion-11780540605127.html,2026-06-04 08:56:58 IST,"Google parent Alphabet has increased its planned equity raise to nearly $85 billion. The massive investment will help fund spending on data centres, chips and AI infrastructure.",https://www.livemint.com/rss/companies
"Sony, 3one4 Capital back WeRize in fresh funding as fintech eyes 2028 IPO",https://www.livemint.com/companies/start-ups/sony-3one4-capital-back-werize-in-fresh-funding-as-fintech-eyes-2028-ipo-startups-11780498236070.html,2026-06-04 06:05:13 IST,WeRize has raised fresh capital led by Sony Innovation Fund as it scales AI-driven financial products and prepares for a potential 2028 IPO.,https://www.livemint.com/rss/companies
"‘No better opportunity than India’: Citi's Ernesto Torres Cantu on layoffs, AI, and supply chains",https://www.livemint.com/companies/news/citi-india-job-cuts-ernesto-torres-cantu-ai-supply-chainsinterview-11780493301960.html,2026-06-04 06:00:53 IST,"Citi's Cantu said India was unlikely to be affected by global job cuts, while discussing AI rollout, supply chain shifts and foreign investment trends.",https://www.livemint.com/rss/companies
"Law firms shift lens as clients look to skip litigation, beef up compliance",https://www.livemint.com/companies/securities-law-firms-shift-from-litigation-to-advisory-services-11780467384328.html,2026-06-04 06:00:33 IST,"Law firms are ramping up their advisory practices as litigation work dries up. Sebi probes are now more rigorous and clients prefer settlements over tedious litigation. Demand is rising for preventive compliance checks and governance reviews, prompting firms to deploy more lawyers for advisory.",https://www.livemint.com/rss/companies
"Indian developers central to Microsoft’s renewed Windows, AI strategy",https://www.livemint.com/companies/news/microsofts-renewed-windows-push-a-shot-in-the-arm-for-indias-ai-developers-11780482554302.html,2026-06-04 05:54:13 IST,"On Tuesday, Microsoft announced a host of developer features for its Windows OS, alongside seven new artificial intelligence (AI) models, a new security initiative, in-house chips and an agentic operating system (OS) designed for future AI-first devices.",https://www.livemint.com/rss/companies
"Uber cuts 23% of HR, People division as new president takes over",https://www.livemint.com/companies/news/uber-cuts-23-of-hr-people-division-as-new-president-takes-over-11780531676702.html,2026-06-04 05:47:35 IST,"Uber has differed from other tech companies conducting mass layoffs in the name of AI-driven investment and efficiencies, instead cutting in a more targeted way to trim costs.",https://www.livemint.com/rss/companies
"The investor education problem facing bankers selling sector-first financial IPOs worth  ₹3,700 crore",https://www.livemint.com/companies/news/niche-finance-ipos-worth-rs-3700-crore-stuck-amid-investor-education-push-11780457581090.html,2026-06-04 05:45:53 IST,"Three Sebi-cleared financial IPOs worth  ₹3,700 crore, Arcil, EAAA, and Gaja, remain unlaunched as bankers conduct extended investor education roadshows to compensate for the absence of listed domestic peers.&amp;nbsp;",https://www.livemint.com/rss/companies
Tax talent on the move as consulting firms ramp up hiring,https://www.livemint.com/companies/consulting-firms-tax-big-four-11780476738980.html,2026-06-04 05:45:53 IST,"India’s leading audit and consulting firms, are engaged in an intense battle for senior tax talent, with over 100 partners and executives changing firms in recent months. Rising demand for tax expertise, AI-driven solutions, regulatory complexity are driving aggressive hiring and expansion plans.",https://www.livemint.com/rss/companies
"Why retirement planning today must account for longevity, inflation and income security",https://www.livemint.com/money/personal-finance/why-retirement-planning-today-must-account-for-longevity-inflation-and-income-security-11780536784028.html,2026-06-04 08:46:23 IST,"A new approach to retirement planning is essential as longer lifespans, inflation and rising healthcare costs reshape financial goals, making income security and long-term financial independence more important than ever.",https://www.livemint.com/rss/money
"8th Pay Commission: Can India afford a 3.5 fitment factor? Salary hike, fiscal impact explained",https://www.livemint.com/money/personal-finance/8th-pay-commission-can-india-afford-a-3-5-fitment-factor-salary-hike-fiscal-impact-explained-11780514093213.html,2026-06-04 06:51:26 IST,"8th Pay Commission fitment factor discussions intensify as unions demand a revision of up to 4x in basic salaries, given current inflation, the once-a-decade revision and associated challenges. Here is what the impact of a 3.5 fitment factor will be on salaries, pensions and government finances.",https://www.livemint.com/rss/money
