title,link,published,summary,source
War robbing D-Street: M-cap drops further Rs 9.4 lakh crore,https://economictimes.indiatimes.com/markets/stocks/news/war-robbing-d-street-as-m-cap-drops-further-rs-9-4-lakh-crore/articleshow/129914315.cms,2026-03-31 07:17:08 IST,"Indian stock markets experienced a significant downturn. Overseas investors sold shares heavily, impacting the Sensex and Nifty. Rising crude oil prices and a weakening rupee added to investor concerns. Bank stocks also saw a sharp decline following regulatory changes. Global markets showed mixed reactions to geopolitical developments.",https://economictimes.indiatimes.com/markets/stocks/rssfeeds/2146843.cms
"Stock Market Holiday: NSE, BSE closed today for Mahavir Jayanti. What are the upcoming market holidays in 2026?",https://economictimes.indiatimes.com/markets/stocks/news/stock-market-holiday-nse-bse-closed-today-for-mahavir-jayanti-what-are-the-upcoming-market-holidays-in-2026/articleshow/129900702.cms,2026-03-31 07:00:00 IST,Indian stock markets are closed today for Shri Mahavir Jayanti. This is the first of two market holidays this week. Trading will resume on Friday for Good Friday and again on April 14 for Dr. Baba Saheb Ambedkar Jayanti. Several other holidays are scheduled throughout the year. MCX will have a trading break in the first session.,https://economictimes.indiatimes.com/markets/stocks/rssfeeds/2146843.cms
"Irdai to push basic health cover, hospital scorecards to expand sector",https://economictimes.indiatimes.com/markets/stocks/news/irdai-to-push-basic-health-cover-hospital-scorecards-to-expand-sector/articleshow/129914127.cms,2026-03-31 06:57:03 IST,"India's insurance regulator is set to introduce basic, no-frills health covers and performance scorecards for insurers and hospitals to address patient criticism and ensure industry viability. These initiatives, designed to enhance transparency and informed choices for policyholders, aim to improve claim settlement times and hospital billing practices, marking a shift towards preventive healthcare.",https://economictimes.indiatimes.com/markets/stocks/rssfeeds/2146843.cms
"Lending rates fall some more, private banks lead push",https://economictimes.indiatimes.com/markets/stocks/news/lending-rates-fall-some-more-private-banks-lead-push/articleshow/129914107.cms,2026-03-31 06:53:48 IST,"Fresh rupee loan rates dipped in February, with private banks leading the decline. However, public sector banks increased their lending rates. The easing on outstanding loans has been slower, despite significant repo rate cuts by the RBI over the past year.",https://economictimes.indiatimes.com/markets/stocks/rssfeeds/2146843.cms
Dubai unveils fiscal package to bolster businesses,https://economictimes.indiatimes.com/markets/stocks/news/dubai-unveils-fiscal-package-to-bolster-businesses/articleshow/129914031.cms,2026-03-31 06:44:21 IST,"Dubai has unveiled a significant AED 1 billion fiscal package to bolster businesses, especially those in tourism and trade impacted by current conflicts.  Effective April 1 for three to six months, the initiative includes a three-month deferment on government fees, hotel sales fees, and Tourism Dirham fees to ease financial burdens and enhance liquidity.",https://economictimes.indiatimes.com/markets/stocks/rssfeeds/2146843.cms
Brokerages turn bullish on HDFC Bank after sharp 26% correction,https://economictimes.indiatimes.com/markets/stocks/news/brokerages-turn-bullish-on-hdfc-bank-after-sharp-26-correction/articleshow/129913926.cms,2026-03-31 06:24:02 IST,"JP Morgan and Jefferies have upgraded HDFC Bank, citing attractive valuations after a significant share price decline. Both brokerages see a favorable risk-reward, with JP Morgan highlighting a strong core franchise and Jefferies pointing to potential re-rating catalysts like board clarity and CEO term rollover.",https://economictimes.indiatimes.com/markets/stocks/rssfeeds/2146843.cms
RBI defers capital market exposure norms to July 1,https://economictimes.indiatimes.com/markets/stocks/news/rbi-defers-capital-market-exposure-norms-to-july-1/articleshow/129913905.cms,2026-03-31 06:18:47 IST,"The Reserve Bank of India has postponed new capital market exposure rules. The implementation date is now July 1, 2026. Banks issuing payment commitments to stock exchange clearing corporations will see eased capital adequacy requirements. Capital will only be held on the portion classified as capital market exposure. These changes follow updates to the central bank's credit facilities framework.",https://economictimes.indiatimes.com/markets/stocks/rssfeeds/2146843.cms
"RBI allows SFBs to lend to MIs, sets fresh LTV ratio norms",https://economictimes.indiatimes.com/markets/stocks/news/rbi-allows-sfbs-to-lend-to-mis-sets-fresh-ltv-ratio-norms/articleshow/129913893.cms,2026-03-31 06:15:45 IST,"The Reserve Bank of India has permitted small finance banks to extend credit to capital market intermediaries. New loan-to-value ratio guidelines have been established for lending against financial assets, including eligible securities. The LTV ceiling for listed shares and convertible debt remains at 60%.",https://economictimes.indiatimes.com/markets/stocks/rssfeeds/2146843.cms
Bank stocks fall as Street factors in lower profits,https://economictimes.indiatimes.com/markets/stocks/news/bank-stocks-fall-as-street-factors-in-lower-profits/articleshow/129913869.cms,2026-03-31 06:10:35 IST,"Indian banks experienced a significant slump on Monday following the RBI's directive to curb net-positioning to support the rupee. The Bank Nifty retreated 3.8%, with all constituents losing value. These new regulations, effective April 10, restrict lenders' forex positions, potentially impacting near-term profits and causing short-term volatility.",https://economictimes.indiatimes.com/markets/stocks/rssfeeds/2146843.cms
"Bank FD tally in Q3 falls to 2-year low, total deposit base growth also slips",https://economictimes.indiatimes.com/markets/stocks/news/bank-fd-tally-in-q3-falls-to-2-year-low-total-deposit-base-growth-also-slips/articleshow/129913839.cms,2026-03-31 06:06:08 IST,"Bank fixed deposit growth slowed to a two-year low in the December quarter. Private banks led deposit collection. This slowdown may increase funding costs for lenders. However, current and savings account deposits saw improved growth. Experts predict a shift back to fixed deposits due to geopolitical events.",https://economictimes.indiatimes.com/markets/stocks/rssfeeds/2146843.cms
India's net international liability comes down by $10.9 billion in the third quarter,https://economictimes.indiatimes.com/markets/stocks/news/indias-net-international-liability-comes-down-by-10-9-billion-in-the-third-quarter/articleshow/129914268.cms,2026-03-30 21:11:48 IST,India's financial obligations to the world decreased by $10.9 billion in the third fiscal quarter. This improvement was driven by Indian residents increasing their overseas assets more than foreigners increased their assets in India. The ratio of India's international assets to liabilities saw a positive shift. Indian residents invested more abroad in direct investments and deposits.,https://economictimes.indiatimes.com/markets/stocks/rssfeeds/2146843.cms
India's invisible receipts grow 56% to $464.189 billion in April-Dec period,https://economictimes.indiatimes.com/markets/stocks/news/indias-invisible-receipts-grow-56-to-464-189-billion-in-april-dec-period/articleshow/129914080.cms,2026-03-30 21:05:18 IST,"India's inward receipts from international trade in services, incomes, and remittances surged by 56% to $464.189 billion in the first nine months of FY26, significantly bolstering the country's balance of payments. The services sector, contributing two-thirds of total receipts, saw a 9% increase to $310.242 billion, driven by telecommunication, computer, and information services.",https://economictimes.indiatimes.com/markets/stocks/rssfeeds/2146843.cms
"Gold, silver rates today: Gold prices rise above $4,600, silver surges to $73/oz. Should you trade?",https://www.livemint.com/market/commodities/gold-silver-rates-today-gold-prices-rise-above-4-600-silver-surges-to-73-oz-should-you-trade-11774919758351.html,2026-03-31 07:20:44 IST,"Gold and silver rates today surged up to 4% after Federal Reserve indicated that long-term US inflation expectations remained in check. Checkout latest gold and silver prices, along with experts take in near-term outlook.",https://www.livemint.com/rss/markets
Hedge Funds Chase Yen Strength Plays on Intervention Fears,https://www.livemint.com/market/hedge-funds-chase-yen-strength-plays-on-intervention-fears-11774921161340.html,2026-03-31 07:09:21 IST,"Hedge fund demand for dollar-yen options that profit from a decline in the pair has increased after the currency moved past 160, amplifying intervention rhetoric from Japan’s Ministry of Finance.",https://www.livemint.com/rss/markets
Stock market holidays 2026: Are BSE and NSE closed today for trading on Mahavir Jayanti?,https://www.livemint.com/market/stock-market-news/stock-market-holidays-are-bse-and-nse-closed-for-trading-on-mahavir-jayanti-2026-11774917709440.html,2026-03-31 06:43:16 IST,Stock market holidays 2026: The Indian stock market will remain closed for two sessions this week. Checkout full stock market holidays calendar 2026.,https://www.livemint.com/rss/markets
"After Iran, gold is looking less glittery",https://www.livemint.com/market/after-iran-gold-is-looking-less-glittery-11774918279870.html,2026-03-31 06:23:27 IST,Is the yellow metal the new crypto?,https://www.livemint.com/rss/markets
HDFC Bank falls on governance rumours: an opportunity or a warning?,https://www.livemint.com/market/stock-market-news/hdfc-bank-stock-fall-governance-rumors-opportunity-warning-11774859099406.html,2026-03-31 06:01:04 IST,"The HDFC Bank stock trades at a significant discount after a tough month. If this is a case of market overreaction, it is a clear signal to buy. Otherwise, the downside looks pretty steep.",https://www.livemint.com/rss/markets
Record foreign selling of  ₹1.8 trillion in FY26 marks a deeper shift in overseas capital flows,https://www.livemint.com/market/stock-market-news/india-fpi-outflows-record-quarter-century-global-disruptions-earnings-reset-11774881088234.html,2026-03-31 06:00:45 IST,"FY26 outflows hit  ₹1.8 trillion as earnings downgrades, crude shock and global volatility unsettle foreign investors. The trend shows how FPIs are turning more tactical, leading to episodic flows and higher market volatility.",https://www.livemint.com/rss/markets
India's brokerages face a sharp 30% revenue hit as West Asia war spooks retail investors and clients exit,https://www.livemint.com/market/active-clients-fall-india-brokers-west-asia-war-impact-retail-investors-11774854016636.html,2026-03-31 05:45:44 IST,"The latest West Asia conflict compounds issues from subdued markets and derivative trading curbs, intensifying an already challenging environment for India's brokerages.",https://www.livemint.com/rss/markets
The 72-hour U-turn: Inside the boardroom drama at Sundaram Clayton,https://www.livemint.com/companies/people/the-72-hour-u-turn-inside-the-boardroom-drama-at-sundaram-clayton-11774877895333.html,2026-03-31 05:30:44 IST,"The company secretary who left but stayed on, and a patriarch who returned to become chairman - For the TVS Group company, the weekend was an unusual one.",https://www.livemint.com/rss/companies
FY26 IPO market a disaster as investors lose money in 2 out of 3 issues. Will next year be better?,https://economictimes.indiatimes.com/markets/stocks/news/fy26-ipo-market-a-disaster-as-investors-lose-money-in-2-out-of-3-issues-will-next-year-be-better/articleshow/129916386.cms,2026-03-31 10:25:39 IST,"India’s IPO market in FY26 has seen a sharp downturn, with nearly two-thirds of listings trading below issue price. Weak market conditions, stretched valuations and cautious investor sentiment have weighed on performance, marking a reversal from earlier gains. Analysts view this as a cyclical correction, with recovery dependent on broader market stability.",https://economictimes.indiatimes.com/markets/stocks/rssfeeds/2146843.cms
12 Nifty stocks slide up to 40% in FY26. Are you affected?,https://economictimes.indiatimes.com/markets/stocks/news/12-nifty-stocks-slide-up-to-40-in-fy26-are-you-affected/slideshow/129916154.cms,2026-03-31 10:00:40 IST,"FY26 proved turbulent for Indian equities, with the Nifty declining amid geopolitical tensions and volatility. Nearly half of Nifty 50 stocks posted losses, with several heavyweights falling sharply. Weak sentiment, sectoral pressures, and stock-specific challenges defined a difficult year, highlighting broad-based investor pain and market-wide stress.",https://economictimes.indiatimes.com/markets/stocks/rssfeeds/2146843.cms
"New STT, MTF rules kick in from April 1: What changes for stock market traders and brokers",https://economictimes.indiatimes.com/markets/stocks/news/new-stt-mtf-rules-kick-in-from-april-1-what-changes-for-stock-market-traders-and-brokers/articleshow/129915911.cms,2026-03-31 09:59:25 IST,"From April 1, Indian markets face major regulatory changes as higher taxes and stricter funding norms reshape trading. Securities transaction tax (STT) on derivatives is rising sharply—150% on futures and 50% on options—while new RBI rules require 100% collateral for bank guarantees in proprietary trading, up from 50%.",https://economictimes.indiatimes.com/markets/stocks/rssfeeds/2146843.cms
Why multi-asset funds are now moving to the centre of mutual fund portfolios,https://economictimes.indiatimes.com/markets/stocks/news/why-multi-asset-funds-are-now-moving-to-the-centre-of-mutual-fund-portfolios/articleshow/129915299.cms,2026-03-31 09:06:32 IST,"Multi-asset allocation funds are gaining prominence in Indian mutual fund portfolios, attracting significant inflows and growing assets. These funds offer a diversified approach by investing in equity, debt, and commodities, providing resilience across market cycles. Investors are increasingly recognizing their value as a strategic core holding for long-term wealth creation.",https://economictimes.indiatimes.com/markets/stocks/rssfeeds/2146843.cms
"GIFT Nifty jumps 240 points on Trump's reported plans to end Iran war. Sensex, Nifty to see some relief tomorrow?",https://economictimes.indiatimes.com/markets/stocks/news/gift-nifty-jumps-240-points-on-trumps-reported-plans-to-end-iran-war-sensex-nifty-to-see-some-relief-tomorrow/articleshow/129914731.cms,2026-03-31 08:16:42 IST,"Indian stock markets are poised for a potential rebound tomorrow following a significant sell-off, buoyed by positive signals from GIFT Nifty and declining oil prices. Reports suggest a potential de-escalation in US-Iran tensions, while a dip in US bond yields offers further support. Despite this optimism, foreign investor outflows and a weakening rupee warrant caution.",https://economictimes.indiatimes.com/markets/stocks/rssfeeds/2146843.cms
"Stocks to buy for short term: From DMart, MCX to Aurobindo Pharma— Experts suggest 6 stock picks for next 1-2 weeks",https://www.livemint.com/market/stock-market-news/stocks-to-buy-for-short-term-from-dmart-mcx-to-aurobindo-pharma-experts-suggest-6-stock-picks-for-next-1-2-weeks-11774926864617.html,2026-03-31 10:15:39 IST,"Stocks to buy for short term: Vishnu Kant Upadhyay of Master Capital Services and Hitesh Tailor of Choice Broking recommend six stocks, including Avenue Supermarts (DMart), MCX, and Aurobindo Pharma, for the next 1-2 weeks.",https://www.livemint.com/rss/markets
Oil slips 1% as Trump signals possible end to US-Iran war. Can prices drop to $100/bbl level?,https://www.livemint.com/market/commodities/oil-slips-1-as-trump-signals-possible-end-to-us-iran-conflict-can-prices-drop-to-100-bbl-level-11774927057676.html,2026-03-31 09:28:31 IST,"US-Iran war: Oil prices fell around 1% on Tuesday after reports revealed that Donald Trump was open to ending war against Iran. Check latest crude oil prices, along with experts take on near-term outlook.",https://www.livemint.com/rss/markets
Five beaten-down railway stocks to watch,https://www.livemint.com/market/stock-market-news/rvnl-ircon-ramkrishna-forging-titagarh-rail-texmaco-railway-stocks-11774868577702.html,2026-03-31 09:00:47 IST,"Railway stocks have declined amid weak execution, margin pressures, and moderation in investor sentiment across the sector.",https://www.livemint.com/rss/markets
"Asian markets today: Kospi falls 4%, Nikkei 225 down 2.2% on US-Iran war escalation",https://www.livemint.com/market/stock-market-news/asian-markets-today-kospi-falls-4-nikkei-225-down-2-2-on-us-iran-war-escalation-11774921988771.html,2026-03-31 07:54:55 IST,Asian markets witnessed a downward trend on Tuesday amid rising crude oil prices and the escalating tensions in the Middle East. Checkout latest stock movements in the Asian countries and the US.,https://www.livemint.com/rss/markets
8th Pay Commission to visit Dehradun on 24 April; stakeholders can apply by 10 April,https://www.livemint.com/money/personal-finance/8th-pay-commission-to-visit-dehradun-on-24-april-stakeholders-can-apply-by-10-april-11774929741663.html,2026-03-31 10:20:53 IST,"8th Central Pay Commission Dehradun Visit 2026 invites stakeholders for consultations on pay, allowances, and pensions. The deadline to submit participation requests for the 24 April meeting is 10 April.",https://www.livemint.com/rss/money
"April 1 Financial Rule Change LIVE Updates: ITR, PAN, salary, LPG prices set for major revisions",https://www.livemint.com/money/personal-finance/april-1-financial-rule-change-live-fy27-itr-pan-salary-lpg-prices-property-tax-labour-laws-income-tax-11774921936095.html,2026-03-31 07:54:11 IST,"April 1 Financial Rule Changes LIVE Updates: One of the most significant changes from 1 April is the implementation of the new Income Tax Act, 2025. Follow Mint's LIVE coverage of 1 April financial rule changes.",https://www.livemint.com/rss/money
Wall Street rally ahead? Dow futures jump nearly 500 points on Trump’s reported plans to exit Iran war,https://economictimes.indiatimes.com/markets/stocks/news/wall-street-rally-ahead-dow-futures-jump-nearly-500-points-on-trumps-reported-plans-to-exit-iran-war/articleshow/129917897.cms,2026-03-31 11:51:24 IST,"US stock futures surged after reports suggested Donald Trump may seek to end the Iran conflict, easing investor concerns over prolonged geopolitical tensions. Gains in Dow, Nasdaq and S&amp;P futures come amid stable oil prices and falling bond yields, although uncertainty remains due to ongoing risks in the Strait of Hormuz.",https://economictimes.indiatimes.com/markets/stocks/rssfeeds/2146843.cms
Stocks to buy: 10 large-caps with up to 81% upside potential after March correction,https://economictimes.indiatimes.com/markets/stocks/news/stocks-to-buy-10-large-caps-with-up-to-81-upside-potential-after-march-correction/slideshow/129917275.cms,2026-03-31 11:07:09 IST,,https://economictimes.indiatimes.com/markets/stocks/rssfeeds/2146843.cms
Nifty 50 has risen eight times in last 10 years in April: Will US-Iran war clouds derail strong seasonality?,https://www.livemint.com/market/stock-market-news/nifty-50-has-risen-eight-times-in-last-10-years-in-april-will-us-iran-war-clouds-derail-strong-seasonality-11774938458192.html,2026-03-31 12:04:28 IST,"Historical data from Trendlyne shows that between 2016 and 2025, barring 2021 and 2022, the 50-pack Nifty has ended the month of April in the green. The average return during this period has been 3%.",https://www.livemint.com/rss/markets
"Easebuzz eyes $80–100 million pre-IPO round, appoints banker",https://www.livemint.com/market/ipo/easebuzz-pre-ipo-funding-fintech-india-11774929060470.html,2026-03-31 11:17:45 IST,"The profitable payments firm will launch a mid-year process with Avendus as banker, targeting a valuation markup ahead of a fundraise later this year and a public market debut in the next 24–36 months.",https://www.livemint.com/rss/markets
"Gold, silver rates today: Check 24K, 22K gold, 999 silver rates on 31 March in your city — Delhi, Mumbai, others",https://www.livemint.com/market/commodities/gold-silver-rates-today-check-24k-22k-gold-999-silver-rates-on-31-march-in-your-city-delhi-mumbai-others-11774930486041.html,2026-03-31 11:12:07 IST,"On 31 March, gold prices fell in India, while silver gained slightly. Here are the rates of the yellow and white metals in major cities of the country.&amp;nbsp;",https://www.livemint.com/rss/markets
"Indian mid-size IT companies look beyond US: Asia, Africa emerge as new growth hotspots",https://www.livemint.com/companies/persistent-systems-hexaware-firstsource-solutions-indian-mid-size-it-companies-asia-africa-growth-hotspots-11774926819661.html,2026-03-31 11:58:39 IST,"Asia, Africa and West Asia are emerging as key growth engines for Indian IT. These markets offer faster expansion than traditional US and European strongholds, attracting significant investment and new client focus.",https://www.livemint.com/rss/companies
How RBI’s Sachet Portal can help you stay safe from financial fraud in FY27; 5-step guide to file complaint,https://www.livemint.com/money/personal-finance/how-rbi-s-sachet-portal-can-help-you-stay-safe-from-financial-fraud-in-fy27-5-step-guide-to-file-complaint-11774936745834.html,2026-03-31 12:14:22 IST,"RBI Sachet Portal helps users verify financial institutions, report fraud, and track complaints.",https://www.livemint.com/rss/money
Duration or accrual: Where should debt investors park money now?,https://www.livemint.com/money/personal-finance/duration-vs-accrual-debt-mutual-fund-strategy-11774885413056.html,2026-03-31 11:48:12 IST,"Debt mutual funds follow different strategies—some bet on falling rates, others earn steady income. With yield spreads wide, here’s how duration and accrual strategies stack up now.",https://www.livemint.com/rss/money
Market crashes teach what no book or course ever can,https://www.livemint.com/money/personal-finance/stock-market-crash-lessons-investors-peter-lynch-11774850888972.html,2026-03-31 11:09:30 IST,"The only way to truly learn investing is to live through the fear and the panic—because markets don’t test your knowledge, they test your nerve. Real conviction is forged not in bull runs, but in moments when staying invested feels hardest.",https://www.livemint.com/rss/money
Three niche commodity prices are surging. What they show about China's grip on supply chains,https://www.cnbc.com/2026/03/31/commodities-price-of-tungsten-sulfur-and-helium.html,2026-03-31 10:59:11 IST,"In the wake of the Iran war, prices are surging for critical elements used in defense and the semiconductors that power artificial intelligence advances.",https://www.cnbc.com/id/10000664/device/rss/rss.html
