title,link,published,summary,source
Vedanta Demerger: How to trade the Anil Agarwal-led stock ahead of record date?,https://www.livemint.com/market/stock-market-news/vedanta-demerger-how-to-trade-the-anil-agarwal-led-stock-ahead-of-record-date-11777015805994.html,2026-04-25 06:18:43 IST,"Ahead of the Vedanta demerger record date, Vedanta's shares are expected to be volatile. Long-term investors may accumulate shares if valuations are appealing, while short-term traders should focus on the pre-record date rallyand ensure tight stop losses.&amp;nbsp;",https://www.livemint.com/rss/markets
"AI Chip Surge Elevates Taiwan, Korea in Global Equity Rankings",https://www.livemint.com/market/ai-chip-surge-elevates-taiwan-korea-in-global-equity-rankings-11777076636370.html,2026-04-25 05:53:55 IST,"The artificial intelligence boom has triggered a seismic reshuffling of global equity markets, with Taiwan and South Korea muscling past European nations one by one.",https://www.livemint.com/rss/markets
"Ficci flags audit rule change proposal in Companies Act, warns of higher costs, reduced expertise",https://www.livemint.com/companies/news/audit-firms-non-audit-services-ban-ficci-companies-act-11776942000591.html,2026-04-25 07:00:49 IST,"Ficci has urged the government to drop a proposed three-year ban preventing audit firms from offering non-audit services to former clients. It said the move would raise costs, limit expertise for large companies and force reliance on smaller audit firms.",https://www.livemint.com/rss/companies
$40 Billion from Google. $25 Billion from Amazon. Anthropic is now the most fought-over AI company on Earth,https://www.livemint.com/companies/news/40-billion-from-google-25-billion-from-amazon-anthropic-is-now-the-most-fought-over-ai-company-on-earth-11777076260150.html,2026-04-25 06:18:55 IST,"Google has committed up to $40 billion to Anthropic, days after Amazon pledged $25 billion, confirming the Claude maker as the AI industry's most coveted startup.",https://www.livemint.com/rss/companies
"Elon Musk vs Sam Altman: US Court drops fraud allegations against OpenAI, but biggest AI trial of the decade is still on",https://www.livemint.com/companies/news/elon-musk-vs-sam-altman-us-judge-dismisses-fraud-claims-against-openai-trial-to-proceed-on-breach-of-trust-claim-11777074120973.html,2026-04-25 05:32:58 IST,"A US judge has dismissed Elon Musk's fraud claims against OpenAI and Sam Altman, but his $134 billion lawsuit over breach of charitable trust heads to trial Monday.",https://www.livemint.com/rss/companies
APCO in talks to sell Z-Morh tunnel in J&amp;K to Alpha Alternatives for $267 mn,https://www.livemint.com/companies/news/apco-infratech-in-talks-with-alpha-alternatives-to-sell-strategic-z-morh-tunnel-for-267-million-11777028220379.html,2026-04-25 05:31:07 IST,"The 6.5-km- tunnel, which ensures uninterrupted military logistics and year-round civilian access to Ladakh by bypassing an avalanche-prone stretch, was built at  ₹2,400 crore and inaugurated in 2025.",https://www.livemint.com/rss/companies
5% annual increase in SIP can boost your retirement corpus by more than  ₹83 lakh. Here's how,https://www.livemint.com/money/5-annual-increase-in-sip-can-boost-your-retirement-corpus-by-more-than-rs-83-lakh-heres-how-11776849366455.html,2026-04-25 07:03:50 IST,"With a step-up SIP, an investor can increase their SIP amount annually as their annual income grows and accumulate a higher retirement corpus compared to a regular SIP.",https://www.livemint.com/rss/money
"RBI revokes Paytm Payments Bank licence: But what happens to your Paytm Wallet, UPI, and account now?",https://www.livemint.com/money/personal-finance/rbi-revokes-paytm-payments-bank-licence-but-what-happens-to-your-paytm-wallet-upi-and-account-now-11777076551326.html,2026-04-25 06:33:17 IST,"The RBI cancelled Paytm Payments Bank's license for non-compliance, stating it harmed depositors' interests. The central bank assured users their funds are safe and the Paytm app will continue normal operations.",https://www.livemint.com/rss/money
Sebi plans risk-based calculation for brokers’ variable net worth,https://economictimes.indiatimes.com/markets/stocks/news/sebi-plans-risk-based-calculation-for-brokers-variable-net-worth/articleshow/130507941.cms,2026-04-25 09:45:24 IST,"In a groundbreaking initiative, the Securities and Exchange Board of India is set to revamp the variable net worth calculation method for stockbrokers. This reform is designed to align capital adequacy with the actual risks of their operations and the size of their client pool.",https://economictimes.indiatimes.com/markets/stocks/rssfeeds/2146843.cms
"Sumitomo Mitsui infuses Rs 1,075 cr into NBFC arm",https://economictimes.indiatimes.com/markets/stocks/news/sumitomo-mitsui-infuses-rs-1075-cr-into-nbfc-arm/articleshow/130507894.cms,2026-04-25 09:43:10 IST,"Japanese conglomerate Sumitomo Mitsui Financial Group has injected ₹1,075 crore into its Indian arm, SMFG India Credit. This follows a significant ₹3,000 crore infusion in December 2024. SMFG India Credit's assets under management reached ₹64,100 crore by December 2025. The group also increased its stake in Yes Bank to 24.2% in September 2025.",https://economictimes.indiatimes.com/markets/stocks/rssfeeds/2146843.cms
Sebi plans changes to rules on unpaid securities,https://economictimes.indiatimes.com/markets/stocks/news/sebi-plans-changes-to-rules-on-unpaid-securities/articleshow/130507873.cms,2026-04-25 09:40:42 IST,"The Securities and Exchange Board of India has unveiled plans to revamp broker regulations. Designed to refine the management of partially paid securities, the suggested reforms include tighter payment deadlines and a swifter process for retrieving pledged investments. This strategic shift aims to elevate market liquidity and lessen prolonged delays for investors while allowing for flexibility in certain challenging scenarios.",https://economictimes.indiatimes.com/markets/stocks/rssfeeds/2146843.cms
Sebi plans risk-based calculation for brokers’ variable net worth,https://economictimes.indiatimes.com/markets/stocks/news/sebi-plans-risk-based-calculation-for-brokers-variable-net-worth/articleshow/130507832.cms,2026-04-25 09:38:07 IST,"The Securities and Exchange Board of India (SEBI) has unveiled plans to overhaul how stockbrokers assess their capital. This innovative strategy will tie capital requirements directly to business risks and client engagement. By fostering a more nuanced, risk-oriented framework, SEBI hopes to ensure that the capital accurately mirrors the broker’s operational scale.",https://economictimes.indiatimes.com/markets/stocks/rssfeeds/2146843.cms
Rs 2.5 lakh crore wiped out: Why Nifty IT just recorded its worst week since 2020,https://economictimes.indiatimes.com/markets/stocks/news/rs-2-5-lakh-crore-wiped-out-why-nifty-it-just-recorded-its-worst-week-since-2020/articleshow/130507772.cms,2026-04-25 09:37:46 IST,"India’s Nifty IT index plunged 10% in a week, marking its steepest fall since March 2020, as weak Q4 earnings and cautious guidance triggered heavy selling. Analysts warn of further downside, with FIIs exiting and technical indicators weakening, even as some see long-term opportunities in mid-cap IT stocks.",https://economictimes.indiatimes.com/markets/stocks/rssfeeds/2146843.cms
D-Street bears brunt of elusive US-Iran truce,https://economictimes.indiatimes.com/markets/stocks/news/d-street-bears-brunt-of-elusive-us-iran-truce/articleshow/130507754.cms,2026-04-25 09:32:05 IST,"Indian stock markets closed the week with losses. Optimism for a US-Iran truce faded, impacting investor sentiment. Crude oil prices saw a significant spike. IT companies also reported lower-than-expected earnings. Foreign portfolio investors sold shares heavily. Analysts advise caution and gradual investment as markets face hurdles.",https://economictimes.indiatimes.com/markets/stocks/rssfeeds/2146843.cms
"JP Morgan downgrades India to underweight, flags earnings risks",https://economictimes.indiatimes.com/markets/stocks/news/jp-morgan-turns-bearish-flags-earnings-risks/articleshow/130507730.cms,2026-04-25 09:28:58 IST,JP Morgan has downgraded India to neutral. Elevated valuations and earnings risks are cited. HSBC also downgraded India. Inflationary pressures and demand concerns may impact growth. India's historical premium is facing challenges. Other emerging markets offer cheaper entry points for similar growth.,https://economictimes.indiatimes.com/markets/stocks/rssfeeds/2146843.cms
"US-Iran war to fuel petrol, diesel prices. How can stock market investors make money from it?",https://www.livemint.com/market/stock-market-news/us-iran-war-news-to-fuel-petrol-diesel-prices-how-can-market-investors-make-money-from-it-11777084466718.html,2026-04-25 09:21:50 IST,"US-Iran war: According to experts, when oil prices go up, upstream oil producers like ONGC and Oil India usually do better",https://www.livemint.com/rss/markets
IT sector Q4 results review: From lower growth visibility to AI impact- Is IT a sector to avoid?,https://www.livemint.com/market/stock-market-news/it-sector-q4-results-review-from-lower-growth-visibility-to-ai-impact-is-it-a-sector-to-avoid-11777085170061.html,2026-04-25 09:20:46 IST,"The Q4FY26 results of major Indian IT players reveal a mixed bag of performance amid rising AI influence and uncertain market conditions. For the week ended Friday, 24 April, the Nifty IT index crashed over 10%, while the equity barometer Nifty 50 declined about 2%.",https://www.livemint.com/rss/markets
Are power stocks entering a new cycle? 3 stocks to watch,https://www.livemint.com/market/stock-market-news/are-power-stocks-entering-a-new-cycle-3-stocks-to-watch-11777030893510.html,2026-04-25 08:00:51 IST,"India’s power sector is entering a high-growth phase, driven by surging demand, renewable expansion, and new consumption drivers like data centres and EVs.",https://www.livemint.com/rss/markets
Reliance GDR price dips after Reliance Q4 results 2026. Should you buy Reliance shares on Monday?,https://www.livemint.com/market/stock-market-news/reliance-gdr-price-dips-after-reliance-q4-results-2026-should-you-buy-reliance-shares-on-monday-11777079206456.html,2026-04-25 07:39:09 IST,Reliance GDR price dipped after the announcement of Reliance Q4 results 2026 and finished 0.86% lower at $57.50,https://www.livemint.com/rss/markets
"Zero income tax nations: Dubai, Monaco, Bahamas and more on the list",https://www.livemint.com/money/personal-finance/zero-income-tax-nations-dubai-monaco-bahamas-and-more-on-the-list-11777081101892.html,2026-04-25 08:36:26 IST,"Countries like Dubai and Qatar do not impose personal income taxes, instead generating revenue through VAT and other fees. This model allows them to maintain tax-friendly environments while still funding government services.",https://www.livemint.com/rss/money
