title,link,published,summary,source
"Wall Street: S&amp;P 500, Nasdaq slip as concerns over AI bubble weigh, Nvidia sinks 2.4%",https://www.livemint.com/market/stock-market-news/sp-500-nasdaq-muted-as-concerns-over-ai-bubble-weigh-11772115398932.html,2026-02-26 20:15:32 IST,"As of 9:35 a.m. Eastern Time, the S&amp;amp;P 500 slipped 0.1% and the Nasdaq Composite was 0.4% lower. The Dow Jones Industrial Average was up 0.5%.",https://www.livemint.com/rss/markets
"Sebi mandates mutual funds value gold, silver using domestic prices",https://www.livemint.com/market/sebi-mutual-funds-gold-silver-etf-valuation-domestic-spot-prices-11772108223741.html,2026-02-26 19:51:36 IST,"In a circular issued on Thursday, the market regulator said mutual funds will now value physical gold and silver held by schemes using polled spot prices published by stock exchanges.&amp;nbsp;",https://www.livemint.com/rss/markets
"Sebi tightens social media norms, mandates registration disclosures",https://www.livemint.com/market/stock-market-news/sebi-social-media-rules-sebi-circular-regulated-entities-11772109964628.html,2026-02-26 19:44:06 IST,"Sebi said the objective is to distinguish content posted by registered entities from that of unregistered individuals, thereby strengthening investor protection and promoting ease of doing business.",https://www.livemint.com/rss/markets
MP Materials selects Texas for rare earth magnet manufacturing site,https://www.cnbc.com/2026/02/26/mp-materials-selects-texas-for-rare-earth-magnet-manufacturing-site.html,2026-02-26 19:55:31 IST,"MP Materials has chosen Northlake, Texas, for its $1.25 billion rare earth magnet factory as the U.S. rushes to secure domestic supplies of critical minerals.",https://www.cnbc.com/id/10000664/device/rss/rss.html
Sebi cautions investors against fake notices demanding STT payments,https://economictimes.indiatimes.com/markets/stocks/news/sebi-cautions-investors-against-fake-notices-demanding-stt-payments/articleshow/128819997.cms,2026-02-26 21:56:28 IST,Sebi warns investors about fake notices demanding Securities Transaction Tax payments. Fraudsters are using forged Sebi letterheads to deceive people. The market regulator clarifies it does not issue such notices. Investors are urged to verify all communications. Sebi also cautions against unregistered individuals promising risk-free profits and handling trading accounts. Investors should check Sebi registration before investing.,https://economictimes.indiatimes.com/markets/stocks/rssfeeds/2146843.cms
Ahead of Market: 10 things that will decide stock market action on Friday,https://economictimes.indiatimes.com/markets/stocks/news/ahead-of-market-10-things-that-will-decide-stock-market-action-on-friday/articleshow/128819417.cms,2026-02-26 21:34:19 IST,"Nifty 50 and BSE Sensex ended largely unchanged as financial stocks, led by HDFC Bank, offset gains in auto and FMCG shares. Analysts flagged weak momentum, bearish technical signals and key support near 25,400, indicating choppy trade and possible near-term downside.",https://economictimes.indiatimes.com/markets/stocks/rssfeeds/2146843.cms
Sebi Working Groups submit reports on agri commodity derivatives to Chairman for review,https://www.livemint.com/market/stock-market-news/sebi-working-groups-submit-reports-on-agri-commodity-derivatives-to-chairman-for-review-11772119861779.html,2026-02-26 21:50:58 IST,"Sebi's working groups are reviewing the delivery and settlement framework in agricultural commodity derivatives. The expert panels were tasked with assessing whether the current framework governing margins, position limits, and delivery and settlement mechanisms could be improved.",https://www.livemint.com/rss/markets
"Gold, silver rates today: Comex gold drops $72/oz; silver falls $4.90/oz ahead of US-Iran nuclear talks",https://www.livemint.com/market/commodities/gold-silver-rates-today-comex-gold-drops-72-oz-silver-falls-4-90-oz-ahead-of-us-iran-nuclear-talks-11772115879201.html,2026-02-26 21:50:55 IST,"Gold and silver prices declined on February 26 as investors awaited US-Iran nuclear talks. April gold futures fell to $5,154, while March silver futures dropped to $86.13.&amp;nbsp;",https://www.livemint.com/rss/markets
Vishal Mega Mart promoter entity likely to sell 6.5% stake via block deal: Report,https://economictimes.indiatimes.com/markets/stocks/news/vishal-mega-mart-promoter-entity-likely-to-sell-6-5-stake-via-block-deal-report/articleshow/128820501.cms,2026-02-26 22:16:26 IST,"Vishal Mega Mart's promoter, Samayat Services LLP, is set to sell a 6.5% stake through a block deal at Rs 115 per share, a 10% discount to the current market price. This move comes as the company reported a 19% rise in net profit for the December quarter.",https://economictimes.indiatimes.com/markets/stocks/rssfeeds/2146843.cms
560% return in five years! Multibagger FMCG stock to be in focus on Friday; here's why,https://www.livemint.com/market/stock-market-news/560-return-in-five-years-multibagger-fmcg-stock-to-be-in-focus-on-friday-heres-why-11772124604587.html,2026-02-26 23:11:10 IST,"Multibagger stock: Shares of FMCG brand GRM Overseas is expected to be in focus on Friday, 27 February after the company informed that it has acquired UAE based GRM ARABIA FZCO.",https://www.livemint.com/rss/markets
Intuit shares climb over 2% ahead of Q2 earnings,https://www.livemint.com/market/intuit-shares-climb-over-2-ahead-of-q2-earnings-11772122514759.html,2026-02-26 22:59:30 IST,Analysts largely expect the results to demonstrate year-over-year growth in both revenue and earnings per share&amp;nbsp;,https://www.livemint.com/rss/markets
Local investors may get to sell shares in GIFT City's secondary market,https://www.livemint.com/market/gift-city-secondary-market-shares-indian-investors-trading-permitted-11772106154338.html,2026-02-26 22:36:04 IST,"Two years after a change in rules allowed Indian companies to list in GIFT City exchanges, just one company has stepped up. Now, the regulators - IFSCA and RBI - are discussing with Centre if local shareholders can be allowed to trade in secondary markets in GIFT City.",https://www.livemint.com/rss/markets
"Layoff news: CNBC to cut nearly a dozen jobs; unify digital, TV news operations, says report",https://www.livemint.com/companies/news/layoff-news-cnbc-to-cut-nearly-a-dozen-jobs-unify-digital-tv-news-operations-says-report-11772126524322.html,2026-02-26 23:13:46 IST,"CNBC to unify digital and TV news operations, cut nearly a dozen jobs, says report.",https://www.livemint.com/rss/companies
Soybeans ease on profit taking after hitting 20-month peak on demand hopes,https://www.livemint.com/market/soybeans-ease-on-profit-taking-after-hitting-20-month-peak-on-demand-hopes-11772130858070.html,2026-02-27 00:04:17 IST,GLOBAL-GRAINS/ (UPDATE 2):GRAINS-Soybeans ease on profit taking after hitting 20-month peak on demand hopes,https://www.livemint.com/rss/markets
"FS KKR Private Credit Fund Sinks on Dividend Cut, Bad Loans",https://www.livemint.com/companies/fs-kkr-private-credit-fund-sinks-on-dividend-cut-bad-loans-11772130798500.html,2026-02-27 00:03:18 IST,"A private credit fund jointly managed by Future Standard and KKR &amp; Co. plunged after cutting its dividend more than forecast, as earnings declined amid lower interest rates and losses from troubled investments.",https://www.livemint.com/rss/companies
"Wall St slides as tech rally stalls, AI enthusiasm wanes after Nvidia results",https://www.livemint.com/market/wall-st-slides-as-tech-rally-stalls-ai-enthusiasm-wanes-after-nvidia-results-11772134076900.html,2026-02-27 00:57:56 IST,USA-STOCKS/ (UPDATE 5):US STOCKS-Wal,https://www.livemint.com/rss/markets
EU Commission Asks Anti-Fraud Watchdog to Probe Mandelson,https://www.livemint.com/companies/eu-commission-asks-anti-fraud-watchdog-to-probe-mandelson-11772131597318.html,2026-02-27 00:16:36 IST,"The European Union’s anti-fraud office has been asked to “look into” the conduct of Peter Mandelson during his time as the bloc’s trade chief, after further details of the British politician’s links with convicted sex offender Jeffrey Epstein came to light.",https://www.livemint.com/rss/companies
