title,link,published,summary,source
"TCS, Nasdaq vying for NCDEX equity platform vendor deal",https://www.livemint.com/market/stock-market-news/ncdex-equity-derivatives-platform-launch-plans-vendors-funding-11766148643678.html,2025-12-20 05:30:42 IST,"NCDEX is reviewing technical proposals from top global vendors for an equity platform launching in FY27. It has raised  ₹770 crore for financing and aims to entice IPO-bound firms, navigating a competitive landscape dominated by established exchanges.",https://www.livemint.com/rss/markets
How an Indian CEO ran his first full marathon in a Swedish mine,https://www.livemint.com/companies/news/india-sweden-mine-world-deepest-marathon-hindustan-zinc-arun-misra-11765763565102.html,2025-12-20 05:31:02 IST,Hindustan Zinc's CEO Arun Misra ran his first full marathon in October—the world's deepest over a kilometer underground in a Swedish mine. Misra wanted to highlight modern mining practices and shift public perception of the industry and remind customers how integral mining is to everyday life.&amp;nbsp;,https://www.livemint.com/rss/companies
VIX India today at record low. What does it signal about the Indian stock market? Explained,https://www.livemint.com/market/stock-market-news/vix-india-today-at-record-low-what-does-it-signal-about-the-indian-stock-market-explained-11766199200180.html,2025-12-20 08:38:53 IST,Indian stock market: VIX India came close to the 52-week low on Friday before closing at 9.52,https://www.livemint.com/rss/markets
"What does Infosys ADR stock rally on the NYSE mean for Infosys shares on the NSE, BSE?",https://www.livemint.com/market/stock-market-news/what-infosys-adr-stock-rally-on-nyse-mean-for-infosys-shares-on-nse-bse-11766194541067.html,2025-12-20 07:19:29 IST,"Infosys ADR stock price hit 52-week high on Friday, logging an intraday rise of over 56% after the short squeeze trigger",https://www.livemint.com/rss/markets
Three small-cap aerospace stocks to add to your 2026 watchlist,https://www.livemint.com/market/stock-market-news/india-aerospace-defence-manufacturing-smallcap-stocks-2026-watchlist-investment-11766145397250.html,2025-12-20 07:00:24 IST,These small-cap aerospace companies are building strong positions in electronics and precision manufacturing.,https://www.livemint.com/rss/markets
Who is Dina Powell McCormick? Former Donald Trump advisor leaving Meta board in just eight months,https://www.livemint.com/companies/news/dina-powell-mccormick-who-is-former-donald-trump-advisor-leaving-meta-board-in-just-eight-months-advisor-mark-zuckerberg-11766195804977.html,2025-12-20 08:29:51 IST,"Dina Powell McCormick, a&amp;nbsp;former top adviser to President Donald Trump, has resigned from the Meta Platforms board just eight months after she was brough onboard by Mark Zuckerberg. Sources say she will continue her association in an advisory role.&amp;nbsp;",https://www.livemint.com/rss/companies
Big win for Elon Musk: Tesla CEO to get 2018 pay package now valued at $140 billion — Will his net worth increase?,https://www.livemint.com/companies/people/big-win-for-elon-musk-tesla-ceo-to-get-2018-pay-package-now-valued-at-140-billion-will-his-net-worth-increase-11766195822045.html,2025-12-20 08:20:10 IST,"Musk's 2018 Tesla pay package is set to be reinstated as the Delaware Supreme Court reversed the ruling of a judge who previously found that the CEO had influenced board members, who came up with the compensation plan, improperly.",https://www.livemint.com/rss/companies
Elon Musk just got a $138 billion pay day—sort of. What to know.,https://www.livemint.com/companies/news/elon-musk-just-got-a-138-billion-pay-day-sort-of-what-to-know-11766196050089.html,2025-12-20 07:34:28 IST,Tesla CEO Elon Musk has had a year for the ages. He’s up about $200 billion and counting.,https://www.livemint.com/rss/companies
TCS among ICICI Securities top 5 bets with upside potential of up to 26% in 1 year,https://economictimes.indiatimes.com/markets/stocks/news/tcs-among-icici-securities-top-5-bets-with-upside-potential-of-up-to-26-in-1-year/slideshow/126088270.cms,2025-12-20 09:41:47 IST,"ICICI Securities sees Nifty heading towards 29,500 by 2026 and has named Bank of India, Marico, Ultratech Cement, TCS and Sun Pharma as its top five stock picks with upside potential of up to 26% over the next year.",https://economictimes.indiatimes.com/markets/stocks/rssfeeds/2146843.cms
Stock market meets physics: 5 laws that explain why prices move the way they do,https://economictimes.indiatimes.com/markets/stocks/news/stock-market-meets-physics-5-laws-that-explain-why-prices-move-the-way-they-do/articleshow/126088189.cms,2025-12-20 09:39:32 IST,"Ambit Capital has drawn parallels between stock markets and classical physics, outlining five laws that explain price behaviour. From inertia and momentum to mean reversion and valuation resistance, the framework helps investors decode why some stocks outperform while others stagnate, and why rich valuations often cap long-term returns.",https://economictimes.indiatimes.com/markets/stocks/rssfeeds/2146843.cms
"Wall St ends higher as tech rally continues, led by Micron",https://economictimes.indiatimes.com/markets/stocks/news/wall-st-ends-higher-as-tech-rally-continues-led-by-micron/articleshow/126088101.cms,2025-12-20 09:29:04 IST,"U.S. stocks closed higher Friday, with technology shares like Micron and Nvidia leading the rebound after a rocky week. This surge offset declines in consumer stocks such as Nike, which experienced a significant drop. The market also saw optimism around potential Federal Reserve interest rate cuts and the traditional ""Santa Claus rally.""",https://economictimes.indiatimes.com/markets/stocks/rssfeeds/2146843.cms
European shares close at record high driven by defence stocks,https://economictimes.indiatimes.com/markets/stocks/news/european-shares-close-at-record-high-driven-by-defence-stocks/articleshow/126088074.cms,2025-12-20 09:24:15 IST,"European stocks hit a record high Friday, buoyed by defence and insurance sectors, ending the year on an optimistic note. The STOXX 600 index saw significant gains, driven by strong performances in banking and aerospace. This surge follows a week of tech-led losses, with investors now favouring European markets over U.S. tech giants amid falling interest rates.",https://economictimes.indiatimes.com/markets/stocks/rssfeeds/2146843.cms
Wall Street Week Ahead: A Santa rally? Investors hope for year-end gains to cap strong 2025,https://economictimes.indiatimes.com/markets/stocks/news/wall-street-week-ahead-a-santa-rally-investors-hope-for-year-end-gains-to-cap-strong-2025/articleshow/126088034.cms,2025-12-20 09:16:50 IST,"U.S. stocks face year-end turbulence despite solid 2025 performance, with AI spending scrutiny and shifting Fed rate cut expectations driving market swings. While tame inflation data offers some optimism for a Santa Claus rally, investors are also digesting delayed economic reports and considering profit-taking after a strong year.",https://economictimes.indiatimes.com/markets/stocks/rssfeeds/2146843.cms
Inox Green to Acquire Macquarie's Renewable Platform Vibrant,https://economictimes.indiatimes.com/markets/stocks/news/inox-green-to-acquire-macquaries-renewable-platform-vibrant/articleshow/126088653.cms,2025-12-20 10:24:33 IST,"Inox Green Energy Services is set to acquire Vibrant Energy, an Indian renewable energy platform. The deal values Vibrant Energy at around $200 million. This acquisition will significantly expand Inox Green's presence in India's growing renewable energy sector. Vibrant Energy manages a substantial renewable portfolio and has a strong client base, including Amazon.",https://economictimes.indiatimes.com/markets/stocks/rssfeeds/2146843.cms
Most valued AMC ICICI Pru pips HDFC MF with 20% pop,https://economictimes.indiatimes.com/markets/stocks/news/most-valued-amc-icici-pru-pips-hdfc-mf-with-20-pop/articleshow/126088526.cms,2025-12-20 10:13:28 IST,ICICI Prudential Asset Management made its stock market debut on Friday. The company's shares listed at a significant premium. This listing propelled ICICI Prudential AMC to become the most valuable asset manager in India. Its market capitalization surpassed that of HDFC AMC. Analysts suggest a medium to long-term view for investors who received allotments.,https://economictimes.indiatimes.com/markets/stocks/rssfeeds/2146843.cms
"Japan's MUFG seals Rs 39,600 crore Shriram Finance Deal",https://economictimes.indiatimes.com/markets/stocks/news/japans-mufg-seals-rs-39600-crore-shriram-finance-deal/articleshow/126088299.cms,2025-12-20 09:48:19 IST,"Japan's MUFG Bank will invest ₹39,620 crore for a 20% stake in Shriram Finance. This is India's biggest foreign investment in financial services. The deal will strengthen Shriram Finance's capital and accelerate its growth. MUFG will appoint two directors to Shriram Finance's board. This partnership aims to leverage global expertise with local strength.",https://economictimes.indiatimes.com/markets/stocks/rssfeeds/2146843.cms
Piramal Finance to exit Shriram Life Insurance Company,https://economictimes.indiatimes.com/markets/stocks/news/piramal-finance-to-exit-shriram-life-insurance-company/articleshow/126088410.cms,2025-12-20 00:29:59 IST,"Piramal Finance is selling its 14.72% stake in Shriram Life Insurance to Sanlam Emerging Markets for ₹600 crore. This move aligns with Piramal's strategy to exit non-core assets and reinvest in its lending business. The transaction is expected to close by March 31, 2026, subject to regulatory approvals.",https://economictimes.indiatimes.com/markets/stocks/rssfeeds/2146843.cms
"Indian Rupee rebounds after hitting country code +91. Will Bank of Japan turn into Santa Claus for INR, stock market",https://www.livemint.com/market/stock-market-news/indian-rupee-rebounds-after-hitting-country-code-91-will-bank-of-japan-turn-into-santa-claus-for-inr-stock-market-11766206463241.html,2025-12-20 10:42:29 IST,"USD vs INR: The Indian Rupee recovered from a record low of 91.07 against the US Dollar, finishing at 89.59 after appreciating by over 1.60% against the record low",https://www.livemint.com/rss/markets
Gold prices surge 73% YTD to record best gains since 1979: Are they ripe for correction next year?,https://www.livemint.com/market/commodities/gold-prices-surge-73-ytd-to-record-best-gains-since-1979-are-they-ripe-for-correction-next-year-11766206617531.html,2025-12-20 10:32:43 IST,"On the MCX, gold has touched a record high of  ₹135,590 per 10 grams. As of Friday's close, it was trading around the  ₹1,34,200 level, as investor interest in bullion sustained. Meanwhile, since October 2023, it has more than doubled, rising 139%.",https://www.livemint.com/rss/markets
"Nvidia stock unusually cheap at Chip Index, says Bernstein — What it means for investors",https://www.livemint.com/market/stock-market-news/nvidia-stock-price-nvdia-share-unusually-cheap-at-chip-index-says-bernstein-what-it-means-for-investors-11766203758942.html,2025-12-20 09:53:05 IST,"Nvidia stock price: Relative to the chip index, Nvidia “currently trades at a ~13% discount, in the first percentile,” wrote analyst Stacy Rasgon.",https://www.livemint.com/rss/markets
TikTok owner ByteDance on track for $50 billion profit in 2025,https://www.livemint.com/companies/news/tiktok-owner-bytedance-50-billion-profit-in-2025-video-sharing-platform-earnings-new-markets-e-commerce-us-business-plan-11766200724466.html,2025-12-20 10:24:10 IST,"ByteDance, parent of video sharing platform TikTok, is on track to earn profit of around $50 billion in 2025. This has been a record year for the Chinese social media leader as it makes major inroads into e-commerce and new markets.",https://www.livemint.com/rss/companies
"Kotak Equities sees Indian stocks faring better in 2026 on 3 factors; adds Dixon, raises IndiGo weight",https://economictimes.indiatimes.com/markets/stocks/news/kotak-equities-sees-indian-stocks-faring-better-in-2026-on-3-factors-adds-dixon-raises-indigo-weight/articleshow/126089032.cms,2025-12-20 11:25:00 IST,"Kotak Equities expects Indian stocks to perform better in 2026, driven by earnings recovery, improved domestic consumption, and a stable macro backdrop. The brokerage added Dixon Technologies and Aadhar Housing Finance to its model portfolio, raised IndiGo weight, and trimmed Torrent, Airtel, and Reliance, highlighting selective positioning amid pockets of expensive valuations.",https://economictimes.indiatimes.com/markets/stocks/rssfeeds/2146843.cms
"Infosys ADRs: Here's what company said on unprecedented 40% spike, trading pause",https://economictimes.indiatimes.com/markets/stocks/news/infosys-adrs-heres-what-company-said-on-unprecedented-40-spike-trading-pause/articleshow/126089161.cms,2025-12-20 11:17:40 IST,"Infosys ADRs surged 40% on the NYSE, hitting a 52-week high of $30 before settling at $20.22, triggering two trading halts. The company clarified that no material events required disclosure. The rally follows Accenture’s strong AI-driven revenue beat, highlighting potential trends for the broader Indian IT sector.",https://economictimes.indiatimes.com/markets/stocks/rssfeeds/2146843.cms
6 multibaggers Vijay Kedia and Mukul Agrawal unearthed in a tough 2025 market,https://economictimes.indiatimes.com/markets/stocks/news/6-multibaggers-vijay-kedia-and-mukul-agrawal-unearthed-in-a-tough-2025-market/slideshow/126089218.cms,2025-12-20 11:15:40 IST,"In a challenging 2025, Vijay Kedia and Mukul Agrawal spotted six multibagger stocks, including OSEL Devices and Zelio E-Mobility, that delivered exceptional returns despite a tough market for smallcaps.",https://economictimes.indiatimes.com/markets/stocks/rssfeeds/2146843.cms
11 IPOs opening next week. GMPs hint at up to 57% listing gains,https://economictimes.indiatimes.com/markets/stocks/news/11-ipos-opening-next-week-gmps-hint-at-up-to-57-listing-gains/slideshow/126089144.cms,2025-12-20 10:59:52 IST,"Next week, 11 IPOs, led by Gujarat Kidney and Shyam Dhani Industries, are set to open, with grey market premiums signalling potential listing gains of up to 57%.",https://economictimes.indiatimes.com/markets/stocks/rssfeeds/2146843.cms
"SBI-owned, FPI's favourite NBFC to be in focus on Monday after this CAPEX update",https://www.livemint.com/market/stock-market-news/sbiowned-fpis-favourite-nbfc-paisalo-digital-to-be-in-focus-on-monday-after-this-capex-update-11766207894809.html,2025-12-20 11:49:01 IST,"Paisalo Digital stock price: From 1,052 touchpoints across 18 states in FY23, Paisalo Digital has increased its customer network to 4,380 touchpoints as of Q2 FY26, the company said in a press release on Friday.",https://www.livemint.com/rss/markets
No need to panic! Chris Wood of Jefferies sees rupee nearing a bottom,https://www.livemint.com/market/stock-market-news/usd-vs-inr-no-need-to-panic-on-indian-rupee-fall-chris-wood-of-jefferies-sees-rupee-nearing-a-bottom-11766129488229.html,2025-12-20 10:50:51 IST,"Jefferies' Chris Wood suggests that the recent decline of the Indian rupee has been overdone and may signal a bottoming out. With strong foreign reserves and contained current account risks, he believes panic is unwarranted despite the currency’s depreciation against the dollar.",https://www.livemint.com/rss/markets
"Gold, silver set to retain shine, PL Capital paints positive outlook for 2026",https://www.livemint.com/market/commodities/gold-silver-set-to-retain-shine-pl-capital-paints-positive-outlook-for-2026-11766208025773.html,2025-12-20 10:50:25 IST,"Gold, that remained one of the strongest performing assets of 2025, is expected to stay ""moderately to strongly positive"" in 2026, financial advisory services firm PL Capital has asserted in a report.",https://www.livemint.com/rss/markets
"Momentum investing: short-term dip, long-term edge",https://economictimes.indiatimes.com/markets/stocks/news/momentum-investing-short-term-dip-long-term-edge/articleshow/126089849.cms,2025-12-20 12:31:42 IST,"Momentum investing may face short-term underperformance, but historical data shows these dips often precede strong long-term gains. Despite recent weakness of around –15%, forward excess returns have historically been robust over 1-, 3-, and 5-year horizons. Discipline and patience remain key for investors seeking long-term trend-driven returns.",https://economictimes.indiatimes.com/markets/stocks/rssfeeds/2146843.cms
Explainer: Why Infosys ADRs jumped 40% and why the NYSE halted trading,https://economictimes.indiatimes.com/markets/stocks/news/explainer-why-infosys-adrs-jumped-40-and-why-the-nyse-halted-trading/articleshow/126089883.cms,2025-12-20 12:26:07 IST,"Infosys ADRs surged 40% on the NYSE, hitting a 52-week high of $30 and triggering two trading halts. Analysts cite a combination of a short squeeze, automated trading glitches, and low holiday liquidity. Infosys clarified there were no material developments behind the sharp spike.",https://economictimes.indiatimes.com/markets/stocks/rssfeeds/2146843.cms
"'Markets in consolidation mode; buy on dips, sell on rallies': Kranti Bathini on current market scenario",https://economictimes.indiatimes.com/markets/stocks/news/markets-in-consolidation-mode-buy-on-dips-sell-on-rallies-kranti-bathini-on-current-market-scenario/articleshow/126089288.cms,2025-12-20 12:09:41 IST,"Kranti Bathini of WealthMills Securities says Indian markets remain in a consolidation phase, with Nifty oscillating between 25,850–26,250. Despite FPI selling and rupee weakness, domestic liquidity supports resilience. Investors are advised to buy on dips and sell on rallies, while sectors like infrastructure, defence, nuclear energy, and semiconductors offer potential opportunities.",https://economictimes.indiatimes.com/markets/stocks/rssfeeds/2146843.cms
Concurrent Losers: 13 small-cap stocks decline for 5 consecutive sessions,https://economictimes.indiatimes.com/markets/stocks/news/concurrent-losers-13-small-cap-stocks-decline-for-5-consecutive-sessions/slideshow/126089616.cms,2025-12-20 11:30:38 IST,"Thirteen small-cap stocks, including Kothari Industrial and Wardwizard Innovations, recorded losses for five consecutive sessions, with declines ranging from 5% to 23% amid broader market weakness.",https://economictimes.indiatimes.com/markets/stocks/rssfeeds/2146843.cms
Reliance shares jump 28% year-to-date; is it time to book profits or buy more?,https://www.livemint.com/market/stock-market-news/reliance-shares-jump-28-year-to-date-is-it-time-to-book-profits-or-buy-more-11766208307043.html,2025-12-20 12:08:38 IST,"Reliance shares have surged 28% year-to-date, outperforming the Sensex. Analysts highlight the company's strong fundamentals, including robust earnings growth and strategic investments in digital and retail sectors.&amp;nbsp;",https://www.livemint.com/rss/markets
