title,link,published,summary,source
Will Trent shares rebound after Q1 update triggers 13% crash? Here's what technical charts indicate,https://economictimes.indiatimes.com/markets/stocks/news/will-trent-shares-rebound-after-q1-update-triggers-13-crash-heres-what-technical-charts-indicate/articleshow/132251756.cms,2026-07-08 07:42:32 IST,"After the 13% crash, Trent shares have technically slipped below their 20-day EMA, while the RSI has witnessed a sharp downtick, signalling a shift in momentum from bullish to bearish, said Sudeep Shah, Head of Technical and Derivatives Research at SBI Securities",https://economictimes.indiatimes.com/markets/stocks/rssfeeds/2146843.cms
Titan dividend alert! Last day to buy shares for Rs 15 dividend payout. Do you own?,https://economictimes.indiatimes.com/markets/stocks/news/titan-dividend-alert-last-day-to-buy-shares-for-rs-15-dividend-payout-do-you-own/articleshow/132251710.cms,2026-07-08 07:38:24 IST,"Only those shareholders who own Titan shares in their demat accounts as of Thursday will be eligible to receive the bonus shares. Under the market regulator SEBI's T+1 settlement cycle, investors must buy shares of a company at least one trading day before the record date so that they are credited to their demat accounts by that day, making them eligible for the dividend.",https://economictimes.indiatimes.com/markets/stocks/rssfeeds/2146843.cms
Negative Breakout: These 11 stocks cross below their 200 DMAs,https://economictimes.indiatimes.com/markets/stocks/news/negative-breakout-these-11-stocks-cross-below-their-200-dmas/slideshow/132251656.cms,2026-07-08 07:30:12 IST,The 200 DMA is used as a key indicator by traders for determining the overall trend in a particular stock.,https://economictimes.indiatimes.com/markets/stocks/rssfeeds/2146843.cms
Knack Packaging IPO shares to debut today. Here's what GMP suggests ahead of listing,https://economictimes.indiatimes.com/markets/stocks/news/knack-packaging-ipo-shares-to-debut-today-heres-what-gmp-suggests-ahead-of-listing/articleshow/132251545.cms,2026-07-08 07:25:21 IST,"Ahead of the listing, the grey market is indicating a positive debut. The IPO is currently commanding a Grey Market Premium (GMP) of around Rs 16 per share, suggesting an estimated listing price of Rs 186, about 10% higher than the upper end of the IPO price band of Rs 170.",https://economictimes.indiatimes.com/markets/stocks/rssfeeds/2146843.cms
D-Street set for a negative opening as GIFT Nifty trades lower,https://economictimes.indiatimes.com/markets/stocks/news/pre-market-action-heres-the-trade-setup-for-todays-session/articleshow/132251336.cms,2026-07-08 06:54:29 IST,"Domestic markets ended lower after a four-session winning streak on Tuesday. Profit booking and weakness in Realty and Metals stocks impacted market sentiment. Foreign portfolio investors bought shares, while domestic institutional investors sold them. The Indian rupee saw its biggest single-session gain in three weeks. Investor focus remains on business updates and trade agreement progress.",https://economictimes.indiatimes.com/markets/stocks/rssfeeds/2146843.cms
General insurers clock 16.7% premium growth,https://economictimes.indiatimes.com/markets/stocks/news/general-insurers-clock-16-7-premium-growth/articleshow/132251184.cms,2026-07-08 06:21:38 IST,The general insurance sector saw a 16.7% premium income rise in June.  Standalone health insurers led this growth with a 31% increase.  First quarter collections for FY27 also climbed by 11.1%.  Niva Bupa Health Insurance showed strong premium growth of 34% in June.  ICICI Lombard General Insurance reported a 13.7% premium increase for the month.,https://economictimes.indiatimes.com/markets/stocks/rssfeeds/2146843.cms
Depositories get to spend 5% of IPF interest income,https://economictimes.indiatimes.com/markets/stocks/news/depositories-get-to-spend-5-of-ipf-interest-income/articleshow/132251130.cms,2026-07-08 06:11:53 IST,Sebi has revised rules for depositories' Investor Protection Fund income.  Depositories can now use five percent of annual income for expenses.  The remaining ninety-five percent must be reinvested back into the fund.  This change allows for administrative costs like salaries and audit fees.  Any unutilized funds from the five percent must be returned to the fund.,https://economictimes.indiatimes.com/markets/stocks/rssfeeds/2146843.cms
Malabar Group companies' merger gets CCI nod,https://economictimes.indiatimes.com/markets/stocks/news/malabar-group-companies-merger-gets-cci-nod/articleshow/132251102.cms,2026-07-08 06:02:49 IST,"The Competition Commission of India approved the merger of fifty-one Malabar Group companies. These companies are primarily engaged in the jewellery business sector. Separately, the regulator dismissed a case against Nissan Motor India. The complainant had accused Nissan of anti-competitive dealership agreement termination practices. The CCI found no violation of competition rules in the Nissan case.",https://economictimes.indiatimes.com/markets/stocks/rssfeeds/2146843.cms
"Stocks in news: Adani Enterprises, Cochin Shipyard, IDFC First Bank, Premier Energies, Glenmark Pharma",https://economictimes.indiatimes.com/markets/stocks/news/stocks-in-news-adani-enterprises-cochin-shipyard-idfc-first-bank-premier-energies-glenmark-pharma/articleshow/132243333.cms,2026-07-08 06:00:00 IST,"Markets traded subdued on the weekly expiry day, with indices ending marginally lower. Cochin Shipyard's offer for sale saw strong investor demand on its first day. Adani Enterprises' US legal case faces a likely dismissal by federal prosecutors. IDFC First Bank launched provident fund payment services through its EPFO integration. Premier Energies secured significant orders, and Glenmark Pharma launched a generic drug in the US.",https://economictimes.indiatimes.com/markets/stocks/rssfeeds/2146843.cms
Trent slides 12% as Q1 growth fails to impress,https://economictimes.indiatimes.com/markets/stocks/news/trent-slides-12-as-q1-growth-fails-to-impress/articleshow/132251087.cms,2026-07-08 05:49:55 IST,Trent shares experienced a significant single-day decline on Tuesday.  This drop followed first-quarter financial results that did not meet market expectations.  Revenue growth was largely driven by recently opened stores in smaller towns.  These new locations show lower revenue per square foot compared to metros.  Analysts remain optimistic about Trent's long-term growth prospects.,https://economictimes.indiatimes.com/markets/stocks/rssfeeds/2146843.cms
Cochin Shipyard OFS gets 3.5x bids; govt exercises greenshoe,https://economictimes.indiatimes.com/markets/stocks/news/cochin-shipyard-ofs-gets-3-5x-bids-govt-exercises-greenshoe/articleshow/132251082.cms,2026-07-08 05:47:03 IST,"Cochin Shipyard's Offer for Sale saw strong demand from non-retail investors.  The issue was subscribed 3.52 times on the first day of bidding.  This robust interest prompted the government to utilize the entire greenshoe option.  The Offer for Sale will now open for retail investors and employees.  The floor price for this share offering was set at ₹1,400.",https://economictimes.indiatimes.com/markets/stocks/rssfeeds/2146843.cms
Cost of free alerts: RBI’s SMS order may dent banks’ income by Rs 300 crore,https://economictimes.indiatimes.com/markets/stocks/news/cost-of-free-alerts-rbis-sms-order-may-dent-banks-income-by-rs-300-crore/articleshow/132250998.cms,2026-07-08 01:07:55 IST,"Banks have also been given the flexibility of dropping mandatory alerts for lowvalue transactions. However, top-draw private banks, such as HDFC Bank or ICICI Bank, are unlikely to reduce SMS alerts for such transactions to ensure their reputation for technology adoption and customer experience isn’t compromised.",https://economictimes.indiatimes.com/markets/stocks/rssfeeds/2146843.cms
Irdai asks state-run insurers to account for wage costs annually,https://economictimes.indiatimes.com/markets/stocks/news/irdai-asks-state-run-insurers-to-account-for-wage-costs-annually/articleshow/132251093.cms,2026-07-08 00:44:47 IST,"Irdai has implemented a new requirement for state insurers to create annual provisions for wage increases, intending to soften the financial repercussions of periodic wage negotiations. Insurers are now obliged to evaluate the sufficiency of these provisions quarterly after obligations become clear. The government has ruled out options for additional capital, instead banking on solvency improvements from IFRS 17 and stakes in the NSE.",https://economictimes.indiatimes.com/markets/stocks/rssfeeds/2146843.cms
ARC consolidation: Govt weighs ASREC merger with NARCL,https://economictimes.indiatimes.com/markets/stocks/news/arc-consolidation-govt-weighs-asrec-merger-with-narcl/articleshow/132251090.cms,2026-07-08 00:39:14 IST,"The government is considering a merger of ASREC Asset Reconstruction Company with NARCL to enhance the functionality of state-sponsored bad-loan resolution efforts. This proposal, still in preliminary discussions, underscores a strategic effort for consolidation rather than growth. ASREC ARC is majorly held by public sector lenders and LIC, aiming for better management and scrutiny of bad loans.",https://economictimes.indiatimes.com/markets/stocks/rssfeeds/2146843.cms
RBI approves re-appointment of NS Vishwanathan as Axis Bank's non-executive chairman,https://economictimes.indiatimes.com/markets/stocks/news/rbi-approves-re-appointment-of-ns-vishwanathan-as-axis-banks-non-executive-chairman/articleshow/132251098.cms,2026-07-07 22:21:40 IST,"The Reserve Bank of India has approved NS Vishwanathan's reappointment as Axis Bank's non-executive chairman. His new three-year term will commence from October 27, 2026, and conclude on October 26, 2029. This extension is contingent upon his reappointment as an independent director for the bank. Vishwanathan, a former deputy governor, has been serving as part-time chairman since October 2023.",https://economictimes.indiatimes.com/markets/stocks/rssfeeds/2146843.cms
"NBFC credit grows 14% in May, led by retail and farm loans",https://economictimes.indiatimes.com/markets/stocks/news/nbfc-credit-driven-by-retail-loans-rbi-data-shows/articleshow/132251115.cms,2026-07-07 19:39:44 IST,"Loans against gold jewellery remained the fastest-growing segment, surging 70% year-on-year to ₹3.29 lakh crore in May, compared with 39% growth a year earlier.",https://economictimes.indiatimes.com/markets/stocks/rssfeeds/2146843.cms
Vaishali Parekh recommends three intraday stocks to buy or sell on Wednesday — 8 July 2026,https://www.livemint.com/market/stock-market-news/vaishali-parekh-recommends-three-intraday-stocks-to-buy-or-sell-on-wednesday-8-july-2026-11783477257483.html,2026-07-08 08:09:33 IST,"Buy or sell stocks, 8 July 2026: Vaishali Parekh recommends three stocks to buy today — Sagility, Marico, and Rashtriya Chemicals and Fertilizers.",https://www.livemint.com/rss/markets
"Stock market today: Gift Nifty hints weak start; eight day trading stocks to buy on Wednesday, 8 July",https://www.livemint.com/market/stock-market-news/stock-market-today-gift-nifty-hints-weak-start-eight-day-trading-stocks-to-buy-on-wednesday-8-july-11783475119935.html,2026-07-08 08:05:15 IST,"Indian equity indices, Sensex and Nifty 50, are expected to open lower as tensions between the US and Iran affect global markets. Crude oil prices rise while gold declines. Analysts predict cautious trading in Indian markets amid geopolitical concerns and potential profit booking.",https://www.livemint.com/rss/markets
"Stocks to watch: Cochin Shipyard, Premier Energies, ideaForge Tech among shares in focus today; check list here",https://www.livemint.com/market/stock-market-news/stocks-to-watch-cochin-shipyard-premier-energies-ideaforge-tech-among-shares-in-focus-today-check-list-here-11783475189066.html,2026-07-08 07:43:42 IST,"Stock market today: Gift Nifty was trading near the 24,235 mark, down over 205 points from the previous close of Nifty futures.",https://www.livemint.com/rss/markets
"Nifty 50, Sensex prediction today: Check how Indian stock market is expected to trade on 8 July",https://www.livemint.com/market/stock-market-news/nifty-50-sensex-prediction-today-check-how-indian-stock-market-is-expected-to-trade-on-8-july-11783474819908.html,2026-07-08 07:29:03 IST,"Nifty 50, Sensex prediction today: The trends on Gift Nifty also indicate a gap-down start for the Indian benchmark index. The Gift Nifty was trading around 24,225 level, a discount of nearly 215 points from the Nifty futures’ previous close.",https://www.livemint.com/rss/markets
Crude oil prices jump 2% on escalating US-Iran war; Brent crude above $75 per barrel,https://www.livemint.com/market/commodities/crude-oil-prices-jump-2-on-escalating-us-iran-war-brent-crude-above-75-per-barrel-11783474283318.html,2026-07-08 07:14:57 IST,"US-Iran war: Brent crude, the global benchmark, for September delivery gained 1.9% to $75.53 per barrel.",https://www.livemint.com/rss/markets
"From Gift Nifty, US-Iran war to crude oil prices: 7 key things that changed for Indian stock market overnight",https://www.livemint.com/market/stock-market-news/from-gift-nifty-us-iran-war-to-crude-oil-prices-7-key-things-that-changed-for-indian-stock-market-overnight-11783474170251.html,2026-07-08 07:05:14 IST,"Gift Nifty was trading around 24,235 level, a discount of nearly 205 points from the Nifty futures’ previous close, indicating a negative start for the Indian stock market indices.",https://www.livemint.com/rss/markets
"Asian stocks today: Nikkei, Kospi fall amid selloff in tech stocks, escalating US-Iran war",https://www.livemint.com/market/stock-market-news/asian-stocks-today-nikkei-kospi-fall-amid-selloff-in-tech-stocks-escalating-us-iran-war-11783472860402.html,2026-07-08 06:59:17 IST,"Asian stocks today: Japan’s benchmark Nikkei 225 slipped 0.55%, while the broader Topix index declined 0.7%. South Korea’s Kospi lost 0.72%, with the small-cap Kosdaq falling a sharper 1.94%.",https://www.livemint.com/rss/markets
Breakout stocks to buy or sell: Sumeet Bagadia recommends five shares to buy today - 8 July 2026,https://www.livemint.com/market/stock-market-news/breakout-stocks-to-buy-or-sell-sumeet-bagadia-recommends-five-shares-to-buy-today-8-july-2026-11783471647726.html,2026-07-08 06:36:35 IST,The Indian stock market ended Tuesday's session on a lower note. Sumeet Bagadia of Choice Broking recommends five breakout stocks to buy today.,https://www.livemint.com/rss/markets
"Knack Packaging IPO listing date today. GMP, experts signal share debut at a decent premium in Indian stock market",https://www.livemint.com/market/ipo/knack-packaging-ipo-listing-date-today-gmp-experts-signal-share-debut-at-a-decent-premium-in-indian-stock-market-11783441678141.html,2026-07-08 06:14:59 IST,"Knack Packaging IPO listing date is today, 8 July 2026, and the equity shares will be listed on both the stock exchanges, BSE and NSE. Ahead of the share debut, Knack Packaging IPO GMP today and experts indicated shares to list at a muted premium.",https://www.livemint.com/rss/markets
Amfi reshuffle signals market leadership shift as BSE enters large-cap club,https://www.livemint.com/market/stock-market-news/amfi-large-cap-reshuffle-2026-bse-market-leadership-shift-11783410124539.html,2026-07-08 06:01:03 IST,"Capital markets, power equipment and telecom infrastructure companies have gained ground in the latest market-cap classification, while several pharma, healthcare and auto names slipped to the mid-cap category.",https://www.livemint.com/rss/markets
Raja Venkatraman recommends three stocks for 8 July,https://www.livemint.com/market/stock-market-news/raja-venkatraman-recommends-three-stocks-for-8-july-11783438670505.html,2026-07-08 06:00:43 IST,Market expert Raja Venkatraman shares his top stock picks for 8 July. Here’s his technical outlook and trade strategy.,https://www.livemint.com/rss/markets
Stock recommendations for 8 July from MarketSmith India,https://www.livemint.com/market/stock-market-news/stock-recommendations-8-july-marketsmith-india-equitas-small-finance-bank-titan-company-nifty-sensex-11783436027626.html,2026-07-08 06:00:43 IST,"MarketSmith India reveals its top stock recommendations for today, 8 July. Get expert insights into the best-performing stocks to guide your investment decisions.",https://www.livemint.com/rss/markets
Promoter caution makes investment banks work longer and harder for IPO wins,https://www.livemint.com/market/ipo/promoter-caution-makes-investment-banks-work-longer-and-harder-for-ipo-wins-11783411865393.html,2026-07-08 05:50:43 IST,"Winning an IPO mandate is becoming a longer process for investment banks. Cautious promoters are extending IPO preparations, doing deeper due diligence and taking more time to choose advisers, reflecting a shift in how companies approach public market listings.",https://www.livemint.com/rss/markets
"Google will set up more AI data centres in India as demand grows, says cloud business CEO Thomas Kurian",https://www.livemint.com/companies/news/google-will-set-up-more-ai-data-centres-in-india-as-demand-grows-says-cloud-business-ceo-thomas-kurian-11783422758078.html,2026-07-08 06:00:23 IST,"A multi-year capital expansion plan will follow the $15-billion investment in Andhra Pradesh announced last October, Thomas Kurian, chief executive of Google Cloud, told Mint.",https://www.livemint.com/rss/companies
Kedaara may lead race to acquire stake in Olive PharmaScience,https://www.livemint.com/companies/news/kedaara-capital-olive-pharmascience-minority-stake-crdmo-11783410467996.html,2026-07-08 06:00:23 IST,"The deal may value Olive PharmaScience at around  ₹4,500 crore.",https://www.livemint.com/rss/companies
"Rapido has more users than Uber and Ola. And Swiggy, Zomato, Zepto, Blinkit",https://www.livemint.com/companies/rapido-has-more-users-than-uber-and-ola-swiggy-zomato-zepto-blinkit-11783344546641.html,2026-07-08 06:00:23 IST,"Rapido averaged 82 million monthly active users between March and May, up 67% year-on-year. That put it ahead of Uber (39 million), Ola (27 million), Blinkit (79 million), Swiggy (67 million) and Zomato (63 million).",https://www.livemint.com/rss/companies
"New GIC Re chief banks on AI, resilience for next growth phase",https://www.livemint.com/companies/news/new-gic-re-chief-banks-on-ai-resilience-for-next-growth-phase-11783403933784.html,2026-07-08 06:00:23 IST,"The state-owned reinsurer is building 'Ragini', a private AI assistant, to capture underwriting expertise before it walks out the door. New chairman and managing director Hitesh Joshi talks to Mint about AI, portfolio rebalancing and the push for an 'A' rating.",https://www.livemint.com/rss/companies
"After nearly a decade of decline, DXC lays out a turnaround plan",https://www.livemint.com/companies/after-nearly-a-decade-of-decline-dxc-lays-out-a-turnaround-plan-11783428889619.html,2026-07-08 05:55:43 IST,DXC’s management on Tuesday outlined a turnaround strategy at a media briefing held alongside the inauguration of a new office in Bengaluru.,https://www.livemint.com/rss/companies
"8th Pay Commission: Can salaries rise by over 60%? Here's how HRA, TA &amp; DA proposals may boost pay for level 1 payments",https://www.livemint.com/money/personal-finance/8th-pay-commission-can-salaries-rise-by-over-60-heres-how-hra-ta-da-proposals-may-boost-pay-for-level-1-payme-11783475097390.html,2026-07-08 07:54:16 IST,"The 8th Pay Commission could significantly increase central government salaries if proposals on fitment factor, HRA, TA and DA merger are accepted. While estimates suggest a 60% rise in some cases, the government is yet to take a final decision.",https://www.livemint.com/rss/money
Swiggy's foreign shareholding falls below 50%: What it means for investors,https://economictimes.indiatimes.com/markets/stocks/news/swiggys-foreign-shareholding-falls-below-50-what-it-means-for-investors/articleshow/132254527.cms,2026-07-08 10:55:36 IST,"Swiggy's foreign shareholding now stands below fifty percent, meeting a key regulatory requirement. This change allows the company to pursue Indian-Owned-and-Controlled Company status under FEMA rules. However, full qualification is not expected until March 2027, after governance changes. Reducing foreign ownership further may impact index weightage for Swiggy. JM Financial maintains a 'Reduce' rating with an unchanged target price.",https://economictimes.indiatimes.com/markets/stocks/rssfeeds/2146843.cms
Smallcap aerospace stock jumps 17% after earning two bullish brokerage calls,https://economictimes.indiatimes.com/markets/stocks/news/smallcap-aerospace-stock-jumps-17-after-earning-two-bullish-brokerage-calls/articleshow/132254494.cms,2026-07-08 10:51:49 IST,"Aequs shares surged significantly on Wednesday, driven by positive brokerage reports.  Analysts issued bullish calls, projecting substantial upside potential for the stock.  The company is India's sole vertically integrated precision aerospace manufacturer.",https://economictimes.indiatimes.com/markets/stocks/rssfeeds/2146843.cms
"RCF shares jump 3% after board approves Rs 1,500 crore FPO",https://economictimes.indiatimes.com/markets/stocks/news/rcf-shares-jump-3-after-board-approves-rs-1500-crore-fpo/articleshow/132254062.cms,2026-07-08 10:28:40 IST,"RCF shares witnessed an uptick on Wednesday after the state-owned fertiliser maker's board approved raising up to Rs 1,500 crore through a further public offering (FPO). The proposal, aimed at issuing fresh equity shares, is subject to approvals from shareholders, the Department of Fertilizers, the Government of India and DIPAM.",https://economictimes.indiatimes.com/markets/stocks/rssfeeds/2146843.cms
PC Jeweller jumps 6% after repaying 2 consortium banks; eyes debt-free status by Q2 FY27,https://economictimes.indiatimes.com/markets/stocks/news/pc-jeweller-jumps-6-after-repaying-2-consortium-banks-eyes-debt-free-status-by-q2-fy27/articleshow/132254038.cms,2026-07-08 10:24:42 IST,"PC Jeweller shares climbed 6.5% after the company said it had repaid all outstanding debt owed to two of its 14 consortium banks under a September 2024 settlement agreement. Calling it a key milestone in its turnaround, the jeweller said it expects to clear the remaining debt and achieve debt-free status during the current quarter, strengthening its financial position.",https://economictimes.indiatimes.com/markets/stocks/rssfeeds/2146843.cms
"Info Edge shares rally 19% in 2 days after Q1 update. Here’s what Nomura, Goldman Sachs, other brokerages say",https://economictimes.indiatimes.com/markets/stocks/news/info-edge-shares-rally-19-in-2-days-after-q1-update-heres-what-nomura-goldman-sachs-other-brokerages-say/articleshow/132253998.cms,2026-07-08 10:22:08 IST,Info Edge shares surged significantly after releasing its Q1 FY27 business update. The company reported a 14%  increase in standalone billings for the quarter.  Brokerages like Nomura and Goldman Sachs issued bullish calls and raised target prices. Naukri and 99acres showed strong billings growth during this period. This positive performance led to a substantial rise in Info Edge's market capitalization.,https://economictimes.indiatimes.com/markets/stocks/rssfeeds/2146843.cms
Airtel to Trent: 44 stocks likely to report double-digit profit slump in Q1. Are your stocks on the list?,https://economictimes.indiatimes.com/markets/stocks/news/airtel-to-trent-44-stocks-likely-to-report-double-digit-profit-slump-in-q1-are-your-stocks-on-the-list/articleshow/132253779.cms,2026-07-08 10:03:56 IST,"Motilal Oswal expects 44 companies, including Bharti Airtel, Trent, IndiGo, HAL, GAIL and Cipla, to report double-digit year-on-year profit declines in the June quarter. Higher energy costs, weaker demand, geopolitical tensions and margin pressure are expected to weigh on earnings, even as overall corporate profit growth slows in Q1.",https://economictimes.indiatimes.com/markets/stocks/rssfeeds/2146843.cms
"Eternal, ICICI Bank &amp; 8 stocks with up to 27% upside. Do you own them?",https://economictimes.indiatimes.com/markets/stocks/news/eternal-icici-bank-amp-8-stocks-with-up-to-27-upside-do-you-own-them/slideshow/132253652.cms,2026-07-08 09:51:21 IST,"Revenue growth is expected to remain healthy across segments, with large-, mid-, and small-cap companies likely to report sales growth of 17%, 15%, and 16% YoY, respectively.",https://economictimes.indiatimes.com/markets/stocks/rssfeeds/2146843.cms
"IndiGo, HPCL, other oil sensitive stocks plunge up to 5% as US strikes on Iran lift crude prices",https://economictimes.indiatimes.com/markets/stocks/news/indigo-hpcl-other-oil-sensitive-stocks-plunge-up-to-5-as-us-strikes-on-iran-lifts-crude-prices/articleshow/132253542.cms,2026-07-08 09:47:51 IST,"Oil-sensitive Indian stocks tumbled significantly after US airstrikes on Iran.  Crude oil prices climbed as sanctions on Iranian sales were reinstated.  These events reignited concerns over Middle East stability and potential supply disruptions.  Shipping through the Strait of Hormuz remains vulnerable, impacting global energy supply routes.  Analysts expect oil inventories to stay under pressure until Gulf supplies resume.",https://economictimes.indiatimes.com/markets/stocks/rssfeeds/2146843.cms
