title,link,published,summary,source
"Can Nifty 50 touch 25,000 this month? Analysts see bank, auto, IT stocks driving the next leg up",https://www.livemint.com/market/stock-market-news/can-nifty-50-touch-25-000-this-month-analysts-see-bank-auto-it-stocks-driving-the-next-leg-up-11783495380333.html,2026-07-08 13:08:31 IST,"Nifty 50 has gained nearly 2% so far in July and had climbed above the 24,500 mark in the previous session — its highest level since April. With the index approaching key resistance levels, investors closely watch whether Nifty 50 can scale the psychologically significant 25,000 mark this month.",https://www.livemint.com/rss/markets
"TCS Q1 Results on July 9: AI Strategy, Dividend, Margins — Key things to watch from IT major's earnings",https://www.livemint.com/market/stock-market-news/tcs-q1-results-on-july-9-ai-strategy-dividend-margins-key-things-to-watch-from-it-majors-earnings-11783494698992.html,2026-07-08 13:03:16 IST,"As TCS kicks off FY27 earnings on July 9, attention will focus on its quarterly numbers and outlook amid a changing IT landscape. Investors will assess AI strategies, deal wins, and the impact of external factors on client spending and hiring practices as industry dynamics evolve.",https://www.livemint.com/rss/markets
"Auto sector Q1 results preview: Margin pressure looms despite strong demand; Hyundai, Tata Motors PV among top picks",https://www.livemint.com/market/auto-sector-q1-results-preview-margin-pressure-looms-despite-strong-demand-hyundai-tata-motors-pv-among-top-picks-11783491745871.html,2026-07-08 12:13:03 IST,"The automobile sector is projected to see strong revenue growth in Q1FY27, fueled by high demand across various vehicle categories. However, profitability may be constrained by rising commodity costs due to the West Asia conflict, impacting margins despite expected revenue increases.",https://www.livemint.com/rss/markets
"Knack Packaging share price extends gains after strong listing; should you buy, sell or hold?",https://www.livemint.com/market/stock-market-news/knack-packaging-share-price-extends-gains-after-strong-listing-should-you-buy-sell-or-hold-11783492299227.html,2026-07-08 12:08:44 IST,"Knack Packaging shares were listed at  ₹188 apiece on NSE, a premium of 10.58% to the issue price of  ₹170 per share. On BSE, Knack Packaging shares were listed with a 9.41% premium at  ₹186 apiece.",https://www.livemint.com/rss/markets
"Laser Power &amp; Infra IPO: GMP, price band to financials—10 things investors should know before subscribing",https://www.livemint.com/market/ipo/laser-power-infra-ipo-gmp-price-band-to-financials-10-things-investors-should-know-before-subscribing-11783490838948.html,2026-07-08 11:50:59 IST,"Laser Power &amp;amp; Infra's IPO opens July 9, 2026, aiming to raise  ₹742 crore. The price band is set at  ₹203-214 per share, with a minimum investment of  ₹14,980. Recent financial growth includes 39.84% revenue CAGR, and positive grey market premium indicates strong investor interest.",https://www.livemint.com/rss/markets
Small-cap AI stock trades green despite weak trends on Dalal Street,https://www.livemint.com/market/stock-market-news/smallcap-ai-stock-blue-cloud-softech-solutions-trades-green-despite-weak-trends-on-dalal-street-11783488775366.html,2026-07-08 11:50:55 IST,"Small-cap AI stock Blue Cloud Softech Solutions opened at  ₹21.70 per share, as compared to previous close of  ₹21.55 on Tuesday.",https://www.livemint.com/rss/markets
"Nuvama-Cushman's maiden fund raises  ₹4000 cr, readies for second fund",https://www.livemint.com/companies/nuvamacushmans-maiden-fund-raises-4000-cr-readies-for-second-fund-11783454045150.html,2026-07-08 12:38:07 IST,"Nuvama and Cushman &amp;amp; Wakefield's joint venture NCW has closed its maiden  ₹4,000 crore office-focused real estate fund, 33% above its original target, on strong domestic investor demand.&amp;nbsp;",https://www.livemint.com/rss/companies
"Foreign assets, bank account or overseas income? Why resident taxpayers must file ITR-2 before the 31 July deadline",https://www.livemint.com/money/personal-finance/foreign-assets-bank-account-or-overseas-income-why-resident-taxpayers-must-file-itr-2-before-the-31-july-deadline-11783495491177.html,2026-07-08 13:39:56 IST,"Residents with foreign assets or overseas income must file ITR-2 instead of ITR-1 before 31 July. Check who needs to file, mandatory disclosure schedules, penalties for non-compliance and steps to ensure accurate tax filing and avoid legal issues.",https://www.livemint.com/rss/money
Ethanol mutual funds: Experts suggest how investors can explore this new theme and key risks to watch,https://www.livemint.com/money/personal-finance/ethanol-mutual-funds-experts-suggest-how-investors-can-explore-this-new-theme-and-key-risks-to-watch-11783420065951.html,2026-07-08 12:59:07 IST,"Experts say there are no pure-play ethanol mutual funds, but investors can gain exposure through select index, thematic and sectoral funds. Given the cyclical, regulatory and adoption risks, they suggest diversified funds rather than concentrated stock bets.",https://www.livemint.com/rss/money
₹60 lakh salary: Here is how to calculate final tax liability after surcharge under new tax regime,https://www.livemint.com/money/personal-finance/60-lakh-salary-here-is-how-to-calculate-final-tax-liability-after-surcharge-under-new-tax-regime-11783486707366.html,2026-07-08 12:13:20 IST,"A  ₹60 lakh salary attracts a surcharge of 10% under the new tax regime in addition to slab-wise income tax and 4% health and education cess. In this case, the final tax liability comes to  ₹15.53 lakh, resulting in an effective tax rate of 25.88%.",https://www.livemint.com/rss/money
Moved back to India? This buffer can help you with tax planning,https://www.livemint.com/money/personal-finance/rnor-india-nri-tax-planning-income-tax-rnor-window-foreign-assets-income-11783434096063.html,2026-07-08 11:59:20 IST,"During the RNOR window, your Indian income is taxed exactly as it would be for any resident. Any income earned in India is taxable and must be declared in the ITR",https://www.livemint.com/rss/money
EPS pension 2026: How much monthly pension can you get after 10 years of service?,https://www.livemint.com/money/personal-finance/eps-pension-2026-how-much-monthly-pension-can-you-get-after-10-years-of-service-11783488162463.html,2026-07-08 11:40:14 IST,"The EPS Pension 2026 replaces previous schemes and retains the core pension formula. Employees who need a monthly pension must have 10 years of service and retire at 58. The estimated monthly pension after 10 years is  ₹2,143, with a minimum pension floor of  ₹1,000.",https://www.livemint.com/rss/money
Torrent Pharma among 6 stocks to hit 52-week highs &amp; rally up to 25% in a month,https://economictimes.indiatimes.com/markets/stocks/news/torrent-pharma-among-6-stocks-to-hit-52-week-highs-amp-rally-up-to-25-in-a-month/slideshow/132261198.cms,2026-07-08 16:17:41 IST,"Despite a sharp sell-off in the broader market, six BSE 200 stocks touched fresh 52-week highs, highlighting resilient investor confidence. The outperformers from retail, pharmaceuticals and energy sectors continued to show strong momentum, signalling sustained buying interest despite market volatility.",https://economictimes.indiatimes.com/markets/stocks/rssfeeds/2146843.cms
"Sensex sinks 1,680 points; Nifty closes below 23,900. 5 key factors behind today’s market mayhem",https://economictimes.indiatimes.com/markets/stocks/news/why-is-market-falling-today-sensex-crashes-1300-points-nifty-slips-below-24k-key-factors-behind-this-meltdown/articleshow/132258210.cms,2026-07-08 14:06:44 IST,Sensex Nifty Crash: Indian stock markets experienced a significant downturn on Wednesday afternoon. Rising crude oil prices and geopolitical tensions battered investor sentiment across exchanges. US President Donald Trump's remarks on Iran further fueled fears of escalation in the Middle East. This led to a sharp decline in the Sensex and Nifty indices. Broader markets and sectoral indices also traded deep in the red.,https://economictimes.indiatimes.com/markets/stocks/rssfeeds/2146843.cms
India's mutual fund industry just beat FIIs in a historic first. Here's what changed,https://economictimes.indiatimes.com/markets/stocks/news/indias-mutual-fund-industry-just-beat-fiis-in-a-historic-first-heres-what-changed/articleshow/132258084.cms,2026-07-08 13:53:59 IST,"India's mutual fund industry has overtaken foreign institutional investors in total assets under custody for the first time, marking a historic shift in market ownership. Strong SIP inflows and sustained domestic participation have driven the milestone, even as FII holdings declined amid continued selling and changing global investment trends.",https://economictimes.indiatimes.com/markets/stocks/rssfeeds/2146843.cms
"Top Gainers &amp; Losers on 8 July: Aegis Logistics, HPCL, Bank of India, IndiGo, Coforge, MRF among top losers",https://www.livemint.com/market/stock-market-news/top-gainers-losers-on-8-july-aegis-logistics-hpcl-bank-of-india-indigo-coforge-mrf-among-top-losers-11783504908341.html,2026-07-08 16:28:34 IST,"The Indian stock market faced heavy selling on Wednesday, with benchmark indices falling over 2% amid renewed U.S.-Iran tensions. The Nifty 50 dropped to 23,882, marking its biggest decline since March, and nearly all sectoral indices ended in the red, particularly the Nifty PSU Bank index.",https://www.livemint.com/rss/markets
Oberoi Realty’s NCR debut spurs growth visibility with solid bookings,https://www.livemint.com/market/mark-to-market/oberoi-realty-s-ncr-debut-spurs-growth-visibility-with-solid-bookings-11783498534621.html,2026-07-08 14:55:53 IST,"Oberoi Realty's debut NCR launch, Three Sixty North, booked  ₹8,109 crore—more than the company's entire FY26 sales. Brokerages have raised price targets and growth estimates, though a heavy MMR-focused pipeline and demand risks remain.",https://www.livemint.com/rss/markets
"BPCL, HPCL to IOC: OMC stocks fall up to 5.5% on sharp rebound in crude oil prices",https://www.livemint.com/market/stock-market-news/bpcl-hpcl-to-ioc-omc-stocks-fall-up-to-5-5-on-sharp-rebound-in-crude-oil-prices-11783501548775.html,2026-07-08 14:48:29 IST,"State-owned oil marketing companies HPCL, BPCL, and IOC saw their shares drop as crude oil prices surged due to Middle East tensions. Investors booked profits after price declines, with HPCL down 5.4%, BPCL 4.7%, and IOC 3.5%. Existing conditions may pressure OMCs' profit margins.",https://www.livemint.com/rss/markets
Oil prices jump to more than $78 a barrel as Trump says ceasefire with Iran is 'over',https://www.livemint.com/market/commodities/oil-prices-jump-to-more-than-78-a-barrel-as-trump-says-ceasefire-with-iran-is-over-11783501314990.html,2026-07-08 14:37:25 IST,Oil prices rose nearly 6% after US President Trump declared the interim agreement with Iran is over. Details here.,https://www.livemint.com/rss/markets
"Defence sector Q1 results preview: Muted earnings likely on execution delays; BEL, Bharat Dynamics, GRSE among top picks",https://www.livemint.com/market/stock-market-news/defence-sector-q1-results-preview-muted-earnings-likely-on-execution-delays-bel-bharat-dynamics-grse-among-top-picks-11783500690463.html,2026-07-08 14:31:49 IST,"Defence sector Q1 results preview: While reported earnings of defence sector may remain subdued, underlying execution momentum is gradually building, with clearer visibility on recovery expected as conversion accelerates through the year, particularly into H2FY27, analysts said.",https://www.livemint.com/rss/markets
Paint makers poised for a mixed Q1; won’t rush on price cuts,https://www.livemint.com/market/mark-to-market/paint-companies-price-cuts-crude-oil-asian-paints-berger-fy27-11783495689007.html,2026-07-08 14:00:56 IST,Price hikes augur well for the June-quarter revenue growth.,https://www.livemint.com/rss/markets
Multibagger stock Diamond Power hits record high despite stock market crash. InCred sees 28% more upside,https://www.livemint.com/market/stock-market-news/multibagger-stock-diamond-power-hits-record-high-despite-stock-market-crash-incred-sees-28-more-upside-11783498323507.html,2026-07-08 13:55:13 IST,"Diamond Power's financial position has notably improved, with working capital now funded by promoters. The stock surged 6.5% to  ₹240 despite market declines, supported by an optimistic earnings outlook from InCred, which rates it an 'ADD' with a target price of  ₹300.",https://www.livemint.com/rss/markets
MobiKwik CFO Taku calls for MDR on UPI transactions,https://www.livemint.com/companies/upi-mdr-large-merchants-mobikwik-cfo-upasana-taku-11783241896555.html,2026-07-08 15:29:08 IST,"Upasana Taku said that while the industry supports the government's financial inclusion goals, the absence of merchant discount rate means payment firms and banks continue to bear the cost of processing transactions without any revenue, even as large listed firms benefit from the zero-fee regime.",https://www.livemint.com/rss/companies
Tata Steel Netherlands summoned by Dutch prosecutors over pollution violations,https://www.livemint.com/companies/news/tata-steel-netherlands-dutch-prosecutors-pollution-violations-11783498312805.html,2026-07-08 14:01:01 IST,"Dutch prosecutors suspect Tata Steel of multiple criminal offence, including unlawful release of harmful substances into the air, failing in its duty of care by carrying out insufficient maintenance",https://www.livemint.com/rss/companies
Clubbing income: Tax return mistakes that many discover only after receiving a notice,https://www.livemint.com/money/tax-return-tax-filing-mistakes-tax-notice-income-tax-tds-tcs-refund-mismatches-invesments-11783491496968.html,2026-07-08 16:21:28 IST,"As taxpayers finalize their returns this filing season, it may be worthwhile to spend a few extra minutes reviewing investments in the name of your spouse and minor children",https://www.livemint.com/rss/money
Starting a SIP? Here is why building the right portfolio matters more,https://www.livemint.com/money/personal-finance/starting-a-sip-here-is-why-building-the-right-portfolio-matters-more-11783501634564.html,2026-07-08 16:18:27 IST,"SIPs are effective for discipline, but they don't ensure a balanced portfolio. Proper portfolio construction requires mapping goals, managing asset allocation and avoiding excessive risk. Critical review and diversification are essential to protect against poor outcomes and market volatility.",https://www.livemint.com/rss/money
EPFO system upgrade: Your PF claim may be delayed after latest update — Here's how long it will take,https://www.livemint.com/money/personal-finance/epfo-system-upgrade-your-pf-claim-may-be-delayed-after-latest-update-heres-how-long-it-will-take-11783501242177.html,2026-07-08 16:05:43 IST,The EPFO informs users that claim processing may be delayed due to a recent database consolidation and software upgrade. Services are restored but will be handled in phases. Details here.,https://www.livemint.com/rss/money
EPF Scheme 2026: Who can withdraw their entire EPF corpus? Check all 7 cases,https://www.livemint.com/money/personal-finance/epf-scheme-2026-who-can-withdraw-their-entire-epf-corpus-check-all-7-cases-11783503603992.html,2026-07-08 15:24:06 IST,"The EPF Scheme, 2026 allows members to withdraw their entire provident fund balance only under specified circumstances. Here's a detailed guide to the seven eligible situations and the key changes from the earlier rules.",https://www.livemint.com/rss/money
"EPF Scheme 2026: Can employers cap EPF contribution at  ₹1,800? Here's what the law says",https://www.livemint.com/money/personal-finance/epf-scheme-2026-can-employers-cap-epf-contribution-at-1-800-heres-what-the-law-says-11783497514404.html,2026-07-08 15:04:27 IST,"Labour Law Reporter emphasizes that while  ₹1,800 is the default PF contribution, employers must have legal grounds to reduce contributions beyond this amount. Employee protections against wage reductions remain vital under the Social Security Code.",https://www.livemint.com/rss/money
"What is a soft credit inquiry? Meaning, benefits and why it does not affect your credit score | Explained",https://www.livemint.com/money/personal-finance/what-is-a-soft-credit-inquiry-meaning-benefits-and-why-it-does-not-affect-your-credit-score-explained-11783497512105.html,2026-07-08 14:49:37 IST,"A soft credit inquiry allows individuals and financial institutions to review credit information without affecting credit scores. Here's how soft checks work, their impact, and how they differ from hard inquiries.",https://www.livemint.com/rss/money
Income Tax Department releases Excel utility for ITR-5 for FY 2025-26. What is it for and other details,https://www.livemint.com/money/personal-finance/income-tax-department-releases-excel-utility-for-itr-5-for-fy-2025-26-what-is-it-for-other-details-11783493750983.html,2026-07-08 13:52:34 IST,"The Income Tax (I-T) department has released an Excel utility for ITR-5, enabling taxpayers to file their return for the assessment year 2026-27.&amp;nbsp;",https://www.livemint.com/rss/money
China warns about AI risks with Anthropic's Claude Code,https://www.cnbc.com/2026/07/08/china-anthropic-ai-claude-code-backdoor-security-threat.html,2026-07-08 13:44:28 IST,China said specific versions of Claude Code posed back-door vulnerabilities that could send sensitive information to a remote server.,https://www.cnbc.com/id/10000664/device/rss/rss.html
HSBC drops 'overweight' call on EM equities on AI spending fears,https://economictimes.indiatimes.com/markets/stocks/news/hsbc-drops-overweight-call-on-em-equities-on-ai-spending-fears/articleshow/132264004.cms,2026-07-08 18:12:05 IST,"HSBC has reassessed its position on emerging markets equities, shifting to an 'overweight' stance due to rising volatility in Asian markets and ongoing concerns about AI-related expenditures. South Korean stocks have notably suffered, dipping into bear market conditions. Investors are growing wary of the sustainability of AI investments backed by debt. Meanwhile, HSBC has raised the rating on eurozone equities to 'overweight,' highlighting favorable market factors.",https://economictimes.indiatimes.com/markets/stocks/rssfeeds/2146843.cms
"Sebi amends rule for foreign investors, directs registration fee payment in Indian rupee",https://economictimes.indiatimes.com/markets/stocks/news/sebi-amends-fpis-rule-directs-registration-fee-payment-in-indian-rupee/articleshow/132262200.cms,2026-07-08 16:57:05 IST,"Sebi has announced a modification to its foreign investor registration fees, shifting to a rupee-based model effective in six months. This adjustment stipulates that Category-I FPIs and FVCIs will be required to pay Rs 2.3 lakh. Additionally, the common application will now demand the date of birth from applicants, and depository participants must ensure that all fees are forwarded to Sebi within a five-day period.",https://economictimes.indiatimes.com/markets/stocks/rssfeeds/2146843.cms
"Bond yields jump, rupee weakens as oil surges after Trump says Iran deal is over",https://www.livemint.com/market/bonds/bond-yields-rupee-weakens-oil-surges-trump-iran-deal-west-asia-tension-strait-of-hormuz-debt-market-11783514363546.html,2026-07-08 19:19:08 IST,The rise in crude oil prices renewed concerns over inflation and India’s external balances.,https://www.livemint.com/rss/markets
Multibagger small-cap Cupid logs biggest one-day fall in 6 months; ends 3-day rally,https://www.livemint.com/market/stock-market-news/multibagger-small-cap-cupid-logs-biggest-one-day-fall-in-6-months-ends-3-day-rally-11783517788669.html,2026-07-08 19:18:48 IST,"Cupid shares fell 11% on July 8, reversing a strong 14-session winning streak. After hitting a record high of  ₹226, the stock plunged to  ₹197, marking its biggest single-day decline since January. Retail investors benefited significantly from its 1,416% rally over the past years.",https://www.livemint.com/rss/markets
"Kusumgar IPO: Issue received a solid response on Day 01, booked 3.7 times; GMP signals bumper listing",https://www.livemint.com/market/stock-market-news/kusumgar-ipo-issue-received-a-solid-response-on-day-01-booked-3-7-times-gmp-signals-bumper-listing-11783513889334.html,2026-07-08 18:21:47 IST,"Kusumgar Limited's IPO saw robust interest on its first day, subscribing 3.67 times with 3.99 crore shares bid against 1.08 lakh available. Non-institutional investors led the demand. The issue closes July 10, with a price band set between  ₹398 and  ₹419.",https://www.livemint.com/rss/markets
"RBI reiterates push for crypto 'prohibition', cites financial risks and tax evasion",https://www.livemint.com/market/cryptocurrency/rbi-reiterates-push-for-crypto-prohibition-cites-financial-risks-and-tax-evasion-11783510273549.html,2026-07-08 18:00:41 IST,"Several key government agencies continue to favour stricter controls on virtual digital assets, even as India has not yet finalised a clear regulatory framework for cryptocurrencies.",https://www.livemint.com/rss/markets
"US stock market today: Dow, S&amp;P 500 futures drop up to 1% as oil rally and Middle East risks hit sentiment",https://www.livemint.com/market/stock-market-news/us-stock-market-today-dow-s-p-500-futures-drop-up-to-1-as-oil-rally-and-middle-east-risks-hit-sentiment-11783510483850.html,2026-07-08 17:44:27 IST,"US stock futures indicated a weak start on 8 July amid rising crude oil prices and tensions in the Middle East. S&amp;amp;P 500 futures fell 0.8%, while Dow Jones and Nasdaq futures declined 1%. Investor sentiment weakened following US strikes on Iran amid escalating conflict.",https://www.livemint.com/rss/markets
"Oil jumps over 6% as Trump declares Iran ceasefire, MoU effectively over",https://www.livemint.com/market/commodities/oil-jumps-over-6-as-trump-declares-iran-ceasefire-mou-effectively-over-11783505793843.html,2026-07-08 17:04:58 IST,"The US has reinstated sanctions on Iranian oil and launches fresh strikes, reviving fears of disruption in the Strait of Hormuz and raising fresh concerns for India's energy security and inflation outlook.",https://www.livemint.com/rss/markets
Apple loses spat with EU over App Store and iPhone rules,https://www.livemint.com/companies/news/apple-loses-spat-with-eu-over-app-store-and-iphone-rules-11783517970968.html,2026-07-08 19:16:32 IST,"Judges at the EU’s General Court in Luxembourg disagreed with Apple’s challenge to the services being targeted under the EU’s Digital Markets Act, saying regulators were right to draw the two services under the scope of the rules",https://www.livemint.com/rss/companies
Apple commits over $30 billion to Broadcom to produce billions more US chips,https://www.livemint.com/companies/news/apple-commits-over-30-billion-to-broadcom-to-produce-billions-more-us-chips-11783513234075.html,2026-07-08 18:24:06 IST,"Apple has announced an expansion of its partnership with Broadcom, involving over $30 billion in investments. This agreement will facilitate the production of 15 billion US-made chips. Details here.",https://www.livemint.com/rss/companies
"Microsoft layoff: Employees offered up to 39 weeks' pay, stock vesting; here's who gets what",https://www.livemint.com/companies/news/microsoft-layoff-employees-offered-up-to-39-weeks-pay-stock-vesting-heres-who-gets-what-11783504960570.html,2026-07-08 16:33:25 IST,"Microsoft announced layoffs affecting 4,800 employees, offering severance packages up to 39 weeks' pay. Compensation varies by employee level, with options for continued stock vesting and health insurance. The cuts aim to streamline costs amid significant AI investments.",https://www.livemint.com/rss/companies
"EPFO portal revamp: 10 changes in PF claims, withdrawals and transfers every member should know",https://www.livemint.com/money/personal-finance/epfo-portal-revamp-10-changes-in-pf-claims-withdrawals-and-transfers-every-member-should-know-11783512492533.html,2026-07-08 18:27:43 IST,"The Employees' Provident Fund Organisation has centralised its member database through the CITES project to enhance service speed, transparency, and accessibility.&amp;nbsp;",https://www.livemint.com/rss/money
Can tenants continue paying old rent if they overstay after lease expires? Delhi HC answers,https://www.livemint.com/money/personal-finance/can-tenants-continue-paying-old-rent-if-they-overstay-after-lease-expires-delhi-hc-answers-11783508191047.html,2026-07-08 17:21:40 IST,The Delhi HC ruled that tenants staying in a property after lease expiration may face higher rent due to automatic escalation clauses. Here's all you need to know.,https://www.livemint.com/rss/money
How much should you invest in mutual funds? Experts say there’s no magic number,https://www.livemint.com/money/personal-finance/how-much-should-you-invest-in-mutual-funds-experts-say-there-s-no-magic-number-11783510728802.html,2026-07-08 17:13:36 IST,"A 20-30% investment target can be a useful starting point, but the right SIP depends on your goals, emergency savings and ability to increase investments as income grows.",https://www.livemint.com/rss/money
EPFO starts crediting interest for FY26: When will it reflect? How to check in EPFO portal and other platforms,https://www.livemint.com/money/personal-finance/epfo-starts-crediting-interest-for-fy26-when-will-your-pf-balance-be-updated-heres-how-to-check-11783508789118.html,2026-07-08 16:51:07 IST,"EPFO will credit FY26 interest at 8.25% to 34 crore member accounts by July 15. Members can check the updated amounts online through various methods, including the EPFO Portal, UMANG app, missed calls, SMS, and DigiLocker after activating their UAN.",https://www.livemint.com/rss/money
