title,link,published,summary,source
"Silver inventories on Shanghai Exchange rise above 350 tonnes, still down 88% from record high",https://www.livemint.com/market/commodities/silver-inventories-on-shanghai-exchange-rise-above-350-tonnes-still-down-88-from-record-high-11771212962579.html,2026-02-16 09:17:00 IST,"Silver available for delivery on the SHFE rose to around 353.559 tonnes on February 13, up from 349.633 tonnes a day earlier, as per CEIC data. The exchange’s silver inventories had fallen to 318.546 tonnes on February 9 — the lowest level since 2015.",https://www.livemint.com/rss/markets
Silver rate today declines over 3% on MCX as US inflation data lifts US dollar - What should investors do?,https://www.livemint.com/market/commodities/silver-rate-today-declines-over-3-on-mcx-as-us-inflation-data-lifts-us-dollar-what-should-investors-do-gold-price-11771212646930.html,2026-02-16 09:08:48 IST,"Silver prices fell on Monday as the US dollar strengthened following better-than-expected inflation data. MCX silver rates dropped 3.3% to  ₹2,36,100 per kg, while international spot silver decreased 0.6% to $76.92 per ounce.",https://www.livemint.com/rss/markets
Gold rate drops 1% on MCX on profit booking; silver prices crash 3% after US CPI data; is it the right time to buy?,https://www.livemint.com/market/commodities/gold-price-today-gold-rate-today-drops-on-mcx-silver-prices-crash-is-it-the-right-time-to-buy-gold-11771212319150.html,2026-02-16 09:06:06 IST,"Gold price today: Gold rate dropped in the morning tarde. MCX gold April contracts dropped by nearly  ₹1,200, or 0.76%, to  ₹1,54,717 per 10 grams, while MCX silver March futures crashed by  ₹8,300, or 3.40%, to  ₹2,36,100 per kg.",https://www.livemint.com/rss/markets
Stock Market Holiday: Is Chinese stock market closed this week for lunar new year 2026?,https://www.livemint.com/market/stock-market-news/stock-market-holiday-china-stock-markets-closed-this-week-for-lunar-new-year-2026-hong-kong-singapore-also-closed-11771210201603.html,2026-02-16 08:44:06 IST,"China's equity markets will shut for the Lunar New Year from February 16 to 23, 2026, affecting trading across Asia. US markets will also be closed on February 16 for Presidents' Day, leading to reduced global liquidity and trading activity.",https://www.livemint.com/rss/markets
Buy or sell: Vaishali Parekh recommends three intraday stocks to buy today — 16 February 2026,https://www.livemint.com/market/stock-market-news/buy-or-sell-vaishali-parekh-recommends-three-intraday-stocks-to-buy-today-16-february-2026-11771208267579.html,2026-02-16 08:36:59 IST,"Buy or sell: Vaishali Parekh recommends three intraday stocks to buy today — PNB Gilts, ZEEL, South Indian Bank",https://www.livemint.com/rss/markets
"Fractal Analytics IPO listing date today. Here's what GMP, experts signal ahead of stock market debut",https://www.livemint.com/market/ipo/fractal-analytics-ipo-listing-date-today-heres-what-gmp-experts-signal-ahead-of-stock-market-debut-11771208911200.html,2026-02-16 08:09:11 IST,"Fractal Analytics IPO listing: The shares of Fractal Analytics will make their stock market debut on Monday, February 16, after the mainboard IPO received a moderate response from investors during the three-day subscription period.",https://www.livemint.com/rss/markets
Stocks to buy for short term: From Coal India to Finolex Industries— Jigar Patel of Anand Rathi suggests 3 shares,https://www.livemint.com/market/stock-market-news/stocks-to-buy-for-short-term-from-coal-india-to-finolex-industries-jigar-patel-of-anand-rathi-suggests-3-shares-11771149742201.html,2026-02-16 08:00:12 IST,"Stocks to buy: In a turbulent market, Jigar Patel from Anand Rathi identifies three stocks, including Coal India and Finolex Industries, poised for short-term gains. For the Nifty 50, Patel believes 25,800–26,000 remains the key intermediate resistance band.&amp;nbsp;",https://www.livemint.com/rss/markets
"Gold, Silver Rates Today LIVE: MCX gold rate falls below  ₹1.55 lakh per 10 grams; silver price drops over 3%",https://www.livemint.com/market/commodities/gold-silver-rates-today-live-mcx-gold-rate-today-mcx-silver-prices-gold-prices-dollar-iran-trump-16-february-2026-11771208323899.html,2026-02-16 07:55:19 IST,"Gold, Silver Rates Today LIVE: Gold prices traded lower as the dollar rose after bullion notched a more than 2% gain in the previous session, as cooler-than-expected US inflation data lifted expectations for the US Fed rate cuts.",https://www.livemint.com/rss/markets
"Australia, NZ dollars mark time ahead of RBNZ rate outlook",https://www.livemint.com/market/australia-nz-dollars-mark-time-ahead-of-rbnz-rate-outlook-11771208678347.html,2026-02-16 07:54:37 IST,"AUSTRALIA-FOREX/:Australia, NZ dollars mark time ahead of RBNZ rate outlook",https://www.livemint.com/rss/markets
"Stock market today: Trade setup for Nifty 50, gold, silver rates, FII-DII data to USD vs INR — 7 stocks to buy or sell",https://www.livemint.com/market/stock-market-news/stock-market-today-trade-setup-for-nifty-50-gold-silver-rates-today-to-usd-vs-inr-seven-stocks-to-buy-or-sell-11771203140587.html,2026-02-16 07:34:46 IST,"Stock market today: Experts have recommended seven stocks to buy today — Schneider Electric, Blue Star, Bajaj Finance, SAIL, SBI Life, ABFRL, and Kirloskar Oil Engines",https://www.livemint.com/rss/markets
"Stocks to watch: Manappuram Finance, Ola Electric, Religare Enterprises among 10 shares in focus today; full list here",https://www.livemint.com/market/stock-market-news/stocks-to-watch-manappuram-finance-ola-electric-religare-enterprises-among-10-shares-in-focus-today-full-list-here-11771200830866.html,2026-02-16 07:23:13 IST,"Stock market today: On Friday, the Sensex tumbled 1,048 points, or 1.25%, to end at 82,626.76, while the Nifty 50 dropped 336 points, or 1.30%, to settle at 25,471.10.",https://www.livemint.com/rss/markets
Shares of Aye Finance list in B Group,https://www.business-standard.com/markets/capital-market-news/shares-of-aye-finance-list-in-b-group-126021600154_1.html,2026-02-16 09:51:04 IST,Powered by Capital Market - Live News,https://www.business-standard.com/rss/markets-106.rss
Ola Electric slides 7% as analysts flag prolonged turnaround after weak Q3,https://www.business-standard.com/markets/news/ola-electric-shares-slide-7-as-analysts-flag-prolonged-turnaround-after-weak-q3-126021600146_1.html,2026-02-16 09:47:06 IST,"Ola Electric reported a consolidated net loss of ₹487 crore in Q3, down from ₹564 crore in the same quarter last year",https://www.business-standard.com/rss/markets-106.rss
Dr Reddy's: 5 technical reasons why Choice Broking is bullish on this stock,https://www.business-standard.com/markets/news/dr-reddy-s-laboratories-5-technical-reasons-why-choice-broking-is-bullish-on-this-pharma-stock-126021600117_1.html,2026-02-16 09:36:02 IST,"Analysts at Choice Broking expects Dr Reddy's Laboratories stock to gain up to 15.5%, and test ₹1,465 levels on the upside in the medium-term given the favourable structure on the weekly chart.",https://www.business-standard.com/rss/markets-106.rss
Shakti Pumps tanks as Q3 PAT slides 70% YoY to Rs 97 cr,https://www.business-standard.com/markets/capital-market-news/shakti-pumps-tanks-as-q3-pat-slides-70-yoy-to-rs-97-cr-126021600134_1.html,2026-02-16 09:32:27 IST,Shakti Pumps India slumped 11.01% to Rs 569.85 after its consolidated net profit declined 69.53% to Rs 31.70 crore in Q3 FY26 as against Rs 104.05 crore posted in Q3 FY25.,https://www.business-standard.com/rss/markets-106.rss
"Keystone Realtors bags redevelopment project in Andheri, Mumbai",https://www.business-standard.com/markets/capital-market-news/keystone-realtors-bags-redevelopment-project-in-andheri-mumbai-126021600133_1.html,2026-02-16 09:32:19 IST,"With estimated gross development value of Rs 1,775 cr",https://www.business-standard.com/rss/markets-106.rss
EaseMyTrip plans to raise capital of Rs 500 cr,https://www.business-standard.com/markets/capital-market-news/easemytrip-plans-to-raise-capital-of-rs-500-cr-126021600127_1.html,2026-02-16 09:31:56 IST,"EaseMyTrip has announced plans to raise capital up to Rs 500 crore as part of its ongoing strategy to scale key growth areas and reinforce its financial strength. The Board has approved, in principally, a proposal to raise funds through the issuance of equity shares and/or other eligible securities, subject to requisite approvals.",https://www.business-standard.com/rss/markets-106.rss
"Gold edges lower as traders lock in gains after rally above $5,000 an ounce",https://www.business-standard.com/markets/commodities/gold-edges-lower-as-traders-lock-in-gains-after-rally-above-5-000-an-ounce-126021600113_1.html,2026-02-16 09:27:35 IST,"Bullion fell as much as 0.8 per cent on Monday, after climbing 2.4 per cent in the previous session",https://www.business-standard.com/rss/markets-106.rss
Hyundai Motor India announces change in senior management,https://www.business-standard.com/markets/capital-market-news/hyundai-motor-india-announces-change-in-senior-management-126021600110_1.html,2026-02-16 09:16:52 IST,With effect from 16 February 2026,https://www.business-standard.com/rss/markets-106.rss
Eyeing passive income? Keep an eye on these 8 dividend paying stocks today,https://www.business-standard.com/markets/news/eyeing-passive-income-keep-an-eye-on-these-8-dividend-paying-stocks-today-126021600103_1.html,2026-02-16 09:10:00 IST,"Among the listed companies, Majestic Auto has announced the highest dividend, declaring a special dividend of ₹35 per share, with February 17 as the record date",https://www.business-standard.com/rss/markets-106.rss
India's forex reserves down by $6.7 billion to $717.6 billion,https://www.business-standard.com/markets/capital-market-news/india-s-forex-reserves-down-by-6-7-billion-to-717-6-billion-126021600098_1.html,2026-02-16 09:05:31 IST,"Meanwhile, data showed a dip in foreign currency assets (FCAs) which declined by $7.66 billion to $570.05 billion during the week.",https://www.business-standard.com/rss/markets-106.rss
Welga Foods reports standalone net loss of Rs 0.70 crore in the December 2025 quarter,https://www.business-standard.com/markets/capital-market-news/welga-foods-reports-standalone-net-loss-of-rs-0-70-crore-in-the-december-2025-quarter-126021600097_1.html,2026-02-16 09:05:25 IST,Sales decline 21.49% to Rs 6.65 crore,https://www.business-standard.com/rss/markets-106.rss
Supraneet Finance & Consultants reports standalone nil net profit/loss in the December 2025 quarter,https://www.business-standard.com/markets/capital-market-news/supraneet-finance-consultants-reports-standalone-nil-net-profit-loss-in-the-december-2025-quarter-126021600096_1.html,2026-02-16 09:05:18 IST,Sales rise 28.57% to Rs 0.09 crore,https://www.business-standard.com/rss/markets-106.rss
Sriven Multi-Tech reports standalone net loss of Rs 0.05 crore in the December 2025 quarter,https://www.business-standard.com/markets/capital-market-news/sriven-multi-tech-reports-standalone-net-loss-of-rs-0-05-crore-in-the-december-2025-quarter-126021600095_1.html,2026-02-16 09:05:11 IST,Sales reported at Rs 0.01 crore,https://www.business-standard.com/rss/markets-106.rss
"Stock Alert: GK Energy, Vikran Engineering, Shakti Pumps, Deep Industries, RailTel Corp",https://www.business-standard.com/markets/capital-market-news/stock-alert-gk-energy-vikran-engineering-shakti-pumps-deep-industries-railtel-corp-126021600094_1.html,2026-02-16 09:05:03 IST,Securities in F&amp;O Ban:,https://www.business-standard.com/rss/markets-106.rss
GIFT Nifty signals a weak start,https://www.business-standard.com/markets/capital-market-news/gift-nifty-signals-a-weak-start-126021600093_1.html,2026-02-16 09:04:52 IST,GIFT Nifty:,https://www.business-standard.com/rss/markets-106.rss
AI threat to Indian IT stocks? Motilal Oswal explains road head for sector,https://www.business-standard.com/markets/news/ai-threat-to-indian-it-stocks-motilal-oswal-explains-road-head-for-sector-126021600062_1.html,2026-02-16 08:56:07 IST,"According to MOFSL, enterprise complexity, legacy systems and governance constraints could slow AI adoption, pushing productivity gains further out",https://www.business-standard.com/rss/markets-106.rss
"Stocks to buy: Choice Equity analyst suggests Minda Corp, Bajaj Consumer",https://www.business-standard.com/markets/news/technical-stock-picks-today-feb-16-minda-corp-breakout-bajaj-consumer-reversal-buy-targets-126021600063_1.html,2026-02-16 08:35:51 IST,"Minda Corp stock is near ₹610-breakout with higher lows, while Bajaj Consumer stock is seeing long-term reversal above ₹345. Aakash Shah suggests buy levels, stop loss and share price targets",https://www.business-standard.com/rss/markets-106.rss
Ashoka Buildcon bags $45.28 Mln Intl road project in West Africa,https://www.business-standard.com/markets/capital-market-news/ashoka-buildcon-bags-45-28-mln-intl-road-project-in-west-africa-126021600054_1.html,2026-02-16 08:04:51 IST,"Ashoka Buildcon said that it has received letter of award (LoA) from an international entity for upgrading the road in Republic of Liberia, West Africa.",https://www.business-standard.com/rss/markets-106.rss
"Stock Market LIVE Updates: Sensex, Nifty flat; BSE drops 9%, Angel One 7%; Natco Pharma zooms 9%",https://www.business-standard.com/markets/news/stock-market-live-february-16-nse-bse-sensex-today-nifty-gift-nifty-ola-electric-q3-results-fractal-analytics-ipo-listing-126021600050_1.html,2026-02-16 08:04:36 IST,"Sensex Today | Stock Market LIVE Updates, Monday, Feb 16: Among sectors, the Nifty Pharma index gained 1 per cent, and the Nifty Auto added 0.06 per cent.",https://www.business-standard.com/rss/markets-106.rss
"Stocks to Watch today, Feb 16: Ola Electric, Kfin Tech, Inox Green, HUL",https://www.business-standard.com/markets/news/stocks-to-watch-today-february-16-2026-ola-electric-fortis-healthcare-gmr-airports-inox-green-kfin-technologies-torrent-pharma-126021600053_1.html,2026-02-16 08:03:37 IST,"Stocks to Watch today, Feb 16: From Ola Electric to Inox Green Energy, here are few stocks that will be on investors' radar",https://www.business-standard.com/rss/markets-106.rss
"Gold price falls ₹10 to ₹1,57,740; silver down ₹100, trades at ₹2,74,900",https://www.business-standard.com/markets/commodities/gold-price-falls-10-to-1-57-740-silver-down-100-trades-at-2-74-900-126021600051_1.html,2026-02-16 07:44:49 IST,"The price of 22-carat gold decreased by ₹10, with ten grams of the yellow metal selling at ₹1,44,590",https://www.business-standard.com/rss/markets-106.rss
"ICICI Bank, Max Health shares flash 'Buy' signals; check levels, targets",https://www.business-standard.com/markets/news/icici-bank-max-health-buy-call-target-price-technical-analysis-126021600048_1.html,2026-02-16 07:32:52 IST,"ICICI Bank & Max Health shares show bullish technical setups with breakout patterns and EMA crossovers, says Osho Krishan of Angel One. Check buy levels, stop loss, price targets for near-term upside",https://www.business-standard.com/rss/markets-106.rss
Global Market Today | China market shut for Lunar New Year: What it means for global investors,https://economictimes.indiatimes.com/markets/stocks/news/global-market-today-china-market-shut-for-lunar-new-year-what-it-means-for-global-investors/articleshow/128408685.cms,2026-02-16 11:14:28 IST,"China's financial markets are observing a seasonal pause for the Lunar New Year, leading to reduced liquidity and potential shifts in global market dynamics. With mainland markets and parts of Hong Kong closed, investors are monitoring commodities, currencies, and risk sentiment for spillover effects during this significant economic period.",https://economictimes.indiatimes.com/markets/stocks/rssfeeds/2146843.cms
"Explained: What new RBI norms mean for BSE, MCX, stock brokers and prop traders",https://economictimes.indiatimes.com/markets/stocks/news/explained-what-new-rbi-norms-mean-for-bse-mcx-stock-brokers-and-prop-traders/articleshow/128408059.cms,2026-02-16 10:59:28 IST,"The Reserve Bank of India’s sweeping overhaul of collateral and funding norms is set to reshape market dynamics, sharply raising costs for proprietary traders while sparing most retail brokers.  Analysts say the tightening will hit different market participants in vastly different ways. Shares of BSE, Angel One, MCX and Groww tumbled as analysts warned of lower liquidity and earnings pressure.",https://economictimes.indiatimes.com/markets/stocks/rssfeeds/2146843.cms
"BSE, MCX, Angel One, Groww shares fall up to 10%. Here’s why",https://economictimes.indiatimes.com/markets/stocks/news/bse-mcx-angel-one-groww-shares-fall-up-to-10-heres-why/articleshow/128407311.cms,2026-02-16 10:24:41 IST,"Stock market intermediaries faced a sharp sell-off Monday after the RBI tightened lending rules, demanding fully secured funding and stricter collateral for margin trading. This forces firms like BSE and Angel One to seek costlier alternatives, potentially impacting earnings and profit margins significantly. The new regulations take effect April 1.",https://economictimes.indiatimes.com/markets/stocks/rssfeeds/2146843.cms
"Aye Finance share price falls 5% after flat listing. Should you buy, sell or hold?",https://www.livemint.com/market/stock-market-news/aye-finance-share-price-falls-5-after-flat-listing-should-you-buy-sell-or-hold-11771219623446.html,2026-02-16 11:11:19 IST,"Aye Finance share price fell nearly 5% following a flat listing at  ₹129 on February 16. The stock saw intraday fluctuations between  ₹120.55 and  ₹133.80, while analysts express caution due to declining profits and competitive pressures.",https://www.livemint.com/rss/markets
"AI-led disruption is real: What it means for the economy, stock market investors",https://www.livemint.com/market/stock-market-news/ai-disruption-indian-it-stocks-economy-stock-market-investors-11771144542371.html,2026-02-16 10:30:37 IST,"As AI technologies advance, global markets are experiencing a sell-off, driven by fears of job losses and economic upheaval. The Indian IT sector, a key player in the economy, faces uncertainty. AI is now very much a part of mainstream businesses across sectors.&amp;nbsp;",https://www.livemint.com/rss/markets
3200% rally in five years! Multibagger stock jumps 4% after Q3 results 2026,https://www.livemint.com/market/stock-market-news/3200-rally-in-five-years-multibagger-stock-spice-lounge-food-works-jumps-4-after-q3-results-2026-11771215316385.html,2026-02-16 10:13:43 IST,"Spice Lounge Food Works share price rallied as much as 4.36% to  ₹40.20 per share on Monday, February 16, after the company posted more than 100% YoY surge in its standalone net profit for the quarter ending on December 31, 2025.",https://www.livemint.com/rss/markets
Kwality Wall’s shares list with 26% discount at  ₹29.80 apiece versus adjusted price of  ₹40.20 on NSE,https://www.livemint.com/market/stock-market-news/kwality-wall-s-shares-list-at-rs-29-80-apiece-versus-issue-price-of-rs-40-20-per-share-on-nse-11771216230025.html,2026-02-16 10:06:18 IST,"Kwality Wall’s share listing follows the demerger of the ice-cream business from Hindustan Unilever (HUL). On February 13, the FMCG major had announced that Kwality Wall’s shares will start trading on BSE and NSE from February 16.",https://www.livemint.com/rss/markets
Fractal Analytics IPO listing: Shares list at 3% discount to the IPO price,https://www.livemint.com/market/stock-market-news/fractal-analytics-ipo-listing-shares-list-at-3-discount-to-the-ipo-price-11771213596788.html,2026-02-16 10:04:16 IST,Fractal Analytics IPO listing: Fractal Analytics share price opened at  ₹876 on the NSE and  ₹873 on the BSE. This means that the IPO allottees made a loss of 3% on the Fractal Analytics IPO listing.,https://www.livemint.com/rss/markets
"Aye Finance share price off to a lakclustre start, lists at par with IPO price of  ₹129 apiece",https://www.livemint.com/market/stock-market-news/aye-finance-ipo-listing-shares-debut-at-par-with-ipo-price-of-rs-129-apiece-11771216060923.html,2026-02-16 10:03:34 IST,Aye Finance IPO listing: The listing beat market expectations as suggested by the grey market premium (GMP). The (-)  ₹2 Aye Finance IPO GMP earlier today signalled a listing at 1.55% discount.,https://www.livemint.com/rss/markets
Why government bond yields remain stubbornly high,https://www.livemint.com/market/bonds/bonds-g-sec-yields-india-rbi-repo-rate-impact-home-loan-11771161679421.html,2026-02-16 09:54:45 IST,"There is an unease over Indian government's fiscal discipline as bond yields refuse to budge despite efforts to consolidate. With an oversupply of debt and an uncertain environment, risks are mounting.",https://www.livemint.com/rss/markets
"Torrent Pharma share price jumps 6% to hit a record high— Is it a stock to buy, sell or hold after Q3 results?",https://www.livemint.com/market/stock-market-news/torrent-pharma-share-price-jumps-6-to-hit-a-record-high-is-it-a-stock-to-buy-sell-or-hold-after-q3-results-11771215316716.html,2026-02-16 09:52:06 IST,"Torrent Pharma's share price jumped as much as 6% in the morning trade on Monday, February 16, to hit a record high of  ₹4,322.80. Torrent Pharmaceuticals shares opened at  ₹4,154.95 and jumped over 6% to an all-time high.",https://www.livemint.com/rss/markets
Fast&amp;Up attracts interest from VC firms for its ongoing $70 mn round,https://www.livemint.com/companies/start-ups/fastup-venture-capital-sports-nutrition-protein-supplements-11771210831330.html,2026-02-16 11:12:30 IST,"Venturi Partners and Elev8 Venture Partners are in the final round of bids for sports nutrition brand Fast&amp;amp;Up’s $70 million fundraise, signalling rising investor appetite for preventive wellness.",https://www.livemint.com/rss/companies
"‘Low pay for exposure, be grateful…’ Ankur Warikoo lists 5 green flags, one red to consider while staying at your job",https://www.livemint.com/companies/people/ankur-warikoo-5-green-flags-one-red-consider-stay-your-job-toxic-stress-low-pay-exposure-dread-appreciate-growth-respect-11771212676121.html,2026-02-16 10:05:53 IST,"From pressure to accept low pay for “exposure and learning” and demands to be grateful for having a job, no matter how hard. Ankur Warikoo has listed five green flags and one red to consider when assessing whether staying at your job is worth it.",https://www.livemint.com/rss/companies
RBI's tighter lending norms rattle capital market stocks,https://www.business-standard.com/markets/capital-market-news/rbi-s-tighter-lending-norms-rattle-capital-market-stocks-126021600283_1.html,2026-02-16 11:20:01 IST,Shares of capital market firms fell sharply after the Reserve Bank of India introduced stricter lending norms for securities intermediaries.,https://www.business-standard.com/rss/markets-106.rss
Volumes spurt at C.E. Info Systems Ltd counter,https://www.business-standard.com/markets/capital-market-news/volumes-spurt-at-c-e-info-systems-ltd-counter-126021600282_1.html,2026-02-16 11:19:53 IST,"C.E. Info Systems Ltd notched up volume of 1.52 lakh shares by 10:46 IST on BSE, a 53.98 fold spurt over two-week average daily volume of 2820 shares",https://www.business-standard.com/rss/markets-106.rss
Dhunseri Tea & Industries reports consolidated net loss of Rs 7.12 crore in the December 2025 quarter,https://www.business-standard.com/markets/capital-market-news/dhunseri-tea-industries-reports-consolidated-net-loss-of-rs-7-12-crore-in-the-december-2025-quarter-126021600281_1.html,2026-02-16 11:19:46 IST,Sales rise 15.32% to Rs 141.21 crore,https://www.business-standard.com/rss/markets-106.rss
Mitcon Consultancy & Engineering Services consolidated net profit rises 419.23% in the December 2025 quarter,https://www.business-standard.com/markets/capital-market-news/mitcon-consultancy-engineering-services-consolidated-net-profit-rises-419-23-in-the-december-2025-quarter-126021600280_1.html,2026-02-16 11:19:40 IST,Sales rise 19.00% to Rs 26.55 crore,https://www.business-standard.com/rss/markets-106.rss
Godavari Biorefineries consolidated net profit rises 43.23% in the December 2025 quarter,https://www.business-standard.com/markets/capital-market-news/godavari-biorefineries-consolidated-net-profit-rises-43-23-in-the-december-2025-quarter-126021600279_1.html,2026-02-16 11:19:33 IST,Sales rise 2.81% to Rs 459.85 crore,https://www.business-standard.com/rss/markets-106.rss
Gokul Refoils and Solvent consolidated net profit rises 805.17% in the December 2025 quarter,https://www.business-standard.com/markets/capital-market-news/gokul-refoils-and-solvent-consolidated-net-profit-rises-805-17-in-the-december-2025-quarter-126021600278_1.html,2026-02-16 11:19:26 IST,Sales rise 6.84% to Rs 1075.61 crore,https://www.business-standard.com/rss/markets-106.rss
Facor Alloys reports consolidated net loss of Rs 4.37 crore in the December 2025 quarter,https://www.business-standard.com/markets/capital-market-news/facor-alloys-reports-consolidated-net-loss-of-rs-4-37-crore-in-the-december-2025-quarter-126021600277_1.html,2026-02-16 11:19:17 IST,Sales reported at Rs 0.27 crore,https://www.business-standard.com/rss/markets-106.rss
Lux Industries consolidated net profit declines 59.73% in the December 2025 quarter,https://www.business-standard.com/markets/capital-market-news/lux-industries-consolidated-net-profit-declines-59-73-in-the-december-2025-quarter-126021600276_1.html,2026-02-16 11:19:09 IST,Sales rise 21.96% to Rs 669.98 crore,https://www.business-standard.com/rss/markets-106.rss
