title,link,published,summary,source
Trent set to announce its first-ever bonus issue today: What Zudio-parent's 5 lakh shareholders should know,https://economictimes.indiatimes.com/markets/stocks/news/trent-set-to-announce-its-first-ever-bonus-issue-today-what-zudio-parents-5-lakh-shareholders-should-know/articleshow/130430008.cms,2026-04-22 07:28:09 IST,"Trent (Zudio parent) is set to consider its first-ever bonus issue today, making it a key trigger for its nearly 5 lakh shareholders.",https://economictimes.indiatimes.com/markets/stocks/rssfeeds/2146843.cms
GIFT Nifty down 160 points; here's the trading setup for today's session,https://economictimes.indiatimes.com/markets/stocks/news/pre-market-action-heres-the-trade-setup-for-todays-session/articleshow/130429688.cms,2026-04-22 06:32:29 IST,"Indian markets experienced a strong session on Tuesday, with the Nifty rising nearly 1% driven by positive global sentiment, robust Q4 earnings, and easing crude prices. Volatility also saw a significant pullback. Investors are now keenly watching the second round of US-Iran talks, with hopes for progress despite elevated tensions.",https://economictimes.indiatimes.com/markets/stocks/rssfeeds/2146843.cms
"Stocks in news: SBI Life, Trent, Tata Investment, HCL Tech, Suzlon Energy",https://economictimes.indiatimes.com/markets/stocks/news/stocks-in-news-sbi-life-trent-tata-investment-hcl-tech-suzlon-energy/articleshow/130429661.cms,2026-04-22 06:27:48 IST,"In today's trade, shares of SBI Life, Trent, Tata Investment, HCL Tech, Suzlon Energy among others will be in focus due to various news developments.",https://economictimes.indiatimes.com/markets/stocks/rssfeeds/2146843.cms
"It's not just war that brought rupee down, it needs better support",https://economictimes.indiatimes.com/markets/stocks/news/its-not-just-war-that-brought-rupee-down-it-needs-better-support/articleshow/130429626.cms,2026-04-22 06:24:41 IST,"The West Asia conflict has accelerated INR depreciation, necessitating a rethink of India's economic fundamentals. Short-term measures include raising domestic interest rates and equalizing onshore tax regulations for asset classes. Longer-term, building world-class universities, encouraging local tourism, and potentially redesigning the INR symbol are proposed to foster resilience and economic growth.",https://economictimes.indiatimes.com/markets/stocks/rssfeeds/2146843.cms
DSP MF sees attractive entry point in large private banks,https://economictimes.indiatimes.com/markets/stocks/news/dsp-mf-sees-attractive-entry-point-in-large-private-banks/articleshow/130429479.cms,2026-04-22 05:49:58 IST,"“Without pencilling in any re-rating, large private banks present an attractive opportunity for investors today,” said DSP in a note.  “More price decline will make them more attractive.”",https://economictimes.indiatimes.com/markets/stocks/rssfeeds/2146843.cms
"As FPIs continue to sell, outflows likely to rise before inflows revive",https://economictimes.indiatimes.com/markets/stocks/news/as-fpis-continue-to-sell-outflows-likely-to-rise-before-inflows-revive/articleshow/130429448.cms,2026-04-22 05:40:25 IST,"""The financial services sector has the biggest weight on benchmark Nifty; so when there is broad-based selling, banking and financial services' share in foreign selling tends to be higher,"" said U R Bhat, co-founder &amp; director, Alphaniti.",https://economictimes.indiatimes.com/markets/stocks/rssfeeds/2146843.cms
Fairfax likely to buy 10% more in IIFL Capital via preferential allotment,https://economictimes.indiatimes.com/markets/stocks/news/fairfax-likely-to-buy-10-more-in-iifl-capital-via-preferential-allotment/articleshow/130429428.cms,2026-04-22 05:35:37 IST,"Fairfax Financial Holdings plans to boost its stake in IIFL Capital Services. The deal is valued at approximately ₹1,000 crore. This move will see Fairfax's holding increase by about 10%. The transaction is expected to trigger an open offer under Indian regulations. Prem Watsa's firm is doubling down on its investment after thorough due diligence.",https://economictimes.indiatimes.com/markets/stocks/rssfeeds/2146843.cms
D-Street bounces as traders cover short bets ahead of peace talks,https://economictimes.indiatimes.com/markets/stocks/news/d-street-bounces-as-traders-cover-short-bets-ahead-of-peace-talks/articleshow/130429416.cms,2026-04-22 05:31:20 IST,"Indian markets saw significant gains on Tuesday, with the Nifty and Sensex rising over 0.9% and 1% respectively. This surge was driven by traders cutting bearish bets ahead of US-Iran peace talks and a moderation in foreign institutional selling. Technical indicators suggest a bullish outlook, with the Nifty potentially moving towards 24,800-25,000.",https://economictimes.indiatimes.com/markets/stocks/rssfeeds/2146843.cms
Stock Radar: Sona BLW stock breaks out from 11-month consolidation to hit fresh 52-week high; time to buy?,https://economictimes.indiatimes.com/markets/stocks/news/stock-radar-sona-blw-stock-breaks-out-from-11-month-consolidation-to-hit-fresh-52-week-high-time-to-buy/articleshow/130417353.cms,2026-04-22 05:00:00 IST,"Sona BLW Precision Forgings stock has broken out from an 11-month consolidation. This move pushed the stock to a fresh 52-week high. Experts suggest buying the stock for a target of Rs 661 in the next 1-2 months. The stock shows strong momentum indicators, indicating a positive trend shift and potential for further upside.",https://economictimes.indiatimes.com/markets/stocks/rssfeeds/2146843.cms
"Life insurers log 16% premium growth in FY26 on GST relief, shift to high-margin products",https://economictimes.indiatimes.com/markets/stocks/news/life-insurers-log-16-premium-growth-in-fy26-on-gst-relief-shift-to-high-margin-products/articleshow/130429522.cms,2026-04-22 00:55:01 IST,"India’s life insurance industry recorded a 16% rise in new business premiums to ₹4.59 lakh crore in FY26, driven by GST exemption benefits, stronger demand for regular premium policies, and a strategic shift towards higher-margin protection and long-term savings products.",https://economictimes.indiatimes.com/markets/stocks/rssfeeds/2146843.cms
"Income Tax dept seeks details from NRIs, offshore firms on unlisted share deals, flags valuation and fund source concerns",https://economictimes.indiatimes.com/markets/stocks/news/income-tax-dept-seeks-details-from-nris-offshore-firms-on-unlisted-share-deals-flags-valuation-and-fund-source-concerns/articleshow/130429525.cms,2026-04-22 00:43:57 IST,"India’s tax department has asked NRIs and offshore entities to justify investments in unlisted shares, seeking details on fund sources and valuations. Using demat data, authorities are probing deals from 2019–23 for potential tax evasion, round-tripping and money laundering, with non-compliance likely to trigger scrutiny, tax demands and litigation.",https://economictimes.indiatimes.com/markets/stocks/rssfeeds/2146843.cms
HDFC Life approves Vibha Padalkar's re-appointment as CEO &amp; Managing Director,https://economictimes.indiatimes.com/markets/stocks/news/hdfc-life-approves-vibha-padalkars-re-appointment-as-ceo-managing-director/articleshow/130429533.cms,2026-04-21 20:25:43 IST,"HDFC Life's board has approved Vibha Padalkar's reappointment as Managing Director and Chief Executive Officer. This new term will begin on September 12, 2026, and will last for five years. Shareholder and regulatory approvals are still pending. This decision ensures leadership continuity for the company. Padalkar has not faced any debarment from regulatory authorities.",https://economictimes.indiatimes.com/markets/stocks/rssfeeds/2146843.cms
"RBI brings cross border transactions under e-mandate rules, allows customer to opt out anytime",https://economictimes.indiatimes.com/markets/stocks/news/rbi-brings-cross-border-transactions-under-e-mandate-rules-allows-customer-to-opt-out-anytime/articleshow/130429398.cms,2026-04-21 18:49:21 IST,"The Reserve Bank of India is enhancing digital fraud prevention. Cross-border recurring electronic payments via cards, prepaid instruments, and UPI are now under E-mandate rules. Customers can opt-out of transactions or mandates. Limits are set for recurring payments. Pre-transaction notifications are mandatory for most debits. These rules aim to protect customers and ensure secure electronic transactions across borders.",https://economictimes.indiatimes.com/markets/stocks/rssfeeds/2146843.cms
"Buy or sell: Gift Nifty signals gap-down opening, Vaishali Parekh recommends three stocks to buy today — 22 April 2026",https://www.livemint.com/market/stock-market-news/buy-or-sell-gift-nifty-signals-gap-down-opening-vaishali-parekh-recommends-three-stocks-to-buy-today-22-april-2026-11776821062862.html,2026-04-22 07:25:48 IST,"Buy or sell stocks, 22 April 2026: Vaishali Parekh recommends three stocks to buy today — Manappuram Finance, Fortis Healthcare, and Bajaj Finance",https://www.livemint.com/rss/markets
"Nifty 50, Sensex prediction today: Check how Indian stock market is expected to trade on 22 April",https://www.livemint.com/market/stock-market-news/nifty-50-sensex-prediction-today-check-how-indian-stock-market-is-expected-to-trade-on-22-april-11776822116178.html,2026-04-22 07:22:32 IST,"Nifty 50, Sensex prediction today: The trends on Gift Nifty also indicate a negative start for the Indian benchmark index. The Gift Nifty was trading around 24,430 level, a discount of nearly 154 points from the Nifty futures’ previous close.",https://www.livemint.com/rss/markets
"From Gift Nifty, US-Iran ceasefire to HCL Tech Q4 results: 10 key things that changed for Indian stock market overnight",https://www.livemint.com/market/stock-market-news/from-gift-nifty-us-iran-ceasefire-to-hcl-tech-q4-results-10-key-things-that-changed-for-indian-stock-market-overnight-11776820949876.html,2026-04-22 07:02:13 IST,"Gift Nifty was trading around 24,421 level, a discount of nearly 163 points from the Nifty futures’ previous close, indicating a negative start for the Indian stock market indices.",https://www.livemint.com/rss/markets
Breakout stocks to buy or sell: Sumeet Bagadia recommends five shares to buy today - 22 April 2026,https://www.livemint.com/market/stock-market-news/breakout-stocks-to-buy-or-sell-sumeet-bagadia-recommends-five-shares-to-buy-today-22-april-2026-11776818713131.html,2026-04-22 06:38:10 IST,The Indian stock market ended Monday's session with nominal gains. Sumeet Bagadia of Choice Broking recommends five breakout stocks to buy today.,https://www.livemint.com/rss/markets
Groww’s stock valuation needs consistent growth to back it up,https://www.livemint.com/market/mark-to-market/groww-stock-valuation-future-growth-investment-outlook-analysis-11776769516060.html,2026-04-22 06:31:00 IST,It will be important to track how Groww’s new segments scale over time.&amp;nbsp;,https://www.livemint.com/rss/markets
"Bond blues: Rising yields, market shifts derail corporate debt funding in FY26",https://www.livemint.com/market/bonds/bond-markets-india-bond-yields-corporate-debt-funding-fy26-11776764030752.html,2026-04-22 06:15:40 IST,"For corporate bond funding, market participants expect a subdued outlook for FY27.",https://www.livemint.com/rss/markets
Stocks to trade: Raja Venkatraman recommends three stocks for 22 April,https://www.livemint.com/market/stock-market-news/stocks-to-trade-raja-venkatraman-three-stocks-for-22-april-sensex-nifty-11776783966787.html,2026-04-22 06:00:40 IST,Market expert Raja Venkatraman shares his top stock picks for 22 April. Here’s his technical outlook and trade strategy.,https://www.livemint.com/rss/markets
Stock recommendations for 22 April from MarketSmith India,https://www.livemint.com/market/stock-market-news/stock-recommendations-22-april-top-stock-picks-marketsmith-india-11776787414049.html,2026-04-22 06:00:20 IST,"MarketSmith India reveals its top stock recommendations for today, 22 April. Get expert insights into the best-performing stocks to guide your investment decisions.",https://www.livemint.com/rss/markets
"War Pushes Japan Equity Fund Into Cash, Eyes Re-Entry in Banks",https://www.livemint.com/market/war-pushes-japan-equity-fund-into-cash-eyes-re-entry-in-banks-11776817113315.html,2026-04-22 05:48:32 IST,"A top-performing Japan equity fund has cut exposure to cyclical stocks and increased cash levels amid heightened uncertainty surrounding the Iran war, and is now waiting for the moment to get back into bank and industrial shares.",https://www.livemint.com/rss/markets
"ASML layoff: Europe's chip giant to cut 1,700 jobs — these roles face the biggest risk",https://www.livemint.com/companies/news/asml-layoff-europes-chip-giant-to-cut-1-700-jobs-these-roles-face-the-biggest-risk-11776818966669.html,2026-04-22 07:33:26 IST,"ASML plans to cut various management roles and reduce complexity as part of a reorganization affecting 1,700 jobs. Details of the layoff here.",https://www.livemint.com/rss/companies
Why India’s college incubators have little to show for a decade of govt push,https://www.livemint.com/companies/start-ups/india-college-incubators-startup-innovation-hubs-performance-government-push-11776650663072.html,2026-04-22 06:00:40 IST,"Private and independent universities have capital to deploy, but experts say the issue lies in how it is allocated and whether it is directed towards the right areas.",https://www.livemint.com/rss/companies
Borzo eyes B2B push as quick commerce war heats up,https://www.livemint.com/companies/news/borzo-eyes-b2b-push-quick-commerce-war-heats-up-intracity-delivery-platform-11776750126812.html,2026-04-22 06:00:20 IST,"With India contributing the bulk of its volumes, the intracity delivery platform is shifting towards enterprise clients and tighter unit economics as competition moves beyond speed.",https://www.livemint.com/rss/companies
"Axis Trustee wants a seat at the risk table, not the sidelines",https://www.livemint.com/companies/axis-trustee-services-axis-bank-trustee-services-industry-india-finances-banking-investors-11776759424029.html,2026-04-22 05:40:39 IST,Axis Bank Trustee Services chief executive Rahul Choudhary said the role of the trustee should entail ensuring the right clauses are included in the agreement and that the asset is closely monitored throughout.,https://www.livemint.com/rss/companies
"SpaceX says partnering with Cursor, option to buy AI startup for $60 billion in high-stakes pre-IPO move",https://www.livemint.com/companies/news/spacex-says-partnering-with-cursor-option-to-buy-ai-startup-for-60-billion-in-high-stakes-pre-ipo-move-11776813719593.html,2026-04-22 05:23:04 IST,"SpaceX said it has an agreement with AI coding startup Cursor, securing an option to acquire the firm for $60 billion or invest $10 billion in a joint venture, as Elon Musk pushes to dominate the AI coding race ahead of a record IPO.",https://www.livemint.com/rss/companies
"Social Security payout today: Benefits jump by up to $1,000 for some recipients — who qualifies?",https://www.livemint.com/money/personal-finance/social-security-payout-today-benefits-jump-by-up-to-1-000-for-some-recipients-who-qualifies-11776817456972.html,2026-04-22 06:33:19 IST,The repeal of the Windfall Elimination Provision and Government Pension Offset aims to assist those previously affected by these reductions.,https://www.livemint.com/rss/money
