title,link,published,summary,source
Asian stocks gain as hopes for year-end rally grow,https://economictimes.indiatimes.com/markets/stocks/news/asian-stocks-gain-as-hopes-for-year-end-rally-grow/articleshow/126112207.cms,2025-12-22 06:21:48 IST,"Asian equities opened higher, mirroring gains in US stocks and fueling hopes for a year-end rally. Investors are closely watching China's loan prime rates and upcoming economic data from the UK, US, and Japan for clues on central bank policy. Meanwhile, oil prices climbed amid US actions in Venezuela, and Bitcoin and silver saw modest gains.",https://economictimes.indiatimes.com/markets/stocks/rssfeeds/2146843.cms
Pre-market action: Here's the trade setup for today's session,https://economictimes.indiatimes.com/markets/stocks/news/pre-market-action-heres-the-trade-setup-for-todays-session/articleshow/126106876.cms,2025-12-22 06:11:00 IST,"Indian markets closed last week with small losses. Mixed economic data, a weaker rupee, and uncertainty about a trade deal with the US kept investors cautious. The upcoming week is shortened by the Christmas holiday. Trading volumes may be low. A Santa rally is possible, potentially pushing the Nifty higher. Foreign investors bought shares.",https://economictimes.indiatimes.com/markets/stocks/rssfeeds/2146843.cms
"Stocks in news: Infosys, Fortis Healthcare, Kotak Bank, SBI, Maruti Suzuki",https://economictimes.indiatimes.com/markets/stocks/news/stocks-in-news-infosys-fortis-healthcare-kotak-bank-sbi-maruti-suzuki/articleshow/126106840.cms,2025-12-22 06:11:00 IST,"Markets rebounded on Friday, tracking global cues, with Nifty reclaiming its 20-DEMA. Analysts advise a stock-specific approach, favoring banking, IT, auto, and metals. Key stocks in focus include Infosys, Fortis Healthcare, Kotak Bank, SBI, and Maruti Suzuki due to various developments.",https://economictimes.indiatimes.com/markets/stocks/rssfeeds/2146843.cms
"Will weddings, travel drive India's hotel sector to new heights in H2 FY26?",https://economictimes.indiatimes.com/markets/stocks/news/will-weddings-travel-drive-indias-hotel-sector-to-new-heights-in-h2-fy26/articleshow/126112153.cms,2025-12-22 06:06:45 IST,"India's hotel sector anticipates a strong rebound in the latter half of the fiscal year. Average room rates are expected to drive growth, with revenue per available room projected to increase. Key hotel stocks like Chalet Hotels, Indian Hotels, and Lemon Tree Hotels show promising upside. Major events and conferences will boost demand, particularly in cities like Mumbai.",https://economictimes.indiatimes.com/markets/stocks/rssfeeds/2146843.cms
1Point1 Solutions to acquire Costa Rica BPM firm Netcom,https://economictimes.indiatimes.com/markets/stocks/news/1point1-solutions-to-acquire-costa-rica-bpm-firm-netcom/articleshow/126112133.cms,2025-12-22 05:59:50 IST,"1Point1 Solutions is set to acquire Costa Rica-based Netcom Business Contact Center for approximately ₹300 crore by March 2026. This strategic move aims to nearly double 1Point1's FY27 revenue, expand its AI-driven BPM services into the Americas, and enhance its domain expertise in financial services.",https://economictimes.indiatimes.com/markets/stocks/rssfeeds/2146843.cms
"Nifty to get support from rupee strength, FII inflows",https://economictimes.indiatimes.com/markets/stocks/news/nifty-to-get-support-from-rupee-strength-fii-inflows/articleshow/126112106.cms,2025-12-22 05:53:11 IST,"Nifty's near-term outlook is cautiously positive. Improving technical signals, a stronger rupee, and renewed foreign investor buying are supporting the market. While resistance at 26,000 is a key level, a breakout could lead to further gains. Traders can consider buying Nifty around the current price with a stop loss below 25,700 for potential upside.",https://economictimes.indiatimes.com/markets/stocks/rssfeeds/2146843.cms
Budget 2026: Private capex likely to gather steam next year,https://economictimes.indiatimes.com/markets/stocks/news/budget-2026-private-capex-likely-to-gather-steam-next-year/articleshow/126112170.cms,2025-12-22 05:30:00 IST,"Private investment is projected to surge in 2026, fueled by robust domestic consumption, reduced GST, government reforms, and favorable economic conditions like soft inflation and low interest rates. Continued government capital expenditure is expected to further stimulate private sector growth, particularly in consumer-focused segments.",https://economictimes.indiatimes.com/markets/stocks/rssfeeds/2146843.cms
Stock Radar: Ramco Cements breaks out from falling trendline resistance; check target &amp; stop loss,https://economictimes.indiatimes.com/markets/stocks/news/stock-radar-ramco-cements-breaks-out-from-falling-trendline-resistance-check-target-stop-loss/articleshow/126074477.cms,2025-12-22 05:00:00 IST,"Ramco Cements stock has broken above a key resistance level. Experts suggest short-term traders can buy the stock for a target above Rs 1,100 in the coming weeks. The stock has shown strong support near its 200-day moving average. Technical indicators signal a bullish trend, indicating potential for further gains.",https://economictimes.indiatimes.com/markets/stocks/rssfeeds/2146843.cms
Credit weighs less on cards with RBI tightening norms,https://economictimes.indiatimes.com/markets/stocks/news/credit-weighs-less-on-cards-with-rbi-tightening-norms/articleshow/126112122.cms,2025-12-22 00:21:45 IST,"Credit card outstandings, despite fewer delinquencies, fell to 4.7% of total retail loans in October 2025, from 5% a year earlier, Reserve Bank of India (RBI) data showed. Growth in outstanding credit card balances within total retail loans slowed sharply to 7.7% in October 2025, from 16.9% a year earlier.",https://economictimes.indiatimes.com/markets/stocks/rssfeeds/2146843.cms
Buy or sell: Vaishali Parekh recommends three intraday stocks to buy today — 22 December 2025,https://www.livemint.com/market/stock-market-news/buy-or-sell-vaishali-parekh-recommends-three-intraday-stocks-to-buy-today-22-december-2025-11766366100874.html,2025-12-22 06:52:47 IST,"Buy or sell: Vaishali Parekh recommends three intraday stocks to buy today — Syrma SGS Technology, Belrise Industries, Torrent Power",https://www.livemint.com/rss/markets
"Nifty 50, Sensex today: What to expect from Indian stock market in trade on December 22",https://www.livemint.com/market/stock-market-news/nifty-50-sensex-today-what-to-expect-from-indian-stock-market-in-trade-on-december-22-11766322364691.html,2025-12-22 06:43:31 IST,"The benchmark index Nifty 50 is entering a critical phase, with investors looking ahead to the next directional cue amid mixed technical signals, say analysts.",https://www.livemint.com/rss/markets
Breakout stocks to buy or sell: Sumeet Bagadia recommends five shares to buy today — 22 December 2025,https://www.livemint.com/market/stock-market-news/breakout-stocks-to-buy-or-sell-sumeet-bagadia-recommends-five-shares-to-buy-today-22-december-2025-11766364880683.html,2025-12-22 06:39:44 IST,"Breakout stocks to buy or sell: Sumeet Bagadia recommends five shares to buy today - Coromandel International, Lumax AutoTechnologies, Hexaware Technologies, Strides Pharma Science, and Sai Life Sciences.",https://www.livemint.com/rss/markets
Shriram Finance: MUFG could soon be in driver's seat,https://www.livemint.com/market/mark-to-market/shriram-finance-mufg-drivers-seat-nbfcs-banks-assets-deposits-transactiobs-11766308732081.html,2025-12-22 06:01:12 IST,"The deal leverages Shriram’s unique ownership structure, which allows for potential future management control, and its superior return on assets compared to traditional banks.",https://www.livemint.com/rss/markets
Stocks to buy: Raja Venkatraman's top picks for 22 December,https://www.livemint.com/market/stock-market-news/stocks-to-buy-raja-venkatramans-top-picks-22-december-sensex-nifty-outlook-trade-set-up-11766215336068.html,2025-12-22 06:00:52 IST,"Market expert Raja Venkatraman shares his top three stock picks to buy today, 22 December. Discover his exclusive picks and analysis to inform your investment strategy.",https://www.livemint.com/rss/markets
Three stocks to buy today: Ankush Bajaj's top recommendations for 22 December,https://www.livemint.com/market/stock-market-news/three-stocks-to-buy-today-ankush-bajaj-top-recommendations-22-december-sensex-nifty-outlook-trade-set-up-11766221680291.html,2025-12-22 06:00:52 IST,Market expert Ankush Bajaj recommends three stocks to buy on 22 December. Discover his exclusive picks and analysis to inform your investment strategy.,https://www.livemint.com/rss/markets
"Liquidity, not just rate cuts, holds the key to cooling Indian bond yields",https://www.livemint.com/market/bonds/liquidity-not-just-rate-cuts-holds-the-key-to-cooling-indian-bond-yields-11766300619399.html,2025-12-22 05:40:31 IST,"Market participants argue that without a durable infusion of&amp;nbsp; ₹2-2.5 trillion and structural shifts in bank balance sheets, the monetary easing cycle will fail to transmit to the broader economy.",https://www.livemint.com/rss/markets
Stock recommendations for 22 December from MarketSmith India,https://www.livemint.com/market/stock-market-news/stock-recommendations-22-december-marketsmith-india-11766148750472.html,2025-12-22 05:31:11 IST,"MarketSmith India reveals its top stock recommendations for today, 22 December. Get expert insights into the best-performing stocks to guide your investment decisions.",https://www.livemint.com/rss/markets
Aavishkaar Group looks to balance long-cycle carbon play with faster-return bets,https://www.livemint.com/companies/news/aavishkaar-group-looks-to-balance-long-cycle-carbon-play-with-faster-return-bets-11766301458775.html,2025-12-22 06:01:12 IST,Aavishkaar Group is recalibrating its climate investment strategy to balance long-term carbon sequestration projects with ‘faster-return’ climate-tech opportunities.,https://www.livemint.com/rss/companies
"Rivals list, but Kotak resists: The case against subsidiary IPOs",https://www.livemint.com/companies/rivals-list-but-kotak-resists-the-case-against-subsidiary-ipos-11766310650809.html,2025-12-22 06:00:32 IST,"Kotak Mahindra Bank is the holding company that fully owns all 20 subsidiaries of the financial services group. But unlike peers such as ICICI Bank and HDFC, Kotak CEO Ashok Vaswani sees little value in taking subsidiaries public. Here's why",https://www.livemint.com/rss/companies
"My goal is to build a younger, leaner, hungrier kind of Kotak: Ashok Vaswani",https://www.livemint.com/companies/my-goal-is-to-build-a-younger-leaner-hungrier-kind-of-kotak-ashok-vaswani-11766310970700.html,2025-12-22 05:50:52 IST,"As MD and CEO Ashok Vaswani enters his third year at the helm of Kotak Mahindra Bank, the veteran banker is shifting gears from crisis management to aggressive modernization.",https://www.livemint.com/rss/companies
"Inside Flipkart’s OneTech: the stack powering IPO readiness, q-comm and AI",https://www.livemint.com/companies/news/flipkart-onetech-stack-powering-ipo-quick-commerce-ai-shifts-domicile-fraud-detection-warehouse-automation-fintech-11766309936379.html,2025-12-22 05:44:31 IST,"OneTech powers all of Flipkart's customer-facing products and services, while supporting internal business operations and corporate functions.",https://www.livemint.com/rss/companies
Hindustan Zinc shares in focus as silver hits fresh record high of $68. What’s next for investors?,https://economictimes.indiatimes.com/markets/stocks/news/hindustan-zinc-shares-in-focus-as-silver-hits-fresh-record-high-of-68-whats-next-for-investors/articleshow/126113395.cms,2025-12-22 08:48:44 IST,"Hindustan Zinc shares are set to gain attention as silver prices reach new peaks.  This surge, driven by supply and demand factors, is expected to boost the company's earnings significantly. Analysts are optimistic about future performance, projecting strong EPS growth.  Improved cost efficiency further supports this positive outlook for the mining giant.",https://economictimes.indiatimes.com/markets/stocks/rssfeeds/2146843.cms
Shriram Finance and 3 other stocks witness 5-year swing high breakout,https://economictimes.indiatimes.com/markets/stocks/news/shriram-finance-and-3-other-stocks-witness-5-year-swing-high-breakout/slideshow/126113443.cms,2025-12-22 08:48:35 IST,"Four Nifty500 stocks touched a 5-year swing high at the close on December 19, signalling strengthening bullish momentum. Such levels mark the highest prices over five years and often reflect sustained buying interest. While distinct from a long-term breakout, these moves may indicate potential continuation of the prevailing uptrend.",https://economictimes.indiatimes.com/markets/stocks/rssfeeds/2146843.cms
"Kaynes Technology among 5 stocks closing above VWAP, signalling bullish shift",https://economictimes.indiatimes.com/markets/stocks/news/kaynes-technology-among-5-stocks-closing-above-vwap-signalling-bullish-shift/slideshow/126113380.cms,2025-12-22 08:44:06 IST,"Five Nifty 500 stocks closed more than 1.5% above their VWAP on December 19, indicating strengthening intraday momentum. A close above VWAP suggests bullish sentiment, as prices finished higher than the volume-weighted average. Such moves are often tracked by traders to identify emerging upside trends and improving market confidence.",https://economictimes.indiatimes.com/markets/stocks/rssfeeds/2146843.cms
"Infosys shares in focus after ADRs jump 40%, Company clarifies no material events behind the surge",https://economictimes.indiatimes.com/markets/stocks/news/infosys-shares-in-focus-after-adrs-jump-40-company-clarifies-no-material-events-behind-the-surge/articleshow/126113250.cms,2025-12-22 08:38:15 IST,"Infosys shares are in focus after sharp volatility in its ADRs on the NYSE, driven by heavy trading volumes and sector-wide optimism. The company clarified there were no material developments behind the move. The rally followed strong Accenture results, reinforcing positive sentiment around Indian IT stocks and near-term sector momentum.",https://economictimes.indiatimes.com/markets/stocks/rssfeeds/2146843.cms
RITES shares in focus on signing MoU with Botswana Government to modernise transport infrastructure,https://economictimes.indiatimes.com/markets/stocks/news/rites-shares-in-focus-on-signing-mou-with-botswana-government-to-modernise-transport-infrastructure/articleshow/126113144.cms,2025-12-22 08:30:06 IST,RITES shares are expected to gain attention. The company signed a Memorandum of Understanding with the Republic of Botswana. This agreement aims to develop and modernize Botswana's railway and transport infrastructure. RITES will provide technical expertise for upgrading transport systems. The collaboration includes rolling stock supply and workshop modernization. Broader infrastructure projects are also part of the plan.,https://economictimes.indiatimes.com/markets/stocks/rssfeeds/2146843.cms
"Varun Beverages shares in focus on approving Rs 1,119 crore Twizza acquisition, Citi expects 44% upside",https://economictimes.indiatimes.com/markets/stocks/news/varun-beverages-shares-in-focus-on-approving-rs-1119-crore-twizza-acquisition-citi-expects-44-upside/articleshow/126113110.cms,2025-12-22 08:27:42 IST,"Varun Beverages will acquire South Africa's Twizza for over Rs 1,100 crore. This deal is set to boost Bevco's market reach in South Africa. Global brokerage Citi has responded positively, maintaining a 'Buy' rating and a target price of Rs 675. The acquisition is expected to be completed by June 2026.",https://economictimes.indiatimes.com/markets/stocks/rssfeeds/2146843.cms
"Shriram Finance shares in focus as brokerages raise target price after MUFG’s Rs 39,640-crore deal",https://economictimes.indiatimes.com/markets/stocks/news/shriram-finance-shares-in-focus-as-brokerages-raise-target-price-after-mufgs-rs-39640-crore-deal/articleshow/126113068.cms,2025-12-22 08:26:22 IST,"Shriram Finance shares are in focus following MUFG's 20% stake acquisition, the largest FDI in India's financial services. Brokerages are positive, citing the deal as an endorsement of the company's fundamentals and growth trajectory. Analysts have raised target prices and AUM growth assumptions, anticipating a significant boost to capital base and potential for rating upgrades.",https://economictimes.indiatimes.com/markets/stocks/rssfeeds/2146843.cms
"KPIT Technologies among 4 stocks flash bullish signals, indicating possible uptrend",https://economictimes.indiatimes.com/markets/stocks/news/kpit-technologies-among-4-stocks-flash-bullish-signals-indicating-possible-uptrend/slideshow/126113063.cms,2025-12-22 08:22:39 IST,"Four stocks from the Nifty200 universe featured in the White Marubozu bullish scan on December 19, reflecting strong buying interest. This candlestick pattern signals firm buyer control throughout the session and often indicates sustained momentum, suggesting a possible continuation of the upward trend as sentiment and price strength improve.",https://economictimes.indiatimes.com/markets/stocks/rssfeeds/2146843.cms
Cipla among 5 Nifty stocks showing bullish RSI upswing,https://economictimes.indiatimes.com/markets/stocks/news/cipla-among-5-nifty-stocks-showing-bullish-rsi-upswing/slideshow/126113017.cms,2025-12-22 08:18:31 IST,"Five Nifty stocks showed improving momentum on December 19 as their RSI readings moved above the 50 mark. This shift signals strengthening price action and early accumulation. Rising RSI levels often reflect a developing bullish bias, offering traders early cues of potential upside as sentiment and trend strength improve.",https://economictimes.indiatimes.com/markets/stocks/rssfeeds/2146843.cms
"Stocks to buy for 2026: Max Healthcare, Amber Enterprises among 4 stocks that could give 20-40% return in 1 year",https://economictimes.indiatimes.com/markets/stocks/news/stocks-to-buy-for-2026-max-healthcare-amber-enterprises-among-4-stocks-that-could-give-20-40-return-in-1-year/slideshow/126112778.cms,2025-12-22 08:02:04 IST,We have collated a list of recommendations from top brokerage firms from ETNow and other sources.,https://economictimes.indiatimes.com/markets/stocks/rssfeeds/2146843.cms
Neptune Logitek shares to list today. Check GMP ahead of debut,https://economictimes.indiatimes.com/markets/stocks/news/neptune-logitek-shares-to-list-today-check-gmp-ahead-of-debut/articleshow/126112625.cms,2025-12-22 07:47:15 IST,Neptune Logitek's stock will list on December 22. Grey market indicators suggest a flat debut. The company's Rs 46.62 crore IPO was subscribed 1.61 times. Neptune Logitek provides integrated logistics solutions. Proceeds will fund truck purchases and debt repayment. Investor sentiment in the SME space remains cautious.,https://economictimes.indiatimes.com/markets/stocks/rssfeeds/2146843.cms
Positive Breakout: These 11 stocks cross above their 200 DMAs,https://economictimes.indiatimes.com/markets/stocks/news/positive-breakout-these-11-stocks-cross-above-their-200-dmas/slideshow/126112618.cms,2025-12-22 07:40:16 IST,"As long as the stock is priced above the 200-day SMA on the daily time frame, it is generally considered to be an overall uptrend.",https://economictimes.indiatimes.com/markets/stocks/rssfeeds/2146843.cms
IndiGo shares in focus as firm enters Sensex today; replaces Tata Motors PV,https://economictimes.indiatimes.com/markets/stocks/news/indigo-shares-in-focus-as-firm-enters-sensex-today-replaces-tata-motors-pv/articleshow/126112577.cms,2025-12-22 07:38:19 IST,"IndiGo joins the Sensex on December 22, replacing Tata Motors Passenger Vehicles. This comes amidst significant flight cancellations due to new duty rules, impacting operations and leading to brokerages cutting target prices. The airline reported a substantial quarterly loss, though revenue saw a year-on-year increase. Despite recent challenges, shares remain up year-to-date.",https://economictimes.indiatimes.com/markets/stocks/rssfeeds/2146843.cms
"IPO lock-in: Anand Rathi, Jaro Institute among 16 companies to free up for trade this week; check full list",https://www.livemint.com/market/stock-market-news/ipo-lock-in-anand-rathi-jaro-institute-among-16-companies-to-free-up-for-trade-this-week-check-full-list-11766373787680.html,2025-12-22 09:04:37 IST,"Shares of 16 companies, with a combined valuation exceeding  ₹11,900 crore, will free up for trade this shortened week as their shareholder lock-in periods expire, according to Nuvama Alternative.",https://www.livemint.com/rss/markets
Domestic stock market fund raising remains strong in FY26; 83 companies raise  ₹1.3 lakh crore till Nov: NSE report,https://www.livemint.com/market/ipo/domestic-stock-market-fund-raising-remains-strong-in-fy26-83-companies-raise-rs-1-3-lakh-crore-till-nov-nse-report-11766374471407.html,2025-12-22 09:04:31 IST,"Fund mobilisation in the domestic stock market remained strong in the current financial year, with 83 companies raising  ₹1.3 lakh crore as of November in FY26, according to a report released by the National Stock Exchange (NSE).",https://www.livemint.com/rss/markets
"Gujarat Kidney IPO opens today: Check GMP, subscription status, and price band, other details - Should you buy?",https://www.livemint.com/market/ipo/gujarat-kidney-ipo-check-gmp-subscription-status-and-price-band-other-details-should-you-buy-11766373608583.html,2025-12-22 09:04:02 IST,"Gujarat Kidney &amp;amp; Super Speciality's IPO opens on December 22, aiming to raise  ₹250.80 crore. The price band is set at  ₹108-114 per share, with shares expected to list on December 30, 2025. The company plans to invest in new hospitals and acquisitions.",https://www.livemint.com/rss/markets
Indian stock markets set for higher opening as hopes of India-US trade deal rise,https://www.livemint.com/market/stock-market-news/indian-stock-markets-nifty-50-prediction-sensex-today-india-us-trade-deal-fpis-11766372835190.html,2025-12-22 08:58:28 IST,Nifty 50 prediction: Rising investor hopes of an India-US trade deal and the sharp rebound in the rupee may push stock markets higher,https://www.livemint.com/rss/markets
"Nilesh Shah of Kotak AMC on 2026 stock market outlook, mid, small-caps, Indian rupee, Budget 2026 expectations and more",https://www.livemint.com/market/stock-market-news/nilesh-shah-of-kotak-amc-on-2026-stock-market-outlook-mid-small-caps-indian-rupee-budget-2026-expectations-and-more-11766371929009.html,2025-12-22 08:51:38 IST,"Nilesh Shah of Kotak AMC shares his outlook on India's stock market for 2026, addressing FII selling trends, the potential of mid and small-caps, and innovative fiscal solutions for Budget 2026, including monetising household gold and silver to bolster government resources.",https://www.livemint.com/rss/markets
Rupee set to slip after RBIs double strike fuelled biggest rally in six months,https://www.livemint.com/market/stock-market-news/rupee-set-to-slip-after-rbis-double-strike-fuelled-biggest-rally-in-six-months-11766372240235.html,2025-12-22 08:27:19 IST,INDIA-MARKETS/RUPEE:INDIA RUPEE-Rupee set to slip after RBI's double strike fuelled biggest rally in six months,https://www.livemint.com/rss/markets
"Stocks to buy for short term: Nifty eyes 26,325, says Angel One’s Osho Krishan, lists 2 stocks to buy this week",https://www.livemint.com/market/stock-market-news/stocks-to-buy-for-short-term-nifty-50-eyes-26-325-says-angel-one-s-osho-krishan-lists-2-stocks-to-buy-this-week-11766332938455.html,2025-12-22 08:14:08 IST,"Indian stock markets closed last week with minor losses due to mixed macro data and a falling rupee. Despite selling pressure, a recovery in the final session limited the decline. Key levels for Nifty and Sensex remain critical, indicating potential for a rebound.",https://www.livemint.com/rss/markets
Stock market today: Trade setup for Nifty 50 to VIX India; eight stocks to buy or sell on Monday — 22 December 2025,https://www.livemint.com/market/stock-market-news/stock-market-today-trade-setup-for-nifty-50-to-vix-india-eight-stocks-to-buy-or-sell-on-monday-22-december-2025-11766369243367.html,2025-12-22 07:49:52 IST,"Stock market today: Experts have recommended eight shares to buy today —JK Tyre, Laurus Labs, ICICI Bank, Sun Pharma, HCL Technologies, Kaynes Technology, TD Power Systems, BEML",https://www.livemint.com/rss/markets
Stocks to buy for short term: Jigar Patel of Anand Rathi suggests these 3 shares with bullish technical indicators,https://www.livemint.com/market/stock-market-news/stocks-to-buy-for-short-term-jigar-patel-of-anand-rathi-suggests-these-3-shares-ceat-endurance-tech-shyam-metalics-11766317495427.html,2025-12-22 07:30:15 IST,"Stocks to buy for short term: Jigar Patel of Anand Rathi recommends buying three shares, including CEAT and Endurance Technologies, for short-term gains. Each stock shows signs of stabilisation and potential reversals.",https://www.livemint.com/rss/markets
"Zen Technologies: When the theme is hot, but the numbers are not",https://www.livemint.com/market/stock-market-news/zen-technologies-when-the-theme-is-hot-but-the-numbers-are-not-11766307771360.html,2025-12-22 07:30:14 IST,"Zen Technologies sits at the intersection of India’s defence and drone boom, but shrinking order books, slowing execution and stretched working capital raise questions about near-term earnings momentum.",https://www.livemint.com/rss/markets
"Stocks to watch: Tata Steel, Infosys, Indian Hotels, Kotak Bank among 10 shares in focus today; Check list here",https://www.livemint.com/market/stock-market-news/stocks-to-watch-tata-steel-infosys-indian-hotels-kotak-bank-among-10-shares-in-focus-today-check-list-here-11766366256406.html,2025-12-22 07:20:40 IST,"Stocks to watch: Tata Steel, Infosys, Indian Hotels, Kotak Bank are some of the stocks that will remain in focus on Monday, 22 December 2025.",https://www.livemint.com/rss/markets
