title,link,published,summary,source
"Health fund and health insurance: What's the difference, why you may need both and how to save…",https://www.livemint.com/money/personal-finance/health-fund-and-health-insurance-difference-medical-needs-emergency-how-savings-account-bank-deposit-why-need-both-11778513117026.html,2026-05-11 21:41:04 IST,"Every individual has to budget and save for possible medical and health related expenses. Here is the difference between a health fund and health insurance, why you may need both and how much to save…",https://www.livemint.com/rss/money
I asked ChatGPT: How can I make my kids more financially aware? AI gives me 10 money hacks,https://www.livemint.com/money/personal-finance/i-asked-chatgpt-how-can-i-make-my-kids-more-financially-aware-ai-gives-me-10-money-hacks-11778513398044.html,2026-05-11 21:06:09 IST,"Teaching children about money is best done through intentional behaviour and practical systems. ChatGPT recommends clear allocation methods, experiences financial consequences, and encourages emotional connections to saving.&amp;nbsp;",https://www.livemint.com/rss/money
"Post office savings: Can  ₹10 lakh FD and  ₹10,000 RD create  ₹1 crore in 20 yrs? Check how inflation impacts returns",https://www.livemint.com/money/personal-finance/can-post-office-10-lakh-fd-7-5-10-000-rd-6-7-create-1-crore-in-20-yrs-check-how-inflation-impacts-return-11778505654707.html,2026-05-11 20:48:43 IST,"A  ₹10 lakh post office FD earning 7.5% and a  ₹10,000 monthly recurring deposit earning 6.7% can grow into a corpus close to  ₹1 crore over 20 years through compounding. However, inflation may significantly reduce the real value of these returns, making long-term planning and diversification crucial.",https://www.livemint.com/rss/money
Sharing your credit card with friends and family could land you in trouble with the Income-Tax department — Here's why,https://www.livemint.com/money/personal-finance/sharing-your-credit-card-with-friends-and-family-could-land-you-in-trouble-with-the-income-tax-department-heres-why-11778506118755.html,2026-05-11 20:23:11 IST,"Avoid sharing credit card with friends, family. If your reported income is not sufficient to pay back your credit card debt, or your expenditures far exceed your income capacity, it may trigger a notice from the authorities.",https://www.livemint.com/rss/money
JPMorgan Chase-led bank group reins in credit line to troubled KKR private credit fund as losses mount,https://www.cnbc.com/2026/05/11/kkr-private-credit-fund-fsk-jpmorgan-chase-credit.html,2026-05-11 21:52:36 IST,"The KKR fund, often referred to by its ticker, FSK, has become one of the most visible fault lines in the private credit story.",https://www.cnbc.com/id/10000664/device/rss/rss.html
Michael Burry is not a believer: 'For any stocks going parabolic reduce positions almost entirely',https://www.cnbc.com/2026/05/11/michael-burry-is-not-a-believer-for-any-stocks-going-parabolic-reduce-positions-almost-entirely.html,2026-05-11 21:38:00 IST,"Michael Burry said investors should ""reject greed"" as enthusiasm around artificial intelligence and momentum-driven trades pushes valuations sharply higher.",https://www.cnbc.com/id/10000664/device/rss/rss.html
