title,link,published,summary,source
"Stock Radar: After a 24% correction, Max Healthcare breaks key resistance level; analysts see long-term potential",https://economictimes.indiatimes.com/markets/stocks/news/stock-radar-after-a-24-correction-max-healthcare-breaks-key-resistance-level-analysts-see-long-term-potential/articleshow/131388273.cms,2026-06-01 05:00:00 IST,"Max Healthcare Institute Ltd. has broken out of a descending trendline resistance on daily charts, signaling a potential shift in momentum. Experts suggest long-term investors with a high-risk profile consider buying the stock, targeting Rs 1,400 in the next 12 months, with a stop loss at Rs 850.",https://economictimes.indiatimes.com/markets/stocks/rssfeeds/2146843.cms
Markets set for bounce after Friday's one-off fall,https://www.livemint.com/market/stock-market-news/markets-set-for-bounce-after-fridays-one-off-fall-nse-hfts-11780208441775.html,2026-06-01 05:30:30 IST,"Sharp decline attributed to index rebalancing trade &amp;nbsp;rather than any fundamental change by analysts . Sustainability of bounce , though, would hinge on geopolitical events&amp;nbsp;",https://www.livemint.com/rss/markets
"In a likely sign of the times, RIL's new hires down by 90k in FY26",https://www.livemint.com/companies/ril-hiring-hr-attrition-recruitment-ai-11780210285270.html,2026-06-01 05:35:30 IST,"Reliance Industries' hiring in FY26 is likely to have been 90,000 lower, signalling a broader shift at large companies towards AI-led productivity, upskilling and leaner teams. While the overall headcount continues to grow, recruiters expect hiring across corporate India to become more selective.",https://www.livemint.com/rss/companies
"Infosys, Tech Mahindra, TCS and other IT stocks jump up to 5%. What’s driving the rally?",https://economictimes.indiatimes.com/markets/stocks/news/infosys-tech-mahindra-tcs-and-other-it-stocks-jump-up-to-5-whats-driving-the-rally/articleshow/131434944.cms,2026-06-01 11:11:40 IST,"Indian IT stocks rose sharply on Monday, lifting the Nifty IT index nearly 3%, as investors reassessed AI-related fears, attracted by attractive valuations and upbeat sector outlooks. Optimism around potential US rate cuts and positive technical signals further fuelled buying in Infosys, Tech Mahindra, TCS and other IT majors.",https://economictimes.indiatimes.com/markets/stocks/rssfeeds/2146843.cms
SoftBank overtakes Toyota as Japan's most valuable company,https://economictimes.indiatimes.com/markets/stocks/news/softbank-overtakes-toyota-as-japans-most-valuable-company/articleshow/131434732.cms,2026-06-01 10:51:08 IST,"Fueled by its significant stake in AI powerhouse OpenAI, SoftBank Group has surged past Toyota to become Japan's most valuable company. The tech investor's market capitalization soared following founder Masayoshi Son's announcement of a massive 75-billion-euro investment in French AI infrastructure, underscoring the booming demand for artificial intelligence technology.",https://economictimes.indiatimes.com/markets/stocks/rssfeeds/2146843.cms
NMDC Steel shares jump 18% to 52-week high after return to profit in Q4 and FY26,https://economictimes.indiatimes.com/markets/stocks/news/nmdc-steel-shares-jump-18-to-record-high-after-returning-to-profit-in-q4-fy26/articleshow/131434696.cms,2026-06-01 10:50:31 IST,"NMDC Steel shares surged nearly 18% to a 52-week high after reporting a significant turnaround in FY26 earnings. The company returned to profitability with a net profit of Rs 391.91 crore in Q4 FY26, a stark contrast to last year's loss. Revenue also saw substantial year-on-year growth, boosting investor confidence.",https://economictimes.indiatimes.com/markets/stocks/rssfeeds/2146843.cms
"Explained: Why Gokaldas Exports, KPR Mill and other textile stocks soared up to 8% on Monday",https://economictimes.indiatimes.com/markets/stocks/news/explained-why-gokaldas-exports-kpr-mill-and-other-textile-stocks-soared-up-to-8-on-monday/articleshow/131434489.cms,2026-06-01 10:35:14 IST,"Textile stocks such as Gokaldas Exports, KPR Mill, Vardhman Textiles and Trident rallied up to 8% after the government exempted cotton imports from customs duty for five months, effective June 1. The move, valid until October 30, is expected to improve raw material availability and lower input costs for textile and apparel manufacturers, particularly small and medium enterprises.",https://economictimes.indiatimes.com/markets/stocks/rssfeeds/2146843.cms
IREDA shares drop 4% post Q4 results. What’s spooking investors?,https://economictimes.indiatimes.com/markets/stocks/news/ireda-shares-drop-4-post-q4-results-whats-spooking-investors/articleshow/131434424.cms,2026-06-01 10:29:37 IST,"IREDA's shares fell over 4% after reporting a nearly 2% year-on-year drop in Q4 FY26 net profit to Rs 493 crore, despite a 14% revenue increase. The company also announced a final dividend of Rs 0.75 per share and is addressing fines from stock exchanges regarding board composition.",https://economictimes.indiatimes.com/markets/stocks/rssfeeds/2146843.cms
Acutaas Chemicals among 4 stocks that closed crossing above VWAP,https://economictimes.indiatimes.com/markets/stocks/news/acutaas-chemicals-among-4-stocks-that-closed-crossing-above-vwap/slideshow/131434336.cms,2026-06-01 10:19:12 IST,"Four Nifty500 stocks, Signatureglobal (India), Afcons Infrastructure, Aarti Industries and ACME Solar Holdings, closed over 1% above VWAP on May 29, signaling bullish momentum and strengthening positive market sentiment.​",https://economictimes.indiatimes.com/markets/stocks/rssfeeds/2146843.cms
"US Stock Market: Jobs data, AI earnings to test Wall Street rally amid inflation risks loom",https://economictimes.indiatimes.com/markets/stocks/news/us-stock-market-jobs-data-ai-earnings-to-test-wall-street-rally-amid-inflation-risks-loom/articleshow/131434157.cms,2026-06-01 10:15:56 IST,"Investors are closely watching the U.S. jobs report and Broadcom's earnings this week amid concerns that persistent inflation and potential interest rate hikes could derail the strong equity rally. While AI enthusiasm fueled recent gains, economic data and Fed policy expectations remain key drivers for market direction.",https://economictimes.indiatimes.com/markets/stocks/rssfeeds/2146843.cms
Asian Paints shares rally 4% after Q4 results. Here’s what Nomura and Motilal Oswal are saying,https://economictimes.indiatimes.com/markets/stocks/news/asian-paints-shares-rally-4-after-q4-results-heres-what-nomura-and-motilal-oswal-are-saying/articleshow/131434143.cms,2026-06-01 10:11:29 IST,"Asian Paints shares rose sharply after the company reported a 69% year-on-year jump in Q4FY26 profit and stronger margins. While Nomura reiterated its Buy call with a Rs 3,600 target price, Motilal Oswal maintained a Neutral stance, citing demand uncertainties despite raising earnings estimates and growth expectations.",https://economictimes.indiatimes.com/markets/stocks/rssfeeds/2146843.cms
NSE pre-IPO window to close soon with filing weeks away. Can buying unlisted shares now make you good money?,https://economictimes.indiatimes.com/markets/stocks/news/nse-pre-ipo-window-to-close-soon-with-filing-weeks-away-can-buying-unlisted-shares-now-make-you-good-money/articleshow/131433910.cms,2026-06-01 09:59:04 IST,"PSU banks achieved historic profit and NPA lows in FY26, yet analysts favor leading private banks for FY27. This shift is driven by superior earnings compounding potential and a more attractive risk-reward profile amid intensifying deposit pressures and global uncertainty.  While PSU banks' structural tailwinds have largely played out, private banks are better positioned for sustained growth.",https://economictimes.indiatimes.com/markets/stocks/rssfeeds/2146843.cms
PSU bank stocks vs private banks in FY27: The valuation trap you need to avoid,https://economictimes.indiatimes.com/markets/stocks/news/psu-bank-stocks-vs-private-banks-in-fy27-the-valuation-trap-you-need-to-avoid/articleshow/131433829.cms,2026-06-01 09:53:57 IST,"PSU banks achieved historic profit and NPA lows in FY26, yet analysts favor leading private banks for FY27. This shift is driven by superior earnings compounding potential and a more attractive risk-reward profile amid intensifying deposit pressures and global uncertainty.  While PSU banks' structural tailwinds have largely played out, private banks are better positioned for sustained growth.",https://economictimes.indiatimes.com/markets/stocks/rssfeeds/2146843.cms
Top Nifty50 stocks analysts suggest buying in this volatile week,https://economictimes.indiatimes.com/markets/stocks/news/top-nifty50-stocks-analysts-suggest-buying-in-this-volatile-week/articleshow/131433625.cms,2026-06-01 09:38:42 IST,"Stock Reports Plus, powered by Refinitiv, is a comprehensive report that evaluates five key components of 4,000+ listed stocks – earnings, fundamentals, relative valuation, risk, and price momentum – to generate standardised scores. The simple average of the above-mentioned five component ratings is normally distributed to reach an average score.",https://economictimes.indiatimes.com/markets/stocks/rssfeeds/2146843.cms
"IndiGo soars 5% after Q4 results. What Goldman Sachs, Jefferies and others are saying",https://economictimes.indiatimes.com/markets/stocks/news/indigo-soars-5-after-q4-results-what-goldman-sachs-jefferies-and-others-are-saying/articleshow/131433553.cms,2026-06-01 09:32:04 IST,"IndiGo's shares surged despite a Q4 FY26 net loss of Rs 2,536 crore, driven by Middle East conflict disruptions. Analysts remain largely positive, citing the airline's long-term growth strategy and India's strong domestic aviation demand, with several maintaining 'Buy' ratings and significant upside targets.",https://economictimes.indiatimes.com/markets/stocks/rssfeeds/2146843.cms
"Inox Wind shares crash 8% after Q4 profit drops 45% YoY. Should you buy, sell or hold?",https://economictimes.indiatimes.com/markets/stocks/news/inox-wind-shares-in-focus-after-q4-net-profit-drops-45-to-rs-106-crore-should-you-buy-sell-or-hold/articleshow/131433546.cms,2026-06-01 09:31:40 IST,"Inox Wind shares: The company reported a 45% year-on-year decline in consolidated net profit to Rs 105.68 crore for Q4 FY26, weighed down by lower revenue and higher expenses. Revenue from operations slipped over 2% to Rs 1,244 crore, while total expenses rose more than 5% to Rs 1,162 crore. Total income also edged lower to Rs 1,306 crore during the quarter.",https://economictimes.indiatimes.com/markets/stocks/rssfeeds/2146843.cms
"Sensex gains 400 points, Nifty above 23,600; IndiGo, Infosys, Asian Paints among top gainers",https://economictimes.indiatimes.com/markets/stocks/news/sensex-gains-430-points-nifty-opens-above-23650-indigo-infosys-asian-paints-among-top-gainers/articleshow/131433513.cms,2026-06-01 09:26:26 IST,"Indian stock markets bounced back on Monday. The Sensex and Nifty saw gains of 0.5 percent each. This recovery followed a significant drop in the previous trading session. IndiGo shares led the gains, surging over 4.5 percent after their Q4 results. Broader markets also opened positively, with midcap and smallcap indices rising.",https://economictimes.indiatimes.com/markets/stocks/rssfeeds/2146843.cms
PB Fintech shares in focus after founders sell stake worth Rs 665 crore in Policybazaar parent,https://economictimes.indiatimes.com/markets/stocks/news/pb-fintech-shares-in-focus-after-founders-sell-stake-worth-rs-665-crore-in-policybazaar-parent/articleshow/131433346.cms,2026-06-01 09:11:10 IST,PB Fintech founders sold shares worth Rs 665 crore. Yashish Dahiya and Alok Bansal offloaded stock on Friday. Major investors like Goldman Sachs and Morgan Stanley bought these shares. This follows previous stake sales by the founders. PB Fintech reported strong revenue and profit growth for the January-March quarter. The company's stock has seen significant fluctuations since its IPO.,https://economictimes.indiatimes.com/markets/stocks/rssfeeds/2146843.cms
Suzlon Energy shares fall over 2% after SEBI fines Rs 29 crore for misleading financial statements,https://economictimes.indiatimes.com/markets/stocks/news/suzlon-energy-shares-in-focus-after-sebi-fines-rs-29-crore-for-misleading-financial-statements/articleshow/131433189.cms,2026-06-01 08:51:48 IST,"Suzlon Energy shares 2% dipped after Sebi imposed nearly Rs 29 crore in penalties on the company and former executives for misrepresenting financial positions. The regulator found inflated profits and inadequate disclosures stemming from transactions involving subsidiaries, impacting the company's reported net worth and financial health.",https://economictimes.indiatimes.com/markets/stocks/rssfeeds/2146843.cms
Wockhardt shares rocket 19% after FDA approval for antibiotic targeting drug-resistant infections. Check details,https://economictimes.indiatimes.com/markets/stocks/news/wockhardt-shares-in-focus-after-fda-approval-for-antibiotic-targeting-drug-resistant-infections-check-details/articleshow/131433158.cms,2026-06-01 08:46:59 IST,"Wockhardt's shares surged 19% after the U.S. FDA approved ZAYNICH, a novel intravenous antibiotic for complicated urinary tract infections. The drug, combining cefepime and zidebactam, demonstrated superior efficacy over meropenem in a Phase 3 trial. This approval addresses the growing challenge of antimicrobial resistance.",https://economictimes.indiatimes.com/markets/stocks/rssfeeds/2146843.cms
"JSW Dulux among 4 stocks flashing bullish signals, hinting at a possible uptrend",https://economictimes.indiatimes.com/markets/stocks/news/jsw-dulux-among-4-stocks-flashing-bullish-signals-hinting-at-a-possible-uptrend/slideshow/131433095.cms,2026-06-01 08:41:08 IST,"Four Nifty500 stocks appeared on the White Marubozu bullish scanner on May 29, signalling strong buying momentum across select counters. The pattern reflects sustained bullish sentiment throughout the session, with buyers maintaining control from open to close, indicating potential continuation of upward momentum in the near term.",https://economictimes.indiatimes.com/markets/stocks/rssfeeds/2146843.cms
Tega Industries among 6 stocks showing bullish RSI upswing,https://economictimes.indiatimes.com/markets/stocks/news/tega-industries-among-6-stocks-showing-bullish-rsi-upswing/slideshow/131433000.cms,2026-06-01 08:32:56 IST,"On May 29, six Nifty500 stocks were highlighted in the RSI Trending Up scan based on data from StockEdge.com. The signal is triggered when RSI crosses above 50 from lower levels, indicating improving momentum. Rising RSI levels suggest strengthening price action and potential bullish continuation, often used by traders to identify possible buying opportunities.",https://economictimes.indiatimes.com/markets/stocks/rssfeeds/2146843.cms
MR Maniveni Foods shares to list today. Check GMP ahead of debut,https://economictimes.indiatimes.com/markets/stocks/news/mr-maniveni-foods-shares-to-list-today-check-gmp-ahead-of-debut/articleshow/131432193.cms,2026-06-01 07:35:29 IST,"MR Maniveni Foods shares are poised for their debut on the BSE SME platform this Monday. Grey market indicators suggest a flat listing, with shares trading near their issue price. The company's Rs 27 crore IPO saw strong anchor investor interest. MR Maniveni Foods specializes in pulse processing, supplying to business-to-business clients.",https://economictimes.indiatimes.com/markets/stocks/rssfeeds/2146843.cms
"Stocks to buy in 2026 for long term: Ashok Leyland, Syrma SGS among 5 stocks that could give 10-20% return",https://economictimes.indiatimes.com/markets/stocks/news/stocks-to-buy-in-2026-for-long-term-ashok-leyland-syrma-sgs-among-5-stocks-that-could-give-10-20-return/slideshow/131432129.cms,2026-06-01 07:23:55 IST,We have collated a list of recommendations from top brokerage firms from ETNow and other sources.,https://economictimes.indiatimes.com/markets/stocks/rssfeeds/2146843.cms
Trent nears record date for 1:2 bonus issue: Should you buy shares for bonus reward? Here’s what experts say,https://economictimes.indiatimes.com/markets/stocks/news/trent-nears-record-date-for-12-bonus-issue-should-you-buy-shares-for-bonus-reward-heres-what-experts-say/articleshow/131432081.cms,2026-06-01 07:22:50 IST,Trent's bonus share issue is approaching its record date of June 4. The company will issue one bonus share for every two held. Analysts suggest investors should not buy Trent shares solely for the bonus. Focus should remain on the company's growth and earnings potential. Trent's stock has seen a decline over the past year but shows strong long-term gains.,https://economictimes.indiatimes.com/markets/stocks/rssfeeds/2146843.cms
Negative Breakout: These 8 stocks cross below their 200 DMAs,https://economictimes.indiatimes.com/markets/stocks/news/negative-breakout-these-8-stocks-cross-below-their-200-dmas/slideshow/131432064.cms,2026-06-01 07:15:53 IST,The 200 DMA is used as a key indicator by traders for determining the overall trend in a particular stock.,https://economictimes.indiatimes.com/markets/stocks/rssfeeds/2146843.cms
Muted opening likely as GIFT Nifty hints at a cautious start for D-Street,https://economictimes.indiatimes.com/markets/stocks/news/pre-market-action-heres-the-trade-setup-for-todays-session/articleshow/131431797.cms,2026-06-01 06:44:24 IST,"Indian markets experienced a significant downturn on Friday, with the Nifty closing 1.5% lower due to broad-based profit booking and increased volatility from MSCI index rebalancing. Analysts anticipate range-bound movement next week, though mid and small-cap stocks may continue to outperform. Global sentiment saw some relief from a potential US-Iran ceasefire.",https://economictimes.indiatimes.com/markets/stocks/rssfeeds/2146843.cms
"Stocks in news: IndiGo, Suzlon Energy, Patanjali Foods, PB Fintech, Vedanta",https://economictimes.indiatimes.com/markets/stocks/news/stocks-in-news-indigo-suzlon-energy-patanjali-foods-pb-fintech-vedanta/articleshow/131431773.cms,2026-06-01 06:37:39 IST,"Markets experienced significant volatility on Friday, with indices falling in the final hour due to heavy institutional selling. Several companies like IndiGo, Suzlon Energy, and Patanjali Foods are in focus today. Vedanta received its highest domestic credit rating in over a decade.",https://economictimes.indiatimes.com/markets/stocks/rssfeeds/2146843.cms
Momentum in mid-&amp; small-caps to fuel fresh derivatives plays,https://economictimes.indiatimes.com/markets/stocks/news/momentum-in-mid-small-caps-to-fuel-fresh-derivatives-plays/articleshow/131431636.cms,2026-06-01 06:12:23 IST,"Mid and small-cap stocks are outperforming, driving activity in stock futures. Analysts highlight GE Vernova T&amp;D India, CAMS, Suzlon Energy, GMR Airports, and Siemens as top derivatives bets for June, citing technical breakouts and positive price action. Conversely, Mahindra &amp; Mahindra shows signs of a fresh short buildup.",https://economictimes.indiatimes.com/markets/stocks/rssfeeds/2146843.cms
"Nifty has a positive undertone, but Street waits for a decisive breakout",https://economictimes.indiatimes.com/markets/stocks/news/nifty-has-a-positive-undertone-but-street-waits-for-a-decisive-breakout/articleshow/131431525.cms,2026-06-01 05:48:47 IST,"Nifty is trading in a consolidation zone between 23,200 and 24,050. Analysts suggest buying on dips with a target of 23,900. Key sectors like banking and auto are showing strength. Specific stock recommendations include Tata Power, Sona BLW, L&amp;T, Indian Energy Exchange, Nuvama Wealth Management, and Syrma SGS Technology for potential gains.",https://economictimes.indiatimes.com/markets/stocks/rssfeeds/2146843.cms
Share of term deposits below 7% jumps as banks reprice liabilities,https://economictimes.indiatimes.com/markets/stocks/news/share-of-term-deposits-below-7-jumps-as-banks-reprice-liabilities/articleshow/131431513.cms,2026-06-01 05:39:10 IST,"Bank term deposits under 7% surged to 61.8% in FY26 due to 125 basis points of policy rate cuts. Depositors shifted to longer maturities, with one-to-three-year tenures rising to 69.8%. Term deposits now form 61.6% of overall deposits, a structural shift from savings accounts.",https://economictimes.indiatimes.com/markets/stocks/rssfeeds/2146843.cms
"FPI selling puts June rally at risk, midcaps may march on",https://economictimes.indiatimes.com/markets/stocks/news/fpi-selling-puts-june-rally-at-risk-midcaps-may-march-on/articleshow/131431497.cms,2026-06-01 05:34:35 IST,"Indian equities face a challenging June, with geopolitical tensions and foreign selling clouding the outlook for large caps. Mid and smallcap stocks, however, show potential for continued gains as domestic investors seek opportunities beyond blue chips. Analysts suggest buying dips in June for a potential July rally.",https://economictimes.indiatimes.com/markets/stocks/rssfeeds/2146843.cms
RBI likely to keep status quo on policy rate as threats loom,https://economictimes.indiatimes.com/markets/stocks/news/status-quo-on-rbis-policy-rate-likely-as-threats-loom/articleshow/131431707.cms,2026-06-01 05:30:00 IST,"A majority of economists polled by ET predict the Reserve Bank of India will hold its policy rate steady at the upcoming June meeting. This decision comes amid concerns over geopolitical tensions and adverse weather forecasts, which threaten economic growth and could fuel inflation.",https://economictimes.indiatimes.com/markets/stocks/rssfeeds/2146843.cms
NCLAT offers Supreme Housing final chance to settle Canara Bank dues,https://economictimes.indiatimes.com/markets/stocks/news/nclat-offers-supreme-housing-final-chance-to-settle-canara-bank-dues/articleshow/131431581.cms,2026-06-01 01:09:07 IST,Supreme Housing promoters have a final opportunity to settle their debt with Canara Bank. The National Company Law Appellate Tribunal has ordered a deposit of ₹460 crore by June 13. This is the third chance for the company to resolve its financial obligations. Failure to meet this deadline will allow the insolvency process to proceed.,https://economictimes.indiatimes.com/markets/stocks/rssfeeds/2146843.cms
West Asia heat may soon scorch banks' books,https://economictimes.indiatimes.com/markets/stocks/news/west-asia-heat-may-soon-scorch-banks-books/articleshow/131431574.cms,2026-06-01 01:05:39 IST,Indian banks anticipate asset quality stress from the second quarter due to the West Asia conflict. Rising fuel prices will reduce consumer spending. Higher input costs will impact corporate profits. Small and medium enterprises face significant pressure. Lenders are becoming cautious about lending to this segment. This situation will be visible in upcoming financial results.,https://economictimes.indiatimes.com/markets/stocks/rssfeeds/2146843.cms
Banks seek easing of guarantee curbs to draw more NRI funds,https://economictimes.indiatimes.com/markets/stocks/news/banks-seek-easing-of-guarantee-curbs-to-draw-more-nri-funds/articleshow/131431564.cms,2026-06-01 00:58:19 IST,Indian banks are asking the Reserve Bank of India to remove a guarantee restriction. This move aims to attract money from the Indian diaspora. Banks want to revive a special deposit scheme for foreign currency non-resident accounts. This could help increase dollar supply. The Reserve Bank of India is considering the proposal.,https://economictimes.indiatimes.com/markets/stocks/rssfeeds/2146843.cms
"Concor fails to impress in Q4, but the Street isn't giving up just yet",https://www.livemint.com/market/stock-market-news/concor-q4-results-concor-share-price-analysts-rating-western-dedicated-freight-corridor-jnpt-11780242223222.html,2026-06-01 11:21:33 IST,"Falling market share at Mundra, and weak rail modal share remain key concerns for Concor investors, though gains at Jawaharlal Nehru Port (JNPT) have offered some relief.",https://www.livemint.com/rss/markets
"JP Power, Vodafone Idea, Suzlon, Ola Electric among most traded stocks on NSE today, 1 June 2026",https://www.livemint.com/market/stock-market-news/jp-power-vodafone-idea-suzlon-ola-electric-among-most-traded-stocks-on-nse-today-1-june-2026-11780289279961.html,2026-06-01 11:19:50 IST,"JP Power, Vodafone Idea, NMDC Steel, Suzlon Energy, YES Bank, Ola Electric Mobility, Dharan Infra-EPC, PC Jeweller, and GTL Infrastructure were the most traded stocks on the NSE.",https://www.livemint.com/rss/markets
"Adani Power, Adani Ports to Adani Total Gas: Adani group stocks tank up to 4%. Details here",https://www.livemint.com/market/stock-market-news/adani-power-adani-ports-to-adani-total-gas-adani-group-stocks-tank-up-to-5-details-here-11780290123639.html,2026-06-01 10:38:38 IST,Adani Group stocks fell up to 4% in Monday's trading session after the group came under scrutiny from US authorities over alleged bribery related to its renewable energy operations.,https://www.livemint.com/rss/markets
Mukul Agrawal-owned PTC Industries surges 19.5% after Q4 results. Do you own this multibagger stock?,https://www.livemint.com/market/stock-market-news/mukul-agrawal-owned-ptc-industries-stock-surges-19-5-after-q4-results-do-you-own-this-multibagger-stock-11780289681113.html,2026-06-01 10:31:14 IST,PTC Industries share price rose as much as 19.51% against its last closing price and inched nearer to its 52-week high after the earnings announcement for the March quarter.,https://www.livemint.com/rss/markets
