title,link,published,summary,source
Vedanta Aluminium shares jump over 3% as Emkay starts coverage with Buy call. 3 reasons why,https://economictimes.indiatimes.com/markets/stocks/news/vedanta-aluminium-shares-rally-over-3-as-emkay-starts-coverage-with-buy-call-3-reasons-why/articleshow/132129197.cms,2026-07-02 10:18:21 IST,"Vedanta Aluminium shares surged after Emkay initiated coverage with a 'Buy' rating and a Rs 550 target, citing strong medium-term prospects. The brokerage anticipates a global aluminium deficit through 2028, driven by robust demand and supply constraints. Emkay believes structural cost reductions through backward integration will fuel earnings growth, positioning Vedanta Aluminium as a low-cost producer with a favourable risk-reward profile.",https://economictimes.indiatimes.com/markets/stocks/rssfeeds/2146843.cms
"Infosys, TCS and other IT stocks jump up to 5% on dip buying. Is the worst over?",https://economictimes.indiatimes.com/markets/stocks/news/infosys-tcs-and-other-it-stocks-jump-up-to-5-on-dip-buying-is-the-worst-over/articleshow/132129063.cms,2026-07-02 10:10:18 IST,"IT stocks rebounded sharply on Thursday, with the Nifty IT index surging nearly 4% after a four-session slide that pushed it to a 52-week low. Coforge led gains with a 5% jump, while Infosys, Mphasis, HCL Tech and Persistent Systems rose around 4%. The recovery lifted sentiment after the sector had shed nearly 7% over the previous four trading sessions.",https://economictimes.indiatimes.com/markets/stocks/rssfeeds/2146843.cms
HDFC Bank shares down 20% in 2026 so far. Time to buy as the governance cloud clears up?,https://economictimes.indiatimes.com/markets/stocks/news/hdfc-bank-shares-down-20-in-2026-so-far-time-to-buy-as-the-governance-cloud-clears-up/articleshow/132129013.cms,2026-07-02 10:06:54 IST,"HDFC Bank shares have plunged 20% this year amid governance concerns, sparked by a former chairman's resignation. The bank has since appointed a new part-time chairman and key financial officers. While leadership is strengthening and operations are improving, analysts advise caution against trying to time the bottom, suggesting other banks might offer better immediate value. The stock's future hinges on the CEO's reappointment and regulatory outcomes.",https://economictimes.indiatimes.com/markets/stocks/rssfeeds/2146843.cms
FirstCry shares in focus ahead of Rs 300 crore Swara Baby stake sale via IPO,https://economictimes.indiatimes.com/markets/stocks/news/firstcry-shares-in-focus-ahead-of-rs-300-crore-swara-baby-stake-sale-via-ipo/articleshow/132128893.cms,2026-07-02 09:55:21 IST,"Brainbees Solutions, the parent of FirstCry, will see its shares in focus after approving a Rs 300 crore offer for sale (OFS) in its subsidiary Swara Baby's upcoming IPO. Swara Baby, a contract manufacturer of hygiene products, plans to raise up to Rs 1,000 crore.This move comes as FirstCry's financial performance shows narrowed losses and revenue growth.",https://economictimes.indiatimes.com/markets/stocks/rssfeeds/2146843.cms
"Buy, Sell or Hold: Motilal Oswal recommends buy on CreditAccess Grameen; Nuvama maintains buy on APL Apollo",https://economictimes.indiatimes.com/markets/stocks/news/buy-sell-or-hold-motilal-oswal-recommends-buy-on-creditaccess-grameen-nuvama-maintains-buy-on-apl-apollo/articleshow/132128790.cms,2026-07-02 09:48:00 IST,"Brokerages are optimistic about select Indian stocks despite sector-specific challenges. Nuvama maintains a 'Buy' on APL Apollo Tubes, expecting healthy profitability despite recent volume dips. Meanwhile, Motilal Oswal reiterates its 'Buy' for CreditAccess Grameen, seeing it emerge stronger from microfinance sector stress with a resilient portfolio and promising growth prospects.",https://economictimes.indiatimes.com/markets/stocks/rssfeeds/2146843.cms
The surprising reason India's most expensive stocks often keep rising,https://economictimes.indiatimes.com/markets/stocks/news/the-surprising-reason-indias-most-expensive-stocks-often-keep-rising/articleshow/132128723.cms,2026-07-02 09:43:20 IST,"Indian stocks defy logic, with expensive companies consistently outperforming. This trend, observed over 15 years, sees sectors like defence and retail surge despite high valuations, driven by structural shifts and strong earnings. Jefferies highlights the power sector as the next potential beneficiary, citing strong demand and private sector capex. Investors should remain aware of potential reversals if growth falters.",https://economictimes.indiatimes.com/markets/stocks/rssfeeds/2146843.cms
"Sensex jumps over 500 points, Nifty tops 24,150 as oil slips below $70/bbl on US-Iran peace talks",https://economictimes.indiatimes.com/markets/stocks/news/sensex-rises-over-400-points-nifty-above-24100-as-oil-prices-fall-below-70-infosys-tcs-shares-jump-up-to-3/articleshow/132128415.cms,2026-07-02 09:26:33 IST,"Indian stock markets saw a second day of gains, with Sensex and Nifty inching up as oil prices plummeted to $70 a barrel amid US-Iran peace talks. Tech stocks like Infosys led the charge, while broader markets also traded higher. Analysts point to falling crude, strong auto sales, and tapering FII selling as positive near-term drivers, though monsoon progress remains a watch point.",https://economictimes.indiatimes.com/markets/stocks/rssfeeds/2146843.cms
"10 smallcap stocks soar up to 212% this year, 3 turn multibaggers. Do you own any?",https://economictimes.indiatimes.com/markets/stocks/news/10-smallcap-stocks-soar-up-to-212-this-year-3-turn-multibaggers-do-you-own-any/slideshow/132128568.cms,2026-07-02 09:26:01 IST,"India's smallcap stocks have outperformed the Nifty 50 in 2026, with HFCL, Aditya Infotech and Acutaas Chemicals leading the top 10 performers, delivering exceptional year-to-date returns.",https://economictimes.indiatimes.com/markets/stocks/rssfeeds/2146843.cms
"Ola Electric shares in focus as Q1 registrations nearly double sequentially to 43,719 units",https://economictimes.indiatimes.com/markets/stocks/news/ola-electric-shares-in-focus-as-q1-registrations-nearly-double-sequentially-to-43719-units/articleshow/132128432.cms,2026-07-02 09:24:13 IST,"Ola Electric Mobility registered 43,719 vehicles in Q1 FY27, nearly doubling from 22,252 in the previous quarter, driven by strong demand and operational improvements. The company also recorded 16,144 registrations in June, its best monthly performance in recent quarters.",https://economictimes.indiatimes.com/markets/stocks/rssfeeds/2146843.cms
Paytm among 4 stocks that closed crossing above VWAP,https://economictimes.indiatimes.com/markets/stocks/news/paytm-among-4-stocks-that-closed-crossing-above-vwap/slideshow/132128324.cms,2026-07-02 09:13:41 IST,"When a stock closes above its VWAP, it indicates that the closing price is higher than the average price at which it traded throughout the day, weighted by trading volume.",https://economictimes.indiatimes.com/markets/stocks/rssfeeds/2146843.cms
Bharti Airtel shares in focus as NBFC Airtel Money commences commercial operations after RBI nod,https://economictimes.indiatimes.com/markets/stocks/news/bharti-airtel-shares-in-focus-as-nbfc-airtel-money-commences-commercial-operations-after-rbi-nod/articleshow/132128118.cms,2026-07-02 08:53:22 IST,"Bharti Airtel shares will be in focus after its NBFC arm, Airtel Money, commenced commercial operations following RBI approval. The development comes as Nomura reaffirmed its bullish stance on the telecom major, raising its target price to Rs 2,355 per share. Despite a 34% drop in Q4 profit, Airtel reported strong revenue growth and margin expansion across its India and Africa businesses.",https://economictimes.indiatimes.com/markets/stocks/rssfeeds/2146843.cms
Wipro shares could crash 17% on Thursday if ADR is an indicator. What’s worrying investors?,https://economictimes.indiatimes.com/markets/stocks/news/wipro-shares-could-crash-17-on-thursday-if-adr-is-an-indicator-whats-worrying-investors/articleshow/132128043.cms,2026-07-02 08:44:36 IST,"Wipro shares are poised for a significant drop following a steep decline in its ADRs, fueled by investor worries about future earnings and AI's impact on IT services.  The company, already down substantially from its peak, faces headwinds from North American market slowdowns and the disruptive potential of generative AI.  Accenture's tempered forecast and US monetary policy further dampen prospects for the sector.",https://economictimes.indiatimes.com/markets/stocks/rssfeeds/2146843.cms
"Delhivery, Eternal among 6 stocks flashing bullish signals, hinting at a possible uptrend",https://economictimes.indiatimes.com/markets/stocks/news/delhivery-eternal-among-6-stocks-flashing-bullish-signals-hinting-at-a-possible-uptrend/slideshow/132127775.cms,2026-07-02 08:27:30 IST,"On July 01, six Nifty500 stocks that gained over 5% appeared on the 'White Marubozu' bullish scanner, according to StockEdge's technical scan data. The bullish candlestick pattern reflects strong buying momentum throughout the session, signalling sustained positive sentiment and the potential for a continuation of the upward price trend.",https://economictimes.indiatimes.com/markets/stocks/rssfeeds/2146843.cms
"Dividend Alert! Last day to buy M&amp;M, Swaraj Engines, 31 other stocks to earn payouts up to Rs 110",https://economictimes.indiatimes.com/markets/stocks/news/dividend-alert-last-day-to-buy-mm-other-32-stocks-for-dividends-worth-rs-473-how-many-do-you-own/articleshow/132127684.cms,2026-07-02 08:25:40 IST,"Investors have a final chance today to buy shares in 33 companies, including Mahindra &amp; Mahindra, Tech Mahindra, and Union Bank, to qualify for upcoming dividend payouts. With July 3rd set as the record date, today is the last opportunity to secure these dividends. Notable payouts include Mahindra &amp; Mahindra's Rs 33 per share and Swaraj Engines' Rs 110 per share, among many others.",https://economictimes.indiatimes.com/markets/stocks/rssfeeds/2146843.cms
Rites among 5 stocks showing bullish RSI upswing,https://economictimes.indiatimes.com/markets/stocks/news/rites-among-5-stocks-showing-bullish-rsi-upswing/slideshow/132127642.cms,2026-07-02 08:17:24 IST,"Five stocks in the Nifty500 segment that gained over 5% featured in the RSI Trending Up scan on July 1 after showing improving momentum. The RSI moved above the 50 mark from lower levels, signalling strengthening price action, improving sentiment and potential short-term buying opportunities for traders tracking bullish technical setups.",https://economictimes.indiatimes.com/markets/stocks/rssfeeds/2146843.cms
Margin trading: why discount brokers are betting big on MTF despite the risks,https://www.livemint.com/market/mtf-margin-trading-facility-discount-brokers-india-sebi-rules-11782963533066.html,2026-07-02 11:53:10 IST,"After Sebi's crackdown on speculative derivatives trading dented their biggest revenue engine, discount brokers are increasingly relying on margin funding to deepen customer engagement and expand margins. The strategy comes as the regulator seeks to strengthen a rapidly growing leveraged product.",https://www.livemint.com/rss/markets
"Nifty IT jumps over 4%; Infosys, TCS shares surge up to 5%. Should you buy IT stocks at this juncture?",https://www.livemint.com/market/stock-market-news/nifty-it-jumps-over-4-infosys-tcs-shares-surge-up-to-5-should-you-buy-it-stocks-at-this-juncture-11782969939148.html,2026-07-02 11:45:19 IST,"Amidst a 30% decline in the IT sector this year, the Nifty IT index jumped over 4% as traders speculate if this marks a market recovery. Experts advise caution—monitoring upcoming earnings and AI impacts could determine if now is the time for investments.",https://www.livemint.com/rss/markets
"CSM Technologies share price hits 5% lower circuit after flat listing. Should you buy, sell or hold?",https://www.livemint.com/market/stock-market-news/csm-technologies-share-price-hits-5-lower-circuit-after-flat-listing-should-you-buy-sell-or-hold-11782970680043.html,2026-07-02 11:37:04 IST,"CSM Technologies debuted flat on the Indian stock market, opening at  ₹113, matching its issue price. The IPO received a muted response, being subscribed only 1.36 times. The company plans to use the funds raised for growth initiatives and working capital.",https://www.livemint.com/rss/markets
At record high! Newly listed Waterways Leisure Tourism share price hits 10% upper circuit after weak stock market debut,https://www.livemint.com/market/stock-market-news/at-record-high-newly-listed-waterways-leisure-tourism-share-price-hits-10-upper-circuit-after-weak-stock-market-debut-11782970077448.html,2026-07-02 11:14:55 IST,"After a subdued market debut, Waterways Leisure Tourism's shares rallied 10% to a record high of  ₹734.05. The company's IPO attracted significant retail interest, achieving 1.46 times subscription, and aims to strengthen its position in India's cruise tourism sector.",https://www.livemint.com/rss/markets
"Adon Agro Commodities IPO share allotment in focus today: GMP, 4 steps to check status online",https://www.livemint.com/market/ipo/adon-agro-commodities-ipo-share-allotment-in-focus-today-gmp-4-steps-to-check-status-online-11782965576360.html,2026-07-02 10:45:51 IST,Adon Agro Commodities' IPO shares are set to be finalised today. Learn how to check your allotment status online and what the grey market premium indicates about the stock's debut.,https://www.livemint.com/rss/markets
Multibagger Alert! Vedanta Iron and Steel share price soars 113% since listing - More upside ahead?,https://www.livemint.com/market/stock-market-news/multibagger-alert-vedanta-iron-and-steel-share-price-soars-113-since-listing-more-upside-ahead-11782967910054.html,2026-07-02 10:31:43 IST,"After a significant acquisition by Premji Invest, Vedanta Iron &amp;amp; Steel shares surged, reaching an all-time high. Other Vedanta companies also saw gains. Analysts note the stock's upward trend.",https://www.livemint.com/rss/markets
"CSM Technologies share price makes flat debut, lists at IPO price of  ₹113",https://www.livemint.com/market/stock-market-news/csm-technologies-share-price-makes-flat-debut-lists-at-ipo-price-of-113-11782966462910.html,2026-07-02 10:03:33 IST,CSM Technologies share price made a subdued debut on Dalal Street on Thursday. The stock listed at its IPO price of  ₹113 on both the BSE and NSE.,https://www.livemint.com/rss/markets
"Stocks to buy or sell: Osho Krishan of Angel One suggests buying CDSL, Indian Hotels shares on 2 July",https://www.livemint.com/market/stocks-to-buy-or-sell-osho-krishan-of-angel-one-suggests-buying-cdsl-indian-hotels-shares-on-2-july-11782964575702.html,2026-07-02 10:00:53 IST,"Indian stock indices Sensex and Nifty 50 rose on Thursday, boosted by falling crude oil prices after US-Iran negotiations. Nifty 50 gained 0.23%, while Sensex increased by 0.21%. Continued sideways trading seen, with key resistance at 24,100-24,200 and support at 23,850-23,800",https://www.livemint.com/rss/markets
"Adani Energy Solutions approves  ₹10,000 crore fundraising via QIP; check Q1 results date for the Adani Group stock",https://www.livemint.com/market/stock-market-news/adani-energy-solutions-approves-rs-10-000-crore-fundraising-via-qip-check-q1-results-date-for-the-adani-group-stock-11782963982557.html,2026-07-02 09:31:12 IST,"Adani Energy Solutions plans to raise up to  ₹10,000 crore via Qualified Institutional Placement, pending shareholder approval. The company will hold an Extraordinary General Meeting on July 25, 2026, to discuss the proposal. Its stock performance shows significant growth over the past year.",https://www.livemint.com/rss/markets
Wipro share price climbs 1% following a 17% drop in ADRs overnight amid growing AI concerns. Do you own?,https://www.livemint.com/market/stock-market-news/wipro-share-price-climbs-1-following-a-17-drop-in-adrs-overnight-amid-growing-ai-concerns-do-you-own-11782961689819.html,2026-07-02 09:21:18 IST,"Wipro ADRs fell over 16.89% to $1.870 apiece on the NYSE even as ADRs of Infosys rose 1.53% to $10.65, while technology peers Cognizant and Accenture gained 6.04% and 5.38%, respectively.",https://www.livemint.com/rss/markets
Tight funding norms for prop traders may hit expiry day volumes,https://www.livemint.com/market/stock-market-news/rbi-reserve-bank-of-india-proprietary-traders-prop-trading-weekly-options-nifty-sensex-options-collateral-11782959844426.html,2026-07-02 09:13:12 IST,"RBI's tighter funding norms make bank overdrafts, widely used by proprietary traders as margins on weekly Nifty and Sensex options expiry days, significantly harder to access.",https://www.livemint.com/rss/markets
"Gold price today: MCX gold drops 0.20%, silver climbs 0.50% after soft US jobs data",https://www.livemint.com/market/commodities/gold-price-today-mcx-gold-drops-0-20-silver-climbs-0-50-after-soft-us-jobs-data-11782962585156.html,2026-07-02 09:08:57 IST,"Gold and silver prices traded mixed in the domestic futures market on Thursday morning, amid largely positive global cues. The dollar index remains above 101, keeping bullion expensive for buyers in overseas currencies.",https://www.livemint.com/rss/markets
Rupee opens 32 paise higher at 94.93 against US dollar,https://www.livemint.com/market/stock-market-news/rupee-opens-32-paise-higher-at-94-93-against-us-dollar-11782963296224.html,2026-07-02 09:06:58 IST,"The Indian rupee opened 32 paise stronger at 94.93 against the US dollar, influenced by falling crude prices. Traders expect limited recovery due to weaknesses in other Asian currencies and rising US Treasury yields, with the RBI likely to manage currency volatility.",https://www.livemint.com/rss/markets
Momentum investing stages sharp comeback after 15-month lull,https://www.livemint.com/market/stock-market-news/stock-market-returns-momentum-investing-nse-nifty-500-momentum-50-index-11782880066212.html,2026-07-02 09:01:07 IST,The strategy outpaced value and quality investing styles in the April-June quarter as active capital chased isolated pockets of growth outside major large caps.,https://www.livemint.com/rss/markets
"Aastha Spintex IPO allotment to be finalised today: Check latest GMP, steps to check allotment status online",https://www.livemint.com/market/ipo/aastha-spintex-ipo-allotment-to-be-finalised-today-check-latest-ipo-gmp-steps-to-check-ipo-allotment-status-online-11782962164529.html,2026-07-02 09:00:27 IST,"Aastha Spintex allotment date is likely to be finalised today, July 2. Investors can check its IPO allotment status online through the websites of NSE, BSE and the IPO registrar - Bigshare Services.",https://www.livemint.com/rss/markets
Stocks to buy for short term: NBCC among 3 shares Amol Athawale of Kotak Securities recommends for next 1-2 weeks,https://www.livemint.com/market/stock-market-news/stocks-to-buy-for-short-term-nbcc-among-3-shares-amol-athawale-of-kotak-securities-recommends-for-next-1-2-weeks-11782960387607.html,2026-07-02 08:47:19 IST,"Stocks to buy for the short term: Amol Athawale recommends three stocks, including NBCC and CDSL, for the next 1-2 weeks. Discover the investment rationale and target price of each stocks.",https://www.livemint.com/rss/markets
"Knack Packaging IPO Day 2: Issue subscribed 3.45x so far. Check GMP, key dates, review. Apply or not?",https://www.livemint.com/market/ipo/knack-packaging-ipo-gmp-knack-packaging-ipo-review-knack-packaging-ipo-subscription-knack-packaging-ipo-details-11782959637119.html,2026-07-02 08:47:03 IST,"Knack Packaging IPO, priced between  ₹161-170, opened on July 1 and closes on July 3. It aims to raise  ₹380 crore and is showing strong demand with a 2.60x subscription on Day 1, highlighting its market potential.",https://www.livemint.com/rss/markets
Crude oil prices extend decline for third session amid ongoing US-Iran talks; Brent crude near $70 per barrel,https://www.livemint.com/market/commodities/crude-oil-prices-extend-decline-for-third-session-amid-ongoing-us-iran-talks-brent-crude-near-70-per-barrel-11782960199471.html,2026-07-02 08:27:41 IST,US-Iran war: Brent crude for September delivery traded near $71 a barrel after falling more than 3% over the previous two sessions.,https://www.livemint.com/rss/markets
"Bhavin Turakhia's next act: A $30 million AI-native workplace platform to challenge Microsoft, Google",https://www.livemint.com/companies/bhavin-turakhia-neo-ai-native-workplace-artificial-intelligence-enterprise-software-workplace-productivity-11782961115580.html,2026-07-02 11:12:54 IST,"Bhavin Turakhia has invested $30 million of his own capital to build Neo, an AI-native workplace platform that lets humans and AI agents work together, challenging legacy productivity suites.",https://www.livemint.com/rss/companies
Sebi’s pump-and-dump crackdown: 5 ways to protect yourself from stock market scams,https://www.livemint.com/money/personal-finance/sebis-pump-and-dump-crackdown-5-ways-to-protect-yourself-from-stock-market-scams-11782969571341.html,2026-07-02 11:55:12 IST,"To avoid stock scams, verify information, consult certified advisors, and focus on disciplined investing. Beware of unsolicited tips, unusual price movements, and FOMO tactics. A diversified portfolio can protect against manipulation. SEBI's crackdown highlights the need for investor vigilance.",https://www.livemint.com/rss/money
New vs old tax regime: How much tax do you pay on a  ₹25 lakh salary?,https://www.livemint.com/money/personal-finance/new-vs-old-tax-regime-how-much-tax-do-you-pay-on-a-25-lakh-salary-11782968993887.html,2026-07-02 10:50:13 IST,"Choosing the right tax regime can significantly reduce your tax outgo. Here's a comparison of the tax liability on a  ₹25 lakh annual salary under both the new and old tax regimes, and when each one makes sense.",https://www.livemint.com/rss/money
"Gold, silver prices today, 2 July: Check retail rates of 24K, 22K gold, 999 silver in Delhi, Mumbai and Kolkata",https://www.livemint.com/money/personal-finance/gold-silver-prices-today-2-july-check-retail-rates-of-24k-22k-gold-999-silver-in-delhi-mumbai-and-kolkata-11782954426682.html,2026-07-02 09:37:26 IST,"Gold and silver prices today, 2 July: Check the latest 24K, 22K gold and 999 silver retail rates across Delhi, Mumbai, Kolkata and other major Indian cities, along with MCX market updates.",https://www.livemint.com/rss/money
"EPF Scheme 2026: New rules on withdrawal, eligibility and limits explained",https://www.livemint.com/money/personal-finance/epf-scheme-2026-new-rules-on-withdrawal-eligibility-and-limits-explained-11782957827632.html,2026-07-02 08:26:56 IST,"EPF Scheme 2026: Here are the new withdrawal rules, eligibility, limits and conditions to help EPF members understand partial withdrawals under the revised framework.",https://www.livemint.com/rss/money
