title,link,published,summary,source
Kwality Wall's shares to list today after demerger with HUL. Here’s everything you need to know,https://economictimes.indiatimes.com/markets/stocks/news/kwality-walls-shares-to-list-today-after-demerger-with-hul-heres-everything-you-need-to-know/articleshow/128382845.cms,2026-02-16 07:00:00 IST,"Kwality Wall’s India shares are set to list today following their demerger from Hindustan Unilever Ltd (HUL). This marks the creation of India's first pure-play listed ice-cream company. HUL also reported a 30% decline in net profit from continuing operations for Q3 FY26, though overall net profit surged due to portfolio transformation.",https://economictimes.indiatimes.com/markets/stocks/rssfeeds/2146843.cms
"Traders stay guarded as Nifty turns range-bound, support at 25,100 zone",https://economictimes.indiatimes.com/markets/stocks/news/traders-stay-guarded-as-nifty-turns-range-bound-support-at-25100-zone/articleshow/128401298.cms,2026-02-16 06:01:05 IST,"Nifty faces a range-bound week after failing to breach 26,000. Analysts anticipate cautious trading with support seen at 25,300 and resistance at 25,700-26,000. Traders are advised a wait-and-watch approach. Key stock picks include Bajaj Finance, Torrent Pharma, Tata Motors Passenger Vehicles, Dr. Reddy’s Laboratories, L&amp;T, and Pricol, offering potential trading opportunities.",https://economictimes.indiatimes.com/markets/stocks/rssfeeds/2146843.cms
"Stocks in news: BSE, TCS, Ola Electric, Religare Enterprises, Manappuram Finance",https://economictimes.indiatimes.com/markets/stocks/news/stocks-in-news-bse-tcs-ola-electric-religare-enterprises-manappuram-finance/articleshow/128390119.cms,2026-02-16 06:01:00 IST,"Markets faced selling pressure, with the Nifty declining due to a sharp fall in technology stocks. Several companies like BSE, TCS, Ola Electric, Religare Enterprises, and Manappuram Finance are in focus due to significant business developments and strategic partnerships.",https://economictimes.indiatimes.com/markets/stocks/rssfeeds/2146843.cms
GIFT Nifty up 15 points; here's the trading setup for today's session,https://economictimes.indiatimes.com/markets/stocks/news/pre-market-action-heres-the-trade-setup-for-todays-session/articleshow/128390244.cms,2026-02-16 06:01:00 IST,"Markets closed the week lower, with benchmark indices down approximately 1% due to rising concerns over AI disruption and a significant sell-off in technology stocks. Analysts advise a selective, risk-managed approach amid ongoing tech stock repricing and AI fears. The India VIX rose 15% to 13.50 levels.",https://economictimes.indiatimes.com/markets/stocks/rssfeeds/2146843.cms
"FPIs trim bearish bets, but no rush to buy yet",https://economictimes.indiatimes.com/markets/stocks/news/fpis-trim-bearish-bets-but-no-rush-to-buy-yet/articleshow/128400967.cms,2026-02-16 05:38:29 IST,"Overseas fund managers have reduced bearish derivative bets on India, moving from near-lifetime lows as market pessimism eases. However, they remain cautious, retaining significant short positions due to ongoing AI trade uncertainties on Wall Street. This cautious approach is reflected in the fluctuating Long-Short Ratio of FPIs' Nifty futures.",https://economictimes.indiatimes.com/markets/stocks/rssfeeds/2146843.cms
"KKR could deploy $20 billion in India over the next decade, says cofounder Henry Kravis",https://economictimes.indiatimes.com/markets/stocks/news/kkr-could-deploy-20-billion-in-india-over-the-next-decade-says-founder-henry-kravis/articleshow/128401906.cms,2026-02-16 05:30:00 IST,"Investment giant KKR sees immense potential in India, committing billions to its growing economy. Cofounder Henry Kravis highlights the increasing quality of Indian companies and the firm's expanding strategies, particularly in private credit. He emphasizes the critical need for better financing for small and medium-sized enterprises to fuel job creation and economic growth.",https://economictimes.indiatimes.com/markets/stocks/rssfeeds/2146843.cms
Stock Radar: Breakout from triangle formation pushes Indus Tower to record highs in February 2026; time to buy or book profits?,https://economictimes.indiatimes.com/markets/stocks/news/stock-radar-breakout-from-triangle-formation-pushes-indus-tower-to-record-highs-in-february-2026-time-to-buy-or-book-profits/articleshow/128298386.cms,2026-02-16 05:00:00 IST,Indus Towers stock has broken out from a technical pattern on weekly charts. This suggests a potential upward movement. Traders can consider buying the stock now or on dips. Experts suggest a target of Rs 560 in the coming one to two months. The stock has shown strong performance recently. Technical indicators are also signaling strength.,https://economictimes.indiatimes.com/markets/stocks/rssfeeds/2146843.cms
Reserve Bank of India restores default loss guarantees for NBFCs,https://economictimes.indiatimes.com/markets/stocks/news/reserve-bank-of-india-restores-default-loss-guarantees-for-nbfcs/articleshow/128400924.cms,2026-02-16 00:35:04 IST,"Non-banking finance companies (NBFC) can now factor in DLGs when setting aside buffers for potential loan losses, provided the guarantee forms an integral part of the loan arrangement, the RBI said last week.",https://economictimes.indiatimes.com/markets/stocks/rssfeeds/2146843.cms
RBI initiates talks to ease overseas investment norms,https://economictimes.indiatimes.com/markets/stocks/news/rbi-initiates-talks-to-ease-overseas-investment-norms/articleshow/128401404.cms,2026-02-16 00:26:46 IST,The Reserve Bank of India is seeking input from banks to streamline overseas investment rules. This move aims to simplify procedures and ease compliance hurdles for Indian companies. Discussions are underway to address practical challenges and ambiguities in the current framework. The central bank is looking to clarify regulations and facilitate smoother outbound investments for businesses and individuals.,https://economictimes.indiatimes.com/markets/stocks/rssfeeds/2146843.cms
"Nifty 50, Sensex today: What to expect from Indian stock market in trade on February 16",https://www.livemint.com/market/stock-market-news/nifty-50-sensex-today-what-to-expect-from-indian-stock-market-in-trade-on-february-16-11771172229863.html,2026-02-16 07:19:46 IST,"Nifty 50, Sensex today: The trends on Gift Nifty also indicate a negative start for the Indian benchmark index. The Gift Nifty was trading around 25,448 level, a discount of nearly 71 points from the Nifty futures’ previous close.",https://www.livemint.com/rss/markets
Gold prices dip on firmer U.S. dollar,https://www.livemint.com/market/gold-prices-dip-on-firmer-u-s-dollar-11771205676643.html,2026-02-16 07:04:36 IST,GLOBAL-PRECIOUS/:PRECIOUS-Gold prices dip on firmer U.S. dollar,https://www.livemint.com/rss/markets
"Indian stock market: 8 key things that changed for market over weekend- Gift Nifty, US inflation, Japan GDP to gold rate",https://www.livemint.com/market/stock-market-news/indian-stock-market-8-key-things-that-changed-for-market-over-weekend-gift-nifty-us-inflation-japan-gdp-to-gold-rate-11771172532645.html,2026-02-16 07:02:53 IST,"Gift Nifty was trading around 25,465 level, a discount of nearly 54 points from the Nifty futures’ previous close, indicating a weak start for the Indian stock market indices.",https://www.livemint.com/rss/markets
"Gold, silver rates today: Gold and silver prices fall up to 2% after disappointing US CPI data. Should you buy or sell?",https://www.livemint.com/market/commodities/gold-silver-rates-today-gold-and-silver-prices-fall-up-to-2-after-disappointing-us-cpi-data-should-you-buy-or-sell-11771202260308.html,2026-02-16 06:59:01 IST,"Gold, silver rates today: Spot gold prices were down nearly 0.27% at $5,033 per ounce, while spot silver prices fell over 2.08% to $76.34 per ounce during the Asian trading hours on Monday.",https://www.livemint.com/rss/markets
"Aye Finance IPO listing date today. GMP, experts signal muted debut of shares in stock market today",https://www.livemint.com/market/ipo/aye-finance-ipo-listing-date-today-gmp-experts-signal-muted-debut-of-shares-in-stock-market-today-11771173274445.html,2026-02-16 06:10:30 IST,"Aye Finance IPO listing date is today, 16 February 2026, and the equity shares will be listed on both the stock exchanges, BSE and NSE. Ahead of the share debut, Aye Finance IPO GMP today and analysts expect a tepid listing in the Indian stock market.",https://www.livemint.com/rss/markets
Stocks to buy: Raja Venkatraman recommends real estate stocks for 16 February,https://www.livemint.com/market/stock-market-news/stocks-to-buy-raja-venkatraman-real-estate-stocks-16-february-stock-recommendations-phoenix-mills-prestige-estates-11771142420894.html,2026-02-16 06:06:10 IST,"Market expert Raja Venkatraman shares his top real estate stock picks for 16 February. Here’s his technical outlook and trade strategy,",https://www.livemint.com/rss/markets
Stock recommendations for 16 February from MarketSmith India,https://www.livemint.com/market/stock-market-news/stock-recommendations-for-16-february-from-marketsmith-india-11770986145508.html,2026-02-16 06:00:29 IST,"MarketSmith India reveals its top stock recommendations for today, 16 February. Get expert insights into the best-performing stocks to guide your investment decisions.",https://www.livemint.com/rss/markets
Options data suggests more volatility this week,https://www.livemint.com/market/nifty50-options-call-selling-ai-it-stocks-volatility-11771156919542.html,2026-02-16 05:40:49 IST,"AI -related disruptions, parsing of trade deal for further clarity and odds of a US -Iran conflict could queer pitch for stocks, said analysts&amp;nbsp;",https://www.livemint.com/rss/markets
Depth Indian markets offer to FPIs is hard to ignore: Baroda BNP Paribas MF’s Sanjay Chawla,https://www.livemint.com/market/markets-sanjay-chawla-on-trade-deal-ai-and-earnings-11771132964851.html,2026-02-16 05:30:48 IST,"After a sluggish 2025 marked by foreign portfolio investment outflows and single-digit earnings, Indian markets are hitting a turning point.",https://www.livemint.com/rss/markets
"OpenClaw creator Peter Steinberger joins OpenAI, Sam Altman says will drive next-gen AI personal agents",https://www.livemint.com/companies/people/openclaw-creator-peter-steinberger-join-openai-will-drive-next-gen-ai-development-personal-agents-chatgpt-ceo-sam-altman-11771202615277.html,2026-02-16 07:13:43 IST,"Peter Steinberger, creator of OpenClaw, will join OpenAI Inc. Here's why and all we know about the development.&amp;nbsp;",https://www.livemint.com/rss/companies
Mubadala Capital Chases ‘Complexity’ Post Clear Channel Deal,https://www.livemint.com/companies/mubadala-capital-chases-complexity-post-clear-channel-deal-11771204758735.html,2026-02-16 06:49:18 IST,"Mubadala Capital is embracing a more aggressive stance on dealmaking, wading into complicated transactions shunned by the titans of private equity and participating in multibillion-dollar buyouts that many other sovereign investors typically avoid.",https://www.livemint.com/rss/companies
Olympus Drops After Full-Year Operating Income Forecast Cut,https://www.livemint.com/companies/olympus-drops-after-full-year-operating-income-forecast-cut-11771202679133.html,2026-02-16 06:14:38 IST,Olympus Corp. fell the most in nearly eight months after the company cut its operating income guidance for the full year and third-quarter earnings missed analyst estimates.,https://www.livemint.com/rss/companies
"Twist in tale? Warner Bros weigh Paramount offer that covers $2.8bn Netflix break fee, says report",https://www.livemint.com/companies/news/warner-bros-board-reconsiders-paramount-talks-raising-stakes-for-netflix-deal-report-11771201321339.html,2026-02-16 06:04:25 IST,"Warner Bros is weighing renewed talks with Paramount after an amended offer that would cover a $2.8bn Netflix break fee and backstop debt refinancing, potentially sparking a new bidding war.",https://www.livemint.com/rss/companies
"AI firm Neysa to raise $1.2 billion from Blackstone, others in debt-equity mix",https://www.livemint.com/companies/news/ai-firm-neysa-to-raise-1-2-bn-from-blackstone-others-in-debt-equity-mix-11771151902418.html,2026-02-16 06:01:10 IST,"Neysa plans to raise $1.2 billion in a Blackstone-led deal to scale India’s AI cloud infrastructure, aiming to deploy 20,000 GPUs and leverage the new 20-year tax holiday.",https://www.livemint.com/rss/companies
"When carmakers are racing ahead, can parts makers be far behind?",https://www.livemint.com/companies/auto-part-makers-capacity-expansion-comes-into-focus-as-demand-surges-11771136210981.html,2026-02-16 06:00:30 IST,"The need for supplier capacity expansion comes as the automakers themselves look to expand their factories. The country’s top four carmakers, Maruti Suzuki, Mahindra, Hyundai and Tata Motors, are set to add more than 2 million units of capacity in the next four years.",https://www.livemint.com/rss/companies
India AI Summit: From Sam Altman to Sundar Pichai — tech CEOs likely to attend major expo in Delhi,https://www.livemint.com/companies/people/india-ai-summit-from-jensen-huang-to-sundar-pichai-tech-ceos-likely-to-attend-major-expo-in-delhi-11771201216706.html,2026-02-16 05:57:17 IST,India AI Summit: Prime Minister Narendra Modi will inaugurate the India AI Impact Expo 2026 on 16 February at the Bharat Mandapam in Delhi.,https://www.livemint.com/rss/companies
Dhruva Space looks to raise up to $50 million in new round of funding,https://www.livemint.com/companies/start-ups/dhruva-space-looks-to-raise-up-to-50-million-new-round-funding-11771152512315.html,2026-02-16 05:30:08 IST,Dhruva Space is chasing a $50 million round but may settle for half that as institutional investors remain wary of the full-stack model.,https://www.livemint.com/rss/companies
₹20 crore and still not enough? Rethinking retirement planning,https://www.livemint.com/money/personal-finance/rs-20-crore-and-still-not-enough-rethinking-retirement-planning-11771146877724.html,2026-02-16 07:00:11 IST,"At the Mint Money Festival, Aarati Krishnan explains why retirement feels harder today, why 25x may not be enough, and how inflation, longevity and compounding reshape the real corpus goal.",https://www.livemint.com/rss/money
How investors should invest in mutual funds in today's environment,https://www.livemint.com/money/personal-finance/how-investors-should-invest-in-mutual-funds-in-todays-environment-11771149991034.html,2026-02-16 07:00:11 IST,"Experts urged investors to stick to disciplined asset allocation, temper equity return expectations, and avoid chasing rallies in gold or silver ETFs.",https://www.livemint.com/rss/money
Asian shares steady in holiday-thinned trade; weak Japan GDP cools rally,https://www.business-standard.com/markets/news/asian-shares-steady-in-holiday-thinned-trade-weak-japan-gdp-cools-rally-126021600036_1.html,2026-02-16 06:45:15 IST,"Japan on Monday reported its economy grew a miserly 0.1 per cent annualised in the December quarter, far below the 1.6 per cent gain forecast as government spending dragged on activity",https://www.business-standard.com/rss/markets-106.rss
"Buy, Sell or Hold: Motilal Oswal maintains neutral on Lupin; Citi maintains sell on Info Edge",https://economictimes.indiatimes.com/markets/stocks/news/buy-sell-or-hold-motilal-oswal-maintains-neutral-on-lupin-citi-maintains-sell-on-info-edge/articleshow/128405994.cms,2026-02-16 09:33:39 IST,"Brokerages offer mixed stock recommendations, with pharma stocks like Lupin and Torrent Pharma seeing target price upgrades despite neutral ratings due to strong quarterly results. Conversely, Citi maintains a sell rating on Info Edge, cutting its target price due to concerns over hiring visibility and valuation de-rating.",https://economictimes.indiatimes.com/markets/stocks/rssfeeds/2146843.cms
"Beyond Rs 6 lakh crore selloff: How TCS, Infosys, other IT giants are reinventing to outlast AI disruption fears",https://economictimes.indiatimes.com/markets/stocks/news/beyond-rs-6-lakh-crore-selloff-how-tcs-infosys-other-it-giants-are-reinventing-to-outlast-ai-disruption-fears/articleshow/128405760.cms,2026-02-16 09:31:37 IST,"Indian IT giants are actively reinventing their strategies to counter fears of AI-driven disruption, which has led to a significant market value sell-off. Companies are embedding AI into transformation programs, focusing on outcome-led growth, and leveraging internal AI tools to maintain margins and deliver value to clients.",https://economictimes.indiatimes.com/markets/stocks/rssfeeds/2146843.cms
Top Nifty50 stocks analysts suggest buying in this volatile week,https://economictimes.indiatimes.com/markets/stocks/news/top-nifty50-stocks-analysts-suggest-buying-in-this-volatile-week/articleshow/128405770.cms,2026-02-16 09:27:37 IST,"Stock Reports Plus, powered by Refinitiv, is a comprehensive report that evaluates five key components of 4,000+ listed stocks – earnings, fundamentals, relative valuation, risk, and price momentum – to generate standardised scores. The simple average of the above-mentioned five component ratings is normally distributed to reach an average score.",https://economictimes.indiatimes.com/markets/stocks/rssfeeds/2146843.cms
"Sensex drops over 100 pts, Nifty below 25,500 as metal stocks decline; small, midcaps underperform",https://economictimes.indiatimes.com/markets/stocks/news/sensex-drops-over-100-pts-nifty-below-25500-as-metal-stocks-decline-small-midcaps-underperform/articleshow/128405791.cms,2026-02-16 09:27:04 IST,"Indian stock markets, Nifty and Sensex, continued their decline for a fourth consecutive session on Monday. Metal stocks contributed to the downturn. Earlier, IT stocks faced a sell-off due to AI disruption fears. Experts suggest IT sector weakness may persist. Funds are expected to shift towards financials, automobiles, capital goods, telecom, and pharma.",https://economictimes.indiatimes.com/markets/stocks/rssfeeds/2146843.cms
"​GE Power India among 5 stocks flashing bullish signals, hinting at possible uptrend​",https://economictimes.indiatimes.com/markets/stocks/news/ge-power-india-among-5-stocks-flashing-bullish-signals-hinting-at-a-possible-uptrend/slideshow/128405202.cms,2026-02-16 08:55:53 IST,"A White Marubozu is a bullish candlestick pattern in technical analysis. It occurs when the opening price is the lowest for a given period, and the closing price is the highest. ​Represented by a long white (or green) candlestick with no upper shadow and a small or nonexistent lower shadow, it indicates strong buying pressure throughout the session.",https://economictimes.indiatimes.com/markets/stocks/rssfeeds/2146843.cms
BEL shares in focus on JV with France’s Safran Electronics. All you need to know,https://economictimes.indiatimes.com/markets/stocks/news/bel-shares-in-focus-on-jv-with-frances-safran-electronics-all-you-need-to-know/articleshow/128405014.cms,2026-02-16 08:53:56 IST,Bharat Electronics Limited shares are set to gain attention. The company's board has approved a joint venture with Safran Electronics and Defence of France. This partnership will focus on Project Hammer. The new entity will be a technology partner for manufacturing and maintenance of the HAMMER Weapon System. The Indian Air Force and Navy are the primary users.,https://economictimes.indiatimes.com/markets/stocks/rssfeeds/2146843.cms
Engineers India among 4 stocks showing bullish RSI upswing,https://economictimes.indiatimes.com/markets/stocks/news/engineers-india-among-4-stocks-showing-bullish-rsi-upswing/slideshow/128405010.cms,2026-02-16 08:44:37 IST,"Four Nifty 500 stocks, including Engineers India, signalled bullish momentum after their RSI crossed above 50. The RSI Trending Up scan highlights strengthening price momentum and potential upside. Such technical signals are often tracked by traders to identify short-term buying opportunities in stocks showing improving trend strength.",https://economictimes.indiatimes.com/markets/stocks/rssfeeds/2146843.cms
"Infosys, Wipro, other IT stocks in focus after massive wipeout in 8 sessions. What’s JPMorgan saying?",https://economictimes.indiatimes.com/markets/stocks/news/infosys-wipro-other-it-stocks-in-focus-after-massive-wipeout-in-8-sessions-whats-jpmorgan-saying/articleshow/128404616.cms,2026-02-16 08:39:22 IST,"Wipro and Infosys IT stocks are in focus after a rebound. A recent sell-off wiped out significant market value. Concerns arose from AI tools automating legal tasks. However, analysts see value in beaten-down IT stocks. They highlight the indispensable role of IT services firms. The sector is adapting to new business models and AI-led development.",https://economictimes.indiatimes.com/markets/stocks/rssfeeds/2146843.cms
Manappuram Finance shares in focus as RBI clears Bain Capital’s 41.66% stake buy,https://economictimes.indiatimes.com/markets/stocks/news/manappuram-finance-shares-in-focus-as-rbi-clears-bain-capitals-41-66-stake-buy/articleshow/128404326.cms,2026-02-16 08:33:40 IST,"Manappuram Finance shares are in focus after the RBI granted final approval for Bain Capital affiliates to acquire up to 41.66% stake. Bain Capital will invest approximately Rs 4,385 crore, initially acquiring 18% and triggering a mandatory open offer for an additional 26% stake. This partnership aims to accelerate growth and strengthen investments in technology and risk management.",https://economictimes.indiatimes.com/markets/stocks/rssfeeds/2146843.cms
BSE shares in focus on Sebi nod to introduce ‘Focused Midcap Index’,https://economictimes.indiatimes.com/markets/stocks/news/bse-shares-in-focus-on-sebi-nod-to-introduce-focused-midcap-index/articleshow/128404133.cms,2026-02-16 08:22:52 IST,BSE shares are set for attention. The exchange secured Sebi's nod for new derivative contracts on its Focused Midcap Index. This expansion aligns with a new single weekly expiry rule for exchanges. The Focused Midcap Index tracks top mid-sized companies. BSE will offer monthly futures and options on this benchmark.,https://economictimes.indiatimes.com/markets/stocks/rssfeeds/2146843.cms
Ola Electric shares slide 5% as revenue slump overshadows narrower Q3 loss,https://economictimes.indiatimes.com/markets/stocks/news/ola-electric-mobility-shares-in-focus-as-q3-net-loss-narrows-to-rs-487-crore/articleshow/128403950.cms,2026-02-16 08:15:52 IST,"Ola Electric shares saw a dip following its Q3 FY26 results. The company reported a reduced net loss but a substantial revenue decline. Ola Electric is undergoing a structural reset, focusing on fundamentals over short-term volumes. Significant investments have been made in manufacturing and R&amp;D. The company aims for substantial revenue growth in the coming years.",https://economictimes.indiatimes.com/markets/stocks/rssfeeds/2146843.cms
Merger involving $61 billion of debt to support India’s credit market,https://economictimes.indiatimes.com/markets/stocks/news/merger-involving-61-billion-of-debt-to-support-indias-credit-market/articleshow/128403435.cms,2026-02-16 08:08:08 IST,"India is merging two major state-owned power lenders, Power Finance Corp. and REC Ltd. This move is expected to inject more funds into the economy and large-scale power projects. Money managers anticipate increased investment opportunities as the combined entity's bond holdings will be reallocated.",https://economictimes.indiatimes.com/markets/stocks/rssfeeds/2146843.cms
Negative Breakout: These 11 stocks close cross below their 200 DMA,https://economictimes.indiatimes.com/markets/stocks/news/negative-breakout-these-11-stocks-close-cross-below-their-200-dma/slideshow/128403664.cms,2026-02-16 07:52:57 IST,"Twenty stocks in the Nifty 500 slipped below their 200-day moving averages on February 13, signalling potential weakness in trend. Eleven stocks declined over 2%, highlighting broader selling pressure. The breach of the 200 DMA is widely viewed as a bearish indicator, reflecting weakening momentum and cautious sentiment among traders.",https://economictimes.indiatimes.com/markets/stocks/rssfeeds/2146843.cms
"Groww, BSE to Angel One: Why are brokerage stocks down up to 10% in trade today? Explained",https://www.livemint.com/market/stock-market-news/groww-bse-to-angel-one-motilal-oswal-jio-financial-why-are-brokerage-stocks-down-up-to-10-in-trade-today-explained-11771215380182.html,2026-02-16 09:48:46 IST,"Shares of BSE, Groww, Angel One, and other capital market stocks fell by up to 10% after the RBI tightened capital market exposure norms, requiring 100% collateral coverage for broker funding and increasing cash blockage for intermediaries, effective April 1, 2026.",https://www.livemint.com/rss/markets
Ola Electric Mobility share price slumps over 7% post Q3 results. Should you buy or sell?,https://www.livemint.com/market/stock-market-news/ola-electric-mobility-share-price-slumps-over-7-post-q3-results-should-you-buy-or-sell-11771214719826.html,2026-02-16 09:38:24 IST,Ola Electric Mobility share price fell over 7% after disappointing Q3 results. Emkay Global downgraded the stock rating from 'buy' to 'sell' and reduced the target price by 60% to  ₹20. The company reported a revenue decline of 57% year-over-year.,https://www.livemint.com/rss/markets
Breakout stocks to buy or sell: Sumeet Bagadia recommends three shares to buy today — 16 February 2026,https://www.livemint.com/market/stock-market-news/breakout-stocks-to-buy-or-sell-sumeet-bagadia-recommends-three-shares-to-buy-today-16-february-2026-11771212159806.html,2026-02-16 09:34:50 IST,"Breakout stocks to buy or sell: Sumeet Bagadia recommends three shares to buy today — LT Foods, Pricol, CIE Automotive India, Ajanta Pharma, and Sterlite Technologies",https://www.livemint.com/rss/markets
