title,link,published,summary,source
"Two Trades for Today: A PSU defence player for a 7.2% gain, a mid-cap auto components stock for a rise of almost 6.5%",https://economictimes.indiatimes.com/markets/stocks/news/two-trades-for-today-a-psu-defence-player-for-a-7-2-gain-a-mid-cap-auto-components-stock-for-a-rise-of-almost-6-5/articleshow/130443702.cms,2026-04-22 19:34:56 IST,Our technical analysts identify select stocks that may gain momentum even in volatile markets. Here are the technical calls for today.,https://economictimes.indiatimes.com/markets/stocks/rssfeeds/2146843.cms
Valuation Check: 9 midcap stocks trading well above industry PE,https://economictimes.indiatimes.com/markets/stocks/news/valuation-check-9-midcap-stocks-trading-well-above-industry-pe/slideshow/130442885.cms,2026-04-22 18:38:29 IST,"Midcap stocks with P/E ratios above industry averages signal strong growth expectations and investor confidence. However, elevated valuations may also indicate overpricing risks. This list highlights ten such NSE stocks, excluding financials, identified through valuation screening.",https://economictimes.indiatimes.com/markets/stocks/rssfeeds/2146843.cms
"Gold, silver rates today: Comex gold gains $70/oz; silver up $2/oz as Iran ceasefire extension boosts safe-haven demand",https://www.livemint.com/market/commodities/gold-silver-rates-today-comex-gold-gains-70-oz-silver-up-2-oz-as-iran-ceasefire-extension-boosts-safe-haven-demand-11776866961305.html,2026-04-22 20:27:12 IST,"Gold and silver prices rose over 1% on 22 April as safe-haven demand increased after President Trump extended the ceasefire with Iran. Gold futures rebounded by $70, while silver futures jumped $2.14, recovering from previous losses amid ongoing negotiations and geopolitical tensions.",https://www.livemint.com/rss/markets
Wall Street surges after Trump extends Iran ceasefire,https://www.livemint.com/market/stock-market-news/wall-street-surges-after-trump-extends-iran-ceasefire-11776864300315.html,2026-04-22 19:23:37 IST,"At 09:50 a.m. ET, the Dow Jones Industrial Average rose 0.72%, the S&amp;amp;P 500 gained 0.65%, the Nasdaq Composite gained 0.76%",https://www.livemint.com/rss/markets
"Tech Mahindra Q4 Results: Headcount falls by 1,993 as IT giant pushes for AI-driven efficiency",https://www.livemint.com/companies/tech-mahindra-q4-results-2026-headcount-falls-by-1-993-as-it-giant-pushes-for-ai-driven-efficiency-11776866159887.html,2026-04-22 19:46:56 IST,"Tech Mahindra CEO Manoj Joshi said, 'We are accelerating our transition to an AI-led organization, embedding AI across services and expanding our capabilities to enhance value delivery for our clients.'",https://www.livemint.com/rss/companies
Tech Mahindra rebounds from a two-year revenue decline,https://www.livemint.com/companies/company-results/tech-mahindra-revenue-growth-profit-turnaround-it-sector-india-results-hcl-infosys-tcs-11776859269018.html,2026-04-22 18:56:28 IST,"India’s fifth-largest IT services company saw nearly 2% growth in FY26 revenue to $6.39 billion, beating street expectations.",https://www.livemint.com/rss/companies
Mutual fund investment: From expense to risk — These are the factors you must consider before choosing a fund,https://www.livemint.com/money/personal-finance/mutual-fund-investment-these-factors-you-must-consider-ahead-choose-fund-growth-performance-expense-ratio-risk-appetite-11776860470881.html,2026-04-22 20:35:12 IST,"Mutual fund investments are considered among the best ways for an ordinary investor to book capital gains. However, there are varying levels of risk attached based on the type of scheme. Here's what you should consider before picking one.",https://www.livemint.com/rss/money
DA hike: Finance Ministry increases Dearness Allowance for central govt employees by 2% wef 1 January 2026,https://www.livemint.com/money/personal-finance/da-hike-finance-ministry-increase-dearness-allowance-central-government-employees-2-percent-basic-pay-wef-1-january-2026-11776865418204.html,2026-04-22 19:21:33 IST,"The Ministry of Finance on 22 April announced revision of rates of Dearness Allowance (DA) for central government employees, effective from 1 January 2026. Here's all we know so far…",https://www.livemint.com/rss/money
Savings of  ₹50 lakh? How inflation and lifestyle determine if your money lasts or runs out,https://www.livemint.com/money/personal-finance/savings-of-50-lakh-how-inflation-and-lifestyle-determine-if-your-money-lasts-or-runs-out-11776860464817.html,2026-04-22 18:57:59 IST,"A big reality check on  ₹50 lakh in savings in India shows how inflation, lifestyle expenses, and location determine how long the corpus lasts and whether it builds long-term financial security.&amp;nbsp;",https://www.livemint.com/rss/money
"These mid-cap stocks with ‘Strong Buy’ &amp; ‘Buy’ recos can rally over 25%, according to analysts",https://economictimes.indiatimes.com/markets/stocks/news/these-mid-cap-stocks-with-strong-buy-buy-recos-can-rally-over-25-according-to-analysts/articleshow/130447059.cms,2026-04-22 22:08:43 IST,"Over the next few sessions, as the uncertainty caused by the Gulf war intensifies and makes you anxious, remember this: It is not the first time (nor will it be the last) that global markets have witnessed such phases. Similar scenarios have played out in the past; and at particular points of time, it had appeared that everything would crash and the world would come to an end. But the world is much stronger than we think.",https://economictimes.indiatimes.com/markets/stocks/rssfeeds/2146843.cms
Ahead of Market: 10 things that will decide stock market action on Thursday,https://economictimes.indiatimes.com/markets/stocks/news/ahead-of-market-10-things-that-will-decide-stock-market-action-on-thursday/articleshow/130445804.cms,2026-04-22 21:02:10 IST,"Nifty 50 and BSE Sensex declined, snapping a three-day rally due to IT and FMCG losses. Rising India VIX signaled caution, though broader trends remain positive with key support and resistance levels in focus.",https://economictimes.indiatimes.com/markets/stocks/rssfeeds/2146843.cms
Tesla stock rises over 1% as analysts predict exceptional Q1 earnings,https://www.livemint.com/market/tesla-stock-rises-over-1-as-analysts-predict-exceptional-q1-earnings-11776874932456.html,2026-04-22 22:15:57 IST,Wall Street analysts forecast that the electric carmaker’s adjusted quarterly earnings will surge 30% in first quarter of 2026 as compared to the previous year,https://www.livemint.com/rss/markets
GE Vernova shares jump over 15% to record high after company raises 2026 outlook on data centre demand,https://www.livemint.com/market/stock-market-news/ge-vernova-shares-jump-over-15-to-record-high-after-company-raises-2026-outlook-on-data-centre-demand-11776871936817.html,2026-04-22 21:45:32 IST,"GE Vernova's shares surged 15.2% to $1,142 after raising its full-year outlook and reporting strong Q1 results, with revenue up 16% YoY to $9.3 billion and a profit of $4.8 billion. The company anticipates 2026 revenue between $44.5 billion and $45.5 billion.",https://www.livemint.com/rss/markets
"Jio, Allianz form 50-50 joint venture to set up non-life insurance company",https://www.livemint.com/companies/jio-allianz-form-50-50-joint-venture-to-set-up-non-life-insurance-company-bajaj-finserv-11776864087974.html,2026-04-22 21:03:31 IST,"The partnership will harness Jio’s massive digital reach and Allianz’s global expertise to build a ‘new model’ for general and health insurance in India, the two companies said on Wednesday.",https://www.livemint.com/rss/companies
"Direct funds vs regular funds: Differences, key things to remember, and which option investors should choose",https://www.livemint.com/money/personal-finance/direct-funds-vs-regular-funds-differences-mutual-fund-investors-choose-commission-charges-interest-payout-key-highlights-11776868060168.html,2026-04-22 22:04:08 IST,"Direct funds are plans where investors apply directly with a fund house without an agent, bank or broker. While this eliminates commission fees, they demand more markets knowledge from investors. Here's what you need to keep in mind…",https://www.livemint.com/rss/money
"SBI Life-owned NBFC sets board meeting date to declare Q4 results 2026, dividend",https://www.livemint.com/market/stock-market-news/sbi-life-owned-nbfc-sets-board-meeting-date-to-declare-q4-results-2026-dividend-11776874379974.html,2026-04-22 22:36:02 IST,"Paisalo Digital's board will meet on May 10, 2026, to approve Q4 FY26 financial results and consider a final dividend. The company is transitioning to an AI-powered lending platform, aiming to double AUM, revenue, and profitability within three years.",https://www.livemint.com/rss/markets
TMX Group to acquire Cboe Global’s Australian and Canadian operations for $300 million,https://www.livemint.com/companies/tmx-group-to-acquire-cboe-global-s-australian-and-canadian-operations-for-300-million-11776878305823.html,2026-04-22 23:04:04 IST,"The acquisition, which encompasses the Cboe Australia and Cboe Canada exchanges, is designed to accelerate TMX's expansion into high-growth segments including digital assets, derivatives, and prediction markets",https://www.livemint.com/rss/companies
Senior Citizen Savings Scheme vs Fixed Deposits: Which gives better interest rates over five-year investment period?,https://www.livemint.com/money/personal-finance/senior-citizen-savings-scheme-scss-8-2-pc-fixed-deposit-7-better-interest-rate-5-yr-investment-sbi-hdfc-bank-icici-axis-11776872775879.html,2026-04-22 23:05:32 IST,"Among the safest investment tools in India, bank deposits and the government's Senior Citizen Savings Scheme (SCSS) are the preferred choice for retired investors seeking steady payouts and guaranteed returns.",https://www.livemint.com/rss/money
"Stocks rise on ceasefire relief, oil gains as truce is tested",https://www.livemint.com/market/stocks-rise-on-ceasefire-relief-oil-gains-as-truce-is-tested-11776885081835.html,2026-04-23 00:41:21 IST,"GLOBAL-MARKETS:Stocks rise on ceasefire relief, oil gains as truce is tested",https://www.livemint.com/rss/markets
Dollar gains as Iran war keeps central banks in wait-and-see mode,https://www.livemint.com/market/dollar-gains-as-iran-war-keeps-central-banks-in-wait-and-see-mode-11776884766255.html,2026-04-23 00:36:05 IST,GLOBAL-FOREX:Dollar gains as Iran war keeps central banks in wait-and-see mode,https://www.livemint.com/rss/markets
Oil Servicer Weatherford Sees War Impacts Deepening This Quarter,https://www.livemint.com/companies/oil-servicer-weatherford-sees-war-impacts-deepening-this-quarter-11776883146717.html,2026-04-23 00:09:06 IST,"Weatherford International Plc., one of the world’s largest oilfield-service providers, is warning that a hit to earnings in the wake of the Iran war will get worse this quarter, before an eventual rebound.",https://www.livemint.com/rss/companies
"Exclusive-Thoma Bravo nears agreement to turn software firm Medallia over to creditors, source says",https://www.livemint.com/companies/exclusivethoma-bravo-nears-agreement-to-turn-software-firm-medallia-over-to-creditors-source-says-11776882773777.html,2026-04-23 00:02:53 IST,"THOMABRAVO-MEDALLIA:Exclusive-Thoma Bravo nears agreement to turn software firm Medallia over to creditors, source says",https://www.livemint.com/rss/companies
Can American customers expect any benefit as US companies seek tariff refunds?,https://www.livemint.com/money/personal-finance/can-american-customers-expect-any-benefit-as-us-companies-seek-tariff-refunds-donald-trump-supreme-court-order-portal-11776878399449.html,2026-04-22 23:50:22 IST,"The US government has launched the CAPE portal for businesses to apply for tariff refunds after SCOTUS deemed Trump's tariff regime illegal. However, companies are unlikely to pass on the benefit to Americans.",https://www.livemint.com/rss/money
Bessent says 'many' U.S. allies have asked for currency swaps amid Iran war turbulence,https://www.cnbc.com/2026/04/22/iran-war-treasury-uae-scott-bessent-currency-swaps.html,2026-04-23 00:16:20 IST,The White House on Tuesday said the UAE had not requested a currency swap line.,https://www.cnbc.com/id/10000664/device/rss/rss.html
