title,link,published,summary,source
"Stock market today: Gift Nifty, US-Iran war, India VIX to gold, silver rates; five stocks to buy or sell — 20 March 2026",https://www.livemint.com/market/stock-market-news/stock-market-today-gift-nifty-us-iran-war-india-vix-to-gold-silver-rates-five-stocks-to-buy-or-sell-20-march-2026-11773969142535.html,2026-03-20 08:55:09 IST,"Stock market today: Experts have recommended these five stocks to buy today — Safari Industries, Thomas Cook, ONGC, Power Grid Corporation, and OIL",https://www.livemint.com/rss/markets
"Central Mine Planning IPO Day 1: Issue opens today. Check GMP, review, key details to know. Should you apply or not?",https://www.livemint.com/market/ipo/central-mine-planning-ipo-day-1-issue-opens-today-check-gmp-review-key-details-to-know-should-you-apply-or-not-11773974140210.html,2026-03-20 08:43:07 IST,"The CMPDIL IPO opens for subscription from March 20 to March 24, with a price band of  ₹163 to  ₹172 per share. The company has raised  ₹470 crore from anchor investors and allocated shares for institutional and retail buyers.",https://www.livemint.com/rss/markets
Stocks to buy or sell: Ajit Mishra of Religare Broking suggests strategies for 3 shares,https://www.livemint.com/market/stock-market-news/stocks-to-buy-or-sell-from-power-grid-to-tata-power-ajit-mishra-of-religare-broking-suggests-strategies-for-3-shares-11773972296267.html,2026-03-20 07:59:50 IST,"Ajit Mishra, SVP of Research at Religare Broking, shares his near-term strategy for Power Grid Corporation of India, Tata Power Company, and PG Electroplast. Mishra believes the Nifty 50 has immediate support in the range of 22,500–22,800, while 23,400–23,600 range is strong resistance.",https://www.livemint.com/rss/markets
"Stock Market Today March 20 LIVE: Sensex rallies 900 pts, Nifty above 23,200 as crude oil prices fall; PSU Banks soar",https://www.livemint.com/market/stock-market-news/stock-market-today-march-20-live-sensex-today-gift-nifty-gold-rate-crude-oil-prices-us-iran-war-nasdaq-hdfc-bank-11773973359463.html,2026-03-20 07:59:25 IST,"Stock Market Today March 20 LIVE: Sensex, Nifty gained in trade on Friday, March 20 recovering from steep losses in previous session. Sentiment was aided by fall in oil prices and well as a softer dollar.  Sensex surged 883 points or 1.1% to 75,093 while Nifty rallied 254 points or 1.1% to 23,254.",https://www.livemint.com/rss/markets
"Raja Venkatraman, MarketSmith recommend five stocks for 20 March",https://www.livemint.com/market/stock-market-news/raja-venkatraman-marketsmith-recommend-five-stocks-for-20-march-11773970458527.html,2026-03-20 07:55:16 IST,"On March 19, Nifty 50 and Sensex dropped over 3% due to HDFC Bank chairman's resignation and rising crude oil prices. Analysts recommend buying Ipca Laboratories, Great Eastern Shipping, Colgate Palmolive, Glenmark Pharmaceuticals, and Power Finance Corporation amid market volatility.",https://www.livemint.com/rss/markets
Super Micro Computer stock price crashes 12% in post-market hours; here's why,https://www.livemint.com/market/stock-market-news/super-micro-computer-stock-price-crashes-12-in-post-market-hours-heres-why-11773972180744.html,2026-03-20 07:47:41 IST,Super Micro Computer share price crashed in post-market hours after finishing around 1.50% higher,https://www.livemint.com/rss/markets
"Gold, Silver Rates Today LIVE: MCX gold rate jumps above  ₹1.47 lakh per 10 grams; silver prices spike 3%",https://www.livemint.com/market/commodities/gold-silver-rates-today-live-gold-rate-today-silver-prices-us-iran-war-us-fed-rate-cut-dollar-crude-oil-donald-trump-11773972370171.html,2026-03-20 07:41:46 IST,"Gold, Silver Rates Today LIVE: Gold and silver prices traded higher after steep losses witnessed earlier this week. Gold prices were headed for a third consecutive weekly decline, weighed down by a firm dollar and a hawkish US Federal Reserve as interest rate cut hopes dampened.",https://www.livemint.com/rss/markets
"Nifty 50, Sensex today: What to expect from Indian stock market in trade on March 20",https://www.livemint.com/market/stock-market-news/nifty-50-sensex-today-what-to-expect-from-indian-stock-market-in-trade-on-march-20-11773938973813.html,2026-03-20 07:17:46 IST,"Nifty 50, Sensex today: The trends on Gift Nifty also indicate a positive start for the Indian benchmark index. The Gift Nifty was trading around 23,250 level, a premium of nearly 195 points from the Nifty futures’ previous close.",https://www.livemint.com/rss/markets
SBI shares jump 3% after subsidiary SBI Funds Management files draft IPO papers,https://economictimes.indiatimes.com/markets/stocks/news/sbi-shares-jump-3-after-subsidiary-sbi-funds-management-files-draft-ipo-papers/articleshow/129693172.cms,2026-03-20 11:12:33 IST,"Shares of State Bank of India (SBI) rose sharply after its subsidiary SBI Funds Management filed draft IPO papers with Sebi for a pure offer for sale of 20.37 crore shares. Proceeds will go to selling shareholders, including SBI and Amundi India Holding.",https://economictimes.indiatimes.com/markets/stocks/rssfeeds/2146843.cms
83% BSE 500 stocks suffer losses amid Iran-Israel war; 101 slump in double digits up to 35%. Do you own any?,https://economictimes.indiatimes.com/markets/stocks/news/83-bse-500-stocks-suffer-losses-amid-iran-israel-war-101-slump-in-double-digits-up-to-35-do-you-own-any/articleshow/129692609.cms,2026-03-20 10:33:48 IST,"The Iran-Israel/US war has triggered a broad sell-off in Indian equities, with 83% of BSE 500 stocks trading in the red. Rising energy prices and the US Federal Reserve holding interest rates have compounded market woes, alongside a falling rupee. Company-specific issues, like IDBI Bank's divestment concerns, have also impacted sentiment.",https://economictimes.indiatimes.com/markets/stocks/rssfeeds/2146843.cms
"HPCL, BPCL, IOCL shares rebound up to 6%. Here are two reasons behind renewed buying",https://economictimes.indiatimes.com/markets/stocks/news/hpcl-bpcl-iocl-shares-rebound-up-to-6-here-are-two-reasons-behind-renewed-buying/articleshow/129692523.cms,2026-03-20 10:30:19 IST,"Shares of Hindustan Petroleum, Indian Oil, and Bharat Petroleum saw significant gains on Friday. This surge followed a statement from Israeli Prime Minister Benjamin Netanyahu indicating a de-escalation of conflict with Iran. Crude oil prices eased as a result. The rally also reflects a technical rebound after recent declines. Investors are watching geopolitical developments closely.",https://economictimes.indiatimes.com/markets/stocks/rssfeeds/2146843.cms
"Buy, Sell or Hold: Citi upgrades Dr Lal PathLabs; JM Financial initiates coverage on Balkrishna Industries",https://economictimes.indiatimes.com/markets/stocks/news/buy-sell-or-hold-citi-upgrades-dr-lal-pathlabs-jm-financial-initiates-coverage-on-balkrishna-industries/articleshow/129691893.cms,2026-03-20 09:41:39 IST,"Brokerages like Morgan Stanley, Citi, and JM Financial remain selectively positive on Indian equities, spotting opportunities in sectors like agrochemicals, diagnostics, and tyres. Despite near-term challenges such as export weakness, firms with strong fundamentals, global exposure, and structural growth drivers continue to offer a constructive investment outlook.",https://economictimes.indiatimes.com/markets/stocks/rssfeeds/2146843.cms
Tata Power share price jumps 5% after signing PPA with Gujarat govt,https://www.livemint.com/market/stock-market-news/tata-power-share-price-jumps-5-after-signing-ppa-with-gujarat-govt-11773983589172.html,2026-03-20 11:12:58 IST,"Tata Power rose 5% after Gujarat approved a new power supply agreement, allowing the co to restart its 4-gigawatt Mundra facility. The agreement aims to boost electricity production amid potential gas shortages, pending approval from the federal regulator, effective retroactively from April 2025.",https://www.livemint.com/rss/markets
"GSP Crop Science IPO allotment date today. Latest GMP, steps to check allotment status online",https://www.livemint.com/market/ipo/gsp-crop-science-ipo-allotment-date-today-latest-ipo-gmp-steps-to-check-ipo-allotment-status-online-11773984706325.html,2026-03-20 11:10:19 IST,"GSP Crop Science IPO allotment date is expected to be finalized on March 20. Investors can check their allotment status online via NSE, BSE, or MUFG Intime. The IPO was subscribed 1.64 times, and shares are set to debut on March 24.",https://www.livemint.com/rss/markets
Nifty 50 to Sensex: Why is the Indian stock market up today? Explained,https://www.livemint.com/market/stock-market-news/us-iran-war-nifty-50-to-sensex-why-is-the-indian-stock-market-up-today-explained-with-us-dollar-rate-oil-price-11773984468877.html,2026-03-20 11:09:11 IST,"Stock market today: Experts attribute the rise to easing US-Iran tensions and a relief rally following recent short selling, though caution is advised amid significant geopolitical risks.",https://www.livemint.com/rss/markets
"Buy or sell: Amid stock market rebound, Vaishali Parekh recommends three intraday stocks to buy today — 20 March 2026",https://www.livemint.com/market/stock-market-news/buy-or-sell-amid-stock-market-rebound-vaishali-parekh-recommends-three-intraday-stocks-to-buy-today-20-march-2026-11773978999820.html,2026-03-20 10:12:58 IST,"Buy or sell stocks on 20 March: Vaishali Parekh recommends three intraday stocks for today — Praj Industries, Power Grid Corporation, and Siemens",https://www.livemint.com/rss/markets
"Rajesh Palviya of Axis Sec suggests ACME Solar, Shriram Finance, Hindalco shares to buy today",https://www.livemint.com/market/stock-market-news/rajesh-palviya-of-axis-sec-suggests-acme-solar-shriram-finance-hindalco-shares-to-buy-today-11773979871730.html,2026-03-20 10:03:58 IST,"On March 20, Nifty 50 and Sensex opened higher after a significant drop, buoyed by easing oil prices. The indices experienced a decline of 3.3% previously, with HDFC Bank losses leading. ACME Solar shows bullish momentum while Shriram Finance and Hindalco indicate bearish trends.",https://www.livemint.com/rss/markets
"SBI, Canara Bank, BoB to PNB: PSU bank stocks rise up to 5% following stock market rebound",https://www.livemint.com/market/sbi-canara-bank-bob-to-pnb-psu-bank-stocks-rise-up-to-5-following-stock-market-rebound-11773980122453.html,2026-03-20 09:50:23 IST,"The Nifty PSU Bank index rose nearly 4% on March 20, reversing a previous 3% decline. Broader market gains and easing crude oil prices boosted sentiment. Key banks like Canara Bank and Union Bank saw significant increases, with all constituents trading positively.",https://www.livemint.com/rss/markets
Central Mine Planning IPO Day 1 LIVE Updates 2026: Central Mine Planning IPO booked 2% — GMP tepid; should you apply?,https://www.livemint.com/market/ipo/central-mine-planning-ipo-day-1-2026-allotment-date-price-band-gmp-listing-grey-market-premium-subscription-status-check-11773979166642.html,2026-03-20 09:42:26 IST,"Central Mine Planning IPO Day 1 Live Updates 2026: The initial public offering (IPO) of Central Mine Planning opened for bidding today. The offer is witnessing a slow response to its offering, booked just 1% in 40 mins.",https://www.livemint.com/rss/markets
"Mint Explainer | Why Big Food is cutting back: Slow growth, new health trends, and GLP-1 drugs push giants to exit",https://www.livemint.com/companies/global-food-companies-unilever-nestl-kraft-heinz-fmcg-exit-food-business-spin-off-packaged-food-market-india-glp-1-drug-11773981392359.html,2026-03-20 11:08:35 IST,"From slow growth to changing consumer habits and the rise of weight-loss drugs, major FMCG players are rethinking their portfolios, a stark contrast to India's booming food market.",https://www.livemint.com/rss/companies
Crypto.com layoffs: Company to cut 12% workforce as AI push reshapes operations — all you need to know,https://www.livemint.com/companies/news/cryptocom-layoffs-company-to-cut-12-workforce-as-ai-push-reshapes-operations-all-you-need-to-know-11773975062689.html,2026-03-20 10:08:51 IST,"Layoffs continue in the tech sector as companies like Meta and Crypto.com cut jobs to adapt to AI-driven changes. This year, over 39,000 employees have been affected, highlighting a significant shift in corporate strategies towards AI and efficiency.",https://www.livemint.com/rss/companies
"How to split  ₹50,000 monthly income: 5 smart budgeting rules to manage expenses and build wealth",https://www.livemint.com/money/personal-finance/how-to-split-50-000-monthly-income-5-smart-budgeting-rules-to-manage-expenses-and-build-wealth-11773982827110.html,2026-03-20 11:14:28 IST,"Effective salary splitting and budgeting depend on personal financial situations. Common strategies include 50-30-20 and 70-20-10 rules. Engaging a financial advisor before making decisions helps in managing expenses, savings, and aligning financial goals for better wealth management.",https://www.livemint.com/rss/money
Rs 1 lakh crore wiped off! Bajaj Finance shares tumble 18% in March so far amid raging Iran-US war,https://economictimes.indiatimes.com/markets/stocks/news/rs-1-lakh-crore-wiped-off-bajaj-finance-shares-tumble-18-in-march-so-far-amid-raging-iran-us-war/articleshow/129694027.cms,2026-03-20 12:00:44 IST,"Bajaj Finance shares have plunged over 20% in a month, eroding more than Rs 1 lakh crore in market value amid escalating Iran-US tensions. Rising oil prices, inflation concerns and macroeconomic risks flagged by Moody’s have weighed on sentiment, dragging financial stocks lower and keeping investors cautious amid ongoing geopolitical uncertainty.",https://economictimes.indiatimes.com/markets/stocks/rssfeeds/2146843.cms
Tata Power shares jump 5% after Gujarat govt approves supply agreement for Mundra plant,https://economictimes.indiatimes.com/markets/stocks/news/tata-power-shares-jump-5-after-gujarat-govt-approves-supply-agreement-for-mundra-plant/articleshow/129693407.cms,2026-03-20 11:25:15 IST,Tata Power shares surged after Gujarat approved a new power supply deal. This allows the company to restart its 4-gigawatt Mundra plant. The agreement aims to boost power output amid potential summer gas shortages. It requires federal approval and takes effect from April 2025. Tariffs will align with other states. This development offers relief to India's energy sector.,https://economictimes.indiatimes.com/markets/stocks/rssfeeds/2146843.cms
"Gold price today: Rates rise nearly 2% after 5% fall; check 20 March prices in Delhi, Mumbai, Bengaluru and other cities",https://www.livemint.com/market/commodities/gold-price-today-rates-rise-nearly-2-after-5-fall-check-20-march-prices-in-delhi-mumbai-bengaluru-and-other-cities-11773981325757.html,2026-03-20 11:35:21 IST,"Gold prices are influenced by central bank purchases and geopolitical tensions, with a positive long-term outlook. Short-term pressures from a stronger US dollar are noted, while recent price increases reflect safe-haven demand amidst ongoing economic uncertainty and conflict in the Middle East.",https://www.livemint.com/rss/markets
"Sensex, Nifty 50, Bank Nifty jump more than 1% each: Has Indian stock market bottomed out after Thursday's crash?",https://www.livemint.com/market/stock-market-news/sensex-nifty-50-bank-nifty-jump-more-than-1-each-has-indian-stock-market-bottomed-out-after-thursdays-crash-11773981304961.html,2026-03-20 11:31:08 IST,"The Sensex, Nifty 50, and Bank Nifty are witnessing a relief rally after Thursday's massive fall, driven by a slight decline in crude oil prices, hopes that the worst in terms of war may be over, and valuations coming to fair levels, especially in the large cap segments.",https://www.livemint.com/rss/markets
"Speciality Medicines IPO opens: Issue booked 15% so far; check GMP, price band and other key details about SME IPO",https://www.livemint.com/market/ipo/speciality-medicines-ipo-opens-issue-booked-15-so-far-check-gmp-price-band-and-other-key-details-about-sme-ipo-11773986040233.html,2026-03-20 11:29:37 IST,"Speciality Medicines IPO Day 1: Speciality Medicines IPO, worth  ₹29 crore, opened for bidding today and will available till March 24. The offer is entirely a fresh share sale. Speciality Medicines IPO GMP remains nil.",https://www.livemint.com/rss/markets
"Innovision IPO allotment status finalised. GMP, steps to check share allotment status online",https://www.livemint.com/market/ipo/innovision-ipo-allotment-status-finalised-gmp-steps-to-check-share-allotment-status-online-11773985108394.html,2026-03-20 11:23:40 IST,"Innovision IPO allotment status online check can be done through the websites of BSE and NSE, and also on the official portal of the IPO registrar. Kfin Technologies is the Innovision IPO registrar.",https://www.livemint.com/rss/markets
"Rentomojo aims to raise up to  ₹1,200 cr via IPO, to file draft papers soon",https://www.livemint.com/companies/start-ups/rentomojo-ipo-subscription-model-startups-india-furniture-rental-11773983868722.html,2026-03-20 12:15:04 IST,"Furniture rental startup Rentomojo plans to raise  ₹1,000–1,200 crore via IPO in FY27, largely through OFS, as it targets a  ₹5,000–7,000 crore valuation amid volatile markets.",https://www.livemint.com/rss/companies
