title,link,published,summary,source
ITR Filing AY 2026-27: Don't miss any bank account while filing your tax return. Here's why,https://www.livemint.com/money/personal-finance/income-tax-return-filing-2026-dont-miss-these-bank-accounts-while-filing-itr-11784448062831.html,2026-07-19 13:39:34 IST,"The ITR forms for AY 2026-27 require taxpayers to disclose all Indian bank accounts held during FY 2025-26, except officially dormant accounts. Accurate bank details are also essential for timely income tax refunds.",https://www.livemint.com/rss/money
"iD Fresh banks on overseas markets, higher margins to become IPO-ready by Oct 2027",https://www.livemint.com/companies/id-fresh-banks-on-overseas-markets-higher-margins-to-become-ipo-ready-by-oct-2027-ready-to-cook-foods-11784442803786.html,2026-07-19 17:18:15 IST,"Ahead of its planned IPO, iD Fresh is targeting best-in-class profitability, expanding into snacks and scaling new product launches as quick commerce reshapes India's ready-to-cook foods market.",https://www.livemint.com/rss/companies
Samsung layoffs: Over 800 US workers affected by Texas headquarters move,https://www.livemint.com/companies/news/samsung-layoffs-800-plus-us-workers-affected-by-texas-headquarters-move-11784453784334.html,2026-07-19 15:58:39 IST,"Samsung layoffs: 739 positions at Samsung Electronics America in Englewood Cliffs, New Jersey, were impacted as part of the company's plan to relocate its U.S. consumer electronics headquarters to Texas",https://www.livemint.com/rss/companies
"DA hike: Here's the full list of states that are considering Dearness Allowance increases for employees, pensioners",https://www.livemint.com/money/personal-finance/da-hike-punjab-himachal-pradesh-west-bengal-kerala-full-list-states-considering-dearness-allowance-employees-pensioners-11784457148727.html,2026-07-19 17:15:20 IST,Dearness Allowance is the component of the basic salary periodically adjusted to counter increased cost-of-living due to inflation. Here's what we know about state governments' discussions on DA hikes. a,https://www.livemint.com/rss/money
"Don't miss this tax benefit: How car buyers can claim a minimum  ₹10,000 refund",https://www.livemint.com/money/personal-finance/dont-miss-this-tax-benefit-how-car-buyers-can-claim-a-minimum-10-000-refund-11784458494847.html,2026-07-19 17:15:02 IST,Car buyers may be eligible for an income tax refund due to 1% TCS collected on vehicle purchases exceeding  ₹10 lakh. This amount can be lower you tax liability or get you a refund if their tax payable is less than the TCS paid. Details here.,https://www.livemint.com/rss/money
"TDS Return Filing 2026: Q1 Due on July 31, Check New Forms and Section Codes",https://www.livemint.com/money/personal-finance/tds-return-filing-2026-q1-due-on-july-31-check-new-forms-and-section-codes-11784458815759.html,2026-07-19 16:38:51 IST,"Businesses and tax deductors must file Q1 TDS and TCS returns by July 31, 2026 using the new return forms and revised section codes under the Income-tax Act, 2025. Here's what has changed, the new forms to use, and the compliance steps to avoid filing errors.",https://www.livemint.com/rss/money
The F&amp;O trap inside the barracks: How army officers are losing crores chasing the next trade,https://www.livemint.com/money/personal-finance/the-f-o-trap-inside-the-barracks-how-army-officers-are-losing-crores-chasing-the-next-trade-11784376144752.html,2026-07-19 16:07:06 IST,"Stable salaries, easy access to credit and early trading wins are drawing serving and retired defence personnel into a cycle of leveraged bets—and mounting losses",https://www.livemint.com/rss/money
ITR filing 2026: Secondary address field is now mandatory — here's how it can help taxpayers,https://www.livemint.com/money/personal-finance/itr-filing-2026-secondary-address-field-is-now-mandatory-heres-how-it-can-help-taxpayers-11784463733314.html,2026-07-19 18:31:36 IST,"The income tax department has mandated a secondary address field in all ITR forms for AY 2026-27, requiring additional communication details from taxpayers. Here's how it can help taxpayers.&amp;nbsp;",https://www.livemint.com/rss/money
8th pay commission: Here's why NC-JCM wants employee levels combined — Pay scale merger proposal explained,https://www.livemint.com/money/personal-finance/8th-pay-commission-cpc-why-nc-jcm-demand-employee-levels-combined-pay-scale-merger-proposal-explained-salary-hike-matrix-11784464357324.html,2026-07-19 18:30:34 IST,"The 8th pay commission: Meetings with employee groups is significant as their suggestions are expected to shape the panel's deliberations on remuneration, allowances, pay and pension structures for the central government workforce.",https://www.livemint.com/rss/money
Kalshi adds 3 million new users as prediction market capitalizes on the World Cup,https://www.cnbc.com/2026/07/19/kalshi-adds-3-million-new-users-as-company-capitalizes-on-world-cup.html,2026-07-19 18:12:30 IST,"The prediction market has launched some ads featuring soccer players, as well as formed a partnership to display its brand in more places during the tournament.",https://www.cnbc.com/id/10000664/device/rss/rss.html
