title,link,published,summary,source
"Stocks to buy in 2026 for long term: Crompton Greaves, Blue Dart among 5 stocks that could give 10-20% return",https://economictimes.indiatimes.com/markets/stocks/news/stocks-to-buy-in-2026-for-long-term-crompton-greaves-blue-dart-among-5-stocks-that-could-give-10-20-return/slideshow/131106286.cms,2026-05-15 07:37:33 IST,We have collated a list of recommendations from top brokerage firms from ETNow and other sources.,https://economictimes.indiatimes.com/markets/stocks/rssfeeds/2146843.cms
"Vedanta, Hindalco, other metal stocks rally up to 11% in one week. Should you buy or wait? Here's what analysts say",https://economictimes.indiatimes.com/markets/stocks/news/vedanta-hindalco-other-metal-stocks-rally-up-to-11-in-one-week-should-you-buy-or-wait-heres-what-analysts-say/articleshow/131106222.cms,2026-05-15 07:36:27 IST,"Metal stocks are experiencing a strong rally. Shares of Adani Enterprises, Hindalco Industries, and Vedanta have surged. Analysts recommend patience. Investors should buy on dips rather than chase momentum. Several factors are driving this surge, including government import duty hikes on gold and silver. Strong industrial demand and supply disruptions are also supporting prices.",https://economictimes.indiatimes.com/markets/stocks/rssfeeds/2146843.cms
Simca Advertising shares to list today. Check GMP ahead of debut,https://economictimes.indiatimes.com/markets/stocks/news/simca-advertising-shares-to-list-today-check-gmp-ahead-of-debut/articleshow/131106193.cms,2026-05-15 07:33:12 IST,"Simca Advertising's IPO saw robust investor demand, subscribed over 80 times, yet a modest grey market premium suggests a subdued stock market debut. The out-of-home advertising firm, focusing on Mumbai and Maharashtra, plans to use IPO funds for expansion and digital asset monetization. Despite strong financials, market watchers anticipate a muted listing.",https://economictimes.indiatimes.com/markets/stocks/rssfeeds/2146843.cms
Dalal Street set for negative opening as GIFT Nifty trades lower,https://economictimes.indiatimes.com/markets/stocks/news/pre-market-action-heres-the-trade-setup-for-todays-session/articleshow/131105882.cms,2026-05-15 06:41:06 IST,"Nifty closed at 23,690 on Thursday. IT shares faced pressure from global AI competition. Markets will watch West Asia conflict, energy prices, and foreign fund flows. A move above 23,800 could boost Nifty higher. Failure to hold this level may bring selling pressure. India VIX fell. SAIL and Kaynes are in F&amp;O ban. Foreign investors bought shares.",https://economictimes.indiatimes.com/markets/stocks/rssfeeds/2146843.cms
"Stocks in news: Adani Enterprises, Tata Motors PV, Tata Steel, Jio Financial, ITC Hotels",https://economictimes.indiatimes.com/markets/stocks/news/stocks-in-news-adani-enterprises-tata-motors-pv-tata-steel-jio-financial-itc-hotels/articleshow/131105846.cms,2026-05-15 06:35:34 IST,"Markets extended their rebound for a second consecutive session on Thursday, buoyed by supportive global cues and selective buying in heavyweight stocks. Banking majors played a crucial role in the relief rally, while IT stocks remained under pressure. Several companies, including Adani Enterprises, Tata Motors PV, and JSW Steel, were in focus due to significant block deals and financial results.",https://economictimes.indiatimes.com/markets/stocks/rssfeeds/2146843.cms
Sebi proposes key tweaks to streamline derivatives trading,https://economictimes.indiatimes.com/markets/stocks/news/sebi-proposes-key-tweaks-to-streamline-derivatives-trading/articleshow/131105642.cms,2026-05-15 06:07:16 IST,"Sebi proposes simplifying exchange-traded and commodity derivatives regulations by removing complex close-to-money (CTM) option rules and reducing mandatory product advisory committee meeting frequency. These changes aim to ease compliance and reduce uncertainty for market participants, aligning with international practices.",https://economictimes.indiatimes.com/markets/stocks/rssfeeds/2146843.cms
Brokerages turn cautious after Kaynes' weak Q4 performance,https://economictimes.indiatimes.com/markets/stocks/news/brokerages-turn-cautious-after-kaynes-weak-q4-performance/articleshow/131105623.cms,2026-05-15 06:02:29 IST,Kaynes Technology shares saw a sharp 20% fall. This followed a disappointing March quarter earnings report and missed revenue forecasts. Analysts have downgraded the stock. Concerns about execution delays and working capital are impacting investor sentiment. The company's stock had previously surged significantly since its listing.,https://economictimes.indiatimes.com/markets/stocks/rssfeeds/2146843.cms
"Global investors Temasek, Alpha Wave Global eye $1.3 bn investment in Adani Airports",https://economictimes.indiatimes.com/markets/stocks/news/global-investors-temasek-alpha-wave-global-eye-1-3-bn-investment-in-adani-airports/articleshow/131105713.cms,2026-05-15 06:00:00 IST,"In all, four investors are expected to join the consortium seeking a stake in India's largest private airport operator, betting that air traffic growth will continue to rise in India. The identity of the other two investors could not be independently verified.",https://economictimes.indiatimes.com/markets/stocks/rssfeeds/2146843.cms
"BoB looks to sell Rs 2,700 crore of NPAs; taps ARCs, NBFCs",https://economictimes.indiatimes.com/markets/stocks/news/bob-looks-to-sell-rs-2700-crore-of-npas-taps-arcs-nbfcs/articleshow/131105603.cms,2026-05-15 05:56:35 IST,"Bank of Baroda is selling a ₹2,776 crore portfolio of 41 stressed loans, including nine declared fraud accounts like Ushdev International and Nirmal Lifestyle. The sale, conducted on a cash basis with assets transferred ""as is where is, without recourse,"" aims to clean the bank's books.",https://economictimes.indiatimes.com/markets/stocks/rssfeeds/2146843.cms
AI reset erases nearly half of IT majors’ value,https://economictimes.indiatimes.com/markets/stocks/news/ai-reset-erases-nearly-half-of-it-majors-value/articleshow/131105553.cms,2026-05-15 05:43:56 IST,"India's top software exporters are projected to lose $200 bn in market value from their peaks due to disruptive AI technology.  The aggregate market cap has already fallen by 45% since December 2024, with TCS and Wipro experiencing over 50% declines. This erosion, while significant in absolute terms, is not unprecedented for the sector.",https://economictimes.indiatimes.com/markets/stocks/rssfeeds/2146843.cms
D-St surges 1% on reports govt to cut tax on foreign bond bets,https://economictimes.indiatimes.com/markets/stocks/news/d-st-surges-1-on-reports-govt-to-cut-tax-on-foreign-bond-bets/articleshow/131105504.cms,2026-05-15 05:31:53 IST,"Indian stock markets surged on Thursday. The Nifty and Sensex saw significant gains. This rise was driven by reports of a potential tax cut on foreign investments in Indian bonds. The rupee also strengthened. This news eased investor concerns. Pharma, Metal, and Financial Services sectors performed well. Foreign and domestic institutions were net buyers of shares.",https://economictimes.indiatimes.com/markets/stocks/rssfeeds/2146843.cms
High costs pull India Inc's foreign borrowing down 51%,https://economictimes.indiatimes.com/markets/stocks/news/high-costs-pull-india-incs-foreign-borrowing-down-51/articleshow/131105573.cms,2026-05-15 01:04:28 IST,"The rupee ended fiscal 2026 as the worst performer in Asia against the US losing close to 10% of its value in a year marked by record exits from Indian equities by overseas investors amid a global scramble for dollar-based assets. Opening the financial year at Rs 85.59 per dollar, the rupee ended at Rs 94.83. It has since weakened to an all-time Rs 95.96 per dollar.",https://economictimes.indiatimes.com/markets/stocks/rssfeeds/2146843.cms
"Soy, Corn Rise as US Says China to Buy More American Crops",https://www.livemint.com/market/soy-corn-rise-as-us-says-china-to-buy-more-american-crops-11778812701474.html,2026-05-15 08:08:20 IST,"Soybean and corn futures gained as US Trade Representative Jamieson Greer said China will make large purchases of American agricultural products, with President Donald Trump also emphasizing that the nation will look at “a lot of soybeans for our farmers.”",https://www.livemint.com/rss/markets
"Raja Venkatraman, MarketSmith recommend five stocks for 15 May",https://www.livemint.com/market/stock-market-news/raja-venkatraman-marketsmith-recommend-five-stocks-for-15-may-11778809030351.html,2026-05-15 07:41:01 IST,"The Indian stock market rebounded on May 14, with the Sensex up 790 points. Analysts recommend buying stocks like Nippon Life India Asset Management and Zydus Lifesciences, citing strong market conditions despite geopolitical tensions and high oil prices.",https://www.livemint.com/rss/markets
"Nifty 50, Sensex prediction today: Check how Indian stock market is expected to trade on 15 May",https://www.livemint.com/market/stock-market-news/nifty-50-sensex-prediction-today-check-how-indian-stock-market-is-expected-to-trade-on-15-may-11778809997200.html,2026-05-15 07:29:48 IST,"Nifty 50, Sensex prediction today: The trends on Gift Nifty also indicate a flat start for the Indian benchmark index. The Gift Nifty was trading around 23,679 level, a discount of nearly 21 points from the Nifty futures’ previous close.",https://www.livemint.com/rss/markets
Buy or sell: Vaishali Parekh recommends three stocks to buy today — 15 May 2026,https://www.livemint.com/market/stock-market-news/buy-or-sell-vaishali-parekh-recommends-three-stocks-to-buy-today-15-may-2026-11778807743793.html,2026-05-15 07:20:52 IST,"Buy or sell: Vaishali Parekh recommends three stocks to buy today — Sterlite Technologies, ICICI Bank, and SML Mahindra",https://www.livemint.com/rss/markets
"From Gift Nifty, Trump-Xi meet, gold prices to Nasdaq rally: 10 things that changed for Indian stock market overnight",https://www.livemint.com/market/stock-market-news/from-gift-nifty-trump-xi-meet-gold-prices-to-nasdaq-rally-10-things-that-changed-for-indian-stock-market-overnight-11778809367265.html,2026-05-15 07:18:08 IST,"Gift Nifty was trading around 23,690 level, a discount of nearly 10 points from the Nifty futures’ previous close, indicating a flat start for the Indian stock market indices.",https://www.livemint.com/rss/markets
These three EV stocks with high returns on capital are worth watching,https://www.livemint.com/market/stock-market-news/top-ev-stocks-india-best-electric-vehicle-stocks-11778771095083.html,2026-05-15 07:01:10 IST,"Over the next decade, India could see a rapid electrification of public transport, logistics, and affordable mobility. Rising renewable-energy capacity also improves the long-term economics of EV charging.",https://www.livemint.com/rss/markets
Q4 results 2026: Tata Steel to NHPC among companies to declare Q4 results today; full list here,https://www.livemint.com/market/stock-market-news/q4-results-2026-tata-steel-to-nhpc-among-companies-to-declare-q4-results-today-full-list-here-11778777008835.html,2026-05-15 06:40:05 IST,Q4 results 2026: More than 145 companies are scheduled to release their Q4 results today. Here's preview and full list companies to declare earnings on Friday.,https://www.livemint.com/rss/markets
Breakout stocks to buy or sell: Sumeet Bagadia recommends five shares to buy today — 15 May 2026,https://www.livemint.com/market/stock-market-news/breakout-stocks-to-buy-or-sell-sumeet-bagadia-recommends-five-shares-to-buy-today-15-may-2026-11778775383349.html,2026-05-15 06:37:19 IST,The Indian stock market ended Friday's session on a higher note. Sumeet Bagadia of Choice Broking recommends five breakout stocks to buy today.,https://www.livemint.com/rss/markets
"Bitcoin price today: Token surpasses $81,000 after US Senate committee advances crypto regulation bill; Ether, XRP rally",https://www.livemint.com/market/cryptocurrency/bitcoin-price-today-token-surpasses-81-000-after-us-senate-committee-advances-crypto-regulation-bill-ether-xrp-rally-11778806687037.html,2026-05-15 06:36:21 IST,"The Senate Banking Committee advanced the Clarity Act, which would establish the Commodity Futures Trading Commission as the primary regulator for large parts of the crypto industry while the Securities and Exchange Commission would retain authority to oversee digital securities.",https://www.livemint.com/rss/markets
Stocks to trade: Raja Venkatraman recommends three stocks for 15 May,https://www.livemint.com/market/stock-market-news/stocks-to-trade-raja-venkatraman-recommends-three-stocks-for-15-may-11778762580070.html,2026-05-15 06:15:49 IST,Market expert Raja Venkatraman shares his top stock picks for 15 May. Here’s his technical outlook and trade strategy.,https://www.livemint.com/rss/markets
Stock recommendations for 15 May from MarketSmith India,https://www.livemint.com/market/stock-market-news/stock-recommendations-for-15-may-from-marketsmith-india-11778760003918.html,2026-05-15 06:00:48 IST,"MarketSmith India reveals its top stock recommendations for today, 15 May. Get expert insights into the best-performing stocks to guide your investment decisions.",https://www.livemint.com/rss/markets
Why India's new hybrid gold products may not be the right investment fit,https://www.livemint.com/market/newlylaunched-gold-vault-nse-egr-dhan-jewellery-purity-investors-11778743771940.html,2026-05-15 06:00:28 IST,"India now has new digital gold products that also allow for physical deliveries. On paper, they promise real-time priced high-purity gold without the hassle of storage. But the jury is still out on whether these products meet investors' real needs.",https://www.livemint.com/rss/markets
Air India’s FY26 loss could eat into Tata Sons' dividend income from TCS,https://www.livemint.com/companies/air-india-fy26-loss-tata-sons-tcs-dividend-income-singapore-airlines-11778765961517.html,2026-05-15 06:00:29 IST,Air India's losses were large enough to significantly erode the dividend income parent Tata Sons earned from its cash cow Tata Consultancy Services in the previous fiscal year.,https://www.livemint.com/rss/companies
"Living in Mumbai on  ₹25,000? Woman’s monthly budgeting formula goes viral – ‘It's hard girl, just own it’",https://www.livemint.com/money/personal-finance/living-in-mumbai-on-rs-25-000-woman-s-monthly-budgeting-formula-goes-viral-its-hard-girl-just-own-it-11778809796374.html,2026-05-15 08:09:23 IST,"A woman claims that  ₹25,000 is sufficient to live in Mumbai, sharing her budgeting tips in a viral video. While some praise her financial skills, others question the feasibility of her budget, noting her expenses seem to exceed her claimed limit.",https://www.livemint.com/rss/money
"Clarity Act clears key Senate hurdle: What it means for crypto users, stablecoins and exchanges",https://www.livemint.com/money/personal-finance/clarity-act-clears-key-senate-hurdle-what-it-means-for-crypto-users-stablecoins-and-exchanges-11778805653237.html,2026-05-15 07:09:49 IST,"The Senate Banking Committee advanced the Clarity Act, establishing cryptocurrency regulations. With bipartisan support, the bill aims to create transparency in crypto transactions and anti-money laundering rules",https://www.livemint.com/rss/money
How to combine investment styles through factor investing,https://www.livemint.com/money/personal-finance/factor-investing-factor-funds-quality-stocks-market-investment-india-11778744110995.html,2026-05-15 07:00:50 IST,"Factor funds are aligned to indices that are variation of regular indices, but with a specific investment trait",https://www.livemint.com/rss/money
Clarity Act: Long-stalled Crypto market bill wins key Senate committee vote,https://www.livemint.com/money/clarity-act-long-stalled-crypto-market-bill-wins-key-senate-committee-vote-11778804219577.html,2026-05-15 05:50:39 IST,"The Senate Banking Committee advanced a landmark digital asset market structure bill Thursday after months of negotiations, signaling fresh momentum for the long-stalled measure.",https://www.livemint.com/rss/money
Data Patterns shares tumble 11% after Q4 revenue declines 13% YoY  to Rs 345 crore,https://economictimes.indiatimes.com/markets/stocks/news/data-patterns-shares-tumble-11-after-q4-revenue-declines-13-yoy-to-rs-345-crore/articleshow/131109203.cms,2026-05-15 11:08:16 IST,"Shares of Data Patterns tumbled 11% after Q4 revenue fell 13% YoY to Rs 345 crore. Despite the decline, the company posted a 21% rise in net profit and reported a record order book nearing Rs 2,062 crore, reinforcing strong visibility for future growth.",https://economictimes.indiatimes.com/markets/stocks/rssfeeds/2146843.cms
Kaynes Tech shares fall another 5% a day after crashing 20%. What brokerages fear the most?,https://economictimes.indiatimes.com/markets/stocks/news/kaynes-tech-shares-fall-another-5-a-day-after-crashing-20-what-brokerages-fear-the-most/articleshow/131108703.cms,2026-05-15 10:43:47 IST,"Kaynes Tech shares extended losses, falling another 5% after a 20% crash following weak Q4 earnings. Profit declined 22% YoY despite 26% revenue growth, which missed internal targets. Brokerages including JP Morgan, Nuvama and CLSA cut targets, citing execution concerns, margin pressure, and weak near-term visibility.",https://economictimes.indiatimes.com/markets/stocks/rssfeeds/2146843.cms
NSE EGRs to commence trading from May 18. Here’s what gold investors should know,https://economictimes.indiatimes.com/markets/stocks/news/nse-egrs-to-commence-trading-from-may-18-heres-what-gold-investors-should-know/articleshow/131108576.cms,2026-05-15 10:31:34 IST,"The NSE will launch trading in Electronic Gold Receipts (EGRs) from May 18, aiming to transform gold investing in India. The exchange said EGRs will make gold trading more transparent, secure and accessible through improved technology and liquidity. NSE believes the move could integrate gold into mainstream capital markets, boost financial inclusion and reduce dependence on fragmented pricing in the physical gold market.",https://economictimes.indiatimes.com/markets/stocks/rssfeeds/2146843.cms
620% rally makes Cupid the costliest stock in its category at 197 P/E. Should investors be cautious?,https://economictimes.indiatimes.com/markets/stocks/news/620-rally-makes-cupid-the-costliest-stock-in-its-category-at-197-p/e-should-investors-be-cautious/articleshow/131108277.cms,2026-05-15 10:12:39 IST,"Cupid, a contraceptives manufacturer, has seen a remarkable 620% rally in the past year, making it the costliest stock in its category with a P/E of 197. Despite strong fundamentals and technicals, experts advise caution for fresh investors due to its high valuation, suggesting partial profit-booking for existing shareholders.",https://economictimes.indiatimes.com/markets/stocks/rssfeeds/2146843.cms
"Buy, Sell or Hold: Elara Capital maintains a buy rating on Oil India; Goldman Sachs retains a buy rating on JSW Steel",https://economictimes.indiatimes.com/markets/stocks/news/buy-sell-or-hold-elara-capital-maintains-a-buy-rating-on-oil-india-goldman-sachs-retains-a-buy-rating-on-jsw-steel/articleshow/131108186.cms,2026-05-15 10:05:36 IST,"Brokerage firms are optimistic about specific market segments. Strong earnings, supportive policies, and better balance sheets are driving this positive outlook. Oil India, Muthoot Finance, and JSW Steel are highlighted with buy recommendations. These companies are expected to benefit from favorable conditions and strategic expansions. Investors can find selective opportunities across various sectors.",https://economictimes.indiatimes.com/markets/stocks/rssfeeds/2146843.cms
HAL shares drop over 4% after Q4 results. What are Goldman Sachs and Nomura saying?,https://economictimes.indiatimes.com/markets/stocks/news/hal-shares-drop-over-4-after-q4-results-what-are-goldman-sachs-and-nomura-saying/articleshow/131108072.cms,2026-05-15 09:55:54 IST,"Hindustan Aeronautics Limited shares fell over 4% despite reporting steady Q4FY26 earnings growth, strong sequential performance and higher annual profit. While Nomura maintained a ‘Buy’ rating, citing strong order backlog and valuations, Goldman Sachs stayed ‘Neutral’, pointing to weaker execution and margin pressure despite robust revenue visibility.",https://economictimes.indiatimes.com/markets/stocks/rssfeeds/2146843.cms
"Tata Motors PV shares rally 8% even as Q4 net profit drops 32% YoY. Here's what Macquarie, Jefferies &amp; other brokerages say",https://economictimes.indiatimes.com/markets/stocks/news/tata-motors-pv-shares-rally-8-even-as-q4-net-profit-drops-32-yoy-heres-what-macquarie-jefferies-other-brokerages-say/articleshow/131107975.cms,2026-05-15 09:49:48 IST,"Tata Motors Passenger Vehicles shares jumped significantly after reporting a profit drop for the fourth quarter of FY26. Revenue from operations saw an increase. The company also recommended a final dividend. Brokerage firms offered varied opinions, with some remaining bullish and others cautious about the automaker's future prospects. Concerns persist regarding Jaguar Land Rover's performance.",https://economictimes.indiatimes.com/markets/stocks/rssfeeds/2146843.cms
Should Titan shareholders worry about recent gold import duty hike? Let 2013 customs move explain,https://economictimes.indiatimes.com/markets/stocks/news/should-titan-shareholders-worry-about-governments-import-duty-hike-let-2013-customs-hike-explain/articleshow/131107778.cms,2026-05-15 09:39:25 IST,"Titan Company shareholders are concerned about the recent import duty hike on gold and silver. This move has caused panic in jewellery stocks. However, historical data from 2013 suggests that such disruptions can strengthen organised players like Titan. The company's strong brand, resilient margins, and customer base position it well to navigate these challenges and potentially gain market share.",https://economictimes.indiatimes.com/markets/stocks/rssfeeds/2146843.cms
"Sensex rises over 400 points, Nifty above 23,800 even as rupee declines, oil prices rise",https://economictimes.indiatimes.com/markets/stocks/news/sensex-rises-over-200-points-nifty-above-23700-even-as-rupee-declines-oil-prices-rise/articleshow/131107560.cms,2026-05-15 09:29:10 IST,"Indian stock markets opened higher for the third straight day, with Sensex and Nifty posting modest gains. This positive sentiment was broad-based, with mid and small-cap indices also trading in the green. Nifty IT led sectoral gains, while Nifty PSU Bank saw a decline.",https://economictimes.indiatimes.com/markets/stocks/rssfeeds/2146843.cms
"HPCL, BPCL and IOC shares slide up to 3% after petrol, diesel price hike",https://economictimes.indiatimes.com/markets/stocks/news/hpcl-bpcl-ioc-shares-in-focus-as-petrol-diesel-prices-hiked-by-rs-3/litre/articleshow/131107365.cms,2026-05-15 09:03:11 IST,Oil marketing company shares fell on Friday. Petrol and diesel prices saw a modest increase. This hike aims to ease financial pressure on companies. Global crude oil prices remain high due to West Asia conflicts. Prime Minister Modi urged fuel conservation. Oil Minister Hardeep Singh Puri expressed concern over companies absorbing losses.,https://economictimes.indiatimes.com/markets/stocks/rssfeeds/2146843.cms
"​Paytm, Urban Company among 10 companies with highest FII shareholding in Q4. Check full list",https://economictimes.indiatimes.com/markets/stocks/news/paytm-urban-company-among-10-companies-with-highest-fii-shareholding-in-q4-check-full-list/slideshow/131107439.cms,2026-05-15 09:01:15 IST,"​Foreign investors are showing interest in select Indian companies. Despite a significant outflow from Indian equities, some firms have attracted substantial FII investment. Le Travenues Technology leads with the highest FII stake. Other notable companies include 360 One WAM, Redington, CarTrade Tech, and Agarwal's Health Care.​",https://economictimes.indiatimes.com/markets/stocks/rssfeeds/2146843.cms
Adani Power vs. Green vs. Energy: Why mutual funds are betting billions on this electrification trio,https://economictimes.indiatimes.com/markets/stocks/news/adani-power-vs-green-vs-energy-why-mutual-funds-are-betting-billions-on-this-electrification-trio/articleshow/131090905.cms,2026-05-15 08:57:52 IST,"Indian mutual funds are significantly increasing their stakes in Adani Power, Adani Green Energy, and Adani Energy Solutions. This strategic shift indicates a strong conviction in India's electrification drive. These companies are seen as key players in meeting the nation's growing demand for electricity driven by data centers, electric vehicles, and manufacturing.",https://economictimes.indiatimes.com/markets/stocks/rssfeeds/2146843.cms
"Titan Company, Kalyan Jewellers, Senco Gold, other stocks fall up to 2% as Centre tightens duty-free gold imports",https://economictimes.indiatimes.com/markets/stocks/news/titan-company-kalyan-jewellers-other-stocks-in-focus-as-centre-tightens-duty-free-gold-imports/articleshow/131107038.cms,2026-05-15 08:37:33 IST,"New regulations on duty-free gold imports for jewellery exporters have caused shares of Senco Gold, Thangamayil, and Kalyan Jewellers to dip. The Directorate General of Foreign Trade has imposed stricter rules, including import caps and physical inspections, to curb gold imports and ensure compliance. These measures follow a recent increase in import duties.",https://economictimes.indiatimes.com/markets/stocks/rssfeeds/2146843.cms
