title,link,published,summary,source
"Shreedhar Spinners IPO share allotment in focus today: GMP, steps to check status online",https://www.livemint.com/market/ipo/shreedhar-spinners-ipo-share-allotment-in-focus-today-gmp-steps-to-check-status-online-11782711187794.html,2026-06-29 11:28:03 IST,Shreedhar Spinners' IPO share allotment is expected to be finalised today. Investors can check their status online. Shreedhar Spinners is engaged in the manufacturing of compact spun cotton yarn of various counts. It operates exclusively in the business-to-business (B2B) segment.,https://www.livemint.com/rss/markets
"Riyaasat Lifestyle IPO allotment date likely today. GMP, steps to check share allotment status online for SME IPO",https://www.livemint.com/market/ipo/riyaasat-lifestyle-ipo-allotment-date-likely-today-gmp-steps-to-check-share-allotment-status-online-for-sme-ipo-11782711927089.html,2026-06-29 11:21:07 IST,"Riyaasat Lifestyle IPO allotment date is likely today, 29 June 2026. Investors can check Riyaasat Lifestyle IPO allotment status through the websites of BSE and IPO registrar. Skyline Financial Services is the Riyaasat Lifestyle IPO registrar.",https://www.livemint.com/rss/markets
Anubhav Plast share price hits 5% lower circuit after flat debut,https://www.livemint.com/market/stock-market-news/anubhav-plast-share-price-hits-5-lower-circuit-after-flat-debut-11782711102785.html,2026-06-29 11:18:52 IST,"Anubhav Plast shares debuted flat at  ₹80 on BSE SME, matching the issue price of  ₹88. The IPO, with a subscription status of 1.53x, focused on manufacturing ERW steel pipes and aims to expand production capabilities.",https://www.livemint.com/rss/markets
"BAT layoffs: British American Tobacco to cut 5,500 jobs; outsource 3,500 in major global restructuring",https://www.livemint.com/companies/news/bat-layoffs-british-american-tobacco-to-cut-5-500-jobs-outsource-3-500-in-major-global-restructuring-11782729026186.html,2026-06-29 16:15:00 IST,"BAT is laying off 5,500 employees and outsourcing 3,500 roles as part of a restructuring effort aimed at achieving significant cost savings by 2028, while transitioning towards smoke-free nicotine products in response to shifting market demands.",https://www.livemint.com/rss/companies
"Comcast to split cable business from media through NBCUniversal, Sky spinoff",https://www.livemint.com/companies/news/comcast-to-split-cable-business-from-media-through-nbcuniversal-sky-spinoff-11782729670575.html,2026-06-29 16:14:25 IST,"Comcast will split into two publicly traded entities, dividing its broadband operations from its media business. Details here.",https://www.livemint.com/rss/companies
ESDS eyes debut as India’s first listed data centre operator with  ₹720-crore IPO,https://www.livemint.com/companies/esds-software-solutions-ipo-india-first-listed-data-centre-company-11782720375196.html,2026-06-29 15:16:39 IST,"The Nashik-based company is likely to have increased the size of its fresh issue to  ₹720 crore from an initial target of  ₹600 crore. The potential public listing of ESDS comes weeks after Sify Infinit Spaces decided to put its planned  ₹3,700-crore data centre IPO on hold amid weak market conditions.",https://www.livemint.com/rss/companies
Nagarro deal jitters drag Persistent's shares to a two-year low,https://www.livemint.com/companies/news/persistent-systems-nagarro-acquisition-shares-hit-two-year-low-brokerages-flag-growth-risks-11782712516091.html,2026-06-29 13:45:35 IST,Analysts are concerned about Nagarro's muted growth outlook and intense competition in the enterprise resource planning space.,https://www.livemint.com/rss/companies
Fluence deal signals Honasa’s pivot towards health-beauty convergence,https://www.livemint.com/companies/honasa-consumer-fluence-pharma-acquisition-nutraceuticals-11782712480471.html,2026-06-29 13:04:40 IST,"As beauty consumers increasingly demand science-backed and holistic solutions, Honasa is blurring the lines between cosmetics, wellness and healthcare, with nutraceuticals emerging as a new battleground for growth and differentiation.",https://www.livemint.com/rss/companies
"Axis Greater China Equity FoF vs Edelweiss Greater China Equity Offshore Fund: Risks, returns and portfolio compared",https://www.livemint.com/money/personal-finance/axis-greater-china-equity-fof-vs-edelweiss-greater-china-equity-offshore-fund-risks-returns-and-portfolio-compared-11782717485327.html,2026-06-29 16:11:36 IST,"Edelweiss Greater China Equity Offshore Fund has delivered slightly higher average returns and marginally better risk-adjusted performance, while the Axis Greater China Equity FoF has experienced lower volatility and has a higher Sortino ratio.",https://www.livemint.com/rss/money
"Dearness Allowance: What is DA merger and why the issue is in focus now, explained",https://www.livemint.com/money/personal-finance/dearness-allowance-what-da-merger-basic-salary-hike-calculate-govt-employees-pensioners-why-issue-in-focus-now-explained-11782724429628.html,2026-06-29 15:59:19 IST,"Dearness Allowance: DA and DR are revised twice annually based on the All-India Consumer Price Index (AICPI) formula as prescribed under the 7th central pay commission. Today, we explain DA merger and why the issue is in focus now.",https://www.livemint.com/rss/money
Can your tax refund be denied if you missed filing ITR last year? Here are your options,https://www.livemint.com/money/personal-finance/can-your-tax-refund-be-denied-if-you-missed-filing-itr-last-year-here-are-your-options-11782725251175.html,2026-06-29 15:56:05 IST,"Missing the income tax return deadline doesn't eliminate the possibility of claiming a refund for excess tax deduced in FY 2024-25, but options are limited. Details here.&amp;nbsp;",https://www.livemint.com/rss/money
Closing India’s insurance gap will need more than just policy reforms,https://www.livemint.com/money/personal-finance/india-insurance-penetration-protection-gap-11782718673678.html,2026-06-29 15:36:24 IST,"With nearly 85% of economic losses left completely uncovered, transforming consumer behaviour mindset is critical.",https://www.livemint.com/rss/money
Investing in global stocks directly? Understand the costs and nominee rules first,https://www.livemint.com/money/personal-finance/investing-directly-global-stocks-costs-nominee-rules-brokerage-fees-transfer-process-estate-tax-11782707449835.html,2026-06-29 15:27:53 IST,"Investors in overseas stocks must make note of costs related to forex spreads, brokerage fees and the process of asset transfers to heirs and nominees.",https://www.livemint.com/rss/money
ITR for deceased spouse without a will: Legal heir tax rules and filing responsibilities explained,https://www.livemint.com/money/personal-finance/itr-for-deceased-spouse-without-a-will-legal-heir-tax-rules-and-filing-responsibilities-explained-11782721228185.html,2026-06-29 15:11:18 IST,"A spouse’s death brings emotional and financial challenges, including filing the deceased’s ITR. Understanding the ITR for deceased spouse rules, legal heir responsibilities and succession laws helps families complete tax formalities correctly and avoid unnecessary disputes.",https://www.livemint.com/rss/money
Top 5 mutual funds with highest 5-year returns: Here’s how their strategies differ,https://www.livemint.com/money/personal-finance/top-5-mutual-funds-with-highest-5-year-returns-here-s-how-their-strategies-differ-11782709900315.html,2026-06-29 14:03:11 IST,"Several equity mutual funds have delivered strong returns over the past five years, despite periods of market volatility and uncertainty. Here’s a closer look at the top 5 diversified equity funds that have stood out in performance.",https://www.livemint.com/rss/money
"Debt mutual funds saw  ₹97,000 crore in outflows in May. Here's why experts still recommend them",https://www.livemint.com/money/personal-finance/debt-mutual-funds-saw-rs-97-000-crore-in-outflows-in-may-heres-why-experts-still-recommend-them-11782716672213.html,2026-06-29 12:53:48 IST,"The May redemptions were largely driven by liquid, overnight, and money market funds, which are often used by institutions for short-term treasury needs. This should not be seen as a structural weakness in debt mutual funds, say market watchers.",https://www.livemint.com/rss/money
"NPS retirees have a new choice. Should you opt for RIS, annuity or SLW?",https://www.livemint.com/money/personal-finance/nps-retirement-income-scheme-vs-annuity-vs-slw-11782706963917.html,2026-06-29 12:41:05 IST,"NPS subscribers now have a third post-retirement payout option in the Retirement Income Scheme (RIS). Here's how it compares with annuities and systematic withdrawals, and who should choose what.",https://www.livemint.com/rss/money
How El Niño could affect your finances,https://www.livemint.com/money/personal-finance/can-el-nino-impact-your-finances-weak-monsoon-food-inflation-emis-household-budget-11782710026011.html,2026-06-29 12:33:29 IST,"A weak monsoon can fuel inflation, pushing up food bills, squeezing discretionary spending and increasing EMI burden.",https://www.livemint.com/rss/money
SCSS vs SBI Senior Citizen FD vs RBI Floating Rate Bond: Which gives better returns on retirement savings?,https://www.livemint.com/money/personal-finance/scss-vs-sbi-senior-citizen-fd-vs-rbi-floating-rate-bond-which-gives-better-returns-on-retirement-savings-11782711867740.html,2026-06-29 12:30:10 IST,"Boost your retirement income with the right investment choice. Compare SCSS vs SBI Senior Citizen FD vs RBI Floating Rate Savings Bond on returns, interest rates, limits and tax rules to find the best option for your long-term financial goals. Consult a certified financial advisor before investing.",https://www.livemint.com/rss/money
"China's economy picks up in June on rebounding U.S. exports, analysts say",https://www.cnbc.com/2026/06/29/china-economy-june-trade-exports-manufacturing-tariffs-iran-war-consumption-ai-technology-.html,2026-06-29 15:30:02 IST,China's economy is showing signs of picking up after a sluggish few months — thanks in part to a rebound in shipments to the U.S.,https://www.cnbc.com/id/10000664/device/rss/rss.html
Microsoft shares head for worst month since 2000 as AI concerns wipe out $570 billion,https://economictimes.indiatimes.com/markets/stocks/news/microsoft-shares-head-for-worst-month-since-2000-as-ai-concerns-wipe-out-570-billion/articleshow/132073656.cms,2026-06-29 19:54:03 IST,"Microsoft shares are heading for their worst month since 2000, falling 17% in June as concerns over heavy AI spending and delayed returns erased $570 billion in value. Weak Azure growth and high capital expenditure outlook weighed on sentiment, though some investors see value at lower valuations.",https://economictimes.indiatimes.com/markets/stocks/rssfeeds/2146843.cms
"Yes Bank to raise up to $1.7 billion via equity, debt issue",https://economictimes.indiatimes.com/markets/stocks/news/yes-bank-to-raise-up-to-1-7-billion-via-equity-debt-issue/articleshow/132073288.cms,2026-06-29 19:30:59 IST,Yes Bank is poised to raise up to ₹160 billion through a strategic mix of equity and debt offerings. The board has approved an equity issuance of as much as ₹75 billion alongside a debt issuance reaching ₹85 billion. This approach is designed to strengthen the bank’s capital framework while minimizing dilution for current shareholders and adhering to regulatory standards.,https://economictimes.indiatimes.com/markets/stocks/rssfeeds/2146843.cms
"Two Trades for Today: A top industrial explosives maker for a 6.7% rise, a mid-cap brewery stock for a 7% gain",https://economictimes.indiatimes.com/markets/stocks/news/two-trades-for-today-a-top-industrial-explosives-maker-for-a-6-7-rise-a-mid-cap-brewery-stock-for-a-7-gain/articleshow/132072989.cms,2026-06-29 19:22:29 IST,Our technical analysts identify select stocks every trading day that may gain momentum even in volatile markets. Here are the technical calls for today.,https://economictimes.indiatimes.com/markets/stocks/rssfeeds/2146843.cms
BSE announces change in licensing requirements for market data products from Jan 2027,https://economictimes.indiatimes.com/markets/stocks/news/bse-announces-change-in-licensing-requirements-for-market-data-products-from-jan-2027/articleshow/132073033.cms,2026-06-29 19:02:10 IST,"BSE Ltd has announced a significant transition in its management of international licensing for market data products, effective January 1, 2027. This move sees BSE taking charge from Deutsche Börse AG, which previously handled these operations since their 2013 agreement. Clients outside India, however, will experience no disruption in service, while Indian clients maintain their direct access unchanged.",https://economictimes.indiatimes.com/markets/stocks/rssfeeds/2146843.cms
Aurobindo Pharma among 9 mid-cap stocks to hit 52-week highs &amp; rally up to 20% in a month,https://economictimes.indiatimes.com/markets/stocks/news/aurobindo-pharma-among-9-mid-cap-stocks-to-hit-52-week-highs-amp-rally-up-to-20-in-a-month/slideshow/132071494.cms,2026-06-29 17:14:21 IST,"The Sensex fell 372 points on Monday, but nine BSE Midcap stocks touched fresh 52-week highs, signalling resilient investor confidence. Bank of Maharashtra, Thermax, Bharat Forge, Oracle Financial Services and Laurus Labs were among the key outperformers despite broader market weakness.",https://economictimes.indiatimes.com/markets/stocks/rssfeeds/2146843.cms
Weekly Top Picks: These stocks scored 10 on 10 on Stock Reports Plus,https://economictimes.indiatimes.com/markets/stocks/news/weekly-top-picks-these-stocks-scored-10-on-10-on-stock-reports-plus/articleshow/132070896.cms,2026-06-29 17:01:33 IST,"Stock Reports Plus, powered by Refinitiv, undertakes detailed company analysis for 4,000+ listed stocks. In addition to detailed company analyses, the report also collates analysts’ forecasts and trend analysis for each component. An average score in Stock Reports Plus is calculated by undertaking quantitative analysis of five key investment tools – earnings, fundamentals, relative valuation, risk, and price momentum.",https://economictimes.indiatimes.com/markets/stocks/rssfeeds/2146843.cms
Rail-focused logistics firm Pristine Logistics confidentially files IPO papers with Sebi,https://economictimes.indiatimes.com/markets/stocks/news/rail-focused-logistics-firm-pristine-logistics-confidentially-files-ipo-papers-with-sebi/articleshow/132071096.cms,2026-06-29 16:59:31 IST,"Pristine Logistics and Infraprojects has confidentially filed its DRHP with Sebi for an IPO. The rail-focused multimodal logistics company is expanding terminals, warehousing and cargo operations while strengthening growth with a Rs 3,422 crore coal mining contract and broader infrastructure footprint.",https://economictimes.indiatimes.com/markets/stocks/rssfeeds/2146843.cms
Bajaj Auto buyback opens July 1; shareholders can tender shares till July 7,https://economictimes.indiatimes.com/markets/stocks/news/bajaj-auto-buyback-opens-july-1-shareholders-can-tender-shares-till-july-7/articleshow/132070315.cms,2026-06-29 16:26:16 IST,"Bajaj Auto's Rs 5,633 crore share buyback will open for tender on July 1 and close on July 7. Eligible shareholders holding shares as of the June 24 record date can participate through the tender offer. The company said the buyback will not adversely impact its financial position.",https://economictimes.indiatimes.com/markets/stocks/rssfeeds/2146843.cms
Himadri Speciality Chemicals bets big on EV battery materials with 100 GWh manufacturing facility,https://www.livemint.com/market/stock-market-news/himadri-speciality-chemicals-bets-big-on-ev-battery-materials-with-100-gwh-manufacturing-facility-11782736245052.html,2026-06-29 18:32:12 IST,"Himadri Speciality Chemicals plans to establish India's largest battery materials manufacturing facility, expecting a revenue boost of  ₹30,000 crore over five years. The 100 GWh facility will produce key components for EV batteries, alongside a 40,000 metric tonnes LFP cathode plant.&amp;nbsp;",https://www.livemint.com/rss/markets
"US stock market today: S&amp;P 500, Nasdaq futures jump as investors buy the tech dip; oil near 4-month low",https://www.livemint.com/market/stock-market-news/us-stock-market-today-s-p-500-nasdaq-futures-jump-as-investors-buy-the-tech-dip-oil-near-4-month-low-11782731695020.html,2026-06-29 17:43:59 IST,"US stock futures rose slightly on 29 June as investors returned to technology stocks after recent losses. The S&amp;amp;P 500 futures increased by 0.08%, while Nasdaq 100 futures gained 1.1%.",https://www.livemint.com/rss/markets
"Expert view: See compelling setup for Indian stocks to outperform, says Bajaj Finserv Asset Management's head of equity",https://www.livemint.com/market/stock-market-news/expert-view-see-compelling-setup-for-indian-stocks-to-outperform-says-bajaj-finserv-asset-managements-head-of-equity-11782733558052.html,2026-06-29 17:30:05 IST,"Expert view: Bajaj Finserv's head of equity emphasises why Indian stocks are set to outperform other emerging markets. With improving foreign investor sentiment and attractive valuations, now may be the time for disciplined, long-term investment in equities.",https://www.livemint.com/rss/markets
"GIP-backed Pristine Logistics takes confidential route to IPO; picks Axis, CLSA, SBI as book managers",https://www.livemint.com/market/ipo/pristine-logistics-ipo-confidential-drhp-gip-axis-clsa-sbi-11782726092043.html,2026-06-29 16:54:42 IST,"The proposed listing of Pristine fits the pattern of infrastructure asset monetization in India, where a record  ₹12.2 trillion government capital expenditure budget is drawing attention from global private equity and infrastructure funds, including GIP, Actis and Macquarie",https://www.livemint.com/rss/markets
Volkswagen layoffs: Work council says European carmaker cannot scrap job until 2030 amid 1 lakh job cuts plan,https://www.livemint.com/companies/news/volkswagen-layoffs-work-council-says-european-carmaker-cannot-scrap-job-until-2030-amid-1-lakh-job-cuts-plan-11782739466881.html,2026-06-29 19:38:48 IST,"Volkswagen's proposal to shut four German factories and cut up to 100,000 jobs is facing opposition from employee representatives. The works council insists the employee guarantee until 2030 must be upheld. Details here.",https://www.livemint.com/rss/companies
"AI isn't the biggest regulatory worry for Indian startups, data governance is: Survey",https://www.livemint.com/companies/news/ai-isnt-the-biggest-regulatory-worry-for-indian-startups-data-governance-is-survey-11782730264762.html,2026-06-29 17:46:33 IST,"The study, based on a survey of 550 ecosystem participants, including 350 startups, 100 venture capital (VC) firms and 100 incubators, shows that 44% of respondents identified data governance and digital trust regulations as their primary regulatory concern.",https://www.livemint.com/rss/companies
"PayU swings to Ebitda profit in FY26 as payments, credit businesses rally",https://www.livemint.com/companies/company-results/payu-ebitda-profit-fy26-payments-credit-businesses-rally-higher-margin-products-prosus-11782728510773.html,2026-06-29 16:54:15 IST,"Backed by higher-margin products and ecosystem lending, the Prosus-owned fintech firm swung to an $18-million full-year Ebitda profit while exiting lower-value UPI categories.",https://www.livemint.com/rss/companies
Hindustan Zinc eyes three new metals in five years,https://www.livemint.com/companies/news/hindustan-zinc-eyes-three-new-metals-in-five-years-critical-minerals-11782726058995.html,2026-06-29 16:35:26 IST,"Hindustan Zinc's long-term strategy is to diversify beyond its existing portfolio of zinc, lead, silver and cadmium by entering businesses such as rare earths, potash and tungsten.",https://www.livemint.com/rss/companies
Apple accuses India of ‘copy-pasting’ rivals' claims in antitrust investigation,https://www.livemint.com/companies/news/apple-accuses-india-of-copy-pasting-rivals-claims-in-antitrust-investigation-11782729413440.html,2026-06-29 16:20:28 IST,"Apple has accused India's antitrust investigators of ‘copy-pasting’ its rivals' claims and failing to properly conduct its own investigation in concluding the tech giant breached competition laws, as per a Reuters report.",https://www.livemint.com/rss/companies
"EPFO: Complete guide to EPF withdrawal — Eligibility, rules, limits, forms, conditions for partial claims, FAQs answered",https://www.livemint.com/money/personal-finance/epfo-your-complete-guide-epf-withdrawal-eligible-job-loss-resign-retire-rule-limit-form-19-31-partial-claim-faqs-answers-11782741454357.html,2026-06-29 20:06:45 IST,"EPFO: We take a look at the frequently asked questions when it comes to provident fund withdrawal process. Here's a complete guide to EPF withdrawal eligibility, rules, limits, form requirements, and conditions for partial claims.",https://www.livemint.com/rss/money
Can you gift overseas property tax-free? What returning NRIs and OCIs should know,https://www.livemint.com/money/personal-finance/can-you-gift-overseas-property-tax-free-what-returning-nris-and-ocis-should-know-11782710151208.html,2026-06-29 19:38:51 IST,Can a returning NRI gift overseas property without attracting Indian tax? And should an OCI invest through an NRE or NRO account? Experts answer two common cross-border tax queries.,https://www.livemint.com/rss/money
"Gold for cash: Indian households sold 50 tonnes of yellow metal in Apr-Jun quarter amid price crash fears, says report",https://www.livemint.com/money/personal-finance/gold-for-liquid-cash-indian-households-sold-50-tonnes-yellow-metal-april-june-2026-quarter-fear-price-crash-says-report-11782733486911.html,2026-06-29 18:28:15 IST,"Gold for liquid cash: Indian households sold 50 tonnes of the yellow metal in the April-June 2026 quarter, amid fears of an imminent price crash, according to a report. Here's all you need to know…",https://www.livemint.com/rss/money
From ITR deadline to passport fee hike: 4 financial changes in July that may impact your personal finances,https://www.livemint.com/money/personal-finance/from-itr-deadline-to-passport-fee-hike-4-financial-changes-in-july-that-may-impact-your-personal-finances-11782734394252.html,2026-06-29 18:25:37 IST,Key financial changes will be effective from July 2026. Staying informed can help individuals manage costs and meet compliance requirements. Full list here.,https://www.livemint.com/rss/money
How NRI money could allow Indian banks to lend more to businesses? Axis Bank CEO explains,https://www.livemint.com/money/personal-finance/how-nri-money-could-allow-indian-banks-to-lend-more-to-businesses-axis-bank-ceo-explains-11782730918463.html,2026-06-29 17:11:56 IST,Indian banks is likely to utilise foreign-currency deposits from the Indian diaspora to replace costly funds in their balance before channeling the money to companies. Here's how it would work.,https://www.livemint.com/rss/money
8th pay commission: Check how much salary could increase with conservative 2.1 and optimistic 3.83 fitment factor,https://www.livemint.com/money/personal-finance/8th-pay-commission-calculate-fitment-factor-how-much-salary-could-increase-conservative-2-1-estimate-optimistic-3-83-cpc-11782730683664.html,2026-06-29 17:01:16 IST,"8th pay commission: Multiple groups, industry watchers, and reports estimate fitment factor could rise up to 3.83. Today we calculate how the conservative and optimistic estimates could each impact your salaries",https://www.livemint.com/rss/money
How rupee movements directly affect your gold ETF returns: Experts explain the impact,https://www.livemint.com/money/personal-finance/how-rupee-movements-directly-affect-your-gold-etf-returns-experts-explain-11782724251417.html,2026-06-29 16:59:55 IST,"For Indian investors, gold ETF returns are driven by global gold prices and currency movements. A weaker rupee can amplify gains, while a stronger rupee can reduce them. However, experts caution against making investment decisions solely on exchange rate expectations.",https://www.livemint.com/rss/money
Ahead of Market: 10 things that will decide stock market action on Tuesday,https://economictimes.indiatimes.com/markets/stocks/news/ahead-of-market-10-things-that-will-decide-stock-market-action-on-tuesday/articleshow/132074909.cms,2026-06-29 21:35:53 IST,"Indian equities ended lower, snapping a two-day rally as escalating Iran-US tensions and profit booking weighed on sentiment. Sensex fell 372 points and Nifty lost 110, while analysts advised a buy-on-dips strategy above the key 23,800 support level.",https://economictimes.indiatimes.com/markets/stocks/rssfeeds/2146843.cms
SIS approves share buyback of up to Rs 120 crore. Check details,https://economictimes.indiatimes.com/markets/stocks/news/sis-approves-share-buyback-of-up-to-rs-120-crore-check-details/articleshow/132074807.cms,2026-06-29 21:28:09 IST,"SIS has approved a proposed Rs 120 crore share buyback at a maximum price of Rs 478.50 per share, its fifth since listing. The move could lift cumulative shareholder returns to about Rs 720 crore through buybacks and dividends.",https://economictimes.indiatimes.com/markets/stocks/rssfeeds/2146843.cms
Market Trading Guide: Finolex Cables among 2 stock recommendations for Tuesday,https://economictimes.indiatimes.com/markets/stocks/news/market-trading-guide-finolex-cables-among-2-stock-recommendations-for-tuesday/articleshow/132074015.cms,2026-06-29 20:25:24 IST,"Domestic equities closed higher on positive Asian cues, falling crude oil prices and hopes of an India-US trade deal. Analysts recommend buying Finolex Cables and Zydus Wellness, citing bullish technical setups, strong moving-average support and breakout patterns with upside potential.",https://economictimes.indiatimes.com/markets/stocks/rssfeeds/2146843.cms
