title,link,published,summary,source
NSE SME stock hits upper circuit despite stock market crash,https://www.livemint.com/market/stock-market-news/nse-sme-stock-hits-upper-circuit-despite-stock-market-crash-11778486528333.html,2026-05-11 13:45:58 IST,"Atmastco share price hit a 5% upper circuit on 11 May after receiving BIS certification for Level 6 Bulletproof Jackets, marking a significant growth milestone. The company aims to enhance its presence in the defence sector and to start commercial production soon.",https://www.livemint.com/rss/markets
"UPL Q4 Results: Profit jumps 18% YoY to  ₹1,061 crore; company announces 300% dividend payout",https://www.livemint.com/market/stock-market-news/upl-q4-results-profit-jumps-18-yoy-to-rs-1-061-crore-company-announces-300-dividend-payout-11778486540027.html,2026-05-11 13:35:03 IST,"UPL Limited reported an 18% YoY increase in consolidated net profit to  ₹1,061 crore for Q4 FY 2025-26, up from  ₹896 crore last year. The QoQ profit rose 168% from  ₹396 crore in the previous quarter.",https://www.livemint.com/rss/markets
Canara Bank Q4 results 2026: Profit declines 10% YoY to  ₹4506 crore; recommends dividend of  ₹4.20,https://www.livemint.com/market/stock-market-news/canara-bank-q4-results-2026-profit-declines-10-yoy-dividend-of-4-20-nii-nim-other-key-takeaways-11778485468596.html,2026-05-11 13:18:49 IST,"Canara Bank Q4 results 2026: Canara Bank reported a 10% YoY fall in standalone profit to  ₹4,505.57 crore. NII rose by nearly 4% YoY and 6% QoQ to  ₹9,808 crore, while NIM eased to 2.54% in Q4FY26 from 2.73% YoY.",https://www.livemint.com/rss/markets
Explained: Why PM Modi asked Indians to avoid buying gold for a year and what it means for prices,https://www.livemint.com/market/stock-market-news/usiran-war-why-pm-modi-asked-indians-to-avoid-buying-gold-for-a-year-and-what-it-means-for-gold-prices-explained-11778484752661.html,2026-05-11 13:14:50 IST,"It's no secret that Indians have a long affinity for gold. We are also one of the world's largest consumers, typically importing 90% of the domestic demand. These massive gold imports form a major part of our import bill, especially now that rising prices are also increasing import costs.",https://www.livemint.com/rss/markets
Investors return to FMCG stocks as early signs of demand recovery emerge,https://www.livemint.com/market/stock-market-news/india-fmcg-stocks-demand-recovery-sales-growth-input-cost-inflation-11778474975739.html,2026-05-11 13:14:31 IST,Early signs of demand recovery and improving earnings outlook drive renewed interest in FMCG stocks after a prolonged phase of underperformance.,https://www.livemint.com/rss/markets
"Stock market crash: Nifty 50 slips below 24,000. Will it fall below 22,000 this time?",https://www.livemint.com/market/stock-market-news/stock-market-crash-nifty-50-slips-below-24-000-will-it-fall-below-22-000-this-time-11778484668133.html,2026-05-11 13:11:02 IST,"Nifty 50 has declined 0.5% over the past one month and has fallen nearly 7.7% in the last three months. Monday’s decline below the crucial 24,000 mark has further weakened near-term sentiment, with broader market breadth also turning negative.",https://www.livemint.com/rss/markets
SBI: The worst of margin pressure could be over after Q4’s sharp sequential drop,https://www.livemint.com/market/mark-to-market/sbi-the-worst-of-margin-pressure-could-be-over-after-q4fy26-s-sharp-sequential-drop-11778477304008.html,2026-05-11 12:33:49 IST,SBI shares slid 10% in two sessions after Q4 results as weak NII growth and margin pressure overshadowed strong core operating profit and steady asset quality. Investors weigh treasury trade-offs.,https://www.livemint.com/rss/markets
"Life insurance stocks gain after strong FY27 start; SBI Life, ICICI Prudential lead growth",https://www.livemint.com/market/stock-market-news/life-insurance-stocks-gain-after-strong-fy27-start-sbi-life-icici-prudential-lead-growth-11778481327094.html,2026-05-11 12:33:39 IST,"Life insurance stocks showed slight gains on May 11, with SBI Life and ICICI Prudential leading the way. The sector experienced robust growth in FY27, particularly SBI Life with an 80% increase in new business premiums and LIC with a 38% rise.",https://www.livemint.com/rss/markets
From uncertainty to opportunity: why staying invested matters in volatile markets,https://www.livemint.com/money/personal-finance/from-uncertainty-to-opportunity-why-staying-invested-matters-in-volatile-markets-11778485136519.html,2026-05-11 14:44:10 IST,"As markets correct amid oil spikes and global uncertainty, history suggests volatility may offer long-term opportunity. Here’s why India’s structural story remains compelling.",https://www.livemint.com/rss/money
Digital FDs: high on convenience but mind the risk,https://www.livemint.com/money/personal-finance/digital-fixed-deposits-convenience-risks-interest-rates-investment-guide-experts-advice-11778416132044.html,2026-05-11 14:20:23 IST,Many online platforms now allow you to invest in fixed deposits from multiple banks. Understand the allure and the often-overlooked downsides before you commit your savings.,https://www.livemint.com/rss/money
"Personal loan rates in May 2026: Compare SBI, HDFC, ICICI and other lenders with fees and EMIs",https://www.livemint.com/money/personal-finance/personal-loan-rates-in-may-2026-compare-sbi-hdfc-icici-and-other-lenders-with-fees-and-emis-11778482187343.html,2026-05-11 13:53:02 IST,"Comprehensive comparison of personal loan rates in May 2026 across SBI, HDFC, ICICI Bank, Axis Bank, and other lenders in India, including EMIs, interest rates, and processing fees, to help borrowers make informed decisions. Before finalising any loan offer, consult a certified financial advisor.",https://www.livemint.com/rss/money
"8th Pay Commission explained: 25 most important FAQs, official dates, latest notices &amp; key facts",https://www.livemint.com/money/personal-finance/8th-pay-commission-explained-25-most-important-faqs-official-dates-latest-notices-key-facts-11778478934002.html,2026-05-11 12:22:10 IST,"Big changes ahead as the 8th Pay Commission enters consultations, with key dates, salary revision updates, pension changes and fitment factor discussions affecting over 1.1 crore beneficiaries.",https://www.livemint.com/rss/money
Weekly Top Picks: These stocks scored 10 on 10 on Stock Reports Plus,https://economictimes.indiatimes.com/markets/stocks/news/weekly-top-picks-these-stocks-scored-10-on-10-on-stock-reports-plus/articleshow/131014757.cms,2026-05-11 18:35:12 IST,"Stock Reports Plus, powered by Refinitiv, undertakes detailed company analysis for 4,000+ listed stocks. In addition to detailed company analyses, the report also collates analysts’ forecasts and trend analysis for each component. An average score in Stock Reports Plus is calculated by undertaking quantitative analysis of five key investment tools – earnings, fundamentals, relative valuation, risk, and price momentum.",https://economictimes.indiatimes.com/markets/stocks/rssfeeds/2146843.cms
"Gainers &amp; Losers: SBI, Indigo and Titan among 8 big movers on Monday ​",https://economictimes.indiatimes.com/markets/stocks/news/gainers-amp-losers-sbi-indigo-and-titan-among-8-big-movers-on-monday-/slideshow/131013807.cms,2026-05-11 17:48:02 IST,"While Nifty plunged 360.30 points or 1.49% to close at 23,815.85, the BSE Sensex settled at 76,015.28, down 1312.91 points or 1.70%.",https://economictimes.indiatimes.com/markets/stocks/rssfeeds/2146843.cms
"SBI sheds over $11 billion in market value in 2 sessions on margin squeeze, disappointing earnings",https://economictimes.indiatimes.com/markets/stocks/news/sbi-sheds-over-11-billion-in-market-value-in-2-sessions-on-margin-squeeze-disappointing-earnings/articleshow/131013510.cms,2026-05-11 17:35:45 IST,"NSE ​data showed the heaviest fresh call writing on SBI's 1,000 strike on Monday, ​signalling that investors expect any near-term rebound in the stock's price to likely be capped at that level.",https://economictimes.indiatimes.com/markets/stocks/rssfeeds/2146843.cms
Mamaearth parent Honasa Consumer may become first new-age company to announce dividend,https://economictimes.indiatimes.com/markets/stocks/news/mamaearth-parent-honasa-consumer-may-become-first-new-age-company-to-announce-dividend/articleshow/131013397.cms,2026-05-11 17:32:51 IST,"Honasa Consumer’s board will consider a final dividend on May 21 alongside Q4 FY26 results, potentially making Mamaearth’s parent the first listed new-age company to reward shareholders with a dividend amid improving stock performance and steady business growth expectations.",https://economictimes.indiatimes.com/markets/stocks/rssfeeds/2146843.cms
Who is Muthukrishnan Dhandapani and how did he become Rahul Gandhi's investment advisor?,https://economictimes.indiatimes.com/markets/stocks/news/who-is-muthukrishnan-dhandapani-and-how-did-he-become-rahul-gandhis-investment-advisor/articleshow/131011773.cms,2026-05-11 16:31:11 IST,"Muthukrishnan Dhandapani, a Chennai-based mutual fund distributor and ex-BJP supporter, went viral on X after revealing that he has been advising Rahul Gandhi on his mutual fund investments since 2013. Despite his political leanings, Dhandapani says Gandhi has always separated politics from professionalism and remained a respectful, long-term client.",https://economictimes.indiatimes.com/markets/stocks/rssfeeds/2146843.cms
"US stock market today: S&amp;P 500, Nasdaq futures steady after Trump rejects Iran proposal; crude spikes",https://www.livemint.com/market/us-stock-market-today-s-p-500-nasdaq-futures-steady-after-trump-rejects-iran-proposal-crude-spikes-11778499448010.html,2026-05-11 18:09:20 IST,"US stock futures showed a cautious opening on 11 May, with S&amp;amp;P 500 futures down 0.1% and Dow futures down 0.2%. Investors are monitoring Middle East tensions and awaiting US inflation data, while a rebound in crude oil prices raises concerns about market volatility.",https://www.livemint.com/rss/markets
"Market likely to enter recovery phase; this could be right time to invest in Nifty 50 index funds, say experts",https://www.livemint.com/market/stock-market-news/market-likely-to-enter-recovery-phase-this-could-be-right-time-to-invest-in-nifty-50-index-funds-say-experts-11778502518044.html,2026-05-11 18:04:13 IST,"As the Indian equity market shows signs of recovery, experts recommend investing in Nifty 50 index funds for long-term gains. These funds offer diversification, low costs, and exposure to top companies, making them a strategic choice for investors looking to benefit from market trends.",https://www.livemint.com/rss/markets
US stocks to buy for short term: From Alphabet to Amazon- Appreciate CEO suggests picking these 5 shares,https://www.livemint.com/market/stock-market-news/us-stocks-to-buy-for-short-term-from-alphabet-to-amazon-appreciate-ceo-suggests-picking-these-5-shares-11778499436154.html,2026-05-11 17:41:41 IST,"As US stock markets reach record highs, CEO Subho Moulik identifies five key stocks poised for short-term growth, driven by robust Q1 earnings and a surge in AI infrastructure spending. Discover which stocks to consider for your investment portfolio in the coming weeks.",https://www.livemint.com/rss/markets
Inside the David vs Goliath battle in India’s mutual fund industry,https://www.livemint.com/market/india-mutual-fund-industry-74-trillion-growth-11778490955414.html,2026-05-11 17:00:25 IST,"India’s mutual fund industry is no longer just a playground for legacy giants. With SIP inflows hitting  ₹32,000 crore a month, a functioning chaos has emerged with many new entrants and products. Here’s why this is a high-stakes game of survival.",https://www.livemint.com/rss/markets
How should stock and mutual fund investors rebalance their portfolios amid market volatility? Here's a guide,https://www.livemint.com/market/stock-market-news/how-should-stock-and-mutual-fund-investors-rebalance-their-portfolios-amid-market-volatility-heres-a-guide-11778484580701.html,2026-05-11 16:51:11 IST,"Amid increasing geopolitical risks and economic uncertainty, experts advise investors on how to rebalance portfolios effectively. Focusing on quality stocks, maintaining SIPs, and adjusting allocations can help navigate this volatile landscape.&amp;nbsp;",https://www.livemint.com/rss/markets
Britannia stock needs a treat of accelerated growth rates,https://www.livemint.com/market/mark-to-market/britannia-stock-q4-results-margin-pressure-west-asia-war-11778491937941.html,2026-05-11 16:28:43 IST,"Britannia Industries' stock fell 7% after Q4FY26 delivered a tepid 5.5% volume growth, undercut by rival Parle's lower pricing and war-linked international supply disruptions.&amp;nbsp;",https://www.livemint.com/rss/markets
"South Indian Bank's gold loan growth to slow on new RBI norms, volatile prices",https://www.livemint.com/companies/news/south-indian-bank-gold-loan-growth-rbi-rules-gold-prices-11778498325055.html,2026-05-11 18:37:30 IST,The lender said tighter end-use rules and stricter loan-to-value guidelines could curb growth in its fast-expanding gold loan portfolio despite strong demand.,https://www.livemint.com/rss/companies
"I asked ChatGPT to calculate the savings needed as a freelance artist, to live my old age in Pune",https://www.livemint.com/money/personal-finance/i-asked-chatgpt-to-calculate-savings-needed-freelancer-artist-live-old-age-pune-retirement-corpus-investment-nps-ppf-sip-11778504617350.html,2026-05-11 18:54:13 IST,"I asked ChatGPT to calculate the how much savings corpus I should build for my old age as a freelance artist with irregular income, living in Pune. Here is what artificial intelligence (AI) chatbot said…",https://www.livemint.com/rss/money
"Senior citizen FD rates in May 2026: AU, Equitas, Shivalik and other small finance banks offer up to 8.30% for retirees",https://www.livemint.com/money/personal-finance/senior-citizen-fd-rates-in-may-2026-au-equitas-shivalik-and-other-small-finance-banks-offer-up-to-8-30-for-retirees-11778497849614.html,2026-05-11 18:39:12 IST,"Senior citizens' FD rates in small finance banks reach up to 8.30% in May 2026, offering secure, high-yield investment options with stable returns. These investment options become even more lucrative in the current geopolitical environment. Check details.",https://www.livemint.com/rss/money
"I asked ChatGPT to plan my son's MBA at London Business School: AI gives course fees, post-degree salary and more",https://www.livemint.com/money/personal-finance/i-asked-chatgpt-to-plan-my-sons-mba-at-london-business-school-ai-gives-course-fees-post-degree-salary-and-more-11778502793399.html,2026-05-11 18:16:55 IST,"MBA returns vary regionally, with the Middle East offering the fastest payback, according to ChatGPT. Check the AI tool's detailed response.",https://www.livemint.com/rss/money
"'Bangalore rent is like second EMI’: Couple says  ₹1.3 lakh monthly expenses exclude holidays, luxury spending",https://www.livemint.com/money/personal-finance/bangalore-rent-is-like-second-emi-bengaluru-couple-says-1-3-lakh-monthly-expenses-exclude-holidays-11778501252195.html,2026-05-11 18:09:42 IST,"According to the couple, rent takes up the largest share of their monthly budget. They said they pay  ₹56,000 every month for their apartment.",https://www.livemint.com/rss/money
"8th central pay commission to engage stakeholders in Delhi, Telangana, J&amp;K and Ladakh in May and June — Check dates",https://www.livemint.com/money/personal-finance/8th-pay-commission-cpc-engage-meet-central-govt-employee-stakeholder-delhi-telangana-jammu-kashmir-ladakh-may-june-dates-11778497537384.html,2026-05-11 16:56:32 IST,"As part of its consultation process, the 8th CPC opened submissions and held meetings in Delhi in March and in April. Now, visits are scheduled in Telangana, Ladakh, Jammu &amp;amp; Kashmir and Delhi in May and June.",https://www.livemint.com/rss/money
"Corporate FD rates in May 2026: Shriram Finance, Mahindra Finance and other top NBFCs offer returns up to 8.95%",https://www.livemint.com/money/personal-finance/corporate-fd-rates-in-may-2026-shriram-finance-mahindra-finance-and-other-top-nbfcs-offer-returns-up-to-895-11778490511027.html,2026-05-11 16:07:15 IST,"Corporate FD rates in May 2026 are attracting investors, as Shriram Finance, Mahindra Finance, and other top NBFCs offer stable FD returns of up to 8.95% amid market volatility. Check the comprehensive comparison, and discuss with certified financial advisors before locking in on any investments.&amp;nbsp;",https://www.livemint.com/rss/money
Early Lenskart investor Alpha Wave trims stake by 2.5% in open market,https://economictimes.indiatimes.com/markets/stocks/news/early-lenskart-investor-alpha-wave-trims-stake-by-2-5-in-open-market/articleshow/131018489.cms,2026-05-11 21:34:02 IST,"Alpha Wave Ventures reduced its stake in Lenskart through a major open market transaction, selling 2.46% holding in the eyewear retailer. Despite the stake sale, analysts remain optimistic on Lenskart’s long-term growth, citing strong revenue potential, operational scale and improving profitability outlook.",https://economictimes.indiatimes.com/markets/stocks/rssfeeds/2146843.cms
Q1 fuel losses may eliminate entire fiscal-year earnings,https://economictimes.indiatimes.com/markets/stocks/news/q1-fuel-losses-may-eliminate-entire-fiscal-year-earnings/articleshow/131018282.cms,2026-05-11 21:20:00 IST,"Despite a 50 per cent surge in input crude oil prices, petrol and diesel continue to be priced at a two-year-old rate of Rs 94.77 a litre and Rs 87.67 per litre respectively. Domestic cooking gas LPG prices were raised in March by Rs 60 per cylinder, but they are still way lower than the actual cost.",https://economictimes.indiatimes.com/markets/stocks/rssfeeds/2146843.cms
Q1 fuel losses may eliminate entire fiscal-year earnings of Indian OMCs,https://economictimes.indiatimes.com/markets/stocks/news/q1-fuel-losses-may-eliminate-entire-fiscal-year-earnings/articleshow/131018267.cms,2026-05-11 21:16:36 IST,"Since the war broke out in the Middle East 10 weeks ago, state-owned oil marketing companies (OMCs) have ensured uninterrupted supplies of petrol, diesel and cooking gas LPG at rates that are way below cost, unlike many global energy systems that imposed rationing or passed through steep price increases.",https://economictimes.indiatimes.com/markets/stocks/rssfeeds/2146843.cms
Market Trading Guide: Buy Tata Consumer and Welspun Corp on Tuesday for gains up to 14%,https://economictimes.indiatimes.com/markets/stocks/news/market-trading-guide-buy-tata-consumer-and-welspun-corp-on-tuesday-for-gains-up-to-14/articleshow/131018000.cms,2026-05-11 21:09:00 IST,"Nifty extended losses for a third straight session amid heavy selling in banking, auto and energy stocks. Analysts warned of a bearish trend after technical breakdowns below key moving averages, while recommending Tata Consumer and Welspun Corp as bullish positional trading opportunities",https://economictimes.indiatimes.com/markets/stocks/rssfeeds/2146843.cms
Zerodha's Nikhil Kamath suggests exploring gold-based stablecoins for India,https://economictimes.indiatimes.com/markets/stocks/news/zerodhas-nikhil-kamath-suggests-exploring-gold-based-stablecoins-for-india/articleshow/131016714.cms,2026-05-11 19:56:35 IST,Zerodha co-founder Nikhil Kamath questioned the long-term suitability of dollar-backed stablecoins for India and proposed exploring a gold-linked stablecoin. He said such a model could monetise idle household gold holdings while reducing dependence on dollar-dominated digital financial systems and supporting India’s strategic interests.,https://economictimes.indiatimes.com/markets/stocks/rssfeeds/2146843.cms
Sebi proposes allowing depositories to use part of IPF investment income for trust expenses,https://economictimes.indiatimes.com/markets/stocks/news/sebi-proposes-allowing-depositories-to-use-part-of-ipf-investment-income-for-trust-expenses/articleshow/131016553.cms,2026-05-11 19:50:02 IST,"At present, stock exchanges are permitted to use a maximum of 5 per cent of the interest or income generated from IPF investments for meeting expenses related to dedicated employees of the IPF Trust, administration of Investor Service Centres, and other statutory and administrative expenses such as taxes, audit fees and charity commissioner fees. However, no such provision exists for depositories.",https://economictimes.indiatimes.com/markets/stocks/rssfeeds/2146843.cms
BofA settles allegation of insider trading rule violation with Sebi,https://economictimes.indiatimes.com/markets/stocks/news/bofa-settles-allegation-of-insider-trading-rule-violation-with-sebi/articleshow/131016406.cms,2026-05-11 19:45:04 IST,"In its settlement order, the SEBI stated that a show-cause notice ​sent to BofA Securities India alleged the firm's failure to maintain ​the structured digital database required by insider trading regulations. BofA declined to comment on the settlement order ​and the allegations.",https://economictimes.indiatimes.com/markets/stocks/rssfeeds/2146843.cms
Jewellery stocks slide after Modi urges Indians to buy less gold,https://www.livemint.com/market/jewellery-stocks-slide-as-pm-modi-calls-for-lower-gold-imports-kalyan-titan-senco-11778503428435.html,2026-05-11 21:30:15 IST,The call for action comes at a time when retailers are already struggling to ensure volume growth due to record high gold prices,https://www.livemint.com/rss/markets
Upcoming IPO: Gaurik Fashion files DRHP with SEBI to raise funds through public issue,https://www.livemint.com/market/ipo/upcoming-ipo-gaurik-fashion-files-drhp-with-sebi-to-raise-funds-through-public-issue-11778510709213.html,2026-05-11 21:20:58 IST,"Gaurik Fashion submitted its Draft Red Herring Prospectus on May 10, 2026, to raise funds via an IPO of up to 70,00,000 equity shares. Proceeds will fund new stores, debt repayment, and corporate purposes. The shares will be listed on Indian stock exchanges.",https://www.livemint.com/rss/markets
"Unfazed by NSE’s commodity push, market share remains intact: MCX chief",https://www.livemint.com/market/commodities/mcx-ceo-nse-competition-commodity-derivatives-11778506671163.html,2026-05-11 20:34:53 IST,"MCX chief executive Praveena Rai says the bourse continues to dominate the commodity derivatives ecosystem since she took over, despite the competition launching new contracts and revising expiry schedules to gain traction.",https://www.livemint.com/rss/markets
"Markets tumble after Modi urges curbs on fuel use, gold buying",https://www.livemint.com/market/india-markets-slump-modi-consumption-curbs-investor-fears-inflation-outlook-11778501469252.html,2026-05-11 20:33:06 IST,"On Monday, the Nifty 50 and the Sensex marked their steepest single-day fall since 30 March, slumping 1.49% and 1.7%, respectively.",https://www.livemint.com/rss/markets
975% return in six months! Multibagger stock hits upper circuit despite stock market crash,https://www.livemint.com/market/stock-market-news/975-return-in-six-months-multibagger-stock-hits-upper-circuit-despite-stock-market-crash-11778508370894.html,2026-05-11 20:11:03 IST,"On May 11, Magnus Steel &amp;amp; Infra shares reached  ₹193, driven by its new role as a steel supplier for Tata Motors. With ongoing orders worth  ₹32.50 crore, the company aims to strengthen revenue visibility following a strong financial performance in FY26.",https://www.livemint.com/rss/markets
Indian Hotels Q4 Results: Net profit rises 15% YoY to  ₹600 crore; announces dividend of  ₹3.25 per share,https://www.livemint.com/market/stock-market-news/indian-hotels-q4-results-net-profit-rises-15-yoy-to-rs-600-crore-announces-dividend-of-rs-3-25-per-share-11778506278980.html,2026-05-11 19:34:29 IST,"Indian Hotels Company reported a Q4FY26 net profit of  ₹600 crore, a 15% YoY increase. Revenue rose 14% to  ₹2,845 crore, driven by strong hotel segment performance. The company anticipates opening 60 new hotels in FY27, with optimistic demand forecasts.",https://www.livemint.com/rss/markets
Early investors in Groww set to reap up to $498 million in block deal,https://www.livemint.com/companies/news/groww-block-deal-billionbrains-garage-groww-share-price-groww-investors-11778511845543.html,2026-05-11 21:21:48 IST,"The proposed transaction involves the sale of up to 268.4 million shares, representing around 4.3% of Groww’s existing total outstanding shares, through one or more on-market transactions on Indian stock exchanges.",https://www.livemint.com/rss/companies
Sunil Bharti Mittal says now is the time to ‘double down’ on investing in India: 'Cut obsession with gold imports',https://www.livemint.com/companies/people/sunil-bharti-mittal-says-now-is-the-time-to-double-down-on-investing-in-india-cut-obsession-with-gold-imports-11778507164670.html,2026-05-11 19:38:33 IST,"Amid soaring global crude oil prices and an energy crisis fuelled by the ongoing US-Iran conflict, Sunil Bharti Mittal, also advocated the use of renewable energy.",https://www.livemint.com/rss/companies
"What is LPG subsidy? Know rules, eligibility and how to spot fake LPG delivery messages and avoid scams | Explained",https://www.livemint.com/money/personal-finance/what-is-lpg-subsidy-know-rules-eligibility-and-how-to-spot-fake-lpg-delivery-messages-and-avoid-scams-explained-11778507701272.html,2026-05-11 21:44:32 IST,State-run oil companies are verifying LPG consumers' income to cut subsidy burden. Those with incomes over  ₹10 lakh may lose benefits. Consumers must respond within seven days to avoid cancellation. The move follows stricter checks with the Income Tax Department to identify ineligible recipients.,https://www.livemint.com/rss/money
