title,link,published,summary,source
8 key things that changed for market overnight - Gift Nifty to silver and gold prices,https://www.livemint.com/market/stock-market-news/8-key-things-that-changed-for-market-overnight-gift-nifty-to-silver-and-gold-prices-11766366791914.html,2025-12-22 07:15:02 IST,"Indian stock market benchmarks Sensex and Nifty 50 are expected to open higher on December 22, buoyed by positive global cues. Early signals from Gift Nifty indicate a firm start, with strong gains observed on December 19 following a stable rupee and favorable global conditions.",https://www.livemint.com/rss/markets
"Stocks to buy for long term: From TCS, Bharat Forge to Lupin— Hedged.in founder suggests 5 shares; do you own any?",https://www.livemint.com/market/stock-market-news/stocks-to-buy-for-long-term-from-tcs-bharat-forge-to-lupin-hedged-in-founder-suggests-5-shares-do-you-own-any-11766314139094.html,2025-12-22 07:00:33 IST,"Stocks to buy for long term: Rahul Ghose, Founder and CEO of Octanom Tech and Hedged.in., suggests five stocks, including TCS, Bharat Forge, and Lupin, with each stock showing potential for significant growth based on strong fundamentals and favorable market dynamics.",https://www.livemint.com/rss/markets
Kajaria Bathware files EoW complaint against CFO Dilip Maliwal for alleged  ₹20 crore fraud over 2 years in subsidiary,https://www.livemint.com/companies/news/kajaria-bathware-files-eow-complaint-against-cfo-dilip-maliwal-allege-rs-20-crore-fraud-2-year-kerovit-global-subsidiary-11766368168423.html,2025-12-22 07:30:09 IST,Kajaria Bathware has filed a complaint with the Economic Offences Wing of the Delhi police against and terminated the services of CFO Dilip Kumar Maliwal for allegedly embezzling  ₹20 crore from subsidiary Kerovit Global over the past two years.,https://www.livemint.com/rss/companies
Elon Musk boasts of Tesla services as Waymo's driverless cars froze due to San Francisco power outage — What happened?,https://www.livemint.com/companies/news/elon-musk-boasts-tesla-services-unaffect-waymo-driverless-vehicles-froze-traffic-san-francisco-power-outage-watch-videos-11766365397467.html,2025-12-22 07:03:06 IST,"Some 17,000 customers in San Francisco were still without power as San Francisco's utility rushed to restore services overnight. Meanwhile, Elon Musk took the chance to boast about Tesla FSD vehicles after rival Waymo's driverless vehicles caused chaos on the streets.&amp;nbsp;",https://www.livemint.com/rss/companies
GE Vernova T&amp;D India shares jump over 10% after major HVDC contract win,https://economictimes.indiatimes.com/markets/stocks/news/ge-vernova-td-india-shares-jump-over-10-after-major-hvdc-contract-win/articleshow/126114274.cms,2025-12-22 09:59:08 IST,"GE Vernova T&amp;D India shares rose sharply after the company secured a large HVDC transmission project from AESL Projects Limited. While the order strengthens long-term growth visibility and underscores technical capabilities, the stock is trading near its peak with rich valuations, suggesting optimism may already be priced in.",https://economictimes.indiatimes.com/markets/stocks/rssfeeds/2146843.cms
Is Nifty cheap for 2026 upside? Hidden valuation gaps challenge Wall Street's India rebound call,https://economictimes.indiatimes.com/markets/stocks/news/is-nifty-cheap-for-2026-upside-hidden-valuation-gaps-challenge-wall-streets-india-rebound-call/articleshow/126114247.cms,2025-12-22 09:56:46 IST,"Wall Street forecasts a Nifty rebound by 2026, driven by earnings recovery and easing rates. However, hidden valuation gaps, with many Nifty constituents trading at high multiples despite modest growth, challenge this optimism. Large financials and PSUs mask the elevated valuations in other sectors, suggesting selective stock picking over broad index gains.",https://economictimes.indiatimes.com/markets/stocks/rssfeeds/2146843.cms
Top Nifty50 stocks analysts suggest buying in this volatile week,https://economictimes.indiatimes.com/markets/stocks/news/top-nifty50-stocks-analysts-suggest-buying-in-this-volatile-week/articleshow/126114023.cms,2025-12-22 09:48:47 IST,"Stock Reports Plus, powered by Refinitiv, is a comprehensive research report that evaluates five key components of 4,000+ listed stocks – earnings, fundamentals, relative valuation, risk, and price momentum – to generate standardized scores. The simple average of the above-mentioned five component ratings is normally distributed to reach an average score.",https://economictimes.indiatimes.com/markets/stocks/rssfeeds/2146843.cms
Groww shares soar over 20% in just 3 days! What’s behind the surge today?,https://economictimes.indiatimes.com/markets/stocks/news/groww-shares-soar-over-20-in-just-3-days-whats-behind-the-surge-today/articleshow/126114089.cms,2025-12-22 09:47:55 IST,"Billionbrains Garage Ventures, parent of Groww, saw its shares surge over 20% after Jefferies initiated coverage with a Buy rating. The brokerage highlighted Groww's ""Robinhood-like"" strategy, expecting 35% earnings growth driven by new products and margin improvements, setting a target price of Rs 180.",https://economictimes.indiatimes.com/markets/stocks/rssfeeds/2146843.cms
"BSE eyes new monthly index options, revamps Bankex to take on Nifty Bank",https://economictimes.indiatimes.com/markets/stocks/news/bse-eyes-new-monthly-index-options-revamps-bankex-to-take-on-nifty-bank/articleshow/126113929.cms,2025-12-22 09:35:26 IST,"BSE is launching new monthly index option products, including a revamped Bankex index with expanded constituents and a new weighting structure, to boost its derivatives market share. This strategy aims to attract traders beyond weekly expiries by offering more attractive, cheaper monthly options. The exchange is also developing other monthly derivative products and strengthening its GIFT City operations.",https://economictimes.indiatimes.com/markets/stocks/rssfeeds/2146843.cms
"Sensex jumps over 450 pts, Nifty above 26,100 as rate-cut hopes, FII inflows lift D-St",https://economictimes.indiatimes.com/markets/stocks/news/sensex-jumps-over-450-pts-nifty-above-26100-as-rate-cut-hopes-fii-inflows-lift-d-st/articleshow/126113862.cms,2025-12-22 09:31:22 IST,"Indian stocks surged on Monday, with the Sensex and Nifty breaking a three-week losing streak. Investor sentiment was boosted by foreign fund inflows and increasing anticipation of interest-rate cuts in the coming year. The Sensex climbed over 450 points, surpassing 85,400, while the Nifty 50 gained over 150 points, crossing 26,100.",https://economictimes.indiatimes.com/markets/stocks/rssfeeds/2146843.cms
Nifty’s Santa rally isn’t just folklore: Why smallcap stocks could steal the spotlight this year-end,https://economictimes.indiatimes.com/markets/stocks/news/niftys-santa-rally-isnt-just-folklore-why-smallcap-stocks-could-steal-the-spotlight-this-year-end/articleshow/126113766.cms,2025-12-22 09:24:24 IST,"Historical data reveals smallcap stocks have consistently outperformed during the year-end Santa rally, averaging 3.55% returns with a 100% success rate. Technical indicators suggest smaller stocks are poised for a comeback, with market breadth already tilting in their favor. The Nifty also shows potential for an upward move, aligning with the repeatable seasonal pattern.",https://economictimes.indiatimes.com/markets/stocks/rssfeeds/2146843.cms
"Buy, Sell or Hold: Morgan Stanley downgrades Titagarh Rail; Citi maintains buy on PB Fintech",https://economictimes.indiatimes.com/markets/stocks/news/buy-sell-or-hold-morgan-stanley-downgrades-titagarh-rail-citi-maintains-buy-on-pb-fintech/articleshow/126113738.cms,2025-12-22 09:19:01 IST,"Brokerages offer mixed views on key stocks. Morgan Stanley downgrades Titagarh Rail Systems due to order visibility concerns but remains positive on Divi’s Laboratories for export recovery. Citi reiterates a Buy on PB Fintech, citing stable revenues. These insights guide investors towards selective market opportunities, balancing near-term challenges with long-term growth potential.",https://economictimes.indiatimes.com/markets/stocks/rssfeeds/2146843.cms
"Nomura initiates coverage on Tata Motors CV, predicts 22% upside potential on CV cycle recovery",https://economictimes.indiatimes.com/markets/stocks/news/nomura-initiates-coverage-on-tata-motors-cv-predits-22-upside-potential-on-cv-cycle-recovery/articleshow/126113568.cms,2025-12-22 08:58:29 IST,"Nomura initiates coverage on Tata Motors Commercial Vehicles (TMCV) with a 'Buy' rating and a Rs 481 target price, anticipating a 22% upside. The brokerage believes TMCV is poised to benefit from an upcoming upcycle in the Indian MHCV segment, driven by favorable economic conditions and strategic global expansion through the Iveco acquisition.",https://economictimes.indiatimes.com/markets/stocks/rssfeeds/2146843.cms
Ashok Leyland among 5 F&amp;O stocks with a sharp rise in futures open interest,https://economictimes.indiatimes.com/markets/stocks/news/ashok-leyland-among-5-fo-stocks-with-a-sharp-rise-in-futures-open-interest/slideshow/126113527.cms,2025-12-22 08:52:25 IST,,https://economictimes.indiatimes.com/markets/stocks/rssfeeds/2146843.cms
"Sensex jumps nearly 1,000 points in 2 sessions; Nifty 50 reclaims 26,100- Why is Indian stock market rising? Explained",https://www.livemint.com/market/stock-market-news/sensex-jumps-nearly-1-000-points-in-2-sessions-nifty-50-reclaims-26-100-why-is-indian-stock-market-rising-explained-11766377602000.html,2025-12-22 10:00:36 IST,"Sensex jumps nearly 1,000 points in 2 sessions; Nifty 50 reclaims 26,100- Why is Indian stock market rising? Explained",https://www.livemint.com/rss/markets
"Groww share price extends gains, jumps 6.5% today after Jefferies gives a thumbs up; stock up 72% from IPO price",https://www.livemint.com/market/stock-market-news/buy-or-sell-groww-share-price-extends-gains-jumps-6-5-after-jefferies-gives-a-thumbs-up-stock-up-72-from-ipo-price-11766376846059.html,2025-12-22 09:53:21 IST,"Groww's share price surged 6.5% after Jefferies initiated coverage, targeting a price of  ₹180, indicating a 12% upside. The brokerage expects a 35% EPS CAGR from FY26 to FY28, with strong investor interest in its IPO, which was subscribed nearly 18 times.",https://www.livemint.com/rss/markets
"China, Hong Kong stocks gain on signs of money inflows, Hainan free trade port excitement",https://www.livemint.com/market/stock-market-news/china-hong-kong-stocks-gain-on-signs-of-money-inflows-hainan-free-trade-port-excitement-11766377066982.html,2025-12-22 09:47:46 IST,"CHINA-STOCKS/MIDDAY:China, Hong Kong stocks gain on signs of money inflows, Hainan free trade port excitement",https://www.livemint.com/rss/markets
2780% rally in three years! Multibagger stock surges 11% on bagging order from Adani Energy Solutions,https://www.livemint.com/market/stock-market-news/2780-rally-in-three-years-multibagger-stock-surges-11-on-bagging-order-from-adani-energy-solutions-11766376679999.html,2025-12-22 09:47:13 IST,"Multibagger stock GE Vernova T&amp;amp;D India rallied 11% in intraday deals on Monday, December 22, following an order win from Adani group company — Adani Energy Solutions Limited (ASEL).",https://www.livemint.com/rss/markets
Silver rate today hits all-time high following gold's record climb - What is silver's next target?,https://www.livemint.com/market/stock-market-news/silver-rate-today-hits-all-time-high-following-golds-record-climb-what-is-silvers-next-target-11766376344798.html,2025-12-22 09:39:38 IST,"Silver prices hit an all-time high, rising 2.39% to  ₹2,13,412 per kg, driven by gold's record levels and expectations of US interest rate cuts. Spot silver reached USD 69.23 per ounce, while platinum and palladium also saw significant gains.",https://www.livemint.com/rss/markets
ICICI Prudential AMC share price dips after strong debut last week. Opportunity to buy?,https://www.livemint.com/market/stock-market-news/icici-prudential-amc-share-price-dips-after-strong-debut-last-week-opportunity-to-buy-11766375787754.html,2025-12-22 09:37:19 IST,"ICICI Prudential AMC share price today opened downside and touched an intraday low of  ₹2,531.10 apiece on the NSE within a few minutes of the Opening Bell",https://www.livemint.com/rss/markets
Gujarat Kidney IPO Day 1 LIVE: Issue kicks off today amid 6% GMP — Should you apply?,https://www.livemint.com/market/ipo/gujarat-kidney-ipo-gmp-today-gujarat-kidney-ipo-subscription-gujarat-kidney-ipo-review-gujarat-kidney-ipo-11766375465496.html,2025-12-22 09:36:17 IST,Gujarat Kidney IPO Day 1 LIVE:  ₹251-crore Gujarat Kidney IPO opened for public subscription on December 22. The price band for the issue has been fixed at  ₹108 to  ₹114 per share. Gujarat Kidney IPO GMP today signals 6% listing pop.,https://www.livemint.com/rss/markets
Infosys shares rise 3% as stock ADRs hit 52-week high before cooling off; IT major issues clarification,https://www.livemint.com/market/stock-market-news/infosys-shares-rise-3-as-infosys-adrs-hit-52-week-high-before-cooling-off-it-major-issues-clarification-11766375808760.html,2025-12-22 09:30:40 IST,"Infosys share price increased over 3% on December 22 following a clarification about a surge in ADRs, which rose 56% to $30 before settling at $20.22. The company stated there were no material events necessitating disclosure under SEBI regulations.",https://www.livemint.com/rss/markets
"Gold price today: Rates jump on MCX on Fed rate cut hopes, healthy spot demand; experts highlight key levels to watch",https://www.livemint.com/market/commodities/gold-price-today-rates-jump-on-mcx-on-fed-rate-cut-hopes-healthy-spot-demand-experts-highlight-key-levels-to-watch-11766374525612.html,2025-12-22 09:16:41 IST,"Gold price today: MCX gold February futures were 0.77% up at  ₹1,35,224 per 10 grams, while MCX silver March futures were 2.39% up at  ₹2,13,412 per kg around 9:15 am.",https://www.livemint.com/rss/markets
"Sensex rallies 1,000 points in 2 days, Nifty tops 26,100. Why is the stock market rising?",https://economictimes.indiatimes.com/markets/stocks/news/sensex-rallies-1000-points-in-2-days-nifty-tops-26100-why-is-the-stock-market-rising/articleshow/126114854.cms,2025-12-22 10:40:44 IST,"Indian equities surged for a second day, with Sensex and Nifty climbing on a stronger rupee and positive global sentiment. Foreign institutional investors turned net buyers, contributing to the rally. This renewed investor confidence, driven by potential U.S. Federal Reserve rate cuts and domestic economic strength, signals a potential year-end market upswing.",https://economictimes.indiatimes.com/markets/stocks/rssfeeds/2146843.cms
"Call or Put? How options shape profits, protection and strategy across markets",https://economictimes.indiatimes.com/markets/stocks/news/call-or-put-how-options-shape-profits-protection-and-strategy-across-markets/articleshow/126114782.cms,2025-12-22 10:34:28 IST,"Options trading has gone mainstream, with calls and puts widely used across Indian, US and global markets for profits, protection and risk management. While options offer leverage, defined risk and hedging benefits, they also involve time decay and complexity, making disciplined strategy and understanding essential for investors.",https://economictimes.indiatimes.com/markets/stocks/rssfeeds/2146843.cms
Jupiter Wagons shares rally over 11% following a promoter stake increase,https://economictimes.indiatimes.com/markets/stocks/news/jupiter-wagons-shares-rally-over-11-following-a-promoter-stake-increase/articleshow/126114762.cms,2025-12-22 10:32:03 IST,"The rally came after Jupiter Wagons informed the stock exchanges that its promoter, Tatravagonka A.S., had acquired additional equity shares through the conversion of convertible warrants.",https://economictimes.indiatimes.com/markets/stocks/rssfeeds/2146843.cms
"ICICI Prudential AMC shares rise another 2% on Day 2. Should you buy, sell or hold?",https://economictimes.indiatimes.com/markets/stocks/news/icici-prudential-amc-shares-rise-another-2-on-day-2-should-you-buy-sell-or-hold/articleshow/126114392.cms,2025-12-22 10:11:27 IST,"ICICI Prudential AMC shares surged over 2% to an intraday high of Rs 2,645, extending their rally post a strong market debut. Brokerages like PL Capital and Centrum have issued Buy ratings, citing strong performance, superior equity yields, and robust revenue growth. The company's dominant position in equity AUM and expanding PMS/AIF platforms further bolster bullish outlooks.",https://economictimes.indiatimes.com/markets/stocks/rssfeeds/2146843.cms
Ola Electric shares are down 60% in 2025. Is there a bottom-fishing opportunity here?,https://economictimes.indiatimes.com/markets/stocks/news/ola-electric-shares-are-down-60-in-2025-is-there-a-bottom-fishing-opportunity-here/articleshow/126114465.cms,2025-12-22 10:11:19 IST,"Ola Electric shares saw a nearly 10% jump Friday after CEO Bhavish Aggarwal sold a portion of his stake to repay debt and eliminate promoter pledges. This move aims to reduce risk and volatility, though the stock remains down significantly year-to-date and from its peak, with technical indicators flashing caution.",https://economictimes.indiatimes.com/markets/stocks/rssfeeds/2146843.cms
Ashish Kacholia-backed Knowledge Marine &amp; Engineering Works shares tumble 51%. Should investors worry?,https://economictimes.indiatimes.com/markets/stocks/news/ashish-kacholia-backed-knowledge-marine-engineering-works-shares-tumble-51-should-investors-worry/articleshow/126114396.cms,2025-12-22 10:07:47 IST,"Shares of Knowledge Marine &amp; Engineering Works fell 51% after turning ex-split, reflecting a technical price adjustment. The drop did not affect fundamentals, and the stock later rebounded over 11% intraday, leaving investors’ overall holding value unchanged.",https://economictimes.indiatimes.com/markets/stocks/rssfeeds/2146843.cms
Santa rally on hold? Wall Street faces crosscurrents from AI and Fed uncertainty,https://economictimes.indiatimes.com/markets/stocks/news/santa-rally-on-hold-wall-street-faces-crosscurrents-from-ai-and-fed-uncertainty/articleshow/126114356.cms,2025-12-22 10:05:34 IST,"U.S. equities have seen a choppier-than-usual December, defying the typical year-end rally even as major indices remain on track for solid full-year gains in 2025. Recent volatility has been driven by concerns over heavy AI-related capital spending and uncertainty around the Federal Reserve’s interest-rate outlook.",https://economictimes.indiatimes.com/markets/stocks/rssfeeds/2146843.cms
"Festive Season, Fragile Markets: Investors brace for a busy finish",https://economictimes.indiatimes.com/markets/stocks/news/festive-season-fragile-markets-investors-brace-for-a-busy-finish/articleshow/126114322.cms,2025-12-22 10:03:02 IST,"As the year-end approaches, global markets remain volatile amid mixed U.S. economic signals, geopolitical risks and uncertainty over a Santa rally. Investors are closely tracking key data releases, oil-market developments and central bank cues in Asia as a turbulent year draws to a close.",https://economictimes.indiatimes.com/markets/stocks/rssfeeds/2146843.cms
Neptune Logitek IPO listing: Shares list at 26% discount to IPO price,https://www.livemint.com/market/stock-market-news/neptune-logitek-ipo-listing-shares-list-at-26-discount-to-ipo-price-11766379547757.html,2025-12-22 10:38:21 IST,"Neptune Logitek share price made a muted debut on BSE SME on Monday, December 22. The shares of Neptune Logitek were listed at 26% discount over the IPO price of  ₹126.",https://www.livemint.com/rss/markets
Kalyan Jewellers share price jumps over 60% against 52-week low. Should you buy amid gold rate rally?,https://www.livemint.com/market/stock-market-news/kalyan-jewellers-share-price-jumps-over-60-against-52-week-low-should-you-buy-amid-gold-rate-rally-11766378068722.html,2025-12-22 10:31:27 IST,"Kalyan Jewellers share price today edged higher and touched an intraday high of  ₹487 apiece on the NSE, logging around 63% rise from 52-week low of  ₹399.40",https://www.livemint.com/rss/markets
"Nomura sees Ashok Leyland as key beneficiary of CV upcycle, sets target at Rs 196. Stock up 2%",https://economictimes.indiatimes.com/markets/stocks/news/nomura-sees-ashok-leyland-as-key-beneficiary-of-cv-upcycle-sets-target-at-rs-196-stock-up-2/articleshow/126115935.cms,2025-12-22 11:50:41 IST,"Ashok Leyland shares hit a fresh 52-week high after Nomura reaffirmed its Buy rating and raised optimism around the commercial vehicle upcycle. The brokerage sees the company as a key beneficiary of improving CV demand, stronger volume growth and margin tailwinds, setting a target price of Rs 196 with healthy upside.",https://economictimes.indiatimes.com/markets/stocks/rssfeeds/2146843.cms
"Cables &amp; Wires industry enters a Rs 1.9-tn growth phase; KEI Industries, Polycab India top buys",https://economictimes.indiatimes.com/markets/stocks/news/cables-wires-industry-enters-a-rs-1-9-tn-growth-phase-kei-industries-polycab-india-top-buys/articleshow/126115422.cms,2025-12-22 11:15:12 IST,"India’s cables &amp; wires industry is entering a multi-year growth phase, driven by infrastructure, renewables, railways, data centres and exports. With the market seen nearing Rs 1.9 trillion by FY30, companies like Polycab India and KEI Industries are well placed to benefit from strong demand visibility and resilient margins.",https://economictimes.indiatimes.com/markets/stocks/rssfeeds/2146843.cms
Meesho shares slide 8% in 2 days. What’s behind the selloff after stock more than doubled from listing?,https://economictimes.indiatimes.com/markets/stocks/news/meesho-shares-slide-8-in-2-days-whats-behind-the-selloff-after-stock-more-than-doubled-from-listing/articleshow/126115390.cms,2025-12-22 11:12:51 IST,"Meesho shares have fallen 8% over two sessions after surging more than 100% since its December 10 IPO. Low free-float, short-covering, and intense early demand are driving the pullback despite strong analyst support.",https://economictimes.indiatimes.com/markets/stocks/rssfeeds/2146843.cms
Australian shares at over one-month high as miners and banks lead rally,https://www.livemint.com/market/stock-market-news/australian-shares-at-over-one-month-high-as-miners-and-banks-lead-rally-11766384722611.html,2025-12-22 11:55:22 IST,AUSTRALIA-STOCKS/ CLOSE:Australian shares at over one-month high as miners and banks lead rally,https://www.livemint.com/rss/markets
Multibagger stock Apollo Micro Systems hits 5% upper circuit after this DRDO approval. Do you own?,https://www.livemint.com/market/stock-market-news/multibagger-stock-apollo-micro-systems-hits-5-upper-circuit-after-this-drdo-approval-do-you-own-11766380727872.html,2025-12-22 11:20:50 IST,"Apollo Micro Systems share price hits a 5% upper circuit at  ₹249.80, boosted by DRDO technology approvals. The company received two Transfers of Technology for Laser-Based Directed Energy Weapon systems, enhancing its defence capabilities and aligning with India's indigenisation initiatives.",https://www.livemint.com/rss/markets
"Dachepalli Publishers IPO opens: Check subscription status, key dates, latest GMP and other details about SME IPO",https://www.livemint.com/market/ipo/dachepalli-publishers-ipo-opens-check-subscription-status-key-dates-latest-gmp-and-other-details-about-sme-ipo-11766381802561.html,2025-12-22 11:12:38 IST,"Dachepalli Publishers IPO has a lot size of 1200 shares. The retail investors need at least  ₹2,44,800 to apply for the share sale as they need to subscribe for at least two lots.",https://www.livemint.com/rss/markets
Australian shares at over one-month high as miners and banks lead rally,https://economictimes.indiatimes.com/markets/stocks/news/australian-shares-at-over-one-month-high-as-miners-and-banks-lead-rally/articleshow/126116022.cms,2025-12-22 11:55:11 IST,"Indian markets are buzzing as Australian shares surged for a third day, hitting a month-high driven by strong mining and broad buying. Analysts are calling it the 'Santa Claus rally,' with potential for further gains. Miners saw record highs, while gold stocks also climbed. Financials are showing resilience, with banks expected to benefit from anticipated interest rate trends into 2026.",https://economictimes.indiatimes.com/markets/stocks/rssfeeds/2146843.cms
Stocks to buy or sell: Nagraj Shetti of HDFC Securities recommends two shares for short term,https://www.livemint.com/market/stock-market-news/stocks-to-buy-or-sell-nagraj-shetti-of-hdfc-securities-recommends-two-shares-for-short-term-11766386159073.html,2025-12-22 12:28:59 IST,Stocks to buy or sell: Nagraj Shetti of HDFC Securities recommends two shares for short term —Borosil Renewables and NMDC,https://www.livemint.com/rss/markets
"MARC Technocrats IPO allotment today: Latest GMP, steps-by-step guide to check allotment status online for SME IPO",https://www.livemint.com/market/ipo/marc-technocrats-ipo-allotment-today-latest-gmp-steps-by-step-guide-to-check-allotment-status-online-for-sme-ipo-11766386319223.html,2025-12-22 12:27:26 IST,"MARC Technocrats' IPO saw strong investor interest, with allotment expected today, December 22, 2025. The shares will debut on NSE SME on December 24, following a successful subscription period. Investors can check allotment status online via NSE or Maashitla Securities.",https://www.livemint.com/rss/markets
