title,link,published,summary,source
Pre-market action: Here's the trade setup for today's session,https://economictimes.indiatimes.com/markets/stocks/news/pre-market-action-heres-the-trade-setup-for-todays-session/articleshow/127747874.cms,2026-01-29 06:51:41 IST,Indian stock markets closed higher on Wednesday. Positive global sentiment and optimism surrounding the India-EU Free Trade Agreement fueled the gains. Analysts anticipate this upward trend to continue. Upcoming budget expectations and ongoing Q3 earnings season are also contributing factors. Global markets showed mixed movements. Foreign investors were net buyers.,https://economictimes.indiatimes.com/markets/stocks/rssfeeds/2146843.cms
"Stocks in news: ITC, Vedanta, Paytm, Swiggy, Akzo Nobel, Tata Motors",https://economictimes.indiatimes.com/markets/stocks/news/stocks-in-news-itc-vedanta-paytm-swiggy-akzo-nobel-tata-motors/articleshow/127747703.cms,2026-01-29 06:47:17 IST,"Markets showed high volatility but gained over half a percent as investor optimism returned, with the Nifty index nearing a crucial 25,350 level. Several companies, including ITC, Vedanta, and Tata Motors, are in focus due to Q3 results and other corporate developments.",https://economictimes.indiatimes.com/markets/stocks/rssfeeds/2146843.cms
"Gold extends record rally, US stock futures drop",https://economictimes.indiatimes.com/markets/stocks/news/gold-extends-record-rally-us-stock-futures-drop/articleshow/127747539.cms,2026-01-29 06:43:05 IST,"Gold and oil prices surged as geopolitical tensions escalated and the Federal Reserve maintained its stance on interest rates. Gold broke above $5,550, while oil advanced on concerns over Iran. US equity futures dipped amid mixed tech earnings, with investors awaiting further clarity on interest rate paths.",https://economictimes.indiatimes.com/markets/stocks/rssfeeds/2146843.cms
Sebi at odds over conflict of interest rules for top brass,https://economictimes.indiatimes.com/markets/stocks/news/sebi-at-odds-over-conflict-of-interest-rules-for-top-brass/articleshow/127746945.cms,2026-01-29 06:29:59 IST,"India's market regulator Sebi faces internal division regarding new conflict-of-interest rules for its top officials. The Sebi board is debating whether it can impose a code of conduct on its chairman and members, whose appointments are approved by the central government.",https://economictimes.indiatimes.com/markets/stocks/rssfeeds/2146843.cms
Brokerages stay constructive on Persistent despite recent underperformance,https://economictimes.indiatimes.com/markets/stocks/news/brokerages-stay-constructive-on-persistent-despite-recent-underperformance/articleshow/127745803.cms,2026-01-29 06:05:12 IST,Persistent Systems stock sees a dip despite positive analyst outlook. The company is on track to meet its revenue guidance of $2 billion by FY27. Strong order bookings and improving profitability are key drivers. Healthcare segment shows renewed growth. Operating margins faced a temporary hit due to labour code changes. Analysts remain optimistic about future performance.,https://economictimes.indiatimes.com/markets/stocks/rssfeeds/2146843.cms
"Reliance, Capri Global to acquire Mumbai’s SevenHills Hospital",https://economictimes.indiatimes.com/markets/stocks/news/reliance-capri-global-to-acquire-mumbais-sevenhills-hospital/articleshow/127747231.cms,2026-01-29 06:00:00 IST,"Reliance Industries and Capri Global will acquire Mumbai’s 1,500-bed SevenHills Hospital, ending an eight-year impasse. The hospital will be converted into a not-for-profit entity, with funds infused via equity support.",https://economictimes.indiatimes.com/markets/stocks/rssfeeds/2146843.cms
Asian Paints’ gloss fades amid a riot of colour &amp; competition,https://economictimes.indiatimes.com/markets/stocks/news/q3-results-trigger-sell-calls-on-asian-paints-shares-drop-4/articleshow/127745307.cms,2026-01-29 05:51:21 IST,"Asian Paints shares fell 4.3% on Wednesday following third-quarter results, with most top brokerages maintaining bearish ratings due to profitability pressures from intense competition. Analysts with sell ratings foresee potential downsides of 8% to 25%, while more optimistic projections suggest upsides of up to 31%.",https://economictimes.indiatimes.com/markets/stocks/rssfeeds/2146843.cms
"UBS bullish on TaMo CV and Ashok Leyland, assigns 'Buy'",https://economictimes.indiatimes.com/markets/stocks/news/ubs-bullish-on-tamo-cv-and-ashok-leyland-assigns-buy/articleshow/127744914.cms,2026-01-29 05:40:54 IST,"UBS initiated coverage on Tata Motors' commercial vehicles business with a buy rating and a ₹550 price target, citing undervaluation compared to global peers. The brokerage also reiterated a buy on Ashok Leyland, raising its price target to ₹225. UBS believes Indian CV makers are poised to narrow valuation gaps due to improving fundamentals.",https://economictimes.indiatimes.com/markets/stocks/rssfeeds/2146843.cms
"Pharma, IT unable to gain from rupee fall, tariffs bigger worry",https://economictimes.indiatimes.com/markets/stocks/news/pharma-it-unable-to-gain-from-rupee-fall-tariffs-bigger-worry/articleshow/127744297.cms,2026-01-29 05:30:13 IST,Indian IT and pharma stocks are not benefiting from a weaker rupee as expected. Tariff concerns are overshadowing currency gains. Investors are waiting for clarity on trade deals. Foreign investors have also been selling these stocks. Valuations remain a concern for pharma companies. Demand for IT services shows signs of improvement. Stock selection will be crucial for investors.,https://economictimes.indiatimes.com/markets/stocks/rssfeeds/2146843.cms
Stock Radar: Shriram Finance stock sees profit taking after hitting record highs earlier in Jan 2026; time to buy the dip?,https://economictimes.indiatimes.com/markets/stocks/news/stock-radar-shriram-finance-stock-sees-profit-taking-after-hitting-record-highs-earlier-in-jan-2026-time-to-buy-the-dip/articleshow/127704068.cms,2026-01-29 05:00:00 IST,"Shriram Finance stock shows potential for further gains. Experts suggest buying for a target of Rs 1,125 in the coming weeks. The stock is trading above key moving averages, indicating a strong uptrend. Technical indicators support a bullish outlook. A stop loss at Rs 944 is recommended for risk management.",https://economictimes.indiatimes.com/markets/stocks/rssfeeds/2146843.cms
"Baramati plane crash likely to result in ₹50 crore claim, insurers say",https://economictimes.indiatimes.com/markets/stocks/news/baramati-plane-crash-likely-to-result-in-50-crore-claim-insurers-say/articleshow/127746471.cms,2026-01-29 00:55:04 IST,"A fatal Learjet 45 crash near Pune, killing five, is expected to trigger insurance claims of approximately ₹50 crore. The aircraft, insured by ICICI Lombard, was attempting to land when it crashed. This follows another aviation insurance claim of ₹18 crore earlier this month.",https://economictimes.indiatimes.com/markets/stocks/rssfeeds/2146843.cms
Private banks step up write-offs despite benign NPA ratios in December quarter,https://economictimes.indiatimes.com/markets/stocks/news/private-banks-step-up-write-offs-despite-benign-npa-ratios-in-december-quarter/articleshow/127746562.cms,2026-01-29 00:51:31 IST,"Indian private banks increased loan write-offs by over 22% in the December quarter. This move aims to clean balance sheets. Despite low reported bad loan ratios, underlying stress persists, especially in retail and unsecured lending. Banks are proactively managing credit costs. This trend highlights ongoing asset quality pressures that observers are watching closely.",https://economictimes.indiatimes.com/markets/stocks/rssfeeds/2146843.cms
"PNB Housing Finance bets on affordable loans, margin focus under new MD",https://economictimes.indiatimes.com/markets/stocks/news/pnb-housing-finance-bets-on-affordable-loans-margin-focus-under-new-md/articleshow/127745661.cms,2026-01-29 00:49:39 IST,"PNB Housing Finance aims to balance growth and margins under a new leader with a five-year tenure, following frequent leadership changes. The company is shifting focus to higher-yielding affordable and mid-market housing loans, targeting a 45-50% share by FY28. This strategy, coupled with funding new developers, seeks to improve profitability and address investor concerns.",https://economictimes.indiatimes.com/markets/stocks/rssfeeds/2146843.cms
"Inox Clean Energy raises ₹3,400 crore from NaBFID to refinance Vibrant Energy debt",https://economictimes.indiatimes.com/markets/stocks/news/inox-clean-energy-raises-3400-crore-from-nabfid-to-refinance-vibrant-energy-debt/articleshow/127745567.cms,2026-01-29 00:49:26 IST,"INOX Clean Energy is securing a ₹3,400 crore, 20-year loan from NaBFID to refinance debt post-acquisition of Macquarie's Vibrant Energy. This loan, priced between 8-8.50%, will be secured by seven solar, wind, and hybrid projects with long-term PPAs. The move aims to retire expensive debt and reduce the company's equity component.",https://economictimes.indiatimes.com/markets/stocks/rssfeeds/2146843.cms
"Indian stock market: 10 things that changed for market overnight- Gift Nifty, US Fed policy to Tesla, Microsoft earnings",https://www.livemint.com/market/stock-market-news/indian-stock-market-10-things-that-changed-for-market-overnight-gift-nifty-us-fed-policy-to-tesla-microsoft-earnings-11769624090332.html,2026-01-29 07:06:47 IST,"Gift Nifty was trading around 25,364 level, a discount of nearly 86 points from the Nifty futures’ previous close, indicating a negative start for the Indian stock market indices.",https://www.livemint.com/rss/markets
Economic Survey 2026 LIVE: FM Nirmala Sitharaman to table Economic Survey today; Growth outlook to capex- what to expect,https://www.livemint.com/market/stock-market-news/economic-survey-2026-live-fm-nirmala-sitharaman-to-table-economic-survey-today-growth-outlook-to-capex-what-to-expect-11769624272782.html,2026-01-29 06:04:08 IST,"Economic Survey 2025-26 LIVE: The Economic Survey usually covers the GDP growth trends, inflation and monetary policy, fiscal position, performance of the external sector, social indicators such as employment, health, education, and other special chapters on emerging themes.",https://www.livemint.com/rss/markets
Top three stocks to buy today—recommended by Ankush Bajaj for 29 January,https://www.livemint.com/market/stock-market-news/stocks-to-buy-ankush-bajaj-29-january-nifty-sensex-oil-india-apl-apollo-tubes-coal-india-11769607528050.html,2026-01-29 06:00:23 IST,"Market expert Ankush Bajaj recommends three stocks to buy on Thursday, 29 January.",https://www.livemint.com/rss/markets
Stocks to buy: Raja Venkatraman recommends top picks for 29 January,https://www.livemint.com/market/stock-market-news/stocks-to-buy-raja-venkatraman-top-stock-picks-29-january-11769601023579.html,2026-01-29 06:00:22 IST,"Market expert Raja Venkatraman shares his top stocks to buy today, 29 January. Discover his exclusive picks and analysis to inform your investment strategy.",https://www.livemint.com/rss/markets
Stock recommendations for 29 January from MarketSmith India,https://www.livemint.com/market/stock-market-news/stock-recommendations-29-january-marketsmith-india-11769607221196.html,2026-01-29 05:46:02 IST,"MarketSmith India reveals its top stock recommendations for today, 29 January. Get expert insights into the best-performing stocks to guide your investment decisions.",https://www.livemint.com/rss/markets
Energy pips bullion for retail traders on MCX,https://www.livemint.com/market/energy-crude-oil-natural-gas-pips-gold-silver-bullion-in-trader-interest-on-mcx-11769589399572.html,2026-01-29 05:30:42 IST,Retail clients on India's largest commodity derivatives bourse are increasing their trading in crude and natural gas options amid rising volatility and escalating geopolitical tensions. Premium turnover in gold and silver contracts is declining.,https://www.livemint.com/rss/markets
Why naming a nominee may be the most important step in your life insurance,https://www.livemint.com/money/personal-finance/life-insurance-nominee-for-claim-settlement-11769586807484.html,2026-01-29 05:46:02 IST,"Assigning a nominee in a life insurance policy ensures faster claim settlement, legal clarity and financial security for families when they need it most.",https://www.livemint.com/rss/money
Smallcap bloodbath: 10 stocks tumble up to 40% in first month of 2026. Do you own any?,https://economictimes.indiatimes.com/markets/stocks/news/smallcap-bloodbath-10-stocks-tumble-up-to-40-in-first-month-of-2026-do-you-own-any/slideshow/127753877.cms,2026-01-29 09:19:48 IST,"India's smallcap market is experiencing a significant downturn, with over 600 stocks seeing double-digit losses in early 2026. This correction follows a year-long build-up after a period of strong gains. The article highlights ten prominent smallcap stocks that have faced substantial declines, including Balu Forge Industries and Systematix Corporate Services, as the market navigates this challenging phase.",https://economictimes.indiatimes.com/markets/stocks/rssfeeds/2146843.cms
"FIIs dump 2 stocks for every one bought, smallcaps worst hit. What it means for investors",https://economictimes.indiatimes.com/markets/stocks/news/fiis-dump-2-stocks-for-every-one-bought-smallcaps-worst-hit-what-it-means-for-investors/articleshow/127752838.cms,2026-01-29 09:00:52 IST,"Foreign institutional investors (FIIs) significantly reduced their holdings in Indian equities during the December quarter, selling nearly two stocks for every one purchased, with smallcaps bearing the brunt. This exodus, driven by high valuations and modest earnings growth, saw FIIs divest from 814 stocks while acquiring only 478 across various market segments.",https://economictimes.indiatimes.com/markets/stocks/rssfeeds/2146843.cms
"Maruti Suzuki in focus after Q3 results; Should buy, sell or hold?",https://economictimes.indiatimes.com/markets/stocks/news/maruti-suzuki-in-focus-after-q3-results-should-buy-sell-or-hold/articleshow/127752710.cms,2026-01-29 08:56:53 IST,"Maruti Suzuki reported modest December-quarter profit growth, missing estimates due to export pressure and one-time labour code costs. Strong revenue growth, record domestic sales, and a supportive GST structure aided performance. With the stock oversold technically, near-term movement will hinge on margin recovery, exports, and demand momentum.",https://economictimes.indiatimes.com/markets/stocks/rssfeeds/2146843.cms
L&amp;T shares in focus after Q3 profit dips 4% YoY; order inflows hit record high,https://economictimes.indiatimes.com/markets/stocks/news/lt-shares-in-focus-after-q3-profit-dips-4-yoy-order-inflows-hit-record-high/articleshow/127752289.cms,2026-01-29 08:45:16 IST,"Larsen &amp; Toubro reported a year-on-year decline in December-quarter profit due to a one-time employee benefit provision, even as underlying earnings and revenues remained strong. Robust order inflows and execution momentum supported growth prospects, while a low RSI suggests the stock is nearing oversold territory.",https://economictimes.indiatimes.com/markets/stocks/rssfeeds/2146843.cms
"TVS Motor Company shares in focus after Q3. Should you buy, sell or hold?",https://economictimes.indiatimes.com/markets/stocks/news/tvs-motor-company-shares-in-focus-after-q3-should-you-buy-sell-or-hold/articleshow/127752020.cms,2026-01-29 08:40:07 IST,"TVS Motor Company reported a robust 49% year-on-year jump in consolidated net profit to Rs 841 crore for the December quarter, driven by record sales and revenue. The two-wheeler major's overall sales grew 27% YoY to 15.44 lakh units, with strong performance across motorcycles, scooters, and international markets.",https://economictimes.indiatimes.com/markets/stocks/rssfeeds/2146843.cms
Cochin Shipyard among 8 Nifty200 stocks showing bullish RSI upswing,https://economictimes.indiatimes.com/markets/stocks/news/cochin-shipyard-among-8-nifty200-stocks-showing-bullish-rsi-upswing/slideshow/127751629.cms,2026-01-29 08:26:30 IST,,https://economictimes.indiatimes.com/markets/stocks/rssfeeds/2146843.cms
KRM Ayurveda shares to list today. GMP indicates healthy premium on debut,https://economictimes.indiatimes.com/markets/stocks/news/krm-ayurveda-shares-to-list-today-gmp-indicates-healthy-premium-on-debut/articleshow/127750035.cms,2026-01-29 07:49:16 IST,"KRM Ayurveda's shares traded at a 17% grey market premium ahead of its NSE SME listing, signaling strong investor confidence. The Rs 77 crore IPO, entirely a fresh issue, was oversubscribed 74.27 times, driven by robust demand across all investor categories.",https://economictimes.indiatimes.com/markets/stocks/rssfeeds/2146843.cms
Positive Breakout: These 12 stocks cross above their 200 DMAs,https://economictimes.indiatimes.com/markets/stocks/news/positive-breakout-these-12-stocks-cross-above-their-200-dmas/slideshow/127749474.cms,2026-01-29 07:28:59 IST,"As long as the stock is priced above the 200-day SMA on the daily timeframe, it is generally considered to be in an overall uptrend.",https://economictimes.indiatimes.com/markets/stocks/rssfeeds/2146843.cms
Breakout stocks to buy or sell: Sumeet Bagadia recommends five shares to buy today before the Economic Survey 2026,https://www.livemint.com/market/stock-market-news/breakout-stocks-to-buy-or-sell-sumeet-bagadia-recommends-five-shares-to-buy-today-before-the-economic-survey-2026-11769655812519.html,2026-01-29 09:25:26 IST,"Breakout stocks to buy or sell: Sumeet Bagadia recommends five shares to buy today — Union Bank, NMDC, MRPL, IRFC, and GPIL",https://www.livemint.com/rss/markets
Gold price today: Rates jump 6% to hit record high on MCX after US Fed policy decision,https://www.livemint.com/market/commodities/gold-price-today-rates-jump-5-to-hit-record-high-on-mcx-after-us-fed-policy-decision-dollar-mcx-silver-11769657604750.html,2026-01-29 09:09:10 IST,"Gold price today: Rates surge. MCX gold February futures jumped by nearly  ₹10,000, or 6%, to hit the record high of  ₹1,75,869 per 10 grams mark. MCX silver March futures soared by  ₹21,500, or almost 6%, to a record high of  ₹4,06,863 per kg.",https://www.livemint.com/rss/markets
Silver rate today jumps 4% to cross  ₹4 lakh for first time ever as US-Iran tensions rise,https://www.livemint.com/market/commodities/silver-rate-today-jumps-4-to-cross-rs-4-lakh-for-first-time-ever-as-us-iran-tensions-rise-gold-price-at-peak-11769655772368.html,2026-01-29 09:07:00 IST,"Silver prices surged past  ₹4 lakh on January 29, driven by geopolitical tensions and supportive global cues. On MCX, silver jumped 4% to  ₹4,00,780, while gold also reached record levels amid a weaker US dollar and strong demand for safe-haven assets.",https://www.livemint.com/rss/markets
Why 360 ONE is pulling ahead in India’s wealth management race,https://www.livemint.com/market/stock-market-news/wealth-management-stocks-india-360-one-share-price-nuvama-share-price-11769592627021.html,2026-01-29 09:00:06 IST,"360 ONE expects India’s wealth management AUM to expand to  ₹152 trillion by FY29 from  ₹95 trillion in FY24. Against this backdrop, the company’s growth trajectory appears to be driven more by industry tailwinds than by cyclical factors",https://www.livemint.com/rss/markets
"Q3 results 2026: ITC, Paytm, Swiggy, Tata Motors among companies to declare earnings today; full list here",https://www.livemint.com/market/stock-market-news/q3-results-2026-itc-paytm-swiggy-tata-motors-among-companies-to-declare-earnings-today-full-list-here-11769654015321.html,2026-01-29 08:50:08 IST,"ITC, One97 Communications (Paytm), Swiggy, Tata Motors, Canara Bank, Dabur, Adani Power, and Dixon Technologies are among the marquee companies to release their Q3 earnings 2026 today.",https://www.livemint.com/rss/markets
"Stock Market Today: Sensex, Nifty 50 open flat; rupee at record low; gold, silver prices jump",https://www.livemint.com/market/stock-market-news/stock-market-today-live-sensex-today-nifty-today-us-fed-economic-survey-gold-price-silver-price-itc-tata-motors-paytm-11769654750745.html,2026-01-29 08:29:54 IST,"Stock Market Today LIVE: The trends on Gift Nifty signal a gap-down opening for Nifty 50 and Sensex today. Gift Nifty was trading around 25,374 level, a discount of nearly 76 points from the Nifty futures’ previous close, indicating a weak start for the Indian stock market indices.",https://www.livemint.com/rss/markets
Smallcap rout has created new dividend opportunities: 5 high payout stocks to watch,https://www.livemint.com/market/stock-market-news/smallcap-rout-has-created-new-dividend-opportunities-5-high-payout-stocks-to-watch-11769597465787.html,2026-01-29 08:00:45 IST,"After a brutal sell-off in smallcaps, a handful of fundamentally strong companies are still throwing off steady cash and high dividends, offering income-focused investors a rare opportunity.",https://www.livemint.com/rss/markets
"Stock market today: Trade guide for Nifty 50, gold, silver rates, US Fed meet to Economic Survey 2026 —  8 stocks to buy",https://www.livemint.com/market/stock-market-news/stock-market-today-trade-guide-for-nifty-50-gold-silver-rates-us-fed-meet-to-economic-survey-2026-8-stocks-to-buy-11769648490420.html,2026-01-29 07:55:03 IST,"Stock market today: Experts have recommended these eight stocks to buy today — Canara Bank, Jindal Steel, Paytm, Hindustan Petroleum, UPL, HBL Engineering, Rashtriya Chemicals and Fertilizers, and BHEL",https://www.livemint.com/rss/markets
"Stocks to watch: ITC, Tata Motors, Swiggy, L&amp;T, NSDL among 10 shares in focus today; full list inside",https://www.livemint.com/market/stock-market-news/stocks-to-watch-itc-tata-motors-swiggy-l-t-nsdl-among-10-shares-in-focus-today-full-list-inside-11769648348070.html,2026-01-29 07:51:57 IST,"Stock market today: Early trends from Gift Nifty indicated a negative start, with the index trading down 62 points, or 0.24%, to 25,364 on January 29.",https://www.livemint.com/rss/markets
"Gold, Silver Rate Today LIVE: Silver price tops  ₹4 lakh, gold price in India above  ₹1.75 lakh per 10 gm",https://www.livemint.com/market/commodities/gold-silver-rate-today-live-mcx-gold-price-today-mcx-silver-price-us-fed-donald-trump-tariffs-gold-etf-silver-etf-iran-11769652738813.html,2026-01-29 07:51:11 IST,"Gold, Silver Rate Today LIVE: Gold price has gained more than 27% this year following a 64% jump in 2025, while silver price has jumped more than 60% so far this year. The rally in bullion prices has been driven by strong safe‑haven demand, firm central bank buying and a weaker dollar.",https://www.livemint.com/rss/markets
"Gold, silver rates today: Spot gold price hits $5,500 mark, silver price climbs to a new peak",https://www.livemint.com/market/commodities/gold-silver-rates-today-spot-gold-price-hits-5-500-mark-silver-price-climbs-to-a-new-peak-11769649122967.html,2026-01-29 07:21:43 IST,"Gold, silver rates today: Gold was trading 2.1% higher at $5,511.79 an ounce, after touching a fresh all-time high of $5,591.61 earlier in the session.",https://www.livemint.com/rss/markets
"Nifty 50, Sensex today: What to expect from Indian stock market in trade on January 29 ahead of the Economic Survey 2026",https://www.livemint.com/market/stock-market-news/nifty-50-sensex-today-what-to-expect-from-indian-stock-market-in-trade-on-january-29-ahead-of-the-economic-survey-2026-11769623876802.html,2026-01-29 07:21:26 IST,"Nifty 50, Sensex today: The trends on Gift Nifty also indicate a weak start for the Indian benchmark index. The Gift Nifty was trading around 25,365 level, a discount of nearly 86 points from the Nifty futures’ previous close.",https://www.livemint.com/rss/markets
Meta to nearly double its investment in AI in 2026 as Mark Zuckerberg looks to build a ‘personal superintelligence’,https://www.livemint.com/companies/news/meta-to-nearly-double-its-investment-in-ai-in-2026-as-mark-zuckerberg-looks-to-build-a-personal-superintelligence-11769655820981.html,2026-01-29 08:39:40 IST,"In its Q4 earnings report released on Wednesday, Meta revealed that its capital expenditure on AI for 2026 would be between $115 and $135 billion, almost twice the amount spent last year when the company revamped its AI unit.",https://www.livemint.com/rss/companies
Capex vs refinancing: What Budget 2026 must do to revive private investment,https://economictimes.indiatimes.com/markets/stocks/news/capex-vs-refinancing-what-budget-2026-must-do-to-revive-private-investment/articleshow/127757308.cms,2026-01-29 10:53:56 IST,"The Union Budget FY27 pivots to a debt-anchoring framework, aiming for fiscal consolidation amidst slowing domestic consumption.  With fading tax buoyancy, the government will increasingly rely on non-tax revenues and expenditure compression.  Capex is normalizing, with a shift towards off-budget spending and state-led initiatives.",https://economictimes.indiatimes.com/markets/stocks/rssfeeds/2146843.cms
Explained: Why Hindustan Zinc shares are down 2% despite silver prices soaring to Rs 4 lakh,https://economictimes.indiatimes.com/markets/stocks/news/explained-why-hindustan-zinc-shares-are-down-2-despite-silver-prices-soaring-to-rs-4-lakh/articleshow/127756661.cms,2026-01-29 10:37:35 IST,"Hindustan Zinc shares have fallen about 2% over the last two sessions despite silver prices hitting a record Rs 4 lakh, reflecting a disconnect between the commodity rally and the stock. The decline is not due to fundamentals but is driven by short-term supply pressure from promoter Vedanta’s ongoing OFS, which has added fresh shares to the market through a base sale and a greenshoe option.",https://economictimes.indiatimes.com/markets/stocks/rssfeeds/2146843.cms
