title,link,published,summary,source
Adisoft Technologies shares list at 19% premium over IPO price on NSE SME  platform,https://economictimes.indiatimes.com/markets/stocks/news/adisoft-technologies-shares-to-list-today-heres-what-gmp-suggests/articleshow/130621882.cms,2026-04-30 08:36:34 IST,"Adisoft Technologies shares opened strong on D-Street, listing at a 19% premium. The company's Rs 74 crore IPO was subscribed over 77 times. Adisoft provides digital automation solutions for manufacturers. IPO funds will support a new facility and debt repayment. Financials show profit growth but volatile revenue. The company aims to scale operations in the growing automation sector.",https://economictimes.indiatimes.com/markets/stocks/rssfeeds/2146843.cms
Valuation reset drives mutual fund inflows into listed new-age firms amid FPI selloff,https://economictimes.indiatimes.com/markets/stocks/news/valuation-reset-drives-mutual-fund-inflows-into-listed-new-age-firms-amid-fpi-selloff/articleshow/130622556.cms,2026-04-30 06:00:00 IST,"Mutual funds increased their stakes in new-age companies during the March quarter, despite falling share prices and overall portfolio value declines. This move by domestic institutional investors comes as foreign investors divest Indian equities, with funds showing confidence in listed peers' long-term business models and execution.",https://economictimes.indiatimes.com/markets/stocks/rssfeeds/2146843.cms
56% YTD return! Healthcare stock retraces after showing resilience against stock market crash. Should you buy?,https://www.livemint.com/market/stock-market-news/55-ytd-return-healthcare-stock-park-medi-world-shows-resilience-against-stock-market-crash-11777524831656.html,2026-04-30 11:19:42 IST,Park Medi Worls share price has remained positive despite weak market sentiments. Here's what brokerages and experts say on the healthcare stock.,https://www.livemint.com/rss/markets
"Bitcoin prices fall below $76,000 after hawkish US Fed policy. Where are crypto prices headed?",https://www.livemint.com/market/cryptocurrency/bitcoin-prices-fall-below-76-000-after-hawkish-us-fed-policy-where-are-crypto-prices-headed-11777526902504.html,2026-04-30 11:19:06 IST,"Bitcoin traded below $76,000, down 2.18% after the Fed's interest rate decision. Ethereum fell 3.81%. Market caution persists as Bitcoin consolidates between $75,500 and $76,500, with April gains nearing 12%. Experts suggest a gradual investment approach amid ongoing macro uncertainties.",https://www.livemint.com/rss/markets
Rise in temperatures fires up Coal India shares. Will renewables spoil the party?,https://www.livemint.com/market/mark-to-market/coal-india-share-price-coal-india-q4fy26-earnings-renewable-energy-india-11777524238237.html,2026-04-30 11:01:05 IST,"Coal India shares rose 7%, hitting a 52-week high of  ₹491.25, after robust March quarter performance and also driven by the recent rise in temperatures.",https://www.livemint.com/rss/markets
"Waaree Energies share price tanks over 10% after Q4 results 2026, dividend announcement - here's why?",https://www.livemint.com/market/stock-market-news/waaree-energies-share-price-tanks-over-10-after-q4-results-2026-dividend-announcement-heres-why-11777524881038.html,2026-04-30 10:47:02 IST,"Waaree Energies reported strong operational performance in FY26 with EBITDA surpassing guidance. While FY27 outlook is positive, margin pressures remain a concern. The company is investing heavily in expansion, but recent earnings results led to a sharp decline in stock price.",https://www.livemint.com/rss/markets
"HUL Q4 results: Net profit rises 21% YoY to  ₹2,994 crore, announces final dividend of  ₹22 per share",https://www.livemint.com/market/stock-market-news/hul-q4-results-net-profit-rises-41-to-15-059-crore-announces-final-dividend-of-22-per-share-11777525551246.html,2026-04-30 10:43:58 IST,"HUL Q4 results 2026: HUL reported a consolidated net profit of  ₹2,994 crore for Q4FY26, up 21% YoY. Revenue from the sale of products during the quarter was  ₹16,172 crore, up 8.1% from  ₹14,955 crore in the same quarter last year.",https://www.livemint.com/rss/markets
Small-cap stock under  ₹50 jumps despite weak trends on Dalal Street,https://www.livemint.com/market/stock-market-news/smallcap-stock-under-rs-50-jumps-despite-weak-trends-on-dalal-street-11777523663492.html,2026-04-30 10:32:10 IST,"Elitecon International shares rose nearly 1% on April 30 amid market weakness. The company appointed Kumar Anubhav Upadhyay as Executive Additional Director and announced a significant expansion plan for its FMCG vertical, aiming to invest  ₹700 crore and expand its distribution network.",https://www.livemint.com/rss/markets
Demand at Japan’s Two-Year Note Sale Jumps to Highest Since 2024,https://www.livemint.com/market/demand-at-japan-s-two-year-note-sale-jumps-to-highest-since-2024-11777524894369.html,2026-04-30 10:24:54 IST,"Japan’s two-year government bond auction on Thursday drew the strongest demand since August 2024, supported by higher yields and expectations that the Bank of Japan may not rush into further interest rate hikes.",https://www.livemint.com/rss/markets
"Gold, silver prices today: Check retail rates of 24K, 22K gold, 999 silver on 30 April in Delhi, Mumbai, Pune, others",https://www.livemint.com/market/commodities/gold-silver-prices-today-check-retail-rates-of-24k-22k-gold-999-silver-on-30-april-in-delhi-mumbai-pune-others-11777520292336.html,2026-04-30 10:08:37 IST,"Gold prices on the MCX rose on 30 April after the US Fed held rates steady for the third consecutive policy, keeping the federal funds rate at 3.5%–3.75%. Check the latest 24K and 22K gold rates and 999 silver prices across major Indian cities, including Delhi, Mumbai and Hyderabad.",https://www.livemint.com/rss/markets
"Indians ditch jewellery for gold ETFs, bars as prices soar, says WGC: How the gold market is undergoing a radical shift?",https://www.livemint.com/market/commodities/indians-ditch-gold-jewellery-for-gold-etfs-bars-as-gold-prices-soar-wgc-report-how-india-s-gold-market-is-changing-11777520747170.html,2026-04-30 10:08:30 IST,"India's gold market shifted dramatically in Q1 2026, with jewellery demand dropping 19% as buyers turned to investment options like bars and coins due to high prices. Investment demand surged 52%, now surpassing jewellery consumption for the first time.",https://www.livemint.com/rss/markets
"Crude oil prices continue to rise, brent above $121/bbl amid ongoing US-Iran talks uncertainty",https://www.livemint.com/market/commodities/crude-oil-prices-continue-to-rise-brent-above-121-bbl-amid-ongoing-us-iran-talks-uncertainty-11777519961964.html,2026-04-30 10:07:46 IST,"Brent crude futures for June climbed to $122 a barrel, following a 6.1% jump in the previous session. Here's factors driving crude oil prices, along with near-term outlook.",https://www.livemint.com/rss/markets
"Stocks to buy or sell: Osho Krishan of Angel One suggests buying Chennai Petroleum Corp, Bharti Airtel shares to buy",https://www.livemint.com/market/stock-market-news/stocks-to-buy-or-sell-osho-krishan-of-angel-one-suggests-buying-chennai-petroleum-corp-bharti-airtel-shares-to-buy-11777522637744.html,2026-04-30 10:02:42 IST,"Nifty 50 and Sensex began April 30 negatively, influenced by soaring oil prices. The Nifty fell 1.16% and Sensex 1.17%, with all sectors losing ground. Analysts recommend buying Chennai Petroleum and Bharti Airtel, highlighting positive technical indicators for these stocks.",https://www.livemint.com/rss/markets
"Sensex plunges 1,100 points, investors lose  ₹9 lakh crore: 5 Key factors behind stock market crash explained",https://www.livemint.com/market/stock-market-news/sensex-plunges-1-000-points-investors-lose-5-lakh-crore-nifty-50-5-key-factors-behind-stock-market-crash-explained-11777521833697.html,2026-04-30 09:39:29 IST,"The 30-share pack Sensex plunged nearly 1,150 points, or 1.5%, to an intraday low of 76,349, while the NSE counterpart Nifty 50 crashed more than 350 points, or 1.6%, to the day's low of 23,801.",https://www.livemint.com/rss/markets
"Bajaj Finance share price jumps 4% after strong Q4 results. Should you buy, sell or hold?",https://www.livemint.com/market/stock-market-news/bajaj-finance-share-price-jumps-4-after-strong-q4-results-should-you-buy-sell-or-hold-11777521036901.html,2026-04-30 09:28:02 IST,"Bajaj Finance share price jumped over 4.11% to  ₹969.95 apiece on NSE in Thursday's trading session after the company posted strong financial results for the quarter ending on March 31, 2026.",https://www.livemint.com/rss/markets
Vedanta demerger: Did the Anil Agarwal-led stock really crash 65% today? Here's what happened,https://www.livemint.com/market/stock-market-news/vedanta-demerger-did-the-anil-agarwal-led-stock-really-crash-59-today-heres-what-happened-11777518366084.html,2026-04-30 09:24:51 IST,"Vedanta's share price appeared to have fallen 65% on April 30 due to a demerger adjustment. Moreover, the company reported record profits, with Q4FY26 PAT at  ₹9,352 crore, up 89% YoY. The demerger will create five independently listed entities.",https://www.livemint.com/rss/markets
"Rupee depreciates 0.2% to open at 95.02 against US dollar amid surge in crude oil prices, hawkish US Fed",https://www.livemint.com/market/stock-market-news/rupee-depreciates-0-2-to-open-at-95-02-against-us-dollar-amid-surge-in-crude-oil-prices-hawkish-us-fed-11777520481554.html,2026-04-30 09:12:00 IST,"The rupee fell 0.2% to 95.02 against the dollar due to Federal Reserve signals and rising oil prices. It faces its third weekly drop, influenced by increased import bills and capital outflows, with analysts noting the impact of both oil and monetary policy on the currency.",https://www.livemint.com/rss/markets
Silver price today: White metal rebounds to  ₹2.35 lakh/kg as dollar falls after Federal Reserve rate decision,https://www.livemint.com/market/commodities/gold-silver-price-today-white-metal-rebounds-rs-2-35-lk-kg-as-dollar-falls-after-federal-reserve-interest-rate-decision-11777517019248.html,2026-04-30 09:11:17 IST,"Silver prices in India recovered on Thursday after reaching a one-month low, supported by a weaker U.S. dollar. However, high crude oil prices raise inflation concerns, impacting interest rates. MCX silver rose 1% to  ₹2,35,102 per kg, while gold prices remained stable.",https://www.livemint.com/rss/markets
Gold rate up on MCX after US Fed hold rates steady; a sharp jump in crude oil prices raises inflation fears,https://www.livemint.com/market/commodities/gold-price-today-rate-up-on-mcx-after-us-fed-hold-rates-steady-a-sharp-jump-in-crude-oil-prices-raises-inflation-fears-11777519253505.html,2026-04-30 09:04:51 IST,Gold rate climbed on MCX on Thursday morning after the US Fed held rates steady. The US Federal Reserve on 29 April kept the federal funds rate unchanged for the third consecutive policy at 3.5%–3.75%.,https://www.livemint.com/rss/markets
HFCL is attracting strong investor interest. Where is the stock headed?,https://www.livemint.com/market/stock-market-news/hfcl-share-price-target-optical-fibre-cable-supplier-india-11777461744861.html,2026-04-30 09:00:57 IST,"The stock of HFCL has surged more than 50% in a month. The question now is, will the rally sustain?",https://www.livemint.com/rss/markets
"Stock market today: Gift Nifty hints weak start; US-Iran war, US Fed rate to oil, gold rates — 8 stocks to buy or sell",https://www.livemint.com/market/stock-market-news/stock-market-today-30-april-2026-gift-nifty-live-us-iran-war-us-fed-rate-to-oil-price-gold-rates-stocks-to-buy-or-sell-11777514536166.html,2026-04-30 08:39:52 IST,"Stock market today: Experts recommend these eight stocks to buy today — Cochin Shipyard, J&amp;amp;K Bank, ICICI Bank, HAL, ONGC, Mazagon Dock Shipbuilders, HBL Engineering, and Hero MotoCorp",https://www.livemint.com/rss/markets
"OnEMI Technology Solutions IPO Day 1: Issue booked 2% today so far. Check GMP, review, key details. Apply or skip?",https://www.livemint.com/market/ipo/onemi-technology-solutions-ipo-gmp-today-onemi-technology-solutions-ipo-onemi-technology-solutions-ipo-good-or-bad-11777516620886.html,2026-04-30 08:29:50 IST,"OnEMI Technology Solutions IPO opens for subscription from April 30 to May 5 at  ₹162-171, aiming to raise  ₹926 crore. The digital lending platform Kissht has over 53 million users and recently secured  ₹278 crore from anchor investors.",https://www.livemint.com/rss/markets
Q4 results 2026: HUL to Adani Enterprises among companies to declare Q4 results today; check full list here,https://www.livemint.com/market/stock-market-news/q4-results-2026-hul-to-adani-enterprises-among-companies-to-declare-q4-results-today-check-full-list-here-11777514768739.html,2026-04-30 08:15:31 IST,"Q4 results 2026: More than 70 companies will release their Q4 earnings on Thursday, 30 April. Here's a complete list of firms to declare Q4 results today.",https://www.livemint.com/rss/markets
Buying a term insurance plan? Here are key things to know before you decide,https://www.livemint.com/money/personal-finance/buying-a-term-insurance-plan-here-are-key-things-to-know-before-you-decide-11777518607825.html,2026-04-30 11:07:03 IST,"A term insurance plan covers life for a fixed period and pays out to nominees upon death. Key considerations include insurer credibility, sum assured and essential add-ons.&amp;nbsp;",https://www.livemint.com/rss/money
Market noise is rising. Here’s how to protect your money now,https://www.livemint.com/money/personal-finance/market-noise-rising-protect-money-now-emergency-funds-sip-11777462668991.html,2026-04-30 10:44:04 IST,"From emergency funds and SIP discipline to loans and asset allocation, top advisors lay out a practical playbook for navigating volatility and job uncertainty.",https://www.livemint.com/rss/money
InvITs: the middle path between equity risk and debt stability,https://www.livemint.com/money/personal-finance/invits-india-infrastructure-investment-trusts-equity-debt-investment-11777485305377.html,2026-04-30 09:59:43 IST,"Allocation to InvITs in your portfolio can be a good diversification avenue. Apart from mild price appreciation, it provides a hedge against inflation.",https://www.livemint.com/rss/money
"Is pension taxable in India? Rules, exemptions and how to declare it in ITR",https://www.livemint.com/money/personal-finance/is-pension-taxable-in-india-rules-exemptions-and-how-to-declare-it-in-itr-11777513017966.html,2026-04-30 08:48:23 IST,"Pension income in India is taxable based on type. Regular pensions are taxed as salary, while commuted pensions can be partially exempt. Full details here.",https://www.livemint.com/rss/money
"Multibaggers: 13 stocks surge up to 190% in a year, do you own any?",https://economictimes.indiatimes.com/markets/stocks/news/multibaggers-13-stocks-surge-up-to-190-in-a-year-do-you-own-any/slideshow/130626910.cms,2026-04-30 12:51:11 IST,"Despite a falling Sensex, several BSE 500 stocks delivered multibagger returns up to 190%. Many saw increased FII interest, highlighting strong sectoral opportunities and selective wealth creation amid broader market underperformance.",https://economictimes.indiatimes.com/markets/stocks/rssfeeds/2146843.cms
Syngene shares zoom 17% even as firm’s Q4 net profit drops 19% YoY. What's driving the surge?,https://economictimes.indiatimes.com/markets/stocks/news/syngene-shares-zoom-17-even-as-firms-q4-net-profit-drops-19-yoy-whats-driving-the-surge/articleshow/130626685.cms,2026-04-30 12:49:43 IST,"Syngene shares surged despite a 19% YoY decline in Q4FY26 net profit to Rs 148 crore, as earnings rebounded sharply from Rs 15 crore in the previous quarter. The results included a Rs 20 crore gratuity credit and a Rs 25 crore exceptional loss from employee termination benefits, alongside management changes.",https://economictimes.indiatimes.com/markets/stocks/rssfeeds/2146843.cms
"HUL shares drop over 4% despite Q4 topping Street estimates; profit jumps 21% YoY to Rs 2,464 crore",https://economictimes.indiatimes.com/markets/stocks/news/hul-shares-drop-over-4-despite-q4-topping-street-estimates-profit-jumps-21-yoy-to-rs-2464-crore/articleshow/130625778.cms,2026-04-30 12:08:56 IST,"Hindustan Unilever shares fell up to 4.4% despite a strong Q4, with net profit rising 21.4% YoY to Rs 2,992 crore. Revenue grew 7.6% to Rs 16,351 crore, while EBITDA rose 3.2% to Rs 3,877 crore, improving margins to 23.7%. Home Care led segmental growth, delivering its best performance in 11 quarters, driven by strong Fabric Wash demand.",https://economictimes.indiatimes.com/markets/stocks/rssfeeds/2146843.cms
Force Motors shares slip 6% as Q4 profit falls 36% YoY to Rs 279 crore,https://economictimes.indiatimes.com/markets/stocks/news/force-motors-shares-slip-6-as-q4-profit-falls-36-yoy-to-rs-279-crore/articleshow/130625195.cms,2026-04-30 11:47:32 IST,"Force Motors shares dropped 5.66% after reporting a 36% year-on-year decline in Q4FY26 net profit to Rs 278.5 crore, despite an 8.2% rise in revenue. Higher costs impacted profitability. However, full-year profit surged 51% to Rs 1,211.6 crore, and the board recommended a Rs 50 dividend.",https://economictimes.indiatimes.com/markets/stocks/rssfeeds/2146843.cms
Meesho shares jump 10% as JP Morgan initiates coverage with Rs 215 target price,https://economictimes.indiatimes.com/markets/stocks/news/meesho-shares-jump-10-as-jp-morgan-initiates-coverage-with-rs-215-target-price/articleshow/130624739.cms,2026-04-30 11:30:06 IST,"Meesho shares surged nearly 10% after JP Morgan initiated coverage with an 'Overweight' rating and a Rs 215 price target. The brokerage highlighted Meesho's potential for significant EBITDA margin expansion and strong net merchandise value growth, driven by advertising monetization and improved logistics. JP Morgan forecasts substantial free cash flow recovery and anticipates market leadership to continue.",https://economictimes.indiatimes.com/markets/stocks/rssfeeds/2146843.cms
Kissht operator OnEMI Tech mobilises  ₹278 cr from anchor investors; IPO to open on April 30,https://www.livemint.com/market/ipo/kissht-operator-onemi-tech-mobilises-278-cr-from-anchor-investors-ipo-to-open-on-apr-30-11777536198643.html,2026-04-30 13:36:36 IST,"OnEMI Technology Solutions Ltd has raised  ₹278 crore from anchor investors for its IPO, set to open on April 30. Details here.",https://www.livemint.com/rss/markets
Up 110% in 3 months! Multibagger defence stock MTAR Technologies share price hits record high— What’s driving the surge?,https://www.livemint.com/market/stock-market-news/up-110-in-3-months-multibagger-defence-stock-mtar-technologies-share-price-hits-record-high-what-s-driving-the-surge-11777533574426.html,2026-04-30 13:08:09 IST,"MTAR Technologies has secured orders exceeding  ₹380 crore for FY26 and FY27, showcasing solid near-term visibility. Its stock surged over 9%, marking a 348% increase from its 52-week low, driven by its pivotal role in clean energy and AI infrastructure sectors.",https://www.livemint.com/rss/markets
"Market cap-to-GDP nears 2007 peak: expensive valuations, but not a bubble yet",https://www.livemint.com/market/stock-market-news/india-market-cap-gdp-ratio-2007-peak-valuations-bubble-sensex-nifty-11777522747595.html,2026-04-30 13:04:25 IST,"India’s market cap-to-GDP ratio is nearing its 2007–08 bull run peak, raising concerns of stretched valuations. However, experts downplay these fears",https://www.livemint.com/rss/markets
Higher Oil Prices May Spur Quicker Yield Gains in Emerging Asia,https://www.livemint.com/market/higher-oil-prices-may-spur-quicker-yield-gains-in-emerging-asia-11777533334720.html,2026-04-30 12:45:34 IST,"Higher-for-longer oil prices threaten a faster rise in emerging Asian bond yields, if history is any guide — a risk market watchers say isn’t yet fully priced in.",https://www.livemint.com/rss/markets
Adisoft Technologies share price rises 5% after strong listing on NSE. Do you own?,https://www.livemint.com/market/stock-market-news/adisoft-technologies-share-price-rises-5-after-strong-listing-on-nse-do-you-own-11777530914063.html,2026-04-30 12:44:51 IST,Adisoft Technologies share price jumped 5% after making strong listing in the Indian stock market. Here's SME IPO listing and IPO details.,https://www.livemint.com/rss/markets
FPI outflows near  ₹1.9 lakh crore in 2026; Can global AI stock correction turn the tide?,https://www.livemint.com/market/stock-market-news/fpi-outflows-near-rs-1-9-lakh-crore-in-2026-can-global-ai-stock-correction-turn-the-tide-11777530473197.html,2026-04-30 12:29:18 IST,"In 2026, foreign portfolio investors have withdrawn  ₹1.89 lakh crore from Indian equities due to global uncertainties and a shift towards AI stocks in the US, South Korea, and Taiwan. This trend reflects a risk-off sentiment rather than weak domestic fundamentals.",https://www.livemint.com/rss/markets
"Vodafone Idea, Suzlon, Meesho, JP Power among the most traded stocks today, 30 April 2026",https://www.livemint.com/market/stock-market-news/vodafone-idea-suzlon-meesho-jp-power-among-the-most-traded-stocks-today-30-april-2026-11777528965880.html,2026-04-30 12:10:59 IST,"Most traded stocks today: Vodafone Idea, Suzlon Energy, Meesho, Jaiprakash Power Ventures (JP Power), HFCL, Adani Power, and Vedanta were the most active stocks, or the most active stocks in terms of volume, on the NSE.",https://www.livemint.com/rss/markets
"Stocks to buy: Nagaraj Shetti recommends Time Technoplast, Gujarat Ambuja Exports shares to buy",https://www.livemint.com/market/stock-market-news/stocks-to-buy-nagaraj-shetti-recommends-time-technoplast-gujarat-ambuja-exports-shares-to-buy-11777528414947.html,2026-04-30 11:38:22 IST,"The Indian stock market experienced a significant selloff on April 30, with the Sensex dropping over 1,150 points and Nifty 50 falling more than 350 points. Investors lost nearly  ₹9 lakh crore as market capitalization decreased amid rising oil prices and the rupee's decline.",https://www.livemint.com/rss/markets
"Bajaj Auto board to consider share buyback with Q4 results, dividend on May 6; stock gains",https://www.livemint.com/market/stock-market-news/bajaj-auto-board-to-consider-share-buyback-with-q4-results-dividend-on-may-6-stock-gains-11777528263531.html,2026-04-30 11:26:57 IST,"Bajaj Auto share price has gained 11% in one month, and has risen just 2% on a year-to-date (YTD) basis. The auto stock has rallied 9% in six months and has surged 22% in one year. Bajaj Auto shares have delivered multibagger returns of 120% in three years and 155% in five years.",https://www.livemint.com/rss/markets
"Pocket FM revives funding talks, seeks to raise around $120 million",https://www.livemint.com/companies/news/pocket-fm-fundraise-talks-audio-entertainment-platform-india-ai-11777519441949.html,2026-04-30 13:38:46 IST,"This marks a second attempt by Pocket FM, which had explored fundraising about nine months ago but failed to close the round amid investor concerns over backing a loss-making business.",https://www.livemint.com/rss/companies
Amazon Now’s India orders growing 25% every month: CEO Andy Jassy,https://www.livemint.com/companies/news/amazon-now-amazon-prime-india-ceo-andy-jassy-quick-commerce-11777531511884.html,2026-04-30 13:22:28 IST,"Amazon’s Prime members are tripling their shopping frequency once they start using it, CEO Andy Jassy said",https://www.livemint.com/rss/companies
"HUL bets on price hikes, cost cuts to counter Mideast-led pressures",https://www.livemint.com/companies/hul-bets-on-price-hikes-cost-cuts-to-counter-mideast-led-pressures-11777532583550.html,2026-04-30 12:34:31 IST,"Revenue climbed 7% to 155.99 billion rupees, supported by its mainstay home-care business - home to brands such as Comfort and Vim - whose revenue increased 9%.",https://www.livemint.com/rss/companies
"From  ₹10 LPA to  ₹30 LPA in 2 years: I asked ChatGPT how to upgrade my job, salary; check personal finance advice from AI",https://www.livemint.com/money/personal-finance/from-10-lpa-to-30-lpa-in-2-years-i-asked-chatgpt-how-to-upgrade-my-job-salary-check-personal-finance-advice-from-ai-11777536063827.html,2026-04-30 13:41:03 IST,A Bengaluru IT consultant aims to upgrade from  ₹10 LPA to  ₹30 LPA in 1-2 years. ChatGPT suggests four paths. Check out.,https://www.livemint.com/rss/money
Beyond long-only: The rise of adaptive equity investing through SIFs,https://www.livemint.com/money/personal-finance/beyond-long-only-the-rise-of-adaptive-equity-investing-through-sifs-11777535571006.html,2026-04-30 13:31:43 IST,"As markets grow increasingly volatile, specialised investment funds (SIFs) offer a dynamic approach to equity investing by combining long and short positions.&amp;nbsp;",https://www.livemint.com/rss/money
"SCSS monthly income guide: See how investments of  ₹10 lakh,  ₹20 lakh and  ₹30 lakh can earn safely in retirement",https://www.livemint.com/money/personal-finance/scss-monthly-income-guide-what-10-lakh-20-lakh-and-30-lakh-investments-can-earn-safely-in-retirement-11777530080977.html,2026-04-30 12:43:33 IST,You can secure a steady retirement income with the Senior Citizen Savings Scheme (SCSS) as investments of  ₹10 to  ₹30 lakh generate predictable monthly returns.,https://www.livemint.com/rss/money
ITR Filing 2026: Why NBFC and HFC interest income must be reported separately and what it means for taxpayers,https://www.livemint.com/money/personal-finance/itr-filing-2026-why-nbfc-and-hfc-interest-income-must-be-reported-separately-and-what-it-means-for-taxpayers-11777527549647.html,2026-04-30 12:31:20 IST,"The Income Tax Department has revised ITR forms for AY 2026-27, requiring separate reporting of interest income from NBFCs, HFCs and corporate instruments under Schedule OS. Details here.",https://www.livemint.com/rss/money
