title,link,published,summary,source
"Dividend alert! Last day to buy Bajaj Finance, Bajaj Finserv, another Bajaj Group stock for dividends worth Rs 138",https://economictimes.indiatimes.com/markets/stocks/news/dividend-alert-last-day-to-buy-bajaj-finance-bajaj-finserv-another-bajaj-group-stock-for-dividends-worth-rs-138/articleshow/132127154.cms,2026-07-02 07:40:01 IST,"Under SEBI's T+1 settlement cycle, investors must purchase a company's shares at least one trading day before the record date to ensure the shares are credited to their demat accounts in time, and they become eligible for the corporate action.",https://economictimes.indiatimes.com/markets/stocks/rssfeeds/2146843.cms
Positive Breakout: These 9 stocks cross above their 200 DMAs,https://economictimes.indiatimes.com/markets/stocks/news/positive-breakout-these-9-stocks-cross-above-their-200-dmas/slideshow/132127136.cms,2026-07-02 07:30:45 IST,"As long as the stock is priced above the 200-day SMA on the daily timeframe, it is generally considered to be in an overall uptrend.",https://economictimes.indiatimes.com/markets/stocks/rssfeeds/2146843.cms
CSM Technologies shares to list today. Check GMP ahead of debut,https://economictimes.indiatimes.com/markets/stocks/news/csm-technologies-shares-to-list-today-check-gmp-ahead-of-debut/articleshow/132127020.cms,2026-07-02 07:24:32 IST,"The public issue, which was open for subscription between June 24 and June 29, was subscribed 1.37 times overall. The retail investor portion was booked 1.63 times, while the qualified institutional buyers (QIB) category saw 1.02 times subscription and the non-institutional investor (NII) segment was subscribed 1.54 times. The employee quota was subscribed 1.82 times.",https://economictimes.indiatimes.com/markets/stocks/rssfeeds/2146843.cms
From deep correction to fresh peaks: 10 stocks soar from 52-week lows to new highs in just three months,https://economictimes.indiatimes.com/markets/stocks/news/from-deep-correction-to-fresh-peaks-10-stocks-soar-from-52-week-lows-to-new-highs-in-just-three-months/articleshow/132126853.cms,2026-07-02 06:39:37 IST,"Several large-cap Indian companies have seen their stock prices surge from 52-week lows to highs within just three months. This impressive rally, yielding returns of 22-65%, is attributed to strong March quarter results, optimistic FY27 forecasts, and strategic moves like fundraising. Despite this momentum, many of these stocks remain undervalued compared to their historical valuation multiples, suggesting potential for further growth.",https://economictimes.indiatimes.com/markets/stocks/rssfeeds/2146843.cms
Prudential HCL Health Insurance gets IRDAI nod,https://economictimes.indiatimes.com/markets/stocks/news/prudential-hcl-health-insurance-gets-irdai-nod/articleshow/132126831.cms,2026-07-02 06:30:14 IST,"India's health insurance sector welcomes a new player as Prudential HCL Health Insurance receives regulatory approval. This joint venture, backed by Prudential Group Holdings and HCL Group, aims to tap into the growing demand for medical cover. The approval also signals broader regulatory changes, including new accounting standards and a policyholder protection fund. Prudential's presence in India is significantly expanding with this new health insurance arm.",https://economictimes.indiatimes.com/markets/stocks/rssfeeds/2146843.cms
"Adani Energy plans Rs 10,000-crore QIP fundraise",https://economictimes.indiatimes.com/markets/stocks/news/adani-energy-plans-rs-10000-crore-qip-fundraise/articleshow/132126813.cms,2026-07-02 06:23:59 IST,"Adani Energy Solutions has received board approval to raise a substantial ₹10,000 crore through a qualified institutional placement. This move follows their recent agreement to acquire IntelliSmart Infrastructure for ₹3,050 crore. Shareholders will vote on the issuance at an extraordinary general meeting on July 25. The company's stock saw a positive response, closing 2% higher on the BSE.",https://economictimes.indiatimes.com/markets/stocks/rssfeeds/2146843.cms
D-St set for a positive opening as GIFT Nifty signals firm start,https://economictimes.indiatimes.com/markets/stocks/news/pre-market-action-heres-the-trade-setup-for-todays-session/articleshow/132120108.cms,2026-07-02 06:11:00 IST,"Indian equities closed higher Wednesday, ending a two-day slump. The market remains range-bound, with traders anticipating a clear direction. Analysts suggest a bullish outlook persists above 23,800, eyeing a potential rise to 24,200. Meanwhile, market volatility eased, and foreign investors were net sellers, while domestic institutions bought shares.",https://economictimes.indiatimes.com/markets/stocks/rssfeeds/2146843.cms
"Stocks in news: Hero MotoCorp, Canara Bank, Bharti Airtel, Indian Hotels, SBI",https://economictimes.indiatimes.com/markets/stocks/news/stocks-in-news-hero-motocorp-canara-bank-bharti-airtel-indian-hotels-sbi/articleshow/132120012.cms,2026-07-02 06:11:00 IST,"Indian markets opened positively, with analysts suggesting a stock-specific strategy amidst consolidation. Hero MotoCorp sees a revival in commuter bike demand, planning capacity expansion. Canara Bank and Indian Bank reported strong credit growth. Bharti Airtel's NBFC arm has begun operations, while Indian Hotels plans significant capital expenditure. SBI launched AI-powered innovations, and BPCL is acquiring a stake in a Brazilian oil venture.",https://economictimes.indiatimes.com/markets/stocks/rssfeeds/2146843.cms
Upstox's erroneous a/c freeze mail sparks client panic,https://economictimes.indiatimes.com/markets/stocks/news/upstoxs-erroneous-a/c-freeze-mail-sparks-client-panic/articleshow/132126638.cms,2026-07-02 05:34:56 IST,"Panic erupted among Upstox clients on Wednesday after an erroneous email incorrectly stated their trading accounts were frozen, with some reporting losses from hasty exits. The brokerage admitted to an ""inadvertent error,"" issuing a follow-up to disregard the initial message and apologizing for confusion. Upstox assured clients their funds and securities remain secure, attributing the incident to a potential human mistake.",https://economictimes.indiatimes.com/markets/stocks/rssfeeds/2146843.cms
KPIT outlook shock sends IT stocks sliding as growth worries intensify,https://economictimes.indiatimes.com/markets/stocks/news/kpit-outlook-shock-sends-it-stocks-sliding-as-growth-worries-intensify/articleshow/132126618.cms,2026-07-02 05:31:00 IST,"Mid-cap IT stocks faced a significant downturn Wednesday, led by KPIT Technologies' warning of a near-term revenue slowdown. This has amplified investor worries about Artificial Intelligence's impact on India's software services sector. Several other IT firms also saw their share prices drop, with the Nifty IT index emerging as the day's biggest loser. Analysts suggest sustained recovery hinges on improving demand and AI's offsetting capabilities.",https://economictimes.indiatimes.com/markets/stocks/rssfeeds/2146843.cms
"Adani, IHC plan to forge $11.5 billion aluminium unit",https://economictimes.indiatimes.com/markets/stocks/news/adani-ihc-plan-to-forge-11-5-billion-aluminium-unit/articleshow/132126794.cms,2026-07-02 05:30:00 IST,"Adani Group and Abu Dhabi's International Holding Company are set to invest a massive $11.5 billion in a new Odisha aluminium plant. This ambitious project, aiming for over 2 million tonnes annual capacity, could significantly boost India's aluminium production by nearly 50%.",https://economictimes.indiatimes.com/markets/stocks/rssfeeds/2146843.cms
Stock Radar: Prestige Estates stock breaks out from inverted head &amp; shoulder pattern; time to buy?,https://economictimes.indiatimes.com/markets/stocks/news/stock-radar-prestige-estates-stock-breaks-out-from-inverted-head-shoulder-pattern-time-to-buy/articleshow/132112806.cms,2026-07-02 05:00:00 IST,"Prestige Estates Projects Ltd. stock is showing strong bullish signals, breaking out of a key chart pattern. Experts suggest this could lead to a significant rise, with potential targets above Rs 1,700 in the coming weeks. The stock has demonstrated a robust recovery, reclaiming crucial moving averages and confirming a trend reversal, indicating a positive outlook for investors.",https://economictimes.indiatimes.com/markets/stocks/rssfeeds/2146843.cms
PSBs raise term deposit rates to reclaim deposit market share,https://economictimes.indiatimes.com/markets/stocks/news/psbs-raise-term-deposit-rates-to-reclaim-deposite-market-share/articleshow/132126733.cms,2026-07-02 01:49:38 IST,"Public sector banks are boosting term deposit rates to reclaim lost market share, a move that contrasts with private banks lowering theirs. Facing a decade of decline, PSBs are prioritizing liabilities to compete, especially as credit growth outpaces deposit mobilization. This strategic shift aims to regain ground, even if it impacts short-term profits, highlighting a competitive necessity in the current banking landscape.",https://economictimes.indiatimes.com/markets/stocks/rssfeeds/2146843.cms
Corporate loan demand outpaces retail credit as firms shift from bonds to banks,https://economictimes.indiatimes.com/markets/stocks/news/corporate-loans-outpace-retail/articleshow/132126721.cms,2026-07-02 01:46:24 IST,"Corporate sector borrowing from banks is accelerating past individual loans, driven by companies seeking cost savings as corporate bond yields climb. Recent RBI rate cuts have made bank loans more appealing. Analysts anticipate this trend to continue, supported by improved liquidity, though a shift back to debt markets is possible. Small businesses are seeing particularly strong bank credit growth.",https://economictimes.indiatimes.com/markets/stocks/rssfeeds/2146843.cms
Zee board backs promoter stake expansion to 24%,https://economictimes.indiatimes.com/markets/stocks/news/zee-board-backs-promoter-stake-expansion-to-24/articleshow/132126805.cms,2026-07-02 00:44:36 IST,"Zee Entertainment's board has greenlit a significant fundraising move, approving the issuance of warrants worth up to ₹3,143.5 crore to a promoter group entity, Sunbright Mauritius Investments. This strategic move, pending shareholder and regulatory nods, could substantially boost the promoter group's stake to nearly 24%. The warrants, priced at ₹126 each, require an upfront payment of 25%, with the balance due upon conversion within 18 months.",https://economictimes.indiatimes.com/markets/stocks/rssfeeds/2146843.cms
"Canara Bank, Indian Bank credit growth outpaces deposits",https://economictimes.indiatimes.com/markets/stocks/news/canara-bank-indian-bank-credit-growth-outpaces-deposits/articleshow/132126841.cms,2026-07-01 21:36:31 IST,"Leading public sector banks, including Canara Bank and Indian Bank, are experiencing a sustained trend where their loan disbursements are expanding at a quicker pace than customer deposits. Canara Bank saw its advances surge by 18%, while Indian Bank reported a 13.9% rise in credit. This robust credit expansion, particularly in retail, agriculture, and MSME sectors, signals a dynamic lending environment for these financial institutions.",https://economictimes.indiatimes.com/markets/stocks/rssfeeds/2146843.cms
Bharti Airtel's NBFC arm begins commercial operation,https://economictimes.indiatimes.com/markets/stocks/news/bharti-airtels-nbfc-arm-begins-commercial-operation/articleshow/132126738.cms,2026-07-01 21:06:48 IST,"Bharti Airtel's non-banking financial arm, Airtel Money, has officially begun its commercial operations after securing a license from the Reserve Bank of India. The company, registered as a Type II Non-Deposit accepting NBFC, plans to be capitalized with Rs 20,000 crore over the coming years, with Bharti Airtel contributing 70% and the promoter group the remaining 30%.",https://economictimes.indiatimes.com/markets/stocks/rssfeeds/2146843.cms
"Stocks to watch: Bharti Airtel, Indian Bank, BPCL among shares in focus today; check list here",https://www.livemint.com/market/stock-market-news/stocks-to-watch-bharti-airtel-indian-bank-bpcl-among-shares-in-focus-today-check-list-here-11782958105449.html,2026-07-02 08:03:53 IST,"Stock market today: Gift Nifty was trading near the 24,187.5 mark, down over 95 points from the previous close of Nifty futures.",https://www.livemint.com/rss/markets
Vaishali Parekh recommends three intraday stocks to buy or sell on Thursday — 2 July 2026,https://www.livemint.com/market/stock-market-news/vaishali-parekh-recommends-three-intraday-stocks-to-buy-or-sell-on-thursday-2-july-2026-11782957447100.html,2026-07-02 07:53:34 IST,"Buy or sell stocks, 2 July 2026: Vaishali Parekh recommends three stocks to buy today — Mazagon Dock Shipbuilders, GMDC, and EID Parry",https://www.livemint.com/rss/markets
"Stock market today: Gift Nifty hints flat-to-positive start; eight day trading stocks to buy on Thursday, 2 July",https://www.livemint.com/market/stock-market-news/stock-market-today-gift-nifty-hints-flat-to-positive-start-us-iran-talks-global-markets-to-oil-prices-8-stocks-to-buy-11782953755858.html,2026-07-02 07:36:56 IST,"The Indian stock market shows a flat start with Gift Nifty trading at 24,180.5, an 88-point premium. Sensex and Nifty 50 rebounded on 1 July, ending a two-day decline as easing crude oil prices boosted market sentiment amid ongoing US-Iran diplomatic talks.",https://www.livemint.com/rss/markets
"Asian stocks today: South Korea's Kospi falls 5%, Japan's Nikkei 225 plunges 2% over AI concerns",https://www.livemint.com/market/stock-market-news/asian-stocks-today-south-koreas-kospi-falls-5-japans-nikkei-225-plunges-2-over-ai-concerns-11782957091774.html,2026-07-02 07:36:01 IST,"Asian stocks today: South Korea's Kospi plunged 5.36% at the open, prompting the Korea Exchange to impose a five-minute trading halt.",https://www.livemint.com/rss/markets
"From Gift Nifty to semiconductor stocks, gold rate: 9 key things that changed for Indian stock market overnight",https://www.livemint.com/market/stock-market-news/from-gift-nifty-to-semiconductor-stocks-gold-rate-9-key-things-that-changed-for-indian-stock-market-overnight-11782953496968.html,2026-07-02 07:02:45 IST,"Gift Nifty was trading around 24,187.5 level, a premium of nearly 95 points from the Nifty futures’ previous close, indicating a mildly positive start for the Indian stock market indices.",https://www.livemint.com/rss/markets
"Nifty 50, Sensex prediction today: Check how Indian stock market is expected to trade on 2 July",https://www.livemint.com/market/stock-market-news/nifty-50-sensex-prediction-today-check-how-indian-stock-market-is-expected-to-trade-on-2-july-11782919725328.html,2026-07-02 06:45:25 IST,"The trends on Gift Nifty indicate a positive start for the Indian benchmark index. The Gift Nifty was trading around 24,187.5 level, a premium of nearly 95 points from the Nifty futures’ previous close.",https://www.livemint.com/rss/markets
Raja Venkatraman recommends three stocks for 2 July,https://www.livemint.com/market/stock-market-news/raja-venkatraman-recommends-three-stocks-for-2-july-11782953010716.html,2026-07-02 06:30:24 IST,Market expert Raja Venkatraman shares his top stock picks for 2 July. Here’s his technical outlook and trade strategy.,https://www.livemint.com/rss/markets
Breakout stocks to buy or sell: Sumeet Bagadia recommends five shares to buy today - 2 July 2026,https://www.livemint.com/market/stock-market-news/breakout-stocks-to-buy-or-sell-sumeet-bagadia-recommends-five-shares-to-buy-today-2-july-2026-11782952303420.html,2026-07-02 06:19:52 IST,The Indian stock market ended Wednesday's session on a higher note. Sumeet Bagadia of Choice Broking recommends five breakout stocks to buy today.,https://www.livemint.com/rss/markets
Stock recommendations for 2 July from MarketSmith India,https://www.livemint.com/market/stock-market-news/stock-recommendations-for-2-july-from-marketsmith-india-11782920710313.html,2026-07-02 06:00:44 IST,"MarketSmith India reveals its top stock recommendations for today, 2 July. Get expert insights into the best-performing stocks to guide your investment decisions.",https://www.livemint.com/rss/markets
Top five defence stocks to watch out for the next decade,https://www.livemint.com/market/stock-market-news/best-indian-defence-stocks-to-watch-bel-grse-mdl-solar-industries-krishna-defence-11782903612696.html,2026-07-02 06:00:44 IST,"These defence companies are sitting on record order books, and their financials have grown at the fastest pace in many years. Can they deliver on execution?",https://www.livemint.com/rss/markets
"Regulatory cloud lifts, Vedanta readies Bokaro capacity doubling",https://www.livemint.com/companies/vedanta-iron-steel-vedanta-anil-agarwal-bokaro-steel-plant-steel-capacity-expansion-esl-steel-bokaro-11782919317947.html,2026-07-02 08:15:26 IST,"The project was delayed by pending statutory approvals, including environmental clearances and consent-related approvals from regulators",https://www.livemint.com/rss/companies
Age Care Labs raises  ₹85 crore to scale senior care services,https://www.livemint.com/companies/news/amid-silver-economy-demand-boost-age-care-labs-eyes-platform-expansion-11782907704213.html,2026-07-02 06:02:44 IST,"The startup already runs two brands - Emoha, an app-based at-home care service for seniors, and Epoch, which provides assisted living and specialized eldercare services, including dementia care, palliative care, recovery and rehabilitation, and long-term care.",https://www.livemint.com/rss/companies
New KPI on the block: Indian companies from banking to consulting start appraising leaders on AI implementation,https://www.livemint.com/companies/news/new-kpi-ai-adoption-performance-appraisals-pwc-india-axis-bank-bell-curve-model-top-management-11782895145276.html,2026-07-02 06:01:04 IST,"India Inc is stitching AI adoption into senior leadership performance appraisals. Companies like Axis Bank now demand measurable AI outcomes, signaling a shift from experimentation to accountability-driven AI integration.",https://www.livemint.com/rss/companies
"All eyes on OMCs' petrol, diesel prices as Nayara cuts fuel rates",https://www.livemint.com/companies/all-eyes-on-omc-petrol-diesel-prices-after-nayara-cuts-fuel-rates-atf-commercial-lpg-turn-cheaper-11782914659827.html,2026-07-02 05:50:43 IST,"OMCs raised petrol and diesel prices for the first time on 15 May, after holding on during the first two months of the war. Over four separate days, petrol and diesel prices were cumulatively raised by around  ₹7.5 per litre.",https://www.livemint.com/rss/companies
"TVS's  ₹2,000-crore Norton gamble is set for the market test",https://www.livemint.com/companies/news/tvs-norton-losses-2000-crore-premium-motorcycle-brand-revival-market-test-11782872699846.html,2026-07-02 05:30:03 IST,"TVS has spent nearly one-fifth of its  ₹9,993 crore profit earned between 2020-21 and 2025-26 covering losses at its British premium motorcycle brand, Norton.",https://www.livemint.com/rss/companies
ITR filing 2026: Do taxpayers need to file two ITRs? The tax department answers,https://www.livemint.com/money/personal-finance/itr-filing-2026-do-taxpayers-need-to-file-two-itrs-the-tax-department-answers-11782275718585.html,2026-07-02 07:51:53 IST,The shift from Assessment Year to Tax Year has sparked questions about return filing obligations. A clarification from the Income Tax Department explains why taxpayers won't need to file two ITRs for the same income.,https://www.livemint.com/rss/money
8th Pay Commission: Key lessons from 7th Pay Commission that could influence salaries,https://www.livemint.com/money/personal-finance/8th-pay-commission-key-lessons-from-7th-pay-commission-that-could-influence-salaries-11782951980219.html,2026-07-02 07:11:55 IST,The 8th Pay Commission may reshape government salaries by taking key lessons from the 7th Pay Commission.,https://www.livemint.com/rss/money
When should young investors pivot from aggressive bets to capital preservation for retirement?,https://www.livemint.com/money/personal-finance/when-should-young-investors-pivot-from-aggressive-bets-to-capital-preservation-for-retirement-11782884181677.html,2026-07-02 05:53:24 IST,"During the accumulation stage, investors will have access to regular income and a long investment horizon, allowing them to take advantage of the potential for growth in assets such as equities.",https://www.livemint.com/rss/money
Alibaba-affiliate Ant Group rushes into humanoid robots with a dozen deals in 18 months,https://www.cnbc.com/2026/07/01/alibaba-affiliate-ant-group-enters-the-humanoid-robot-market-with-12-deals.html,2026-07-02 06:30:01 IST,"Ant has led a 500 million yuan ($73.59 million) funding round in humanoid robotics company Zeroth, the start-up announced Thursday.",https://www.cnbc.com/id/10000664/device/rss/rss.html
June auto sales data: Commercial vehicle turns consensus player; brokerages list stocks to buy,https://economictimes.indiatimes.com/markets/stocks/news/june-auto-sales-data-commercial-vehicle-turns-consensus-player-brokerages-list-stocks-to-buy/articleshow/132130312.cms,2026-07-02 11:32:41 IST,"Indian automakers reported strong performance in June 2026, with healthy demand across passenger vehicles, two-wheelers, commercial vehicles and tractors. Brokerages including Motilal Oswal, Emkay and ICICI Securities highlighted broad-based growth, with several OEMs beating estimates. Maruti, M&amp;M, TVS and Tata Motors stood out, while Hyundai underperformed in PVs. Analysts remain optimistic on the sector, favouring CVs and select two-wheeler players amid improving demand and pricing conditions.",https://economictimes.indiatimes.com/markets/stocks/rssfeeds/2146843.cms
Vedanta Iron and Steel shares rocket 113% in 13 sessions since listing; market value more than doubles,https://economictimes.indiatimes.com/markets/stocks/news/vedanta-iron-and-steel-shares-rocket-113-in-13-sessions-since-listing-market-value-more-than-doubles/articleshow/132129896.cms,2026-07-02 11:05:20 IST,"Vedanta Iron and Steel shares have surged more than 100% in just 13 trading sessions since listing at Rs 20 on the NSE following Vedanta's mega demerger. The company, one of four new Vedanta entities to debut on June 15, has delivered stellar gains to investors after starting with a market capitalisation of Rs 7,821 crore.",https://economictimes.indiatimes.com/markets/stocks/rssfeeds/2146843.cms
Tamilnad Mercantile Bank shares surge 5% after strong Q1FY27 business update,https://economictimes.indiatimes.com/markets/stocks/news/tamilnad-mercantile-bank-shares-surge-5-after-strong-q1fy27-business-update/articleshow/132129770.cms,2026-07-02 10:54:10 IST,"Tamilnad Mercantile Bank shares rose sharply on Thursday after the lender reported strong Q1FY27 business growth. Total business rose 23% year-on-year, driven by a 27% jump in advances and nearly 20% growth in deposits. Rising institutional ownership and a bullish technical setup further supported investor sentiment toward the stock.",https://economictimes.indiatimes.com/markets/stocks/rssfeeds/2146843.cms
India's private credit market doubles to $25 billion AUM in five years: Report,https://economictimes.indiatimes.com/markets/stocks/news/indias-private-credit-market-doubles-to-25-billion-aum-in-five-years-report/articleshow/132129712.cms,2026-07-02 10:51:19 IST,"India's private credit market is booming, nearly doubling to $25 billion in assets under management over five years, fueled by strong business demand.  The Insolvency and Bankruptcy Code has boosted lender confidence, enabling financing for stressed firms.  Real estate and infrastructure sectors are key beneficiaries.  While global investors are increasing their participation, potential liquidity risks loom, as highlighted by past crises.  Despite challenges, significant growth is anticipated.",https://economictimes.indiatimes.com/markets/stocks/rssfeeds/2146843.cms
F&amp;O Radar: Call Ratio Spread strategy for AU Small Finance Bank this week,https://economictimes.indiatimes.com/markets/stocks/news/fo-radar-call-ratio-spread-strategy-for-au-small-finance-bank-this-week/articleshow/132129595.cms,2026-07-02 10:44:55 IST,"AU Small Finance Bank is showing robust bullish momentum, consistently trading higher and finding support at its 20-Day EMA. The stock is comfortably positioned above key moving averages, indicating sustained buyer control.",https://economictimes.indiatimes.com/markets/stocks/rssfeeds/2146843.cms
India's textile stocks become market standouts on trade deals,https://economictimes.indiatimes.com/markets/stocks/news/indias-textile-stocks-become-market-standouts-on-trade-deals/articleshow/132129389.cms,2026-07-02 10:35:50 IST,"Indian textile exporters are experiencing a significant stock market surge, outperforming the broader market. New trade deals with the UK, EU, and potential US agreements are boosting competitiveness. Global brands shifting sourcing away from China are also creating opportunities. Investors are optimistic about Indian firms capturing substantial market share, with some analysts predicting further gains contingent on capacity expansion and sustained earnings growth.",https://economictimes.indiatimes.com/markets/stocks/rssfeeds/2146843.cms
TVS Motor rises 3% on record quarterly sales of 16.31 lakh units,https://economictimes.indiatimes.com/markets/stocks/news/tvs-motor-rises-3-on-record-quarterly-sales-of-16-31-lakh-units/articleshow/132129309.cms,2026-07-02 10:26:51 IST,"TVS Motor shares rose on Thursday after the company reported record quarterly sales of 16.31 lakh units in Q1 FY2026-27, driven by strong domestic demand, exports, and electric-vehicle sales. June sales surged 47% year-on-year, while the stock continued to show positive long-term momentum despite neutral technical indicators.",https://economictimes.indiatimes.com/markets/stocks/rssfeeds/2146843.cms
