title,link,published,summary,source
"Dividend alert! Last day to buy Axis Bank, BSE and 28 other stocks for payouts worth nearly Rs 187 per share. Do you own any?",https://economictimes.indiatimes.com/markets/stocks/news/dividend-alert-last-day-to-buy-axis-bank-bse-and-28-other-stocks-for-payouts-worth-nearly-rs-187-per-share-do-you-own-any/articleshow/132258229.cms,2026-07-09 07:46:58 IST,"Under SEBI's T+1 settlement cycle, investors must purchase a company's shares at least one trading day before the record date to ensure the shares are credited to their demat accounts in time, and they become eligible for the corporate action. Therefore, today is the last opportunity for investors to buy the shares so that they are credited to their accounts by Friday, making them eligible for the dividends.",https://economictimes.indiatimes.com/markets/stocks/rssfeeds/2146843.cms
Negative Breakout: These 9 stocks cross below their 200 DMAs,https://economictimes.indiatimes.com/markets/stocks/news/negative-breakout-these-9-stocks-cross-below-their-200-dmas/slideshow/132275258.cms,2026-07-09 07:36:30 IST,Traders use the 200 DMA as a key indicator to determine the overall trend in a particular stock. Take a look:,https://economictimes.indiatimes.com/markets/stocks/rssfeeds/2146843.cms
D-St set for a positive opening as GIFT Nifty signals firm start,https://economictimes.indiatimes.com/markets/stocks/news/pre-market-action-heres-the-trade-setup-for-todays-session/articleshow/132274908.cms,2026-07-09 06:38:51 IST,"Indian markets experienced widespread selling on Wednesday, with the Nifty declining significantly. Global risk sentiment deteriorated following US President Donald Trump's comments on Iran. Asian markets also traded lower, reflecting the weak global backdrop. The Indian Rupee tanked against the US dollar as oil prices rose. Foreign and domestic investors showed net buying activity in equities.",https://economictimes.indiatimes.com/markets/stocks/rssfeeds/2146843.cms
"Stocks in news: TCS, Nalco, Maruti Suzuki, Natco Pharma, HFCL",https://economictimes.indiatimes.com/markets/stocks/news/stocks-in-news-tcs-nalco-maruti-suzuki-natco-pharma-hfcl/articleshow/132274884.cms,2026-07-09 06:34:29 IST,"Indian markets saw a significant decline on Wednesday, influenced by global factors. TCS anticipates modest profit growth amid client spending caution and wage pressures. Nalco and NLC India will form a joint venture for a power plant. HFCL plans substantial investment to boost optical fibre cable production capacity. Natco Pharma announced significant investments and stake increases in South Africa.",https://economictimes.indiatimes.com/markets/stocks/rssfeeds/2146843.cms
Domestic prop trading firms face higher funding costs under RBI's new rules,https://economictimes.indiatimes.com/markets/stocks/news/domestic-prop-trading-firms-face-higher-funding-costs-under-rbis-new-rules/articleshow/132274853.cms,2026-07-09 06:24:34 IST,"New Reserve Bank of India lending rules increase funding costs for local proprietary traders.  These changes require 100% collateral for bank guarantees, impacting domestic firms significantly.  Foreign trading majors, however, can access cheaper overseas funding sources.  This situation may allow foreign firms to capture a larger domestic market share.  Domestic traders face a disadvantage compared to their well-capitalized international competitors.",https://economictimes.indiatimes.com/markets/stocks/rssfeeds/2146843.cms
"Rupee, stocks reel as Trump signals end of Iran truce",https://economictimes.indiatimes.com/markets/stocks/news/rupee-stocks-reel-as-trump-signals-end-of-iran-truce/articleshow/132274839.cms,2026-07-09 06:18:14 IST,"Indian stocks and the rupee experienced a significant decline on Wednesday. This market downturn followed fresh US strikes on Iran and rising oil prices. The country's volatility index surged, reflecting increased trader risk perception. Bond yields climbed the most in over three months, while the rupee ended as the continent's worst performer. Analysts suggest market reactions to geopolitical events are often short-lived.",https://economictimes.indiatimes.com/markets/stocks/rssfeeds/2146843.cms
"These mid-cap stocks with ‘Strong Buy’ &amp; ‘Buy’ recos can rally over 25%, according to analysts",https://economictimes.indiatimes.com/markets/stocks/news/these-mid-cap-stocks-with-strong-buy-buy-recos-can-rally-over-25-according-to-analysts/articleshow/132274773.cms,2026-07-09 05:57:16 IST,"In the stock market, everything has to be seen in context. Look at how the market was disappointed because crude oil prices inched up and crossed $78 on Wednesday. Now, think back to the last time the price was at this level. The markets had reacted positively – because it was on its way down. So, same price, but different expectations on the street.",https://economictimes.indiatimes.com/markets/stocks/rssfeeds/2146843.cms
Demat account additions pick up on D-Street rebound,https://economictimes.indiatimes.com/markets/stocks/news/demat-account-additions-pick-up-on-d-street-rebound/articleshow/132274735.cms,2026-07-09 05:36:07 IST,"India added over 2.5 million demat accounts in June, the highest since February. This growth occurred as key market indices Nifty 50 and Sensex advanced significantly. Improved market sentiment followed the easing of geopolitical concerns and potential IPO announcements. Broader market participation and digital onboarding are attracting new retail investors. Future demat account growth will depend on Indian market performance and investor confidence.",https://economictimes.indiatimes.com/markets/stocks/rssfeeds/2146843.cms
Private banks may lead PSU peers in Q1 PAT show amid macro pressures,https://economictimes.indiatimes.com/markets/stocks/news/private-banks-may-lead-psu-peers-in-q1-pat-show-amid-macro-pressures/articleshow/132274774.cms,2026-07-09 01:02:37 IST,"Private banks are expected to show stronger profit growth than public sector banks this quarter. Analysts predict private lenders' profits will climb ten percent year-on-year. Balance sheet growth also favors private banks, with higher deposit expansion. However, public sector banks led in loan book expansion during the June quarter. Investor focus will remain on individual bank performance and execution.",https://economictimes.indiatimes.com/markets/stocks/rssfeeds/2146843.cms
Axis Bank loses three senior executives amid leadership reshuffle,https://economictimes.indiatimes.com/markets/stocks/news/axis-bank-loses-three-senior-executives-amid-leadership-reshuffle/articleshow/132274767.cms,2026-07-09 01:00:16 IST,"Axis Bank has seen three senior executives resign from their positions. These departures add to a significant reshuffling occurring within private sector lenders. Anil Agarwal and Vikas Shinde, long-serving executives, have left the bank. Jimmy Tavadia, group head of trading, also resigned from his role. These changes coincide with the lender reorganizing key corporate banking positions.",https://economictimes.indiatimes.com/markets/stocks/rssfeeds/2146843.cms
Private life insurers outpace LIC in new business premium growth,https://economictimes.indiatimes.com/markets/stocks/news/private-life-insurers-outpace-lic-in-new-business-premium-growth/articleshow/132274825.cms,2026-07-09 00:58:54 IST,"Life insurers saw a 16.6% rise in new business premium during the April-June quarter. Private sector firms expanded faster than LIC, driven by regular premium products. Regular premium collections grew nearly twenty percent year-on-year, while single premium business increased. SBI Life Insurance emerged as the fastest-growing player among listed companies. Private insurers continue gaining market share while LIC retains its dominant position.",https://economictimes.indiatimes.com/markets/stocks/rssfeeds/2146843.cms
Credit cards lose ground as small-ticket personal loans gain traction: CIBIL,https://economictimes.indiatimes.com/markets/stocks/news/credit-cards-lose-ground-as-small-ticket-personal-loans-gain-traction-cibil/articleshow/132274771.cms,2026-07-09 00:54:53 IST,"Credit cards now hold 38% of unsecured credit, down from 56% in 2016. Small personal loans under fifty thousand rupees have gained significant market share. Card balances remain stable at fifteen to sixteen percent of total consumption credit. Delinquency data shows risk spilling across various credit products. Occasional card users exhibit low delinquency rates across their credit portfolios.",https://economictimes.indiatimes.com/markets/stocks/rssfeeds/2146843.cms
FCNR-B flows taper as higher costs trip math for double-digit returns,https://economictimes.indiatimes.com/markets/stocks/news/fcnr-b-flows-taper-as-higher-costs-trip-math-for-double-digit-returns/articleshow/132274676.cms,2026-07-09 00:52:59 IST,"Indian banks are experiencing a slowdown in special foreign currency deposit collection. Rising overseas borrowing costs are impacting banks' leverage offerings to clients. High-net-worth individuals seek double-digit dollar returns, assessing tax implications. Banks are recalibrating deposit mobilization strategies after recent guideline releases. Investor expectations for higher spreads are increasing due to Indian supply.",https://economictimes.indiatimes.com/markets/stocks/rssfeeds/2146843.cms
RBI approves Mahesh M Pai as new MD at South Indian Bank,https://economictimes.indiatimes.com/markets/stocks/news/south-indian-bank-names-canara-banks-mahesh-pai-as-ceo/articleshow/132274778.cms,2026-07-08 20:46:41 IST,"Mahesh Muralidhar Pai will become South Indian Bank's new MD and CEO. The Reserve Bank of India approved his appointment, effective October 1. He brings three decades of banking experience across various key verticals. Pai previously led digital banking and innovation initiatives at Canara Bank. His appointment follows the conclusion of PR Seshadri's current term.",https://economictimes.indiatimes.com/markets/stocks/rssfeeds/2146843.cms
"Stocks to watch: Tata Steel, TCS, NALCO among shares in focus today; check list here",https://www.livemint.com/market/stock-market-news/stocks-to-watch-tata-steel-tcs-nalco-among-shares-in-focus-today-check-list-here-11783562061334.html,2026-07-09 07:57:16 IST,"Stock market today: Gift Nifty was trading near the 23,980 mark, down over 68 points from the previous close of Nifty futures.",https://www.livemint.com/rss/markets
"SBI Funds Management IPO: Price band set at  ₹545-574 per share; check key dates, issue details",https://www.livemint.com/market/ipo/sbi-funds-management-ipo-price-band-set-at-rs-545-574-per-share-check-key-dates-issue-details-11783561311861.html,2026-07-09 07:37:14 IST,"SBI Funds Management IPO price band is  ₹545 to  ₹574, with subscription from July 14-16. The offer for sale aims to raise  ₹11,102 crore, with significant allocations for institutional and retail investors.",https://www.livemint.com/rss/markets
"Nifty 50, Sensex prediction today: Check how Indian stock market is expected to trade on 9 July",https://www.livemint.com/market/stock-market-news/nifty-50-sensex-prediction-today-check-how-indian-stock-market-is-expected-to-trade-on-9-july-11783561641651.html,2026-07-09 07:27:33 IST,"Nifty 50, Sensex prediction today: The trends on Gift Nifty also indicate a positive start for the Indian benchmark index. The Gift Nifty was trading around 23,980 level, a premium of nearly 68 points from the Nifty futures’ previous close.",https://www.livemint.com/rss/markets
Crude oil prices extend gains on renewed US-Iran war tensions; Brent climbs above $78 per barrel,https://www.livemint.com/market/commodities/crude-oil-prices-extend-gains-on-renewed-us-iran-war-tensions-brent-climbs-above-78-per-barrel-11783560834001.html,2026-07-09 07:17:05 IST,"US-Iran war: Brent crude futures were up 78 cents, or 1%, at $78.80 a barrel, while US West Texas Intermediate (WTI) crude gained 74 cents, or 1.01%, to trade at $74.26 a barrel.",https://www.livemint.com/rss/markets
"From Gift Nifty, US-Iran war, oil prices to bond yields: 10 key things that changed for Indian stock market overnight",https://www.livemint.com/market/stock-market-news/from-gift-nifty-us-iran-war-oil-prices-to-bond-yields-10-key-things-that-changed-for-indian-stock-market-overnight-11783560749368.html,2026-07-09 07:09:14 IST,"Gift Nifty was trading around 23,990 level, a premium of nearly 78 points from the Nifty futures’ previous close, indicating a positive start for the Indian stock market indices.",https://www.livemint.com/rss/markets
"Asian stocks today: Kospi, Nikkei rally up to 3% led by semiconductor stocks despite US-Iran war tensions",https://www.livemint.com/market/stock-market-news/asian-stocks-today-kospi-nikkei-rally-up-to-3-led-by-semiconductor-stocks-despite-us-iran-war-tensions-11783559343489.html,2026-07-09 07:01:07 IST,"Asian stocks today: South Korea’s Kospi rebounded sharply after slipping into bear market territory in the previous session. Kospi jumped 3% at the open, and the small-cap Kosdaq advanced 1.28%.",https://www.livemint.com/rss/markets
Breakout stocks to buy or sell: Sumeet Bagadia recommends five shares to buy today - 9 July 2026,https://www.livemint.com/market/stock-market-news/breakout-stocks-to-buy-or-sell-sumeet-bagadia-recommends-five-shares-to-buy-today-9-july-2026-11783558083104.html,2026-07-09 06:34:46 IST,The Indian stock market ended Wednesday's session on a lower note. Sumeet Bagadia of Choice Broking recommends five breakout stocks to buy today.,https://www.livemint.com/rss/markets
Raja Venkatraman recommends three stocks for 9 July,https://www.livemint.com/market/stock-market-news/raja-venkatraman-stock-recommendation-9-july-nifty-sensex-oil-india-exide-industries-11783523696062.html,2026-07-09 06:00:45 IST,Market expert Raja Venkatraman shares his top stock picks for 9 July. Here’s his technical outlook and trade strategy.,https://www.livemint.com/rss/markets
Cloud consulting firm CloudThat eyes GIFT City's first-ever listing with $8 mn IPO,https://www.livemint.com/market/cloudthat-gift-city-ipo-dollar-listing-11783492382935.html,2026-07-09 06:00:25 IST,"CloudThat is set to file papers for an $8 million IPO in GIFT City, potentially becoming the exchange's first-ever listed company after XED's issue fell through.&amp;nbsp;",https://www.livemint.com/rss/markets
Stock recommendations for 9 July from MarketSmith India,https://www.livemint.com/market/stock-market-news/stock-recommendations-9-july-marketsmith-india-sensex-nifty-11783513485797.html,2026-07-09 06:00:25 IST,"MarketSmith India reveals its top stock recommendations for today, 9 July. Get expert insights into the best-performing stocks to guide your investment decisions.",https://www.livemint.com/rss/markets
Agratas filings reveal deeper role of Chinese-owned firm in Tata's EV battery push,https://www.livemint.com/companies/news/agratas-filings-reveal-deeper-role-of-chinese-owned-firm-in-tata-s-ev-battery-push-11783504100561.html,2026-07-09 06:01:05 IST,"Parallel filings show a twin technology and equity alliance, marking a growing trend of strategic collaborations between the Indian conglomerate and major Chinese EV infrastructure entities.",https://www.livemint.com/rss/companies
India's oldest chip fab revamp awaits a green light six months after partners picked,https://www.livemint.com/economy/indias-oldest-chip-fab-revamp-awaits-a-green-light-six-months-after-partners-picked-11783506296237.html,2026-07-09 06:00:25 IST,The revival of India’s oldest chip fabrication plant has yet to move forward despite the selection of private partners six months ago. The delay comes at a crucial time as the government is stepping up effort to build the country’s semiconductor ecosystem.,https://www.livemint.com/rss/companies
Corporate philanthropy faces a higher compliance burden,https://www.livemint.com/companies/news/fcra-amendment-rules-2026-csr-foreign-funding-ngos-compliance-11783490252223.html,2026-07-09 05:55:25 IST,"While the new foreign contribution regulations leave companies' CSR obligations unchanged, they significantly tighten compliance for companies undertaking foreign-funded philanthropic projects and engaging non-profits that receive foreign funding, say experts.",https://www.livemint.com/rss/companies
BlackSoil’s NBFC arm forays into solar financing through Creditfair acquisition,https://www.livemint.com/companies/blacksoil-group-credit-fair-solar-financing-rooftop-solar-renewable-energy-11783486809267.html,2026-07-09 05:00:24 IST,"BlackSoil has acquired Credit Fair's solar financing business for about  ₹45 crore, marking its entry into rooftop solar lending as it expands its retail and climate-focused loan portfolio.",https://www.livemint.com/rss/companies
"July 2026 DA hike: 3% increase most likely as June inflation data guides decision, says expert",https://www.livemint.com/money/personal-finance/july-2026-da-hike-3-increase-most-likely-as-june-inflation-data-guides-decision-says-expert-11783560129847.html,2026-07-09 07:20:26 IST,"3% Dearness Allowance hike for Central government staff and pensioners is a possibility in July 2026. The final DA revision hinges on June AICPI-IW inflation data, with the government's announcement expected after Cabinet approval and inflation review.",https://www.livemint.com/rss/money
