title,link,published,summary,source
Economic Survey 2026 outlines 3 global market risks. Could it be worse than 2008 global financial crisis?,https://www.livemint.com/market/stock-market-news/economic-survey-2026-outlines-3-global-market-risks-could-it-be-worse-than-2008-global-financial-crisis-11769675175934.html,2026-01-29 14:12:46 IST,"The Economic Survey 2026 highlights significant global economic vulnerabilities, predicting three scenarios for 2026, including possible crises worse than the 2008 financial collapse. However, it notes that India will remain better off than most other countries.",https://www.livemint.com/rss/markets
"L&amp;T’s confidence on order inflow comforts, but strong finish to FY26 hinges on execution",https://www.livemint.com/market/mark-to-market/larsen-toubro-l-t-order-inflow-fy26-execution-middle-east-11769672170508.html,2026-01-29 14:05:07 IST,"Strong infrastructure-led order inflows lift visibility and stock sentiment, but weak execution and Middle East exposure remain key risks as L&amp;amp;T chases revenue growth and margin stability.",https://www.livemint.com/rss/markets
Economic Survey 2026: Why Gold matters now more than ever for Indian economy?,https://www.livemint.com/market/commodities/economic-survey-2026-why-gold-matters-now-more-than-ever-for-indian-economy-11769674877486.html,2026-01-29 14:02:20 IST,"The Economic Survey notes gold's resurgence in India as a strategic asset amidst global instability, with prices rising sharply due to geopolitical tensions and a weaker dollar. This increase has influenced inflation dynamics and bolstered the country's foreign exchange reserves.",https://www.livemint.com/rss/markets
"Survey seeks insolvency revamp, simpler tax to boost corporate bond demand",https://www.livemint.com/market/bonds/economic-survey-corporate-bond-market-reforms-11769672353917.html,2026-01-29 14:00:20 IST,"The regulators have taken several measures over the years to deepen the corporate bond market, but coordinated and phased reforms are needed to further strengthen it and lower the cost of credit for Indian companies, the survey said.",https://www.livemint.com/rss/markets
"Market Wrap: Sensex adds 222 points, Nifty above 25,400 as D-St recovers from early dip",https://economictimes.indiatimes.com/markets/stocks/news/market-wrap-sensex-adds-222-points-nifty-above-25400-as-d-st-recovers-from-early-dip/articleshow/127771084.cms,2026-01-29 15:41:57 IST,"At the close, the Sensex was higher by 222 points, or 0.27%, to 82,566.37, and the Nifty gained 76 points, or 0.3%, to end at 25,418.90.",https://economictimes.indiatimes.com/markets/stocks/rssfeeds/2146843.cms
"FPIs flow remained volatile in FY26 on global uncertainty, capital shift towards AI-hubs: Eco Survey",https://economictimes.indiatimes.com/markets/stocks/news/fpis-flow-remained-volatile-in-fy26-on-global-uncertainty-capital-shift-towards-ai-hubs-eco-survey/articleshow/127770211.cms,2026-01-29 15:27:15 IST,"Foreign Portfolio Investment (FPI) flows in FY26 remained volatile, leading to a net outflow of USD 3.9 billion as of December 2025, driven by elevated uncertainty and increased capital allocation towards AI-centric markets such as the US, Taiwan, and Korea, the Economic Survey 2025-26 said on Thursday.",https://economictimes.indiatimes.com/markets/stocks/rssfeeds/2146843.cms
"European shares rise as miners, energy stocks lift sentiment",https://economictimes.indiatimes.com/markets/stocks/news/european-shares-rise-as-miners-energy-stocks-lift-sentiment/articleshow/127769555.cms,2026-01-29 15:14:05 IST,"European shares rebounded on Thursday, lifted by higher prices of oil and precious metals, shaking off the gloom from weaker luxury ‌earnings the ‌day before.",https://economictimes.indiatimes.com/markets/stocks/rssfeeds/2146843.cms
Weekly Top Picks: These stocks scored 10 on 10 on Stock Reports Plus,https://economictimes.indiatimes.com/markets/stocks/news/weekly-top-picks-these-stocks-scored-10-on-10-on-stock-reports-plus/articleshow/127769388.cms,2026-01-29 15:09:31 IST,"Stock Reports Plus, powered by Refinitiv, undertakes detailed company analysis for 4,000+ listed stocks. In addition to detailed company analyses, the report also collates analysts’ forecasts and trend analysis for each component. An average score in Stock Reports Plus is calculated by undertaking quantitative analysis of five key investment tools – earnings, fundamentals, relative valuation, risk, and price momentum.",https://economictimes.indiatimes.com/markets/stocks/rssfeeds/2146843.cms
"Swiggy Q3 Results: Net loss widens to  ₹1,065 crore, revenue surges 54%",https://www.livemint.com/market/stock-market-news/swiggy-q3-results-net-loss-widens-to-rs-1-065-crore-revenue-surges-54-11769682024908.html,2026-01-29 15:59:20 IST,"Swiggy reported a net loss of  ₹1,065 crore for September–December, up from  ₹800 crore last year, despite a 54% increase in consolidated revenue to  ₹6,148 crore.",https://www.livemint.com/rss/markets
"Top Gainers and Losers on Jan 29: Hindustan Copper, GMDC, ABB India, Oil India, Vedanta, Gravita India among top gainers",https://www.livemint.com/market/stock-market-news/top-gainers-and-losers-on-jan-29-hindustan-copper-gmdc-abb-india-oil-india-vedanta-gravita-india-among-top-gainers-11769681208748.html,2026-01-29 15:49:44 IST,"The Indian stock market saw volatility on January 29, yet key indices extended their gains, supported by a rally in metal and banking stocks. The Nifty 50 and Sensex increased by 0.25% and 0.26%, respectively, while healthcare and FMCG sectors struggled.",https://www.livemint.com/rss/markets
How may the US Fed meeting outcome impact the RBI MPC meeting next month? Explained,https://www.livemint.com/market/stock-market-news/how-may-the-us-fed-meeting-outcome-impact-the-rbi-mpc-meeting-next-month-explained-11769674057360.html,2026-01-29 15:40:21 IST,"According to experts, the Federal FOMC's decision to keep rates unchanged has important implications for global monetary policy, including India.",https://www.livemint.com/rss/markets
DIIs cushion Indian equities as FIIs stay net sellers: Economic Survey,https://www.livemint.com/market/stock-market-news/domestic-institutional-investors-economic-survey-indian-equities-11769678325641.html,2026-01-29 15:38:02 IST,"FIIs have been net sellers since July 2025, barring October and November. Even in January so far, FIIs have net sold Indian equities worth  ₹36,771.10 crore. Meanwhile, DIIs have been net buyers throughout 2025. In January so far, DIIs have purchased Indian shares worth  ₹67,183.01 crore.",https://www.livemint.com/rss/markets
"Sensex gains 222 points, Nifty 50 ends above 25,400— 10 key highlights from the Indian stock market today",https://www.livemint.com/market/stock-market-news/sensex-gains-222-points-nifty-50-ends-above-25-400-10-key-highlights-from-the-indian-stock-market-today-11769680914457.html,2026-01-29 15:35:56 IST,"The Sensex jumped 222 points, or 0.27%, to close at 82,566.37, while the Nifty 50 settled at 25,418.90, up 76 points, or 0.30%. Mid and small-cap segments, however, underperformed as the BSE 150 Midcap index inched up by 0.10%, while the BSE 250 Smallcap index slipped 0.19%.",https://www.livemint.com/rss/markets
Economic Survey views Sebi code as blueprint for regulatory reform,https://www.livemint.com/market/stock-market-news/economic-survey-views-sebi-code-as-blueprint-for-regulatory-reform-11769675666666.html,2026-01-29 15:33:30 IST,The Economic Survey said the Securities Markets Code could reshape governance across India’s regulatory architecture.,https://www.livemint.com/rss/markets
"Maruti margins look weak on paper, but per-car profitability holds up",https://www.livemint.com/market/mark-to-market/maruti-suzuki-gst-q3-results-operating-margins-auto-sector-india-steel-passenger-vehicles-11769678437737.html,2026-01-29 15:29:36 IST,"Margin compression appears sharper due to pricing and cost pass-through, but per-car profitability remains stable even as steel costs, export risks and valuation concerns weigh on sentiment.",https://www.livemint.com/rss/markets
Over 3900% in 5 years! Multibagger small-cap stock RDB Infra board sets meeting date to consider and approve NSE listing,https://www.livemint.com/market/stock-market-news/over-3900-in-5-years-multibagger-small-cap-stock-rdb-infra-board-sets-meeting-date-to-consider-and-approve-nse-listing-11769678983324.html,2026-01-29 15:27:15 IST,"RDB Infrastructure And Power's stock fluctuated on January 29, 2026, rising 4.5% to  ₹69.82 before dropping over 6%. The company will consider a direct NSE listing on February 3, 2026, following a 3900% rise in five years and recent strong returns.",https://www.livemint.com/rss/markets
"Economic Survey 2026:  ₹10.7 lakh crore raised through primary markets in FY26,  ₹1.6 lakh crore via mainboard IPOs",https://www.livemint.com/market/stock-market-news/economic-survey-2026-rs-10-7-lakh-crore-raised-through-primary-markets-in-fy26-rs-1-6-lakh-crore-via-mainboard-ipos-11769676170442.html,2026-01-29 15:26:20 IST,"Despite volatility in FY26, the Indian IPO market is thriving, attracting diverse companies and strong investor interest. The Economic Survey highlights a significant rise in resource mobilization, with total amounts reaching  ₹10.7 lakh crore, showcasing India's role in global capital formation.",https://www.livemint.com/rss/markets
"Nokia chair Sari Baldauf to step down, Vice chair Timo Ihamuotil to succeed. Details here",https://www.livemint.com/companies/news/nokia-chair-sari-baldauf-to-step-down-vice-chair-timo-ihamuotil-to-succeed-details-here-11769678635061.html,2026-01-29 15:54:49 IST,"Nokia's chair Sari Baldauf is resigning, to be replaced by Timo Ihamuotila. The company is pushing into AI to counteract declining earnings, while shares dropped 6%. Baldauf has been a key figure at Nokia since the early 1980s.",https://www.livemint.com/rss/companies
Piramal Pharma points to early recovery signs after seeing red in Q3,https://www.livemint.com/companies/piramal-pharma-recovery-signs-q3-earnings-net-loss-guidance-11769673730084.html,2026-01-29 15:44:39 IST,"The company posted its results for the third quarter of FY26 late on Wednesday evening, with its revenue dipping 3% year-on-year to  ₹2,140 crore, and slipping to a loss of  ₹136 crore from a net profit of  ₹4 crore in Q3FY25. Its ebitda margin shrank from 16% in Q3FY25 to 11% this fiscal.",https://www.livemint.com/rss/companies
‘Easy money era’ after 2008 made Indian stock market very expensive: CEA Nageswaran,https://economictimes.indiatimes.com/markets/stocks/news/easy-money-era-after-2008-made-indian-stock-market-very-expensive-cea-nageswaran/articleshow/127774259.cms,2026-01-29 16:41:17 IST,"India’s Chief Economic Adviser V Anantha Nageswaran on Thursday delivered a sharp warning on financial markets, saying years of ultra-loose monetary policy have resulted in stretched asset valuations, rising concentration risks, and a growing reliance on less regulated sources of capital.",https://economictimes.indiatimes.com/markets/stocks/rssfeeds/2146843.cms
"REC Q3 Results: Net profit flat at  ₹4,043 crore;  ₹4.6 interim dividend declared",https://www.livemint.com/market/stock-market-news/rec-q3-results-net-profit-flat-at-rs-4-043-crore-rs-4-6-interim-dividend-declared-11769683850799.html,2026-01-29 16:27:53 IST,"REC reported a standalone net profit of  ₹4,043.08 crore for Q3 FY26, a slight increase from  ₹4,029.09 crore in the previous year. The company declared a 46% interim dividend of  ₹4.60 per equity share, with the record date set for February 6, 2026.",https://www.livemint.com/rss/markets
"Vedanta Q3 Results: Anil Agarwal-led firm's profit jumps 61% YoY to  ₹5,710 crore, revenue hits  ₹23,369 crore",https://www.livemint.com/market/stock-market-news/vedanta-q3-results-anil-agarwal-led-firms-profit-jumps-61-yoy-revenue-hits-rs-23-369-crore-details-here-11769682963611.html,2026-01-29 16:18:30 IST,"Vedanta Q3 results: Vedanta Ltd, led by Anil Agarwal, reported a 61% increase in Q3 profit to  ₹5,710 crore, up from  ₹3,547 crore last year. Revenue from operations reached  ₹23,369 crore for the October to December quarter.",https://www.livemint.com/rss/markets
Large caps currently have a bigger margin of safety than mid or small caps: SBI Mutual Fund's Anup Upadhyay,https://www.livemint.com/money/personal-finance/sbi-flexi-cap-fund-sbi-mutual-fund-11769667954894.html,2026-01-29 16:22:49 IST,"Anup Upadhyay, fund manager at SBI Mutual Fund, said about 70% of the SBI Flexi Cap Fund is now in large caps, up from 55% a year ago. In an interview with Mint, he also spoke about his outlook for the market, sectoral bets, and structural changes in the SBI Flexi Cap Fund.",https://www.livemint.com/rss/money
Hindustan Zinc OFS sees strong retail subscription of 2.3 times on Day 2,https://economictimes.indiatimes.com/markets/stocks/news/hindustan-zinc-ofs-sees-strong-retail-subscription-of-2-3-times-on-day-2/articleshow/127776447.cms,2026-01-29 17:56:42 IST,"Hindustan Zinc’s OFS drew strong interest, with the retail portion subscribed 2.3 times on Day 2 as investors bid for 1.10 crore shares against 47.58 lakh on offer. This followed a robust 142% non-retail subscription on Day 1, underscoring solid demand at the Rs 685 floor price despite the stock trading higher.",https://economictimes.indiatimes.com/markets/stocks/rssfeeds/2146843.cms
Hindustan Zinc stock hits fresh 52-week high in January 2026; will the rally continue?,https://economictimes.indiatimes.com/markets/stocks/news/hindustan-zinc-stock-hits-fresh-52-week-high-in-january-2026-will-the-rally-continue/articleshow/127697932.cms,2026-01-29 17:00:00 IST,"Hindustan Zinc has hit a fresh 52-week high after breaking out of a four-week consolidation. Technical indicators remain bullish, with experts suggesting buying on dips while cautioning that overbought levels could trigger short-term pullbacks.",https://economictimes.indiatimes.com/markets/stocks/rssfeeds/2146843.cms
Chemical stock jumps over 4% from today's low following stock market rebound. Do you own?,https://www.livemint.com/market/stock-market-news/chemical-stock-jumps-over-3-from-todays-low-following-stock-market-rebound-do-you-own-11769687953372.html,2026-01-29 18:08:41 IST,"Sudarshan Pharma shares surged nearly 4% to  ₹20.25 after reporting Q3FY26 revenue of  ₹158.37 crore, a 37% YoY increase. Net profit rose 56% to  ₹43.05 crore. Despite a 27.40% drop in January, the stock shows a strong long-term gain of 165%.",https://www.livemint.com/rss/markets
Economic Survey 2026 sees silver lining in rupee weakness amid 50% Trump tariffs,https://www.livemint.com/market/stock-market-news/economic-survey-2026-sees-silver-lining-in-rupee-weakness-amid-50-trump-tariffs-11769687472360.html,2026-01-29 17:28:21 IST,The Indian rupee breached the 92 per US dollar mark earlier today and settled the day near an all-time low at 91.96 as persistent selloff by foreign portfolio investors (FPIs) and risk-off sentiment weighed on the domestic unit.,https://www.livemint.com/rss/markets
"Gold, silver ETFs may soon rival top equity funds in assets on sharp rally",https://www.livemint.com/market/commodities/gold-silver-etfs-may-soon-rival-top-equity-funds-in-assets-on-sharp-rally-11769684052914.html,2026-01-29 16:55:01 IST,"Top gold, silver ETFs' AUM vault to  ₹2.77 lakh crore.",https://www.livemint.com/rss/markets
"Tata Motors Q3 Results: Net profit declines 48% to  ₹705 crore, revenue improves 16.2%",https://www.livemint.com/market/stock-market-news/tata-motors-q3-results-net-profit-declines-48-to-rs-705-crore-revenue-improves-162-11769685272311.html,2026-01-29 16:54:33 IST,"Tata Motors Commercial Vehicles reported a 48% drop in Q3 net profit to  ₹705 crore, impacted by exceptional items totaling  ₹1,600 crore. However, revenue rose 16.23% to  ₹21,732 crore, with a 41% YoY jump in EBITDA, and a strong outlook for Q4 demand.",https://www.livemint.com/rss/markets
"Boeing unfazed by India-EU FTA, says maintenance cost unlikely to decline soon",https://www.livemint.com/companies/news/india-eu-fta-aircraft-maintenance-costs-boeing-airbus-impact-11769678557701.html,2026-01-29 17:42:50 IST,"Despite the India-EU FTA eliminating tariffs on aircraft parts, Boeing remains skeptical about significant cost reductions for maintenance in India. Airbus might see marginal advantages, but the focus remains on increasing aircraft deliveries to meet growing demand in the Indian market.",https://www.livemint.com/rss/companies
"Budget &amp; the Stock Market: Don’t confuse this number with the deficit, it is a delivery mechanism that holds a message for the markets",https://economictimes.indiatimes.com/markets/stocks/news/budget-the-stock-market-dont-confuse-this-number-with-the-deficit-it-is-a-delivery-mechanism-that-holds-a-message-for-the-markets/articleshow/127778036.cms,2026-01-29 19:15:48 IST,"The deficit figure for FY 2025–26 is best read not through one number, but through the full programme mix the budget documents lay out – because that mix is what determines yields, liquidity, and ultimately the valuation environment for equities.",https://economictimes.indiatimes.com/markets/stocks/rssfeeds/2146843.cms
"Two Trades for Today: A PSU energy major for a 6.1% gain, a mid-cap cement stock for a 3% upmove",https://economictimes.indiatimes.com/markets/stocks/news/two-trades-for-today-a-psu-energy-major-for-a-6-1-gain-a-mid-cap-cement-stock-for-a-3-upmove/articleshow/127777807.cms,2026-01-29 18:55:24 IST,Our technical analysts identify select stocks that may gain momentum even in volatile markets. Here are the technical calls for today.,https://economictimes.indiatimes.com/markets/stocks/rssfeeds/2146843.cms
"These large- and mid-cap stocks can give more than 25% return in 1 year, according to analysts",https://economictimes.indiatimes.com/markets/stocks/news/these-large-and-mid-cap-stocks-can-give-more-than-25-return-in-1-year-according-to-analysts/articleshow/127776949.cms,2026-01-29 18:26:31 IST,"Budget 2026 is unlikely to bring any direct relief to the market. Unless, of course, the government decides to do something dramatically positive with capital gains, which it is literally unlikely to. Why? Because this government has been quite clear on its taxation policy – and it involves a stable tax regime. But there are many things which the government could announce that may indicate how it plans to tackle the impact of geopolitics on the economy. And that will, in turn, provide a good idea on how things will pan out in the market.",https://economictimes.indiatimes.com/markets/stocks/rssfeeds/2146843.cms
"Gainers &amp; Losers: Hindustan Copper, Vedanta among 6 stocks in focus on Thursday",https://economictimes.indiatimes.com/markets/stocks/news/gainers-amp-losers-hindustan-copper-vedanta-among-6-stocks-in-focus-on-thursday/slideshow/127777131.cms,2026-01-29 18:25:32 IST,"Indian markets rose for a third day, led by financials and energy. Hindustan Copper hit a record, L&amp;T and Vedanta gained, eClerx jumped on results, while BEL slipped on brokerage views and Five-Star fell after earnings pressure elsewhere persisted modestly.",https://economictimes.indiatimes.com/markets/stocks/rssfeeds/2146843.cms
"ITC Q3 results: Net profit remains flat at  ₹5,018 crore; revenue up 6.7%, announces interim dividend  ₹6.5 per share",https://www.livemint.com/market/stock-market-news/itc-q3-results-net-profit-remains-flat-at-rs-5-018-crore-revenue-up-6-7-announces-interim-dividend-rs-6-5-per-share-11769691782386.html,2026-01-29 18:53:47 IST,"ITC Q3 results: Net profit remains flat at  ₹5018 crore; revenue up 6.7%, announces interim dividend  ₹6.50 per share",https://www.livemint.com/rss/markets
Cupid Q3 results: Net profits surge 196% YoY to  ₹33 crore; 4:1 bonus issue announced — Details here,https://www.livemint.com/market/stock-market-news/cupid-q3-results-net-profits-surge-196-yoy-to-rs-33-crore-4-1-bonus-issue-announced-details-here-11769691672496.html,2026-01-29 18:39:18 IST,Cupid Q3 results: Net profits surge 196% YoY to  ₹33 crore; 4:1 bonus issue announced — Details here,https://www.livemint.com/rss/markets
"Dow layoffs: Chemicals maker to slash 4,500 jobs amid sluggish demand — here's what we know",https://www.livemint.com/companies/news/dow-layoffs-chemicals-maker-to-slash-4-500-jobs-amid-sluggish-demand-heres-what-we-know-11769689506636.html,2026-01-29 19:05:31 IST,"Dow plans to cut 4,500 jobs, about 13% of its workforce, to enhance profitability by $2 billion, while projecting lower first-quarter revenue. Shares fell 3% as global chemical firms reassess strategies amid weak demand and rising costs.",https://www.livemint.com/rss/companies
How India’s informal watchdogs are forcing consumer brands to clean up their act,https://www.livemint.com/companies/influencers-changing-trust-in-packaged-food-supplements-india-11769690164074.html,2026-01-29 18:55:06 IST,"They have no connection with each other, but together, a motley band of independent watchdogs, influencers, online communities, and third-party platforms has kindled a consumer awakening across India.",https://www.livemint.com/rss/companies
‘Climate of fear’: ICE violence in Minnesota forces CEOs to weigh the risks of speaking out against Trump,https://www.cnbc.com/2026/01/29/trump-minnesota-ice-action-ceos-speaking-out.html,2026-01-29 18:55:01 IST,Minneapolis has become the testing ground for when and how far corporate leaders will wade into escalating political tensions.,https://www.cnbc.com/id/10000664/device/rss/rss.html
Market Trading Guide: Buy Oil India and ABB on Friday for up to 14% potential upside,https://economictimes.indiatimes.com/markets/stocks/news/market-trading-guide-buy-oil-india-and-abb-on-friday-for-up-to-14-potential-upside/articleshow/127780113.cms,2026-01-29 20:46:35 IST,"Nifty posted a third straight gain, led by financials and energy, while autos and IT capped upside. Technicals remain positive above the 50 EMA, with resistance near 25,500. Analysts recommend buying Oil India and ABB India on bullish setups.",https://economictimes.indiatimes.com/markets/stocks/rssfeeds/2146843.cms
"Shipping stock hits one year high, logging 9% intraday gain. Do you own?",https://www.livemint.com/market/stock-market-news/shipping-stock-hits-one-year-high-logging-9-intraday-gain-do-you-own-11769699062350.html,2026-01-29 20:40:49 IST,"Seamec shares rose 7% to  ₹1,291 on January 29, marking a five-day rally of 18%. Despite no fundamental triggers, technical factors aided the surge. The stock trades 194% higher over five years, with promoters holding 72.7%. Seamec specializes in offshore oil and gas diving support services.",https://www.livemint.com/rss/markets
"Gold rates today: MCX gold rises  ₹15,000 per 10g, silver jumps  ₹34,600 per kg on rising geopolitical tensions",https://www.livemint.com/market/commodities/gold-rates-today-mcx-gold-rises-rs-15-000-per-10g-silver-jumps-rs-34-600-per-kg-on-rising-geopolitical-tensions-11769696632285.html,2026-01-29 20:36:46 IST,"Gold prices have risen for three consecutive sessions, with February futures reaching  ₹1,80,799 per 10 grams. International spot gold surged to $5,600 per ounce, while silver prices also hit historic highs. Investors flock to precious metals amid geopolitical tensions and economic uncertainty.",https://www.livemint.com/rss/markets
"Dow Jones, S&amp;P 500 open higher, Nasdaq drops at US market open after Federal Reserve holds key interest rates steady",https://www.livemint.com/market/stock-market-news/dow-jones-s-p-500-open-higher-nasdaq-drops-at-us-market-open-after-federal-reserve-holds-key-interest-rates-steady-11769697520408.html,2026-01-29 20:19:49 IST,"Dow Jones, S&amp;amp;P 500 open higher, Nasdaq drops at US market open after Federal Reserve holds key interest rates steady",https://www.livemint.com/rss/markets
Swiggy signals restraint in quick commerce as Instamart’s Q3 losses climb,https://www.livemint.com/companies/company-results/swiggy-q3-results-swiggy-share-price-instamart-11769696269758.html,2026-01-29 20:29:00 IST,"Adjusted Ebitda losses of Instamart widened to  ₹908 crore during the quarter compared to  ₹578 crore in the year-ago period as it stepped up spending on marketing and customer-facing experiments such as Maxxsaver, and on a greater assortment of products.",https://www.livemint.com/rss/companies
Software stocks enter bear market on AI disruption fear with ServiceNow plunging 11% Thursday,https://www.cnbc.com/2026/01/29/software-stocks-enter-bear-market-on-ai-disruption-fear-with-servicenow-plunging-11percent-thursday.html,2026-01-29 20:48:46 IST,The iShares Expanded Tech-Software Sector ETF is on pace for its biggest one-day decline since April 4 during the tariff-triggered downturn.,https://www.cnbc.com/id/10000664/device/rss/rss.html
Ahead of Market: 10 things that will decide stock market action on Friday,https://economictimes.indiatimes.com/markets/stocks/news/ahead-of-market-10-things-that-will-decide-stock-market-action-on-friday/articleshow/127780766.cms,2026-01-29 21:27:20 IST,"Domestic markets rebounded strongly, ending higher on optimism from the Economic Survey projecting robust FY27 growth and anchored inflation. Metals outperformed, FMCG, IT and autos lagged. Nifty stayed above the 50 EMA, with resistance at 25,500 and support near 25,200.",https://economictimes.indiatimes.com/markets/stocks/rssfeeds/2146843.cms
