title,link,published,summary,source
"Sensex rises over 200 points, Nifty above 24,000; Maruti Suzuki shares jump 3%",https://economictimes.indiatimes.com/markets/stocks/news/sensex-rises-over-200-points-nifty-above-24000-maruti-suzuki-shares-jump-3/articleshow/132083324.cms,2026-06-30 09:22:14 IST,"Indian stock markets rebounded on Tuesday, with both Sensex and Nifty climbing approximately 0.4% after a dip in the previous session.  The Sensex surged over 200 points to cross 77,000, while the Nifty 50 also saw a healthy jump, nearing 24,000. Broader market indices, including Midcap and Smallcap, also participated in the upward trend, adding to the positive sentiment.",https://economictimes.indiatimes.com/markets/stocks/rssfeeds/2146843.cms
"NHPC among 5 stocks flashing bullish signals, hinting at a possible uptrend",https://economictimes.indiatimes.com/markets/stocks/news/nhpc-among-5-stocks-flashing-bullish-signals-hinting-at-a-possible-uptrend/slideshow/132083321.cms,2026-06-30 09:15:35 IST,"Five Nifty500 stocks, including Bank of Maharashtra, Chennai Petroleum, Carborundum Universal, Granules India, and NHPC, formed the bullish White Marubozu pattern on June 29, indicating strong buying momentum.",https://economictimes.indiatimes.com/markets/stocks/rssfeeds/2146843.cms
India's next stock market headache isn't oil but a bigger storm brewing in the skies,https://economictimes.indiatimes.com/markets/stocks/news/indias-next-stock-market-headache-isnt-oil-but-a-bigger-storm-brewing-in-the-skies/articleshow/132083174.cms,2026-06-30 09:03:50 IST,"India's stock market faces a new challenge as a severe ""Super El Niño"" threatens the monsoon, impacting 56% of GDP tied to consumption. This follows a decade-low monsoon start, with rainfall deficits exceeding previous El Niño years. Analysts warn of domestic demand destruction, range-bound markets, and downgrades in consumer sectors, despite easing oil prices. The situation could strain rural incomes and government finances.",https://economictimes.indiatimes.com/markets/stocks/rssfeeds/2146843.cms
HDFC Bank shares in focus as lender appoints ex-finance secretary Rajiv Kumar as part-time chairman,https://economictimes.indiatimes.com/markets/stocks/news/hdfc-bank-shares-in-focus-as-lender-appoints-ex-finance-secretary-rajiv-kumar-as-part-time-chairman/articleshow/132082764.cms,2026-06-30 08:54:20 IST,"HDFC Bank has appointed former IAS officer and ex-Chief Election Commissioner Rajiv Kumar as its Part-time Chairman, following Atanu Chakraborty's abrupt resignation over ethical concerns. Kumar, known for his role in cleaning up public sector bank balance sheets, will serve a three-year term subject to RBI approval. The bank also announced Puneet Sharma as its new CFO. This news comes as HDFC Bank shares have seen mixed performance recently.",https://economictimes.indiatimes.com/markets/stocks/rssfeeds/2146843.cms
How Ambani built Project Jupiter to launch India’s biggest IPO,https://economictimes.indiatimes.com/markets/stocks/news/how-ambani-built-project-jupiter-to-launch-indias-biggest-ipo/articleshow/132082679.cms,2026-06-30 08:27:05 IST,"Reliance quietly executed Project Jupiter to prepare Jio’s IPO while managing regulatory changes, investor alignment and strict secrecy. The plan evolved from an offer-for-sale to a primary issue, enabling funds to remain with the company and positioning Jio for India’s biggest stock market listing.",https://economictimes.indiatimes.com/markets/stocks/rssfeeds/2146843.cms
"Oyo parent Prism files updated IPO papers for fresh issue worth Rs 6,650 crore",https://economictimes.indiatimes.com/markets/stocks/news/oyo-parent-prism-files-updated-ipo-papers-for-fresh-issue-worth-rs-6650-crore/articleshow/132082678.cms,2026-06-30 08:24:48 IST,"OYO parent Prism, formerly Oravel Stays, has filed an updated DRHP with SEBI for a Rs 6,650 crore IPO entirely through fresh issue. Proceeds will primarily repay borrowings, with remaining funds for corporate use. The company may also undertake a pre-IPO placement before listing plans progress further.",https://economictimes.indiatimes.com/markets/stocks/rssfeeds/2146843.cms
Hexaware Technologies among 5 stocks showing bullish RSI upswing,https://economictimes.indiatimes.com/markets/stocks/news/hexaware-technologies-among-5-stocks-showing-bullish-rsi-upswing/slideshow/132082577.cms,2026-06-30 08:18:00 IST,"Five stocks in the Nifty500 segment that gained over 4% featured in the RSI Trending Up scan on June 29 after showing improving momentum. The RSI moved above the 50 mark from lower levels, signalling strengthening price action, improving sentiment and potential short-term buying opportunities for traders tracking bullish technical setups.",https://economictimes.indiatimes.com/markets/stocks/rssfeeds/2146843.cms
Positive Breakout: These 8 stocks cross above their 200 DMAs,https://economictimes.indiatimes.com/markets/stocks/news/positive-breakout-these-8-stocks-cross-above-their-200-dmas/slideshow/132081997.cms,2026-06-30 07:23:24 IST,"As long as the stock is priced above the 200-day SMA on the daily time frame, it is generally considered to be an overall uptrend.",https://economictimes.indiatimes.com/markets/stocks/rssfeeds/2146843.cms
Dalal Street set for a positive start as GIFT Nifty trades higher,https://economictimes.indiatimes.com/markets/stocks/news/pre-market-action-heres-the-trade-setup-for-todays-session/articleshow/132081761.cms,2026-06-30 06:51:30 IST,"Indian markets experienced a downturn on Monday, with the Nifty closing below 24,000 due to profit-taking and geopolitical concerns. IT and Auto stocks faced selling pressure. Analysts suggest a cautious outlook, with attention on US-Iran talks and the Strait of Hormuz. The India VIX saw an increase, indicating heightened market fear.",https://economictimes.indiatimes.com/markets/stocks/rssfeeds/2146843.cms
"Stocks in news: Bajaj Auto, ZEE, BPCL, HDFC Bank, HUL, Tata Motors CV",https://economictimes.indiatimes.com/markets/stocks/news/stocks-in-news-bajaj-auto-zee-bpcl-hdfc-bank-hul-tata-motors-cv/articleshow/132081740.cms,2026-06-30 06:38:35 IST,"Indian markets saw a subdued trading session on Monday, with key indices declining due to mixed global signals and profit-taking. Several prominent companies like Bajaj Auto, ZEEL, BPCL, HDFC Bank, and HUL are in focus today due to significant corporate developments. These include share buybacks, foreign investments, leadership appointments, and strategic acquisitions, signaling active corporate maneuvering amidst market fluctuations.",https://economictimes.indiatimes.com/markets/stocks/rssfeeds/2146843.cms
"MGL rides PNG adoption wave, analysts see further upside",https://economictimes.indiatimes.com/markets/stocks/news/mgl-may-have-enough-gas-in-pipeline-for-further-rise/articleshow/132081703.cms,2026-06-30 06:29:22 IST,"Mahanagar Gas shares have surged on government's push for piped natural gas adoption, aiming for a 20% customer base increase. This move is expected to significantly boost PNG consumption and accelerate volume growth. Despite a recent rally, the stock's valuation remains attractive, with analysts predicting future earnings growth and potential for a re-rating as margin pressures ease.",https://economictimes.indiatimes.com/markets/stocks/rssfeeds/2146843.cms
'Higher-for-longer' aluminium cycle to lift producer stocks,https://economictimes.indiatimes.com/markets/stocks/news/higher-for-longer-aluminium-cycle-to-lift-producer-stocks/articleshow/132081690.cms,2026-06-30 06:26:08 IST,"Indian aluminium giants Vedanta Aluminium and Hindalco Industries are poised for significant gains, with analysts predicting around 20% growth over the next 9-12 months. Despite recent price dips, a global supply deficit is expected to bolster metal prices. Investors are advised to capitalize on the current market correction to accumulate shares, anticipating strong performance driven by cost improvements, volume expansion, and stabilizing international operations.",https://economictimes.indiatimes.com/markets/stocks/rssfeeds/2146843.cms
Leading Indian brokerages gear up to offer seamless access to global stocks via GIFT City,https://economictimes.indiatimes.com/markets/stocks/news/leading-indian-brokerages-gear-up-to-offer-seamless-access-to-global-stocks-via-gift-city/articleshow/132081641.cms,2026-06-30 06:18:20 IST,"Indian investors can now easily buy foreign stocks like Apple and Nvidia through GIFT City, thanks to major discount brokers like Groww and Zerodha launching overseas investing services. This move, facilitated by the Liberalised Remittance Scheme, allows investments starting from just $1 with fractional shares. While charges include brokerage and forex conversion, GIFT City offers a regulated framework for these international investments.",https://economictimes.indiatimes.com/markets/stocks/rssfeeds/2146843.cms
India tops Taiwan to reclaim fifth spot in global market capitalisation,https://economictimes.indiatimes.com/markets/stocks/news/india-tops-taiwan-to-reclaim-fifth-spot-in-global-market-capitalisation/articleshow/132081579.cms,2026-06-30 05:44:04 IST,"India has surged back to the fifth spot globally in market capitalization, surpassing Taiwan. This marks India's second ascent in recent weeks, having previously overtaken South Korea. The shift comes as Taiwan's AI-driven rally cooled, trimming its market value. Investors are now reassessing stretched valuations and the sustainability of AI spending, impacting semiconductor-heavy markets.",https://economictimes.indiatimes.com/markets/stocks/rssfeeds/2146843.cms
Institutional demand sparks surge in block deals as promoters book profits,https://economictimes.indiatimes.com/markets/stocks/news/institutional-demand-sparks-surge-in-block-deals-as-promoters-book-profits/articleshow/132081553.cms,2026-06-30 05:36:24 IST,"Promoters and large shareholders are cashing in on a stock market rebound, offloading shares worth over ₹24,000 crore in May and June. This surge in secondary market deals, driven by strong domestic institutional investor appetite fueled by SIP inflows, contrasts with a lull earlier in the year. Notable sales include Vedanta, Craftsman Automation, and PB Fintech, with investors seeing favorable conditions for monetizing holdings and rebalancing portfolios.",https://economictimes.indiatimes.com/markets/stocks/rssfeeds/2146843.cms
NPCI turns to AI to stop frauds from siphoning off money,https://economictimes.indiatimes.com/markets/stocks/news/npci-turns-to-ai-to-stop-frauds-from-siphoning-off-money/articleshow/132081606.cms,2026-06-30 00:39:03 IST,"India's banking sector is set to gain a powerful new weapon against digital fraud. The National Payments Corporation of India (NPCI) has initiated a pilot for an AI model that can detect and track stolen money in real-time as it moves across bank accounts. This innovative technology aims to intercept fraudulent transactions before funds vanish, significantly reducing losses for victims and bolstering the security of digital payments across the nation.",https://economictimes.indiatimes.com/markets/stocks/rssfeeds/2146843.cms
RBI buyback gets few bids despite cash crunch,https://economictimes.indiatimes.com/markets/stocks/news/rbi-buyback-gets-few-bids-despite-cash-crunch/articleshow/132081609.cms,2026-06-30 00:34:51 IST,"The central bank's bond buyback saw a lukewarm market reception, attracting significantly less than the offered amount despite a liquidity deficit in the banking system.  Banks held back, anticipating future inflows and preferring short-term papers. Meanwhile, the benchmark 10-year government bond yield dipped to its lowest since March, buoyed by falling oil prices and record overseas portfolio investments.",https://economictimes.indiatimes.com/markets/stocks/rssfeeds/2146843.cms
'Creditors can't seek claims beyond okayed resolution plan',https://economictimes.indiatimes.com/markets/stocks/news/creditors-cant-seek-claims-beyond-okayed-resolution-plan/articleshow/132081614.cms,2026-06-30 00:30:52 IST,"Creditors seeking duplicate recoveries from group companies after a resolution plan is finalized will be disappointed, the NCLT ruled.  JM Financial ARC's bid to recover more from KSK Mahanadi Power via guarantees was dismissed, as the tribunal found their admitted dues were already fully satisfied.  This landmark judgment clarifies that approved resolution plans are binding, preventing further claims outside their scope.",https://economictimes.indiatimes.com/markets/stocks/rssfeeds/2146843.cms
Former finance services secy Rajiv Kumar named HDFC Bank part-time chairman,https://economictimes.indiatimes.com/markets/stocks/news/former-finance-services-secy-rajiv-kumar-named-hdfc-bank-part-time-chairman/articleshow/132081540.cms,2026-06-30 00:30:30 IST,"Kumar (66), a seasoned public policy leader and financial sector reformer, is widely credited with playing a key role in revitalising India's banking and financial system during a period of significant stress between 2017 and 2020. During his tenure, he strengthened governance, risk management and regulatory oversight across banks by institutionalising specialised monitoring of large exposures and introducing technology-driven risk assessment systems.",https://economictimes.indiatimes.com/markets/stocks/rssfeeds/2146843.cms
Zerodha eyes foray into investment banking,https://economictimes.indiatimes.com/markets/stocks/news/zerodha-eyes-foray-into-investment-banking/articleshow/132081615.cms,2026-06-30 00:26:31 IST,"India's leading retail broker, Zerodha, is making a significant move into investment banking. The company has applied to Sebi for a merchant banking license through its arm, Zerodha Corporate Advisors. This strategic expansion comes as the equity capital markets show strong potential, with experts noting ample room for new players possessing robust distribution and investor networks.",https://economictimes.indiatimes.com/markets/stocks/rssfeeds/2146843.cms
"India's external debt rises to $762.8 billion in FY26, debt-to-GDP ratio climbs",https://economictimes.indiatimes.com/markets/stocks/news/indias-external-debt-rises-to-762-8-billion-in-fy26-debt-to-gdp-ratio-climbs/articleshow/132081626.cms,2026-06-29 19:51:35 IST,"India's external debt reached $762.8 billion by March 2026, a rise of $26.3 billion year-on-year, pushing the debt-to-GDP ratio to 20.8%. The US dollar's strength significantly impacted this figure. While long-term debt saw a modest increase, short-term debt's share grew, raising concerns about its proportion to foreign exchange reserves. Despite these shifts, debt servicing as a percentage of current receipts declined.",https://economictimes.indiatimes.com/markets/stocks/rssfeeds/2146843.cms
"Aastha Spintex IPO Day 2: Issue booked 88% so far. Check GMP, subscription, review. Apply or skip?",https://www.livemint.com/market/ipo/aastha-spintex-ipo-gmp-aastha-spintex-ipo-subscription-status-aastha-spintex-ipo-review-aastha-spintex-ipo-details-11782789256214.html,2026-06-30 09:29:08 IST,"The Aastha Spintex IPO is priced between  ₹125-136 and opens for subscription until 1 July. It has allocated 20% for QIBs, 40% for NIIs, and 40% for retail investors, with allotments expected on 2 July and listing on 6 July.",https://www.livemint.com/rss/markets
"Gold rate drops near  ₹1,40,500 per 10 grams on MCX; silver declines below  ₹2,21,000 per kg; what should investors do?",https://www.livemint.com/market/commodities/gold-rate-drops-below-1-41-000-per-10-grams-on-mcx-silver-declines-to-2-21-000-per-kg-what-should-investors-do-11782790099861.html,2026-06-30 09:05:31 IST,"MCX gold August futures were 1.28% down at  ₹1,40,574 per 10 grams, while MCX silver September contracts were 1.04% down at  ₹2,20,322 per kg around 9:10 am.",https://www.livemint.com/rss/markets
Rupee opens marginally weaker at 94.57 against US dollar,https://www.livemint.com/market/stock-market-news/rupee-opens-marginally-weak-at-94-57-against-us-dollar-11782790391484.html,2026-06-30 09:05:24 IST,Rupee opens marginally weaker at 94.57 against US dollar,https://www.livemint.com/rss/markets
"SIS announces  ₹120 crore share buyback, fifth since listing; check details",https://www.livemint.com/market/stock-market-news/sis-buyback-sis-announces-rs-120-crore-share-buyback-fifth-since-listing-check-details-11782788256951.html,2026-06-30 08:57:14 IST,"SIS Ltd has proposed a  ₹120 crore share buyback, its fifth since 2017. The maximum buyback price is set at  ₹478.50 per share. This follows an 8% stock rise in a month and highlights the company's commitment to returning around  ₹720 crore to shareholders through various initiatives.",https://www.livemint.com/rss/markets
"Stocks to buy for short term: Trent, Torrent Pharma among 6 stocks experts recommend for next 1-2 weeks",https://www.livemint.com/market/stock-market-news/stocks-to-buy-for-short-term-trent-torrent-pharma-among-6-stocks-experts-recommend-for-next-1-2-weeks-11782786375546.html,2026-06-30 08:43:11 IST,"Stocks to buy for the short term: Experts highlight six stocks poised for short-term gains. From Trent, Lloyds Metals to Torrent Pharma, these companies showcase strong momentum backed by technical indicators.&amp;nbsp;",https://www.livemint.com/rss/markets
"CSM Technologies IPO allotment date likely today. GMP, steps to check share allotment status online",https://www.livemint.com/market/ipo/csm-technologies-ipo-allotment-date-likely-today-gmp-steps-to-check-share-allotment-status-online-11782788419228.html,2026-06-30 08:38:43 IST,"CSM Technologies IPO allotment status is expected to be finalised today, 30 June 2026. CSM Technologies IPO allotment status online check can be done through the websites of BSE and NSE, and also on the official portal of the IPO registrar. Kfin Technologies is the CSM Technologies IPO registrar.",https://www.livemint.com/rss/markets
Stock market today: Gift Nifty hints muted start; US-Iran talks to global markets - 7 stocks to buy or sell,https://www.livemint.com/market/stock-market-news/stock-market-today-gift-nifty-hints-muted-start-us-iran-talks-to-global-markets-7-stocks-to-buy-or-sell-11782783429732.html,2026-06-30 08:00:14 IST,"Indian stock market indices, Sensex and Nifty 50, are expected to open positively on Tuesday amid rising global markets, despite geopolitical tensions due to US-Iran conflicts and profit booking. Experts suggest cautious trading influenced by upcoming negotiations and regional developments.",https://www.livemint.com/rss/markets
"Buy or sell: Gift Nifty up, Vaishali Parekh recommends three stocks to buy today — 30 June 2026",https://www.livemint.com/market/stock-market-news/buy-or-sell-gift-nifty-up-vaishali-parekh-recommends-three-stocks-to-buy-today-30-june-2026-11782784177767.html,2026-06-30 07:55:42 IST,"Buy or sell: Vaishali Parekh recommends three stocks to buy today — MCX, IEX, and JSW Energy",https://www.livemint.com/rss/markets
"Stocks to watch: HDFC Bank, Bajaj Auto, Yes Bank among shares in focus today; check list here",https://www.livemint.com/market/stock-market-news/stocks-to-watch-hdfc-bank-bajaj-auto-yes-bank-among-shares-in-focus-today-check-list-here-11782784812585.html,2026-06-30 07:54:27 IST,"Stock market today: On Monday, the Sensex declined 372.10 points, or 0.48%, to settle at 76,728.37, while the Nifty 50 dropped 109.75 points, or 0.46%, ending the session at 23,946.25.",https://www.livemint.com/rss/markets
"Nifty 50, Sensex prediction today: Check how Indian stock market is expected to trade on 30 June",https://www.livemint.com/market/stock-market-news/nifty-50-sensex-prediction-today-check-how-indian-stock-market-is-expected-to-trade-on-30-june-11782784045317.html,2026-06-30 07:29:52 IST,"Nifty 50, Sensex prediction today: The trends on Gift Nifty also indicate a mildly positive start for the Indian benchmark index. The Gift Nifty was trading around 23,994 level, a premium of nearly 21 points from the Nifty futures’ previous close.",https://www.livemint.com/rss/markets
Crude oil prices fall on possible US-Iran talks; Brent near $72 per barrel,https://www.livemint.com/market/commodities/crude-oil-prices-fall-on-possible-us-iran-talks-brent-near-72-per-barrel-11782783756605.html,2026-06-30 07:28:09 IST,"US-Iran war: Brent crude futures for August delivery, set to expire on Tuesday, fell 1.03%, or 75 cents, to $72.40 per barrel.",https://www.livemint.com/rss/markets
"From Gift Nifty, Nasdaq, Nikkei rally to gold rate: 10 key things that changed for Indian stock market overnight",https://www.livemint.com/market/stock-market-news/from-gift-nifty-nasdaq-nikkei-rally-to-gold-rate-10-key-things-that-changed-for-indian-stock-market-overnight-11782783099679.html,2026-06-30 07:11:48 IST,"Gift Nifty was trading around 24,011 level, a premium of nearly 38 points from the Nifty futures’ previous close, indicating a mildly positive start for the Indian stock market indices.",https://www.livemint.com/rss/markets
"Asian stocks today: Kospi, Nikkei trade mixed amid US-Iran peace talks",https://www.livemint.com/market/stock-market-news/asian-stocks-today-kospi-nikkei-trade-mixed-amid-us-iran-peace-talks-11782782129015.html,2026-06-30 07:09:38 IST,Asian stocks today: Japan's Nikkei 225 remained volatile and traded largely flat and the Topix was down 0.65%.,https://www.livemint.com/rss/markets
Breakout stocks to buy or sell: Sumeet Bagadia recommends five shares to buy today - 30 June 2026,https://www.livemint.com/market/stock-market-news/breakout-stocks-to-buy-or-sell-sumeet-bagadia-recommends-five-shares-to-buy-today-30-june-2026-11782780656925.html,2026-06-30 06:37:58 IST,The Indian stock market ended Monday's session on a lower note. Sumeet Bagadia of Choice Broking recommends five breakout stocks to buy today.,https://www.livemint.com/rss/markets
Stock recommendations for 30 June from MarketSmith India,https://www.livemint.com/market/stock-market-news/stock-recommendations-for-30-june-from-marketsmith-india-11782779462882.html,2026-06-30 06:30:14 IST,"MarketSmith India reveals its top stock recommendations for today, 30 June. Get expert insights into the best-performing stocks to guide your investment decisions.",https://www.livemint.com/rss/markets
Three sectors investors should watch now,https://www.livemint.com/market/stock-market-news/best-sectors-to-invest-in-india-defence-critical-minerals-nuclear-energy-stocks-11782731692983.html,2026-06-30 06:00:33 IST,What are the sectors that investors should be tracking?&amp;nbsp;,https://www.livemint.com/rss/markets
Raja Venkatraman recommends three stocks for 30 June,https://www.livemint.com/market/stock-market-news/raja-venkatraman-recommends-three-stocks-sensex-nifty-11782734051416.html,2026-06-30 05:45:53 IST,Market expert Raja Venkatraman shares his top stock picks for 30 June. Here’s his technical outlook and trade strategy.,https://www.livemint.com/rss/markets
Sebi panel weighs proposal to open physically settled commodity trades to FPIs,https://www.livemint.com/market/sebi-fpis-commodity-derivatives-proposal-11782714314159.html,2026-06-30 05:45:12 IST,"The proposal seeks to address a long-standing tax hurdle that has kept FPIs out of bullion and base metal derivatives, where contracts are compulsorily deliverable on expiry.",https://www.livemint.com/rss/markets
How retail came to life in currency derivatives during war,https://www.livemint.com/market/rupee-forex-currency-derivatives-trading-west-asia-iran-war-dollar-etcd-rbi-nri-retail-investors-11782726220205.html,2026-06-30 05:30:32 IST,As local unit plunges 6.5% participation as percentage of turnover almost doubles; brokers say such trades are hedges against currency volatility&amp;nbsp;,https://www.livemint.com/rss/markets
"Mid caps expected to trump the large caps again, this time through acquisitions",https://www.livemint.com/companies/indian-it-services-acquisitions-coforge-persistent-systems-mphasis-hexaware-infosys-wipro-tcs-hcltech-tech-mahindra-11782745821453.html,2026-06-30 08:33:12 IST,"Indian mid-cap IT firms are using acquisitions to accelerate growth, positioning themselves to add more incremental revenue than larger peers this year as AI and weak demand reshape the industry.",https://www.livemint.com/rss/companies
The great startup scramble for compliance clarity as privacy law deadline nears,https://www.livemint.com/companies/start-ups/startup-clarity-privacy-dpdp-ai-legal-compliance-11782724245590.html,2026-06-30 06:01:53 IST,"As the data privacy compliance deadline draws closer, startups are rushing to understand their obligations. Legal experts say confusion over exemptions, data governance, AI use, and vendor management is driving a surge in compliance requests.",https://www.livemint.com/rss/companies
mAadhaar App discontinued: Here's everything to know about the new Aadhaar app,https://www.livemint.com/money/personal-finance/maadhaar-app-discontinued-heres-everything-to-know-about-the-new-aadhaar-app-and-its-features-11782784943427.html,2026-06-30 09:04:46 IST,"The Unique Identification Authority of India (UIDAI) has announced that the mAadhaar App will be discontinued from today, 30 June. The new Aadhaar App is designed to offer Aadhaar Number Holders (ANHs) a secure and paperless way to access Aadhaar services.&amp;nbsp;",https://www.livemint.com/rss/money
"Small Savings Scheme interest rates for July-Sept 2026 to be announced today; investors eye PPF, SCSS and SSY updates",https://www.livemint.com/money/personal-finance/small-savings-scheme-interest-rates-for-july-sept-2026-to-be-announced-today-investors-eye-ppf-scss-and-ssy-updates-11782784209064.html,2026-06-30 08:25:03 IST,"Small Savings Scheme Interest Rates July-September 2026 are expected today, with investors awaiting updates on PPF, SCSS, SSY, NSC and other government-backed schemes.",https://www.livemint.com/rss/money
