title,link,published,summary,source
Stocks with a 3- to 5-year perspective. 7 stocks where the budget continues to provide tailwinds by way of policy support,https://economictimes.indiatimes.com/markets/stocks/news/stocks-with-a-3-to-5-year-perspective-7-stocks-where-the-budget-continues-to-provide-tailwinds-by-way-of-policy-support/articleshow/127971909.cms,2026-02-06 11:19:39 IST,"Defence, railways, power. The common thread running through these sectors is that revival came only after the government brought about policy changes that prioritised them. However, unlike, for instance, power, where government support resulted in a relatively quick turnaround, there are some sectors where such support would be needed for a longer time. The fact that the government has, for the  third year in a row, made an effort in the budget clearly shows its intent.",https://economictimes.indiatimes.com/markets/stocks/rssfeeds/2146843.cms
"Indian stocks enjoy a rare combination, makes a case for re-rating: Morgan Stanley's Ridham Desai",https://economictimes.indiatimes.com/markets/stocks/news/indian-stocks-enjoy-a-rare-combination-makes-a-case-for-re-rating-morgan-stanleys-ridham-desai/articleshow/127972117.cms,2026-02-06 11:15:31 IST,"Morgan Stanley sees Indian equities entering a rare phase that supports a valuation re-rating, driven by policy stimulus, improving earnings, weak foreign positioning and attractive relative valuations. With macro stability improving and growth accelerating, the firm forecasts meaningful upside for the Sensex through 2026 under its base and bull case scenarios.",https://economictimes.indiatimes.com/markets/stocks/rssfeeds/2146843.cms
Nykaa share price jumps over 6% to 1-year high as brokerages stay bullish after Q3 earnings,https://www.livemint.com/market/stock-market-news/nykaa-share-price-jumps-over-6-to-1-year-high-as-brokerages-stay-bullish-after-q3-earnings-11770358317085.html,2026-02-06 11:58:42 IST,"Nykaa share price surged 6.2% to  ₹274.45 as brokerages raised target prices after strong Q3 results. Nomura upgraded its rating to 'buy' with a target of  ₹305, while JM Financial maintained a target of  ₹325, highlighting robust growth and profitability improvements.",https://www.livemint.com/rss/markets
"'Never regretted staying away,' warns Porinju Veliyath on gold, silver, bitcoin meltdown",https://www.livemint.com/market/stock-market-news/never-regretted-staying-away-warns-small-cap-czar-porinju-veliyath-on-gold-price-silver-rate-bitcoin-meltdown-11770356973443.html,2026-02-06 11:52:45 IST,"Veteran investor Porinju Veliyath advises against investing in sentiment-driven assets like gold and silver, especially during corrections. As precious metals face substantial price drops, he highlights the need for cautious investing based on fundamental strength rather than market frenzy.",https://www.livemint.com/rss/markets
"Aye Finance IPO opens on Monday — Price band, GMP, offer size among top 10 things to know ahead of offer launch",https://www.livemint.com/market/ipo/aye-finance-ipo-opens-on-monday-price-band-gmp-offer-size-among-top-10-things-to-know-ahead-of-offer-launch-11770358302463.html,2026-02-06 11:46:51 IST,"Aye Finance IPO: From  ₹5 a day ago, Aye Finance IPO GMP has fallen to  ₹1. This means that shares of Aye Finance are trading at  ₹130 in the grey market.",https://www.livemint.com/rss/markets
RBI plans to remove VRR cap to boost foreign investments in bonds,https://www.livemint.com/market/bonds/rbi-vrr-cap-fpi-bonds-debt-nsdl-investments-11770355716677.html,2026-02-06 11:27:00 IST,The Reserve Bank of India's plan offers investors operational flexibility while maintaining existing limits on government and corporate bonds.,https://www.livemint.com/rss/markets
"Bath &amp; Body Works has a new formula for growth, bets on India",https://www.livemint.com/companies/news/bath-body-works-india-fragrance-business-apparel-group-personal-care-11770347603673.html,2026-02-06 11:52:40 IST,"India now ranks among Bath &amp;amp; Body Works’ top five international markets by growth, underscoring the country’s role as a strategic lever in its global recovery.",https://www.livemint.com/rss/companies
Why Tata Motors’ India PV business may not offset JLR’s cyber drag: Jefferies explains,https://economictimes.indiatimes.com/markets/stocks/news/why-tata-motors-india-pv-business-may-not-offset-jlrs-cyber-drag-jefferies-explains/articleshow/127975131.cms,2026-02-06 12:34:09 IST,"Jefferies highlights significant pressures on Jaguar Land Rover (JLR) following Tata Motors Passenger Vehicles' weak December quarter, with JLR's EBITDA plunging 91% YoY. Despite improved India PV prospects, JLR faces structural challenges, including competition and EV transition, impacting overall profitability and growth.",https://economictimes.indiatimes.com/markets/stocks/rssfeeds/2146843.cms
The software apocalypse will be a buying opportunity—eventually,https://www.livemint.com/market/stock-market-news/the-software-apocalypse-will-be-a-buying-opportunityeventually-11770363257633.html,2026-02-06 13:08:35 IST,The tech stock panic stems from a misunderstanding about AI models like Claude ChatGPT. It’s making for some very cheap stocks.,https://www.livemint.com/rss/markets
Tata Steel Q3 Results 2026 LIVE: Tata Steel share price dips 1.5% — Brokerages see multifold jump in Dec quarter profit,https://www.livemint.com/market/stock-market-news/tata-steel-q3-results-2026-live-tata-steel-share-price-tata-steel-q3-earnings-profit-6-february-2026-11770360721917.html,2026-02-06 12:32:42 IST,Tata Steel Q3 Results 2026 LIVE: Domestic brokerages expect Tata Steel to announce a multi-fold jump in its Q3 profit after tax (PAT) on a year-on-year basis while the figure could decline sequentially.,https://www.livemint.com/rss/markets
"For Tata Power, Mundra remains the Achilles’s heel, overshadowing other segments",https://www.livemint.com/market/mark-to-market/tata-power-q3-earnings-tata-power-share-price-mundra-power-plant-11770357973356.html,2026-02-06 12:32:01 IST,"Tata Power’s shares have stayed largely flat over the past year, dragged down by Mundra’s underperformance.",https://www.livemint.com/rss/markets
"Biopol Chemicals IPO day 1: GMP, subscription status, price, other key details of SME IPO in 10 points",https://www.livemint.com/market/ipo/biopol-chemicals-ipo-day-1-gmp-subscription-status-price-other-key-details-of-sme-ipo-in-10-points-11770358373752.html,2026-02-06 12:31:46 IST,"Biopol Chemicals launched its IPO on February 6, offering 28,94,400 shares priced between  ₹102 and  ₹108. The IPO closes on February 10 and aims to raise  ₹32.26 crore for expansion and debt repayment.",https://www.livemint.com/rss/markets
Kalyan Jewellers Q3 results 2026 LIVE: What to expect from the jewellery stock in December quarter?,https://www.livemint.com/market/stock-market-news/kalyan-jewellers-q3-results-2026-live-kalyan-jewellers-share-price-gold-price-today-11770360139987.html,2026-02-06 12:29:39 IST,"Kalyan Jewellers Q3 results 2026 LIVE: Kalyan Jewellers will announce its Q3 FY26 results on February 6, following a strong December quarter update, where it reported sharp revenue growth driven by festive demand despite volatile gold prices.",https://www.livemint.com/rss/markets
"Brandman Retail IPO subscribed over 9x on Day 3 led by NIIs, retail investors. Check GMP, subscription status, more",https://www.livemint.com/market/ipo/brandman-retail-ipo-subscribed-over-9x-on-day-3-led-by-niis-retail-investors-check-brandman-retail-ipo-gmp-11770358649346.html,2026-02-06 12:22:14 IST,"The Brandman Retail IPO commenced on February 4 and ends on February 6, with shares priced between  ₹167 and  ₹176. The company has reported significant profit growth and aims to expand its retail presence, with substantial interest shown in the IPO subscription so far.",https://www.livemint.com/rss/markets
OpenAI launches GPT‑5.3-Codex as AI race heats up after Anthropic’s Claude Opus 4.6 — all you need to know,https://www.livemint.com/companies/news/openai-gpt5-3-codex-sam-altman-coding-model-artificial-intelligence-anthropic-claude-opus-46-11770360795351.html,2026-02-06 13:05:27 IST,"Sam Altman-led OpenAI launched GPT-5.3-Codex, which is a fast, agentic model that it believes goes beyond coding and can handle research and workflows. Rival Anthropic's Claude Opus 4.6 focuses on long-running tasks and deep reasoning.",https://www.livemint.com/rss/companies
"ITC, Godfrey Phillips, other cigarette stocks jump up to 13% amid reports of price hike",https://economictimes.indiatimes.com/markets/stocks/news/itc-godfrey-phillips-other-cigarette-stocks-jump-up-to-13-amid-reports-of-price-hike/articleshow/127976963.cms,2026-02-06 13:57:04 IST,"Cigarette company shares saw a significant jump on Friday. This surge followed reports of price increases, with firms like ITC, Godfrey Phillips, and VST Industries passing on higher costs to consumers. The market also saw value buying after a recent tax overhaul. Higher priced cigarette packets have been introduced, with price hikes ranging from 15% to 30%.",https://economictimes.indiatimes.com/markets/stocks/rssfeeds/2146843.cms
"MRF declares Rs 3 interim dividend, February 13 set as record date",https://economictimes.indiatimes.com/markets/stocks/news/mrf-declares-rs-3-interim-dividend-february-13-set-as-record-date/articleshow/127977043.cms,2026-02-06 13:16:38 IST,"Tyre maker MRF announced a second interim dividend of Rs 3 per share for the financial year ending March 31, 2026. This follows a robust Q3 earnings report. Net profit surged significantly, driven by strong operational performance and improved business execution. Revenue saw a healthy increase, with EBITDA jumping considerably. Margins also expanded sharply, reflecting efficient operations.",https://economictimes.indiatimes.com/markets/stocks/rssfeeds/2146843.cms
Japan's Nikkei rallies on earnings in unsteady trade before Sunday election,https://economictimes.indiatimes.com/markets/stocks/news/japans-nikkei-rallies-on-earnings-in-unsteady-trade-before-sunday-election/articleshow/127977011.cms,2026-02-06 13:15:20 IST,"The impact of earnings, recent sharp share declines, and the weekend's impending election contributed ‍to a ⁠sense of tug-of-war in ⁠Tokyo's equity markets, said Maki Sawada, an equities strategist at Nomura Securities.",https://economictimes.indiatimes.com/markets/stocks/rssfeeds/2146843.cms
Fortis Healthcare sets board meeting date to declare Q3 results 2026. Details here,https://www.livemint.com/market/stock-market-news/fortis-healthcare-sets-board-meeting-date-to-declare-q3-results-2026-details-here-11770366428182.html,2026-02-06 14:01:01 IST,Fortis Healthcare sets board meeting date to declare Q3 results 2026. Details here,https://www.livemint.com/rss/markets
Engineering stock jumps despite weak trends on Dalal Street; here's why,https://www.livemint.com/market/stock-market-news/smallcap-engineering-stock-standard-engineering-technology-share-price-jumps-despite-weak-trends-on-dalal-street-11770363639640.html,2026-02-06 13:25:09 IST,"Standard Engineering Technology shares rose by 7% following strong Q3 results, reporting a 28.3% increase in profit. The company's transformation into an integrated engineering platform and strategic acquisitions boosted investor confidence despite a broader market decline.",https://www.livemint.com/rss/markets
Multibagger stock Hitachi Energy rises 14% as Q3 net profit jumps 90% YoY,https://www.livemint.com/market/stock-market-news/multibagger-stock-hitachi-energy-rises-14-as-q3-net-profit-jumps-90-yoy-11770361172172.html,2026-02-06 13:24:40 IST,"Hitachi Energy share price rose 14% to  ₹21,889 on February 6, following a strong Q3 performance with a 90.3% YoY profit increase. Revenue also surged 29.6% YoY. Despite a decline in order inflows, the company's order backlog stands at  ₹29,872.2 crore, ensuring future revenue visibility.",https://www.livemint.com/rss/markets
RBI MPC keeps repo rate unchanged: Does it signal the end of current rate-cutting cycle?,https://www.livemint.com/market/stock-market-news/rbi-mpc-keeps-repo-rate-unchanged-does-it-signal-the-end-of-current-rate-cutting-cycle-11770363889324.html,2026-02-06 13:19:37 IST,"The RBI's decision to maintain the repo rate at 5.25% reflects a consolidation phase amid economic stability. Analysts suggest that further rate cuts may occur if growth slows, especially with a projected 25 basis point cut possible in the next financial year.",https://www.livemint.com/rss/markets
Page Industries strives to regain its mojo. Can millennials and Gen Zers help the Jockey maker?,https://www.livemint.com/market/mark-to-market/page-industries-volume-growth-gen-z-millennial-consumers-market-share-jockey-speedo-11770361115431.html,2026-02-06 13:17:11 IST,"Page Industries continues to aspire to return to double-digit growth, led by marketing initiatives, distribution expansion, and new product launches.",https://www.livemint.com/rss/markets
"Logistics stock rises for the fifth day in a row, rises 27% this week despite weak markets",https://www.livemint.com/market/stock-market-news/logistics-stock-rises-for-the-fifth-day-in-a-row-rises-27-this-week-despite-weak-markets-11770361062915.html,2026-02-06 13:13:29 IST,"Sindhu Trade Links rose over 4% on Feb 6, driven by strong trading volumes and investor interest. The co reported significant financial results, including increased net sales and profit, and announced a strategic shift towards critical minerals, planning to invest USD 100 mln in related projects.",https://www.livemint.com/rss/markets
"Toyota Motor announces leadership reshuffle — Who is new CEO Kenta Kon, ‘mastermind’ behind subsidiary buyout?",https://www.livemint.com/companies/people/toyota-motor-corp-leadership-reshuffle-who-kenta-kon-ceo-mastermind-subsidiary-buyout-koji-sato-transition-vice-chairman-11770360829533.html,2026-02-06 13:57:55 IST,"Toyota's CEO Koji Sato steps down after three years, transitioning to vice chairman as Kenta Kon takes over. The change aims to address growing scrutiny over the subsidiary buyout and enhance decision-making amid industry disruptions.",https://www.livemint.com/rss/companies
"UPI stocks Paytm, Mobikwik fall up to 4% after RBI proposes transaction fraud framework",https://economictimes.indiatimes.com/markets/stocks/news/upi-stocks-paytm-mobikwik-fall-up-to-4-after-rbi-proposes-transaction-fraud-framework/articleshow/127979580.cms,2026-02-06 14:10:24 IST,"UPI stocks Paytm and Mobikwik fell up to 4% after the RBI proposed a framework to compensate customers for small value fraudulent transactions. The central bank plans to cap compensation at Rs 25,000 while tightening customer liability norms and enhancing digital payments safety through stricter safeguards.",https://economictimes.indiatimes.com/markets/stocks/rssfeeds/2146843.cms
"From HDFC Bank, TCS, to Maruti Suzuki— InCred Equities shares 19 high-conviction ideas for February. Full list here",https://www.livemint.com/market/stock-market-news/stocks-to-buy-from-hdfc-bank-tcs-to-maruti-suzuki-incred-equities-shares-19-high-conviction-ideas-for-february-11770368612381.html,2026-02-06 15:04:10 IST,"InCred Equities has released a list of 19 high-conviction stock recommendations, including HDFC Bank, TCS, Maruti Suzuki, Bajaj Finance, and Axis Bank, for February, emphasising potential growth from the recent Union Budget and trade deals.&amp;nbsp;",https://www.livemint.com/rss/markets
Silver prices crash 45% from peak — more than twice the fall in gold. Should investors be worried?,https://www.livemint.com/market/commodities/silver-prices-crash-45-from-peak-more-than-twice-the-fall-in-gold-should-investors-be-worried-11770365873284.html,2026-02-06 14:49:24 IST,"Silver prices have sharply declined, losing all early-2026 gains as selling pressure increases. The March futures contract reached an intraday low of  ₹2,29,187.&amp;nbsp;",https://www.livemint.com/rss/markets
"BEML Q3 Results 2026: Defence PSU posts net loss of  ₹22.4 crore, revenue rises 24% YoY; stock slips 10%",https://www.livemint.com/market/stock-market-news/beml-q3-results-2026-defence-psu-posts-net-loss-of-rs-23-5-crore-revenue-rises-24-yoy-stock-slips-10-11770368490034.html,2026-02-06 14:39:58 IST,"BEML Q3 Results 2026: The consolidated company’s revenue from operations in Q3FY26 increased 23.7% to  ₹1,083.27 crore from  ₹875.77, year-on-year (YoY).",https://www.livemint.com/rss/markets
"Robert Kiyosaki paused buying gold, silver, Bitcoin at these levels; reveals when he will enter again",https://www.livemint.com/market/stock-market-news/robert-kiyosaki-paused-buying-gold-silver-bitcoin-at-these-levels-reveals-when-he-will-enter-again-11770358448316.html,2026-02-06 14:29:53 IST,"Robert Kiyosaki advises patience in investing, waiting for lower prices before buying gold and Bitcoin. He emphasizes the importance of entry timing over exit and warns against overconfidence in volatile markets.&amp;nbsp;",https://www.livemint.com/rss/markets
RBI to roll out framework for corporate bond derivatives and total return swaps after Budget push,https://www.livemint.com/news/india/rbi-bond-framework-total-return-swaps-india-11770356623898.html,2026-02-06 11:36:06 IST,"Treasury officials said the introduction of TRS could mark a shift in how investors access corporate credit, allowing them to take short-term or directional views on bond yields and prices without deploying large balance-sheet capital.",https://www.livemint.com/rss/markets
“Fifth day of a test match”: Air India chief on fleet overhaul as retrofit runs two years late,https://www.livemint.com/companies/news/fifth-day-of-a-test-match-air-india-chief-on-fleet-overhaul-as-retrofit-runs-two-years-late-11770358384461.html,2026-02-06 14:38:51 IST,"After four years under Tata Group, Air India’s $400 million retrofit is still catching up, with wide-body upgrades lagging even as the airline says the overhaul is on budget and nearing rollout.",https://www.livemint.com/rss/companies
MRF zooms after Q3 PAT more than doubles to Rs 692 cr; declares dividend of Rs 3/ share,https://www.business-standard.com/markets/capital-market-news/mrf-zooms-after-q3-pat-more-than-doubles-to-rs-692-cr-declares-dividend-of-rs-3-share-126020600965_1.html,2026-02-06 14:51:19 IST,"MRF rallied 6.28% to Rs 143,413.65 after the company's consolidated net profit surged 119.31% to Rs 691.83 crore on 14.99% jump in revenue from operations to Rs 8050.43 crore in Q3 December 2025 over Q3 December 2024.",https://www.business-standard.com/rss/markets-106.rss
Market trade sideways; FMCG shares advance,https://www.business-standard.com/markets/capital-market-news/market-trade-sideways-fmcg-shares-advance-126020600955_1.html,2026-02-06 14:50:52 IST,"At 14:28 IST, the barometer index, the S&amp;P BSE Sensex, rose 78.21 points or 0.09% to 83,392.14. The Nifty 50 index fell 32.35 points or 0.12% to 25,610.40.",https://www.business-standard.com/rss/markets-106.rss
InCred rejigs India strategy for Feb 26; what's new in high-conviction list,https://www.business-standard.com/markets/news/incred-rejigs-india-strategy-for-feb-26-what-s-new-in-high-conviction-list-check-here-126020600907_1.html,2026-02-06 14:42:15 IST,"Reviewing the performance of its high-conviction ideas, InCred said Tata Motors Commercial Vehicles, GE Vernova T&amp;D and Thyrocare Technologies have been ""big outperformers to Nifty""",https://www.business-standard.com/rss/markets-106.rss
Jubilant Pharmova shares fall over 4% after Q3 net profit declines 17% YoY,https://www.business-standard.com/markets/news/jubilant-pharmova-shares-fall-over-4-after-q3-net-profit-declines-17-yoy-126020600875_1.html,2026-02-06 14:36:29 IST,The scrip fell as much as 4.4 per cent to ₹931 per share on the National Stock Exchange (NSE),https://www.business-standard.com/rss/markets-106.rss
RBI announces regulatory policy measures relating to financial markets,https://www.business-standard.com/markets/capital-market-news/rbi-announces-regulatory-policy-measures-relating-to-financial-markets-126020600910_1.html,2026-02-06 14:32:03 IST,The Reserve Bank of India (RBI) has come up with a statement on developmental and regulatory policies. Following regulatory policy measures relating to financial markets were announced.,https://www.business-standard.com/rss/markets-106.rss
Lok Sabha adjourned for day amid opposition protests,https://www.business-standard.com/markets/capital-market-news/lok-sabha-adjourned-for-day-amid-opposition-protests-126020600909_1.html,2026-02-06 14:31:51 IST,"The Lok Sabha was adjourned for the day after repeated disruptions by opposition members over various issues, preventing the House from conducting its scheduled business.",https://www.business-standard.com/rss/markets-106.rss
India not selling US Treasury holdings despite forex fluctuations: RBI Guv,https://www.business-standard.com/markets/news/india-not-selling-us-treasury-holdings-despite-forex-fluctuations-rbi-guv-126020600888_1.html,2026-02-06 14:20:44 IST,"The country's holdings of long-term US debt had dropped to a five-year low of $174 billion as of November, down 26 per cent from a 2023 peak, according to US government data",https://www.business-standard.com/rss/markets-106.rss
Physicswallah falls 4% after Q3 results; 20% down from IPO listing price,https://www.business-standard.com/markets/news/physicswallah-stock-falls-4-after-q3-results-20-down-from-ipo-listing-price-126020600880_1.html,2026-02-06 14:19:11 IST,Physicswallah had reported a 33 per cent year-on-year (Y-o-Y) increase in its net profit to 102.3 crore compared to ₹76.7 crore in the year-ago period,https://www.business-standard.com/rss/markets-106.rss
Veranda Learning Solutions reports standalone net profit of Rs 1.09 crore in the December 2025 quarter,https://www.business-standard.com/markets/capital-market-news/veranda-learning-solutions-reports-standalone-net-profit-of-rs-1-09-crore-in-the-december-2025-quarter-126020600863_1.html,2026-02-06 14:17:55 IST,Sales decline 66.45% to Rs 3.58 crore,https://www.business-standard.com/rss/markets-106.rss
Raj Rayon Industries standalone net profit declines 27.98% in the December 2025 quarter,https://www.business-standard.com/markets/capital-market-news/raj-rayon-industries-standalone-net-profit-declines-27-98-in-the-december-2025-quarter-126020600862_1.html,2026-02-06 14:17:45 IST,Sales rise 33.17% to Rs 305.39 crore,https://www.business-standard.com/rss/markets-106.rss
Ganesh Housing consolidated net profit declines 66.59% in the December 2025 quarter,https://www.business-standard.com/markets/capital-market-news/ganesh-housing-consolidated-net-profit-declines-66-59-in-the-december-2025-quarter-126020600861_1.html,2026-02-06 14:17:38 IST,Sales decline 64.48% to Rs 91.30 crore,https://www.business-standard.com/rss/markets-106.rss
Thrive Future Habitats reports consolidated net profit of Rs 0.34 crore in the December 2025 quarter,https://www.business-standard.com/markets/capital-market-news/thrive-future-habitats-reports-consolidated-net-profit-of-rs-0-34-crore-in-the-december-2025-quarter-126020600860_1.html,2026-02-06 14:17:29 IST,Sales decline 87.30% to Rs 0.08 crore,https://www.business-standard.com/rss/markets-106.rss
Ester Industries reports consolidated net loss of Rs 12.41 crore in the December 2025 quarter,https://www.business-standard.com/markets/capital-market-news/ester-industries-reports-consolidated-net-loss-of-rs-12-41-crore-in-the-december-2025-quarter-126020600859_1.html,2026-02-06 14:17:22 IST,Sales decline 1.91% to Rs 338.98 crore,https://www.business-standard.com/rss/markets-106.rss
Jubilant Pharmova consolidated net profit declines 44.60% in the December 2025 quarter,https://www.business-standard.com/markets/capital-market-news/jubilant-pharmova-consolidated-net-profit-declines-44-60-in-the-december-2025-quarter-126020600858_1.html,2026-02-06 14:17:12 IST,Sales rise 16.67% to Rs 2116.10 crore,https://www.business-standard.com/rss/markets-106.rss
MRF consolidated net profit rises 119.32% in the December 2025 quarter,https://www.business-standard.com/markets/capital-market-news/mrf-consolidated-net-profit-rises-119-32-in-the-december-2025-quarter-126020600857_1.html,2026-02-06 14:17:03 IST,Sales rise 14.99% to Rs 8050.43 crore,https://www.business-standard.com/rss/markets-106.rss
Mehta Securities reports standalone net loss of Rs 0.03 crore in the December 2025 quarter,https://www.business-standard.com/markets/capital-market-news/mehta-securities-reports-standalone-net-loss-of-rs-0-03-crore-in-the-december-2025-quarter-126020600856_1.html,2026-02-06 14:16:57 IST,Sales rise 33.33% to Rs 0.04 crore,https://www.business-standard.com/rss/markets-106.rss
India gold premiums drops sharply; China demand up ahead of Lunar New Year,https://www.business-standard.com/markets/commodities/india-gold-premiums-drops-sharply-china-demand-up-ahead-of-lunar-new-year-126020600762_1.html,2026-02-06 14:16:18 IST,"Domestic gold prices were trading around ₹150,000 per 10 grams on Friday, after hitting a record high of  ₹180,779 last week before sliding to as low as  ₹133,687 this week",https://www.business-standard.com/rss/markets-106.rss
CESC slips as Q3 PAT slides 32% QoQ to Rs 304 cr,https://www.business-standard.com/markets/capital-market-news/cesc-slips-as-q3-pat-slides-32-qoq-to-rs-304-cr-126020600837_1.html,2026-02-06 14:05:06 IST,"CESC declined 1.91% to Rs 151.40 after the company's consolidated net profit fell 32.14% to Rs 304 crore on a 23.96% drop in revenue from operations to Rs 4,005 crore in Q3 FY26 over Q2 FY26.",https://www.business-standard.com/rss/markets-106.rss
