title,link,published,summary,source
"NLC India among 7 stocks flashing bullish signals, indicating possible uptrend",https://economictimes.indiatimes.com/markets/stocks/news/nlc-india-among-7-stocks-flashing-bullish-signals-indicating-possible-uptrend/slideshow/126152039.cms,2025-12-24 08:45:23 IST,"Seven NSE-listed stocks with market capitalisation above Rs 1,000 crore signalled bullish momentum on 23 December after forming White Marubozu patterns. This candlestick formation reflects strong buying interest throughout the session, suggesting buyers remained in control from open to close and indicating potential continuation of the prevailing uptrend.",https://economictimes.indiatimes.com/markets/stocks/rssfeeds/2146843.cms
Ambuja Cements among 5 F&amp;O stocks that saw a high increase in futures open interest,https://economictimes.indiatimes.com/markets/stocks/news/ambuja-cements-among-5-fo-stocks-that-saw-a-high-increase-in-futures-open-interest/slideshow/126151955.cms,2025-12-24 08:41:52 IST,"As of December 23, five stocks in the NSE F&amp;O segment recorded a sharp rise in futures open interest, signalling fresh derivatives activity. A rise in open interest reflects increasing participation, with traders either initiating new positions or expanding existing exposure, pointing to stronger conviction on near-term price direction.",https://economictimes.indiatimes.com/markets/stocks/rssfeeds/2146843.cms
"Coal India shares jump over 1% after in-principle nod for listing of MCL, SECL",https://economictimes.indiatimes.com/markets/stocks/news/coal-india-shares-in-focus-after-in-principle-nod-for-listing-of-mcl-secl/articleshow/126151903.cms,2025-12-24 08:40:28 IST,"In a significant boost for investors, Coal India has seen its shares gain traction after the announcement of plans to list its subsidiaries, Mahanadi Coalfields Limited and South Eastern Coalfields Limited. This strategic initiative aligns with directives from the Ministry of Coal, paving the way for further communications with the Ministry regarding submissions to DIPAM.",https://economictimes.indiatimes.com/markets/stocks/rssfeeds/2146843.cms
Shriram Finance among 5 stocks closed crossing above VWAP,https://economictimes.indiatimes.com/markets/stocks/news/shriram-finance-among-5-stocks-closed-crossing-above-vwap/slideshow/126151869.cms,2025-12-24 08:36:18 IST,"Five Nifty500 stocks closed more than 1% above their VWAP levels on 23 December, indicating strong intraday accumulation and improving market sentiment. A close above VWAP suggests prices strengthened through the session, often viewed as a short-term bullish signal reflecting active buying interest and potential continuation of upward momentum.",https://economictimes.indiatimes.com/markets/stocks/rssfeeds/2146843.cms
Silver rate today smashes record again as Gold scales new peak - How far can this rally in precious metals go?,https://www.livemint.com/market/commodities/silver-rate-today-hits-record-high-as-gold-prices-scale-new-peak-how-far-can-this-rally-in-precious-metals-go-11766546930445.html,2025-12-24 09:45:41 IST,"Recent rallies in silver and gold are fueled by geopolitical tensions and a weaker dollar, with silver gaining over 140% this year. Platinum also hits new highs, driven by supply issues and strong demand across sectors.",https://www.livemint.com/rss/markets
"Gold tops $4,500, silver and platinum hit records in metal markets frenzy",https://www.livemint.com/market/commodities/gold-tops-4-500-silver-and-platinum-hit-records-in-metal-markets-frenzy-11766549631588.html,2025-12-24 09:43:51 IST,GLO,https://www.livemint.com/rss/markets
"Gujarat Kidney IPO Day 3 LIVE: Last day to apply for IPO — Check latest GMP, review and other details",https://www.livemint.com/market/ipo/gujarat-kidney-ipo-gmp-today-gujarat-kidney-ipo-subscription-status-gujarat-kidney-ipo-review-gujarat-kidney-ipo-11766548247862.html,2025-12-24 09:36:51 IST,"Gujarat Kidney IPO Day 3 LIVE: Gujarat Kidney IPO price band has been fixed at  ₹108 to  ₹114 per share. It consists entirely of a fresh issue of up to 2.2 crore equity shares, amounting to  ₹250.8 crore at the upper end of the price band.",https://www.livemint.com/rss/markets
"Copper prices hit record high of $12,000, rise 35% YTD — here's why",https://www.livemint.com/market/commodities/copper-price-hit-record-high-of-12-000-rise-35-in-ytd-heres-why-11766543380032.html,2025-12-24 09:18:54 IST,"On Tuesday, benchmark prices on the London Metal Exchange shot up 2% to $12,159.50",https://www.livemint.com/rss/markets
"Gold, silver rates at fresh highs on MCX on US Fed rate cut hopes, dollar's weakness",https://www.livemint.com/market/commodities/gold-price-today-rates-hit-a-fresh-high-on-mcx-on-us-fed-rate-cut-hopes-dollars-weakness-silver-11766547497557.html,2025-12-24 09:13:58 IST,"MCX gold February futures rose by 0.42% to a record high of  ₹1,38,469 per 10 grams, while MCX silver March contracts jumped almost 2% to reach a fresh peak of  ₹2,23,742 per kg.",https://www.livemint.com/rss/markets
"Stock market today: Trade guide for Nifty 50, global markets to gold price. 8 stocks to buy or sell on Wednesday",https://www.livemint.com/market/stock-market-news/stock-market-today-trade-guide-for-nifty-50-global-markets-to-gold-price-8-stocks-to-buy-or-sell-on-wednesday-11766546345676.html,2025-12-24 09:05:19 IST,"Buy or sell stocks: Experts have recommended eight shares to buy today — HCL Tech, UPL, JSW Infra, Sarda Energy, Syrma SGS, Coforge, Axis Bank, Prestige Estates",https://www.livemint.com/rss/markets
"Last day to buy Gujarat Kidney IPO: Check GMP, subscription status, IPO review - Apply or not?",https://www.livemint.com/market/ipo/gujarat-kidney-ipo-check-ipo-gmp-subscription-status-ipo-review-price-band-and-other-details-should-you-buy-11766545763200.html,2025-12-24 08:57:56 IST,"The IPO of Gujarat Kidney &amp;amp; Super Speciality has a price band of  ₹108-114 per share, with a total size of  ₹250.80 crore. The company plans to use funds for hospital acquisitions and capital expenditure, while facing mixed analyst opinions.",https://www.livemint.com/rss/markets
"Income Tax Refund Status LIVE Updates: I-T Department sends bulk text to taxpayers, says refunds on hold; chaos online",https://www.livemint.com/money/personal-finance/income-tax-refund-status-live-updates-check-refund-status-when-where-how-to-check-24-december-2025-11766544075805.html,2025-12-24 09:12:45 IST,"Income Tax Refund LIVE Updates: The income tax department has reportedly started sending bulk SMS and emails to taxpayers, saying that their refunds had been put on hold due to risk management measures.",https://www.livemint.com/rss/money
"RVNL, IRCTC, Jupiter Wagons shares are running again. Should you ride railway stocks into the Union Budget?",https://economictimes.indiatimes.com/markets/stocks/news/rvnl-irctc-jupiter-wagons-shares-are-running-again-should-you-ride-railway-stocks-into-the-union-budget/articleshow/126153490.cms,2025-12-24 10:47:28 IST,"Railway stocks are back in focus as RVNL, IRCTC, Jupiter Wagons and other rail-linked names rally ahead of the Union Budget 2026. Investors are eyeing potential increases in railway allocations, but analysts caution that pre-Budget spikes may be short-lived without sustained fundamentals.",https://economictimes.indiatimes.com/markets/stocks/rssfeeds/2146843.cms
ESG and Wealth Preservation: How sustainable investing fits into HNI portfolios,https://economictimes.indiatimes.com/markets/stocks/news/esg-and-wealth-preservation-how-sustainable-investing-fits-into-hni-portfolios/articleshow/126153351.cms,2025-12-24 10:37:06 IST,"For HNIs, investing is increasingly focused on capital protection, risk management and long-term sustainability, not just returns. ESG investing has become a key framework globally, shaping how investors assess business quality and influencing capital allocation decisions among U.S. investors, Indian HNIs and family offices.",https://economictimes.indiatimes.com/markets/stocks/rssfeeds/2146843.cms
Websol Energy System shares rally 14% after Rs 73 crore tax bombshell is defused,https://economictimes.indiatimes.com/markets/stocks/news/websol-energy-system-shares-rally-14-after-rs-73-crore-tax-bombshell-is-defused/articleshow/126153108.cms,2025-12-24 10:19:03 IST,"Websol Energy System shares jumped as much as 14% after the company won a key tax appeal, with authorities setting aside a Rs 73.04 crore demand for FY18. The ruling removes a major contingent liability from the solar firm’s books, triggering a sharp relief rally despite the stock being down 46% so far in 2025.",https://economictimes.indiatimes.com/markets/stocks/rssfeeds/2146843.cms
Carnage-hit media stocks plunge up to 40% in 2025 but Ranbir Kapoor-backed scrip flashes Animal spirits,https://economictimes.indiatimes.com/markets/stocks/news/carnage-hit-media-stocks-plunge-up-to-40-in-2025-but-ranbir-kapoor-backed-scrip-flashes-animal-spirits/articleshow/126152933.cms,2025-12-24 10:08:43 IST,"The media sector is ending 2025 as a poor performer, with most Nifty Media index stocks experiencing double-digit declines. Prime Focus, however, stands out with significant gains. Analysts attribute the sector's struggles to a shift in consumer habits towards digital platforms and a lack of innovation in traditional media.",https://economictimes.indiatimes.com/markets/stocks/rssfeeds/2146843.cms
"Vikran Engineering shares zoom 15% on Rs 2,035 crore solar EPC order win",https://economictimes.indiatimes.com/markets/stocks/news/vikran-engineering-shares-zoom-15-on-rs-2035-crore-solar-epc-order-win/articleshow/126152655.cms,2025-12-24 09:51:49 IST,"Vikran Engineering shares rose sharply on Wednesday after the company secured a Rs 2,035 crore EPC order from Onix Renewables for developing 600 MW AC solar projects in Maharashtra. The turnkey project, to be completed in 12 months, strengthens Vikran’s renewable energy portfolio and boosts its order book.",https://economictimes.indiatimes.com/markets/stocks/rssfeeds/2146843.cms
"Rupee forwards retreat after central bank unveils FX swap, spot treads water",https://www.livemint.com/market/rupee-forwards-retreat-after-central-bank-unveils-fx-swap-spot-treads-water-11766552514378.html,2025-12-24 10:31:53 IST,"INDIA-MARKETS/RUPEE (UPDATE 1):INDIA RUPEE-Rupee forwards retreat after central bank unveils FX swap, spot treads water",https://www.livemint.com/rss/markets
"Hindustan Copper share price hits 52-week high, rises 70% in YTD. Here's why",https://www.livemint.com/market/stock-market-news/hindustan-copper-share-price-hits-52-week-high-rises-70-in-ytd-heres-why-11766548957015.html,2025-12-24 10:28:15 IST,"Hindustan Copper share price today opened with an upside gap at  ₹418 apiece on the NSE and touched an intraday high of  ₹430.50, rising 5% in the Opening Bell",https://www.livemint.com/rss/markets
"Marc Technocrats IPO listing: Shares debut at 20% discount, extend fall to hit lower circuit",https://www.livemint.com/market/ipo/marc-technocrats-ipo-listing-shares-debut-at-20-discount-extend-fall-to-hit-lower-circuit-11766550867689.html,2025-12-24 10:06:34 IST,"Marc Technocrats IPO listing: Marc Technocrats shares opened at  ₹74.40, a 20% discount to the issue price of  ₹93. The SME stock extended its losses and hit its lower circuit of  ₹70.70, a 24% fall with respect to the issue price.",https://www.livemint.com/rss/markets
Indian bonds rally as RBI unveils $32 billion cash-infusion plan,https://www.livemint.com/news/indian-bonds-rally-as-rbi-unveils-32-billion-cash-infusion-plan-11766549558713.html,2025-12-24 09:49:07 IST,"The yield on the benchmark 10-year bond fell as much as eight basis points on Wednesday, the most since Aug. 14, to 6.56%.",https://www.livemint.com/rss/markets
"As PE firms return to schools, Kedaara-backed K-12 Techno looks to raise $150-200 million",https://www.livemint.com/companies/start-ups/k12-techno-services-pe-deal-orchids-the-international-school-education-industry-11766469247044.html,2025-12-24 10:28:58 IST,"The talks come amid renewed private equity interest in K-12 education, with investors increasingly favouring platform-led consolidation over backing individual school assets",https://www.livemint.com/rss/companies
5 practical steps to avoid legal action after a personal loan default,https://www.livemint.com/money/personal-finance/5-practical-steps-to-avoid-legal-action-after-a-personal-loan-default-11766487520150.html,2025-12-24 10:27:57 IST,"A personal loan default can lead to legal action, but timely communication, repayment planning, restructuring options and understanding recovery rules can help borrowers reduce risk and protect credit health.",https://www.livemint.com/rss/money
