title,link,published,summary,source
Negative Breakout: These 8 stocks cross below their 200 DMAs,https://economictimes.indiatimes.com/markets/stocks/news/negative-breakout-these-8-stocks-cross-below-their-200-dmas/slideshow/130743266.cms,2026-05-04 07:26:45 IST,The 200 DMA is used as a key indicator by traders for determining the overall trend in a particular stock.,https://economictimes.indiatimes.com/markets/stocks/rssfeeds/2146843.cms
"West Bengal, Assam among 5 state election results today. 10 things stock market investors should track under volatility",https://economictimes.indiatimes.com/markets/stocks/news/west-bengal-assam-among-5-state-election-results-today-10-things-stock-market-investors-should-track-under-volatility/articleshow/130742547.cms,2026-05-04 07:11:00 IST,"Vote counting for assembly elections in West Bengal, Assam, Tamil Nadu, Kerala, and Puducherry begins today. Equity traders anticipate a volatile trading week. Early trends are expected within two hours, with clearer leads by late morning. Investors are advised to focus on broader macro signals beyond political headlines. Crude oil prices and foreign fund flows remain significant market drivers.",https://economictimes.indiatimes.com/markets/stocks/rssfeeds/2146843.cms
Bullish start likely for Dalal Street as GIFT Nifty advances 100 points,https://economictimes.indiatimes.com/markets/stocks/news/pre-market-action-heres-the-trade-setup-for-todays-session/articleshow/130742491.cms,2026-05-04 06:30:49 IST,"Indian markets opened weak on Thursday, experiencing a partial recovery but remaining in the red. Persistent FII outflows, a weak rupee, and elevated crude oil prices are expected to keep markets sideways. The India VIX rose, indicating increased market fear, while the rupee gained slightly against the US dollar.",https://economictimes.indiatimes.com/markets/stocks/rssfeeds/2146843.cms
"Stocks in news: Kotak Mahindra Bank, DMart, Vodafone Idea, Nestle India, Coal India",https://economictimes.indiatimes.com/markets/stocks/news/stocks-in-news-kotak-mahindra-bank-dmart-vodafone-idea-nestle-india-coal-india/articleshow/130742435.cms,2026-05-04 06:25:49 IST,"Markets closed the week with modest gains amidst a volatile trading environment. Key domestic triggers include financial results from Kotak Mahindra Bank, DMart, and Nestle India, while global cues like crude oil prices and the rupee's movement will be closely watched. Vodafone Idea's AGR chapter closure and Coal India's production dip are also significant.",https://economictimes.indiatimes.com/markets/stocks/rssfeeds/2146843.cms
"Short covering fuels April rally, stock-specific action to continue in May",https://economictimes.indiatimes.com/markets/stocks/news/short-covering-fuels-april-rally-stock-specific-action-to-continue-in-may/articleshow/130742199.cms,2026-05-04 06:10:35 IST,"Analysts are identifying stock-specific opportunities for May following April's short-covering rally.  Bullish bets include Sun Pharma, Adani Ports, ONGC, Sona BLW, Bharti Airtel, ITC, and Kotak Mahindra Bank, with specific price targets and stop-losses. Conversely, Tata Motors Passenger Vehicles shows bearish sentiment with a potential downside target.",https://economictimes.indiatimes.com/markets/stocks/rssfeeds/2146843.cms
"Pharma Q4 outlook mixed: Hospitals steady, generics face revlimid drag",https://economictimes.indiatimes.com/markets/stocks/news/pharma-q4-outlook-mixed-hospitals-steady-generics-face-revlimid-drag/articleshow/130742088.cms,2026-05-04 06:00:55 IST,"Indian pharma and healthcare firms face a mixed March quarter. While hospitals anticipate steady growth, generic drugmakers grapple with lost Revlimid sales and pricing challenges. Lupin and Divi's are poised for strong performance, with Sun Pharma and Torrent showing resilience. Apollo Hospitals expects robust traction across its diverse segments.",https://economictimes.indiatimes.com/markets/stocks/rssfeeds/2146843.cms
"Nifty may keep to 23,500–24,800 range amid high oil prices, war uncertainty",https://economictimes.indiatimes.com/markets/stocks/news/nifty-may-keep-to-2350024800-range-amid-high-oil-prices-war-uncertainty/articleshow/130741898.cms,2026-05-04 05:49:11 IST,"Nifty is expected to trade within a narrow range of 23,500–24,800 due to geopolitical tensions and high oil prices. Analysts suggest a mildly positive bias, with specific trading strategies and stock picks like ITC and Tube Investments recommended for potential gains.",https://economictimes.indiatimes.com/markets/stocks/rssfeeds/2146843.cms
"Resurgent in April, can bulls defy 'Sell in May' maxim?",https://economictimes.indiatimes.com/markets/stocks/news/resurgent-in-april-can-bulls-defy-sell-in-may-maxim/articleshow/130741765.cms,2026-05-04 05:32:16 IST,"Indian stock markets may see continued gains in May. Investors should resist the urge to sell. While a repeat of April's strong rally is unlikely, key indices have historically performed well in May. Moderate, stock-specific moves are expected. Elevated oil prices and a strong dollar could limit significant upside.",https://economictimes.indiatimes.com/markets/stocks/rssfeeds/2146843.cms
Stock Radar: Down over 20% from highs! Jio Financial Services stock showing signs of bottoming out,https://economictimes.indiatimes.com/markets/stocks/news/stock-radar-down-over-20-from-highs-jio-financial-services-stock-showing-signs-of-bottoming-out/articleshow/130631736.cms,2026-05-04 05:00:00 IST,"Jio Financial Services has established a strong base above 220 and broken out of a two-month inverse head-and-shoulders pattern, signaling building bullish momentum. Experts suggest short-term traders with a high-risk profile can buy for a target of Rs 280 in the coming weeks.",https://economictimes.indiatimes.com/markets/stocks/rssfeeds/2146843.cms
Third party premiums take the wheel in motor cover growth,https://economictimes.indiatimes.com/markets/stocks/news/third-party-premiums-take-the-wheel-in-motor-cover-growth/articleshow/130741987.cms,2026-05-04 01:13:16 IST,"TP premiums rose 9.3% in FY26, compared with 9% growth in OD, taking overall motor insurance expansion to about 9% on an estimated base of ?1.08 lakh crore. This contrasts with FY24, when OD grew a stronger 17.4% against roughly 10% for TP, supported by robust vehicle sales and pricing improvements. In FY25, OD grew at 8.1% while TP grew at 7.8%. The latest shift comes despite no increase in regulated TP premium rates since the pandemic.",https://economictimes.indiatimes.com/markets/stocks/rssfeeds/2146843.cms
Public sector banks rush to build up wealth management assets,https://economictimes.indiatimes.com/markets/stocks/news/public-sector-banks-rush-to-build-up-wealth-management-assets/articleshow/130741966.cms,2026-05-04 01:02:18 IST,"The move is aimed at improving customer engagement as household savings shift from bank deposits to market-linked instruments and risk products. Indian Bank plans to set up a wealth management vertical targeting high net worth individuals, while sectoral leader State Bank of India aims to grow its wealth assets under management fivefold to Rs 15 lakh crore by 2030.",https://economictimes.indiatimes.com/markets/stocks/rssfeeds/2146843.cms
Tax shadow over charitable trusts with 'profit' motive,https://economictimes.indiatimes.com/markets/stocks/news/tax-shadow-over-charitable-trusts-with-profit-motive/articleshow/130741720.cms,2026-05-04 00:33:39 IST,Three top-notch hospitals in Mumbai and a famous international spiritual organisation-all functioning as charitable trusts-have been denied Income tax (I-T) exemption on the grounds that they were carrying out commercial activities.,https://economictimes.indiatimes.com/markets/stocks/rssfeeds/2146843.cms
"Sensex, Nifty 50 | Stock Market LIVE: Gift Nifty signals firm start for Indian market; Assembly election results eyed",https://www.livemint.com/market/stock-market-news/stock-market-sensex-nifty-50-live-gift-nifty-us-iran-war-crude-oil-prices-gold-rate-assembly-election-results-4-may-2026-11777861406580.html,2026-05-04 08:00:54 IST,"Sensex, Nifty 50 | Stock Market LIVE: Globally, Asian markets traded higher, while the US stock market ended mixed, with the S&amp;P 500 and the Nasdaq posting record closing highs.",https://www.livemint.com/rss/markets
"Raja Venkatraman, MarketSmith recommend five stocks for 4 May",https://www.livemint.com/market/stock-market-news/raja-venkatraman-marketsmith-recommend-five-stocks-for-4-may-11777858578104.html,2026-05-04 07:44:35 IST,"After a dip in late April, Indian markets may start positively on May 4, driven by a favourable Gift Nifty. Analysts recommend buying stocks such as Syngene International and DCM Shriram, highlighting their growth potential despite recent market volatility.",https://www.livemint.com/rss/markets
Emerging Assets Climb on Iran’s New Proposal in Thin Trading,https://www.livemint.com/market/emerging-assets-climb-on-iran-s-new-proposal-in-thin-trading-11777859786364.html,2026-05-04 07:26:26 IST,"Emerging-market benchmarks for stocks and currencies advanced in thin holiday trading, as Iran delivered a new proposal to the US via Pakistan over the Strait of Hormuz, pushing crude lower.",https://www.livemint.com/rss/markets
"Nifty 50, Sensex prediction today: Check how Indian stock market is expected to trade on 4 May",https://www.livemint.com/market/stock-market-news/nifty-50-sensex-prediction-today-check-how-indian-stock-market-is-expected-to-trade-on-4-may-11777859138023.html,2026-05-04 07:25:24 IST,"Nifty 50, Sensex prediction today: The trends on Gift Nifty also indicate a positive start for the Indian benchmark index. The Gift Nifty was trading around 24,240 level, a premium of nearly 142 points from the Nifty futures’ previous close.",https://www.livemint.com/rss/markets
"Buy or sell: Gift Nifty signals gap-up opening, Vaishali Parekh recommends three stocks to buy today — 4 May 2026",https://www.livemint.com/market/stock-market-news/buy-or-sell-gift-nifty-signals-gap-up-opening-vaishali-parekh-recommends-three-stocks-to-buy-today-4-may-2026-11777857599550.html,2026-05-04 07:15:35 IST,"Buy or sell: Gift Nifty up, Vaishali Parekh recommends three stocks to buy today — Thirumalai Chemicals, CESC, and Bharat Dynamics",https://www.livemint.com/rss/markets
"Stocks to watch: BHEL, Kotak Mahindra, Adani Enterprises among 10 shares in focus today",https://www.livemint.com/market/stock-market-news/stocks-to-watch-bhel-kotak-mahindra-adani-enterprises-among-10-shares-in-focus-today-11777857024146.html,2026-05-04 07:15:10 IST,"Stock market today: The Indian stock market is likely to snap its losing streak as trends in the Gift Nifty index signalled a positive opening on Monday. Amid this backdrop, these stocks will remain in focus on Monday, 4 May.",https://www.livemint.com/rss/markets
"From Gift Nifty, Kospi, Nasdaq rally to crude oil prices: 8 key things that changed for Indian stock market over weekend",https://www.livemint.com/market/stock-market-news/from-gift-nifty-kospi-nasdaq-rally-to-crude-oil-prices-8-key-things-that-changed-for-indian-stock-market-over-weekend-11777858020966.html,2026-05-04 07:05:52 IST,"Gift Nifty was trading around 24,245 level, a premium of nearly 147 points from the Nifty futures’ previous close, indicating a positive start for the Indian stock market indices.",https://www.livemint.com/rss/markets
"Australian shares fall in broad-based losses, NAB slips on missing earnings estimate",https://www.livemint.com/market/australian-shares-fall-in-broad-based-losses-nab-slips-on-missing-earnings-estimate-11777858135160.html,2026-05-04 06:58:54 IST,"AUSTRALIA-STOCKS/ MIDDAY:Australian shares fall in broad-based losses, NAB slips on missing earnings estimate",https://www.livemint.com/rss/markets
Breakout stocks to buy or sell: Sumeet Bagadia recommends five shares to buy today — 4 May 2026,https://www.livemint.com/market/stock-market-news/breakout-stocks-to-buy-or-sell-sumeet-bagadia-recommends-five-shares-to-buy-today-4-may-2026-11777855317521.html,2026-05-04 06:31:59 IST,The Indian stock market ended Thursday's session on a negative note. Sumeet Bagadia of Choice Broking recommends five breakout stocks to buy today.,https://www.livemint.com/rss/markets
Yen steady as intervention fears linger with Japan shut for holidays,https://www.livemint.com/market/yen-steady-as-intervention-fears-linger-with-japan-shut-for-holidays-11777854813552.html,2026-05-04 06:03:33 IST,GLOBAL-FOREX/:FOREX-Yen steady as intervention fears linger with Japan shut for holidays,https://www.livemint.com/rss/markets
Stock recommendations for 4 May from MarketSmith India,https://www.livemint.com/market/stock-market-news/stock-recommendations-marketsmith-india-sensex-nifty-11777550518687.html,2026-05-04 06:01:13 IST,"MarketSmith India reveals its top stock recommendations for today, 4 May. Get expert insights into the best-performing stocks to guide your investment decisions.",https://www.livemint.com/rss/markets
RBI’s forex gamble may steady the rupee but weigh on investor sentiment,https://www.livemint.com/market/rbi-forex-cap-rupee-stability-investor-sentiment-india-market-fragmentation-11777790683126.html,2026-05-04 06:00:53 IST,"Experts are divided on the long-term implications. While some warn of unintended consequences, others see the curbs as necessary.",https://www.livemint.com/rss/markets
Kotak Mahindra Bank needs to catch up with its peers in cost efficiency,https://www.livemint.com/market/mark-to-market/kotak-mahindra-bank-q4-results-cost-efficiency-challenges-peer-performance-11777801990338.html,2026-05-04 06:00:33 IST,"The pursuit of growth in safer, secured segments such as home loans is good for asset quality. However, it does not help in expanding NIM. Unsecured loans hold the key to better profitability.",https://www.livemint.com/rss/markets
Stocks to trade: Raja Venkatraman recommends 3 stocks for 4 May,https://www.livemint.com/market/stock-market-news/stocks-to-trade-raja-venkatraman-recommendations-3-stocks-for-4-may-11777805369975.html,2026-05-04 06:00:33 IST,Market expert Raja Venkatraman shares his top stock picks for 4 May. Here’s his technical outlook and trade strategy.,https://www.livemint.com/rss/markets
Nifty bulls eye 500-point rally on peace hopes and Bengal buzz,https://www.livemint.com/market/nifty-bulls-eye-500-point-rally-on-peace-hopes-and-bengal-buzz-11777784216177.html,2026-05-04 05:50:52 IST,"Growing anticipation of a peace deal in West Asia, with both sides preferring negotiations over renewed fighting, and expectations of a win for the BJP in the West Bengal assembly elections have fuelled bullish sentiment.",https://www.livemint.com/rss/markets
A key moment at Tata Trusts as it votes on the reappointment of two vice chairmen at its wealthiest affiliate,https://www.livemint.com/companies/tata-trusts-on-the-reappointment-of-two-vice-chairmen-venu-srinivasan-and-vijay-singh-noel-tata-11777803029151.html,2026-05-04 06:00:53 IST,"An important fallout of the vote will be whether both Srinivasan and Singh can continue as vice-chairmen of Tata Trusts; an adverse outcome would prevent them from holding the titles, as the chairman and vice-chairmen must be trustees of all Tata Trusts.",https://www.livemint.com/rss/companies
"Indian equities deserve higher FII allocation, but valuations stretched",https://www.livemint.com/companies/indian-equities-deserve-higher-fii-allocation-but-valuations-stretched-11777786796784.html,2026-05-04 06:00:53 IST,"India merits a higher allocation given its structural strengths. While the underlying business is strong, the valuations are not attractive, said Ramneek Kundra, chief investment officer at DSP Pension Fund Managers. But India’s premium to emerging markets has come down.",https://www.livemint.com/rss/companies
"White Whale bets on Blue Tokai, Atomberg via secondaries fund",https://www.livemint.com/companies/start-ups/blue-tokai-atomberg-draw-secondary-bets-as-white-whale-hits-first-close-11777745389298.html,2026-05-04 05:54:52 IST,"The Mumbai-based venture capital firm, which also backs startups such as M2P Fintech and iD Fresh, has completed the first close of the fund and expects to reach the final close within the next 12-18 months, co-founder Shapath Parikh told Mint.",https://www.livemint.com/rss/companies
How Infosys is adapting as GCCs move outsourcing work in-house,https://www.livemint.com/companies/how-infosys-is-adapting-gccs-move-outsourcing-work-in-house-ai-topaz-11777800258150.html,2026-05-04 05:30:12 IST,"The Bengaluru-based IT major has mandated dedicated GCC offerings with embedded AI capabilities across its delivery centres, while also setting aside capacity within its campuses to incubate client-owned tech hubs.",https://www.livemint.com/rss/companies
"New Boss, Same Playbook: Berkshire signals stability post-Buffett era",https://economictimes.indiatimes.com/markets/stocks/news/new-boss-same-playbook-berkshire-signals-stability-post-buffett-era/slideshow/130758604.cms,2026-05-04 11:21:02 IST,"Berkshire Hathaway enters new era under Greg Abel, maintaining Warren Buffett’s legacy, emphasizing disciplined capital allocation, strong operations, cautious AI stance, and long-term value creation amid evolving leadership dynamics.",https://economictimes.indiatimes.com/markets/stocks/rssfeeds/2146843.cms
Tamil Nadu election impact: Sun TV Network shares plunge 10% as Vijay’s TVK heads for big upset,https://economictimes.indiatimes.com/markets/stocks/news/tamil-nadu-election-impact-sun-tv-network-shares-plunge-10-as-vijays-tvk-heads-for-big-upset/articleshow/130755787.cms,2026-05-04 11:18:41 IST,"Actor-turned-politician C Joseph Vijay's Tamilaga Vettri Kazhagam (TVK) is poised to disrupt Tamil Nadu's long-standing Dravidian party dominance, leading in 108 seats. This unexpected surge has sent shockwaves through the political landscape, impacting established players like the DMK and AIADMK. Sun TV Network shares saw a significant dip amid these electoral trends.",https://economictimes.indiatimes.com/markets/stocks/rssfeeds/2146843.cms
"Oil Shock, Jobs Data &amp; Global Risks: Markets brace for a volatile week",https://economictimes.indiatimes.com/markets/stocks/news/oil-shock-jobs-data-global-risks-markets-brace-for-a-volatile-week/slideshow/130756611.cms,2026-05-04 11:01:18 IST,"Global markets enter a volatile week as oil prices surge amid Middle East tensions, raising inflation and growth concerns. Investors track US jobs data, central bank signals, and geopolitical risks. While strong earnings and AI momentum offer support, uncertainty around policy, energy costs, and political developments may drive market direction.",https://economictimes.indiatimes.com/markets/stocks/rssfeeds/2146843.cms
"Vedanta shares jump 5% after demerger. Should buy, sell or hold the stock?",https://economictimes.indiatimes.com/markets/stocks/news/vedanta-shares-jump-5-after-demerger-should-buy-sell-or-hold-the-stock/articleshow/130752532.cms,2026-05-04 10:33:41 IST,"Vedanta shares surged after its demerger into four entities, with analysts highlighting improved business focus but increased concentration risks. Brokerages remain optimistic on upside potential, supported by strong Q4 earnings, while advising caution for new investors amid ongoing price discovery and evolving valuations of the separated businesses.",https://economictimes.indiatimes.com/markets/stocks/rssfeeds/2146843.cms
Equitas Small Finance Bank shares rally 7% on 5-fold jump in Q4 profit to Rs 213 crore,https://economictimes.indiatimes.com/markets/stocks/news/equitas-small-finance-bank-shares-rally-7-on-5-fold-jump-in-q4-profit-to-rs-213-crore/articleshow/130751840.cms,2026-05-04 10:25:32 IST,"Equitas Small Finance Bank shares saw a significant 7% rise. This surge followed the bank's announcement of a substantial 406% increase in its fourth-quarter net profit for FY26. The lender's strong performance was attributed to business expansion and improved asset quality. Advances and disbursements also showed robust growth. The bank's profitability metrics improved, with net interest margin rising.",https://economictimes.indiatimes.com/markets/stocks/rssfeeds/2146843.cms
"DMart shares fall 4% after Q4 results. What are Goldman Sachs, Morgan Stanley, others saying?",https://economictimes.indiatimes.com/markets/stocks/news/dmart-shares-fall-4-after-q4-results-what-are-goldman-sachs-morgan-stanley-others-saying/articleshow/130748475.cms,2026-05-04 09:47:45 IST,"DMart Share Price: Avenue Supermarts shares fell on Monday. The company reported a 19% rise in net profit and revenue for the March quarter of FY26. It also added 58 new stores, crossing the 500 DMart store milestone. Experts offer mixed views. Morgan Stanley and Motilal Oswal maintain positive ratings, citing store expansion and improving trends.",https://economictimes.indiatimes.com/markets/stocks/rssfeeds/2146843.cms
"Unfazed by 670X P/E, retail investors add Eternal on dips for 2nd quarter as stock trades 30% off peak",https://economictimes.indiatimes.com/markets/stocks/news/unfazed-by-670x-p/e-retail-investors-add-eternal-on-dips-for-2nd-quarter-as-stock-trades-30-off-peak/articleshow/130748268.cms,2026-05-04 09:44:09 IST,"Retail investors are showing confidence in Eternal, a food delivery and quick commerce firm. They are buying its shares on price dips, undeterred by a high valuation. This trend continues for the second quarter. Meanwhile, mutual funds are increasing their holdings, while foreign institutional investors are reducing theirs. The company has reported strong revenue growth and improved profitability.",https://economictimes.indiatimes.com/markets/stocks/rssfeeds/2146843.cms
Top Nifty50 stocks analysts suggest buying in this volatile week,https://economictimes.indiatimes.com/markets/stocks/news/top-nifty50-stocks-analysts-suggest-buying-in-this-volatile-week/articleshow/130748127.cms,2026-05-04 09:42:02 IST,"Stock Reports Plus, powered by Refinitiv, is a comprehensive report that evaluates five key components of 4,000+ listed stocks – earnings, fundamentals, relative valuation, risk, and price momentum – to generate standardised scores. The simple average of the above-mentioned five component ratings is normally distributed to reach an average score.",https://economictimes.indiatimes.com/markets/stocks/rssfeeds/2146843.cms
"Kotak Mahindra Bank shares tank 5% after Q4 results. What Morgan Stanley, Nomura, other brokerages are saying",https://economictimes.indiatimes.com/markets/stocks/news/kotak-mahindra-bank-shares-tank-5-after-q4-results-what-morgan-stanley-nomura-other-brokerages-are-saying/articleshow/130748095.cms,2026-05-04 09:35:02 IST,"Shares of Kotak Mahindra Bank fell despite posting a solid Q4FY26 performance, with net profit rising 13.3% YoY and NII up 8.1%. Asset quality improved, with both gross and net NPAs declining. Despite the positive results, the stock slipped, but Morgan Stanley remains bullish, maintaining an “Overweight” rating",https://economictimes.indiatimes.com/markets/stocks/rssfeeds/2146843.cms
"Why is market rising today? Sensex surges 600 pts, Nifty above 24,150. West Bengal election trends among 5 factors",https://economictimes.indiatimes.com/markets/stocks/news/sensex-rises-650-points-nifty-above-24000-as-markets-assess-early-trends-in-state-elections/articleshow/130746939.cms,2026-05-04 09:28:31 IST,"Indian stock markets surged on Monday, with Sensex and Nifty rising nearly 1% as investors closely assessed early trends in West Bengal and other state election results. Broad-based optimism saw major indices and sectors gain, though Kotak Mahindra Bank bucked the trend. Analysts suggest the election impact will be short-term.",https://economictimes.indiatimes.com/markets/stocks/rssfeeds/2146843.cms
Vodafone Idea shares rally 8% after govt cuts AGR dues by 27%. Time to buy?,https://economictimes.indiatimes.com/markets/stocks/news/vodafone-idea-shares-in-focus-after-govt-cuts-agr-dues-by-27-time-to-buy/articleshow/130746953.cms,2026-05-04 09:21:06 IST,"Vodafone Idea shares are in focus after the government reduced AGR dues by 27% to Rs 64,046 crore, easing financial stress. The move, along with a structured repayment plan, has improved investor sentiment, with Citi issuing a bullish call, citing better prospects for fundraising and network expansion.",https://economictimes.indiatimes.com/markets/stocks/rssfeeds/2146843.cms
"Buy, Sell or Hold: Morgan Stanley maintains buy on Kotak Bank; Goldman Sachs retains sell on DMart",https://economictimes.indiatimes.com/markets/stocks/news/buy-sell-or-hold-morgan-stanley-maintains-buy-on-lotak-bank-goldman-sachs-retail-sell-on-avenue-supermarts/articleshow/130744856.cms,2026-05-04 08:59:10 IST,"Brokerages are selectively approaching the market. Morgan Stanley is positive on Kotak Mahindra Bank due to strong earnings and attractive valuations. They maintain a neutral stance on Hindustan Unilever despite steady demand. Goldman Sachs remains cautious on Avenue Supermarts, citing demand sustainability and valuation concerns. The focus is on earnings visibility and balance sheet strength.",https://economictimes.indiatimes.com/markets/stocks/rssfeeds/2146843.cms
