title,link,published,summary,source
RBI promises pre-emptive liquidity action to ensure policy transmission; keeps repo rate at 5.25%,https://economictimes.indiatimes.com/markets/stocks/news/rbi-promises-pre-emptive-liquidity-action-to-ensure-policy-transmission-keeps-repo-rate-at-5-25/articleshow/127971222.cms,2026-02-06 11:05:44 IST,"The Reserve Bank of India maintained the repo rate at 5.25% and will proactively manage liquidity to ensure effective monetary policy transmission. The central bank also plans to remove the Rs 2.5 lakh crore limit for investments under the Voluntary Retention Route, while projecting comfortable inflation for FY26.",https://economictimes.indiatimes.com/markets/stocks/rssfeeds/2146843.cms
Fractal Analytics IPO opens Feb 9; GMP signals 7% listing gain. Key details here,https://economictimes.indiatimes.com/markets/stocks/news/fractal-analytics-ipo-opens-feb-9-gmp-signals-7-listing-gain-key-details-here/articleshow/127971210.cms,2026-02-06 10:54:24 IST,"Fractal Analytics, a leading Indian AI firm, is launching a Rs 2,833.90 crore IPO on February 9, marking India's first pure-play AI company to go public. With a grey market premium suggesting a potential 7% listing gain, the issue aims to fund growth and innovation. Investors can participate in India's burgeoning AI sector.",https://economictimes.indiatimes.com/markets/stocks/rssfeeds/2146843.cms
"Meesho slides 40% from peak, slips below listing price. Here is why brokerages still see 26% upside",https://economictimes.indiatimes.com/markets/stocks/news/meesho-slides-40-from-peak-slips-below-listing-price-here-is-why-brokerages-still-see-26-upside/articleshow/127970051.cms,2026-02-06 10:20:12 IST,"Meesho shares have fallen nearly 40% from their peak after Q3 losses widened sharply, slipping below the listing price. Despite near-term margin pressures and concerns over growth sustainability, foreign brokerages UBS and BofA remain constructive, citing strong revenue growth, improving logistics efficiency and long-term user expansion.",https://economictimes.indiatimes.com/markets/stocks/rssfeeds/2146843.cms
"Hitachi Energy India shares soar 14% as Q3 net profit jumps 90%. Should you buy, sell or hold?",https://economictimes.indiatimes.com/markets/stocks/news/hitachi-energy-india-shares-soar-14-as-q3-net-profit-jumps-90-should-you-buy-sell-or-hold/articleshow/127969881.cms,2026-02-06 10:16:07 IST,"Hitachi Energy India shares surged 14% after the company reported a 90% year-on-year jump in Q3 net profit, aided by strong execution, margin expansion and a record order backlog. Brokerages remain bullish, citing earnings visibility, robust order flows and improving operating leverage.",https://economictimes.indiatimes.com/markets/stocks/rssfeeds/2146843.cms
Amazon shares crash over 11% after-market hours. What triggered the sell-off in FAANG stock,https://economictimes.indiatimes.com/markets/stocks/news/amazon-shares-crash-over-11-after-market-hours-what-triggered-the-sell-off-in-faang-stock/articleshow/127969323.cms,2026-02-06 09:59:50 IST,"Amazon’s stock fell more than 11% in after-hours trading after the company said it would raise capital spending by nearly 60% to about $200 billion this year, sparking investor concerns over rising AI-related costs. The decline came despite strong fourth-quarter results, with revenue rising 14% to $213.4 billion.",https://economictimes.indiatimes.com/markets/stocks/rssfeeds/2146843.cms
Indian IT stocks set for worst week in four months as AI jitters deepen,https://economictimes.indiatimes.com/markets/stocks/news/indian-it-stocks-set-for-worst-week-in-four-months-as-ai-jitters-deepen/articleshow/127968914.cms,2026-02-06 09:50:17 IST,"In a dramatic turn of events, Indian software shares fell sharply this Friday, leading to their toughest week in over four months. The spotlight is on artificial intelligence anxieties, which are weighing heavy on the high-margin income of IT companies.",https://economictimes.indiatimes.com/markets/stocks/rssfeeds/2146843.cms
"Hero MotoCorp shares in focus as Q3 profit jumps 14%, board declares Rs 110 interim dividend",https://economictimes.indiatimes.com/markets/stocks/news/hero-motocorp-shares-in-focus-as-q3-profit-jumps-14-board-declares-rs-110-interim-dividend/articleshow/127968514.cms,2026-02-06 09:35:10 IST,"Hero MotoCorp reported a 14% year-on-year rise in Q3FY26 consolidated profit to Rs 1,268 crore, driven by strong volumes and better realisations, with revenue jumping 22% to Rs 12,487 crore. The company also announced an interim dividend of Rs 110 per share and a Rs 275 crore investment in Euler Motors.",https://economictimes.indiatimes.com/markets/stocks/rssfeeds/2146843.cms
ETMarkets Smart Talk: Amit Gupta on why STT hike may cool speculative F&amp;O trades without hurting investors,https://economictimes.indiatimes.com/markets/stocks/news/etmarkets-smart-talk-amit-gupta-on-why-stt-hike-may-cool-speculative-fo-trades-without-hurting-investors/articleshow/127968410.cms,2026-02-06 09:32:26 IST,"A recent hike in Securities Transaction Tax on derivatives aims to curb excessive speculation. Experts believe this move will impact high-frequency, low-margin trades. Long-term investors are unlikely to be affected. Valuations, earnings, and currency stability are key factors for foreign investor flows. The market faces a challenging period requiring balanced preparation.",https://economictimes.indiatimes.com/markets/stocks/rssfeeds/2146843.cms
"Nifty, Sensex slip after RBI holds repo rate; rate-sensitive stocks drag, Nifty PSU Bank drops 1.6%",https://www.livemint.com/market/stock-market-news/nifty-50-sensex-slip-after-rbi-holds-repo-rate-rate-sensitive-stocks-drag-nifty-auto-drops-1-nifty-bank-falls-11770352983391.html,2026-02-06 10:33:16 IST,"Indian stock market indices, Sensex and Nifty 50, fell on Friday after RBI kept the repo rate unchanged at 5.25%. Sensex dropped 368 points to 82,945.56, while Nifty 50 fell 136 points to 25,504.6, with rate-sensitive sectors also trading negatively.",https://www.livemint.com/rss/markets
"Bitcoin slumps below $65,000 — lowest in over a year. Here's what experts expect from crypto markets",https://www.livemint.com/market/cryptocurrency/bitcoin-price-today-slumps-64352-lowest-over-year-here-what-experts-expect-tokens-crypto-currency-markets-cap-2-trillion-11770350395461.html,2026-02-06 10:19:58 IST,"Bitcoin slumps below $65,000 in lowest price in over a year amid Trump's presidency. Here's what experts and watchers expect from the cryptocurrency markets amid extreme fear and selling pressure.",https://www.livemint.com/rss/markets
RBI MPC Policy: Central bank revises inflation estimate upward to 2.1% for FY26,https://www.livemint.com/market/stock-market-news/rbi-mpc-policy-central-bank-revises-inflation-estimate-upward-to-2-1-for-fy26-11770352521317.html,2026-02-06 10:12:57 IST,"RBI MPC Policy: The RBI has revised its inflation forecast for 2025-2026 to 2.1% and projected CPI inflation for Q1 and Q2 of 2026-27 at 4% and 4.2%, respectively. The MPC maintained the repo rate at 5.25% and a neutral policy stance.",https://www.livemint.com/rss/markets
RBI MPC meeting: Repo rate unchanged at 5.25%—5 key takeaways from February monetary policy decision,https://www.livemint.com/market/stock-market-news/rbi-mpc-meeting-repo-rate-interest-rate-gdp-inflation-highlights-key-takeaways-february-monetary-policy-decision-11770351225178.html,2026-02-06 10:04:50 IST,"RBI MPC decided to keep the repo rate unchanged at 5.25%, while maintaining a neutral policy stance. RBI governor Sanjay Malhotra announced the status quo on the policy interest rate, highlighting that the Indian economy remains on a strong footing.",https://www.livemint.com/rss/markets
"CKK Retail Mart share price makes flat debut; SME IPO lists at  ₹163, same as issue price",https://www.livemint.com/market/stock-market-news/ckk-retail-mart-share-price-makes-flat-debut-sme-ipo-lists-at-rs-163-on-nse-sme-same-as-issue-price-11770351680755.html,2026-02-06 10:01:46 IST,"CKK Retail Mart made a subdued debut on the stock market, listing at  ₹163 on NSE SME and  ₹155.60 on BSE. The IPO was subscribed 1.63 times, with significant interest from retail investors. The company aims to use proceeds for expansion and working capital.",https://www.livemint.com/rss/markets
"‘Makes my heart sing’: Tim Cook gets reflective on Apple’s golden jubilee plans, lauds 'terrific' India growth",https://www.livemint.com/companies/people/makes-my-heart-sing-tim-cook-gets-reflective-on-apple-s-golden-jubilee-plans-lauds-terrific-india-growth-11770350750170.html,2026-02-06 10:44:24 IST,"During an all-hands meeting inside Apple, Tim Cook talked about the company's 50th anniversary, AI advancements, and the memory chip shortage. The Apple CEO also talked about the company's growth in markets like India and Malaysia",https://www.livemint.com/rss/companies
Govt bond yields harden by 4 bps after RBI MPC keeps policy rate unchanged,https://www.business-standard.com/markets/news/govt-bond-yields-harden-by-4-bps-after-rbi-mpc-keeps-policy-rate-unchanged-126020600505_1.html,2026-02-06 11:05:22 IST,"The 10-year benchmark yield rose to 6.69 per cent after the MPC held rates steady and the RBI refrained from announcing fresh OMOs, despite market expectations",https://www.business-standard.com/rss/markets-106.rss
Sayaji Hotels (Indore) rises after Q3 PAT jumps 29% YoY to Rs 6 cr,https://www.business-standard.com/markets/capital-market-news/sayaji-hotels-indore-rises-after-q3-pat-jumps-29-yoy-to-rs-6-cr-126020600504_1.html,2026-02-06 11:04:59 IST,Sayaji Hotels (Indore) added 4.91% to Rs 834 after the company's consolidated net profit rose 29.3% to Rs 5.87 crore in Q3 FY26 as against Rs 4.54 crore posted in Q3 FY25.,https://www.business-standard.com/rss/markets-106.rss
Nykaa rises 4% to 1-mth high on Q3 result; analysts hike target price,https://www.business-standard.com/markets/news/nykaa-rises-4-to-1-mth-high-on-q3-result-analysts-hike-target-price-126020600314_1.html,2026-02-06 11:04:02 IST,"The scrip increased as much as 4.1 per cent to ₹271.80, the highest level since January 5 on the National Stock Exchange (NSE)",https://www.business-standard.com/rss/markets-106.rss
Indian Oil Corp shares hit 52-week high after multifold jump in Q3 profit,https://www.business-standard.com/markets/news/indian-oil-corp-shares-hit-52-week-high-after-multifold-jump-in-q3-profit-126020600502_1.html,2026-02-06 11:02:47 IST,"Indian Oil Corp reported a six-times jump in consolidated net profit to ₹13,502 crore for Q3 on the back of improved gross refining margins",https://www.business-standard.com/rss/markets-106.rss
India's forex stockpile rises to all-time high of $723.8 billion: RBI Guv,https://www.business-standard.com/markets/news/india-s-forex-stockpile-rises-to-all-time-high-of-723-8-billion-rbi-guv-126020600445_1.html,2026-02-06 10:52:15 IST,"The stockpile rose from $709.4 billion, which was already an all-time high",https://www.business-standard.com/rss/markets-106.rss
"Bharti Airtel Q3 PAT tumbles 55% YoY to Rs 6,630 cr; ARPU climbs over 5% to Rs 259",https://www.business-standard.com/markets/capital-market-news/bharti-airtel-q3-pat-tumbles-55-yoy-to-rs-6-630-cr-arpu-climbs-over-5-to-rs-259-126020600471_1.html,2026-02-06 10:51:07 IST,"Bharti Airtel reported a 55.14% decline in consolidated net profit to Rs 6,630.5 crore, despite a 19.62% jump in revenue from operations to Rs 53,981.6 crore in Q3 FY26 over Q3 FY25.",https://www.business-standard.com/rss/markets-106.rss
Data Patterns soars after Q3 PAT climbs 31% YoY to Rs 58 crore,https://www.business-standard.com/markets/capital-market-news/data-patterns-soars-after-q3-pat-climbs-31-yoy-to-rs-58-crore-126020600470_1.html,2026-02-06 10:51:00 IST,"Data Patterns (India) rallied 3.40% to Rs 2,612.45 after the company's standalone net profit jumped 30.54% to Rs 58.30 crore on a 47.92% surge in revenue from operations to Rs 173.13 crore in Q3 FY26, compared with Q3 FY25.",https://www.business-standard.com/rss/markets-106.rss
"Nifty slides below 25,550 mark; IT shares decline for 3rd day",https://www.business-standard.com/markets/capital-market-news/nifty-slides-below-25-550-mark-it-shares-decline-for-3rd-day-126020600468_1.html,2026-02-06 10:50:52 IST,"The Nifty traded below the 25,550 mark, while IT shares extended losses for the three consecutive trading session.",https://www.business-standard.com/rss/markets-106.rss
RBI holds interest rate steady at 5.25%,https://www.business-standard.com/markets/capital-market-news/rbi-holds-interest-rate-steady-at-5-25-126020600430_1.html,2026-02-06 10:31:51 IST,Powered by Capital Market - Live News,https://www.business-standard.com/rss/markets-106.rss
"Bitcoin falls, Asian shares slip as Wall Street hit by tech stock losses",https://www.business-standard.com/markets/news/bitcoin-falls-asian-shares-slip-as-wall-street-hit-by-tech-stock-losses-126020600413_1.html,2026-02-06 10:25:53 IST,"US futures and Asian shares traded mostly lower on Friday, tracking Wall Street's losses as technology stocks again dragged on markets.
Bitcoin sank to roughly half its record price, giving back all it gained since US President Donald Trump won the White House for his second term.
Tokyo's Nikkei 225 was up 0.5 per cent to 54,073.52, recovering from losses earlier this week, with technology-related stocks leading gains. SoftBank Group rose 1.9 per cent, and chipmaker Tokyo Electron rose 3 per cent. Japan will also be holding its general election on Sunday, in which Prime Minister Sanae Takaichi expects to win a stronger public mandate for her policies.
South Korea's Kospi lost 1.7 per cent to 5,076.69, weighed down by tech shares. Samsung Electronics, the country's biggest listed company, fell 0.9 per cent. Chipmaker SK Hynix was down 0.6 per cent.
Hong Kong's Hang Seng fell 1.2 per cent to 26,569.14. The Shanghai Composite index was flat at 4,075.37.
In Australia, the S&amp;P/ASX 200",https://www.business-standard.com/rss/markets-106.rss
Hitachi Energy zooms after Q3 PAT surges 90% YoY to Rs 261 cr,https://www.business-standard.com/markets/capital-market-news/hitachi-energy-zooms-after-q3-pat-surges-90-yoy-to-rs-261-cr-126020600377_1.html,2026-02-06 10:17:00 IST,"Hitachi Energy India surged 10% to Rs 21,113.50 after the company's standalone net profit soared 90.29% to Rs 261.42 crore on 27.71% increase in revenue from operations to Rs 2021.31 crore in Q3 FY26 over Q3 FY25.",https://www.business-standard.com/rss/markets-106.rss
Pitti Engineering slips as Q3 PAT slides 30% QoQ to Rs 28 cr,https://www.business-standard.com/markets/capital-market-news/pitti-engineering-slips-as-q3-pat-slides-30-qoq-to-rs-28-cr-126020600376_1.html,2026-02-06 10:16:52 IST,Pitti Engineering declined 2.53% to Rs 877.35 after the company's consolidated net profit fell 29.61% QoQ to Rs 28.22 crore despite a flat 0.06% decline in net sales to Rs 477.42 crore in Q3 FY26 over Q2 FY26.,https://www.business-standard.com/rss/markets-106.rss
"Hitachi Energy India surges 14%, stock nears 52-week high; here's why",https://www.business-standard.com/markets/news/hitachi-energy-india-surges-14-stock-nears-52-week-high-here-s-why-126020600341_1.html,2026-02-06 10:15:47 IST,"Hitachi Energy order backlog stood at ₹29,872.2 crore as of December 31, 2025, providing revenue visibility for several upcoming quarters.",https://www.business-standard.com/rss/markets-106.rss
Yen holds ahead of election; Set for 1% weekly loss,https://www.business-standard.com/markets/capital-market-news/yen-holds-ahead-of-election-set-for-1-weekly-loss-126020600363_1.html,2026-02-06 10:06:31 IST,Powered by Capital Market - Live News,https://www.business-standard.com/rss/markets-106.rss
Subex secures a AI deal in North America,https://www.business-standard.com/markets/capital-market-news/subex-secures-a-ai-deal-in-north-america-126020600362_1.html,2026-02-06 10:06:25 IST,"Subex announced a deal win with a North American AI and Data transformation specialist providing services to telecom operators in the region, to launch subscription and handset fraud risk assessment services.",https://www.business-standard.com/rss/markets-106.rss
India-US trade deal fully safeguards India's agricultural interests: Union Minister for Agriculture & Farmers' Welfare,https://www.business-standard.com/markets/capital-market-news/india-us-trade-deal-fully-safeguards-india-s-agricultural-interests-union-minister-for-agriculture-farmers-welfare-126020600346_1.html,2026-02-06 10:04:52 IST,"Union Minister for Agriculture & Farmers Welfare and Rural Development, Shivraj Singh Chouhan, firmly stated that the agreement fully safeguards Indias agricultural interests, particularly those of the farm and dairy sectors. He underlined that under the leadership and guidance of Prime Minister Narendra Modi, the deal reflects a new benchmark of diplomacy, development and dignity, with the Prime Minister making it clear from the outset that farmers interests are non-negotiable. He reiterated that Indias staple grains, fruits, major crops, millets and dairy products remain completely secure and face no threat whatsoever. He emphasized that the interests of small and large farmers alike have been fully protected, and that the agreement will create fresh opportunities rather than risks for Indian agriculture.",https://www.business-standard.com/rss/markets-106.rss
"Tata Motors PV: Analysts cautiously positive despite Q3 loss, JLR headwinds",https://www.business-standard.com/markets/news/stocks-tata-motors-share-price-target-q3-results-jlr-outlook-analysts-126020600342_1.html,2026-02-06 09:59:02 IST,"Tata Motors Q3FY26 results: Analysts stay cautiously positive as India PV growth improves, JLR outlook stabilises. Targets range ₹310-₹460.",https://www.business-standard.com/rss/markets-106.rss
INR extends recovery ahead of RBI policy,https://www.business-standard.com/markets/capital-market-news/inr-extends-recovery-ahead-of-rbi-policy-126020600329_1.html,2026-02-06 09:52:09 IST,Powered by Capital Market - Live News,https://www.business-standard.com/rss/markets-106.rss
"ACME Solar wins 301 MW/ 1,204 MWh  MWh assured peak supply SECI FDRE project",https://www.business-standard.com/markets/capital-market-news/acme-solar-wins-301-mw-1-204-mwh-mwh-assured-peak-supply-seci-fdre-project-126020600325_1.html,2026-02-06 09:51:50 IST,"ACME Solar Holdings (ACME Solar) has secured a 301 MW/ 1,204 MWh assured peak supply SECI FDRE-VII project in an e-reverse auction conducted on 05 February 2026. Following this win, ACME Solar's diversified portfolio stands at 8,071 MW contracted capacity spanning solar, wind, storage, hybrid, FDRE and RTC solutions. The formal Letter of Award is expected soon.",https://www.business-standard.com/rss/markets-106.rss
NCC slides after Q3 PAT tumbles 37% YoY to Rs 122 cr,https://www.business-standard.com/markets/capital-market-news/ncc-slides-after-q3-pat-tumbles-37-yoy-to-rs-122-cr-126020600323_1.html,2026-02-06 09:51:39 IST,"NCC slipped 4.14% to Rs 145.75 after the company reported 36.60% drop in consolidated net profit to Rs 122.46 crore in Q3 FY26, compared to Rs 193.18 crore recorded in Q3 FY25.",https://www.business-standard.com/rss/markets-106.rss
"TACL gains on securing multi-year orders worth over Rs 1,000 crore",https://www.business-standard.com/markets/capital-market-news/tacl-gains-on-securing-multi-year-orders-worth-over-rs-1-000-crore-126020600322_1.html,2026-02-06 09:51:32 IST,"Talbros Automotive Components (TACL) rose 5.56% to Rs 282.20 after the company, along with its JVs, received orders worth over Rs 1,000 crore for both the domestic and export markets from the leading OEMs.",https://www.business-standard.com/rss/markets-106.rss
National Aluminium Company Ltd Falls 2.46%,https://www.business-standard.com/markets/capital-market-news/national-aluminium-company-ltd-falls-2-46-126020600321_1.html,2026-02-06 09:51:25 IST,National Aluminium Company Ltd has added 0.71% over last one month compared to 2.62% gain in BSE Metal index and 2.01% drop in the SENSEX,https://www.business-standard.com/rss/markets-106.rss
Godrej Properties Ltd Spikes 1.16%,https://www.business-standard.com/markets/capital-market-news/godrej-properties-ltd-spikes-1-16-126020600320_1.html,2026-02-06 09:51:19 IST,Godrej Properties Ltd has lost 20.1% over last one month compared to 9.37% fall in BSE Realty index and 2.01% drop in the SENSEX,https://www.business-standard.com/rss/markets-106.rss
Indices edge lower in early trade; breadth negative,https://www.business-standard.com/markets/capital-market-news/indices-edge-lower-in-early-trade-breadth-negative-126020600319_1.html,2026-02-06 09:51:02 IST,"The Nifty traded below the 25,600 level. Barring private bank shares, all other sectoral indices on the NSE traded in the red.",https://www.business-standard.com/rss/markets-106.rss
LIC shares advance 5% after 'very strong results'; Q3 profit rises 17%,https://www.business-standard.com/markets/news/lic-shares-advance-5-after-very-strong-results-q3-profit-rises-17-126020600311_1.html,2026-02-06 09:47:31 IST,LIC's net premium income for the quarter increased 17 per cent year-on-year (Y-o-Y) to ₹1.26 trillion from ₹1.07 trillion in Q3FY25,https://www.business-standard.com/rss/markets-106.rss
Creative Newtech secures orders worth Rs 54.15 cr,https://www.business-standard.com/markets/capital-market-news/creative-newtech-secures-orders-worth-rs-54-15-cr-126020600293_1.html,2026-02-06 09:31:59 IST,From Govt. of Maharashtra,https://www.business-standard.com/rss/markets-106.rss
"MCX Gold down 23%; Silver prices dip by nearly ₹200,000 from high in 6 days",https://www.business-standard.com/markets/news/mcx-gold-down-23-silver-prices-dip-by-nearly-200-000-from-high-in-6-days-126020600286_1.html,2026-02-06 09:31:08 IST,"Commodity rout: Precious metals - Gold, Silver, Platinum have cracked up to 47.5%; base metals - aluminium, copper, zinc, lead and nickel - plunged up to 18% in global markets from January 29 highs.",https://www.business-standard.com/rss/markets-106.rss
Godrej Properties shares gain 2% after Q3 profit jumps 23%; check outlook,https://www.business-standard.com/markets/news/godrej-properties-shares-gain-2-after-q3-profit-jumps-23-check-outlook-126020600289_1.html,2026-02-06 09:27:23 IST,"Godrej Properties reported a 23 per cent increase in its consolidated net profit to ₹193.87 crore for the quarter ended December, despite lower income",https://www.business-standard.com/rss/markets-106.rss
"Talbros Auto and its JVs win orders worth Rs 1,000 cr",https://www.business-standard.com/markets/capital-market-news/talbros-auto-and-its-jvs-win-orders-worth-rs-1-000-cr-126020600283_1.html,2026-02-06 09:16:53 IST,"Talbros Automotive Components along with its JV's has received orders worth over Rs. 1,000 crore for both domestic and exports market from the leading OEMs.",https://www.business-standard.com/rss/markets-106.rss
GIFT Nifty suggests flat start for equities ahead of RBI's monetary policy announcement,https://www.business-standard.com/markets/capital-market-news/gift-nifty-suggests-flat-start-for-equities-ahead-of-rbi-s-monetary-policy-announcement-126020600281_1.html,2026-02-06 09:16:05 IST,GIFT Nifty:,https://www.business-standard.com/rss/markets-106.rss
Updater Services consolidated net profit declines 70.34% in the December 2025 quarter,https://www.business-standard.com/markets/capital-market-news/updater-services-consolidated-net-profit-declines-70-34-in-the-december-2025-quarter-126020600280_1.html,2026-02-06 09:15:59 IST,Sales rise 10.39% to Rs 767.10 crore,https://www.business-standard.com/rss/markets-106.rss
Hexa Tradex reports consolidated net loss of Rs 4.35 crore in the December 2025 quarter,https://www.business-standard.com/markets/capital-market-news/hexa-tradex-reports-consolidated-net-loss-of-rs-4-35-crore-in-the-december-2025-quarter-126020600279_1.html,2026-02-06 09:15:52 IST,Sales reported at Rs 0.02 crore,https://www.business-standard.com/rss/markets-106.rss
OnMobile Global reports consolidated net profit of Rs 3.58 crore in the December 2025 quarter,https://www.business-standard.com/markets/capital-market-news/onmobile-global-reports-consolidated-net-profit-of-rs-3-58-crore-in-the-december-2025-quarter-126020600278_1.html,2026-02-06 09:15:45 IST,Sales decline 17.27% to Rs 135.69 crore,https://www.business-standard.com/rss/markets-106.rss
Ashapura Minechem consolidated net profit declines 20.12% in the December 2025 quarter,https://www.business-standard.com/markets/capital-market-news/ashapura-minechem-consolidated-net-profit-declines-20-12-in-the-december-2025-quarter-126020600277_1.html,2026-02-06 09:15:38 IST,Sales rise 10.98% to Rs 960.43 crore,https://www.business-standard.com/rss/markets-106.rss
Kirloskar Brothers consolidated net profit rises 6.06% in the December 2025 quarter,https://www.business-standard.com/markets/capital-market-news/kirloskar-brothers-consolidated-net-profit-rises-6-06-in-the-december-2025-quarter-126020600276_1.html,2026-02-06 09:15:32 IST,Sales decline 2.45% to Rs 1116.20 crore,https://www.business-standard.com/rss/markets-106.rss
