title,link,published,summary,source
Is it worth taking a fresh look at the housing finance sector? 6 housing finance stocks with upside potential of up to 18%,https://economictimes.indiatimes.com/markets/stocks/news/is-it-worth-taking-a-fresh-look-at-the-housing-finance-sector-6-housing-finance-stocks-with-upside-potential-of-up-to-18/articleshow/130434768.cms,2026-04-22 12:50:54 IST,"Housing finance is one of those sectors where the macro picture is always attractive, but not so much the micro reality. At the level of the economy, the case is easy to make. Housing is a genuine multiplier. Every home built sets off activity across an entire chain: Cement, bricks, steel, tiles, pipes, sanitaryware, electrical fittings, paints, logistics, and labour. Few sectors transmit economic activity so widely. That is why housing finance, in principle, should be among the most durable long-term opportunities in Indian financials. But the fact is that it has produced both scams like DHFL and wealth creators like HDFC.",https://economictimes.indiatimes.com/markets/stocks/rssfeeds/2146843.cms
Premier Explosives shares jump 10% on  ₹350 crore export order win; up 43% in April,https://www.livemint.com/market/stock-market-news/premier-explosives-shares-jump-10-on-rs-350-crore-export-order-win-up-43-in-april-11776848739986.html,2026-04-22 14:43:03 IST,"Premier Explosives stock surged 10% to  ₹545 on April 22 after securing export orders worth  ₹350.23 crore for defense products. Despite a weak December quarter performance, the company's strong order book remains promising for future growth.",https://www.livemint.com/rss/markets
"Expert view: Defence story structurally strong; approach IT as company-specific bets, says Alpha AMC CEO",https://www.livemint.com/market/stock-market-news/expert-view-defence-story-structurally-strong-approach-it-as-company-specific-bets-says-alpha-amc-ceo-11776847691017.html,2026-04-22 14:39:22 IST,"As the IT sector undergoes transformation driven by AI, Alpha AMC CEO Rajesh Singla emphasises the need to adopt a company-specific approach. The defence sector shows robust potential due to government spending and indigenisation.",https://www.livemint.com/rss/markets
"Nestlé India delivers multi-quarter high, but FY27 cool-down looms amid pricey valuations",https://www.livemint.com/market/mark-to-market/nestle-india-high-q4-growth-pricey-valuations-distribution-omni-channel-strategy-advertising-product-innovation-costs-11776843784249.html,2026-04-22 14:30:58 IST,"Nestlé India reported 22.6% revenue growth, driven by distribution expansion, successful omni-channel strategies, and increased advertising. Despite a declining gross margin, Ebitda margin rose to 26.3%. The question is whether this growth can be sustained amid rising costs and competition.",https://www.livemint.com/rss/markets
US-Iran war: Is the ‘safe haven’ narrative for gold and silver breaking down?,https://www.livemint.com/market/commodities/usiran-war-are-gold-and-silver-still-safe-haven-assets-amid-ongoing-geopolitical-tension-11776844164374.html,2026-04-22 14:28:44 IST,"Gold and silver prices have remained highly volatile, especially after begging of the US-Iran war. However, analysts believe both assets have a scope to offer higher returns if the Middle East crisis begins to weigh on global growth or trigger broader risk aversion.",https://www.livemint.com/rss/markets
"Tech Mahindra Q4 Results 2026: Net profit rises 19% to  ₹1,356 crore;  ₹36 per share dividend announced",https://www.livemint.com/market/stock-market-news/tech-mahindra-q4-results-2026-net-profit-rises-19-to-rs-1-356-crore-rs-36-per-share-dividend-announced-11776845648086.html,2026-04-22 14:19:09 IST,"Tech Mahindra's Q4FY26 profit rose 19% YoY to  ₹1,356 crore, up from  ₹1,142 crore last year. Revenue grew 12.6% YoY to  ₹15,076 crore. A final dividend of  ₹36 per share is recommended, totaling  ₹51 including the interim dividend, pending AGM approval.",https://www.livemint.com/rss/markets
PNC Infratech share price jumps 14% after receipt of two highway projects,https://www.livemint.com/market/stock-market-news/pnc-infratech-share-price-jumps-14-after-receipt-of-two-highway-projects-11776847268702.html,2026-04-22 14:16:32 IST,"PNC Infratech share price gained 20% in one month, but fell 11% on a year-to-date (YTD) basis. The smallcap stock has declined 20% in one year, and has dropped 48% over the past two years.",https://www.livemint.com/rss/markets
"Mehul Telecom IPO allotment to be finalised today. Latest GMP, step-by-step guide to check status",https://www.livemint.com/market/ipo/mehul-telecom-ipo-allotment-mehul-telecom-ipo-gmp-mehul-telecom-ipo-subscription-status-11776845891111.html,2026-04-22 14:07:49 IST,"Mehul Telecom IPO allotment will be finalized today, April 22. Investors can check their allotment status on Kfin Technologies Ltd's portal. The IPO subscription was 44.91 times, and refunds for non-allocation start April 23, with shares credited the same day. Mehul Telecom IPO GMP is +3.",https://www.livemint.com/rss/markets
Gold vs Silver: Which precious metal can outperform amid uncertainty over US-Iran war?,https://www.livemint.com/market/commodities/gold-vs-silver-which-precious-metal-can-outperform-amid-uncertainty-over-us-iran-war-11776844916004.html,2026-04-22 13:51:28 IST,"Gold vs Silver: The rally in gold and silver prices today came after US President Donald Trump announced an indefinite extension of the ceasefire with Iran to facilitate further peace negotiations, just hours before the deal was set to expire.",https://www.livemint.com/rss/markets
Small-cap stock under  ₹100 hits 10% upper circuit after Vijay Kedia buys 1% stake in Q4,https://www.livemint.com/market/stock-market-news/smallcap-stock-under-rs-100-websol-energy-share-price-hits-10-upper-circuit-after-vijay-kedia-buys-1-stake-in-q4-11776841293017.html,2026-04-22 13:11:57 IST,"Websol Energy shares surged 10% following Vijay Kedia's acquisition of a 1.02% stake. Despite recent gains, the stock has fallen over 35% in a year. The company will hold a board meeting on April 27 to discuss Q4 results and a potential dividend, its first in 17 years.",https://www.livemint.com/rss/markets
"Ruchit Jain of Motilal Oswal suggests Balrampur Chini, Paras Defence, DMart shares to buy in the near-term",https://www.livemint.com/market/stock-market-news/ruchit-jain-of-motilal-oswal-suggests-balrampur-chini-paras-defence-dmart-shares-to-buy-in-the-nearterm-11776841223800.html,2026-04-22 13:07:36 IST,"Indian benchmark indices faced selling pressure on April 22, with the Sensex dropping over 800 points and Nifty 50 falling more than 200 points. Despite this, the broader market showed strength. Analysts recommend buying Balrampur Chini, Paras Defence, and DMart for potential short-term gains.",https://www.livemint.com/rss/markets
Micro-vacation boom: Why trekking is the new budget-friendly weekend escape,https://www.livemint.com/money/personal-finance/microvacation-boom-trekking-hiking-trails-budget-friendly-weekend-escape-endurance-tests-resilience-nature-group-travel-11776832388994.html,2026-04-22 13:34:19 IST,"Young professionals in India are opting for short weekend treks instead of long vacations. &amp;nbsp;Weekend trips offer affordability and accessibility, while organizations emphasize the importance of physical and financial preparation for trekking.",https://www.livemint.com/rss/money
"Bengaluru living expenses: 23-year-old JPMorgan techie reveals that she spends up to  ₹35,000 in living costs",https://www.livemint.com/money/personal-finance/bengaluru-living-expenses-23-year-old-jpmorgan-techie-reveals-that-she-spends-up-to-rs-35-000-in-living-costs-11776840157537.html,2026-04-22 13:28:05 IST,"Arushi Garg, a 23-year-old JPMorgan Chase engineer, shared her monthly expenses on Instagram, revealing the high cost of living in Bengaluru. Her total expenses range from  ₹30,000 to  ₹35,000, sparking discussions about financial pressures faced by young professionals in urban areas.",https://www.livemint.com/rss/money
Kaun Banega Crorepati: But  ₹1 crore in 2046 won’t be enough — plan for inflation‑proof retirement. Here's how,https://www.livemint.com/money/personal-finance/kaun-banega-crorepati-but-1-crore-in-2046-won-t-be-enough-plan-for-inflation-proof-retirement-heres-how-11776840777527.html,2026-04-22 13:17:35 IST,"Inflation can significantly erode the value of retirement savings, as  ₹1 crore in 2046 loses purchasing power, highlighting the need for a larger corpus, disciplined investing and inflation-adjusted long-term financial planning.",https://www.livemint.com/rss/money
Trent announces first-ever bonus issue in 1:2 ratio. Check details,https://economictimes.indiatimes.com/markets/stocks/news/trent-announces-first-ever-bonus-issue-in-12-ratio-along-with-q4-results-check-record-date-and-other-details/articleshow/130438960.cms,2026-04-22 16:04:32 IST,"Trent, the parent company of Westside and Zudio, announced its first-ever bonus issue, offering shares in a 1:2 ratio to over five lakh shareholders. The Tata Group company will issue one bonus share for every two held, subject to shareholder approval, and also declared a Rs 6 dividend.",https://economictimes.indiatimes.com/markets/stocks/rssfeeds/2146843.cms
"Vedanta demerger a buy 1 get 4 offer: What is the last day to buy, and when will new stocks list?",https://economictimes.indiatimes.com/markets/stocks/news/vedanta-demerger-a-buy-1-get-4-offer-what-is-the-last-day-to-buy-and-when-will-new-stocks-list/articleshow/130437852.cms,2026-04-22 15:19:16 IST,"Vedanta’s long-awaited demerger kicks in with May 1 as the record date and April 30 as the ex-date, determining investor eligibility. Shareholders will receive four new stocks for every Vedanta share held. Listing of the demerged entities is expected within 4–8 weeks, subject to regulatory approvals.",https://economictimes.indiatimes.com/markets/stocks/rssfeeds/2146843.cms
"Nifty to hit 31,000 by March 2027? OmniScience Capital is overweight on these sectors, but cautious on IT",https://economictimes.indiatimes.com/markets/stocks/news/nifty-to-hit-31000-by-march-2027-omniscience-capital-is-overweight-on-these-sectors-but-cautious-on-it/articleshow/130437677.cms,2026-04-22 15:11:31 IST,"Sensex and Nifty have overall begun the new financial year 2027 on a positive note, recovering some of the losses which were recorded during the sharp downturns of March.",https://economictimes.indiatimes.com/markets/stocks/rssfeeds/2146843.cms
"Midcap Meltdown: 12 stocks slide up to 50% from 52-week highs, FIIs cut stakes",https://economictimes.indiatimes.com/markets/stocks/news/midcap-meltdown-12-stocks-slide-up-to-50-from-52-week-highs-fiis-cut-stakes/slideshow/130437448.cms,2026-04-22 14:43:48 IST,"Midcap stocks have seen sharp corrections despite index resilience, with most of the worst performers witnessing FII stake cuts, signalling cautious sentiment in the segment.",https://economictimes.indiatimes.com/markets/stocks/rssfeeds/2146843.cms
Tata Power sets board meeting date to declare Q4 results 2026. Details here,https://www.livemint.com/market/stock-market-news/tata-power-sets-board-meeting-date-to-declare-q4-results-2026-details-here-11776855474573.html,2026-04-22 16:30:24 IST,Tata Power Q4 update: The Tata group company has fixed 12 May 2026 as the board meeting date to consider Q4 results and dividend. Brokerages expect a double-digit fall in profit and sales for January-March quarter.,https://www.livemint.com/rss/markets
Stock market crash: Will the Nifty 50 sustain above 24K? These three bank stocks hold key,https://www.livemint.com/market/stock-market-news/stock-market-crash-will-the-nifty-50-sustain-above-24k-these-three-bank-stocks-hold-key-11776850686386.html,2026-04-22 16:17:02 IST,"On April 22, Indian stock markets fell sharply, with the Sensex losing 831 points and Nifty 50 dropping 224 points. The decline was driven by IT and banking sectors amid global uncertainties, including the U.S.–Iran conflict and fluctuating crude oil prices, causing cautious investor sentiment.",https://www.livemint.com/rss/markets
"Bitcoin jumps over $78,000, hits 11-week high amid Trump's ceasefire extension — Here's what experts say",https://www.livemint.com/market/cryptocurrency/bitcoin-price-today-jumps-over-78400-11-week-high-donald-trump-us-iran-war-ceasefire-extend-experts-crypto-markets-ether-11776850161762.html,2026-04-22 16:16:39 IST,"Bitcoin price today jumped over the $78,400 level, after US President Donald Trump said the ceasefire agreement between US and Iran has been extended. Experts are watching for geopolitical movements.",https://www.livemint.com/rss/markets
SBI Life Insurance Q4 Results: Net profit slips 1% YoY to  ₹804 crore; premium income up 16%,https://www.livemint.com/market/sbi-life-q4-results-net-profit-slips-1-yoy-to-rs-804-crore-premium-income-up-16-11776853518031.html,2026-04-22 16:08:56 IST,"SBI Life Insurance reported a 1% decline in net profit for Q4 FY26, totaling  ₹804 crore, down from  ₹814 crore last year. Net premium income increased by 16% year-on-year to  ₹27,684 crore.",https://www.livemint.com/rss/markets
"Trent Q4 results: Net profit jumps 32.6% YoY to  ₹413 crore; firm announces 1:2 bonus issue,  ₹6 dividend",https://www.livemint.com/market/stock-market-news/trent-q4-results-net-profit-jumps-32-6-to-rs-413-yoy-board-approves-bonus-issue-in-1-2-ratio-rs-6-dividend-declared-11776853883745.html,2026-04-22 16:07:38 IST,"Trent Q4 results: Net profit jumps 32.6% YoY to  ₹413 crore; firm announces 1:2 bonus issue,  ₹6 dividend",https://www.livemint.com/rss/markets
Should you hold one or more demat accounts? Here’s what every investor should know,https://www.livemint.com/market/stock-market-news/should-you-hold-one-or-more-demat-accounts-here-s-what-every-investor-should-know-11776849246096.html,2026-04-22 15:52:51 IST,"Investors in India can have multiple demat accounts for varied purposes, but they must manage them wisely to avoid complications. Kamath's approach highlights the balance between flexibility and organization, which is crucial for effective portfolio management.",https://www.livemint.com/rss/markets
"Top Gainers &amp; Losers on April 22: HCL Tech, Tata Elxsi, Infosys, Bajaj Auto, Nykaa, PTC Industries among top losers",https://www.livemint.com/market/stock-market-news/top-gainers-losers-on-april-22-hcl-tech-tata-elxsi-infosys-bajaj-auto-nykaa-ptc-industries-among-top-losers-11776849420500.html,2026-04-22 15:48:00 IST,"The Indian stock market experienced a sell-off on April 22, closing lower as technology stocks plunged. The Nifty 50 fell 0.81%, and S&amp;amp;P BSE Sensex declined 0.95%, with investors wary of US-Iran tensions and fluctuating crude oil prices.",https://www.livemint.com/rss/markets
HCL Tech’s growth premium is vanishing. Can AI help win it back?,https://www.livemint.com/market/stock-market-news/hcl-tech-growth-premium-vanishing-ai-infrastructure-traditional-business-slowdown-11776845446927.html,2026-04-22 15:31:07 IST,"As a weak FY27 outlook triggers a sharp sell-off, the IT major is pivoting toward industrial-scale AI infrastructure to offset a slowdown in its traditional business. Will this bet pay off?",https://www.livemint.com/rss/markets
Vedanta demerger record date falls on a stock market holiday — When should you buy to be eligible for spin-off benefit?,https://www.livemint.com/market/stock-market-news/vedanta-demerger-record-date-falls-on-a-stock-market-holiday-when-should-you-buy-to-be-eligible-for-spin-off-benefit-11776849074144.html,2026-04-22 14:45:02 IST,"Vedanta will demerge its businesses into aluminium, merchant power, oil and gas and iron ore verticals into separate listed entities. As part of the spin-off, each shareholder will be allotted shares in the ratio of 1:1 for each demerged entity.",https://www.livemint.com/rss/markets
NCLAT reserves order in Jaiprakash Associates insolvency case,https://www.livemint.com/companies/news/jaiprakash-associates-insolvency-case-vedanta-vs-adani-jal-adani-enterprises-nclat-india-11776836137388.html,2026-04-22 15:07:02 IST,"On 6 April, a Supreme Court bench, led by Chief Justice Surya Kant and Justice Joymalya Bagchi, directed the NCLAT to hear the matter urgently",https://www.livemint.com/rss/companies
Buying your first home in 2026? Experts share key financial and market tips,https://www.livemint.com/money/personal-finance/buying-your-first-home-in-2026-experts-share-key-financial-and-market-tips-11776847819498.html,2026-04-22 15:30:41 IST,"Buying your first home in 2026 demands smart financial planning, professional guidance, awareness of home loan rates, hidden costs and location value to ensure long-term stability and confident property investment decisions.",https://www.livemint.com/rss/money
Adani Green among 9 largecap stocks that hit 52-week high; rally up to 40% in a month,https://economictimes.indiatimes.com/markets/stocks/news/adani-green-among-9-largecap-stocks-that-hit-52-week-high-rally-up-to-40-in-a-month/slideshow/130440177.cms,2026-04-22 16:43:49 IST,"Despite Sensex falling sharply, several large-cap stocks hit 52-week highs, signalling strong momentum. Gains in power, energy, and industrial stocks highlight resilience and potential continued upside amid broader market weakness.",https://economictimes.indiatimes.com/markets/stocks/rssfeeds/2146843.cms
"US stock market today: Dow, Nasdaq futures rise up to 1% after Trump extends ceasefire with Iran",https://www.livemint.com/market/stock-market-news/us-stock-market-today-dow-nasdaq-futures-rise-up-to-1-after-trump-extends-ceasefire-with-iran-11776859018118.html,2026-04-22 18:11:04 IST,"US stock market futures rose as President Trump extended the Iran ceasefire, with S&amp;amp;P 500 and Nasdaq hitting record highs. Investors are optimistic about AI stocks despite rising oil prices, while energy stocks are under pressure due to higher fuel costs.",https://www.livemint.com/rss/markets
Holding 10 or more mutual funds? You may be over-diversified — here’s the ideal number,https://www.livemint.com/market/stock-market-news/holding-10-or-more-mutual-funds-you-may-be-over-diversified-here-s-the-ideal-number-11776858552508.html,2026-04-22 17:23:50 IST,"While there is no magical number, most wealth advisors and financial planners that Mint talked to recommended that 4-6 funds spread across asset classes and stock categories can take care of the majority of the needs of an investor.",https://www.livemint.com/rss/markets
Tata Communications Q4 Results: Net profit drops 65% YoY to  ₹263 crore; firm announces  ₹17.5 final dividend,https://www.livemint.com/market/stock-market-news/tata-communications-q4-results-net-profit-drops-65-yoy-to-rs-263-crore-firm-announces-rs-17-5-final-dividend-11776858002827.html,2026-04-22 17:20:35 IST,"For the March quarter, Tata Communications posted a net profit of  ₹263 crore, a 65% decrease from last year. Revenue rose 9.4% to  ₹6,554 crore, bolstered by Data Services growth. A final dividend of  ₹17.50 per share was also declared.",https://www.livemint.com/rss/markets
"Infosys Q4 results preview: Profit may dip QoQ; all eyes on guidance, deal wins",https://www.livemint.com/market/stock-market-news/infosys-q4-results-preview-profit-may-dip-qoq-all-eyes-on-guidance-deal-wins-11776852766935.html,2026-04-22 17:00:12 IST,"Infosys will announce its Q4FY26 results on April 23, with investors focused on earnings and growth outlook amid geopolitical risks and generative AI impacts. Profit is estimated at  ₹7,508.6 crore, a 4% YoY increase, while revenue may grow 13.7% YoY to  ₹46,567 crore.",https://www.livemint.com/rss/markets
"OpenAI taps Airbnb executive Emmanuel Marill as first managing director for Europe, West Asia, Africa",https://www.livemint.com/companies/openai-taps-airbnb-exec-emmanuel-marill-as-first-managing-director-for-europe-middle-east-africa-11776861089213.html,2026-04-22 18:16:22 IST,"Emmanuel Marill will be tasked with expansion of ChatGPT’s parent company in key markets, where political pressure is mounting about over-reliance on US artificial intelligence services.",https://www.livemint.com/rss/companies
Condoms to turn costly: Durex supplier Karex set to hike prices by up to 30% as Iran war hits supply chain,https://www.livemint.com/companies/news/condoms-to-turn-costly-durex-supplier-karex-set-to-hike-prices-by-up-to-30-as-iran-war-hits-supply-chain-11776852248981.html,2026-04-22 17:18:17 IST,"The world’s leading condom manufacturer&amp;nbsp;relies on a range of petrochemical-linked materials — such as ammonia used to preserve latex, ethanol for packaging and printing, and silicone oil to lubricate each condom.",https://www.livemint.com/rss/companies
The  ₹5 trillion ambition: How Pirojsha Godrej plans to triple his group’s value in five years,https://www.livemint.com/companies/people/pirojsha-godrej-interview-5-trillion-market-cap-11776856396373.html,2026-04-22 16:57:35 IST,"Pirojsha Godrej, the chairman designate of Godrej Industries, is rewriting a 129-year legacy. With a  ₹5 trillion target, two IPOs on the horizon, and a firm ‘no’ to 70-hour work weeks, discover how the leader is crafting the group’s tomorrow.",https://www.livemint.com/rss/companies
"Income-tax returns: Here's how to declare gifts, mutual fund and share transfers in ITR form",https://www.livemint.com/money/personal-finance/incometax-returns-declare-gifts-mutual-fund-equity-share-transfers-itr-form-demat-account-family-tax-free-50000-limit-11776856557953.html,2026-04-22 18:17:06 IST,Recipients of significant financial gifts from relatives should disclose these in their ITR to ensure transparency. Proper reporting and retention of documents can prevent tax queries or notices from the tax department in the future.,https://www.livemint.com/rss/money
Indian retail portfolios are no longer insulated from global shocks,https://www.livemint.com/money/personal-finance/indian-retail-portfolios-no-longer-insulated-from-global-shocks-us-markets-diversification-strategies-11776849475054.html,2026-04-22 17:11:37 IST,"As the correlation between Indian and US markets hits record highs, the hidden global risks embedded in domestic stocks are making traditional diversification strategies obsolete.",https://www.livemint.com/rss/money
"In a fragile world, how anti-fragile is your portfolio?",https://www.livemint.com/money/personal-finance/antifragile-portfolio-investment-strategy-financial-planning-wealth-growth-market-shocks-11776847629392.html,2026-04-22 16:59:40 IST,The world is unpredictable—build a portfolio that benefits from shocks.&amp;nbsp;,https://www.livemint.com/rss/money
NRI rental income compliance: Why is my tenant asking for UK address and tax ID from April 2026?,https://www.livemint.com/money/personal-finance/nri-rental-income-compliance-why-is-my-tenant-asking-for-uk-address-and-tax-id-from-april-2026-11776832154649.html,2026-04-22 16:56:33 IST,"New Income-tax Act, 2025 and Rules, 2026 change foreign remittance reporting. What NRIs renting out Indian property must disclose—and whether PPF withdrawals remain tax-free.",https://www.livemint.com/rss/money
These 5 money habits are quietly pushing you towards a financial crisis – here's how to fix them,https://www.livemint.com/money/personal-finance/these-5-money-habits-are-quietly-pushing-you-towards-a-financial-crisis-heres-how-to-fix-them-11776852382799.html,2026-04-22 16:32:44 IST,"Financial crisis warning signs often hide in daily habits. From rising debt to no savings, these signals reveal weakening money control, inefficient financial planning and the urgent need for smarter reconsideration and devising a proper economic management strategy.",https://www.livemint.com/rss/money
Stock market losses can ease your tax burden if you don’t ignore this crucial caveat,https://www.livemint.com/money/personal-finance/stock-market-losses-can-ease-your-tax-burden-if-you-don-t-ignore-this-crucial-caveat-11776848338040.html,2026-04-22 16:30:36 IST,"Capital losses on listed shares can be set off against capital gains within the same financial year. Unutilised losses can be carried forward for up to eight years, provided ITR is filed on time. Here's what the process looks like.",https://www.livemint.com/rss/money
Market Trading Guide: Buy Adani Green and HBL Engineering on Thursday for gains up to 16%,https://economictimes.indiatimes.com/markets/stocks/news/market-trading-guide-buy-adani-green-and-hbl-engineering-on-thursday-for-gains-up-to-16/articleshow/130445336.cms,2026-04-22 20:34:46 IST,"Nifty 50 ended lower, breaking its winning streak amid IT and FMCG weakness. Technical indicators show mixed signals with bearish bias short term. Analysts highlight support levels and recommend selective buying in Adani Green Energy and HBL Engineering.",https://economictimes.indiatimes.com/markets/stocks/rssfeeds/2146843.cms
"Only a handful of traders power India’s F&amp;O volumes, highlights Zerodha's Nithin Kamath",https://economictimes.indiatimes.com/markets/stocks/news/only-a-handful-of-traders-power-indias-fo-volumes-highlights-zerodhas-nithin-kamath/articleshow/130445179.cms,2026-04-22 20:27:02 IST,"Nithin Kamath said India’s F&amp;O market remains small despite perceptions, with limited participation. A tiny group of 1–2% traders drives 60–70% of volumes, making brokerage revenues highly dependent on a narrow, concentrated investor base.",https://economictimes.indiatimes.com/markets/stocks/rssfeeds/2146843.cms
