title,link,published,summary,source
Aequs to invest Rs 1900 cr for setting up manufacturing unit in Tamil Nadu,https://www.business-standard.com/markets/capital-market-news/aequs-to-invest-rs-1900-cr-for-setting-up-manufacturing-unit-in-tamil-nadu-126021600358_1.html,2026-02-16 12:16:51 IST,"Under this non-binding MoU, Company has proposed to set up unit for manufacturing components for Aircraft Engines, Landing Gear and 
systems and has proposed to invest up to Rs 1900 crore over a period of ten years.",https://www.business-standard.com/rss/markets-106.rss
Religare Enterprises shares drop 5% after announcing demerger plan,https://www.business-standard.com/markets/news/religare-enterprises-shares-drop-5-after-announcing-demerger-plan-126021600347_1.html,2026-02-16 12:07:16 IST,"As part of the consideration for the demerger, Religare Finvest will issue fully paid-up equity shares to Religare Enterprises shareholders in a 1:1 ratio",https://www.business-standard.com/rss/markets-106.rss
US dollar index speculative shorts edge lower,https://www.business-standard.com/markets/capital-market-news/us-dollar-index-speculative-shorts-edge-lower-126021600344_1.html,2026-02-16 12:05:39 IST,"US dollar index speculators marginally reduced net short positions, according to the latest Commitment of Traders (COT) data released by the Commodity Futures Trading Commission (CFTC). The non-commercial futures contracts of US dollar index futures, traded by large speculators and hedge funds, totaled a net short position of 729 contracts in the data reported through February 10, 2026, showing a decrease of 123 net short positions compared to the previous week.",https://www.business-standard.com/rss/markets-106.rss
RBI tightens capital market exposure norms,https://www.business-standard.com/markets/capital-market-news/rbi-tightens-capital-market-exposure-norms-126021600343_1.html,2026-02-16 12:05:32 IST,"The Reserve Bank of India (RBI) has notified Commercial Banks - Credit Facilities Amendment Directions, 2026, updating norms for how banks extend credit to stockbrokers and other capital market intermediaries. Banks must provide credit to SEBI regulated stockbrokers and similar intermediaries only on a fully secured basis. Collateral for such credit can include cash, government or eligible securities, immovable property and other approved financial assets, but partial unsecured guarantees or promoter only guarantees will no longer suffice.",https://www.business-standard.com/rss/markets-106.rss
Texmaco Rail & Engineering receives order of Rs 27.67 cr from South Western Railway,https://www.business-standard.com/markets/capital-market-news/texmaco-rail-engineering-receives-order-of-rs-27-67-cr-from-south-western-railway-126021600341_1.html,2026-02-16 12:05:16 IST,"The total contract value is Rs 27.67 crore (inclusive of GST), equivalent to approximately Rs 23.45 crore (excluding GST). Under the mandate, Texmaco will undertake routine, emergency, and preventive maintenance to ensure reliable, efficient, and uninterrupted operation of traction power systems across the division.",https://www.business-standard.com/rss/markets-106.rss
BHEL trades firm after 7% decline in 4 days; stock up 1% on successful OFS,https://www.business-standard.com/markets/news/bhel-trades-firm-after-7-decline-in-4-days-stock-up-1-on-successful-ofs-126021600324_1.html,2026-02-16 12:01:53 IST,"With nearly 80 per cent of the order book anchored in the power segment, positioning the BHEL to benefit from India's renewed thermal capacity additions and infrastructure push, believe analysts.",https://www.business-standard.com/rss/markets-106.rss
"Banks allowed to finance acquisitions up to 20% of their eligible capital base, says RBI",https://www.business-standard.com/markets/capital-market-news/banks-allowed-to-finance-acquisitions-up-to-20-of-their-eligible-capital-base-says-rbi-126021600328_1.html,2026-02-16 11:51:44 IST,Powered by Capital Market - Live News,https://www.business-standard.com/rss/markets-106.rss
Desco Infratech spurts on bagging Rs 40-cr power & solar orders,https://www.business-standard.com/markets/capital-market-news/desco-infratech-spurts-on-bagging-rs-40-cr-power-solar-orders-126021600327_1.html,2026-02-16 11:51:36 IST,Desco Infratech rallied 3.37% to Rs 180.90 after it has received significant purchase orders in the power and solar infrastructure segments totaling Rs 40.43 crore.,https://www.business-standard.com/rss/markets-106.rss
Sensex jumps 149 pts; pharma shares in demand,https://www.business-standard.com/markets/capital-market-news/sensex-jumps-149-pts-pharma-shares-in-demand-126021600326_1.html,2026-02-16 11:51:28 IST,"At 11:30 ST, the barometer index, the S&amp;P BSE Sensex, jumped 149.12 points or 0.18% to 82,775.88. The Nifty 50 index rose 58 points or 0.23% to 25,528.40.",https://www.business-standard.com/rss/markets-106.rss
KFin Technologies shares jump 6% on posting healthy Q3FY26 results,https://www.business-standard.com/markets/news/kfin-technologies-shares-jump-6-percent-on-posting-healthy-q3fy26-results-126021600314_1.html,2026-02-16 11:42:14 IST,"In the December quarter (Q3FY26), Kfin Technologies consolidated net profit stood at ₹91.993 per share, compared to ₹90.178 crore a year ago, up 2 per cent",https://www.business-standard.com/rss/markets-106.rss
Blue Jet Healthcare tanks 19% in 2 days; nears issue price; here's why,https://www.business-standard.com/markets/news/blue-jet-healthcare-share-price-tanks-19-in-2-days-nears-issue-price-here-s-why-126021600215_1.html,2026-02-16 11:37:39 IST,The company said decrease in revenue from operations during Q3FY26 is due to lower sales of PI and Artificial Sweeteners.,https://www.business-standard.com/rss/markets-106.rss
"Apollo Pipes up 24% in Feb, aims to break 5-mth losing streak; hint charts",https://www.business-standard.com/markets/news/apollo-pipes-up-24-in-feb-aims-to-break-5-mth-losing-streak-hint-charts-126021600288_1.html,2026-02-16 11:34:25 IST,"Aakash Shah of Choice Broking reckons that Apollo Pipes has closed above short- and medium-term EMAs, and broken above the falling trendline; thus confirming a breakout on the charts.",https://www.business-standard.com/rss/markets-106.rss
Board of Axita Cotton allots 3.47 cr equity shares under bonus issue,https://www.business-standard.com/markets/capital-market-news/board-of-axita-cotton-allots-3-47-cr-equity-shares-under-bonus-issue-126021600299_1.html,2026-02-16 11:32:00 IST,At meeting held on 16 February 2026,https://www.business-standard.com/rss/markets-106.rss
Mukand announces change in CEO - Machine Building Division,https://www.business-standard.com/markets/capital-market-news/mukand-announces-change-in-ceo-machine-building-division-126021600298_1.html,2026-02-16 11:31:51 IST,With effect from 16 February 2026,https://www.business-standard.com/rss/markets-106.rss
"Investor rush to EM, gold ETFs fuel speculation concerns, say analysts",https://www.business-standard.com/markets/news/investor-rush-to-em-gold-etfs-fuel-speculation-concerns-kotak-securities-126021600271_1.html,2026-02-16 11:21:44 IST,"The January inflow in Gold ETFs exceeded the net investment in equity schemes last month, which stood at ₹24,028.59 crore",https://www.business-standard.com/rss/markets-106.rss
Indian stocks poised for better CY26; Nifty earnings growth seen at 12% CAGR over FY25-27: Motilal Oswal,https://economictimes.indiatimes.com/markets/stocks/news/indian-stocks-poised-for-better-cy26-nifty-earnings-growth-seen-at-12-cagr-over-fy25-27-motilal-oswal/articleshow/128414120.cms,2026-02-16 13:48:48 IST,"Indian markets may stage a stronger show in CY26 after a steep CY25 underperformance, as Motilal Oswal sees improving earnings momentum and supportive macro conditions. With Nifty valuations near long-term averages and upgrades returning, the brokerage expects steadier growth, moderating FII outflows and a healthier outlook across large, mid and small caps.",https://economictimes.indiatimes.com/markets/stocks/rssfeeds/2146843.cms
"Info Edge’s AI problem isn’t visible yet, but investors are already worried",https://www.livemint.com/market/mark-to-market/info-edge-q3-results-ai-impact-it-sector-hiring-11771224978556.html,2026-02-16 14:05:43 IST,"Info Edge’s earnings remain resilient, but AI uncertainty and weak hiring outside of the IT sector raise questions about growth durability.",https://www.livemint.com/rss/markets
Marushika Technology IPO: Issue booked over 7x so far on last bidding day; NIIs steal the show. Check GMP,https://www.livemint.com/market/ipo/marushika-technology-ipo-issue-booked-over-7x-on-last-bidding-day-niis-steal-the-show-marushika-technology-ipo-gmp-11771228186263.html,2026-02-16 13:49:28 IST,"Marushika Technology IPO, running from February 12 to 16, offers shares priced between  ₹111 and  ₹117. The company focuses on IT and telecommunications solutions for enterprise and government clients, aiming to raise  ₹26.97 crore through the offering.",https://www.livemint.com/rss/markets
"Fractal Industries IPO sails through on Day 1: Check GMP, issue size, key dates and other details",https://www.livemint.com/market/ipo/fractal-industries-ipo-sails-through-on-day-1-check-gmp-issue-size-key-dates-and-other-details-11771229584808.html,2026-02-16 13:47:19 IST,"Fractal Industries IPO price band has been fixed at  ₹205 to  ₹216 apiece. The book-built issue is entirely a fresh share sale of 0.23 crore shares, worth  ₹49 crore.",https://www.livemint.com/rss/markets
Multibagger small-cap stock nearly doubles shareholders' money in just 15 sessions. Do you own?,https://www.livemint.com/market/stock-market-news/multibagger-small-cap-stock-nearly-doubles-shareholders-money-in-just-15-sessions-do-you-own-11771227766147.html,2026-02-16 13:31:12 IST,"Multibagger small-cap stock: GE Power India share price rose 9% to  ₹522, marking its highest level since August 2024. The stock has gained 57% over three sessions, driven by strong Q3FY26 results, including a net profit of  ₹72 crore and improved EBITDA margins.",https://www.livemint.com/rss/markets
Fear job loss due to AI? Devina Mehra says history shows humans can't predict eventual impact of any new technology,https://www.livemint.com/companies/people/ai-job-loss-fears-devina-mehra-investor-first-global-humans-never-able-predict-eventual-impact-new-technology-employment-11771227134391.html,2026-02-16 14:03:07 IST,Ace investor Devina Mehra feels that job losses due to AI may not be too dire. Feels that human beings have never been able to predict the eventual impact of any new technology on employment.,https://www.livemint.com/rss/companies
"A banker ditched 7-figure career to build $500M bubble tea company, shares strategy — ‘opened stores next to Starbucks’",https://www.livemint.com/companies/people/a-banker-ditched-7-figure-career-to-build-500m-bubble-tea-company-shares-strategy-opened-stores-next-to-starbucks-11771227402469.html,2026-02-16 13:42:49 IST,Here's Gong Cha Global chairman Martin Berry's striking journey from being a banker to becoming the master franchiser of a million-dollar bubble tea company.,https://www.livemint.com/rss/companies
Beyond FDs: How to build a diversified fixed-income portfolio,https://www.livemint.com/money/personal-finance/fixed-deposits-corporate-bonds-debt-funds-retail-investors-11771223768207.html,2026-02-16 13:45:40 IST,"At the Mint Money festival on Saturday, Vineet Agrawal, co-founder of Jiraaf, explained how fixed-income instruments fit into modern portfolios.",https://www.livemint.com/rss/money
HCL Technologies Ltd down for fifth straight session,https://www.business-standard.com/markets/capital-market-news/hcl-technologies-ltd-down-for-fifth-straight-session-126021600530_1.html,2026-02-16 14:05:06 IST,"HCL Technologies Ltd is quoting at Rs 1453.3, down 0.13% on the day as on 13:19 IST on the NSE. The stock tumbled 15.01% in last one year as compared to a 11.36% rally in NIFTY and a 21.03% fall  in the Nifty IT index.",https://www.business-standard.com/rss/markets-106.rss
Federal Bank allots 27.29 cr warrants to Asia II Topco XIII,https://www.business-standard.com/markets/capital-market-news/federal-bank-allots-27-29-cr-warrants-to-asia-ii-topco-xiii-126021600529_1.html,2026-02-16 14:04:59 IST,"For an aggregate consideration of Rs 6,196.51 crore",https://www.business-standard.com/rss/markets-106.rss
"Shriram Properties acquires 4-acre land on Sarjapur Main Road, Bengaluru",https://www.business-standard.com/markets/capital-market-news/shriram-properties-acquires-4-acre-land-on-sarjapur-main-road-bengaluru-126021600527_1.html,2026-02-16 14:04:51 IST,For development of residential project with GDV of Rs 550-600 cr,https://www.business-standard.com/rss/markets-106.rss
Sensex spurts 317 pts; realty shares outperforms,https://www.business-standard.com/markets/capital-market-news/sensex-spurts-317-pts-realty-shares-outperforms-126021600507_1.html,2026-02-16 13:50:51 IST,"At 13:28 IST, the barometer index, the S&amp;P BSE Sensex advanced 317.07 points or 0.39% to 82,945.23. The Nifty 50 index added 111.60 points or 0.43% to 25,579.50.",https://www.business-standard.com/rss/markets-106.rss
Yen slips as Japan Q4 growth misses expectations,https://www.business-standard.com/markets/capital-market-news/yen-slips-as-japan-q4-growth-misses-expectations-126021600481_1.html,2026-02-16 13:31:51 IST,Powered by Capital Market - Live News,https://www.business-standard.com/rss/markets-106.rss
"Precision Wires India surges 17%, stock hits new high as Q3 net doubles",https://www.business-standard.com/markets/news/precision-wires-india-surges-17-stock-hits-new-high-as-q3-net-doubles-126021600425_1.html,2026-02-16 13:23:32 IST,Precision Wires India share price rose as much as 16.9 per cent to a new high of ₹305.80 on the National Stock Exchange (NSE) in Monday's trading session.,https://www.business-standard.com/rss/markets-106.rss
Torrent Pharmaceuticals Ltd soars 4.69%,https://www.business-standard.com/markets/capital-market-news/torrent-pharmaceuticals-ltd-soars-4-69-126021600462_1.html,2026-02-16 13:17:07 IST,"Torrent Pharmaceuticals Ltd is quoting at Rs 4269.3, up 4.69% on the day as on 12:49 IST on the NSE. The stock is up 38.7% in last one year as compared to a 11.3% spurt in NIFTY and a 6.17% spurt in the Nifty Pharma index.",https://www.business-standard.com/rss/markets-106.rss
Siemens Energy India Ltd gains for third straight session,https://www.business-standard.com/markets/capital-market-news/siemens-energy-india-ltd-gains-for-third-straight-session-126021600461_1.html,2026-02-16 13:16:59 IST,"Siemens Energy India Ltd is quoting at Rs 2810, up 2.55% on the day as on 12:49 IST on the NSE. The stock is up 2.74% in last one year as compared to a 11.3% jump in NIFTY and a 17.78% jump in the Nifty Energy index.",https://www.business-standard.com/rss/markets-106.rss
Canara Bank gains 2%; why PSB outperforms PSU Bank index on Monday?,https://www.business-standard.com/markets/news/canara-bank-gains-2-why-psb-outperforms-psu-bank-index-on-monday-126021600426_1.html,2026-02-16 13:08:41 IST,Motilal Oswal Financial Services reiterated BUY rating on Canara Bank with a revised target price of ₹175 per share.,https://www.business-standard.com/rss/markets-106.rss
