title,link,published,summary,source
"India regains investor favour as China slips, BofA fund manager survey shows",https://economictimes.indiatimes.com/markets/stocks/news/india-regains-investor-favour-as-china-slips-bofa-fund-manager-survey-shows/articleshow/126120449.cms,2025-12-22 16:04:38 IST,"India has regained favour with global investors, moving to a mild overweight in BofA’s latest Asia Fund Manager Survey, even as China slipped into underweight territory. The shift highlights India’s appeal as a diversification play amid selective risk-taking, while Japan remains the region’s top investment choice.",https://economictimes.indiatimes.com/markets/stocks/rssfeeds/2146843.cms
"Global Ocean Logistics India IPO allotment in focus: Check steps to track status, latest GMP here",https://www.livemint.com/market/ipo/global-ocean-logistics-india-ipo-allotment-in-focus-check-steps-to-track-status-latest-gmp-here-11766401674783.html,2025-12-22 16:41:12 IST,"Investors can check the allotment for Global Ocean Logistics India IPO by visiting the website of the registrar, which is KFin Technologies, or the exchange – BSE SME in this case.",https://www.livemint.com/rss/markets
Not so cool: Voltas investors wait for demand to warm up,https://www.livemint.com/market/mark-to-market/voltas-fy26-outlook-weak-ac-demand-margin-pressure-11766396777368.html,2025-12-22 16:35:50 IST,Voltas is managing high inventory and competitive pricing pressures while trying to increase market share. Analysts emphasize the need for improved quarterly results to attract investors.,https://www.livemint.com/rss/markets
Small-cap IT stock jumps after BSNL's 5G network deal. Details here,https://www.livemint.com/market/stock-market-news/smallcap-it-stock-jumps-after-bsnls-5g-network-deal-details-here-11766399058156.html,2025-12-22 15:56:28 IST,"Over the past three and five years, Blue Cloud Softech Solutions has emerged as a multibagger stock, surging 269% and 309%, respectively.",https://www.livemint.com/rss/markets
These 9 largecap stocks delivered more than 50% EBITDA growth in Q2FY26,https://economictimes.indiatimes.com/markets/stocks/news/these-9-largecap-stocks-delivered-more-than-50-ebitda-growth-in-q2fy26/slideshow/126122197.cms,2025-12-22 17:40:01 IST,"Among the NSE large-cap segment,  9 stocks, including BPCL, Lupin and Shree Cement, recorded over 50% EBITDA growth in the September '25 quarter compared to the same period last year.",https://economictimes.indiatimes.com/markets/stocks/rssfeeds/2146843.cms
"Indian ETF AUM crosses Rs 10 lakh crore mark, doubles in 3 years: Zerodha Fund House",https://economictimes.indiatimes.com/markets/stocks/news/indian-etf-aum-crosses-rs-10-lakh-crore-mark-doubles-in-3-years-zerodha-fund-house/articleshow/126121403.cms,2025-12-22 16:57:06 IST,"India’s ETF industry has crossed a major milestone, with assets under management surpassing Rs 10 lakh crore as of October 2025, according to Zerodha Fund House. ETF AUM has doubled in just three years, driven by rising retail participation, deeper liquidity, and growing investor interest beyond equities into gold and silver ETFs.",https://economictimes.indiatimes.com/markets/stocks/rssfeeds/2146843.cms
Gainers &amp; Losers: Meesho among 7 stocks that hogged limelight on Monday,https://economictimes.indiatimes.com/markets/stocks/news/gainers-amp-losers-meesho-among-7-stocks-that-hogged-limelight-on-monday/slideshow/126121173.cms,2025-12-22 16:42:06 IST,"Indian equities extended gains for a second day, led by IT stocks, with notable action in Persistent Systems, Jupiter Wagons, Shriram Finance and Hindustan Zinc, while Meesho and Reliance Power saw sharp declines.",https://economictimes.indiatimes.com/markets/stocks/rssfeeds/2146843.cms
Nithin Kamath explains why most stock brokers don't own the tech that keeps trades running,https://economictimes.indiatimes.com/markets/stocks/news/nithin-kamath-explains-why-most-stock-brokers-dont-own-the-tech-that-keeps-trades-running/articleshow/126121130.cms,2025-12-22 16:39:00 IST,"Zerodha founder Nithin Kamath explains why most brokers do not own their core trading technology, highlighting the risks, regulatory complexity and high costs involved in building in-house OMS and RMS systems.",https://economictimes.indiatimes.com/markets/stocks/rssfeeds/2146843.cms
Shriram Finance rules out banking license plans after MUFG investment — Check details,https://www.livemint.com/market/stock-market-news/shriram-finance-rules-out-banking-license-plans-after-mufg-investment-11766405022728.html,2025-12-22 18:01:53 IST,"Shriram Finance confirmed it will not apply for a banking license after MUFG's $4.4 billion investment for a 20% stake. The company prefers to remain an NBFC, focusing on retail lending opportunities without structural changes in management.",https://www.livemint.com/rss/markets
How street-level data is changing the way India sees air pollution—and the startup behind it,https://www.livemint.com/companies/street-level-air-quality-data-monitoring-startup-india-air-pollution-11766398288453.html,2025-12-22 17:00:42 IST,"Respirer Living Sciences, a tiny startup, is punching above its weight in the fight to improve India’s abysmal air quality. This is the story of how it has endured pushback, developed solutions with limited resources, and became an indispensable asset to a clutch of cities.",https://www.livemint.com/rss/companies
"AI layoffs in 2025: Over 55,000 US job cuts are linked to arrival of artificial intelligence – here's list of companies",https://www.livemint.com/companies/news/ai-layoffs-in-2025-over-55-000-us-job-cuts-are-linked-to-arrival-of-artificial-intelligence-heres-list-of-companies-11766397770152.html,2025-12-22 16:53:42 IST,"In 2025, layoffs surged to 1.17 million in the US, influenced heavily by AI, which accounted for 55,000 job cuts. Major companies such as Amazon and Microsoft have implemented significant layoffs.",https://www.livemint.com/rss/companies
Can India move beyond  ₹1 candies? Perfetti Van Melle hopes so,https://www.livemint.com/companies/candy-market-india-rupee-1-candy-perfetti-van-melle-confectionery-market-fmcg-11766391004175.html,2025-12-22 16:42:15 IST,"While  ₹1 sweets still drive most sales, the candy giant is betting on  ₹5 and  ₹10 products, wider distribution, and innovation to reshape India’s confectionery market.",https://www.livemint.com/rss/companies
Two Trades for Today: A global telecom giant for a 5.2% upmove; a mid-cap sugar producing stock for an almost 6% gain,https://economictimes.indiatimes.com/markets/stocks/news/two-trades-for-today-a-global-telecom-giant-for-a-5-2-upmove-a-mid-cap-sugar-producing-stock-for-an-almost-6-gain/articleshow/126122956.cms,2025-12-22 18:43:47 IST,Our technical analysts identify select stocks that may gain momentum even in volatile markets. Here are the technical calls for today.,https://economictimes.indiatimes.com/markets/stocks/rssfeeds/2146843.cms
Weekly Top Picks: These stocks scored 10 on 10 on Stock Reports Plus,https://economictimes.indiatimes.com/markets/stocks/news/weekly-top-picks-these-stocks-scored-10-on-10-on-stock-reports-plus/articleshow/126122610.cms,2025-12-22 18:18:52 IST,"Stock Reports Plus, powered by Refinitiv, undertakes detailed company analysis for 4,000+ listed stocks. In addition to detailed company analyses, the report also collates analysts’ forecasts and trend analysis for each component. An average score in Stock Reports Plus is calculated by undertaking quantitative analysis of five key investment tools – earnings, fundamentals, relative valuation, risk, and price momentum.",https://economictimes.indiatimes.com/markets/stocks/rssfeeds/2146843.cms
"Vedanta, Samvardhana Motherson among 8 largecap stocks hit 52-week highs; gains of up to 32% in a month",https://economictimes.indiatimes.com/markets/stocks/news/vedanta-samvardhana-motherson-among-8-largecap-stocks-hit-52-week-highs-gains-of-up-to-32-in-a-month/slideshow/126122344.cms,2025-12-22 17:49:31 IST,"Eight BSE large-cap stocks, including Vedanta and Samvardhana Motherson, touched fresh 52-week highs as a broader market rally lifted the Sensex, with some stocks gaining up to 32% in a month.",https://economictimes.indiatimes.com/markets/stocks/rssfeeds/2146843.cms
"Penny stock under  ₹2 declares increase in borrowing, authorised capital limit",https://www.livemint.com/market/stock-market-news/penny-stock-under-rs-2-declares-increase-in-borrowing-authorised-capital-limit-11766406966476.html,2025-12-22 18:28:12 IST,"Excel Realty N Infra's board approved increasing authorized share capital from  ₹500 crore to  ₹750 crore. The company will also change its name to Landsmill Green Limited and raise investment limits for foreign investors, pending consent through a postal ballot.",https://www.livemint.com/rss/markets
"Netflix refinances part of $59 billion loan with cheaper, long-term debt as it seeks to acquire Warner Bros",https://www.livemint.com/companies/news/netflix-refinances-part-of-59-billion-loan-with-cheaper-long-term-debt-as-it-seeks-to-acquire-warner-bros-11766406976680.html,2025-12-22 18:21:14 IST,"Netflix has refinanced part of its $59 billion bridge loan with cheaper long-term debt, boosting its financial position as it seeks to acquire Warner Bros. Discovery.",https://www.livemint.com/rss/companies
"Gujarat Kidney IPO: Issue received solid response on Day 01, booked 1.5 times on strong retail interest",https://www.livemint.com/market/stock-market-news/gujarat-kidney-ipo-issue-received-solid-response-on-day-01-booked-1-5-times-on-strong-retail-interest-11766408874045.html,2025-12-22 19:06:34 IST,"Gujarat Kidney IPO saw strong demand on its first day, with bids for 2.02 crore shares against an offer of 1.32 crore, achieving 1.53 times subscription. Retail investors showed the most interest at 5.06 times. The IPO is priced between  ₹108-114 per share.",https://www.livemint.com/rss/markets
Oracle's Larry Ellison guarantees $40.4 billion in equity financing for Paramount Skydance's Warner Bros bid,https://www.livemint.com/companies/news/oracles-larry-ellison-guarantees-40-4-billion-in-equity-financing-for-paramount-skydances-warner-bros-bid-11766410383597.html,2025-12-22 19:41:59 IST,Larry Ellison has agreed to personally guarantee $40.4 billion in equity financing for Paramount Skydance's all-cash offer for Warner Bros Discovery. Warner Bros shares rose 2.5% and Paramount Skydance shares climbed 1.6% as competition for media assets intensifies.,https://www.livemint.com/rss/companies
"Asset manager Janus Henderson gets bought by Trian, General Catalyst for $7.4 billion",https://www.cnbc.com/2025/12/22/asset-manager-janus-henderson-gets-bought-by-trian-general-catalyst-for-7point4-billion.html,2025-12-22 19:34:10 IST,"Asset manager Janus Henderson agreed to be acquired by investors Trian Fund Management and General Catalyst, the companies announced Monday.",https://www.cnbc.com/id/10000664/device/rss/rss.html
Groww launches backup trading portal to protect traders during outages,https://economictimes.indiatimes.com/markets/stocks/news/groww-launches-backup-trading-portal-to-protect-traders-during-outages/articleshow/126124121.cms,2025-12-22 20:24:52 IST,"Stock broking platform Groww on Monday said it has launched 'Groww Lite', a web-based emergency trading portal, to safeguard users during platform outages and technical glitches.",https://economictimes.indiatimes.com/markets/stocks/rssfeeds/2146843.cms
Wall Street gains as techs continue ‌rebound,https://www.livemint.com/market/stock-market-news/wall-street-gains-as-techs-continue-rebound-11766415297219.html,2025-12-22 20:30:01 IST,"The ⁠Dow Jones Industrial&amp;nbsp;⁠Average rose 0.45%,&amp;nbsp;‌the S&amp;amp;P 500 gained 0.58%&amp;nbsp;​and the Nasdaq Composite&amp;nbsp;‍added 0.59%",https://www.livemint.com/rss/markets
"Gold rates today: MCX gold jumps over  ₹2,200 to record  ₹1.36 lakh per 10g; silver tops  ₹2.14 lakh per kg",https://www.livemint.com/market/commodities/gold-rates-today-mcx-gold-jumps-over-rs-2-200-to-record-rs-1-36-lakh-per-10g-silver-tops-rs-2-14-lakh-per-kg-11766412820438.html,2025-12-22 20:03:19 IST,"Gold rate today: Gold prices surged to record highs on December 22, driven by expectations of US Federal Reserve rate cuts in 2026. MCX gold reached  ₹1,36,458 per 10 grams, marking a 77.5% year-to-date gain. Silver also hit a record high of  ₹2,14,583 per kilo.",https://www.livemint.com/rss/markets
Agnikul eyes 100 launches per year for its reusable small rocket by 2030,https://www.livemint.com/companies/start-ups/agnikul-100-launches-per-year-reusable-small-rocket-2030-11766404728886.html,2025-12-22 20:25:46 IST,"Chennai's Agnikul Cosmos seeks to launch 100 reusable rockets in five years, targeting profitability in two years. With $17 million in recent funding, the company is preparing for its first commercial launch and aims to differentiate itself in the small rocket sector.",https://www.livemint.com/rss/companies
"Spanish carrier Telefonica to slash 5,500 jobs at $2.9 billion cost in bid to bring down operational expenses",https://www.livemint.com/companies/news/spanish-carrier-telefonica-to-slash-5-500-jobs-at-2-9-billion-cost-in-bid-to-bring-down-operational-expenses-11766413674201.html,2025-12-22 20:04:54 IST,"Employees affected are expected to exit beginning early next year, with Telefonica projecting a positive impact on cash generation from 2026 itself.",https://www.livemint.com/rss/companies
Ahead of Market: 10 things that will decide stock market action on Tuesday,https://economictimes.indiatimes.com/markets/stocks/news/ahead-of-market-10-things-that-will-decide-stock-market-action-on-tuesday/articleshow/126124768.cms,2025-12-22 21:27:51 IST,"Indian equities ended higher as a stronger rupee, global optimism and expectations of US Fed rate cuts boosted sentiment. Sensex and Nifty gained sharply, led by IT and metals, while technical indicators signalled continued short-term bullish momentum.",https://economictimes.indiatimes.com/markets/stocks/rssfeeds/2146843.cms
These large-caps have ‘strong buy’ &amp; ‘buy’ recos and an upside potential of at least 25%,https://economictimes.indiatimes.com/markets/stocks/news/these-large-caps-have-strong-buy-buy-recos-and-an-upside-potential-of-at-least-25/articleshow/126124631.cms,2025-12-22 21:21:55 IST,"After a year of clear bearish bias, it appears that Nifty and Sensex are making serious attempts to move out into a different territory. Now, the big question is: Which sector will lead this breakout? There are many contenders. And another question: Which sector will sustain the upward movement when it starts? The answer is clear, the sector or sectors where the probability of Q3 earning numbers being good are high. So, look forward to the coming earnings season.",https://economictimes.indiatimes.com/markets/stocks/rssfeeds/2146843.cms
Market Trading Guide: Buy MCX and IIFL Capital on Tuesday for up to 10% gains,https://economictimes.indiatimes.com/markets/stocks/news/market-trading-guide-buy-mcx-and-iifl-capital-on-tuesday-for-up-to-10-gains/slideshow/126124662.cms,2025-12-22 21:09:29 IST,"Nifty rose for a second straight session, led by IT, autos and financials, as a falling wedge breakout and RSI signals strengthened short-term bullish momentum, keeping buy-on-dips strategy favourable above key support levels.",https://economictimes.indiatimes.com/markets/stocks/rssfeeds/2146843.cms
Larry Ellison net worth: How much does Oracle CTO earn amid buzz over $40 bn backing for son's Warner Bros bid?,https://www.livemint.com/companies/people/larry-ellison-net-worth-how-much-does-oracle-cto-earn-amid-buzz-over-40-bn-backing-sons-warner-bros-bid-paramount-11766416800996.html,2025-12-22 21:44:03 IST,"Larry Ellison has pledged $40.4 billion to support Paramount and Skydance in their bid to acquire Warner Bros. assets, countering Netflix's offer. Following the news, Warner Bros. shares rose nearly 4% and Paramount's by about 3%. Take a look at Oracle co-founder's net worth.",https://www.livemint.com/rss/companies
Adani Group's Ambuja Cements Board approves amalgamation of ACC and Orient Cement,https://www.livemint.com/companies/news/adani-groups-ambuja-cements-board-approves-amalgamation-of-acc-and-orient-cement-11766419634695.html,2025-12-22 21:41:02 IST,The board of Ambuja Cements has sanctioned the amalgamation of ACC and Orient Cement.,https://www.livemint.com/rss/companies
Premji Invest buys 2.61 pc unitholding in NHIT for  ₹754 cr,https://www.livemint.com/market/premji-invest-buys-2-61-pc-unitholding-in-nhit-for-rs-754-cr-11766422934401.html,2025-12-22 22:40:32 IST,Azim Premji's Prazim Trading acquired 5.06 crore units (2.61% stake) in NHIT for  ₹754.24 crore at  ₹149.06 per unit. Vidyaniti LLP sold the same number of units. NHIT's units rose 0.57% to  ₹149 on the NSE.,https://www.livemint.com/rss/markets
India regains favour of global investors with ‘mildly overweight’ allocation as China drops: Bofa survey,https://www.livemint.com/market/stock-market-news/india-regains-favour-of-global-investors-with-mildly-overweight-allocation-as-china-drops-bofa-survey-11766403564286.html,2025-12-22 23:10:53 IST,"India is now mildly overweight in Bank of America's Asia Fund Manager Survey, reflecting its appeal as a diversification option. With 10% of fund managers favoring India, it ranks third in Asia, while Japan leads and China sees a decline in investor sentiment.",https://www.livemint.com/rss/markets
