title,link,published,summary,source
Stocks to buy under  ₹200: Mehul Kothari of Anand Rathi recommends three shares to buy or sell,https://www.livemint.com/market/stock-market-news/stocks-to-buy-under-rs-200-mehul-kothari-of-anand-rathi-recommends-three-shares-to-buy-or-sell-11766219709688.html,2025-12-20 14:16:18 IST,"Stocks to buy under  ₹200: Mehul Kothari of Anand Rathi recommends three shares to buy or sell — UCO Bank, Ircon International, MRPL",https://www.livemint.com/rss/markets
Gujarat Kidney IPO: Healthcare company garners  ₹100 crore from anchor investors ahead of IPO,https://www.livemint.com/market/ipo/gujarat-kidney-ipo-healthcare-company-garners-100-crore-from-anchor-investors-ahead-of-ipo-11766217463796.html,2025-12-20 14:05:58 IST,"Gujarat Kidney and Super Speciality IPO: According to the exchange filing, the company has allocated 87,73,120 equity shares at  ₹114 per share to anchor investors.",https://www.livemint.com/rss/markets
"Expert view: A delayed India-US trade deal not an immediate macro shock, says Sonam Srivastava of Wright Research PMS",https://www.livemint.com/market/stock-market-news/expert-view-a-delayed-india-us-trade-deal-not-an-immediate-macro-shock-says-sonam-srivastava-of-wright-research-pms-11766222299119.html,2025-12-20 15:41:08 IST,"Expert view on markets: The Indian market faces uncertainty due to a delayed India-US trade deal. Sonam Srivastava of Wright Research PMS believes investors should focus on domestic demand and capital expenditure, while maintaining staggered allocations and avoiding leveraged trades.",https://www.livemint.com/rss/markets
Small-cap stock Mangalam Cement jumps 10% in December amid promoters' stake restructuring; details here,https://www.livemint.com/market/stock-market-news/smallcap-stock-mangalam-cement-jumps-10-in-december-amid-promoters-stake-restructuring-11766224585942.html,2025-12-20 15:40:40 IST,"In the previous session on Friday, December 19, Mangalam Cement's share price ended 3% higher at  ₹777.65, while the Sensex closed with a gain of 0.53% at 84,929.36, and the BSE Smallcap index ended 1.25% higher at 50,800.77.",https://www.livemint.com/rss/markets
₹6.45 to  ₹793.50: Multibagger penny stock turns  ₹1 lakh into  ₹1.23 crore in 12 years,https://www.livemint.com/market/stock-market-news/rs-6-45-to-rs-793-50-multibagger-penny-stock-izmo-shares-turns-rs-1-lakh-into-rs-1-23-crore-in-12-years-11766222201108.html,2025-12-20 15:32:18 IST,"Multibagger penny stock: Over the last 12 years, Izmo Limited shares have given stock market investors more than 12,200% returns on their investments, turning people's  ₹1 lakh investment into nearly  ₹1.23 crore over the last 12 years. Here's how the shares have performed over the years.&amp;nbsp;",https://www.livemint.com/rss/markets
Buy or sell: Sumeet Bagadia recommends three stocks to buy on Monday — 22 December 2025,https://www.livemint.com/market/stock-market-news/buy-or-sell-sumeet-bagadia-recommends-three-stocks-to-buy-on-monday-22-december-2025-11766223995365.html,2025-12-20 15:26:43 IST,"Buy or sell: Sumeet Bagadia recommends three stocks to buy on Monday — Jio Financial Services, BEL, Asian Paints",https://www.livemint.com/rss/markets
"Is Santa Rally real? Small-cap stocks lead with a perfect 10-year winning streak over mid-caps, large-caps",https://www.livemint.com/market/stock-market-news/is-santa-rally-real-small-cap-stocks-lead-with-a-perfect-10-year-winning-streak-over-mid-caps-largecaps-11765988326982.html,2025-12-20 15:21:15 IST,"The Santa Claus Rally indicates that smallcaps consistently outperform during the last five trading days of December and the first two of January, with an average return of 3.55% over the last decade. This seasonal trend remains strong even during market uncertainty.",https://www.livemint.com/rss/markets
Sebi plans working group to deepen non-farm commodity derivatives market,https://www.livemint.com/market/commodities/sebi-plans-working-group-to-deepen-non-farm-commodity-derivatives-market-11766221621777.html,2025-12-20 15:17:21 IST,"Sebi is examining whether the regulatory framework governing margins, position limits, and delivery and settlement mechanisms can be optimized without compromising market integrity.",https://www.livemint.com/rss/markets
Here's advice OpenAI co-founder Andrej Karpathy wishes he was told as an undergraduate student,https://www.livemint.com/companies/people/openai-co-founder-andrej-karpathy-former-director-ai-autopilot-vision-tesla-wishes-was-told-advice-undergraduate-student-11766216206494.html,2025-12-20 15:19:03 IST,"Here's advice Andrej Karpathy, OpenAI co-founder and former director for AI and Autopilot Vision at Tesla, wishes he was told as an undergraduate student.",https://www.livemint.com/rss/companies
"After Elon Musk, Nikhil Kamath's WTF Podcast to feature this billionaire fund manager - Can you guess?",https://www.livemint.com/money/personal-finance/after-elon-musk-nikhil-kamaths-wtf-podcast-to-feature-this-billionaire-fund-manager-can-you-guess-11766222064401.html,2025-12-20 15:28:10 IST,"In a post on X on Saturday, Nikhil Kamath dropped a one-minute video teaser of his podcast with Ray Dalio, where they discuss a wide range of topics including crypto, wealth creation, wealth to money ratio and others. The video has already gone viral on social media.",https://www.livemint.com/rss/money
Big year for old school Wall Street trades gets lost in AI hype,https://economictimes.indiatimes.com/markets/stocks/news/big-year-for-old-school-wall-street-trades-gets-lost-in-ai-hype/articleshow/126092578.cms,2025-12-20 16:36:56 IST,"Even as AI mania dominated headlines in 2025, diversified and multi-asset strategies quietly delivered some of their strongest returns in years. Balanced stock-bond portfolios, global value trades and risk-parity funds outperformed expectations, underscoring the enduring appeal of diversification despite investors continuing to chase concentrated, thematic bets.",https://economictimes.indiatimes.com/markets/stocks/rssfeeds/2146843.cms
Gold EGR framework may need a review to revive India’s price-setter ambition: Sebi Chairman,https://economictimes.indiatimes.com/markets/stocks/news/gold-egr-framework-may-need-a-review-to-revive-indias-price-setter-ambition-sebi-chairman/articleshow/126092381.cms,2025-12-20 16:17:04 IST,"Sebi Chairman Tuhin Kanta Pandey said India’s Electronic Gold Receipts (EGR) framework may need a review as it has not gained the desired traction. He urged greater investor awareness of regulated gold products, stressing that EGRs were meant to help India emerge as a global gold price discovery hub.",https://economictimes.indiatimes.com/markets/stocks/rssfeeds/2146843.cms
This ratio deserves a place on your checklist: 5 stocks with an upside potential of up to 36%,https://economictimes.indiatimes.com/markets/stocks/news/this-ratio-deserves-a-place-on-your-checklist-5-stocks-with-an-upside-potential-of-up-to-36/articleshow/126091885.cms,2025-12-20 15:51:45 IST,"Value matters more when the environment gets harder. But value isn’t a low PE number. Value is what you pay relative to what the business can become. That’s why looking beyond PE is not optional; it’s essential. And if you want one simple upgrade to your valuation lens, make it this: Don’t just ask what the stock is trading at. Ask what growth you are paying for.",https://economictimes.indiatimes.com/markets/stocks/rssfeeds/2146843.cms
"Ola Electric, FirstCry among worst BSE 500 performers, stocks sink up to 62% in 2025",https://economictimes.indiatimes.com/markets/stocks/news/ola-electric-firstcry-among-worst-bse-500-performers-stocks-sink-up-to-62-in-2025/slideshow/126075542.cms,2025-12-19 15:52:17 IST,"More than 300 BSE 500 stocks ended 2025 in deep losses, with names like Ola Electric, FirstCry and Aditya Birla Fashion plunging as much as 70% amid volatility and sectoral churn.",https://economictimes.indiatimes.com/markets/stocks/rssfeeds/2146843.cms
Bitcoin bulls are blinking. 2026 forecasts look soft.,https://www.livemint.com/market/cryptocurrency/bitcoin-bulls-are-blinking-2026-forecasts-look-soft-11766228148467.html,2025-12-20 16:28:41 IST,Bitcoin’s slump has prompted Wall Street banks and longtime crypto bulls to dial back longer-term price targets.,https://www.livemint.com/rss/markets
"FIIs dump Rs 1.58 lakh cr in 2025, but Rs 3,000 cr year-end buying sparks 2026 reversal hopes. Here’s why",https://economictimes.indiatimes.com/markets/stocks/news/fiis-dump-rs-1-58-lakh-cr-in-2025-but-rs-3000-cr-year-end-buying-sparks-2026-reversal-hopes-heres-why/articleshow/126093097.cms,2025-12-20 17:13:26 IST,"Foreign Institutional Investors have sold Indian equities worth Rs 14,185 crore in December, contributing to total outflows of Rs 1,57,860 crore in 2025. However, recent buying ahead of the Santa Claus rally has narrowed outflows, sparking hopes for a 2026 reversal. The rupee's depreciation also saw a reversal, aiding the sentiment.",https://economictimes.indiatimes.com/markets/stocks/rssfeeds/2146843.cms
"Dalal Street Week Ahead: Nifty enters consolidation phase; breakout above 26,100 key for next market move",https://economictimes.indiatimes.com/markets/stocks/news/dalal-street-week-ahead-nifty-enters-consolidation-phase-breakout-above-26100-key-for-next-market-move/articleshow/126092923.cms,2025-12-20 17:01:48 IST,"The Nifty ended the week mildly lower, extending its sideways consolidation within the 25,700–26,100 band amid falling volatility. With no clear breakout and the India VIX near multi-year lows, markets may remain range-bound, making stock-specific and sectoral positioning crucial in the near term.",https://economictimes.indiatimes.com/markets/stocks/rssfeeds/2146843.cms
Concurrent Losers: 13 smallcap stocks decline for 5 consecutive sessions,https://economictimes.indiatimes.com/markets/stocks/news/concurrent-losers-13-smallcap-stocks-decline-for-5-consecutive-sessions/slideshow/126089616.cms,2025-12-20 11:30:38 IST,"Thirteen small-cap stocks, including Kothari Industrial and Wardwizard Innovations, recorded losses for five consecutive sessions, with declines ranging from 5% to 23% amid broader market weakness.",https://economictimes.indiatimes.com/markets/stocks/rssfeeds/2146843.cms
"PSU banks emerge as top sectoral performers in 2025; six stocks surge 20–50%, led by Canara Bank",https://www.livemint.com/market/stock-market-news/psu-banks-emerge-as-top-sectoral-performers-in-2025-six-stocks-surge-20-50-led-by-canara-bank-11766231084999.html,2025-12-20 17:38:19 IST,"With gains of 28% in 2025 so far, the Nifty PSU Bank index has emerged as the top-performing sectoral index, largely outperforming the benchmark Nifty 50, which has risen 10% over the same period.",https://www.livemint.com/rss/markets
Arihant Capital buys over 2 crore shares of this penny stock under  ₹5 — Details here,https://www.livemint.com/market/stock-market-news/arihant-capital-buys-over-2-crore-shares-of-this-penny-stock-under-rs-5-davangere-sugar-details-here-11766225784968.html,2025-12-20 16:42:50 IST,"Arihant Capital buys over 2 crore shares of penny stock under  ₹5, Davangere Sugar, through a bulk deal via the open market on 19 December 2025. The stake purchased fueled up the agro-industrial company's shares by more than 10% during Friday's market session.&amp;nbsp;",https://www.livemint.com/rss/markets
Stocks to buy for long term: From Coal India to RVNL— Jigar Patel of Anand Rathi suggests 5 shares to buy for 2026,https://www.livemint.com/market/stock-market-news/stocks-to-buy-for-long-term-from-coal-india-to-rvnl-jigar-patel-of-anand-rathi-suggests-5-shares-to-buy-for-2026-11766225977080.html,2025-12-20 16:39:55 IST,"Stocks to buy for the long term: The Indian stock market has seen modest gains this year amid challenges. Jigar Patel of Anand Rathi Share and Stock Brokers recommends quality stock picking for 2026. He suggests five stocks, including Coal India, and RVNL, for next year.",https://www.livemint.com/rss/markets
Not Bitcoin or Ethereum - These 5 are the top best performing cryptos in 2025,https://www.livemint.com/market/cryptocurrency/not-bitcoin-or-ethereum-these-5-are-the-top-best-performing-cryptos-in-2025-11766216526786.html,2025-12-20 18:16:50 IST,"Bitcoin is down 7.96% year-to-date, trading at $86,065 as of December 18 after beginning the year at $93,508. In comparison, Ethereum has recorded a steeper decline of 15.25% YTD, with its price falling from $3,337 to $2,828 during the same timeframe.",https://www.livemint.com/rss/markets
"Warren Buffett's currency devaluation warning video resurfaces amid US dollar low, ‘Push towards weaker currencies…’",https://www.livemint.com/market/stock-market-news/warren-buffetts-currency-devaluation-warning-video-resurfaces-amid-us-dollar-low-push-towards-weaker-currencies-11765961313452.html,2025-12-20 18:08:59 IST,Warren Buffett's video warning about a currency devaluation in the US economy resurfaced on the social media platform X as the US dollar index hit its 2-month low this week. Here's what the billionaire value investors said in its shareholder meeting earlier this year.&amp;nbsp;,https://www.livemint.com/rss/markets
Sebi imposes  ₹50 lakh penalty on four individuals over allegations of manipulating GG Engineering shares,https://www.livemint.com/market/stock-market-news/sebi-imposes-rs-50-lakh-penalty-on-four-individuals-over-allegations-of-manipulating-gg-engineering-shares-11766239297966.html,2025-12-20 19:52:08 IST,"The Securities and Exchange Board of India fined four individuals  ₹50 lakh for manipulating shares of G G Engineering Ltd. They created artificial trading volumes and misled investors through false YouTube videos, violating Prohibition of Fraudulent Trade Practices rules, the Sebi order noted.",https://www.livemint.com/rss/markets
KSH International IPO allotment status out — What GMP signals ahead of share listing date,https://www.livemint.com/market/ipo/ksh-international-ipo-allotment-status-out-what-gmp-signals-ahead-of-share-listing-date-11766235419254.html,2025-12-20 19:50:38 IST,"KSH International IPO shares are set to be listed on the Indian stock market next week on Tuesday, 23 December 2025. Take a look at what the GMP signals on the grey market ahead of the share listing date.&amp;nbsp;",https://www.livemint.com/rss/markets
"It was true in 2008, will be true in 2026, and even in 2036: Hold good stocks for wealth creation; 10 stocks that fit the bill",https://economictimes.indiatimes.com/markets/stocks/news/it-was-true-in-2008-will-be-true-in-2026-and-even-in-2036-hold-good-stocks-for-wealth-creation-10-stocks-that-fit-the-bill/articleshow/126094996.cms,2025-12-20 20:46:09 IST,"There is enough evidence to show that it is by holding on to stocks for the long term that you ensure wealth creation. Anything can happen in the short term, but in the long term, stock prices of good companies will surely move up because their earnings are going to be higher. Why will earnings be higher? Because the underlying product or service has a very large runaway of growth and the management has been able to crack the code of growing efficiently under different economic cycles.",https://economictimes.indiatimes.com/markets/stocks/rssfeeds/2146843.cms
"Gujarat Kidney IPO opens next week — GMP, review, other details in 10 points",https://www.livemint.com/market/ipo/gujarat-kidney-ipo-opens-next-week-gmp-review-other-details-in-10-points-11766243473137.html,2025-12-20 22:26:36 IST,"Gujarat Kidney IPO: Gujarat Kidney's initial public offering (IPO) is set to open for public subscription next week, starting Monday, 22 December 2025. Here's what the GMP indicates ahead of the public issue open.&amp;nbsp;",https://www.livemint.com/rss/markets
"Dividend, bonus issue, stock split: Canara Robeco to trade ex-dividend, GRM Overseas ex-bonus issue next week — List",https://www.livemint.com/market/stock-market-news/dividend-bonus-issue-stock-split-canara-robeco-to-trade-ex-dividend-grm-overseas-ex-bonus-issue-next-week-list-11766250377780.html,2025-12-20 23:24:35 IST,"Dividend, bonus issue, stock split: Canara Robeco to trade ex-dividend, GRM Overseas ex-bonus issue next week, starting 22 December 2025. Other companies are also set to declare other corporate actions next week.&amp;nbsp;",https://www.livemint.com/rss/markets
