title,link,published,summary,source
Bank of Japan keeps key interest rate unchanged at 0.75%,https://economictimes.indiatimes.com/markets/stocks/news/bank-of-japan-keeps-key-interest-rate-unchanged-at-0-75/articleshow/127227850.cms,2026-01-23 09:04:25 IST,The Bank of Japan has kept its key interest rate steady at 0.75 percent. This decision was widely expected by analysts. The central bank anticipates inflation will fall below two percent in early 2026. Japan's economy is projected to grow moderately. Prime Minister Sanae Takaichi is preparing for a snap election on February 8.,https://economictimes.indiatimes.com/markets/stocks/rssfeeds/2146843.cms
"Shadowfax Technologies IPO allotment date likely today. GMP, steps to check share allotment status online",https://www.livemint.com/market/ipo/shadowfax-technologies-ipo-allotment-date-likely-today-gmp-steps-to-check-share-allotment-status-online-11769140805887.html,2026-01-23 09:54:11 IST,"Shadowfax Technologies IPO allotment date is likely today, 23 January 2026. Shadowfax Technologies IPO allotment status online check can be done through the websites of BSE and NSE, and also on the official portal of the IPO registrar. Kfin Technologies is the Shadowfax Technologies IPO registrar.",https://www.livemint.com/rss/markets
Multibagger defence stock hits 5% upper circuit on bagging $1 million contract. Do you own?,https://www.livemint.com/market/stock-market-news/multibagger-defence-stock-axiscades-technologies-hit-5-upper-circuit-on-bagging-1-million-contract-do-you-own-11769142024450.html,2026-01-23 09:53:25 IST,"Multibagger defence stock Axiscades Technologies surged to the 5% upper circuit on Friday, January 23, following an order win worth $1 million by its subsidiary, Mistral Solutions Private Limited.",https://www.livemint.com/rss/markets
"Silver rate today soars 4% to hit its record high of  ₹3,39,927 amid geopolitical tensions - Will it rise further?",https://www.livemint.com/market/commodities/silver-rate-today-soars-4-to-hit-its-record-high-of-rs-3-39-927-amid-geopolitical-tensions-will-it-rise-further-11769140314540.html,2026-01-23 09:35:35 IST,"Silver prices soared nearly 4% to a record high of  ₹3,39,927 amid a weaker US dollar and rising geopolitical tensions. Gold also reached a new high of  ₹1,59,226 per 10 grams, reflecting strong demand for safe-haven assets.",https://www.livemint.com/rss/markets
"Gold, silver rates today hit new peaks. Is it time to buy gold and silver ETFs, mutual funds or SIP?",https://www.livemint.com/market/commodities/gold-silver-rates-today-hit-new-peaks-is-it-time-to-buy-gold-and-silver-etfs-mutual-funds-or-sip-11769134070751.html,2026-01-23 09:24:33 IST,"Gold and silver rates today touched new peaks of $4,969.69 per ounce and $98.980 per ounce, respectively",https://www.livemint.com/rss/markets
"IndiGo share price crashes 4%; should investors buy, sell, or hold this aviation stock after Q3 results?",https://www.livemint.com/market/stock-market-news/indigo-share-price-crashes-4-should-investors-buy-sell-or-hold-this-aviation-stock-after-q3-results-11769137522040.html,2026-01-23 09:23:39 IST,"InterGlobe Aviation reported a 77.55% YoY drop in its consolidated profit for Q3FY26 at  ₹5,498 million, largely due to a one-time impact of  ₹9,693 million due to the implementation of new labour laws, and an exceptional item related to operational disruptions aggregating to  ₹5,772 million.",https://www.livemint.com/rss/markets
Multibagger jewellery stock PC Jeweller share price rises on allotment of 6.85 crore shares; check details,https://www.livemint.com/market/stock-market-news/multibagger-jewellery-stock-pc-jeweller-share-price-rose-1-after-it-completed-6-85-crore-share-allotment-check-details-11769139505778.html,2026-01-23 09:18:48 IST,"The successful allotment of 6.85 crore equity shares by PC Jeweller has increased its paid-up capital, impacting ownership stakes. The company reported a 37% revenue growth for Q3 FY26 and aims for debt-free status. The stock has shown impressive long-term returns despite recent pressures.",https://www.livemint.com/rss/markets
"Gold price today: Rates at record high on MCX as geopolitical risks, weaker dollar drive safe-haven demand",https://www.livemint.com/market/commodities/gold-price-today-rates-at-record-high-on-mcx-as-geopolitical-risks-weaker-dollar-drive-safe-haven-demand-mcx-silver-11769139016851.html,2026-01-23 09:07:05 IST,"Gold price today: Gold rates jumped to a record high on Friday morning. MCX gold February futures jumped by nearly  ₹2,900, or almost 2%, to a fresh record high of  ₹1,59,226 per 10 grams. MCX silver March futures surged by more than  ₹12,600, or almost 4%, to a fresh record high of  ₹3,39,927 per kg.",https://www.livemint.com/rss/markets
"Planning to build your own house? Know home loan eligibility, tax limits, and EMI rules",https://www.livemint.com/money/personal-finance/planning-to-build-your-own-house-know-home-loan-eligibility-tax-limits-and-emi-rules-11769137280498.html,2026-01-23 09:11:39 IST,"Planning to build your own house? Learn how home loan eligibility works, EMI rules for self‑construction, and tax benefits under Sections 80C and 24(b).",https://www.livemint.com/rss/money
"Buy, Sell or Hold? Elara upgrades APL Apollo; Motilal raises Bandhan Bank",https://economictimes.indiatimes.com/markets/stocks/news/buy-sell-or-hold-elara-upgrades-apl-apollo-motilal-raises-bandhan-bank/articleshow/127233451.cms,2026-01-23 10:13:29 IST,"Brokerage commentary highlights improving fundamentals and favourable risk-reward across sectors, leading to stock upgrades and higher target prices. APL Apollo, Bandhan Bank, and InterGlobe Aviation are among the stocks receiving positive attention due to strong performance and constructive outlooks.",https://economictimes.indiatimes.com/markets/stocks/rssfeeds/2146843.cms
"Hindustan Zinc shares jump 6%, hit fresh 52-week high as silver nears $100. Should you buy, sell, hold?",https://economictimes.indiatimes.com/markets/stocks/news/hindustan-zinc-shares-jump-6-hit-fresh-52-week-high-as-silver-nears-100-should-you-buy-sell-hold/articleshow/127233226.cms,2026-01-23 10:12:12 IST,"Hindustan Zinc shares surged to a new 52-week high. This rally is fueled by record silver prices and strong analyst upgrades. HSBC and IIFL Capital have recommended buying the stock, citing its robust financial performance and positive outlook. The company reported its highest-ever quarterly revenue and profit in Q3FY26. Future capex plans indicate a focus on growth and expansion.",https://economictimes.indiatimes.com/markets/stocks/rssfeeds/2146843.cms
"Aditya Birla Sun Life AMC shares rally 6% as Citi, Nuvama upgrade stock after strong Q3 beat",https://economictimes.indiatimes.com/markets/stocks/news/aditya-birla-sun-life-amc-shares-rally-6-as-citi-nuvama-upgrade-stock-after-strong-q3-beat/articleshow/127233198.cms,2026-01-23 10:10:22 IST,"Aditya Birla Sun Life AMC shares rose sharply on Friday after a strong Q3 FY26 performance and fresh upgrades from Citi and Nuvama. The AMC posted a 20% YoY rise in net profit and steady revenue growth, prompting brokerages to highlight improving scheme performance and potential market-share recovery despite ongoing operational challenges.",https://economictimes.indiatimes.com/markets/stocks/rssfeeds/2146843.cms
Budget 2026: Can a reduction in LTCG unleash a bull market in Indian stocks?,https://economictimes.indiatimes.com/markets/stocks/news/budget-2026-can-a-reduction-in-ltcg-unleash-a-bull-market-in-indian-stocks/articleshow/127232792.cms,2026-01-23 10:06:10 IST,"Budget 2026 approaches with discussions on reducing capital gains tax for equities. While some believe it could boost investor sentiment after a year of muted returns and foreign investor selling, market experts suggest it may only offer marginal help. Global factors and corporate earnings growth are seen as more significant drivers for a sustained stock market rally.",https://economictimes.indiatimes.com/markets/stocks/rssfeeds/2146843.cms
Tanla Platforms share price up 13% after Q3 results 2026,https://www.livemint.com/market/stock-market-news/tanla-platforms-share-price-up-13-after-q3-results-2026-11769143286503.html,2026-01-23 10:39:13 IST,"Tanla Platforms share price rose 13% after reporting Q3 results, with a net profit increase of 10.8% to  ₹131.3 crore. Revenue climbed 12.1% to  ₹1,121 crore, and EBITDA grew 16.9% to  ₹190.5 crore, marking a strong quarter for the company.",https://www.livemint.com/rss/markets
Tata Capital Healthcare-backed Linux Laboratories hires Avendus as banker to raise up to $70 million,https://www.livemint.com/companies/start-ups/linux-laboratories-avendus-tata-capital-healthcare-fund-11769141519239.html,2026-01-23 10:37:21 IST,"Linux Laboratories aims to raise $50-70 million to fund its expansion plans through organic and inorganic growth, double down on its existing categories and widen its footprint beyond India",https://www.livemint.com/rss/companies
