title,link,published,summary,source
Jubilant Pharmova slips after weak Q3 performance,https://www.business-standard.com/markets/capital-market-news/jubilant-pharmova-slips-after-weak-q3-performance-126020600836_1.html,2026-02-06 14:04:57 IST,Jubilant Pharmova declined 2.40% to Rs 951.15 after the company reported 45% fall in consolidated net profit to Rs 55.8 crore in Q3 FY26 from Rs 100.7 crore in Q3 FY25.,https://www.business-standard.com/rss/markets-106.rss
Board of Tarsons Products approves change in directorate,https://www.business-standard.com/markets/capital-market-news/board-of-tarsons-products-approves-change-in-directorate-126020600785_1.html,2026-02-06 13:32:43 IST,At meeting held on 06 February 2026,https://www.business-standard.com/rss/markets-106.rss
Alembic Pharma receives USFDA approval for Parkinson's drug tablets,https://www.business-standard.com/markets/capital-market-news/alembic-pharma-receives-usfda-approval-for-parkinson-s-drug-tablets-126020600784_1.html,2026-02-06 13:32:35 IST,"Alembic Pharmaceuticals announced that it has received final approval from the US Food & Drug Administration (USFDA) for its Abbreviated New Drug Application (ANDA) for Carbidopa, Levodopa, and Entacapone tablets.",https://www.business-standard.com/rss/markets-106.rss
"Tips Music Ltd spurts 0.54%, gains for five straight sessions",https://www.business-standard.com/markets/capital-market-news/tips-music-ltd-spurts-0-54-gains-for-five-straight-sessions-126020600783_1.html,2026-02-06 13:32:28 IST,"Tips Music Ltd is quoting at Rs 561.1, up 0.54% on the day as on 12:44 IST on the NSE. The stock is down 17.61% in last one year as compared to a 8.42% fall in NIFTY and a 14.58% fall in the Nifty Media.",https://www.business-standard.com/rss/markets-106.rss
"Patanjali Foods Ltd spurts 0.53%, up for five straight sessions",https://www.business-standard.com/markets/capital-market-news/patanjali-foods-ltd-spurts-0-53-up-for-five-straight-sessions-126020600782_1.html,2026-02-06 13:32:21 IST,"Patanjali Foods Ltd is quoting at Rs 518.25, up 0.53% on the day as on 12:44 IST on the NSE. The stock is down 15.93% in last one year as compared to a 8.42% gain in NIFTY and a 6.55% gain in the Nifty FMCG.",https://www.business-standard.com/rss/markets-106.rss
Emami Ltd gains for fifth session,https://www.business-standard.com/markets/capital-market-news/emami-ltd-gains-for-fifth-session-126020600781_1.html,2026-02-06 13:32:15 IST,"Emami Ltd is quoting at Rs 506.2, up 0.58% on the day as on 12:44 IST on the NSE. The stock is down 11.63% in last one year as compared to a 8.42% fall in NIFTY and a 6.55% fall in the Nifty FMCG.",https://www.business-standard.com/rss/markets-106.rss
"ABB India Ltd soars 0.33%, rises for fifth straight session",https://www.business-standard.com/markets/capital-market-news/abb-india-ltd-soars-0-33-rises-for-fifth-straight-session-126020600780_1.html,2026-02-06 13:32:08 IST,"ABB India Ltd is quoting at Rs 5789, up 0.33% on the day as on 12:44 IST on the NSE. The stock is up 1.82% in last one year as compared to a 8.42% spurt in NIFTY and a 10.33% spurt in the Nifty Energy.",https://www.business-standard.com/rss/markets-106.rss
Bharti Hexacom share price jumps 6% as Q3 net profit rises 82% YoY,https://www.business-standard.com/markets/news/bharti-hexacom-share-price-jumps-6-as-q3-net-profit-rises-82-yoy-126020600721_1.html,2026-02-06 13:31:56 IST,"The stock rose as much as 6.2 per cent to ₹1,729, the highest level since January 12 on the National Stock Exchange (NSE)",https://www.business-standard.com/rss/markets-106.rss
"AAVAS Financiers hits 52-week low, stock slips 7% post Q3 results",https://www.business-standard.com/markets/news/aavas-financiers-hits-52-week-low-stock-slips-7-post-q3-results-126020600756_1.html,2026-02-06 13:19:43 IST,"AAVAS Financiers stock quoted lower for the eight straight trading day, and has plunged 14 per cent during this period.",https://www.business-standard.com/rss/markets-106.rss
"Dollar index holds just under two-week high, US equities stay slippery",https://www.business-standard.com/markets/capital-market-news/dollar-index-holds-just-under-two-week-high-us-equities-stay-slippery-126020600767_1.html,2026-02-06 13:16:59 IST,Powered by Capital Market - Live News,https://www.business-standard.com/rss/markets-106.rss
Bajel Projects secures Mandsaur 765kV extension project,https://www.business-standard.com/markets/capital-market-news/bajel-projects-secures-mandsaur-765kv-extension-project-126020600766_1.html,2026-02-06 13:16:52 IST,"The contract, designated as 765kV AIS Extn. Substation Package SS 108T, involves the extension of the existing 765/400/220kV Mandsaur Pooling Station (PS). The project falls under the ""Augmentation of Transformation Capacity and Implementation of line bays at Mandsaur for RE interconnection"" and is being executed through the Tariff Based Competitive Bidding (TBCB) route. The Company at present is executing the transmission line of 260 route kms from Beawar to Mandsaur Pooling station traversing through Madhya Pradesh and Rajasthan. This win 
reinforces Bajel's role in high-voltage infrastructure, critical for integrating renewable energy into the national power grid.",https://www.business-standard.com/rss/markets-106.rss
"RBI holds repo rate at 5.25%; here's what it means for markets, key sectors",https://www.business-standard.com/markets/news/rbi-holds-repo-rate-at-5-25-here-s-what-it-means-for-markets-key-sectors-126020600764_1.html,2026-02-06 13:16:47 IST,"The RBI MPC, led by governor Sanjay Malhotra, on Friday, announced to keep the repo rate unchanged at 5.25 per cent",https://www.business-standard.com/rss/markets-106.rss
Zydus receives USFDA Orphan drug designation for Desidustat,https://www.business-standard.com/markets/capital-market-news/zydus-receives-usfda-orphan-drug-designation-for-desidustat-126020600754_1.html,2026-02-06 13:05:22 IST,"Orphan drug designation by the USFDA for Desidustat, provides eligibility for certain development incentives, including tax credits for qualified clinical testing, prescription drug user fee exemptions and a potential seven-year marketing exclusivity upon the USFDA approval.",https://www.business-standard.com/rss/markets-106.rss
Tarsons Products consolidated net profit declines 4.18% in the December 2025 quarter,https://www.business-standard.com/markets/capital-market-news/tarsons-products-consolidated-net-profit-declines-4-18-in-the-december-2025-quarter-126020600753_1.html,2026-02-06 13:05:15 IST,Sales rise 12.76% to Rs 107.89 crore,https://www.business-standard.com/rss/markets-106.rss
Divyashakti standalone net profit declines 91.20% in the December 2025 quarter,https://www.business-standard.com/markets/capital-market-news/divyashakti-standalone-net-profit-declines-91-20-in-the-december-2025-quarter-126020600752_1.html,2026-02-06 13:05:09 IST,Sales decline 76.27% to Rs 4.49 crore,https://www.business-standard.com/rss/markets-106.rss
"Tata Motors PV records Q3 loss of Rs 3,486 cr; JLR disruption weighs",https://www.business-standard.com/markets/capital-market-news/tata-motors-pv-records-q3-loss-of-rs-3-486-cr-jlr-disruption-weighs-126020600751_1.html,2026-02-06 13:05:00 IST,"Tata Motors Passenger Vehicles reported consolidated net loss of Rs 3,486 crore in Q3 FY26 compared with net profit of Rs 5,406 crore in Q3 FY25.",https://www.business-standard.com/rss/markets-106.rss
RBI announces policy measures relating to financial inclusion,https://www.business-standard.com/markets/capital-market-news/rbi-announces-policy-measures-relating-to-financial-inclusion-126020600750_1.html,2026-02-06 13:04:51 IST,The Reserve Bank of India (RBI) has come up with a statement on developmental and regulatory policies. Following regulatory policy measures relating to financial inclusion were announced.,https://www.business-standard.com/rss/markets-106.rss
"Market Wrap: Sensex adds 266 pts, Nifty above 25,650; Indian rupee logs best week in over 3 years",https://economictimes.indiatimes.com/markets/stocks/news/market-wrap-sensex-adds-266-pts-nifty-above-25650-indian-rupee-logs-best-week-in-over-3-years/articleshow/127983812.cms,2026-02-06 15:50:41 IST,"Indian stock markets, Nifty and Sensex, ended Friday higher. The Reserve Bank of India maintained its policy repo rate at 5.25 percent. Cigarette stocks saw a significant surge following price increases. Global markets retreated, impacted by a Wall Street selloff and AI concerns. Crude oil futures extended losses.",https://economictimes.indiatimes.com/markets/stocks/rssfeeds/2146843.cms
14 consistent high-margin stocks rally up to 430% in a year. Do you own any?,https://economictimes.indiatimes.com/markets/stocks/news/14-consistent-high-margin-stocks-rally-up-to-430-in-a-year-do-you-own-any/slideshow/127984207.cms,2026-02-06 15:26:47 IST,"About 170 BSE-listed companies sustained profit margins above 10% for four straight quarters to December 2025. From these, 14 non-financial midcaps and largecaps delivered 50–430% one-year returns, highlighting operational efficiency, scale, and disciplined profitability amid volatile markets and investor wealth.",https://economictimes.indiatimes.com/markets/stocks/rssfeeds/2146843.cms
BEML Q3: Loss widens to Rs 22 crore YoY despite 24% revenue growth; Rs 2.5 dividend,https://economictimes.indiatimes.com/markets/stocks/news/beml-q3-loss-widens-to-rs-22-crore-yoy-despite-24-revenue-growth-rs-2-5-dividend/articleshow/127982688.cms,2026-02-06 15:24:01 IST,"Total expenses during the quarter rose sharply to Rs 1,113 crore, up from Rs 796 crore in Q2FY26 and Rs 851 crore in Q3FY25, reflecting a 40% sequential increase and a 31% year-on-year rise. The higher costs were driven by employee benefits, raw material expenses, and finance costs, among other factors.",https://economictimes.indiatimes.com/markets/stocks/rssfeeds/2146843.cms
"MRF shares surge 9% after Q3 profit doubles, dividend announcement",https://economictimes.indiatimes.com/markets/stocks/news/mrf-shares-surge-9-after-q3-profit-doubles-dividend-announcement/articleshow/127982510.cms,2026-02-06 15:18:00 IST,"MRF shares jumped up to 9% after strong December quarter results, driven by doubled profits, margin expansion, and revenue growth. Improved operating leverage and a second interim dividend boosted investor confidence despite higher costs in a volatile cost environment market.",https://economictimes.indiatimes.com/markets/stocks/rssfeeds/2146843.cms
"Top Gainers &amp; Losers on Feb 06: Hitachi Energy, Godfrey Phillips, MRF, Nykaa, IDBI Bank, HUL among top gainers",https://www.livemint.com/market/stock-market-news/top-gainers-losers-on-feb-06-hitachi-energy-godfrey-phillips-mrf-nykaa-idbi-bank-hul-among-top-gainers-11770372752687.html,2026-02-06 15:51:09 IST,"The Indian stock market gained on February 6, with Nifty 50 up 0.20% and S&amp;amp;P BSE Sensex up 0.32%, driven by FMCG and private banking stocks. Broader markets were mixed, while the Reserve Bank of India held interest rates steady at 5.25%.",https://www.livemint.com/rss/markets
"Peter Lynch’s timeless investment lesson: Why stock market crashes are opportunities, not threats",https://www.livemint.com/market/stock-market-news/peter-lynch-s-timeless-investment-lesson-why-stock-market-crashes-are-opportunities-not-threats-11770372633280.html,2026-02-06 15:47:07 IST,"Lynch, who famously ran Fidelity’s Magellan Fund, urges investors to first understand history before reacting to falling markets. His central argument is simple yet powerful: market declines are not rare events — they are inevitable.",https://www.livemint.com/rss/markets
"Sensex rises over 250 points, Nifty 50 ends above 25,650— 10 key highlights from Indian stock market today",https://www.livemint.com/market/stock-market-news/sensex-rises-over-250-points-nifty-50-ends-above-25-650-10-key-highlights-from-indian-stock-market-today-11770371562556.html,2026-02-06 15:32:31 IST,"The Sensex ended 266 points, or 0.32%, higher at 83,580.40, while the Nifty 50 closed at 25,693.70, up 51 points, or 0.20%.",https://www.livemint.com/rss/markets
"Paisalo Digital Q3 Results: Net profit remains flat at  ₹66 crore, income rises to  ₹240 crore",https://www.livemint.com/market/stock-market-news/paisalo-digital-q3-results-net-profit-remains-flat-at-rs-66-crore-income-rises-to-rs-240-crore-11770371305406.html,2026-02-06 15:23:56 IST,"Paisalo Digital reported a consolidated PAT of  ₹66.3 crore for Q3 FY26, up from  ₹62.4 crore last year. Total income rose to  ₹240.1 crore, while net income reached  ₹243 crore, marking significant growth from the previous year.",https://www.livemint.com/rss/markets
"Rupee to take cues from fine print of India-US trade deal, says RBI governor",https://www.livemint.com/market/india-us-trade-deal-rupee-movement-rupee-dollar-rate-rbi-governor-11770368205847.html,2026-02-06 15:17:17 IST,"Following the India-US trade deal announcement, the rupee posted a strong single-day gain of 124 paise to 90.27 per dollar on 3 February.",https://www.livemint.com/rss/markets
"Gold at $6,000, silver at $150: Why Harshal Dasani of INVasset PMS remains bullish on precious metals despite meltdown",https://www.livemint.com/market/stock-market-news/gold-prices-at-6-000-silver-rate-at-150-why-harshal-dasani-remains-bullish-on-precious-metals-despite-meltdown-11770370001942.html,2026-02-06 15:15:27 IST,"Gold largely remains in storage, acting as a monetary reserve and balance-sheet hedge, while silver is consumed and effectively disappears through industrial use, making its supply dynamics far tighter over time, says Harshal Dasani of INVasset PMS.",https://www.livemint.com/rss/markets
"Vanguard CEO Salim Ramji poaches talents from Wall Street rivals Goldman, BlackRock to boost asset management firm",https://www.livemint.com/companies/vanguard-ceo-salim-ramji-poaches-talents-from-wall-street-rivals-goldman-blackrock-to-boost-asset-management-firm-11770368413281.html,2026-02-06 15:34:37 IST,"Salim Ramji, CEO of Vanguard Group, is reshaping the company by recruiting talent from top Wall Street firms to bolster its asset management strategy. Recent hires aim to enhance Vanguard's focus on low-fee funds and explore higher-margin sectors such as wealth management and private markets.",https://www.livemint.com/rss/companies
Siemens board decides to defer capex for setting up metro car assembly in Aurangabad,https://www.business-standard.com/markets/capital-market-news/siemens-board-decides-to-defer-capex-for-setting-up-metro-car-assembly-in-aurangabad-126020601069_1.html,2026-02-06 15:31:58 IST,Due to continued delays in issuance of metro tenders,https://www.business-standard.com/rss/markets-106.rss
BEML slumps after posting Rs 22-cr net loss in Q3 FY26,https://www.business-standard.com/markets/capital-market-news/beml-slumps-after-posting-rs-22-cr-net-loss-in-q3-fy26-126020601068_1.html,2026-02-06 15:31:51 IST,BEML dropped 9.34% to Rs 1584.95 after the company reported consolidated net loss of Rs 22.38 crore in Q3 FY26 compared with net profit of Rs 24.41 crore posted in Q3 FY25.,https://www.business-standard.com/rss/markets-106.rss
Ashapura Minechem Ltd leads losers in 'A' group,https://www.business-standard.com/markets/capital-market-news/ashapura-minechem-ltd-leads-losers-in-a-group-126020601045_1.html,2026-02-06 15:17:01 IST,"BEML Ltd, Nazara Technologies Ltd, Poly Medicure Ltd and Cemindia Projects Ltd are among the other losers in the BSE's 'A' group today, 06 February 2026.",https://www.business-standard.com/rss/markets-106.rss
"Goodyear India, MRF surge up to 16% after strong Q3 result",https://www.business-standard.com/markets/news/goodyear-india-mrf-surge-up-to-16-after-strong-q3-result-126020600980_1.html,2026-02-06 15:06:45 IST,"Volume growth of tyre companies remained healthy, supported by robust momentum in both the OEM and replacement segments, along with continued premiumisation, said Ceat management.",https://www.business-standard.com/rss/markets-106.rss
Mahindra Group plans its largest integrated manufacturing unit in Nagpur,https://www.business-standard.com/markets/capital-market-news/mahindra-group-plans-its-largest-integrated-manufacturing-unit-in-nagpur-126020601002_1.html,2026-02-06 15:05:20 IST,"Mahindra Group today announced plans to establish its largest integrated manufacturing facility for automobiles and tractors in Nagpur, Maharashtra, marking a significant milestone in the Group's long-term growth strategy. The announcement was made at Advantage Vidarbha, a three-day flagship event positioning Vidarbha as an emerging industrial growth hub on India's manufacturing map.",https://www.business-standard.com/rss/markets-106.rss
Siemens slips after Q1 PAT drops 26% YoY to Rs 269,https://www.business-standard.com/markets/capital-market-news/siemens-slips-after-q1-pat-drops-26-yoy-to-rs-269-126020601001_1.html,2026-02-06 15:05:13 IST,"Siemens fell 3.93% to Rs 3,169.65 after reporting a 25.99% decline in consolidated net profit to Rs 268.8 crore for the quarter ended December 2025, compared with Rs 362.5 crore in the quarter ended December 2024.",https://www.business-standard.com/rss/markets-106.rss
GNG Electronics hits the roof after robust Q3 results,https://www.business-standard.com/markets/capital-market-news/gng-electronics-hits-the-roof-after-robust-q3-results-126020601000_1.html,2026-02-06 15:05:06 IST,GNG Electronics hit an upper limit of 10% at Rs 322.10 after delivering a strong set of numbers for the quarter ended 31 December 2025.,https://www.business-standard.com/rss/markets-106.rss
CL Educate Ltd leads losers in 'B' group,https://www.business-standard.com/markets/capital-market-news/cl-educate-ltd-leads-losers-in-b-group-126020600999_1.html,2026-02-06 15:04:59 IST,"Vivid Mercantile Ltd, Tokyo Plast International Ltd, Orchasp Ltd and Digidrive Distributors Ltd are among the other losers in the BSE's 'B' group today, 06 February 2026.",https://www.business-standard.com/rss/markets-106.rss
Volumes soar at Kirloskar Brothers Ltd counter,https://www.business-standard.com/markets/capital-market-news/volumes-soar-at-kirloskar-brothers-ltd-counter-126020600996_1.html,2026-02-06 15:04:51 IST,"Kirloskar Brothers Ltd clocked volume of 14.98 lakh shares by 14:14 IST on NSE, a 26.32 times surge over two-week average daily volume of 56914 shares",https://www.business-standard.com/rss/markets-106.rss
IPO Calendar: Fractal Analytics to open next week; 4 SME listings on radar,https://www.business-standard.com/markets/ipo/ipo-calendar-fractal-analytics-aye-finance-to-open-next-week-4-sme-listings-on-radar-126020600993_1.html,2026-02-06 15:04:08 IST,"Upcoming IPO Calendar: Two major mainboard IPOs, Fractal Analytics, looking to raise ₹2,833.9 crore, and Aye Finance, with an issue size of ₹1,010 crore, opening for public subscription on Monday",https://www.business-standard.com/rss/markets-106.rss
"Goldman Sachs is tapping Anthropic’s AI model to automate accounting, compliance roles",https://www.cnbc.com/2026/02/06/anthropic-goldman-sachs-ai-model-accounting.html,2026-02-06 15:46:05 IST,"Goldman Sachs is building AI agents with Anthropic’s Claude to automate trade accounting and client onboarding, aiming to speed work and boost efficiency.",https://www.cnbc.com/id/10000664/device/rss/rss.html
