title,link,published,summary,source
Accord Transformer &amp; Switchgear allotment to be finalised today: Step-by-step guide to check your allotment status,https://www.livemint.com/market/ipo/accord-transformer-switchgear-allotment-to-be-finalised-today-step-by-step-guide-to-check-your-allotment-status-11772092150290.html,2026-02-26 13:32:38 IST,"Accord Transformer &amp;amp; Switchgear's IPO allotment is expected today, following a 357 times subscription. Retail investors will receive shares proportionally, with refunds starting February 27. The IPO may list on BSE SME on March 02, with an 8 per share grey market premium.",https://www.livemint.com/rss/markets
"Stocks to buy: Nagaraj Shetti recommends Aurobindo Pharma, NMDC shares to buy",https://www.livemint.com/market/stock-market-news/stocks-to-buy-nagaraj-shetti-recommends-aurobindo-pharma-nmdc-shares-to-buy-11772090964463.html,2026-02-26 13:23:50 IST,"Domestic benchmark indices fell after profit booking and weak global signals, with Sensex down 281.81 points and Nifty 50 down 62 points. Crude oil price hikes and geopolitical tensions impacted investor sentiment. Analysts suggest Aurobindo Pharma and NMDC as short-term buy recommendations.",https://www.livemint.com/rss/markets
"IT sector valuations turn attractive after AI sell-off: Emkay; Adds Infosys, HCL Tech; Exits Mphasis in portfolio reset",https://www.livemint.com/market/stock-market-news/it-sector-valuations-turn-attractive-after-ai-sell-off-emkay-adds-infosys-hcl-tech-exits-mphasis-in-portfolio-reset-11772091609678.html,2026-02-26 13:23:44 IST,"In its model portfolio, Emkay Global has added Indus Towers, SRF, Infosys, and HCL Technologies, while exiting Sun Pharmaceutical Industries, Gravita India and Mphasis. It has trimmed its positions in Maruti Suzuki India, Larsen &amp;amp; Toubro (L&amp;amp;T), and Craftsman Automation.",https://www.livemint.com/rss/markets
Angel One share price crashes 90% today? Here’s what actually happened,https://www.livemint.com/market/stock-market-news/angel-one-stock-split-angel-one-share-price-crashes-90-today-here-s-what-actually-happened-11772089387625.html,2026-02-26 13:22:58 IST,"Following a 1:10 stock split, Angel One shares fell nearly 90% on Thursday, opening at  ₹251.35. Despite a profit decline in Q3 FY26, total income rose. The split aims to enhance liquidity while keeping overall ownership value consistent for shareholders.",https://www.livemint.com/rss/markets
Nvidia still hasn't sold its U.S.-approved China AI chips — and it’s worried local AI rivals could take over,https://www.cnbc.com/2026/02/26/nvidia-china-chip-sales-export-controls-ai-competition.html,2026-02-26 13:53:22 IST,The U.S. chipmaker has yet to confirm shipments to China despite Washington easing restrictions on exports of advanced chips.,https://www.cnbc.com/id/10000664/device/rss/rss.html
"Gold, silver soared in 2025, stocks were major drags. What could 2026 have in store for investors?",https://economictimes.indiatimes.com/markets/stocks/news/gold-silver-soared-in-2025-stocks-were-major-drags-what-could-2026-have-in-store-for-investors/articleshow/128808368.cms,2026-02-26 14:35:16 IST,"After gold and silver delivered spectacular gains in 2025, Indian equities enter 2026 shaped by slower global rate cuts, geopolitical risks and a shift from slowdown to recovery. Largecaps may stay resilient, while mid and smallcaps could benefit from improving consumption trends and banking reforms, though global growth and currency risks persist,  a report by 1 Finance suggest.",https://economictimes.indiatimes.com/markets/stocks/rssfeeds/2146843.cms
"Turnaround Play: 6 stocks turn profitable in Q3, rally up to 55% in just 3 months",https://economictimes.indiatimes.com/markets/stocks/news/turnaround-play-6-q3-profit-makers-rally-up-to-55-in-3-months/slideshow/128808076.cms,2026-02-26 13:57:58 IST,"Twenty-seven BSE-listed companies with market caps over Rs 3,000 crore turned profitable sequentially in the December quarter. While six stocks saw share price surges of 10-55%, many others declined, with the top five laggards dropping 20-40% in three months.",https://economictimes.indiatimes.com/markets/stocks/rssfeeds/2146843.cms
"HAL, BEL and other defence stocks jump up to 5% on potential India-Israel defence deal",https://economictimes.indiatimes.com/markets/stocks/news/hal-bel-and-other-defence-stocks-jump-up-to-5-on-potential-india-israel-defence-deal/articleshow/128807416.cms,2026-02-26 13:54:36 IST,"Defence stocks such as Hindustan Aeronautics, Bharat Electronics and others gained up to 5% after reports of a potential India–Israel defence pact. The agreement, expected during Prime Minister Narendra Modi’s Tel Aviv visit, may prioritise technology transfer in missile defence and advanced weapon systems.",https://economictimes.indiatimes.com/markets/stocks/rssfeeds/2146843.cms
How much gold is enough? Ray Dalio reveals ideal allocation for your portfolio; find out here,https://www.livemint.com/market/commodities/gold-price-today-how-much-gold-is-enough-ray-dalio-reveals-ideal-allocation-for-your-portfolio-find-out-here-11772093155278.html,2026-02-26 14:51:02 IST,"Ray Dalio emphasizes gold's value during instability, citing historical performance during the 1970s and 1930s crises. Gold should comprise 5-15% of portfolios as it acts as a stabilizer and diversifier, protecting wealth when traditional assets struggle amid economic uncertainties.",https://www.livemint.com/rss/markets
"Grade-A office spaces in a sweet spot, but risks loom",https://www.livemint.com/market/mark-to-market/offices-spaces-india-grade-a-office-space-reits-india-it-sector-office-leasing-11772093339510.html,2026-02-26 14:40:16 IST,"As supply increases, stagnation in occupancies or vacancy levels can spoil the party. For now, there is also no clarity on how AI impacts demand for office spaces.",https://www.livemint.com/rss/markets
Auto sales preview: Strong retail demand to drive double-digit wholesale growth in February: Report,https://www.livemint.com/market/stock-market-news/auto-sales-preview-strong-retail-demand-to-drive-double-digit-wholesale-growth-in-february-report-11772095061390.html,2026-02-26 14:33:01 IST,"February's wholesale numbers for domestic auto companies are anticipated to show double-digit growth, led by strong demand and new vehicle launches. Major OEMs like Mahindra &amp;amp; Mahindra and Tata Motors expected to see significant sales boosts.",https://www.livemint.com/rss/markets
RBI broker funding rules could give foreign proprietary traders an edge,https://www.livemint.com/market/stock-market-news/rbi-broker-funding-norms-could-give-an-edge-to-foreign-prop-traders-11772016409871.html,2026-02-26 14:23:33 IST,"Amended capital market exposure rules aimed at curbing bank lending for speculative purposes could raise costs for domestic proprietary traders, benefiting their global counterparts.",https://www.livemint.com/rss/markets
"Dassault Aviation, NVIDIA, to Elbit Systems: Is it possible to buy global stocks on NSE? Explained",https://www.livemint.com/market/stock-market-news/dassault-aviation-nvidia-to-elbit-systems-is-it-possible-to-buy-global-stocks-on-nse-explained-11772093356892.html,2026-02-26 14:17:28 IST,"The NSE has launched NSE IX, where investors will be able to buy stocks of the selcted global bourses",https://www.livemint.com/rss/markets
"Time to increase exposure to equities; remain overweight on mid, small-caps, says Mihir Vora of TRUST Mutual Fund",https://www.livemint.com/market/stock-market-news/time-to-increase-exposure-to-equities-remain-overweight-on-mid-small-caps-says-mihir-vora-of-trust-mutual-fund-11772093847824.html,2026-02-26 14:15:33 IST,"Mihir Vora of TRUST Mutual Fund believes this is the right time to increase equity exposure, anticipating healthy earnings growth. Vora highlights that he has been consistently overweight in mid- and small-caps due to greater growth opportunities in these segments.",https://www.livemint.com/rss/markets
Small-cap stock under  ₹50 hits upper circuit for second straight session,https://www.livemint.com/market/stock-market-news/smallcap-stock-under-rs-50-hits-upper-circuit-for-second-straight-session-11772094254835.html,2026-02-26 14:10:13 IST,"A-1 share price hit a 5% upper circuit following the launch of the Yellow EV brand for electric two-wheelers. The company announced significant partner-driven growth and updates on its mobile app, enhancing customer experience and operational efficiency.",https://www.livemint.com/rss/markets
‘Death of Software?’ Anand Mahindra calls AI doom ‘Greatly Exaggerated’ amid IT stock crash,https://economictimes.indiatimes.com/markets/stocks/news/death-of-software-anand-mahindra-calls-ai-doom-greatly-exaggerated-amid-it-stock-crash/articleshow/128810044.cms,2026-02-26 15:43:38 IST,"Indian IT stocks face sharp corrections amid AI disruption fears. Anand Mahindra advises against extreme AI doomsday predictions. He believes AI will pressure IT firms to adapt, focusing on outcomes and value delivery. While some roles may change, new opportunities in AI integration and governance will emerge.",https://economictimes.indiatimes.com/markets/stocks/rssfeeds/2146843.cms
"Market Wrap: Nifty, Sensex end flat in a volatile trade as heavyweight HDFC Bank drags market",https://economictimes.indiatimes.com/markets/stocks/news/market-wrap-nifty-sensex-end-flat-in-a-volatile-trade-as-heavyweight-hdfc-bank-drags-market/articleshow/128809816.cms,2026-02-26 15:42:26 IST,"Market wrap: The broader Nifty settled at 25,496.55, up 14 points or 0.06%, while the 30-stock index closed at 82,248.61, declining by 27 points or 0.03%.",https://economictimes.indiatimes.com/markets/stocks/rssfeeds/2146843.cms
"Top Gainers &amp; Losers on Feb 26: Tejas Networks, KSB, Mankind Pharma, Tata Motors, Finolex Cables among top gainers",https://www.livemint.com/market/stock-market-news/top-gainers-losers-on-feb-26-tejas-networks-ksb-mankind-pharma-tata-motors-finolex-cables-among-top-gainers-11772098770812.html,2026-02-26 16:11:17 IST,"The Indian stock market remained largely unchanged on February 26, with the Nifty 50 up 0.07% at 25,500 and the S&amp;amp;P BSE Sensex flat at 82,267. Broader markets showed mixed results, while US stocks rallied on Nvidia's strong earnings, boosting Asian markets as well.",https://www.livemint.com/rss/markets
"Sensex slips 27 points, Nifty 50 rises 14 points— 10 key highlights from the Indian stock market today",https://www.livemint.com/market/stock-market-news/sensex-slips-27-points-nifty-50-rises-14-points-10-key-highlights-from-the-indian-stock-market-today-11772100241021.html,2026-02-26 16:11:17 IST,"The Sensex ended 27 points, or 0.03%, lower at 82,248.61, while the Nifty 50 inched up by 14 points, or 0.06%, to settle at 25,496.55. The BSE 150 MidCap Index clocked a decent gain of 0.55%, while the BSE 250 SmallCap Index rose by 0.07%.",https://www.livemint.com/rss/markets
Bank of Japan interest rate decision in focus: Will BOJ tighten policy? How it could impact emerging markets like India,https://www.livemint.com/market/stock-market-news/bank-of-japan-interest-rate-decision-in-focus-will-boj-tighten-policy-how-it-could-impact-emerging-markets-like-india-11772097114305.html,2026-02-26 16:11:17 IST,"As speculation grows about potential interest rate hikes by the Bank of Japan, experts weigh in on how these changes could impact emerging markets, particularly India. In December, BOJ raised its key policy rate by 25 basis points to 0.75%, which is its highest level since September 1995.",https://www.livemint.com/rss/markets
Gaudium IVF &amp; Women Health IPO to list at discount? Here's what GMP signals ahead of debut,https://www.livemint.com/market/stock-market-news/gaudium-ivf-women-health-ipo-to-list-at-discount-heres-what-gmp-signals-ahead-of-debut-11772091507273.html,2026-02-26 16:11:17 IST,"The shares of Gaudium IVF &amp;amp; Women Health IPO are trading at a premium of  ₹-4 in the grey market, as per the websites tracking the grey market.",https://www.livemint.com/rss/markets
"Striders Impex IPO Day 1: Issue subscribed 61% so far, QIBs steal the show. Check GMP, issue details, more",https://www.livemint.com/market/ipo/striders-impex-ipo-day-1-issue-subscribed-61-so-far-qibs-steal-the-show-check-gmp-issue-details-more-11772098386029.html,2026-02-26 16:11:17 IST,"Striders Impex IPO opened on February 26, priced between  ₹71 and  ₹72 per share. Investors can bid for a minimum of 1,600 shares. The IPO aims to raise funds for expanding retail and e-commerce channels, with a current subscription status of 61% on day one.",https://www.livemint.com/rss/markets
NSE said to invite i-bank pitches for much-awaited IPO,https://www.livemint.com/market/ipo/nse-national-stock-exchange-invite-i-bank-pitches-for-ipo-stock-market-11772096677130.html,2026-02-26 16:11:17 IST,"NSE has issued RFPs to investment banks for its upcoming IPO, targeting an adviser selection by April. The move follows Sebi’s 30 January no-objection clearance.",https://www.livemint.com/rss/markets
Elbit Systems share price near record high ahead of the India-Israel defence deal,https://www.livemint.com/market/stock-market-news/elbit-systems-share-price-near-record-high-ahead-of-the-india-israel-defence-deal-11772095111044.html,2026-02-26 16:11:17 IST,India-Israel defence deal: The defence stock of Israel's stock market has given multibagger returns of 440% in five years,https://www.livemint.com/rss/markets
Data Patterns among 5 smallcap stocks that hit 52-week high; rally up to 50% in a month,https://economictimes.indiatimes.com/markets/stocks/news/data-patterns-among-5-small-cap-stocks-that-hit-52-week-high-rally-up-to-50-in-a-month/slideshow/128811874.cms,2026-02-26 16:42:39 IST,,https://economictimes.indiatimes.com/markets/stocks/rssfeeds/2146843.cms
Sebi introduces Life Cycle Funds: Radhika Gupta of Edelweiss MF explains what it means for investors,https://www.livemint.com/market/stock-market-news/sebi-introduces-life-cycle-funds-radhika-gupta-of-edelweiss-mf-explains-what-it-means-for-investors-11772099860742.html,2026-02-26 16:39:39 IST,"Radhika Gupta, CEO of Edelweiss Mutual Fund, discusses significant changes in India's asset management due to SEBI's regulatory framework. She emphasizes the introduction of Life Cycle Funds simplifies long-term investing and enhancing goal-based strategies.",https://www.livemint.com/rss/markets
Stock market holiday: When will the Indian stock market be closed for Holi?,https://www.livemint.com/market/stock-market-holiday-when-will-the-indian-stock-market-be-closed-for-holi-2026-11772102939091.html,2026-02-26 16:33:28 IST,Stock market holiday: Once can access to the entire stock market holidays list by logging in at the BSE or at the NSE websites,https://www.livemint.com/rss/markets
From US dependency to African opportunity: India's solar industry has new export option post-duty blow.,https://www.livemint.com/companies/us-duty-solar-india-africa-exports-resco-modules-mnre-china-pli-scheme-11772098850638.html,2026-02-26 17:03:37 IST,A new countervailing duty by the US on Indian solar modules are reshaping trade patterns. India's renewable energy ministry sees Africa as a strong alternative for both module exports and for developers setting up projects.,https://www.livemint.com/rss/companies
Mint Explainer: What does Meta's capitulation mean for Indian WhatsApp users and Big Tech?,https://www.livemint.com/companies/news/whatsapp-privacy-policy-india-cci-whatsapp-case-11772102543238.html,2026-02-26 16:28:09 IST,"After years of legal resistance, the social media giant’s pledge to grant users data-sharing control marks a watershed victory for Indian digital sovereignty and antitrust enforcement.",https://www.livemint.com/rss/companies
Weekly Top Picks: These stocks scored 10 on 10 on Stock Reports Plus,https://economictimes.indiatimes.com/markets/stocks/news/weekly-top-picks-these-stocks-scored-10-on-10-on-stock-reports-plus/articleshow/128813544.cms,2026-02-26 17:46:50 IST,"Stock Reports Plus, powered by Refinitiv, undertakes detailed company analysis for 4,000+ listed stocks. In addition to detailed company analyses, the report also collates analysts’ forecasts and trend analysis for each component. An average score in Stock Reports Plus is calculated by undertaking quantitative analysis of five key investment tools – earnings, fundamentals, relative valuation, risk, and price momentum.",https://economictimes.indiatimes.com/markets/stocks/rssfeeds/2146843.cms
"Gainers &amp; Losers: XTGlobal, Tejas Networks among 5 top movers on Thursday",https://economictimes.indiatimes.com/markets/stocks/news/gainers-amp-losers-xtglobal-tejas-networks-among-5-top-movers-on-thursday/slideshow/128811973.cms,2026-02-26 16:50:26 IST,"India’s benchmark indices ended flat amid selling in financial stocks. Individual stocks were active, with XTglobal, Tejas Networks and Sanofi Consumer rallying, Angel One adjusting for stock split, and Home First declining.",https://economictimes.indiatimes.com/markets/stocks/rssfeeds/2146843.cms
"PNGS Reva Diamond Jewellery IPO sails through on Day 3: Check subscription status, GMP and other key details",https://www.livemint.com/market/ipo/pngs-reva-diamond-jewellery-ipo-sails-through-on-day-3-check-subscription-status-gmp-and-other-key-details-11772105737238.html,2026-02-26 17:26:25 IST,"PNGS Reva Diamond Jewellery's IPO was fully subscribed on February 26, receiving bids for 70,31,776 shares, 1.23 times the offer. The employee segment was oversubscribed 6.74 times, while the allotment finalisation is on February 27.",https://www.livemint.com/rss/markets
Info Edge to invest  ₹250 crore in fund to back growth-stage tech startups,https://www.livemint.com/companies/news/info-edge-tech-startups-alternative-investment-fund-tech-startups-11772105734913.html,2026-02-26 17:53:43 IST,"The commitment will be made directly by Info Edge and/or through its wholly owned subsidiaries, in one or more tranches",https://www.livemint.com/rss/companies
"Crocs bets on India as top-6 global market, targets Gen-Z",https://www.livemint.com/companies/news/crocs-bets-on-india-as-top-6-global-market-targets-gen-z-footwear-genz-11772099797328.html,2026-02-26 17:09:57 IST,"Crocs India is focusing on Gen-Z marketing, launching India-themed ‘Jibbitz’, and gradually scaling its newly acquired casual shoes brand Hey Dude after stabilizing it in the US.",https://www.livemint.com/rss/companies
Sebi unveils life-cycle mutual funds; solution-oriented schemes scrapped — what it means for your portfolio,https://www.livemint.com/money/personal-finance/sebi-announces-lifecycle-funds-discontinues-solution-oriented-mutual-funds-in-the-latest-categorisation-of-schemes-11772102565148.html,2026-02-26 17:42:15 IST,Mutual funds will now be permitted to offer both value and contra mutual funds as long as the scheme portfolio overlap between the two schemes is not more than 50%.,https://www.livemint.com/rss/money
NSE CEO pitches for minimum qualifying criteria for derivatives trading,https://economictimes.indiatimes.com/markets/stocks/news/nse-ceo-pitches-for-minimum-qualifying-criteria-for-derivatives-trading/articleshow/128815847.cms,2026-02-26 19:15:05 IST,NSE's managing director and CEO Ashishkumar Chauhan on Thursday made a case for 'minimum qualifying criteria' for those participating in derivatives trading to prevent people from lower strata of society from wasting their money on speculation.,https://economictimes.indiatimes.com/markets/stocks/rssfeeds/2146843.cms
Sebi mandates market intermediaries to disclose registration details on social media from May 1,https://economictimes.indiatimes.com/markets/stocks/news/sebi-mandates-market-intermediaries-to-disclose-registration-details-on-social-media-from-may-1/articleshow/128815815.cms,2026-02-26 19:10:05 IST,"Sebi has directed all regulated entities and their agents to display registered names and registration numbers on social media platforms. The move aims to enhance transparency, curb misleading content and help investors distinguish between regulated intermediaries and unregistered market participants online.",https://economictimes.indiatimes.com/markets/stocks/rssfeeds/2146843.cms
Sebi Working Groups submit agri derivatives review reports to chairman,https://economictimes.indiatimes.com/markets/stocks/news/sebi-working-groups-submit-agri-derivatives-review-reports-to-chairman/articleshow/128814912.cms,2026-02-26 18:36:03 IST,"Working groups constituted by Sebi to review the delivery and settlement framework and existing regulatory norms in the agricultural commodity derivatives segment have submitted their reports to Chairman Tuhin Kanta Pandey, the regulator said on Thursday.",https://economictimes.indiatimes.com/markets/stocks/rssfeeds/2146843.cms
"Salesforce shares down 4% in premarket on weak guidance, raising concerns over AI competition",https://www.livemint.com/market/stock-market-news/salesforce-shares-down-4-in-premarket-on-weak-guidance-raising-concerns-over-ai-competition-11772110998643.html,2026-02-26 19:35:48 IST,"Salesforce shares are expected to open lower after a lukewarm sales growth outlook, trading down 4% pre-market at $183.79. Despite a strong quarterly performance, concerns over AI competition and revenue projections below Wall Street estimates have affected investor sentiment.",https://www.livemint.com/rss/markets
"Sebi caps mutual fund overlap, forces schemes to truly differ",https://www.livemint.com/market/sebi-mutual-fund-portfolio-overlap-rules-impact-investors-asset-managers-11772106005060.html,2026-02-26 18:48:48 IST,"In a circular issued on Thursday, the Securities and Exchange Board of India (Sebi) capped portfolio overlaps at 50% for sectoral and thematic equity schemes with other equity schemes within the same fund house, barring large-cap funds.",https://www.livemint.com/rss/markets
India to shift solar manufacturing subsidy from sales-linked PLI to upfront capex support for key components: MNRE secy,https://www.livemint.com/companies/solar-subsidy-india-manufacturing-renewable-energy-capex-pli-wafers-polysilicon-mnre-santosh-kumar-sarangi-psa-agripv-11772108141446.html,2026-02-26 19:13:50 IST,"The MNRE's new strategy aims to boost domestic production of wafers, ingots, and polysilicon, addressing gaps in previous incentive schemes. This move is crucial for India's ambitious green energy targets.",https://www.livemint.com/rss/companies
India needs $750 million in flexible funding to build 100 ‘non-profit Unicorns’ in 5 years: Report,https://www.livemint.com/companies/india-needs-750-million-in-flexible-funding-to-build-100-non-profit-unicorns-in-5-years-report-11772109786362.html,2026-02-26 19:08:25 IST,A new report reveals India requires $750 million in flexible funding over five years to create 100 'non-profit unicorns' that could significantly impact social development goals. The findings highlight funding constraints and regulatory challenges that hinder the growth of impactful non-profits.,https://www.livemint.com/rss/companies
Native acquires strategic stake in RPO venture Woven,https://www.livemint.com/companies/native-acquires-woven-recruitment-process-outsourcing-talent-solutions-india-growth-11772106441747.html,2026-02-26 18:31:41 IST,Native expands into recruitment process outsourcing by taking a stake in Woven to create an end-to-end talent platform.,https://www.livemint.com/rss/companies
Sebi’s new MF rulebook: Clarity or more clutter?,https://www.livemint.com/money/personal-finance/sebi-mutual-fund-circular-mf-category-overhaul-mf-schemes-11772107957330.html,2026-02-26 19:16:02 IST,Sebi's new categorisation circular fixes old problems while handing the industry fresh material for the next round of product clutter,https://www.livemint.com/rss/money
Home First Finance bulk deal alert: Promoters sell stake worth Rs 660 crore; Societe Generale among buyers,https://economictimes.indiatimes.com/markets/stocks/news/home-first-finance-bulk-deal-alert-promoters-sell-stake-worth-rs-660-crore-societe-generale-among-buyers/articleshow/128818139.cms,2026-02-26 20:44:19 IST,"Home First Finance shares fell nearly 6% after promoters Aether and True North sold Rs 660 crore stake via bulk deals to Societe Generale and PICTET. Despite the decline, the stock has outperformed benchmarks over one year and posted strong quarterly profit growth.",https://economictimes.indiatimes.com/markets/stocks/rssfeeds/2146843.cms
Market Trading Guide: Buy Data Patterns and Finolex Cables on Friday for short term gains,https://economictimes.indiatimes.com/markets/stocks/news/market-trading-guide-buy-data-patterns-and-finolex-cables-on-friday-for-short-term-gains/articleshow/128817891.cms,2026-02-26 20:32:07 IST,"The Nifty ended flat as financial stocks dragged despite gains in auto and consumer sectors. Technical indicators signal continued weakness, with resistance at 25,550–25,600 and downside risk toward 25,300. Analysts recommend buying Data Patterns and Finolex Cables on bullish breakouts.",https://economictimes.indiatimes.com/markets/stocks/rssfeeds/2146843.cms
"Sebi warns investors against fake STT notices, flags market scams",https://www.livemint.com/market/stock-market-news/sebi-fake-stt-notices-market-scams-stock-exchanges-11772115148415.html,2026-02-26 20:26:33 IST,"Sebi said it has observed cases where entities impersonate its officials, misuse names and designations, and create fake email IDs resembling those of the regulator.",https://www.livemint.com/rss/markets
