title,link,published,summary,source
Pre-market action: Here's the trade setup for today's session,https://economictimes.indiatimes.com/markets/stocks/news/pre-market-action-heres-the-trade-setup-for-todays-session/articleshow/126425267.cms,2026-01-09 06:42:25 IST,"Indian stock markets saw a sharp decline on Thursday. The Nifty dropped significantly as investors worried about potential US tariffs. Foreign institutional investors continued to sell shares. Global markets also showed weakness. Analysts expect the market to remain under pressure in the near term. The India VIX, a measure of market fear, surged. The rupee weakened against the US dollar.",https://economictimes.indiatimes.com/markets/stocks/rssfeeds/2146843.cms
"Stocks in news: RIL, BHEL, NTPC, Bharat Forge, Ashok Leyland",https://economictimes.indiatimes.com/markets/stocks/news/stocks-in-news-ril-bhel-ntpc-bharat-forge-ashok-leyland/articleshow/126425250.cms,2026-01-09 06:38:41 IST,"Markets closed lower on Thursday due to weak global cues, with the Nifty breaching a key support level. Several companies are in focus today: Bharat Forge partnered with Agile Robots for AI automation, BHEL secured a coal gasification order, RIL may consider buying Venezuelan oil, NTPC plans nuclear power projects, and Ashok Leyland inaugurates its new EV plant.",https://economictimes.indiatimes.com/markets/stocks/rssfeeds/2146843.cms
"Asian stocks edge up before US jobs data, tariff ruling",https://economictimes.indiatimes.com/markets/stocks/news/asian-stocks-edge-up-before-us-jobs-data-tariff-ruling/articleshow/126425212.cms,2026-01-09 06:34:29 IST,"Asian equities saw a modest rise after a two-day decline, as investors awaited US payrolls data and a potential Supreme Court ruling on President Trump's tariffs.  Money has shifted from tech giants to smaller companies, with the Russell 2000 outperforming the Nasdaq 100.  US jobs data will offer clues on the Federal Reserve's interest rate path.",https://economictimes.indiatimes.com/markets/stocks/rssfeeds/2146843.cms
Will proposed US tariffs trigger further Indian market decline? Experts weigh in,https://economictimes.indiatimes.com/markets/stocks/news/will-proposed-us-tariffs-trigger-further-indian-market-decline-experts-weigh-in/articleshow/126425157.cms,2026-01-09 06:22:24 IST,"Indian stock markets experienced a significant drop on Thursday, with major indices falling around 1 percent. This decline, the steepest since August, was triggered by news of proposed steep tariffs on Russian oil imports. Investors are now closely watching the US Supreme Court's decision on the legality of these tariffs.",https://economictimes.indiatimes.com/markets/stocks/rssfeeds/2146843.cms
RBI plans cooling-off for UCB directors,https://economictimes.indiatimes.com/markets/stocks/news/rbi-plans-cooling-off-for-ucb-directors/articleshow/126425124.cms,2026-01-09 06:13:08 IST,"The Reserve Bank of India is proposing new guidelines for co-operative banking, mandating a three-year cooling-off period for urban co-operative bank directors after a decade of continuous service. During this time, directors can only be members or customers, though they may serve on other bank boards.",https://economictimes.indiatimes.com/markets/stocks/rssfeeds/2146843.cms
Bajaj Finserv completes acquisition of Allianz stake in insurance JVs,https://economictimes.indiatimes.com/markets/stocks/news/bajaj-finserv-completes-acquisition-of-allianz-stake-in-insurance-jvs/articleshow/126425104.cms,2026-01-09 06:08:12 IST,"Bajaj Finserv and its promoter group have acquired a combined 97% stake in Bajaj Allianz General Insurance and Bajaj Allianz Life Insurance from Allianz SE, concluding a 20-year partnership.  The transactions, finalized through share purchase agreements, significantly increased Bajaj Finserv's direct holdings to 75.01% in both entities.",https://economictimes.indiatimes.com/markets/stocks/rssfeeds/2146843.cms
FPI Registration: Sebi allows digital signatures,https://economictimes.indiatimes.com/markets/stocks/news/fpi-registration-sebi-allows-digital-signatures/articleshow/126425067.cms,2026-01-09 05:59:05 IST,"The Securities and Exchange Board of India (Sebi) has simplified the foreign portfolio investor (FPI) registration process by introducing digital signatures. This new functionality, integrated into the common application form (CAF) portal, allows applicants to apply for DSC directly while submitting their registration, creating a unified and streamlined onboarding experience.",https://economictimes.indiatimes.com/markets/stocks/rssfeeds/2146843.cms
Electronics stocks need a spark of profit for D-St vibe,https://economictimes.indiatimes.com/markets/stocks/news/electronics-stocks-need-a-spark-of-profit-for-d-st-vibe/articleshow/126425019.cms,2026-01-09 05:46:41 IST,"JP Morgan anticipates 2026 will be a crucial year for India's electronics manufacturing services (EMS) sector, with stocks facing a significant test after underperforming in 2025. A sustained recovery for these shares will depend on companies demonstrating improved profitability, with key triggers including the extension of the mobile PLI scheme and the rollout of ISM 2.0.",https://economictimes.indiatimes.com/markets/stocks/rssfeeds/2146843.cms
Exporters shares slump on US warning of higher tariffs,https://economictimes.indiatimes.com/markets/stocks/news/exporters-shares-slump-on-us-warning-of-higher-tariffs/articleshow/126424941.cms,2026-01-09 05:29:56 IST,"Indian exporter shares fell sharply. Donald Trump's support for a bill proposing 500% tariffs on Indian imports caused panic. This could significantly increase existing tariffs. Textile, apparel, seafood, and drug makers saw their shares drop. Experts advise caution and focusing on domestic companies. Clarity on the tariffs is awaited.",https://economictimes.indiatimes.com/markets/stocks/rssfeeds/2146843.cms
Stock Radar: Tata Power stock breaks out from descending trendline resistance; time to buy?,https://economictimes.indiatimes.com/markets/stocks/news/stock-radar-tata-power-stock-breaks-out-from-descending-trendline-resistance-time-to-buy/articleshow/126411180.cms,2026-01-09 05:00:00 IST,"Tata Power stock is showing positive signs. A double bottom pattern has formed on daily charts. The stock has also broken a descending trendline. Experts suggest buying the stock for a target of Rs 470 in the next 3-4 months. The stock is considered undervalued. High volume was seen on January 2, 2026.",https://economictimes.indiatimes.com/markets/stocks/rssfeeds/2146843.cms
Credit costs rise for Shapoorji Pallonji Group firm as refinancing timeline slips,https://economictimes.indiatimes.com/markets/stocks/news/credit-costs-rise-for-shapoorji-pallonji-group-firm-as-refinancing-timeline-slips/articleshow/126425083.cms,2026-01-09 00:50:28 IST,"The step-up was triggered after Goswami Infratech, a borrower linked to the structure, did not complete a refinancing by December end, said the people cited above. Although not a covenant breach, the delay requires existing borrowings to be repriced if fresh debt was raised at a higher cost.",https://economictimes.indiatimes.com/markets/stocks/rssfeeds/2146843.cms
"Premium gain, margin strain likely for insurers in December quarter",https://economictimes.indiatimes.com/markets/stocks/news/premium-gain-margin-strain-likely-for-insurers-in-december-quarter/articleshow/126425080.cms,2026-01-09 00:44:03 IST,"Most large life insurers, including LIC, HDFC Life, Axis Max and SBI Life, are set to post double-digit APE growth in Oct–Dec 2025, aided by GST tailwinds and a favourable base after new surrender value norms.",https://economictimes.indiatimes.com/markets/stocks/rssfeeds/2146843.cms
IndusInd Bank plans bigger board for better governance,https://economictimes.indiatimes.com/markets/stocks/news/indusind-bank-plans-bigger-board-for-better-governance/articleshow/126425087.cms,2026-01-09 00:40:34 IST,"The bank is considering increasing its board strength to around a dozen members from the current nine with the aim of strengthening oversight and aligning with evolving regulatory expectations. Currently, managing director and CEO Rajiv Anand is the only executive on the board. Others are non-executive and independent directors.",https://economictimes.indiatimes.com/markets/stocks/rssfeeds/2146843.cms
Banks narrow NBFCs’ lead as India’s gold loan market turns nearly 50-50,https://economictimes.indiatimes.com/markets/stocks/news/banks-narrow-nbfcs-lead-as-indias-gold-loan-market-turns-nearly-50-50/articleshow/126425072.cms,2026-01-09 00:34:54 IST,"NBFCs' share of aggregate gold loans fell by nearly 20 percentage points over the past five years to 50.3% as of March 2025, from 69.4% in 2020. In the same period, banks increased their share to 49.7% from 30.6%, data showed.",https://economictimes.indiatimes.com/markets/stocks/rssfeeds/2146843.cms
Breakout stocks to buy or sell: Sumeet Bagadia recommends five shares to buy today — 9 January 2026,https://www.livemint.com/market/stock-market-news/breakout-stocks-to-buy-or-sell-sumeet-bagadia-recommends-five-shares-to-buy-today-9-january-2026-11767919801997.html,2026-01-09 06:49:07 IST,"Breakout stocks to buy or sell: Sumeet Bagadia recommends five shares to buy today — INOX India, Ramco Cements Limited, Netweb Technologies India, Sobha, and Onesource Specialty Pharma.",https://www.livemint.com/rss/markets
"Stock market today: Trade guide for Nifty 50 to gold, silver rates — eight stocks to buy or sell on 9 January 2026",https://www.livemint.com/market/stock-market-news/stock-market-today-trade-guide-for-nifty-50-to-gold-silver-rates-eight-stocks-to-buy-or-sell-on-9-january-2026-11767896379780.html,2026-01-09 06:38:11 IST,"Stock market today: Experts have recommended eight stocks to buy today — AIA Engineering, India Cements, Dr. Reddy's Lab, Infosys, Kfin Technologies, Netweb Technologies India, Fertilizers and Chemicals Travancore, and Zensar Technologies.&amp;nbsp;",https://www.livemint.com/rss/markets
Stock recommendations for 9 January from MarketSmith India,https://www.livemint.com/market/stock-market-news/stock-recommendations-9-january-top-stock-picks-marketsmith-india-11767874319055.html,2026-01-09 06:00:52 IST,"MarketSmith India reveals its top stock recommendations for today, 9 January. Get expert insights into the best-performing stocks to guide your investment decisions.",https://www.livemint.com/rss/markets
Elon Musk's xAI reports $1.46 billion loss as startup rapidly expands operations — what we know,https://www.livemint.com/companies/news/elon-musks-xai-reports-1-46-billion-loss-as-startup-rapidly-expands-operations-what-we-know-11767919397030.html,2026-01-09 06:39:09 IST,"Elon Musk’s xAI is burning cash quickly as it builds data centers, recruits talent and developd software to power humanoid robots, internal documents showed. The artificial intelligence startup is reported $1.46 billion loss for the September quarter. &amp;nbsp;",https://www.livemint.com/rss/companies
"Green power is hot again, Stonepeak circles AM Green for mega deal",https://www.livemint.com/companies/stonepeak-eyes-am-green-hold-co-stake-in-1-4-billion-deal-mitsui-also-doing-due-diligence-11767878784492.html,2026-01-09 06:00:52 IST,"AM Green will use $650 million from the transaction to repay its private credit, and the rest into various capex projects in bio-fuel, aluminium and ammonia projects.",https://www.livemint.com/rss/companies
"From mega M&amp;As to aggressive expansion, 2025 was the year of Indian conglomerates. Will the momentum sustain in 2026?",https://www.livemint.com/companies/india-2025-conglomerates-acquisitions-organic-expansion-momentum-sustain-2026-11767077736879.html,2026-01-09 06:00:31 IST,"India's top conglomerates excelled in 2025 with significant M&amp;amp;As and capital expenditure, reflecting resilience amid global challenges. Experts caution against overleveraging and stress the importance of succession planning as India's top business houses prepare for sustained growth in 2026.",https://www.livemint.com/rss/companies
BEL shares in focus after securing Rs 569 crore worth of defence orders since last disclosure,https://economictimes.indiatimes.com/markets/stocks/news/bel-shares-in-focus-after-securing-rs-569-crore-worth-of-defence-orders-since-last-disclosure/articleshow/126426369.cms,2026-01-09 08:51:23 IST,"Defence major Bharat Electronics announced securing additional orders worth Rs 569 crore, including drone detection and jamming systems, bolstering its order book. This follows a similar order win on January 1, reaffirming BEL's crucial role in India's defence manufacturing. The company also reported an 18% year-on-year rise in standalone profit after tax for the July-September quarter of FY26.",https://economictimes.indiatimes.com/markets/stocks/rssfeeds/2146843.cms
Bansal Wire shares in focus as 20% equity becomes eligible for trading after lock-in expiry,https://economictimes.indiatimes.com/markets/stocks/news/bansal-wire-shares-in-focus-as-20-equity-becomes-eligible-for-trading-after-lock-in-expiry/articleshow/126426113.cms,2026-01-09 08:31:11 IST,"Bansal Wire Industries shares are poised for attention as a significant lock-in period expires on January 9, freeing up nearly 20% of its outstanding equity for trading. This development follows the company's recent announcement of record sales volumes for the December quarter, indicating strong operational performance. Market participants will be closely monitoring any potential trading activity.",https://economictimes.indiatimes.com/markets/stocks/rssfeeds/2146843.cms
"BHEL shares in focus after Rs 5,400 crore order win from JV firm with CIL",https://economictimes.indiatimes.com/markets/stocks/news/bhel-shares-in-focus-after-rs-5400-crore-order-win-from-jv-firm-with-cil/articleshow/126426080.cms,2026-01-09 08:28:34 IST,"Bharat Heavy Electricals Limited is set for a busy Friday. The company secured a major Rs 5,400 crore order for a coal gasification project in Odisha.  Additionally, BHEL has begun supplying traction converters for the new Vande Bharat Sleeper trains. This marks BHEL's entry into the semi-high-speed propulsion market.  Other train components are also in production.",https://economictimes.indiatimes.com/markets/stocks/rssfeeds/2146843.cms
IEX shares in focus ahead of APTEL hearing on market coupling case,https://economictimes.indiatimes.com/markets/stocks/news/iex-shares-in-focus-ahead-of-aptel-hearing-on-market-coupling-case/articleshow/126426054.cms,2026-01-09 08:26:50 IST,Indian Energy Exchange shares are under scrutiny today. The Electricity Appellate Tribunal hears arguments in the market coupling case. This case could change how electricity prices are discovered. The Central Electricity Regulatory Commission is willing to take directions from the tribunal. Investor sentiment has improved following recent developments. The outcome will shape the future of power exchanges.,https://economictimes.indiatimes.com/markets/stocks/rssfeeds/2146843.cms
"Stocks to buy in 2026: Titan, Waaree Energies among 5 stocks that could give double digit returns in long term",https://economictimes.indiatimes.com/markets/stocks/news/stocks-to-buy-in-2026-titan-waaree-energies-among-5-stocks-that-could-give-double-digit-returns-in-long-term/slideshow/126425683.cms,2026-01-09 07:53:36 IST,We have collated a list of recommendations from top brokerage firms from ETNow and other sources.,https://economictimes.indiatimes.com/markets/stocks/rssfeeds/2146843.cms
Negative Breakout: These 11 stocks cross below their 200 DMAs,https://economictimes.indiatimes.com/markets/stocks/news/negative-breakout-these-11-stocks-cross-below-their-200-dmas/slideshow/126425646.cms,2026-01-09 07:46:36 IST,The 200 DMA is used as a key indicator by traders for determining the overall trend in a particular stock.,https://economictimes.indiatimes.com/markets/stocks/rssfeeds/2146843.cms
CVC Capital Partners leads race to buy ValueLabs at $1–1.2 billion valuation,https://economictimes.indiatimes.com/markets/stocks/news/cvc-capital-partners-leads-race-to-buy-valuelabs-at-11-2-billion-valuation/articleshow/126425342.cms,2026-01-09 06:00:00 IST,"CVC has an exclusivity agreement with ValueLabs, founded in 1997 by Arjun Rao Donakanti (87% owner). Promoters may retain 15–20% and management will continue running the firm.",https://economictimes.indiatimes.com/markets/stocks/rssfeeds/2146843.cms
"Stocks to watch: IREDA, Reliance Industries, BEL, RVNL among 10 shares in focus today; full list inside",https://www.livemint.com/market/stock-market-news/stocks-to-watch-ireda-reliance-industries-bel-rvnl-among-10-shares-in-focus-today-full-list-inside-11767925818662.html,2026-01-09 08:36:00 IST,"Stock market today: On Thursday, benchmark indices Sensex and Nifty saw a steep, broad-based decline in line with weak global market trends.",https://www.livemint.com/rss/markets
IREDA share price in focus ahead of Q3 FY26 results: Here's what experts expect from the PSU’s earnings,https://www.livemint.com/market/stock-market-news/ireda-share-price-in-focus-ahead-of-q3-fy26-results-heres-what-experts-expect-from-the-psu-s-earnings-11767924929992.html,2026-01-09 08:10:10 IST,"As IREDA prepares to unveil its Q3 FY26 results, analysts predict strong loan growth and stable earnings driven by the renewable energy sector. The PSU stock has seen profit booking recently; on the weekly scale, it is down nearly 4%, looking set to snap its two-week winning run.",https://www.livemint.com/rss/markets
"Nifty 50, Sensex today: What to expect from the Indian stock market in intraday trade on Friday — 9 January 2026",https://www.livemint.com/market/stock-market-news/nifty-50-sensex-today-what-to-expect-from-the-indian-stock-market-in-intraday-trade-on-friday-9-january-2026-11767924109440.html,2026-01-09 07:54:42 IST,"Stock market today: Early indications from Gift Nifty suggested a positive start to the day, with the index trading at 26,002.5—up around 35 points, or 0.13%, from its previous close.",https://www.livemint.com/rss/markets
"Buy or sell: Amid volatile gold, silver rates, Vaishali Parekh recommends three intraday stocks to buy today",https://www.livemint.com/market/stock-market-news/buy-or-sell-amid-volatile-gold-silver-rates-vaishali-parekh-recommends-three-intraday-stocks-to-buy-today-11767923047147.html,2026-01-09 07:52:32 IST,"Buy or sell: Vaishali Parekh recommends three intraday stocks to buy today — IDFC First Bank, CG Power, and Data Patterns",https://www.livemint.com/rss/markets
"7 key things that changed for the market overnight - Gift Nifty to gold, silver prices",https://www.livemint.com/market/stock-market-news/7-key-things-that-changed-for-the-market-overnight-gift-nifty-to-gold-silver-prices-11767921347115.html,2026-01-09 07:28:12 IST,"Stock market today: Early trends in Gift Nifty also pointed towards a positive start to Friday's session, as Gift Nifty was trading at 26,002.5, which is around 35 points or 0.13% up from the previous close.",https://www.livemint.com/rss/markets
"Silver rate today LIVE: Silver price in India cracks over  ₹16,000 from record high — More pain ahead?",https://www.livemint.com/market/commodities/silver-rate-today-live-track-latest-silver-price-today-on-mcx-comex-heres-what-analysts-recommend-on-silver-outlook-11767872768079.html,2026-01-09 07:04:54 IST,"Silver rate today LIVE: MCX gold price finished at  ₹2,42,631 per kg on Thursday, losing over  ₹16,500 from the record high of  ₹2,59,322.",https://www.livemint.com/rss/markets
Three crude oil stocks to benefit amid US-Venezuela tension,https://www.livemint.com/market/stock-market-news/crude-oil-stocks-us-venezuela-tensions-oil-prices-ongc-ioc-reliance-11767871516126.html,2026-01-09 07:00:14 IST,Here are a three crude oil stocks to consider amid US-Venezuela tensions. Some of these stocks have direct benefits with easing tensions.,https://www.livemint.com/rss/markets
