title,link,published,summary,source
Pre-market action: Here's the trade setup for today's session,https://economictimes.indiatimes.com/markets/stocks/news/pre-market-action-heres-the-trade-setup-for-todays-session/articleshow/127217181.cms,2026-01-23 06:44:35 IST,"Indian equities rebounded on Thursday, snapping a three-day decline. Analysts anticipate market movements to be influenced by global cues, macro indicators, and ongoing quarterly earnings. Key companies like JSW Steel and BPCL are set to announce their results on Friday, while the India VIX saw a dip.",https://economictimes.indiatimes.com/markets/stocks/rssfeeds/2146843.cms
"Stocks in news: IndusInd Bank, Adani Green, IndiGo, RIL, Adani Energy",https://economictimes.indiatimes.com/markets/stocks/news/stocks-in-news-indusind-bank-adani-green-indigo-ril-adani-energy/articleshow/127216805.cms,2026-01-23 06:39:06 IST,"Markets rebounded on Thursday, driven by improved global trade and geopolitical sentiment. The Nifty is nearing its 200-day DEMA, with sustained gains crucial for further recovery. Several companies, including IndusInd Bank and Adani Green, are in focus due to Q3 results and news developments.",https://economictimes.indiatimes.com/markets/stocks/rssfeeds/2146843.cms
"Asian stocks rise, gold gains on weaker dollar",https://economictimes.indiatimes.com/markets/stocks/news/asian-stocks-rise-gold-gains-on-weaker-dollar/articleshow/127216442.cms,2026-01-23 06:34:52 IST,"Asian equities climbed Friday, mirroring Wall Street's gains, as upbeat US economic data and easing geopolitical tensions boosted investor confidence. The dollar weakened, fueling a rise in gold prices, while emerging market assets broadly rallied amid signs of de-escalating US-Europe trade friction and a record pace of fund inflows.",https://economictimes.indiatimes.com/markets/stocks/rssfeeds/2146843.cms
"Indian stocks, rupee rebound as Trump remarks ease concerns over tariffs on Europe",https://economictimes.indiatimes.com/markets/stocks/news/indian-stocks-rupee-rebound-as-trump-eases-greenland-tariff-fears/articleshow/127215379.cms,2026-01-23 06:22:00 IST,"Indian stocks and the rupee saw a rebound on Thursday. This recovery followed US President Donald Trump's remarks easing concerns over tariffs on Europe. The NSE Nifty and BSE Sensex closed higher, snapping a losing streak. The Indian rupee also recovered against the dollar. Geopolitical anxiety lessened, impacting gold and silver prices. Foreign portfolio investors continued to sell shares.",https://economictimes.indiatimes.com/markets/stocks/rssfeeds/2146843.cms
Banks want RBI to inject Rs 3-5 lakh crore via OMO,https://economictimes.indiatimes.com/markets/stocks/news/banks-want-rbi-to-inject-rs-3-5-lakh-crore-via-omo/articleshow/127214922.cms,2026-01-23 06:14:28 IST,"Indian lenders are pushing the Reserve Bank of India to commit to substantial open market operations (OMOs) of at least ₹3-5 lakh crore. This move aims to ease liquidity, lower yields, and boost credit growth. Economists also voiced concerns about inflation and GDP data uncertainty, urging caution on rate cuts until new figures are released.",https://economictimes.indiatimes.com/markets/stocks/rssfeeds/2146843.cms
IIFL nosedives 17% after receiving income-tax notice,https://economictimes.indiatimes.com/markets/stocks/news/iifl-nosedives-17-after-receiving-income-tax-notice/articleshow/127213510.cms,2026-01-23 05:52:17 IST,"IIFL Finance shares plunged 17% despite a 20% profit rise after receiving an income-tax notice for a past block period. The company deposited ₹1.47 crore towards potential revision of its returns. Despite the slump, IIFL Finance declared a 200% interim dividend as net profit grew to ₹501 crore.",https://economictimes.indiatimes.com/markets/stocks/rssfeeds/2146843.cms
"ET@Davos 2026: ‘India has already arrived, no longer an emerging market,’ says Blackstone CEO Schwarzman",https://economictimes.indiatimes.com/markets/stocks/news/etdavos-2026-india-has-already-arrived-no-longer-an-emerging-market-says-blackstone-ceo-schwarzman/articleshow/127215209.cms,2026-01-23 05:30:00 IST,"Blackstone, a global investment giant, no longer considers India an emerging market.  The firm sees immense growth potential in India, citing its large population and stable government.  Blackstone plans to expand its investments across various sectors.  Artificial intelligence is also highlighted as a technology set to transform the world rapidly.  This outlook contrasts with short-term stock market fluctuations.",https://economictimes.indiatimes.com/markets/stocks/rssfeeds/2146843.cms
Stock Radar: Titan Company stock slips after hitting record highs earlier in January; time to buy the dip?,https://economictimes.indiatimes.com/markets/stocks/news/stock-radar-titan-company-stock-slips-after-hitting-record-highs-earlier-in-january-time-to-buy-the-dip/articleshow/127136277.cms,2026-01-23 05:00:00 IST,"Titan Company, a prominent player in the gems and jewellery sector, is showing signs of an upward trend. Following a recent dip from record highs, experts anticipate a bounce back. Short-term traders are advised to consider buying the stock with a target of Rs 4,250. The company's strong market share and sector resilience support this outlook.",https://economictimes.indiatimes.com/markets/stocks/rssfeeds/2146843.cms
Credit flow to commercial sector jumps 15% to Rs 298 lakh crore: RBI data,https://economictimes.indiatimes.com/markets/stocks/news/credit-flow-to-commercial-sector-jumps-15-to-rs-298-lakh-crore-rbi-data/articleshow/127214643.cms,2026-01-22 11:56:40 IST,"Financial resources for businesses saw a significant 15% increase, reaching Rs 298 lakh crore by December. This growth was fueled by both banks and non-bank lenders. Non-bank credit now forms a substantial 47% of these total flows. NBFCs are expanding lending faster than banks. Corporate bond issuance also contributed to this positive trend.",https://economictimes.indiatimes.com/markets/stocks/rssfeeds/2146843.cms
Stocks to buy: Raja Venkatraman recommends top picks for 23 January,https://www.livemint.com/market/stock-market-news/stocks-to-buy-raja-venkatraman-top-picks-23-january-sensex-nifty-hcl-technologies-tata-steel-bharat-electronics-11769087482200.html,2026-01-23 06:00:47 IST,"Market expert Raja Venkatraman shares his top stocks to buy today, 23 January. Discover his exclusive picks and analysis to inform your investment strategy.",https://www.livemint.com/rss/markets
Stock recommendations for 23 January from MarketSmith India,https://www.livemint.com/market/stock-market-news/stock-recommendations-23-january-marketsmith-india-top-stock-picks-sensex-nifty-11769083101353.html,2026-01-23 06:00:46 IST,"MarketSmith India reveals its top stock recommendations for today, 23 January. Get expert insights into the best-performing stocks to guide your investment decisions.",https://www.livemint.com/rss/markets
Retail investors boost IPO allotment odds via parent shares,https://www.livemint.com/market/retail-investors-boost-ipo-allotment-odds-via-parent-shares-bccl-icici-pru-amc-ntpc-green-11769079334258.html,2026-01-23 06:00:27 IST,"Some IPOs set aside a small portion of shares for existing shareholders of the parent or group company. This bucket is much smaller than the regular retail category, but it also attracts far fewer applicants. As a result, allotment odds are usually better.",https://www.livemint.com/rss/markets
"Q3 results 2026: IndusInd Bank, JSW Steel to Cipla - 54 companies to declare earnings today; check full list",https://www.livemint.com/market/stock-market-news/q3-results-2026-indusind-bank-jsw-steel-to-cipla-54-companies-to-declare-earnings-today-check-full-list-11769103501664.html,2026-01-23 05:00:45 IST,"Q3 results 2026: On January 23, 2026, 54 Indian firms will report Q3 results, with significant players like Cipla and JSW Steel. Analysts predict a margin increase and a decline in provisions, but JSW Steel may experience reduced EBITDA due to market pressures.",https://www.livemint.com/rss/markets
"TikTok, parent ByteDance form JV to transfer parts of US business to investors Oracle, Silver Lake and MGX",https://www.livemint.com/companies/news/tiktok-parent-bytedance-form-jv-transfer-part-us-business-to-investors-larry-ellison-oracle-pe-silver-lake-abu-dhabi-mgx-11769130040830.html,2026-01-23 06:39:25 IST,"TikTok and parent ByteDance have formed a joint venture to transfer parts of TikTok's US business to non-Chinese owners, ensuring the app's future in the US. This deal was initiated to address national security concerns and avoid a ban on the platform.",https://www.livemint.com/rss/companies
Budget 2026: What it will take to make India’s new tax law work,https://www.livemint.com/money/personal-finance/budget-2026-what-it-will-take-to-make-india-s-new-tax-law-work-11769001342621.html,2026-01-23 06:00:26 IST,"With the Income Tax Act, 2025, set to kick in from 1 April, the upcoming Budget must prioritize compliance, clarity and credibility over further tax rate cuts.",https://www.livemint.com/rss/money
Bharat Electronics among 6 stocks showing bullish RSI upswing,https://economictimes.indiatimes.com/markets/stocks/news/bharat-electronics-among-6-stocks-showing-bullish-rsi-upswing/slideshow/127227759.cms,2026-01-23 08:59:12 IST,An uptrend signal is generated when the RSI crosses above 50 from below.,https://economictimes.indiatimes.com/markets/stocks/rssfeeds/2146843.cms
"DLF shares in focus after turning gross debt-free, Q3 net profit rises 14% YoY",https://economictimes.indiatimes.com/markets/stocks/news/dlf-shares-in-focus-after-turning-gross-debt-free-q3-net-profit-rises-14-yoy/articleshow/127226388.cms,2026-01-23 08:45:56 IST,"DLF shares are in focus after a strong Q3 performance. The company reported a 14.4% jump in net profit to Rs 1,207 crore. DLF also achieved a significant milestone by becoming gross debt-free for the first time since its 2007 IPO. Strong operating performance and consistent growth from its annuity business contributed to these positive results.",https://economictimes.indiatimes.com/markets/stocks/rssfeeds/2146843.cms
Fear comes to India’s property developers: Andy Mukherjee,https://economictimes.indiatimes.com/markets/stocks/news/fear-comes-to-indias-property-developers-andy-mukherjee/articleshow/127224706.cms,2026-01-23 08:24:48 IST,Indian property stocks are falling as developers struggle with construction delays and rising costs.  Investors are wary after builders expanded rapidly post-pandemic.  Slower project completion impacts revenue and increases risk.  This situation is causing concern for the real estate sector and its investors.  The industry must improve efficiency to regain market trust.,https://economictimes.indiatimes.com/markets/stocks/rssfeeds/2146843.cms
Bandhan Bank shares in focus as Q3 net profit declines 52% YoY,https://economictimes.indiatimes.com/markets/stocks/news/bandhan-bank-shares-in-focus-as-q3-net-profit-declines-52-yoy/articleshow/127223856.cms,2026-01-23 08:16:59 IST,"Bandhan Bank will be in focus after it reported a 52% year-on-year decline in net profit for the December quarter, reaching Rs 206 crore. However, sequential performance showed significant improvement with an 84% surge in profit after tax. The bank also saw an 11% YoY growth in total deposits and a 10% rise in gross advances.",https://economictimes.indiatimes.com/markets/stocks/rssfeeds/2146843.cms
"Stocks to buy in 2026: United Spirits, Bajaj Consumer among 5 stocks that could give 10-40% return in long term",https://economictimes.indiatimes.com/markets/stocks/news/stocks-to-buy-in-2026-united-spirits-bajaj-consumer-among-5-stocks-that-could-give-10-40-return-in-long-term/slideshow/127222781.cms,2026-01-23 07:55:16 IST,We have collated a list of recommendations from top brokerage firms from ETNow and other sources.,https://economictimes.indiatimes.com/markets/stocks/rssfeeds/2146843.cms
Positive Breakout: These 13 stocks cross above their 200 DMAs,https://economictimes.indiatimes.com/markets/stocks/news/positive-breakout-these-13-stocks-cross-above-their-200-dmas/slideshow/127222223.cms,2026-01-23 07:46:32 IST,"As long as the stock is priced above the 200-day SMA on the daily timeframe, it is generally considered to be in an overall uptrend.",https://economictimes.indiatimes.com/markets/stocks/rssfeeds/2146843.cms
Aritas Vinyl shares to list today. Check GMP ahead of debut,https://economictimes.indiatimes.com/markets/stocks/news/aritas-vinyl-shares-to-list-today-check-gmp-ahead-of-debut/articleshow/127221571.cms,2026-01-23 07:45:25 IST,"Aritas Vinyl's shares are set to list on the BSE SME platform on January 23, with grey market signals suggesting a flat debut close to the IPO price. The Rs 37.52 crore issue, which closed on January 20, will fund working capital and a solar project. Investors will monitor the company's execution and financial performance post-listing.",https://economictimes.indiatimes.com/markets/stocks/rssfeeds/2146843.cms
"A tale of two spirits: Radico on a high, United Spirits stays sober for now",https://www.livemint.com/market/stock-market-news/a-tale-of-two-spirits-radico-on-a-high-united-spirits-stays-sober-for-now-11769095727539.html,2026-01-23 09:05:54 IST,"Street expectations continue to favour Radico, with analysts pencilling in further outperformance. However, United Spirits remains a stock to watch, with shifting consumer demographics and a clear tilt towards Prestige &amp;amp; Above brands setting the stage for a potential upside for the stock.",https://www.livemint.com/rss/markets
The next market leaders? Six growth stocks to watch in 2026,https://www.livemint.com/market/stock-market-news/growth-stocks-affle-share-price-hcl-tech-bharti-airtel-stocks-to-watch-11769080556201.html,2026-01-23 09:00:52 IST,These companies have registered strong growth in recent years and have ambitious plans for 2026. Take a look.,https://www.livemint.com/rss/markets
"Stocks to watch: IndiGo, Bandhan Bank, Reliance, NTPC Green, among other stocks in focus today, January 23",https://www.livemint.com/market/stock-market-news/stocks-to-watch-indigo-bandhan-bank-reliance-ntpc-green-among-other-stocks-in-focus-today-january-23-11769137928031.html,2026-01-23 08:48:52 IST,"Stocks to watch: IndiGo, Bandhan Bank, Reliance Industries, Ashoka Buildcon, NTPC Green, among other stocks will be in focus today, January 23.",https://www.livemint.com/rss/markets
"Digilogic Systems IPO allotment date in focus. Latest GMP, step-by-step guide to check status",https://www.livemint.com/market/ipo/digilogic-systems-ipo-allotment-date-in-focus-digilogic-systems-ipo-gmp-digilogic-ipo-gmp-11769136294430.html,2026-01-23 08:42:29 IST,"The Digilogic Systems IPO allotment is set for today, with investors able to check their status via Kfin Technologies. The IPO subscription stands at 1.10x, and refunds for unallocated shares will begin on January 27, while shares will be credited the same day.",https://www.livemint.com/rss/markets
Shares to buy or sell: Chandan Taparia recommends three stocks to buy and sell today - 23 January 2026,https://www.livemint.com/market/stock-market-news/shares-to-buy-or-sell-chandan-taparia-recommends-three-stocks-to-buy-and-sell-today-23-january-2026-bel-ashok-leyland-11769105556386.html,2026-01-23 08:03:28 IST,"Shares to buy or sell: Chandan Taparia has recommended three stocks to buy today, 23 January 2026. Taparia recommends buying Ashok Leyland, Bharat Electronics (BEL) and APL Apollo Tubes shares.",https://www.livemint.com/rss/markets
Stocks to buy for short term: From BEL to Jindal Steel— Ajit Mishra of Religare Broking suggests 3 technical picks,https://www.livemint.com/market/stock-market-news/stocks-to-buy-for-short-term-bel-jindal-steel-godrej-consumer-ajit-mishra-of-religare-broking-suggests-3-shares-11769133106197.html,2026-01-23 07:49:11 IST,"Stocks to buy for the short term: Ajit Mishra from Religare Broking highlights three stocks, including BEL and Jindal Steel, poised for short-term gains. With favourable technical indicators, Mishra believes these stocks can give decent returns in the next one to two weeks.&amp;nbsp;",https://www.livemint.com/rss/markets
"Stock Market Today LIVE: Gift Nifty signals muted start for Nifty 50, Sensex; Nikkei, Nasdaq rally; gold prices gain",https://www.livemint.com/market/stock-market-news/stock-market-today-live-updates-trump-tariffs-impact-sensex-nifty-stock-market-latest-news-gold-prices-23-january-2026-11769107098340.html,2026-01-23 07:27:56 IST,"Stock Market Today LIVE: Asian markets traded higher on Friday, following overnight rally on Wall Street as geopolitical tensions eased, after President Donald Trump rescinded Greenland tariff threats on European allies.",https://www.livemint.com/rss/markets
Breakout stocks to buy or sell: Sumeet Bagadia recommends five shares to buy today — 23 January 2026,https://www.livemint.com/market/stock-market-news/breakout-stocks-to-buy-or-sell-sumeet-bagadia-recommends-five-shares-to-buy-today-23-january-2026-11769129705133.html,2026-01-23 07:27:55 IST,"Breakout stocks to buy or sell: Sumeet Bagadia recommends five shares to buy today — Apl Apollo Tubes, Ashok Leyland, Federal Bank, Nestle India, and Campus Activewear",https://www.livemint.com/rss/markets
"Nifty 50, Sensex today: What to expect from Indian stock market in trade on January 23",https://www.livemint.com/market/stock-market-news/nifty-50-sensex-today-what-to-expect-from-indian-stock-market-in-trade-on-january-23-11769105857749.html,2026-01-23 07:15:28 IST,"Nifty 50, Sensex today: The trends on Gift Nifty also indicate a muted start for the Indian benchmark index. The Gift Nifty was trading around 25,345 level, a discount of nearly 4 points from the Nifty futures’ previous close.",https://www.livemint.com/rss/markets
"Indian stock market: 10 key things that changed for market overnight - Gift Nifty, US GDP, inflation to gold prices",https://www.livemint.com/market/stock-market-news/indian-stock-market-10-key-things-that-changed-for-market-overnight-gift-nifty-us-gdp-inflation-to-gold-prices-11769106164280.html,2026-01-23 07:00:06 IST,"Gift Nifty was trading around 25,380 level, a premium of nearly 30 points from the Nifty futures’ previous close, indicating a positive start for the Indian stock market indices.",https://www.livemint.com/rss/markets
"Amazon layoffs: Thousands of corporate jobs on chopping block as giant seeks to trim workforce by 30,000 — All we know",https://www.livemint.com/companies/news/amazon-layoffs-plan-thousands-of-corporate-job-cuts-white-collar-workforce-30000-aws-prime-video-retail-hr-roles-report-11769138279537.html,2026-01-23 09:05:21 IST,"Amazon is planning a second round of job cuts next week, as it aims to cut its corporate workforce by 30,000. These layoffs — among the companies largest — are likely to impact white collar roles across divisions including AWS.",https://www.livemint.com/rss/companies
JPMorgan Chase hikes CEO Jamie Dimon's pay by 10.3% amid Donald Trump's $5 billion lawsuit over ‘debanking’ allegations,https://www.livemint.com/companies/people/jpmorgan-chase-hikes-ceo-jamie-dimon-2025-pay-10-3-pc-salary-43-million-strong-year-donald-trump-5-bn-debanking-lawsuit-11769134137151.html,2026-01-23 08:33:22 IST,"JPMorgan Chase's CEO Jamie Dimon's pay package for 2025 increased by 10.3% to $43 million, including a $1.5 million salary and $41.5 million in incentives. This comes amid US President Donald Trump's $5 billion lawsuit against the bank for allegedly ‘debanking’ him.",https://www.livemint.com/rss/companies
Sensex and Nifty edge modestly higher on easing geopolitical jitters,https://economictimes.indiatimes.com/markets/stocks/news/sensex-and-nifty-edge-modestly-higher-on-easing-geopolitical-jitters/articleshow/127229998.cms,2026-01-23 09:47:31 IST,"Indian equities opened marginally higher on Friday, extending a modest recovery after a three-session decline. Gains in Asian markets and easing geopolitical tensions provided some support, but persistent foreign fund outflows and mixed corporate results maintained investor caution.",https://economictimes.indiatimes.com/markets/stocks/rssfeeds/2146843.cms
"What Goldman Sachs, Jefferies, HSBC, 5 others expect from Union Budget FY27",https://economictimes.indiatimes.com/markets/stocks/news/what-goldman-sachs-jefferies-hsbc-5-others-expect-from-union-budget-fy27/slideshow/127231444.cms,2026-01-23 09:38:01 IST,"As the Union Budget FY27 nears, financial experts anticipate a careful balance between fiscal discipline and economic growth. Key expectations include sustained capital expenditure, particularly in infrastructure and defence, alongside conservative tax policies. Investors will closely watch measures aimed at boosting consumption, manufacturing, and exports, while the fiscal deficit remains a critical market indicator.",https://economictimes.indiatimes.com/markets/stocks/rssfeeds/2146843.cms
Rs 4.5 lakh crore PSU bank rally draws FII buying in 10 stocks. Are you late to the party?,https://economictimes.indiatimes.com/markets/stocks/news/rs-4-5-lakh-crore-psu-bank-rally-draws-fii-buying-in-10-stocks-are-you-late-to-the-party/articleshow/127230002.cms,2026-01-23 09:31:52 IST,"Foreign investors are significantly increasing their stakes in Indian public sector banks, drawn by a remarkable rally and improving financial health.  These banks are now outperforming private lenders in loan growth, signaling a strong turnaround. Despite recent gains, analysts believe many PSU banks still offer attractive valuations, making them a compelling investment opportunity.",https://economictimes.indiatimes.com/markets/stocks/rssfeeds/2146843.cms
"Silver prices soar by Rs 12,600 per kg to inch near Rs 3.4 lakh, Gold hits Rs 1.6 lakh mark. What should investors do?",https://economictimes.indiatimes.com/markets/stocks/news/silver-prices-soar-by-rs-12600-per-kg-to-inch-near-rs-3-4-lakh-gold-hits-rs-1-6-lakh-mark-what-should-investors-do/articleshow/127229743.cms,2026-01-23 09:27:56 IST,"Gold and silver surged to fresh highs on Friday, extending recent gains amid geopolitical tensions, a weaker US dollar, and expectations of Federal Reserve rate cuts at its upcoming January 27 meeting. Market uncertainty was also fueled by comments from US President Donald Trump on securing permanent US access to Greenland, though the deal’s details remain unclear and Denmark rejected any challenge to its sovereignty.",https://economictimes.indiatimes.com/markets/stocks/rssfeeds/2146843.cms
"IndiGo shares skid 4% after Q3 profit plummets 78% YoY. Should you buy, sell or hold?",https://economictimes.indiatimes.com/markets/stocks/news/indigo-shares-skid-4-after-q3-profit-plummets-78-yoy-should-you-buy-sell-or-hold/articleshow/127229019.cms,2026-01-23 09:27:31 IST,"IndiGo share price: InterGlobe Aviation shares slipped after IndiGo reported a 78% year-on-year fall in Q3FY26 profit to Rs 550 crore, hit by exceptional charges from labour law changes, operational disruptions and currency movements. Excluding these items, profitability was strong, with revenue rising 26% sequentially, though margins and load factors weakened.",https://economictimes.indiatimes.com/markets/stocks/rssfeeds/2146843.cms
Adani Energy Solutions shares fall over 2% after Q3 net profit slips to Rs 552 crore,https://economictimes.indiatimes.com/markets/stocks/news/adani-energy-solutions-shares-in-focus-after-q3-profit-slips-revenue-grows/articleshow/127229288.cms,2026-01-23 09:22:05 IST,"Adani Energy Solutions' shares dipped over 2% after reporting a marginal 2% year-on-year decline in Q3 FY26 net profit to Rs 552 crore. Despite this, revenues surged 15% to Rs 6,730 crore, with EBITDA reaching a record Rs 2,210 crore, driven by strong transmission and smart metering growth.",https://economictimes.indiatimes.com/markets/stocks/rssfeeds/2146843.cms
KEI Industries among 5 F&amp;O stocks with a sharp rise in futures open Interest,https://economictimes.indiatimes.com/markets/stocks/news/kei-industries-among-5-fo-stocks-with-a-sharp-rise-in-futures-open-interest/slideshow/127228857.cms,2026-01-23 09:13:04 IST,"KEI Industries saw a sharp surge in futures open interest, emerging among five F&amp;O stocks signaling rising trader interest and potential near-term volatility.",https://economictimes.indiatimes.com/markets/stocks/rssfeeds/2146843.cms
"APL Apollo Tubes, two other stocks flash bullish signals, indicating an uptrend",https://economictimes.indiatimes.com/markets/stocks/news/apl-apollo-tubes-two-other-stocks-flash-bullish-signals-indicating-an-uptrend/slideshow/127228460.cms,2026-01-23 09:09:53 IST,A White Marubozu is a bullish candlestick pattern that forms when the opening price is the lowest and the closing price is the highest for a given session.,https://economictimes.indiatimes.com/markets/stocks/rssfeeds/2146843.cms
United Spirits shares in focus after Adar Poonawalla signals bid for RCB acquisition,https://economictimes.indiatimes.com/markets/stocks/news/united-spirits-shares-in-focus-after-adar-poonawalla-signals-bid-for-rcb-acquisition/articleshow/127228227.cms,2026-01-23 09:08:45 IST,"United Spirits shares are set to be in focus after Serum Institute CEO Adar Poonawalla said he plans to make a strong and competitive bid for the Royal Challengers Bengaluru IPL franchise, currently owned by the Diageo-controlled liquor maker. The development comes against the backdrop of a sharp rise in United Spirits’ December-quarter profit, even as revenue growth remained modest.",https://economictimes.indiatimes.com/markets/stocks/rssfeeds/2146843.cms
