title,link,published,summary,source
"Raajmarg Infra Investment Trust InvIT IPO Day 1: Issue booked 5% so far. Check GMP, key dates, subscription details",https://www.livemint.com/market/ipo/raajmarg-infra-investment-trust-invit-ipo-gmp-day-1-issue-booked-5-so-far-check-gmp-key-dates-subscription-details-11773212381150.html,2026-03-11 12:55:40 IST,"The Raajmarg Infra Investment Trust InvIT IPO subscription period runs from March 11 to March 13, with a price band of  ₹99 to  ₹100 per unit. It aims to raise  ₹6,000 crore, having secured  ₹1,728 crore from anchor investors beforehand.",https://www.livemint.com/rss/markets
Portfolio alert! Nifty 50 cracks 5% since US-Iran war began — where should investors park money now?,https://www.livemint.com/market/stock-market-news/portfolio-alert-nifty-50-cracks-5-since-us-iran-war-began-where-should-investors-park-money-now-stock-market-crash-11773212084968.html,2026-03-11 12:53:41 IST,Market sentiment remains negative as Indian stocks lose nearly 5% amidst the US-Iran conflict. Experts recommend maintaining a long-term investment strategy and suggest reallocating portfolios towards sectors that are resilient during global volatility.,https://www.livemint.com/rss/markets
NSE unlisted share probe puts spotlight on risky grey market,https://www.livemint.com/market/stock-market-news/ed-probe-nse-shares-grey-market-nse-ipo-sebi-bank-fraud-investors-rbi-11773200570012.html,2026-03-11 12:53:24 IST,The ED’s probe into fake NSE share sales has exposed structural gaps in India’s fast-growing  ₹5 trillion unlisted market. Experts say clearer regulations could improve investor protection and bring greater institutional participation.,https://www.livemint.com/rss/markets
"Shakti Pumps, Denta Water to KEC International: Pump and pipe stocks jump up to 20% on Jal Jeevan Mission extension",https://www.livemint.com/market/stock-market-news/shakti-pumps-denta-water-to-kec-international-pump-stocks-jump-up-to-20-on-jal-jeevan-mission-extension-11773211996736.html,2026-03-11 12:31:41 IST,"Denta Water and Infra Solutions shares were locked in the 20% upper circuit, while Shakti Pumps India shares jumped 19.2% and Vishnu Prakash R Punglia share price advanced 18.4%.",https://www.livemint.com/rss/markets
US-Iran war: Oil prices on MCX rise 4% despite fall in Brent crude — What's behind this divergence?,https://www.livemint.com/market/commodities/usiran-war-oil-prices-on-mcx-rise-4-despite-fall-in-brent-crude-whats-behind-this-divergence-11773199652654.html,2026-03-11 12:22:49 IST,"US-Iran war: On the international front, Brent crude prices slipped 0.26% to $87.57 per barrel, while West Texas Intermediate (WTI) crude futures dropped 0.44% to $83.08, on Wednesday.",https://www.livemint.com/rss/markets
Microsoft backs Anthropic in court: Top 10 key updates in Claude maker's lawsuit against US government blacklist,https://www.livemint.com/companies/news/microsoft-backs-anthropic-in-court-top-10-key-updates-in-the-claude-makers-lawsuit-over-us-government-blacklist-11773207353442.html,2026-03-11 12:48:22 IST,"Anthropic has filed lawsuits against the US government after negotiations with the Pentagon broke down over AI use in classified settings. The company claims it was blacklisted for adhering to AI safety standards, alleging government pressure on its customers and potential revenue losses.",https://www.livemint.com/rss/companies
Capital market ecosystem stocks: Short term headwind? Yes. But structure stays intact: 8 stocks with upside potential of up to 36%,https://economictimes.indiatimes.com/markets/stocks/news/capital-market-ecosystem-stocks-short-term-headwind-yes-but-structure-stays-intact-8-stocks-with-upside-potential-of-up-to-36/articleshow/129448181.cms,2026-03-11 13:56:21 IST,"Are the headwinds for the Indian economy brought on by the latest Gulf war for real? Yes, they are. But here’s the contrarian question worth asking: Does a downturn in market sentiment change the structural story of some sectors? Have the changes being wrought by AI in the IT sector stopped? Have auto companies stopped transitioning to EVs? The short answer is no. And that’s what makes this moment interesting. As an investor, one needs to look beyond the war.",https://economictimes.indiatimes.com/markets/stocks/rssfeeds/2146843.cms
Sebi to further ease accreditation process for AIF investors: Tuhin Kanta Pandey,https://economictimes.indiatimes.com/markets/stocks/news/sebi-to-further-ease-accreditation-process-for-aif-investors-tuhin-kanta-pandey/articleshow/129447070.cms,2026-03-11 13:20:39 IST,"Securities and Exchange Board of India (Sebi) will further simplify accreditation norms for AIF investors, Chairman Tuhin Kanta Pandey said at the IVCA Conclave 2026. India now has over 1,700 AIFs with commitments nearing Rs 16 lakh crore, though challenges around mis-selling, risk disclosure and funding innovation persist.",https://economictimes.indiatimes.com/markets/stocks/rssfeeds/2146843.cms
"SEDEMAC Mechatronics share price extends gains after strong listing. Should you buy, sell or hold the stock?",https://www.livemint.com/market/stock-market-news/sedemac-mechatronics-share-price-extends-gains-after-strong-listing-should-you-buy-sell-or-hold-the-stock-11773216382733.html,2026-03-11 13:47:01 IST,"SEDEMAC Mechatronics share price extended rally after strong listing and the stock rallied over 6%. The stock hit a high of  ₹1,613.50 apiece on the BSE and NSE, up as much as 19.35% from its issue price.",https://www.livemint.com/rss/markets
Small-cap tech stock under  ₹50 jumps after this AI update. Do you own?,https://www.livemint.com/market/stock-market-news/smallcap-tech-stock-under-50-jumps-after-this-ai-update-do-you-own-11773212630154.html,2026-03-11 13:28:44 IST,"Small-cap stock under  ₹50, Kellton Tech Solutions, rose after the company announced its partnership with FutureAge AI Labs to build a B2B travel platform.",https://www.livemint.com/rss/markets
Gold ETF inflows drop 78% after record January. Should investors worry? Explained,https://www.livemint.com/market/commodities/gold-etf-inflows-drop-78-after-record-january-should-investors-worry-explained-11773214773516.html,2026-03-11 13:16:13 IST,"Gold ETFs: Analysts say February’s decline largely reflects a normalisation after January’s unusually strong inflows, which were boosted by start-of-year portfolio allocations, defensive positioning and record-high gold prices.",https://www.livemint.com/rss/markets
Air India Express aircraft's nose wheel faces malfunction at Phuket airport — here's what we know,https://www.livemint.com/companies/news/air-india-express-aircrafts-nose-wheel-faces-malfunction-at-phuket-airport-heres-what-we-know-11773216484396.html,2026-03-11 14:06:13 IST,"An Air India Express flight from Hyderabad to Phuket faced a nose-wheel issue at Phuket Airport, leading to the suspension of flight operations as the aircraft remains on the runway.",https://www.livemint.com/rss/companies
TCS sees $100-billion market value erosion since 2021. What lies ahead?,https://economictimes.indiatimes.com/markets/stocks/news/tcs-sees-100-billion-market-value-erosion-since-2021-what-lies-ahead/articleshow/129450737.cms,2026-03-11 14:33:51 IST,"Nearly $100 billion has been wiped off TCS’ market value from its 2021 peak amid fears of AI-led disruption that have dragged down the broader IT pack. However, brokerage Nuvama believes the selloff is overdone, saying Gen AI poses no existential threat to the sector and could eventually expand the industry’s opportunity, prompting it to upgrade all top 10 IT stocks to ‘Buy’.",https://economictimes.indiatimes.com/markets/stocks/rssfeeds/2146843.cms
Capital market stocks shine in FY26; MCX India tops chart with 143% rally,https://economictimes.indiatimes.com/markets/stocks/news/capital-market-stocks-shine-in-fy26-mcx-india-tops-chart-with-143-rally/articleshow/129450357.cms,2026-03-11 14:28:00 IST,"India’s capital markets stocks delivered strong gains in FY26, with the Nifty Capital Markets Index rising 35%, making it the second-best performing sector after PSU banks. Multi Commodity Exchange of India led the rally with a 143% surge, while brokerages, exchanges, and wealth management firms benefited from rising investor participation.",https://economictimes.indiatimes.com/markets/stocks/rssfeeds/2146843.cms
Rs 8.7 lakh crore Jal Jeevan Mission extended till 2028. These 25 stocks likely to be biggest beneficiaries,https://economictimes.indiatimes.com/markets/stocks/news/rs-8-7-lakh-crore-jal-jeevan-mission-extended-till-2028-these-25-stocks-likely-to-be-biggest-beneficiaries/articleshow/129449130.cms,2026-03-11 14:02:03 IST,"The Union Cabinet's approval to extend the Jal Jeevan Mission until 2028, with a boosted outlay of Rs 8.69 lakh crore, is set to benefit around 25 stocks. This significant push for rural water infrastructure and service delivery will drive demand for companies in pipes, pumps, construction, and water treatment sectors, aiming for universal tap water access.",https://economictimes.indiatimes.com/markets/stocks/rssfeeds/2146843.cms
Money will be made in small-cap stocks now in Indian stock market: Shankar Sharma’s latest call,https://www.livemint.com/market/stock-market-news/money-will-be-made-in-small-cap-stocks-in-indian-stock-market-shankar-sharma-s-latest-call-11773220803445.html,2026-03-11 14:55:25 IST,"Shankar Sharma said that he sees exceptional opportunity and value in small-cap stocks, adding that the segment could outperform larger companies in the coming period.",https://www.livemint.com/rss/markets
"Flipkart IPO: Walmart-Backed firm moves closer to IPO with bank pitches, eyes listing in early 2027",https://www.livemint.com/market/ipo/flipkart-ipo-walmart-backed-firm-moves-closer-to-ipo-with-bank-pitches-eyes-listing-in-early-2027-11773220118482.html,2026-03-11 14:53:11 IST,"Online retailer Flipkart Internet Pvt is set to start the formal process for banks to pitch for work on its potential initial public offering as soon as next month, according to people familiar with the matter.",https://www.livemint.com/rss/markets
Small-cap stock HG Infra surges 20% despite stock market crash on order win. Details here,https://www.livemint.com/market/stock-market-news/smallcap-stock-hg-infra-surges-20-despite-stock-market-crash-on-order-win-details-here-11773215989073.html,2026-03-11 14:28:03 IST,"The small-cap stock opened at  ₹515.10 apiece in the early morning session today, as compared to the previous close of  ₹490.55. On Wednesday, the stock touched an intraday high of  ₹584.40 per share on NSE.",https://www.livemint.com/rss/markets
"Vodafone Idea, Happiest Minds, to Jindal Saw— These are the top most traded stocks on the NSE today",https://www.livemint.com/market/stock-market-news/vodafone-idea-happiest-minds-to-jindal-saw-these-are-the-top-most-traded-stocks-on-the-nse-today-11773216461145.html,2026-03-11 14:13:33 IST,"Vodafone Idea, Tata Silver Exchange Traded Fund, Jindal Saw, Happiest Minds Technologies, Filatex Fashions, Suzlon Energy, Tata Gold Exchange Traded Fund, YES Bank, and Reliance Power were the most traded stocks on the NSE.",https://www.livemint.com/rss/markets
Hyatt elevates Sunjae Sharma to Asia Pacific leadership role; Vikas Chawla to head India operations,https://www.livemint.com/companies/news/hyatt-hotels-india-asia-pacific-leadership-sunjae-sharma-vikas-chawla-11773219940297.html,2026-03-11 15:01:51 IST,"David Udell, group president for Hyatt's Asia Pacific operations, said Sunjae Sharma would take on broader regional responsibilities as the hotel chain sharpens its focus on growth across the region",https://www.livemint.com/rss/companies
"Siemens bets on private capex revival in India, sees local businesses leapfrog to AI-led automation",https://www.livemint.com/companies/india-siemens-capex-revival-ai-automation-smart-infrastructure-digital-mobility-11773200773308.html,2026-03-11 14:46:26 IST,"Siemens in India looks stronger under the extended tenure of CEO Sunil Mathur. How is it positioned to next power growth in its digital industries, smart infrastructure, and mobility businesses next? Find out in this interview with Mathur and Siemens AG chief product officer Peter Koerte.",https://www.livemint.com/rss/companies
Adani Energy Solutions raises $500 million from Apollo Global through dollar bonds,https://www.livemint.com/companies/news/adani-energy-bonds-adani-transmission-debt-11773212652525.html,2026-03-11 14:12:41 IST,"The capital will be used to refinance $500 million of a subsidiary's bonds that are maturing in early August. These bonds were issued in 2016 with a 4% coupon, according to data from Bloomberg.",https://www.livemint.com/rss/companies
"Gas crisis impact: Stove Kraft, TTK Prestige, other stocks rally up to 15%; here's why",https://economictimes.indiatimes.com/markets/stocks/news/gas-crisis-impact-stove-kraft-ttk-prestige-other-stocks-rally-up-to-15-heres-why/articleshow/129454831.cms,2026-03-11 15:51:46 IST,"Home appliance stocks surged up to 15% as India’s LPG supply crisis, triggered by disruptions in the Strait of Hormuz amid the Iran-Israel conflict, boosted demand for induction cooktops and electric cooking appliances, driving investor optimism for companies selling alternative cooking solutions.",https://economictimes.indiatimes.com/markets/stocks/rssfeeds/2146843.cms
Volume shocker: MFs added 1 crore+ shares in 12 stocks in Feb ’26. Do you own any?,https://economictimes.indiatimes.com/markets/stocks/news/volume-shocker-mfs-added-1-crore-shares-in-12-stocks-in-feb-26-do-you-own-any/slideshow/129454582.cms,2026-03-11 15:12:58 IST,"Mutual funds significantly increased their holdings in 28 stocks during February 2026, with Vodafone Idea and Vishal Mega Mart seeing the largest share additions. Despite this strong buying interest, most of these stocks have experienced considerable price declines since the start of February '25, with 12 stocks falling between 10-36%.",https://economictimes.indiatimes.com/markets/stocks/rssfeeds/2146843.cms
"Top Gainers &amp; Losers on Mar 11: Apar Industries, Redington, Axis Bank, Finolex Cables, TVS Motor among top losers",https://www.livemint.com/market/stock-market-news/top-gainers-losers-on-mar-11-apar-industries-redington-axis-bank-finolex-cables-tvs-motor-among-top-losers-11773223677904.html,2026-03-11 16:03:14 IST,"The Indian stock market declined on March 11 due to heightened Middle East tensions, with the Nifty 50 down 1.63% and the BSE Sensex falling 1.72%. Most sectors were affected, especially auto and private banks, while pharma and oil &amp;amp; gas saw slight gains.",https://www.livemint.com/rss/markets
Crude oil back above $90 a barrel. How elevated energy prices may impact various Indian sectors?,https://www.livemint.com/market/stock-market-news/crude-oil-back-above-90-a-barrel-how-elevated-energy-prices-may-impact-various-indian-sectors-11773221828281.html,2026-03-11 15:47:56 IST,"Crude oil prices surged to nearly $120 a bbl due to the US-Iran conflict, disrupting Middle Eastern energy production. Prices have fluctuated significantly, impacting global markets and raising concerns over economic repercussions, especially for India reliant on imports from the Strait of Hormuz.",https://www.livemint.com/rss/markets
"US–Iran tensions fan energy costs, leave tile makers walking a tightrope",https://www.livemint.com/market/stock-market-news/us-iran-tensions-hit-india-ceramic-tile-industry-11773207462867.html,2026-03-11 15:38:38 IST,"Tension in the Middle East has led to a sharp spike in energy costs, forcing production halts and margin pressure across the Indian ceramic tile industry.",https://www.livemint.com/rss/markets
"Axis Bank share price tumbles over 4% to 7-week low, market cap slips below  ₹4 lakh crore",https://www.livemint.com/market/stock-market-news/axis-bank-share-price-tumbles-over-4-to-7-week-low-market-cap-slips-below-rs-4-lakh-crore-11773222302771.html,2026-03-11 15:26:32 IST,"Axis Bank shares fell 4.7% to  ₹1,252.80, marking a seven-week low and wiping out  ₹19,016 crore in market value. The decline reflects broader market tensions and a sell-off by overseas investors amidst rising crude prices.",https://www.livemint.com/rss/markets
Nuvama sees 37% upside in this healthcare stock. Should you buy?,https://www.livemint.com/market/stock-market-news/nuvama-sees-37-upside-in-this-healthcare-stock-park-medi-world-should-you-buy-11773222197114.html,2026-03-11 15:17:39 IST,"Park Medi World is set to benefit from India's hospital bed shortage and growth in Tier II markets. Nuvama initiated coverage with a 'Buy' rating and a target price of  ₹280, projecting a 37% upside. The company aims to expand bed capacity significantly by FY28.",https://www.livemint.com/rss/markets
"Srinibas Pradhan Constructions IPO allotment to be out today. Here's GMP, how to check status",https://www.livemint.com/market/ipo/srinibas-pradhan-constructions-ipo-allotment-to-be-out-today-heres-gmp-how-to-check-status-11773220197754.html,2026-03-11 15:11:54 IST,"The current GMP of Srinibas Pradhan Constructions IPO is  ₹0, according to Investorgain. The estimated listing price of Srinibas Pradhan Constructions IPO is likely to be same as the IPO price of  ₹98.",https://www.livemint.com/rss/markets
How US-Iran war is causing gas crisis in India? Sectors and stocks that are likely to be impacted,https://www.livemint.com/market/stock-market-news/how-us-iran-war-is-causing-gas-crisis-in-india-adani-total-gas-to-jubilant-zomato-sectors-and-stocks-to-be-impacted-11773160686703.html,2026-03-11 15:10:15 IST,"The global gas supply shock triggered by disruptions in the Strait of Hormuz is beginning to ripple through Indian markets, putting several sectors and companies in focus. Fertiliser, QSR and gas stocks could face operational and cost pressures as LPG and LNG supplies tighten.&amp;nbsp;",https://www.livemint.com/rss/markets
Sebi mulls faster ‘lodge and launch’ route for AIF schemes,https://www.livemint.com/market/sebi-mulls-fast-track-aif-approvals-lodge-and-launch-11773217589012.html,2026-03-11 15:09:56 IST,"Sebi may rely on due diligence certificates issued by merchant bankers for certain AIF schemes, Tuhin Kanta Pandey says. For schemes intended exclusively for accredited investors, the responsibility for disclosure diligence would rest with the AIF manager.",https://www.livemint.com/rss/markets
Talent wars heat up: tech giants turn to influencers for viral job hunts on social media,https://www.livemint.com/companies/talent-wars-tech-giants-influencers-viral-job-hunts-social-media-gen-z-ai-talent-social-media-11773204323838.html,2026-03-11 15:47:14 IST,India’s top tech firms are partnering with social media influencers to run viral recruitment campaigns targeting Gen Z and AI talent. These high-paying collaborations are evolving to include ‘internal influencers’ as companies prioritize authenticity over traditional ads.,https://www.livemint.com/rss/companies
Have an old EPFO account? Funds from these inoperative accounts may be auto-credited — check if you are eligible,https://www.livemint.com/money/personal-finance/have-an-old-epfo-account-funds-from-these-inoperative-accounts-may-be-auto-credited-check-if-you-are-eligible-11773216218625.html,2026-03-11 15:47:00 IST,"EPF members may soon withdraw funds directly through UPI, with a target rollout by April 2026. Additionally, a pilot project will automatically settle claims for small inoperative accounts, simplifying the withdrawal process and helping members access long-unclaimed funds more quickly.",https://www.livemint.com/rss/money
Can you revoke a gift? What senior citizens and heirs need to know.,https://www.livemint.com/money/personal-finance/revoking-gift-deed-maintenance-act-2007-11773209018771.html,2026-03-11 15:37:12 IST,"While a registered gift may seem final, Indian courts are increasingly using maintenance laws to strip away property from heirs who fail to care for their elderly parents.",https://www.livemint.com/rss/money
"Explained: How Dixon, Kaynes Tech, others may benefit from latest FDI policy changes",https://economictimes.indiatimes.com/markets/stocks/news/explained-how-dixon-kaynes-tech-others-may-benefit-from-latest-fdi-policy-changes/articleshow/129458037.cms,2026-03-11 16:52:07 IST,"India has eased investment rules for countries sharing a land border, allowing up to 10% foreign ownership in firms via the automatic route. Approvals for specific sectors like electronics components will now be fast-tracked to 60 days, aiming to boost domestic manufacturing and attract capital.",https://economictimes.indiatimes.com/markets/stocks/rssfeeds/2146843.cms
"Adani Total Gas, Stove Kraft among 30 stocks that surged up to 20% despite Rs 6 lakh crore wealth wipeout",https://economictimes.indiatimes.com/markets/stocks/news/adani-total-gas-stove-kraft-among-30-stocks-that-surged-up-to-20-despite-rs-5-6-lakh-crore-wealth-wipeout/articleshow/129456732.cms,2026-03-11 16:45:28 IST,"Despite a sharp market downturn, select gas and water-related stocks delivered strong gains. Adani Total Gas hit the upper circuit on policy support, while Jindal SAW surged after the Jal Jeevan Mission extension, lifting several allied companies even as broader indices like BSE Sensex and Nifty50 fell.",https://economictimes.indiatimes.com/markets/stocks/rssfeeds/2146843.cms
"Sebi eases certification requirement for sales, non-core staff associated with Research Services",https://economictimes.indiatimes.com/markets/stocks/news/sebi-eases-certification-requirement-for-sales-non-core-staff-associated-with-research-services/articleshow/129456152.cms,2026-03-11 16:16:32 IST,"In a move aimed at easing compliance requirements, markets regulator Sebi on Wednesday relaxed certification norms for Persons Associated with Research Services (PARS), allowing sales staff, relationship managers and other non-research personnel to qualify through a lighter certification module.",https://economictimes.indiatimes.com/markets/stocks/rssfeeds/2146843.cms
"Dixon opens a new chapter with HKC JV approval, but valuations are high",https://www.livemint.com/market/mark-to-market/dixon-technologies-hkc-joint-venture-display-manufacturing-11773221899930.html,2026-03-11 16:28:31 IST,"The display-module venture deepens Dixon’s push into electronics components and backward integration, but much of the optimism appears already reflected in the valuation.",https://www.livemint.com/rss/markets
Small-cap NBFC stock under  ₹50: Paisalo Digital announces  ₹100 crore fundraise via debentures with green shoe option,https://www.livemint.com/market/stock-market-news/smallcap-nbfc-stock-under-rs-50-paisalo-digital-announces-rs-100-crore-fundraise-via-debentures-with-green-shoe-option-11773224976392.html,2026-03-11 16:06:36 IST,"Small-cap NBFC stock under  ₹50: Paisalo Digita aims to raise  ₹100 crore via 9.25% non-convertible debentures. The stock has dropped sharply, with a 63% loss over two years.&amp;nbsp;",https://www.livemint.com/rss/markets
350% rally in five years! Multibagger stock shows resilience against stock market crash; here's why,https://www.livemint.com/market/stock-market-news/350-rally-in-five-years-multibagger-stock-shows-resilience-against-stock-market-crash-heres-why-11773224402514.html,2026-03-11 16:06:26 IST,"Godawari Power and Ispat shares increased by over 2% on March 11, despite market declines. The NCLT approved the merger with Godawari Energy Limited, finalizing a process that began in August 2025, with significant financial implications for the transferor company.",https://www.livemint.com/rss/markets
Emami among 7 small-cap stocks hit 52-week lows; slip up to 25% in a month,https://economictimes.indiatimes.com/markets/stocks/news/emami-among-7-small-cap-stocks-hit-52-week-lows-slip-up-to-25-in-a-month/slideshow/129460973.cms,2026-03-11 17:33:50 IST,"Amid a sharp 1,342-point Sensex drop to 76,863, seven BSE 250 Smallcap stocks, including Sapphire Foods, JK Lakshmi Cement, Relaxo, Aegis Logistics, Five-Star Finance, Emami and Jyothy Labs, hit 52-week lows, signaling weakness.",https://economictimes.indiatimes.com/markets/stocks/rssfeeds/2146843.cms
The Fed’s hawks and doves are drifting further apart. What it means for investors.,https://www.livemint.com/market/the-fed-s-hawks-and-doves-are-drifting-further-apart-what-it-means-for-investors-11773232206222.html,2026-03-11 18:04:11 IST,Futures markets assign a 99.4% chance that the Fed leaves interest rates unchanged at its policy meeting next week.,https://www.livemint.com/rss/markets
Indian rupee falls 16 paise to end at 92.01 against US dollar as crude prices rebound,https://www.livemint.com/market/stock-market-news/indian-rupee-falls-16-paise-to-end-at-92-01-against-us-dollar-as-crude-prices-rebound-11773231096326.html,2026-03-11 17:45:04 IST,"FII outflows and weak sentiments in the domestic equity markets pressured the local unit, according to forex traders.",https://www.livemint.com/rss/markets
"Rajputana Stainless IPO fully subscribed on final day; NII portion sees strong demand, GMP signals muted debut",https://www.livemint.com/market/stock-market-news/rajputana-stainless-ipo-fully-subscribed-on-final-day-nii-portion-sees-strong-demand-gmp-signals-muted-debut-11773229551910.html,2026-03-11 17:42:11 IST,"The Rajputana Stainless IPO was subscribed 1.12 times by its closing date on March 11, with non-institutional investors leading. As of today, the grey market premium (GMP) for the Rajputana Stainless IPO stands at  ₹01.&amp;nbsp;",https://www.livemint.com/rss/markets
