title,link,published,summary,source
Nifty Bank crashes 8% in March so far: What’s driving the sharp selloff?,https://www.livemint.com/market/stock-market-news/nifty-bank-crashes-8-in-march-so-far-what-s-driving-the-sharp-selloff-11773226217698.html,2026-03-11 17:14:37 IST,"The Nifty Bank index has crashed 8% so far in March. From the index, stocks such as Bank of Baroda, Federal Bank, Punjab National Bank, Union Bank, and Canara Bank are down 10-11% this month.",https://www.livemint.com/rss/markets
Devyani to Westlife FoodWorld: QSR stocks near 52-week lows! Should you avoid the sector amid LPG crisis in India?,https://www.livemint.com/market/stock-market-news/devyani-to-westlife-foodworld-qsr-stocks-near-52-week-lows-should-you-avoid-the-sector-amid-lpg-crisis-in-india-11773228564556.html,2026-03-11 17:07:23 IST,"LPG shortage: While independent restaurants face the most immediate risk of closures, large quick service restaurant (QSR) chains could also experience margin pressure and operational disruptions in certain micro markets, warned experts.",https://www.livemint.com/rss/markets
Are Indians planning for a retirement that ‘no longer exists’? This CA explains breaks down what factors are important,https://www.livemint.com/money/personal-finance/retirement-planning-indians-ca-money-advice-inflation-healthcare-longevity-expenses-lifestyle-financial-freedom-wealth-11773225465090.html,2026-03-11 17:15:29 IST,Nitin Kaushik warns that outdated retirement plans fail to address rising healthcare costs and longevity. He suggests that individuals must prepare for a minimum corpus of 300 times monthly expenses by 2026 to avoid financial crises in retirement.,https://www.livemint.com/rss/money
JPMorgan Chase reins in lending to private credit firms after marking down software loans,https://www.cnbc.com/2026/03/11/jpmorgan-reins-lending-private-credit-marks-down-software-loans.html,2026-03-11 18:21:48 IST,JPMorgan's move shows that the biggest U.S. bank by assets wants to get ahead of potential turbulence involving private credit loans to software companies.,https://www.cnbc.com/id/10000664/device/rss/rss.html
US stock market to open flat as traders await inflation report amid Middle East tensions,https://www.livemint.com/market/stock-market-news/us-stock-market-to-open-flat-as-traders-await-inflation-report-amid-us-iran-war-11773231543979.html,2026-03-11 18:52:30 IST,The US stock market is expected to open flat as investors watch Middle East tensions and await the February inflation report. Key indices are trading flat in pre-market trade.&amp;nbsp;,https://www.livemint.com/rss/markets
"SBI ties up with MUFG Bank to finance M&amp;A, aviation and real estate deals",https://www.livemint.com/companies/news/sbi-mufg-partnership-acquisition-financing-india-11773233238805.html,2026-03-11 19:29:03 IST,"The agreement comes after the Reserve Bank of India issued the final guidelines for banks to finance mergers and acquisitions on 13 February, executing a significant regulatory shift that's expected to boost deal funding by domestic lenders.",https://www.livemint.com/rss/companies
"Two Trades for Today: A PSU power major for a 5.01% gain, a mid-cap pipe maker’s stock for an almost 5% upmove",https://economictimes.indiatimes.com/markets/stocks/news/two-trades-for-today-a-psu-power-major-for-a-5-01-gain-a-mid-cap-pipe-makers-stock-for-an-almost-5-upmove/articleshow/129466150.cms,2026-03-11 19:41:59 IST,Our technical analysts identify select stocks that may gain momentum even in volatile markets. Here are the technical calls for today.,https://economictimes.indiatimes.com/markets/stocks/rssfeeds/2146843.cms
Nithin Kamath says genuine hedging in options market is now harder due to heavy speculation,https://economictimes.indiatimes.com/markets/stocks/news/nithin-kamath-says-genuine-hedging-in-options-market-is-now-harder-due-to-heavy-speculation/articleshow/129466236.cms,2026-03-11 19:37:41 IST,"Zerodha co-founder Nithin Kamath highlighted a structural shift in India's options market, with a surge in weekly options trading making hedging difficult.  Trading has concentrated in ultra-short-term contracts, reducing liquidity in longer-dated options crucial for risk management, especially during geopolitical volatility.",https://economictimes.indiatimes.com/markets/stocks/rssfeeds/2146843.cms
Sebi introduces a simpler NISM certification for research services,https://economictimes.indiatimes.com/markets/stocks/news/sebi-introduces-a-simpler-nism-certification-for-research-services/articleshow/129466006.cms,2026-03-11 19:29:47 IST,"India's market regulator Sebi has introduced a simplified certification for employees in non-core research roles, aiming to ease business operations. Staff involved in sales and client interaction will now take a lighter NISM module, while those directly preparing research reports remain under the existing stringent examination. This reform reduces compliance burdens for client-facing roles, fostering greater participation in research-related activities.",https://economictimes.indiatimes.com/markets/stocks/rssfeeds/2146843.cms
"Oracle shares surge 15% to five-week high after strong earnings, upbeat revenue guidance",https://www.livemint.com/market/stock-market-news/oracle-shares-surge-15-to-five-week-high-after-strong-earnings-upbeat-revenue-guidance-11773236654702.html,2026-03-11 20:36:19 IST,"Oracle's shares rose 15% to $171.76 after strong Q3 results and an increased revenue forecast for fiscal 2027. Revenue grew 22% year-over-year, with significant gains in infrastructure and cloud applications. The firm plans job cuts and anticipates $90 billion in revenue for 2027.",https://www.livemint.com/rss/markets
Wednesday wipeout: investor mood sours after Tuesday’s brief respite,https://www.livemint.com/market/stock-market-news/india-stock-market-crash-west-asia-conflict-investor-wealth-11773230613865.html,2026-03-11 20:06:26 IST,"Renewed West Asia hostilities triggered a broad sell-off, erasing  ₹5.48 trillion in BSE market cap as benchmark indices hit 10-month lows. While oil-sensitive sectors face margin compression, analysts suggest current valuations offer long-term entry points despite rising volatility.",https://www.livemint.com/rss/markets
Retail investors flock to weekly options despite regulatory curbs and losses,https://www.livemint.com/market/weekly-options-trading-retail-investors-sebi-curbs-11773232009701.html,2026-03-11 19:45:37 IST,"Combined average daily premium turnover (ADT) of index options such as Nifty and Sensex rose 5% even as combined cash market ADT dipped by almost 8% in the current fiscal through 9 March (FY26), from the same period a year ago.",https://www.livemint.com/rss/markets
"Wall Street mixed after flat inflation data amid rising oil prices, Oracle surges 12.8%",https://www.livemint.com/market/stock-market-news/wall-street-mixed-as-investors-assess-inflation-dat-11773237418424.html,2026-03-11 19:39:26 IST,"At 10:20 a.m. ET, the Dow Jones Industrial Average fell 0.45%, the S&amp;amp;P 500 gained 0.10%, the Nasdaq Composite rose 0.48%",https://www.livemint.com/rss/markets
"Sebi eases certification requirement for sales, non-core staff associated with Research Services",https://www.livemint.com/companies/news/sebi-eases-certification-requirement-for-sales-non-core-staff-associated-with-research-services-11773241657149.html,2026-03-11 20:44:41 IST,"Sebi relaxed certification norms for Persons Associated with Research Services (PARS), allowing sales staff, relationship managers and other non-research personnel to qualify through a lighter certification module.",https://www.livemint.com/rss/companies
Qualcomm Ventures eyes India startups to build low-cost AI for the world,https://www.livemint.com/companies/news/qualcomm-ventures-eyes-india-startups-to-build-low-cost-ai-for-the-world-11773228613521.html,2026-03-11 20:14:04 IST,"Qualcomm Ventures' new $150 million fund will back founders building lower-cost AI applications, robotics and edge technologies",https://www.livemint.com/rss/companies
Ahead of Market: 10 things that will decide stock market action on Thursday,https://economictimes.indiatimes.com/markets/stocks/news/ahead-of-market-10-things-that-will-decide-stock-market-action-on-thursday/articleshow/129470101.cms,2026-03-11 21:27:26 IST,"Indian stock markets, Sensex and Nifty, experienced a significant downturn on Wednesday. Both indices closed nearly 2% lower. This decline followed a surge in crude oil prices and heightened tensions in West Asia. Foreign fund outflows and selling in major bank stocks also contributed to the market's fall. Investors are now awaiting key inflation data from the US and India.",https://economictimes.indiatimes.com/markets/stocks/rssfeeds/2146843.cms
"Gold, silver rates today: Comex gold drops $87/oz; silver falls $5 as US dollar strengthens",https://www.livemint.com/market/commodities/gold-silver-rates-today-comex-gold-drops-87-oz-silver-falls-5-as-us-dollar-strengthens-11773240285726.html,2026-03-11 21:52:16 IST,"Precious metals fell on 11 March as the US dollar gained, making commodities pricier. Gold futures dropped $80 to $5,012 per ounce, while silver fell $4.67 to $79.64. Rising energy prices and inflation concerns complicate potential Federal Reserve rate cuts amid ongoing Middle East tensions.",https://www.livemint.com/rss/markets
"These mid-cap stocks with ‘Strong Buy’ &amp; ‘Buy’ recos can rally over 25%, according to analysts",https://economictimes.indiatimes.com/markets/stocks/news/these-mid-cap-stocks-with-strong-buy-buy-recos-can-rally-over-25-according-to-analysts/articleshow/129473139.cms,2026-03-11 22:53:13 IST,"When markets come under the kind of pressure they are experiencing these days, the bears don't see fundamentals; it is all about selling. At this point of time, invest only for the long term – and, even then, be ready to see a decline in the value of the stocks you buy for the next couple of weeks at least, if not more. The time frame will depend on when the ongoing hostilities in the Gulf region come to an end. And, more importantly, when normal gas supplies resume.",https://economictimes.indiatimes.com/markets/stocks/rssfeeds/2146843.cms
"Middle East conflict: Get ready for oil to hit $200 a barrel, warns Iran as IRGC strikes Thai vessel in Hormuz Strait",https://www.livemint.com/market/middle-east-conflict-get-ready-for-oil-to-hit-200-a-barrel-warns-iran-as-irgc-strikes-thai-vessel-in-hormuz-strait-11773245173714.html,2026-03-11 22:58:40 IST,"After peaking near $120 on Monday, oil prices have settled around $90, reflecting market hopes for a diplomatic breakthrough and the reopening of the waterway.",https://www.livemint.com/rss/markets
Oil prices jump over 6% despite IEA move to release 400 million barrels of crude amid US-Iran war; Brent back above $90,https://www.livemint.com/market/commodities/oil-prices-jump-over-6-despite-iea-move-to-release-400-million-barrels-of-crude-amid-us-iran-war-brent-back-above-90-11773245115340.html,2026-03-11 22:35:24 IST,"Crude oil prices soared despite the IEA's decision to release 400 million barrels from reserves to combat supply disruptions in the Middle East. Brent futures rose to $93, and WTI to $88.90, highlighting the ongoing volatility in oil markets amid escalating regional conflicts.",https://www.livemint.com/rss/markets
Charles Schwab’s direct crypto offering is coming soon. What to know.,https://www.livemint.com/market/cryptocurrency/charles-schwab-s-direct-crypto-offering-is-coming-soon-what-to-know-11773248417156.html,2026-03-11 22:32:37 IST,The company is forging ahead with plans to allow customers to directly hold Bitcoin and Ethereum even though the “fervor” around digital assets has waned.,https://www.livemint.com/rss/markets
Google Cloud completes $32 billion acquisition of cloud security firm Wiz — Here's what this means,https://www.livemint.com/companies/news/google-cloud-completes-32-billion-acquisition-of-cloud-security-firm-wiz-what-this-means-ai-cybersecurity-multicloud-ai-11773242948860.html,2026-03-11 23:08:37 IST,"Google Cloud has completed acquisition of Wiz, enhancing cloud security capabilities. The deal allows the Alphabet owned unit to leverage Wiz's technology for multicloud cybersecurity. Here's all we know:",https://www.livemint.com/rss/companies
"Trump announces Reliance’s investment in new US refinery, Mukesh Ambani firm stays silent",https://www.livemint.com/companies/news/reliance-industries-america-first-refinery-deal-trump-announcement-skepticism-ambani-11773240098000.html,2026-03-11 22:50:24 IST,"Shares of India’s most valuable company dipped after President Donald Trump touted Reliance Industries’ involvement in a $300 billion US refinery, even as the company declined to confirm its role and experts questioned the deal’s scale.",https://www.livemint.com/rss/companies
Microsoft and retired military chiefs back AI company Anthropic in court fight against Pentagon,https://www.livemint.com/companies/microsoft-and-retired-military-chiefs-back-ai-company-anthropic-in-court-fight-against-pentagon-11773248166748.html,2026-03-11 22:26:06 IST,Microsoft and retired military chiefs back AI company Anthropic in court fight against Pentagon,https://www.livemint.com/rss/companies
